id,text,is_unemployed,lost_job_1mo,job_search,is_hired_1mo,job_offer
1496,I killed it today at work Im proud of myself everyone is telling me not to leave that Im a badass a worker makes me just wanna stay.,0,0,0,0,0
1498,I worked 2-12:30am today lol my GM is gonna kill me.,0,0,0,0,0
1680,I quit my job today I gave my two weeks notice but bitch told me to get her yoshinoya. She didnt ask lol nope bye,1,1,0,0,0
701,Boss wants me to work 40+ hours or more per week.  Im not sure if this is a good thing or a bad thing.  Is someone getting fired?,0,0,0,0,0
2868,My hands dont like to be unemployed they like to work.,unsure,0,0,0,0
4899,I feel pretty badass for not paying any income taxes right now. Im ganna keep this up until I get caught #unemployed,1,0,0,0,0
2263,Looking for a job? Energy Engineer/Resource Efficiency Manager(13005062) at Northrop Grumman (AK) http://t.co/0fdWzVCWvf #green #jobs,0,0,0,0,1
4580,I am  an unemployed father of 5. I am trying to start a small businessbut i need help with start up funds. any suggestions or help please,1,0,1,0,0
1618,i am quitting tv...,0,0,0,0,0
2614,Looking for some inspiration to get off the couch? Here are some quotes to get you fired up! http://t.co/Nv4pyUuWRq,0,0,0,0,0
