id,text,class
3707,After hitting 90 movies each of the last 2 years Id like to thank my unemployment for getting me to 101 this year #HalloweenRules,0
5273,Dont submit then quit. Apply for jobs like Java developer at Cognizant then look for people you might know at the company. You might be able to reach out to HR directly. Ready to apply? Check out the link in our bio.,0
3913,My job hired 60 new people I have yet to see one of them.,0
5088,im currently being terrorized by a mosquito. please send swat team.,0
3820,55% of my department just got laid off.. I lost 4 great employees and the my entire management team. #mixedfeelings #thankfulyetsad,0
4635,Anyone hiring where you actually have to do work??,1
4065,my old manager is trying to tell unemployment that I never called in on October 11th. Please explain this? Also I was fired on October 13th and my paycheck was ready 3 days later. If I stopped showing up why did I get a check so soon? I normally receive DP 🤷‍♀️ @ChipotleTweets https://t.co/JyjxOMGlCR,0
3517,Temp job was just offered. I wanted to take it but too far. Vehicle in shop.lost the battle but will win this war on unemployment,1
804,Currently seeking a position in Event Planning or Marketing. If your company has an opening feel free to message me :),1
955,In my interview today the girl called my name then said what I applied for. I was like assembly wtf I applied for that position? lol,1
3438,Last night I applied for a full-time good-pay position as a haha I wish but nOW I HAVE AN INTERVIEW ON WEDNESDAY???,1
3565,Shift is almost over also I have the chance of possibly getting a new shift hmm wondering should I do it or not. Im think no my boss sucks,0
1219,Interested in Real Estate Careers? A networking event you might attend is 4/11. Register: http://t.co/Ya4Dfnr6S7 http://t.co/48vr4CWO2d,0
845,#jobs #unemployed Traveling PICU RN Registered Nurse: Palm Springs CA - Seeking PICU ... http://t.co/6dQlNgBqdn http://t.co/1Jnuthnk56,1
4498,my bus driver quit today I wonder why???????,0
292,Driving home today saw a motorcycle crew and they cut me off and I let them because Im in the middle of #SOA and got shook,0
5236,Can you recommend anyone for this #job? Store Team Member - https://t.co/WXnjQCrkH8 #Retail #Mesquite TX #Hiring,0
4300,i need a job is anyone hiring??,1
2349,Anybody hiring this summer??,1
3731,I am now a drafting engineer what an opportunity.,0
2898,Today I got to judge a science fair and it was the greatest and I miss my volunteer positions and working with kids,0
2122,Searching for #work in Medina OH? Send your #resume to Northern Ohio Electric. http://t.co/qsR8w4VhxN #gethired,0
4308,Anyone know of places hiring??? I want a 2nd job! Im money hungry.,1
4594,i have sent out 40 job applications and had 3 interviews…how am i still unemployed?,1
1593,Looking for a job? Instructor - Adjunct - Energy Efficiency at Education Corporation of America (... http://t.co/GICorAoj0U #green #jobs,0
4808,This week marked the 1 year anniversary of me being laid off. I still have not found a full time job. Some freelance work next week though.,1
4319,Anyone know places in CLE/Akron that are hiring?!! I am having a hard time finding a job. Please let me know of any,1
4464,If McDonalds say Im hires today. I swear I wouldnt quit this time,1
364,I am also looking for possible work in #branding #uidesign or studio openings.,1
5313,Niggas late to meek mill oooo kill em I was cranking it earlier this week,0
2662,#Anchorage #Job Fairbanks AK Special Education Teacher Position: Anchorage Fairbanks AK Special Education Te... http://t.co/vmVajCIUQz,0
1089,job searching is the worst. please give me money i am just trying to survive capitalism,1
3190,The manager made it clear she doesnt need/want me there after looking at a new job &amp; gave me the option quit or be fired. Why not be nc/ns?,1
604,Someone hired Wanny as an analyst?? #Fox #Why #Stillhavingflashbacks #Bears,0
4793,Shouldve moved up my interview to earlier in the week now i gotta depend on wednesday to determine if i have to stay at this wack ass job if i dont already get fired for not showing up lately...,1
4981,Today is dedicated to all the work I didnt want to do earlier this week.,0
1116,I am searching for a good job but i am not getting it .i am already 29 yrs and i dont know wen i will http://t.co/xeAPAYWQPu #pray #prayer,1
607,Raiders hired Ricky Bobbys best friend as Defensive Coordinator? #shakeandbake,0
5059,Is There Life After Being Laid Off? via @amazonkindle #newprice #careers http://t.co/wjLUzTWV,0
149,I bet I fucc around and get hired by somebody today aha I feel it,1
2908,I dont count me losing my job as a lose... Just lets me know God got somethin for me on the way. I jz need to be positioned,0
4702,does anyone know anywhere hiring?? Im bout to quit my job,1
566,Unemployed pot smoker? Weird. - I Regret Nothing: First Man to Buy Legal Weed in Washington Fired http://t.co/j5zLPcVm9D,0
3538,anyone know anywere hiring? I got laid off this week and gotta find another job asap before i lose my house,1
3209,I am positioning myself so that I can move in the full power of Christ. I am fired up.#boldness #christ,0
4352,Microsoft posted a job you might be interested in. Software Engineer II - Shanghai City China CN via LinkedIn.,0
1912,RT @paulcarr: Whenever I see Greenwald I dont think internatl jounro rockstar so much as recently laid off Ghostbuster http://t.co/r…,0
1978,I recently quit my job to make $9023 from my phone PRESS THE LINK INSIDE BIO to do it too https://t.co/i0V9BWexzO,0
4401,@DineshDSouza I sure wish people would remember she was fired from watergate! http://t.co/P3saPcFmlw,0
2798,I finally got hire at walmart I been working at walgreens for like 3 and a half months. Tomorrow my last day at walgreens,0
2343,Is anywhere hiring?? Someone please tell me of somewhere,1
4070,Boss announced that were looking for another tech support worker. I immediately assume I am getting fired.,0
4946,Who is hiring?? Bcuz I quit my job &amp; yea,1
1152,I wasnt fired I got laid off you wouldnt know the difference,0
2335,anybody know any places hiring??,1
5463,Bad News Rob Ryan Was Fired. Good News Rob Ryan Is Unemployed And Living In New Orleans https://t.co/WkAUVVeQ0F https://t.co/J7lnwBi0sx,0
5083,Ummmm @CMPunk seems to actually have quit and if this isnt a work which it appears not to be then i am quitting supporting @WWE as well,0
371,I am getting no hours at work. Searching for a new job.,1
3432,Today I put an order in. Earlier in the year I put an order in and didnt get anything out of it. Im in a greater position so once again...,0
908,Got hired at best buy mobile last week &amp;amp;amp; today I have an interview with FedEx for a customer service rep position! #needthat,1
2828,Looking for a New Work Wife? 8 Tips for Making Friends at the Office https://t.co/eGt7WRSWyS,0
263,I went driving today and got my lunch and I saw that Dollar Tree is hiring. So Im going to check that out.,1
398,I am Looking for work in fixing #computers or #security #jobs.https://t.co/wCK1SPs6rv#fintech #bitcoin #rimbit #crypto,1
3392,Fired for drinking water? Or for asking not to lift heavy boxes? Visit  https://t.co/NgzCdL2vQg for resources #PregnantAtWork,0
2196,Officially unemployed. Anybody want to give me a job?,1
3476,Unemployment is playing with my life 🙄 I just wanna job already 😩,1
5009,Long Island town fired me for complaining about racist coworkers https://t.co/YeGWAbEAlO https://t.co/vryxjzgDUv,0
4625,Anyone work in the long-term care industry (e.g. nursing homes)? via /r/Entrepreneur http://t.co/nM0Dxrxrwh,0
360,I am Looking for work in fixing #computers or #security #jobs.https://t.co/pI6e6gT3Y5 #resumes #careers https://t.co/ZqDXrZgyGO,1
4326,Anyone likes their job &amp; by any chance are hiring ?? Hook your girl up pls,1
826,.@BillGates  I grabbed and killed a mosquito can I have a job? http://t.co/NDVgqCfWNu,0
4316,Does anyone know whos hiring?!?! I need a different job,1
2364,Does anyone know of any places in Mesa/Gilbert that are hiring right now??? PLZ help a girl out. I need that cash money flow,1
4019,Yes I am currently unemployed. No I am not some bum trying to cheat the system. I was sick and couldnt work now Im trying please be nice,1
358,I am badly searching for a job. I was working for 1.5 yrs but lost it. Plea~ https://t.co/BoFNeiwnjA #pray #prayer https://t.co/Ot9tssGocS,1
5447,I had a squirrel follow me home today and did not have a leash to put on it. Opportunity lost..,0
4309,Anyone know if there job is hiring ??,1
4335,I need a new job anyone hiring?!?!?,1
800,I am looking for a sales job or sales trainer position in Dallas.  Multiple Presidents Club Winner #hireme #salesjobs #careercorner,1
199,Today I ripped off my eyelashes. I lost my car keys. Lost my card and my moms card. I get out of work at 5 but  I have my last class at 5,0
1948,In my past 10 days at my new job my boss has been out for 4 and in late out early for 6 because he can #rolemodels,0
486,Im not even fired from the one I worked at. Cause I never signed my termination papers,0
639,Who hired the violent protesters??,0
5053,@BCDTravel Im looking to return to BCD after being laid off. Any supervisor positions in the works?,1
5357,Amazon posted a job you might be interested in. Technical Account Manager - Beijing City China CN via LinkedIn http://t.co/34zWPHtZuB,0
4314,Any jobs hiring???,1
1968,I recently quit my job to make $9023 from my phone PRESS THE LINK INSIDE BIO to do it too https://t.co/E9a1gJhVqX,0
1469,Today was a prime example as to why I cant go to work sober. Damn near almost lost my job,0
4356,Microsoft posted a job you might be interested in. Software Engineer – Visual Studio Cambridge - Cambridge United Kingdom GB via LinkedI…,0
3666,Looking for a grownup spot to unwind after a long week of work? Fuzion Fridays | $5 Buffet (6-9PM) | Ladies Free... http://t.co/2NdnvPmU,0
1669,I quit filling out a job application on indeed and I got a call from the supervisor today asking me to come in to meet the team lol wtf nah,1
5132,Im excited to see whats to come. I went from employed to laid off to aspiring entrepreneur in just 3 days.,0
2503,Well I was scheduled for a test for that job position but the fire alarm went off.  Been sitting outside for 30mins and the FPD is here,1
1984,Man Im glad time breeze by at my new job.,0
3596,I feel receNtly I would like to go out for full time job somewhere.,1
3468,Yes I Got The Job Im No Longer Unemployed Now I Really Dont Need Nobody All This Is For DaMorra My First Pay Check Going All On Her!!!!,0
2922,UH sucks so bad. Lost my job becuz of funding and now every position I try to apply for cant hire me becuz of funding -_-,1
4815,Hey guys. I was laid off from http://t.co/7N4tnSH0ra yesterday. Please let me know if you know of somewhere hiring.,1
4657,Is anybodys work place hiring???,1
791,Currently unemployed and I am seeking a f/t permanent NYC or Long Island based marketing or event management position. Please respond to …,1
2906,My composition professor lost all my essays. Smh.,0
4328,Anyone looking for a job wanting to drive a tow truck?!?! Get ahold of me kalebs looking to hire someone asap!,0
3101,Im #laid off and #looking for new #job opportunities in the #Chicago area.  Microbiology Molecular Biology scientist.  #recruiter  DM me.,1
4318,anyones job hiring over night????????????????,1
1846,I am looking for GUEST BLOGGERS REALTORS and SMALL BUSINESS OWNERS.  Are you one of these?,0
1060,I am Looking for work in the Oakland California area.https://t.co/GYOhEV0xqG#JobListing #JobOpening #JobTips #Résumé,1
2735,i am trying to figure out where else i would apply to work and it is #tough gang.,1
2963,I now work another desk on campus and the new boss told me in order to work there I need an eclectic taste in music. Hes in for it.,0
2337,Anyone know of anyplace hiring?¿,1
1127,I am seeking evening/weekend job opportunities. If you know of any available I would greatly appreciate it if you could send them my way.,1
2220,INSURANCE ISSUES FIXED. Im now covered by the insurance I paid for. This has been bothering me for so long. Still unemployed but insured!,0
3044,I quit today. Actually I quit this week can it be the weekend??,0
4958,Well I just quit my job... So anyone know anywhere hiring?,1
1100,I am job searching for: Work at home jobs! http://t.co/4tgcXWg6JK — Walker Inklebarger (@Walker_marocliv... http://t.co/WZfdKpUsEG,1
1086,I am actively searching for a new job! Marketing promotions social media and/or sales! #Madison #jobs #hiring,1
1113,So while searching for a job Im going to offer services as structural editor/copywriter/general wordsmith.,1
841,Three Reasons Why You May Be Unemployed In Nigeria  ?  #unilagmusic,0
4686,Now I can apply for and get this job and if I get hired I will do okay in it if I am not abused on a daily basis. I am far from incompetent,1
1633,last resort is to give up searching quit my current pt job and go work ft thru the temp agency....,1
4630,anyone know anywhere that is hiring/ a good place to work? #brokebitch,1
1762,Dude. Being laid off is so awesome...... Someone get me a good construction job,1
3637,Looking for a new job..whos hiring?,1
3259,I fired my Life Coach and hired an Inbox Coach. Look out email!,0
4029,Currently unemployed seeking full-time employment in or near Bakersfield. Message me for resume.,1
1907,I was laid off and couldnt find a job then raised $1M to help people hunt jobs! A real story needs a great writer! You?,0
345,On Friday we learned of a reduction in workforce and now I am searching  for a new opportunity. https://t.co/hfX15on1uo,1
3511,Its 5 am time to start my daily job search and certify for my unemployment benefits. Good look in your job search and interviews! Peace.,1
2129,Searching for #work in Newark NJ? Send your #resume to Horizon Blue Cross Blue Shield of New Jersey. http://t.co/UraFuURHaT #gethired,0
231,I am not feeling work today what so ever.,0
4697,Anyone hiring? Im trying to quit my job doing bodywork....,1
4580,I am  an unemployed father of 5. I am trying to start a small businessbut i need help with start up funds. any suggestions or help please,1
1093,I am not looking for a job I am trying to find a career,1
105,on a brighter note I got hired today so Im stoked n I start tomorrow,0
1790,currently at a swingers club?????,0
764,@renewaldb I might be interested.  Is there a job posting where I can see position description?,1
5285,Now On my way to my first corporate job which I got on my own #blessed . NEVER GIVE UP !,0
960,Get HIRED Today to Work for @LoveNightClubDc were HIRING for Multiple positions Txt 3013436531 for application http://t.co/bJXKRYU5iy,0
4882,My taxes are paying for you to be unemployed?!?! America we have to do better,0
165,My uncle died today then my car gets stolen. Why cant people work for their own shit for real!,0
2934,I went to a job interview and got offered a supervisor position. Look at God,1
3451,Applied to a job a few days ago.then it was reposted as two separate positions.CAN YOU SEND ME A LETTER OF DECLINATION,1
3000,Ive learned more &amp; talked more with my co-workers in 3 days at my new job than I did in 3 weeks at Dicks. extremely grateful &amp; happy.,0
2792,So I got nominated for this thing at work and im like ???? and today the store manager was talking about how well I did and im like ????????,0
5152,I only worked 2 months &amp; already getting laid off,0
912,Today at work I was offered the position as a supervisor it pays good but I cant do 40 hours a week ugh,0
1736,Laid off Friday unemployment office Monday sigh,0
4863,Might be wise to explore another income stream......because eyan le get laid off any fuckn time.,1
3462,Just found out my boss has been shifted to a lower position and starting this week Im getting a new boss o.o That seemed sudden!,0
2158,Searching for #work in Minnetonka MN? Send your #resume to BMW of Minnetonka. http://t.co/f8CMsxol1q #gethired,0
922,Got hired  t best buy mobile last week &amp; today I have an interview with FedEx for a customer service rep position! #needthat#,1
2318,DID MY UNEMPLOYMENT DID MY RESUME NOW I GOTTA FILE MY TAXES AND WAIT FOR Securitas TO HIT ME UP FOR DIS JOB..................,1
2086,Looking for Entry-Level Social Media Work? 5 Tips to Get Hired: http://t.co/L73v5OmQqA via @SocialMediaToday,0
1150,Exactly last month I was laid off. Today I was called and offered 2 jobs on the same day. #Blessed,1
2100,Searching for #work in Auburn MA? Send your #resume to Sears Holdings Corp.. http://t.co/WDUy24xjXX #gethired,0
3569,I recently challenged myself to do something I had never done before. When was the last time you stepped out of your comfort zone?,0
2379,Does anyone know of any place (not a restaurant or fast food joint) hiring part time? Needing semi-constant hours each week.,1
3972,Got hired yesterday (finally) and got another interview next Thursday :) #Options nigga OPTIONS !,1
2372,Anyone looking to work for a great company? The Lowes of Leesburg VA is now hiring. Let me know if you are interested! Hiring 161 people!,0
294,I cant stand my job today!  Whos hiring?  I can try to do about anything! Ugh!,1
2212,And I am now officially unemployed,0
2051,Looking for a New Job? Interested in a Career Change? #CareerCast Has Everything You Need and More! - https://t.co/AooltyNlmL #GetHired,0
4288,Anyone hiring entry level positions in a tech or imaging / photography / arts job? ANYTHING. In Chicago preferably but will relocate.,1
1939,I recently put in mad work and Helped my uncle land a better job. Happy I could do that for my fam.,0
3459,Alright got fired from a volunteer position new low in life whatever still setting milestones.,0
5317,Video I wanted to release earlier this week is still battling against a content ID claim. So releasing another video this afternoon instead!,0
1072,Lost my job 7 years ago and have not been able to get another I am searching for a job but dont have a car to claim as my own. for a job,1
3879,The lady I was hired to take over her job temporarily while she was on maternity leave resigned. I smell an extension of my internship 🤑🤑🤑,0
4446,But no ones hiring and Ive called back everyone and I just want to quit and go sleep for 20 years,1
2358,Anyone know of places hiring?!,1
347,I am always searching for a work out that challenges my https://t.co/XBbVdRm571 that is different… https://t.co/ka3wVjpqEE,0
2411,Yahoo! posted a job you might be interested in. Incident Management Analyst - Buffalo/Niagara New York Area US... http://t.co/WIJ7UoIojs,0
4323,I want a job so bad  whos hiring ???,1
3108,@cressler_nico nah sadly got laid off so I been searching. Woo! How have things been for you?,1
5320,So did @_anisamarie get fired? Because last time I saw her was a month ago.,0
2943,Ive already got an interview call for a paid position! So glad I lost that other job now :),1
1822,Searching for a new job is not easy...,1
5176,My project got killed this weekend and in the process I was laid off meaning that I am available for new opportunities lets talk...,1
1057,My name is sam Working in a hospital I am not satisfied with current job I~ https://t.co/k3mlEM9XyW #pray #prayer https://t.co/qXljsQdCTh,1
697,I am currently watching one of the worst bands Iv ever seen.  Theyre signed and headlining a tour. Someone is fired.,0
3834,Fitch called @ufc hostile work environmentIn fight biz you can get cut for losingIn the real world you can get laid off for any reason.,0
4405,@GULLYKING82 @Enrique9604 @Brickwallblitz shut yo ass up. Coaches get fired cuz of PLAYERS fuck ups,0
4947,Is anyone hiring? Im dead ass about to quit my job,1
674,Currently sitting at the lunch room table considering what my next job should be. Not trying to get fired on a technicality no siree !!,1
1313,You might be tempted to abandon your dog and your family and stay in #Tasmania. Its really quite a place. http://t.co/QQTOOxdWMj #australia,0
5423,Heres everywhere in America you can still get fired for being gay or trans https://t.co/hCRSFVvgte https://t.co/udmtknz8ec,0
344,I am in search of someone that would  like to pick up a few hours (6-12) per week working in our kids zone at Training Ground.  This will i…,0
5545,RT @clarissa: Im a UX designer/developer/strategist looking for a new position preferably to work remotely. Anyone hiring?,1
4106,After almost being fired yesterday becuz I was puking my guts up and had no control over it I am searching for a new job 👋,1
2873,So Ive been unemployed for like 3 hours and I need to work.,1
595,Simply Hired is simply gone: What does this mean in candidate attraction? https://t.co/jWYibWsFt4,0
4651,Live or work in Philly? Study reveals city has 2nd highest tax burden of all cities in the USA: http://t.co/NqVOn08gO9,0
322,I am searching to work for a company/department that develops clean technology. https://t.co/EFVYYkaxPu,1
2964,I finally started watching Workaholics recently. Finished season 1. #getweird,0
1128,Yes I am sending resumes and filing out job applications on Christmas.,1
651,Heres what to say when a hiring manager asks Have you ever been fired? https://t.co/Yk3Br6sekH https://t.co/mpNaQbfCVz,0
4315,Anyone know where is hiring?? #NeedAJob,1
1720,.@Lin_Manuel yay or nay I use the last of my got laid off severance to come see you even tho Im still hella unemployed,0
4549,When you niggas talking about work you niggas unemployed,0
3953,I got hired in a salon..... I start monday bitches,0
392,I am looking for a few businesses to work with.,1
3086,our maid quit like 4 days ago and the worst thing possible happened to me today,0
1207,So you were laid off or fired via Couponing 4 You - So you got laid off or fired today all these ... http://t.co/hr8vFz57nr,0
998,Heres a joke I wrote to explain where all the jobs are:10 developers walk into an interview.They are all hired.,0
3909,I recently hired my first recording studio intern. People often ask meabout the skills it takes… https://t.co/XK0qpVAi5y,0
1288,I am currently working a sale with a real estate agent that does NOT work on the weekend! #whatnottodo #REagent #realtor,0
3493,ok Im done being unemployed I want a job,1
1090,I am seeking a #Marketing position in #NYC. Please share my #LinkedIn profile - http://t.co/at90iZQ9m4  #jobsearch #jobhunt Open to relocate,1
350,I am looking to start or work with a charity that helps foster kids.,1
1634,This job search is wearing me out. Im about ready to give up but to do that apparently I need 3+ years of quitting experience.,1
2575,Has attacking George W. Bush backfired big time for Donald Trump? https://t.co/QPllag2I5T,0
1087,I am searching a job for Graphic Designer,1
5122,I also had an internship and quit it since the time we talked. Im looking  for a new one as we speak.,1
3457,I also applied for a job with apple last night.. Not the same position but HOLY CRAP PICK ME,1
1374,#Unemployed or earning less than before? Looking for #mortgage assistance? #free #mortgage event 11/19 #FL https://t.co/jquLB7SwSu,0
862,FYI I love Psychology...I am just poking fun at my profession technically Im an unemployed nobody.,0
3445,this chick who took the position i applie to stopped showing up so my chances are high.,1
5336,As for me I know that my Redeemer lives And at the last He will take His stand on the earth. Job 19:25 #HELives,0
1094,Today I am searching for a job pretty desperately again need to be busy and getting paid for it...,1
1118,I am job searching for: Work at home jobs! http://t.co/4tgcXWg6JK — Walker Inklebarger (@Walker_marocliv.... http://t.co/Vdm4dkCNzU,1
940,Today I was offered a part time assistant management position at work for another store...,0
2962,So I recently got this SNS  nail polish its great for the type of work I do and I found a new nail salon,0
2356,Does anyone know where theyre hiring?? I need a job because Im a lazy bum and 2014 and idk,1
4338,Anyone hiring? Im in desperate need of a job ... Just got kicked out with nothing.,1
4120,Officially looking for a new job.  Not fired just heard new mandates being handed down.  I do not want to be a part of this organization.,1
4205,@HeartCapricorn: #Capricorn needs to work on not getting so quickly turned off &amp; irritated. True,0
260,On the bright side I got offered a job today so....G T F O,0
2120,Searching for #work in San Francisco CA? Send your #resume to Skyline Recruiting Corporation. http://t.co/h4CgEvXqra #gethired,0
993,Sous Chef opportunities are everywhere. EHS is here to help you be picky. Details here: https://t.co/zgqbL9N1W9 #GetHiredNow #EHSGetHired,0
958,Today my manager pulled me off the sales floor to help out in the Geek Squad. A sign of good faith that Ill get the position? :),0
4556,Anyone know of any places that are hiring right now??,1
2144,Searching for #work in Columbia SC? Send your #resume to Palmetto Baptist Columbia SC. http://t.co/IhFw5nWjEH #gethired,0
363,I am job searching for: Work at home jobs! http://t.co/4tgcXWg6JK — Walker Inklebarger (@Walker_marocliv)... http://t.co/28YdPjRzIA,1
3756,This is where Im at with life right now. #unemployed http://t.co/PCMKpa10Pk,0
4086,Also I didnt get fired they are having a mass layoff so hopefully I can get a better job now.,1
2141,Searching for #work in Newark NJ? Send your #resume to Heesor inc. http://t.co/rgW1qydAOx #gethired,0
1686,3 people quit at the DQ in Morris today and I applied.. if I dont get hired Im giving up all hope,1
3265,Got fired for two hours then rehired. Wtff #NOBITCH I need to start looking for a new job,1
1683,I quit my job today lol Going to start looking for a new job,1
5066,Stagnant?Im a highly skilled white collar worker &amp; I cant even find a damn job after being laid off! A nation of homeless ppl is coming. https://t.co/064d1cMiUq,1
2483,Interested in a #job in #Charlotte North Carolina? This could be a great fit: https://t.co/gmiUfbTT3y #NowHiring #GetHired #Engineering,0
