id,text,class
4707,Anyone know where they are hiring ??! Need a new job I hate mine already I have to patience for my GM !,1
4639,does anyone work at a place thats hiring??,1
853,@ravenbones_ yeaaaahhh tho that was a few weeks ago and im still unemployed.....Its for an ice cream place like 10 minutes away,0
4623,Anyone work at a show place thats hiring and pays more than $8.25??? #NeedThat,1
3279,I was fired because Im trying to get hired somewhere else 😕,1
4317,I need another job. Anyone hiring???,1
3773,You cant just be known as your job or for your job you have to have transferrable skills that you can use elsewhere. -@amandamogul,0
5288,At the part of the new job phase where my head is spinning bc I am starting to be involved but I have no clue whats going on!,0
2325,Ive been unemployed now for about 5 days...I am not about this life #ineedanotherjob,1
4007,Hey everyone- Im once again unemployed. If you know of any opportunities PLEASE contact me asap! It would be greatly appreciated #wompwomp,1
2920,I worked my ass off to get a raise and a better position so I went on a shopping spree with my hard earned money and I feel bad about it ://,0
474,#StandardEquitySale #JustListed on NEWLAND in #HuntingtonBeach #singlefamily w/ $2500 #TMP http://t.co/814l58qhxn,0
4883,I actually dont do either of those things so if we are going to get really technical with it yes i am unemployed,0
4468,I quit my job whos hiring?,1
2820,Looking for an internship or part-time temporary work?? Benton County Health Department is recruiting for a... http://t.co/OJtnUV9kuh,0
3477,Now I have 7 or 8 thousand n student loans with no job&amp; nobody will hire me bc I speak the truth&amp; so many people do dirt behind the scenes.,1
405,#Job #NewJersey Community Director Bergen County Area: NJ-Pine Brook Position Purpose This position will impl... http://t.co/EbNuCzFaeP,0
5167,Just got laid off... am I too late for recruiting? http://t.co/2585gBm2qc,1
2643,Starting a Side Business? Here are 5 Steps to Avoid Getting Fired #entrepreneur #startup https://t.co/IRfWUuRx3v https://t.co/LnnlZnqU2F,0
4704,Anyone hiring?! In need if a second job!! #gainesville #ga,1
5123,Just applied for an internship at the Ottawa County FOTC. Lets hope I get it and can quit searching for an internship.,1
1550,Got this girl a job next door to my office and she was late everyday they fired her this morning 🙄🙄,0
4772,I recently quit my job to bring in $5641 from my phone PRESS THE LINK INSIDE BIO to do it too https://t.co/BKYKp6wuxj,0
100,I may get hired back at Apple again spoke to my buddy who is a store leader over a store and hes considering hiring me back again,1
5508,Im actively searching for a full-time career in CNJ doing #graphic #design. Please let me know if you hear of any positions.,1
1904,@DirtMoverMan @Pleasehireme017 An uncle of mine was laid off by Chrysler a while back &amp; has had problems finding work since then.,0
1949,Recently started job searching again...,1
1918,Any day a #journo gets laid off is a horrible day for the industry.Thoughts go out to those at #FoxSports1 #FS1. https://t.co/KWzfLfJooq,0
2903,Same day call interview and Hire! Thank You Jesus! I will officially have a teaching position this upcoming school year!,0
1946,Recently started my first FT job. Should I be paying more than the minimum on my student loans? - https://t.co/n7fgL3fDFR #taxreturn #taxe…,0
941,right so today I went to apply for a cashier position at this restaurant and it was hella fancy and I had no,1
4539,My Hands Dont Like To Be Unemployed They Like To Work!,1
5403,I helped a guy out that I worked with at my previous job by telling him about an open position at my new employer...he failed the drug test,0
4111,Searching for a second job that wont conflict with my first job and get me fired 😒,1
5396,So in 4 days I lost my job and my apartment. Ive got 19 days to find a place to stay and income. Im fucked.,1
3406,So I applied for a new position earlier this week and not they’re telling us today that the kind of position I applied for is no longer going to be the same and that shit’s on hold AGAIN and I’ll have to re-apply eventually which is cool and nice and fun.,1
4660,Well I just applied for a few jobs to day and I hope I get hired so I can get more money coming so I can afford to have a boyfriend.,1
5039,RT @jonfisher: Hey guys. My position was eliminated today and I got laid off. If you know anyone looking for a designer / project manager…,1
3506,Thomas Pridgen was once asked what the secret to his success was and he said I never worked a day job.And that is why I am unemployed.,0
4805,This week: I had to take Atlas to the Doggy ER for some nasty shit you dont want to hear about. But I also landed another kick ass job!,0
5149,Wait why am I still working I should of been laid off 2 months ago...I guess manager likes me,0
1558,I had a dream I was fired from @KTLA last night so today especially on Thanksgiving I am thankful to have a job!!,0
4324,Anyone in #Fresno know anyone thats hiring??? #ineedanewjob,1
1496,I killed it today at work Im proud of myself everyone is telling me not to leave that Im a badass a worker makes me just wanna stay.,0
4331,Anyone hiring C++ Developers or Linux Admins? Im in the job market :-),1
4568,Anyone know where theyre hiring ?? Lmk,1
3933,Got hired today to work as quality control at a lab. 12 hr shift for 4 days. Lord help me lol.,0
5246,who job hiring? I had to quit chick-fil-a that aint my speed &amp; they was doing corny shit Im cool,1
11,I had one job that I worked my ass off for before and made good money. got laid off now I work two jobs that are bit easier that I match.,0
3529,When unemployed ppl tell someone how to fill out job apps... lol ok,1
1103,I am seeking a new marketing or investor relations job,1
917,I got offered literally 4 positions today.,1
5378,Currently looking for a Director of Basketball Operations or Video Coordinator job within College Basketball. If anyone has any information on colleges/universities looking for one of these positions please let me know.,0
3550,Recently started watching Castle. Its formulaic predictable a bit over-the-top and I love it.,0
1132,I got laid off my job today. If anyone knows someone looking for a social/digital marketer with a can do attitude in the LA area hit me up.,1
644,Has anyone on here hired a Virtual Assistant? Advice???I seriously need a personal assistant at this point and have debated it for awhile for my publicity social media emails castings Production Contact log updates calendar management...#virtualassistant #PersonalBranding,0
3654,Looking for real leadership in a virtual age? EWTN President and COO Doug Keck discusses the long standing... http://t.co/LfeZTd8ERX,0
1037,I am resigning from cell tower work and would like to book some audio recording/hired gun drumming. Please let me... http://t.co/X1FH7ZVwKZ,1
3119,@laidoffleftout I am also one who is laid off from the construction industry and got a better education who still cant find work. #renewui,1
4327,Anyone know any jobs that are hiring ??,1
4477,Yaaaaas quit my job today and got hired at another 👌👏🙌💯,0
5536,Here is a wonderful opportunity for a full-time Administrative position in Banking and Finance! #jobs #greenemployers http://t.co/16BeeVGQmt,0
4137,We are seeking a social media expert/writer who is fired up about libraries archives and museums. Join us! http://t.co/rV097IQ3zr,0
1143,Got laid off yesterday. Non stop job hunting today. -_-,1
4113,Acquired a new doctor (PCP) last Wed &amp; today I used the famous words uttered by Donald Trump Youre FIRED! Search for a new Dr continues.,0
4705,Anyone know of places that are hiring?????? #needjob,1
2951,My new boss is the nicest guy. Actually looking forward to start working,0
1613,I am looking for a buyer on 815 Mesquite Dr Magnolia TX. (http://t.co/6gBeEGpwzX) http://t.co/mu4HHrr97A,0
977,If youre a hard worker and interested in making real money as a delivery driver hmu and Ill get you hired,0
1605,Looking for a new career? Rain Bird has the right environment for a thriving career. Sr. Tooling Engineer #Tucson AZ #job #hiring #career https://t.co/k9hK5oTSM4 #Engineer #Extrusion #Plastics #CareerArc,0
1584,Looking for a job a new career or more job satisfaction? 51 #Career &amp; #Job Affirmations. https://t.co/8hR97kCZPj#hr,0
4738,I got fired from my old job and got another job a week later karma nigga. KARMA,0
3626,Looking for a #career change? Dealertrack is #hiring a Director of Inside Sales. #Jobs https://t.co/kV9L4dHCFN #job,0
1114,I am job searching for: Work at home jobs! http://t.co/4tgcXWg6JK — Walker Inklebarger (@Walker_marocliv.... http://t.co/2Krzj9OxCV,1
5244,Any of yall niggas hiring ? Im quitting my job,1
918,I got offered a full time position doubt telecom today out of nowhere didnt even apply for it. School first tho,0
4527,Life is a lot better when I have work to do. Unemployment = way more things to worry about and way more time to worry about them.,0
5,I was laid off from my last job a year ago tomorrow. It was surprising and scary. Im forever grateful to those that took the time,0
4312,Anyone know any jobs that are hiring??,1
2496,I applied for a position with @SJMjobs yesterday evening. #Motivated #JobSearch,1
2288,Looking for a Spring semester Work-Study job?  Purdue School of Nursing has a Clerical Assistant position to scan files to archive make copies make student IDs file cover phones type and other clerical tasks. https://t.co/zEDTdoCG8I,0
2397,Okay who knows of any place that is hiring right now!!!!!!,1
3959,finally I got hired! thank god after I move its gonna be 5-10mins away.,0
387,I am looking for a part time tax contractor.  This person should have the flexibility to work from home or go into the office as needed.  H…,0
910,I applied for a job position and surprisingly I got a call back today ya girl is making moves,1
3745,Anyone have any need of an artist? Im broke broke broke still out of work and unemployment has yet to pay me a single dime. I need help.,1
959,Got offered the position I interviewed for yesterday \o/ Howeverthe offered rate was a bit lower than I wantedand below the min. in the ad,1
2377,Who hiring ??,1
3611,These people at my new job are hilarious singing loud as hell lol,0
2732,I have to work on Christmas AND my Rod Stewart Christmas cd is nowhere to be found. Therefore I am converting to Judaism.,0
4771,The only other employees at my new job are 3 Jamaican women. Beginning to think I was a diversity hire,0
43,Ill check this out within the coming days because Ive been terminated laid off and or locked out from my previous job. Thank you benefits,1
1322,Here is 19 Billion Reasons why you should quit your job and start  an app company! http://t.co/VmuKA4wPjX,0
2398,Does anyone know anywhere in denton thats hiring? Help a sista move out!,1
3503,Minimum wage is now 10.10?!! Now I just need a job for the summer...,1
4681,Now Im not gonna get hired.,1
3873,They had me heated today boooaaay ..Sams done hired the wrong nigga cuss I spazzed ! Managers members and anybody in my way caught fire,0
2346,Does anyone know of any place hiring? http://t.co/4ggPlrcnNp #reddit,1
4058,I am an unemployed veteran simply looking for a chance.  I have an MBA and Med.  Anyone know of any opps. in Houston? #hr #jobs,1
418,5 Trades acquired &amp; sold from equity deals in first 60 days. Let #DealActivator work for you. Find out more here: http://t.co/M1DytRjQZw,0
4272,Currently at work looking for new jobs so I can quit my gas station job.,1
5157,If only been laid off for 2 days are i have a potential job lined up. I must be lucky or something.,1
38,Suuurrrrrree I couldnt get laid off 3 weeks ago BEFORE I bought my new car. #unemployed #hireme #job #FML,0
261,2 times today I get emailed about 2 jobs I applied for earlier this morning that were already filled. Unreal.,1
3041,I think Im quitting my job today Im bouta go job hunting after class,1
4573,I still have not found a full time job. I havent been unemployed this long in my life ever. http://t.co/gq9jps2yiK,1
5085,I am sitting on the deck in October and mosquitoes are biting me. WTF???,0
4687,Anyone hiring in social media media or marketing? Drop me a line: http://t.co/WAVTSZTbjt #SocialMedia #Media #Jobs,1
1172,30 people were laid off today at my place of employment. To say today wasnt tough is an understatement,0
1957,I been at my new job for less than 2 months  one of the girls I work with paid for everything I did this weekend . A blessing ok,0
3574,I recently started praying again  and Ive been doing better ever since,0
402,I am Looking for work in fixing #computers or #security #jobs.https://t.co/qDiujyCA9J#Oakland #Bayarea Please Repost,1
4342,Anyone in Rochester know of any places that are hiring ?? #rochester #hiring #job #money !!!,1
2363,Whos hiring ????,1
4558,Needing a second job (preferably retail) anybody hiring?,1
1705,Jared says: I am laid off for two weeks n I filed a claim for unemployment when I went to certify I answer... http://t.co/w253Vh9jMQ,0
3907,I just got hired at my new job congratulations. I plan on buying my own firearm to carry around.,0
3158,I was laid off from my first post grad school job 6 years ago today.,0
696,So for the first time in 30 years...I got fired today.  I am looking for work or marketing work but let me know... https://t.co/99ZRjqBdJQ,1
602,me: are you hiring? employer: yesme: **submits resume**........me: *calls back a couple of days later*employer: sorry we just hired some new people ..BITCH WTF,1
3505,ok got another 8 job applications out now i am tuckered out and time to veg at tv for a bit,1
1101,I am on the search for a second job.,1
4944,Wow. Worst day ever at work so far.. I think imma quit. I cant take it anymore. Anyone know a good place to work that is hiring? :),1
19,Being laid off sucks but it was more like jumping ship knowing it was about to sink lol. Yeah I will be fine. It is easy to lose a job.,0
4701,anyone know of places that are hiring? ya girl needs a job,1
4311,I need a job  anyones work hiring ???,1
3722,The last quarter in which I worked full time at a reasonable wage (Oct-Dec) is not counted towards my unemployment benefits!,0
3178,need to find a job lmao lets see how long it takes before I am fired.,1
1853,@Adam_Ganz I have started the search for a new position. Are you in the Seattle area?,1
3541,Got laid off today.  :(  Will rest this July 4th weekend and then start looking next Tuesday.  Anyone wants to hire me?,1
4554,OK #Nashville - I have a 19 year old with brains and muscles (my son) who needs a job. Anyone hiring or know of an opportunity?,1
4067,I obtain job soon after I forced to quit or fired Bullied 24-7 for no reason ongoing harass by Mr Falk SD Governor Atty G,0
1632,If I don’t find an internship for next semester I am not finishing grad school. Like I’m quitting. I give up.,1
3638,Looking for a new #job in #Kentucky? Subscribe to #JobAlerts! http://t.co/nlyggAo5xX,0
5300,What an experience: earlier this week I was in Cuba and now I am in Miami hearing about Castros death.,0
5268,Does anyone know of any places hiring in Liberty? Ive got to find another job so I can quit WOF!,1
806,Currently researching HR/Labor positions in the Ocean County NJ area however am willing to travel or relocate. Have 2.8 years experience…,1
5424,Here Are The 32 States Where You Can Be Fired For Being LGBT http://t.co/bJnqS896TX,0
3250,Salty i got fired today lol Ill have a job bye tomorrow tho aint tripping,1
676,I am currently done with both tee tee and crystal...yall both fired.,0
4708,Does anyone know any place hiring? Please my store I work at is getting shut down and I will be jobless,1
1122,I am searching jobs in New Jersey on http://www.employmentladdercom,1
3322,So does Rutgers actually do employment background checks or do they just hire whoever?! And the persons hiring should be fired too!!!,0
5270,RT @RunningCrazy1: Quit blaming each other and fix the fucking problem!-what I just said in this meeting.-oops-anyone hiring?,1
1588,Looking for a FULL time job or looking to stay competitive in a tough job market? FREE Career workshop http://t.co/aGmP7fhpy1,0
4631,With that being said anyone hiring? I can basically do anything and can work like 5 am-2pm every day because I go to work at 3. Hit me up,1
5168,Unfortunely I was laid off today I am actively looking for other employment However an... http://t.co/RcgHPnyYL8,1
1962,Ive now spent my night scrolling through about 800 job listings applied for about 20 or so. #Fingerscrossed for new life in my #jobhunt.,1
3892,Not gonna lie if I get hired at this new job Im gonna miss my coworkers at McDonalds well some of them.,1
1111,I am Looking for work in fixing computers or security jobs.https://t.co/HsApvrA7Se#fintech #bitcoin #rimbit #crypto,1
3372,Luck: The Difference Between Hired or Fired http://t.co/kqxaSLfWNF #luck,0
618,Looking to Hire or Be Hired? Turn to #SocialMedia | http://t.co/oKeJPIZ9iz,0
4103,I havent been to my work &amp; learn in at least 2 months how have I not been fired,0
3194,I needa find a new job .-. I get bored af home. Why did I have to get fired -.-,1
4143,Unemployed? The Social Web App offers a better way to search for social media jobs. http://t.co/p2cUeub9bH #job #jobs,0
5303,Earlier this week: Master P Divorce -- My Husbands Filthy Rich -- And Im On Welfare http://t.co/nRAXjQOrJE,0
1023,Currently applying to jobs. Therefore my Twitter is now going private until Im hired.,1
2316,I will never understand unemployed people cause Ive NEVER been without a job.,0
2841,I smoke everyday at all time bc I work my ass off and I can afford it. It would be bad if I was smoking errday but was a lazy unemployed guy,0
4231,My bank account cannot currently keep up with the lifestyle that I want to obtain. Therefore this makes me quite upset.,0
5370,RT @olivierlacan: Firing People https://t.co/WPZazjnjawThe best thing I’ve ever read about getting fired or laid off.,0
4459,I worked a 12 hr shift damn near 🙄😐 and 3 people quit today.. they over working me man.. who hiring?,1
2381,Anyone know a good website for resumes or someone know how to edit one??,1
2191,Today I became unemployed.   Please visit http://t.co/zH0tVlyhdv and let me know how I can help your company,1
1078,(IN) I quit my advertising job because i lacked the passion for it. I am searching for a job that i am passionate about but im running out…,1
4934,haha i have a management position full-time and i still cant afford a basic fucking place to live funny joke,0
5231,Anyone know any places that are hiring bc im really close to quitting and walking out,1
1640,I wish I didnt have to search so hard for a new job all I want to do is quit. Just thinking about work in the morning gives me anxiety...,1
4489,Im about to quit so whos job is hiring ?,1
4350,Microsoft posted a job you might be interested in. Tech Solutions Prof DYN - United States US via LinkedIn.,0
3598,Two more shifts at my old job. New job starts Monday. OMIGAW EXCITE!,0
4439,Hired a Mommys Helper to run errands w me tomorrow bc I am a total sellout &amp; quitter.,0
4325,Who has a dope job and is hiring????,1
2334,anyones job hiring?? seriously done w crappy Main Event,1
3202,I got fired for organizing a union with my coworkers and it has been extremely difficult for us to find work. It’s not a good time to look for work https://t.co/FCCuyrYJV8,1
1649,But people ask me I cant believe you quit your job to find a new one lol you know how hard it is to job search when you work office hours,1
1077,I seriously have pages and pages of Job Openings I want to apply for but I am addicted to Internet Job Searching &amp; avoiding the applications,1
4632,Anyone hiring that pays $10 an hour that I can work evenings??,1
2800,I got paid today and have yet to go pick my check up from work lol...,0
4119,I am applying for every fellowship I can find in 2018. I am so fired up to learn and share knowledge! My brain is ready to expand.,1
5155,I got sick &amp; hospitalized w/ no insurance got laid off. am recovering still on the road to recovery while job hunting AGAIN @BarackObama,1
4250,My laptop will not work and the light in my room just broke.. So I quit today.,0
1709,Mr. TrumpI would like to know what you will do about unemployment. Laid off Aug 2015 still no job. No unemployment could loose home.,1
4781,Earlier this week Calvin Johnson mentions retirement. Later in the week pats head of scouting rumored to take GM job in Detroit@scottzolak,0
4956,Anybody hiring in Mesquite? I need a second job...,1
3063,So I quit my job today. Does anybody know if Office Depot is looking for animators?,1
84,Got hired at a bank life is good,0
3154,@E_Megas I am looking for freelance gigs. I was laid off a steady 3 year gig. This is the longest Ive been out of work.,1
4372,#SSM #GayMarriage Gay music director says he was fired from Catholic church job after same-s... https://t.co/4xnSEyPFbL #SameSexMarriage,0
1740,@crookedhooligan Im so sorry autumn :/ if I didnt just get laid off I would in a sec. When unemployment kicks in I will. Thoughts w/ you🙏🏼,0
4922,Got offered assistant manager position at Dollar Tree for 9.50/hr. However I still work as a waitress and make good money. What to do?,1
375,I am Looking for work in fixing #computers or #security #jobs.https://t.co/EpoV7VU12t #resumes #careers https://t.co/Il2jXZ2teZ,1
3883,So I had a job interview today and sadly I wont know if Im hired for 1-3 weeks. Then my second interview is pushed off till end of week.,1
1803,I am searching for an SR Vice President of Customer Service for L.A. based ecommerce company with world class experience and skills.,0
1182,Yesterday my employer laid off 10 people. Coming in today felt like heading to a funeral.,0
1551,Fired? Heres how to answer the #jobinterview question: why did you leave by @ChesRes https://t.co/Ec1n6xsOek,0
5060,Got Laid off? Out of options? Think again We have your plan B... and it works like CRAZY.. http://t.co/eH9wccb4,0
2849,i realize i actually did not miss working much because my legs ache and did not ache one single day I was unemployed,0
3122,I was laid off from my job April 7. Seeking editing job. Appreciate all leads. View my LinkedIn profile: http://t.co/ogRrXD1eNZ,1
1187,A year ago today I got laid off from Cheez. Yay?,0
5119,How Can I Quit a New First Job? https://t.co/gIiZu1vJzo #quitting-a-job#resigning #resigning-a-job #job-search #job-hunting,0
953,I applied for a position got sent a confirmation email then got a rejection one 3 minutes later lmao no bullshit here at least,1
1208,Yesterday I was laid off. Today I played with my kiddo talked with a TON of people am sprucing up my resume coffee meeting at 2. #islay,1
1292,Quitting is easy &amp; #success is hard. You will never be a success if you always quit. Here is an #opportunity for you. http://t.co/UzU6jjeR84,0
5098,I am seeking an advocate -attorney who represent tenants rights regarding housing matters. It Is quite evident the landlord is retaliating,0
370,I am looking for full-time work (and am willing to relocate!) if anyone knows of anyone hiring.,1
4872,Baby Im a boss and your man unemployed,0
4160,@itsjustme_adt24 #nowork #unemployed #cantspell #hashtag,0
1209,how uu think i got uu somebody got laid off,0
4744,I GOT A NEW JOB THAT STARTS IN A MONTH JUST INCASE I GET FIRED FROM MY CURRENT JOB BEFORE THAT.,0
3488,Am I an unemployed journalist because when applying for jobs I think its funny to misspell fact check &amp; copy edit,1
4306,Anyone know about any restaurants that are hiring or non food jobs??,1
914,Got hired  at best by mobile last week &amp;amp; today I have an interview with FedEx for a customer service rep position! #needthat@,1
2365,Does anyone know any places hiring .....,1
4049,I am not unemployed.,0
2391,Anyone hiring foodmonsters in NY? plz hire me full time I swear Ill try my hardest to leave you a pizza slice...,1
4692,Anyones job hiring????,1
3232,need to find a way to get a certain someone fired from work this will be a challenge but i will find a way.,0
21,One of my parents friends just got laid off today... I know I complain a lot but Im so grateful for the job I have. Even tho it part time,0
390,I am Looking for work in fixing #computers or #security #jobs.https://t.co/yIniDqgefP #resumes https://t.co/AfjLPoEMsC,1
3135,#esurancesave30 Since I just got laid off and not sure how long it will take me to find a new day job.,1
2375,Who job hiring ??,1
5307,Earlier this week I got a UPS notice but wasnt sure what for. Now I know. Thanks @getzubits! I have… https://t.co/NDPTPjAQr4,0
1840,Searching for a new job. My expertise are HRM Admin Intelligence services and Tele Communications.,1
5527,Recently laid off? 5 key things to remember http://t.co/Alv605dwq3  #jobtips #jobless #laidoff,0
2115,Searching for #work in Durham NC? Send your #resume to Department of Veterans Affairs. http://t.co/l6ViPbYGEY #gethired,0
2722,#Job #Manhattan Retail sales position (Midtown East): High end tennis shop in mid-town Manhattan needs an expe... http://t.co/nfsCk46kGR,0
227,Well today fucking sucks and I lost money snow plowing... How does that work?,0
3042,Almost quit my job today cause they didnt want to pay me..,0
4343,Anyone seeking employment? Try the Diversity Job Fair April 5 2016.  https://t.co/gaAzw2OnSl #diversity #equity https://t.co/PhN7Jp2vcc,0
4942,Yo anyone hiring college students? Somebody help me man I really want to quit the one I got now but I need money.,1
2357,Does anyone know any places hiring? #needajob,1
1711,Things I am learning today: Unemployment claims are filed in the state you worked last year not in the state where you were laid off,0
1826,I still search for that one employer who doesnt see me as a risk because I would really love a bit more financial security...,1
