id,text,is_unemployed,lost_job_1mo,job_search,is_hired_1mo,job_offer
4,GOT LAID OFF FROM MY JOB 2 WEEKS AGO AND I WAS KINDA SAD but thank god bc now Im doing photo work for Drais beach club,0,1,0,1,0
26,officially starting may 11 at my new job wooooooo. i got laid off early feb and this new job seems like a step up in a lot of ways.,0,0,0,1,0
32,After 4 months of unemployment (being laid off sucks) I was going to celebrate 1 week of my new job by buying myself a ticket to see @OldDominion @TheBigEFair since I haven’t see them since last September at Foxwoods. Just went to the website and the show is sold out!  :( 😭,0,0,0,1,0
35,I got laid off two weeks ago now I got another job # All can do is thank God,0,1,0,1,0
39,Start my new job 6/30. Havent worked in an office in 6 yrs. Laid off 2 yrs ago...and worked from home the 4 yrs prior.,0,0,0,1,0
41,Bad news: laid off from my recreation position. Good news: I was offered another job at the same building. Less hours but its a job.,0,1,0,1,0
64,Crazy how I got laid off just last week &amp; got a new job already,0,1,0,1,0
80,I got hired as a camp counselor for short term teaching chorus and adventure time at Camp Waldemar!!!! Today is good. God is good.,0,0,0,1,0
81,Got hired and unhired because I tested positive good morning,1,1,0,1,0
82,I got hired at 2 places.. God is so good yall,0,0,0,1,0
84,Got hired at a bank life is good,0,0,0,1,0
86,I got hired to cook fathers day dinner tomorrow...cuz Im nice in the kitchen.,0,0,0,1,0
87,Went job hunting today and the 1st place I went was boca tanning I got hired on the spot without even filling out an application☺️ #yayme,0,0,0,1,0
89,Got hired in as a full time custodian today at a college. #IFeelHappy,0,0,0,1,0
91,liz &amp; i got hired at 2 diff places today &amp; were like ok let me use ur discount &amp; u can use mine ok ?,0,0,0,1,0
92,Got hired on the spot. God is so good to me,0,0,0,1,0
93,Today I got proletariatainized... Got hired on permanently at a company.,0,0,0,1,0
94,I got hired for 2 jobs today knowing damn well I dont like to work....idk which one Ima take,0,0,0,1,0
95,Walked into polo to shop but instead I got hired again when I wasnt planning on applying today #idiot,0,0,0,1,0
96,I got hired at Chulas today...,0,0,0,1,0
97,I just got hired and today is my first day and I already really dont wanna go to work,0,0,0,1,0
98,Got hired on the spot &amp; some random guy took the dent out my car for $20..today a good ass day lol,0,0,0,1,0
99,I got hired 4 Jamba Juice God is Good,0,0,0,1,0
101,I got hired at Safeway today (*^o^*),0,0,0,1,0
102,Got hired as a music sales rep today so entirely expect my life to get much more Mad Men-y,0,0,0,1,0
103,I had a job interview today baby and i got hired start work in the morning @DVP387,0,0,0,1,0
104,I JUST GOT HIRED ON THE SPOT AND I ALREADY LOVE MY BOSS HES SO NICE OMG I LOVE STARBUCKS,0,0,0,1,0
105,on a brighter note I got hired today so Im stoked n I start tomorrow,0,0,0,1,0
107,So I got hired @ this financial service place &amp; I already quit today.,1,1,0,1,0
108,Hey guys I just got hired at starbucks,0,0,0,1,0
109,I got hired on at 8.50,0,0,0,1,0
110,Yesterday I applied everywhere within view saw the worlds end slept for 3 hours got ready for an interview hired on the spot.,0,0,0,1,0
111,Ya girl got hired to cocktail and possibly bartend at one of the busiest bars in town will I finally be out of debt?? Well see,0,0,0,1,0
114,lost my job today which sucks but a friend hired me right away to watch her twins starting tomorrow. So tomorrow is a beach day!,1,1,0,1,0
115,Lost my job yesterday. Jus got hired again LOLLL,0,1,0,1,0
120,Quit my job last Monday and got rehired again today. Woo! So long unemployment,0,1,0,1,0
123,Today I was rehired for my job! :),0,0,0,1,0
125,Quit my crap job yesterday today I got hired at a restaurant opening in March. #favor,0,1,0,1,0
128,Craziest thing happened to me today..i lost my job..then got hired by another one an hour later..pure awesomeness,0,1,0,1,0
132,Today I was hired back into the food business. Yay. Aug 2 cant come fast enough. I just wanna teach my 5th grade hooligans,0,0,0,1,0
133,good news: I made $20 busking today. bad news: novelty store that hired me part-time unhired me before I started to hire back old employee.,1,1,0,1,0
134,whats funny is the job i had today wasnt even mine the guy didnt show up at all i just took over &amp; the designer hired me #blessed💃🏽,0,0,0,1,0
138,Another job called me and I am hired I aint get to call them back yet,0,0,0,1,0
144,My job fired me and just hired me back wtf is my life 😩😂,0,1,0,1,0
148,I didnt get fired but I just got hired.,0,0,0,1,0
164,I came to dance and literally got hired to work here lol my first day is today Im FR LIT 🙌🏻,0,0,0,1,0
166,Got interviewed and hired and worked all in the same day. #EMPLOYED,0,0,0,1,0
183,Came to a call center today to apply and I got in! Training for 2 week at over 9$hr &amp; after 45 days of working it goes up to 10$! 😍😃😁🙏,0,0,0,1,0
185,Its a good day working at Chipotle is awesome and I just got hired at Jamba,0,0,0,1,0
188,Work was amazing today put in 12 hours and got 3 leases today on my 3rd day!!,0,0,0,1,0
190,i got hired on the spot by Mister E...or just E the finance guy who worked at HYundai Mazda and @HarrelsonNissan ask tre about E,0,0,0,1,0
241,Got hired for a new job today. Pays $4 more than my current job full time + benefits. Moving up in the world!,0,0,0,1,0
245,got hired to be tutor in my summer statistics class even though I know as much about statistics as the guy Im tutoring,0,0,0,1,0
250,Orientation Day. Been waiting for this day since I got the Yes your Hired #BCH here I come 💁🏨,0,0,0,1,0
252,I GOT HIRED MOFUCKA!,0,0,0,1,0
253,Got hired today by just luck. Rewarding my week of sobriety by celebrating being employed again. http://t.co/Qlm6pfvEDV,0,0,0,1,0
254,i think i just got a job??? meemployed????????,1,0,0,1,0
256,Where at in beachwood? I just got hired out there too. @LoveMee_Lyn,0,0,0,1,0
257,Got hired and fired in the same day😐,1,1,0,1,0
259,I need these 11s  a physical  and my food handlers permit 😂😂 I know my mama glad I got hired some where,0,0,0,1,0
269,Got a job at @CottonOn today! Was hired right on the spot! A very good day! Really made me feel good since the start of the week was bad,0,0,0,1,0
271,My hired day was yesterday Walmart finally called me in for orientation thank god 🙌🏾👏🏾🙏🏾,0,0,0,1,0
283,I got hired a week ago but I havent started yet like what gives,0,0,0,1,0
286,I got hired at riverdale last night tho .. O.o too bad Im not gonna work there LoLoL,0,0,0,1,0
287,I went to the new hire session yesterday to sign my contract..,0,0,0,1,0
288,I JUST GOT HIRED TO BE A WAITER AT BUNKER HILL BAR AND GRILL WHICH IS A NEW RESTAURANT OPENING UP AT THE MALL HOLY FUCK IM SO HAPPY😫🙏,0,0,0,1,0
291,OMG I GOT HIRED @ A&amp;F. #Happiness #Menlo,0,0,0,1,0
293,Got hired right after I interviewed,0,0,0,1,0
296,Got hired at my favorite Cannibus Club Dispensary they said I come in there so much to buy edibles and weed lol,0,0,0,1,0
298,Main manager hired me back 5 mins later,0,0,0,1,0
491,First day at my big girl job complete. Didnt get fired. Id say Im off to a good start.,0,0,0,1,0
493,Well I didnt get fired on my first day at my new big girl job so thats something I can be proud of for fifteen minutes.,0,0,0,1,0
511,Saw my first check from my new job today &amp; I never been happier that I got fired from my last job God is good,0,0,0,1,0
518,Yea Im happy I got a new job. This white lady at my old job wouldve been hype this morning if I went in. I wouldve gotten fired today.,0,0,0,1,0
591,Did anyone else get hired at the mall for seasonal???,0,0,0,1,0
601,Who calls somebody this late at night to tell them theyre hired!?!,0,0,0,1,0
641,Just got hired to clean another store at water side shops named Panerai boutique .. Does anyone know what kind store is that ?,0,0,0,1,0
903,Today was a good day! Found out I got the position I wanted &amp; some woman randomly gave me a $5 tip,0,0,0,1,0
904,Today was a pretty good day. Found out I got the position I wanted &amp; some woman randomly gsve me a $5 tip,0,0,0,1,0
906,Got offered a full time position at work which I took! Got a car yesterday &amp; if someone moves out before the 17th I will have my own place!,0,0,0,1,0
907,Got hired at best buy mobile last week &amp;amp;amp;amp; today I have an interview with FedEx for a customer service rep position! #needthat,0,0,1,1,0
908,Got hired at best buy mobile last week &amp;amp;amp; today I have an interview with FedEx for a customer service rep position! #needthat,0,0,1,1,0
914,Got hired  at best by mobile last week &amp;amp; today I have an interview with FedEx for a customer service rep position! #needthat@,0,0,1,1,0
915,Got hired at best buy mobile last week &amp;amp; today I have an interview with FedEx for a customer service rep position! #needthat,0,0,1,1,0
919,Got hired  t best buy mobile last week &amp; today I have an interview with FedEx for a customer service rep position! #needthat-,0,0,1,1,0
920,today I got offered an Assistant Manager position at Finish Line! :)))))))))),0,0,0,1,0
921,Last week I got hired as the Scenic Designer of an awesome play! Today I was offered the Art Director position for a TV show! So thrilled!!!,0,0,0,1,0
922,Got hired  t best buy mobile last week &amp; today I have an interview with FedEx for a customer service rep position! #needthat#,0,0,1,1,0
923,i got an email congratulating me for getting a student position but I havent been told by anybody that Ive been hired??,0,0,0,1,0
924,Got a interview at Costco for a position there on Tuesday hope I get this one as well....just got hired at the school district,0,0,1,1,0
925,I got a salaried position yesterday as a Marketing Consultant. #Sohappy,0,0,0,1,0
927,Got hired to be a music reviewer again next semester but idk if I should take the position or not? Hmm.. decisions decisions.,0,0,0,1,0
928,Yesterday I got hired for a teaching position in the fall! Thankful for how God opens doors and provides!,0,0,0,1,0
929,I got the pharm. tech position on the spot. I got the email to start my job at the hospital on the 3rd today I got a large check for my car,0,0,0,1,0
931,today I got hired on to a new position that Im not even qualified for with a higher pay than I ever wouldve expected.... Im in awe ❤,0,0,0,1,0
935,I got offered a position today yall...WHOOP!!!!!!!!!!!!!!!!!!!!!!!!!!!!!!!!!!!,0,0,0,1,0
936,Today I got a paid summer lab position bought a suit got to see my family from CT and got a new car!!! Its been a damn good day.,0,0,0,1,0
937,Damn I got interviewed first and a girl was getting interviewed after me for the same position but I got hired on the spot hahaha,0,0,0,1,0
938,Well got hired for a new position here in the admissions office as a fellow. Hopefully it can help transition into a full time counselor,0,0,0,1,0
943,@Mayhaaa thanks for letting us know about Ms. Little and that job position. i got hired today :),0,0,0,1,0
944,So today I got a new job and at the end of the day they fired the guy who interviewed me and gave me his position + desk. #BallerShit,0,0,0,1,0
950,Job hunting with @Pshwazzy today step brothers style went well. Got hired on the spot and offered management positions. life,0,0,0,1,0
952,I got hired for the position I wanted.,0,0,0,1,0
961,I went in American Eagle and filled out for a seasonal position less than an hour ago &amp; they just called &amp; ask me to work tomorrow,0,0,1,1,0
965,I have a class in 2 hours and then I can come back home and sleep...NOT! and I have to train for a position I got hired for ugh!,0,0,0,1,0
1024,The woman who hired me has not called in 5 days and is not answering when I call. I called like 7 times throughout the day yesterday.,0,0,0,1,0
1025,Man I am not a morning person at all and I where I just got hired I have like four shifts at 7 and 8AM! I asked for day shifts tf!,0,0,0,1,0
1028,ok so i got hired for 2 jobs now. one bakery another a coffee shop the fam says do both. I gotta go into one today at 2,0,0,0,1,0
1031,As of June 8th no longer unemployed... just got hired as a data analyst / programmer at Cigna in Bloomfield...,0,0,0,1,0
1039,Just got hired on the spot full time factory job awesome shift very laid back. I am happy 😋😋😋,0,0,0,1,0
1045,Shit I just got hired at ANOTHER job plus I go to school.. Life is hard,0,0,0,1,0
1126,I am getting a job as a trader on Wall Street and buying a house in New Jersey. Also I have found Jesus.,0,0,0,1,0
1133,So I got laid off from toys r us yesterday and hired at chipotle today. #TYBG  🙏🙏🙏,0,1,0,1,0
1168,Got laid off and rehired by the same people as full time 1-2 weeks later..,0,0,0,1,0
1185,2 weeks ago I got laid off 2 weeks later I got 2 jobs paying more than the one that laid me off! 😁😳,0,1,0,1,0
1188,Good news bad news time. Bad news I got laid off from one of my jobs. Good news just got a  position at one of the 8+ Gamestops near me,0,1,0,1,0
1538,Yesterday I got a job and today I got a call from them and I was like oh no this is where they found my Twitter and tell me I’m fired but false alarm it’s all good.,0,0,0,1,0
1549,2nd week on the job and I may have already gotten someone fired I mean freed up ones future. Being fired is an opportunity. Your welcome.,0,0,0,1,0
1563,This morning I got a call from Walmart thats my 4th job offer this week I had to tell them I was no longer... https://t.co/Y9qMRo1BM4,0,0,0,1,0
1665,Just got hired and Im finna quit real quick,0,0,0,1,0
1666,Got fired got hired and quit a job all in the same day 😂 aint that some SHITTT,1,1,0,1,0
1675,I just got hired in today and im already thinking of quitting by the end of the year....smh,0,0,0,1,0
1678,just got hired at Cal sun 2 weeks ago and I already am quitting LOL,0,0,0,1,0
1679,today I signed a contract quit my old job quit my new job then unquit my old job  so that was just great 🎃🔫,0,1,0,1,0
1684,Quit my job yesterday got a new one today,0,1,0,1,0
1685,Interview went well I got hired now to figure out how to work two jobs or quit my first one,0,0,0,1,0
1689,Dang got my first check today!!! Then saw how much I paid In taxes and now I wanna quit. Rather do nothing and get paid.,0,0,0,1,0
1738,I have been laid off since Dec 22 and tomorrow is my first day back to work. Bye bye life,1,0,0,1,0
1936,I recently got a job at Tijuana Flats. I already hate my life already,0,0,0,1,0
1943,At my new job some guy had a dog in his office &amp; I asked my boss about it &amp; he casually told me they sometimes just BRING DOGS TO WORK!!!,0,0,0,1,0
1944,I recently started working at a new job and now I have weekends off and a normal schedule and I don’t have to dread the weekend anymore,0,0,0,1,0
1946,Recently started my first FT job. Should I be paying more than the minimum on my student loans? - https://t.co/n7fgL3fDFR #taxreturn #taxe…,0,0,0,1,0
1948,In my past 10 days at my new job my boss has been out for 4 and in late out early for 6 because he can #rolemodels,0,0,0,1,0
1950,I started a new job last night. My new boss is a good fella I am looking forward to working with him!,0,0,0,1,0
1953,I recently started at Stryker and like everyone I had the New Job Jitters.  Here are some great tips to minimize…https://t.co/6nhgxWdljT,0,0,0,1,0
1954,I recently started a job in child dependency I posted this a while ago about the two jobs that led me to it. #blog https://t.co/CrfDajGev7,0,0,0,1,0
1958,my new job started only scheduling me for Monday and Wednesday and like that is not enough money for me at all so I might quit,0,0,0,1,0
1971,I should of starting working at this new job this week now Im home bored asf,0,0,0,1,0
1972,Been working hard at my new job so I decided to reward myself! gibson #sg #gibson #custom #guitar http://t.co/o3HDIJvfLL,0,0,0,1,0
1974,I recently started my first #law job. I am feeling overwhelmed. Any advice? https://t.co/RNsmj6AEyB,0,0,0,1,0
1979,Im already subject to termination at work and I started 3 weeks ago lol . I need more clientele to end this job saga,0,0,0,1,0
1983,First day at my new new job &amp; my boss is 10 mins late when I was 10 mins early..Hmm.,0,0,0,1,0
1985,I was stressing over leaving my old job but my new job treat me like I own the place. You really gotta be willing to progress,0,0,0,1,0
1986,Ever since I started working at my new job Ive been watchin reality tv less and less now. I will be watch LHHATL tho next Monday!!!,0,0,0,1,0
1990,my trainer at my new job lied about me to our boss http://t.co/GUmotcFpDh #hr #advice #manager,0,0,0,1,0
1995,I recently took a job cleaning houses a few days a week. Now on my days off I am slightly obsessed… https://t.co/rmcxrq5cWL,0,0,0,1,0
1996,everyone at my new job calls me Kimberly &amp; I feel like this is a great opportunity for me to have an alter ego,0,0,0,1,0
1997,Just ended my shift at my new job and now Im about to start my shift at my old job literally kill me,0,0,0,1,0
2003,I recently started working a part-time job in addition to building my biz because I have big giving dreams and goals. #GetFit #Dream #Give,0,0,0,1,0
2005,First day at the new job and my emotions  are everywhere #still dont know if thats a good thing or a bad one but Im rolling with it,0,0,0,1,0
2007,I unknowingly started my new job today so yeah thats great,0,0,0,1,0
2008,Ight so I started this new job today right so Im in training class and the big manager dude ask who knows someone that works here this,0,0,0,1,0
2009,So Im starting this new job at a news station the same day SmackDown is in town. Holding out hope someone shows ip to promote on my 1st day,0,0,0,1,0
2011,5 other people got hired the same time as me this week and by today ( the 3rd day) I was the only one to show up to work haha,0,0,0,1,0
2012,Got fired a few weeks ago for showing up a few minutes late several times. You can ask my boss. Got hired back and put on days. Its cool.,0,1,0,1,0
2015,My sudden job change is proof of this. Fired 1/14 hired 1/23 at a better job. God is good we just ha http://t.co/xLQj6tqut2,0,1,0,1,0
2017,dont know how I feel about being fired and rehired all in a span of 2 days. so weird honestly.,0,1,0,1,0
2182,A week ago I was unemployed and now I work for ESPN. God is good and He never ceases to amaze me with HIS plan!  🙌🏻,0,0,0,1,0
2214,Two minutes ago I was unemployed. Then I got a text message. #fuckyafreelance,0,0,0,1,0
2225,So technically Im unemployed now. At least until Monday morning. ;),1,0,0,1,0
2228,A month ago I was unemployed and now next week I have work every day,0,1,0,1,0
2322,I went from being unemployed to now having 2 jobs in a months time! Im a living witness that with God ALL things are possible!,0,0,0,1,0
2326,oh man im like unemployed for three days. but also new job in three days! also also three day weekend!,1,1,0,1,0
2327,I had so much fun being unemployed for 3 days after quitting my job but now I have to go back to work fuck my life lmao,0,1,0,1,0
2332,I’ve only been unemployed for 10 days and I was blessed with a job when I wasn’t even looking and I start tomorrow. A bitch just want 2 sleep!!,0,1,0,1,0
2430,Just got hired yesterday but have a job interview tomorrow. CFA or FL?!?,0,0,0,1,0
2493,This week I started my new position at the ACS as Sr. Manager of Community Events!,0,0,0,1,0
2768,I got hired yesterday and started working the same day too 🖖🏽,0,0,0,1,0
2769,got hired at two places todayand got all my homework done ahead of time. adderal goes the hardest,0,0,0,1,0
2772,Got hired to work at Olive Garden turn up!,0,0,0,1,0
2775,Went applying today got hired on the spot. Worked a 12 hours shift now Im tired af,0,0,0,1,0
2781,Today gone be a good ass day! I just keep getting good news! 1st I get hired in. Then found out ion have to work tomorrow.,0,0,0,1,0
2798,I finally got hire at walmart I been working at walgreens for like 3 and a half months. Tomorrow my last day at walgreens,0,0,0,1,0
2836,Ahh last day on the bench. starting work Monday what do I do with my last day of unemployment!!??,1,0,0,1,0
2844,now i am back working  i am just going pay the salon to do my hair.,0,0,0,1,0
2850,After 141 days of unemployment I am so excited to be at work tomorrow morning!,0,0,0,1,0
2876,I applied for 18 positions  same day one phone interview next day a personal interview 2 days later were hired with top pay and benefits.,0,0,0,1,0
2877,Today I can smile. Today I have secured a new apartment and got hired for a full time position!😁👍,0,0,0,1,0
2878,And just today I got offered a full time position with a past employer today must be my day :),0,0,0,1,0
2880,I got offered a full time position at work today &amp; I also forgot to clock in at work today. So thats how my days going.,0,0,0,1,0
2884,I got a call from Hot Topic at Dmills for a sales associate position.. too bad I JUST got hired somewhere else lmao,0,0,0,1,0
2885,I got the secretary position and was reelected for the Public Relations committee for my sorority tonight ahhh Im doing the thing!!!,0,0,0,1,0
2886,Yall today I was offered a full time position with my temp job so NOW YA GIRL HAS A FULL TIME JOB SUCK IT,0,0,0,1,0
2893,Got a position as a lead teacher in the education field. I am employed. Hallelujah.  Thank you Jesus.!!!!!Glory to GOD!!!!!,0,0,0,1,0
2895,WELL I GOT OFFICIALLY HIRED FOR THAT CASHIER POSITION AT LEASTWOOP WOOP GIMME DAT INCOME,0,0,0,1,0
2897,I applied and got offered a position today in which Ill be able to use my college degree,0,0,1,1,0
2899,I had the shortest job ever. Got hired on Friday &amp; boss told me he changed his mind about offering the position when I came in 1st day. :O,1,1,0,1,0
2901,I ALSO GOT PROMOTED TODAY  finally have a management position 🎉,0,0,0,1,0
2903,Same day call interview and Hire! Thank You Jesus! I will officially have a teaching position this upcoming school year!,0,0,0,1,0
2921,I lost followers for announcing my new position as a software developer. Niggas is haters forreal,0,0,0,1,0
2925,So my job just offered me my position full time just after me working two weeks which I did full time..,0,0,0,1,0
2934,I went to a job interview and got offered a supervisor position. Look at God,1,0,1,1,0
2940,Weird state of my life. Yesterday I was being interviewed for a position today I was interviewing people for a position.,0,0,0,1,0
2947,So I recently started work for a pet boarding/doggie daycare and someone was REALLY fucking happy to see me this mo… https://t.co/GDPFizGxUw,0,0,0,1,0
2951,My new boss is the nicest guy. Actually looking forward to start working,0,0,0,1,0
2966,Recently started working at a sex shop...got me thinkin...what are your thoughts on graffita covered sex toys @imcorinnemec,0,0,0,1,0
2969,Yay my new boss is pretty cool and hes letting my employer train me! Sweet so I will be working Sundays maybe 4am to 12,0,0,0,1,0
2970,I recently started working here and I already hate it,0,0,0,1,0
2973,wanna start working 25-30 hours a week at my new job,0,0,0,1,0
2974,Ok so I just started my new job and found out 4 of the girls I work with are lesbians,0,0,0,1,0
2979,just started my new job and some bitch i work with decided to tell me that my bf fucked her in HS? Like ok? Do you want a cookie?,0,0,0,1,0
2980,First day at my new job on the 17th been out of work a month to long now and I hate that shit,0,0,0,1,0
2984,Well the new job barely has work for me too at least Im still getting paid.,0,0,0,1,0
2989,even though I only been working at my new job for 4 days Im already gonna be running the second store by myself tomorrow,0,0,0,1,0
2992,So far my first week at my new store I have been sick and have lost my voice last 2 times I worked.,0,0,0,1,0
2995,I wish I took 4/20 off but I just couldnt do that at a store I just started working at recently,0,0,0,1,0
2999,I have a new job work 4 hours unlike the hours I worked at my old job and get paid every Thursday Im gonna work to buy a Iphone 5.,0,0,0,1,0
3000,Ive learned more &amp; talked more with my co-workers in 3 days at my new job than I did in 3 weeks at Dicks. extremely grateful &amp; happy.,0,0,0,1,0
3004,My first day of work at my new job is done! Wow crazy how time is flying by.,0,0,0,1,0
3005,Hell yeah got the job at Citadel Outlets finally I can start working again on Monday,0,0,0,1,0
3006,I really would consider moving if I hadnt recently started working.,0,0,0,1,0
3009,First week at the new job is going well so happy im working again in my industry i think i need to buy some shoe insoles though.,0,0,0,1,0
3010,Today I made a customers day and a customer made mine: So I recently started a second job working in retail ... http://t.co/osuM8pFwt2,0,0,0,1,0
3014,Im bout to start back working out Yall. My new job has a gym,0,0,0,1,0
3016,Just started my new job today. Im working at a movie theater cleaning up after the movies get out. Found 2 small popcorns wedges under,0,0,0,1,0
3017,Today’s been really weird.I got a call saying I can start at my new job I got a new working tablet for free from my other job and I got a free cold unopened Red Bull from some random girl. What is happening? What did I do?,0,0,0,1,0
3090,My uncle told me since I lost my job if Im not working soon I can come back to the jungle. I responded by getting one fast cuz I never quit!,0,0,0,1,0
3141,my swag is currently middle age dad who while searching for a new job after being laid off has finally landed that dream job hes wanted,0,0,0,1,0
3163,Got laid off and paid today. W.e. Im in the union I start working in the next 2 days.,1,1,0,1,0
3165,I GOT LAID OFF YESTERDAY AND GOT TO JOBS TODAY 😊☺😊😊😆😆,0,1,0,1,0
3167,Wow I just realized I got laid off and hired in one month. Laid off April 7th hired May 7th. Really got a job in one month.,0,1,0,1,0
