id,text,class
3527,unemployment is causing me to go freaking stir crazy....  Job searching in my field is really a pain in the dick.,1
5473,Looking for a job in #Mesquite #TX? Medical Customer Service https://t.co/XuJpy5xBRi #jobs #hiring,0
1398,Long-Term Unemployed Winning Jobs Or Giving Up? http://t.co/ftGSBhii via @HuffPostPol,0
4467,Officially gonna quit my job. Whos hiring?!?!,1
1844,I am looking for a position that will get me closer to where I was. Who has had success with resumes on video? #LOOKINGFORAJOB #Accountants,1
3160,Debating whether to switch jobs rn to a better company with higher pay OR stay at my current job till I get laid off &amp; then go there? 🤔🙃,1
2038,Looking to get re-hired at a previous place of employment? Tip: be more prepared than you were the 1st time you got hired. #improve #biztip,0
1144,My coworker got laid off today... I fasho dressed up today and was on time lmao,0
533,Also man dude I dont know what to put for reason for leaving. I was fired for being tardy too many times.,1
785,I am currently employed &amp; still searching for a payroll specialist position in the Kansas City MO or KS area. Anybody plz forward any leads,1
1716,Photo: Today I was laid off #layoff #unemployed :-( I am very sad but optimistic anyway…. One door slaps me... http://t.co/RMgG27F6vd,0
1631,I am looking for a buyer on 1234 W MESQUITE TREE Lane San Tan Valley AZ. http://t.co/c19nsG29ba,0
1464,Today I talked to my cute coworker &amp; he did this eye thing that my exboyf does &amp; now I know that I want to die,0
3924,Searching for #work in New York NY? Send your #resume to Lheim Industries LLC. http://t.co/mtsV8jaQ2T #gethired,0
267,I got a job interview got asked out got someones number and free food. Today is a great day!,1
2371,Anyone want to coach football?  The NFL is hiring! (Hey maybe someone will take Greg Roman),0
5264,Anyone know of any places hiring weekends? because Im gonna burn this place down if I dont quit soon.,1
1863,RT @BlackLifeCoach: Laid Off With A Baby On The Way: How I Turned My Setback Into A Power Play http://t.co/V6BPz6OMFZ @Reesefinancial,0
1552,This weeknd I took a couple days off so I could drive down to eugene for a job interview. Also gotta move into my new house.,1
2531,Looking for an exciting new #job? Opportunities include a Senior UI Developer position in #Arlington VA. #... https://t.co/dClbbeWAtU,0
689,I am ranting and if I get fired so be it. I am over this so called manager we have. Sent a text to him asking... https://t.co/vKLlEAIUgU,0
907,Got hired at best buy mobile last week &amp;amp;amp;amp; today I have an interview with FedEx for a customer service rep position! #needthat,1
5388,Work was crazy today a lady feel guy got him phone stolen and I almost got fired but thanks to my loyal customers who recount my change,0
1191,Ironic I drop the #EAT today and jus got laid off from my job..,0
2882,I got to be in a leadership position today in ROTC.. And everything went well,0
4330,Black people never help each other but is anyones job hiring?,1
789,I am currently sourcing for a position for a Junior Assistant to work in an Entertainment company in NYC. If you love music.. this may be p…,0
368,Im not looking for a handout. I am looking for a chance to work and prove I have what it takes to be a Pro Fisherman and make an impact.,1
2728,Whenever I feel unappreciated at work I stay looking for a new job realizing I dont have a lot of the qualifications required I stop.,1
1298,Interested in a #job in #Mesquite TX? This could be a great fit: https://t.co/wqJiTWI366 #Retail #Hiring,0
2600,Just Get Fired? Prove It on LinkedIn &amp; Burger King Will Give You a Free Whopper https://t.co/sfoxMgms2e #burgerking #Employment https://t.co/8EjkRqwHwf,0
1639,Relocated to Tucson AZ. Well not quite done yet. Relocating. Now Im searching in earnest for a Remote Front-End Developer position.,1
4878,My father is now unemployed,0
4868,Been unemployed for awhile? Contracting can help you get back in the game: https://t.co/VKsHLP3Unh,0
1820,I am seeking employment with an agency whos ideology is about the well-being and care of the elderly.,1
2403,Whos hiring at the mall!!??,1
3008,I recently cleaned out my phone and all of the pictures on it now are from work.,0
4295,I need a job. Anybody hiring??,1
5281,recently started to listen to v loud &amp; aggressive trap music in the shower and its rly improved my quality of life.,0
5239,Is there a coach OSU can hire who has a built-in recruiting in (ala Tinkle/Thomp.)? Or someone that can flip Hufanga Lowe or Quitoriano?,0
4374,#VPDebate shots fired shots fired lol get em Tim #ImWithHer,0
2733,I am looking for a social worker internship. If anyone knows of anything please let me know. I have to have an internship by June,1
5296,I remember when I thought Eric Bledsoe was the answer. I remember when I thought firing Jason Kidd was the answer. But both have just caused more problems,0
3437,Working interview was moved to Tuesday of next week. Hoping I can get this position so badly lol,1
1032,I keep not getting hired because I have no work experience. Well how in the hell do you expect me to get job experience if you dont hire me,1
4591,I have been working my ass off applying for jobs networking and volunteering and somehow 5 months after budget cuts Im still unemployed.,1
1566,I didnt get fired &amp; I still hate my job. But I feel good cuz I had an awesome run this morning &amp; I have a date with a lovely lady tonight.,0
2336,Anyone know of any oilfield jobs or good paying jobs??? Let me know my brother is looking,0
5164,Please pray that God leads me to a full time job. I was laid off and am not receiving responses to my http://t.co/R7QDi3NFx7 #pray #prayer,1
2274,Searching for a new #career? #Job openings incl Servers Managers Cooks &amp; more! App &amp; additional info https://t.co/mKh9KpXfVv @TriRestJobs,0
2880,I got offered a full time position at work today &amp; I also forgot to clock in at work today. So thats how my days going.,0
2876,I applied for 18 positions  same day one phone interview next day a personal interview 2 days later were hired with top pay and benefits.,0
1307,Interested in a #job in #Quitman TX? This could be a great fit: https://t.co/7tEt93KQrL #Retail #Hiring #CareerArc,0
3502,Sean Hannity is making 30 million a year for his job at Fox and Im unemployed ??  Seriously ??  SERIOUSLY ????,0
1753,connecticut unemployment claim: #Collecting Unemployment if You Quit or Were Fired or Laid OffAudio/VideoI... https://t.co/jQrwqe98yk,0
3537,Is anybodys work hiring ? cause Im fucking laid off #lame #pissed,1
5213,Being #unemployed and looking for a new #job takes a surprising amount of time and effort. Sorry #youtubechannel I got some things to do.,1
1198,Got laid off today. The Oilfield industry is brutal right now. Time to find a new job 😔,1
1080,Well I am actively searching for a new job.,1
1598,Looking for an exciting new career opportunity in Detroit? https://t.co/1JbvAXo4wl    #jobopportunity #detroit https://t.co/PnYS6qcN34,0
2482,Interested in a #job in #Chickasaw Alabama? This could be a great fit: https://t.co/PtGIscHa9u #NowHiring #GetHired #Manufacturing #Hiring,0
3719,Now my employer has Minimum Wage as their ringtone. This pleases me more than is probably reasonable.,0
3239,Got fired on Wednesday got my job back yesterday and I work today haYesterday was my day off too so its like I was never fired at allMy manager hates me even more now I know it aha,0
4634,Is anyones work hiring???,1
2787,Who is hiring? Im down to work my 40 hrs/overtime/can lift 50+ lbs weights.,1
3662,Looking to join Department of Veterans Affairs (@JobsatVA) Premier Anesthesia (@WorkatPremier) or Locum Leaders (@LocumLeaderJobs)? View 43 openings from these companies and more. https://t.co/Qe4cEifw7g,0
1501,I havent worked in 2 months and place I applied for BEFORE losing my job are contacting me right now,1
3162,Got laid off today anyone who knows of good places hiring pls let me know,1
4445,today i got yelled at over the phone by someone i presume isnt quite alright in the head. yay customer service jobs.,0
1264,One day you might find yourself working on a pursuit then all of a sudden lose all interest and have no qualms about it.,0
3431,My position at AMC was eliminated this morning so if anyone needs a lunch date or has a lead on an interesting gig PM me! #time4change,1
1055,I am currently in the job market want to help me network to find employment? Share my LinkedIn profile! http://t.co/6TknMV94sn,1
965,I have a class in 2 hours and then I can come back home and sleep...NOT! and I have to train for a position I got hired for ugh!,0
948,I have to go in tomorrow at 1030 for a try out but he didnt tell me what position or if ill be hired even after that or if ill get paid ok,1
4844,This might help you become too important to be laid off - 10 Steps to Becoming a Better Team Leader at Work http://t.co/vXEFDkXRtw,0
5233,Any restaurants hiring in buffalo? I need to quit my job like today,1
875,RT @Med2Cold: Who is this? Asking for my unemployed dark skin cousin.. https://t.co/S3fKEEoPy7,0
1570,Looking for a new career? Rain Bird has the right environment for a thriving career. Sr. Project Engineer (electronics) #Tucson AZ #job #hiring #career https://t.co/Ff36w7Zbi8 #Engineer #Extrusion #Plastics #CareerArc,0
1088,I am searching jobs in New Jersey on http://t.co/H0a5SDt6BT,1
5460,Last time this happened I was unemployed and it was fun. Now Im sick have work tomorrow and am not having a good time. #ONEGOAL,0
652,Heres what to say when a hiring manager asks Have you ever been fired? https://t.co/tapqkP9A2j,0
5064,Being laid off sucks. So they say there is about 80 to 100 applicants to each available job. So should I apply 80 to 100 times to get hired?,1
3157,i need to find a new job since im being laid off next month buuut i have no ideas,1
740,Someone applying for a UI / UX Designer or Developer position might want to consider making their portfolio HTML5 compatible.,0
3375,Getting fired today. And probably going to get kicked out. Anybody hiring?,1
1053,Currently laying on my floor in fetal position chanting I need a new job. I need a new job,1
4313,Anyone hiring for a part time job? https://t.co/amAYJAwXq6 #reddit #Gainesville,1
2368,HELLO SAN JOSE yall hiring????????,1
827,.@DarynPittman put on quite a show last night in the #BDclassic @atticaracewyprk - start last &amp; finish 3rd! Impressive  job guys! @KKRdirt,0
1070,I am searching for jobs anybody got any suggestions?,1
4366,#BREAKING411 Bob Beckel Fired By Fox News - NEW YORK — Bob Beckel most recently a co-host on ‘The Five’ was let-g... http://t.co/pVgZickb0w,0
4339,anyone in #inlandempire know of anyone hiring? its time for a new chapter/better job,1
2584,Walmart worker fired for kicking out gay couple: A Walmart janitor is looking for a new job after he was fir... http://t.co/9lsDhexBQl,0
3240,Gave my supervisor a evaluation today also I got fired today,0
1798,I am currently watching the wayan Bros.,0
2500,Today has been rough. Headache  threw up from headache and told I wasnt qualified for a position.  Can I get a restart option?,1
4689,anyone hiring??? i need a second job,1
2263,Looking for a job? Energy Engineer/Resource Efficiency Manager(13005062) at Northrop Grumman (AK) http://t.co/0fdWzVCWvf #green #jobs,0
2627,Looking for some inspiration to get off the couch? Here are some quotes to get you fired up! http://t.co/LVcrLU2clr,0
4797,Last week: I was looking for other jobs. This week: got a raise got 2 interviews as well.,1
1115,I am searching jobs in New Jersey on http://t.co/rwQS6slTU4,1
228,Today at work someone came through my line &amp; said hello how are you then handed me Adeles album &amp; I lost it,0
1726,Crazy tho. I got laid off and now TWO jobs want me. Im spechul,1
2131,Searching for #work in Columbus OH? Send your #resume to Express. http://t.co/6yG91nNBZM #gethired,0
3789,#ASSETPROTECTIONSPECIALIST-WarrenMI#2702 #job in  #HomeDepot #Detroit apply at http://t.co/HtLDzy7whf,0
5177,I am no longer reporting on education @indystar - laid off Friday. 110% unexpected. Still bent on journalism/covering ed so plz RT,1
4968,I went into work 3 hrs late the other day please dont fire me,0
3699,With vine dead every vine famous person needs to go to the unemployment line now.,0
5049,its terrible being poor and desperately looking for a job..being laid off sucks,1
5232,Im looking to quit teaching after 18 years of being an educator Im looking for my niche? Anyone out there hiring? #myniche,1
4047,Currently unemployed so if you know of anything Im taking suggestions,1
3006,I really would consider moving if I hadnt recently started working.,0
1730,@BarackObama 15 year teacher assistant laid off over a year unemployment funds almost gone. Cant find work. Now what? I fear being homeless,1
3327,I think Ima get fired soon anybody hiring?,1
2252,RT @JPCVServices: Looking for a new job in 2016? If so are unemployed seeking internal promotion or looking to move company?,0
5493,I  am currently medicating,0
2736,I am Looking for work in fixing #computers or #security #jobs.https://t.co/Bm4FAwHaSz#Oakland #Bayarea,1
552,my boyfriend talks in his sleep he just asked me if I had finished the batmobile. He was also apparently fired by Mrs Batman recently.,0
1323,Everybody has that one job that you would gladly quit school move wherever and take a pay cut for given the opportunity,0
5278,Dont submit then quit. Apply for jobs like RN Nurse Manager at Canterbury Woods then look for people you might know at the company. You might be able to reach out to HR directly. Ready to apply? Check out the link in our bio.,0
2341,Anyone know of places newly hiring in Sierra Vista Tombstone Bisbee Fort Huachuca Benson or anywhere within 30 miles of here?,1
4861,If you didnt think it was possible to get laid off of a nanny job I can tell you that it is #unemployed,0
4294,Anybody Hiring??? Looking for a 2nd job,1
4130,Im losing my home and car due to being fired and not being able to find job to cover immediate bills not ... http://t.co/eKwWHiZbWZ,1
4620,Unemployed people always say  I have a lot of Me Time. Busy people always apologize for the delay.,0
1157,Just got laid off whose hiring,1
517,Welp it happened i have 4 job interviews on the table after 2 weeks of getting fired.  Wow thats amazing.,1
4780,When I woke up this morning I did not think that I would be fired from asked to return to and quit the same job all within a span of 2 hrs,0
1342,Any positions for an equity trader with 15+ years experience @jobs4ATX?  Other i-banking opportunities would also be of interest.  Thanks!,1
5096,I am looking for a buyer on 3103 Old Madison Highway #Quitman #GA http://t.co/sYQ7ExV4SL #realestate http://t.co/I1SuBaut3V,0
4948,Anyone looking for a great buy and hold in MID GEORGIA? 30-40k in Equity when purchased and does not need any... https://t.co/nN3MtYyM6p,0
1289,Am currently the people greeter at work..,0
1327,If youve ever been interested in quitting your part time job wanted to be your own boss  or run your own business send me a message!,0
2415,Bookish? Outdoorsman former Flint cop hired as Muskegon Countys new top librarian http://t.co/N6tHl1p1G0,0
3522,Now actively seeking employment. I hate job hunting! But such are the times in todays job climate.,1
1549,2nd week on the job and I may have already gotten someone fired I mean freed up ones future. Being fired is an opportunity. Your welcome.,0
936,Today I got a paid summer lab position bought a suit got to see my family from CT and got a new car!!! Its been a damn good day.,0
4560,Does anyone know of any place hiring?!,1
4953,Anyone know of places hiring? Macs is pissing me off now and im quitting McDonalds no matter what lol,1
1400,Unemployed Under-Employed Unhappily Employed? Find #jobs &amp; career solutions on #LinkedIn in the Job Seeker &amp;... http://t.co/uUqhBrEH9n,0
801,I am seeking a technology facilitator position at a school in the Chicago Suburb or DeKalb County Area. Please DM for resume.,1
1733,To all of my baseball fan family:I was laid off yesterday and am unemployed 1st time in 20 yrs. Send leads my way pls! @BaseballDo @TepidP,1
5540,Searching high &amp; low for a new job I officially hate my job,1
3052,I quit my job at Starbucks so I could have more time for school but then I my depression came back &amp; I havent done shit since week 2 fml,0
1718,If I get laid off ima get that unemployment check,0
4561,Anyone have Nintendo64 related stuff they dont want/willing to sale??? (i.e. video games/remotes/memory packs),0
2924,An employer told me today I may be overqualified for a position. In my mind I was thinking of all the times the first Goomba killed me.,1
1306,If you are thinking of #quitting here are 5 #nursing jobs at home you can try. https://t.co/DAFHLwiOSM #athomenurse https://t.co/PVhr7iwjSP,0
1931,@HASSAssiNation: after following you for so many months I still cant tell what position you are Close D. Left side. #StrongSide,0
3337,Anybody in weatherford hiring? #igotfired,1
359,I am job searching for: Work at home jobs! http://t.co/4tgcXWg6JK — Walker Inklebarger (@Walker_marocliv)... http://t.co/yN2e891rUT,1
1259,I might be interested in working at best buy.,1
5269,About to quit  who hiring ?,1
2885,I got the secretary position and was reelected for the Public Relations committee for my sorority tonight ahhh Im doing the thing!!!,0
1044,Literally not applying to jobs I know I will get hired for. #aimhigh,1
4413,@JC1053 the agent still gets paid for the extension even though he is fired?,0
4454,Today a guy @ work had bad ass long hair the way I want to grow it out. I told him I cant grow it out cuz of work so he suggested me 2 quit,0
1099,I am job searching for: Work at home jobs! http://t.co/4tgcXWg6JK — Walker Inklebarger (@Walker_marocliv.... http://t.co/QIM3fwjwaZ,1
4299,Does anyone know of any places hiring??  This girl needs a job,1
4181,RT @JustinWolfers: There are still 1.7 unemployed workers for each job opening. http://t.co/TAMhhW2WBL,0
3727,I am back on the Job Market! Is anyone looking for a Test or Technical Manager? https://t.co/gCBJh8nyQD #gamedev #gamejobs #unemployment,1
1040,I am a Polysomnographic Tech that cannot get hired ugh this shit sucks.,1
1177,TODAY.TIME 2 FIND A NEW THERAPIST. MINE GOT LAID OFF BECAUSE OF BUDGET CUTS. REAL BUMMER CAUSE WE DID ART THERAPY &amp; I THRIVED!! BN,0
4642,Is anyones work hiring??,1
3053,I almost quit my job yesterday but my manager called me and said dont quit just come in you have a child to think about,0
2347,Whos job is hiring ???,1
3227,I dont want to find a new job but I honestly feel like I have no choice. Either I quit or get fired.,1
1329,Here is an awesome app that shows you how long ago you quit smoking -&gt; https://t.co/69F7MYabG6 #vaping #eliquid,0
3629,Looking for a Spring Vacation at Walt Disney World?  New discounts as of today for Disney Visa Card Holders... http://t.co/yqQ5Dc9UiY,0
2888,Almost walked out of work today because I work with a fucking fat lazy bum who somehow got a managing position and cant do his job right.,0
3744,@DanScavino You are disgusting the worst kind of person. The world will greet your unemployment with a smile when your boss goes to jail,0
1073,I am searching for a job in helping clean businesses offices or home @lexijablon @lrotts http://t.co/Em2sdu6pK5,1
325,i am thinking of changing my internship workplace if it is Gods will and i am searching for a place  http://t.co/GuAdDjDAku #pray #prayer,1
1596,looking for a new job does anyone know a place thats hiring???,1
3509,I am going to #tweet about my #unemployment until I find a #job I am from #LosAngeles #California living in #NorthCarolina,1
5258,Bloomberg is hiring a Software Developer C/C++ - Equity Products Job http://t.co/wRTnFZfP4e #job http://t.co/jKGAuxsYFt,0
889,I searching for a position as a registered nurse. #focusclass,1
1849,I AM LOOKING FOR A GRAPHIC DESIGNER FOR SOME QUICK PROMO FLYERS.,0
4548,The Michigan unemployment office has been the most difficult group of people to try and work with. I have received no help whatsoever.,1
2331,Now I am actively looking for jobs in Manhattan and uggh I hate looking for jobs,1
1585,Looking for a raise or a higher offer?  5 tips to negotiate #salary https://t.co/YCoXVJFjva #jobs,0
4166,Fear is Why Workers in Red States Vote Against Their Economic Self-Interest | The fear of being unemployed http://t.co/hFwXPnAnih,0
1062,Currently looking for a job. Can anyone help me out? Im open to doing porn. Please send amazon gift cards if you guys can,1
660,Are you an employer who has questions about unemployment for a fired or employee who quits? http://t.co/SupHGp98hH... http://t.co/KgLzqDz0tx,0
4921,The new coworker that was late for their interview and paperwork then didnt have 2 forms of ID is making more than I am. Same position.,0
5175,I got laid off on Monday needing to find a job quickly also hoping my house~ https://t.co/EBlIQaTyhn #pray #prayer https://t.co/KK4e7zDX6b,1
966,Today I applied for the @santamonicacity Jailer position hopefully I get an email and/or a callback,1
2618,Has attacking George W. Bush backfired big time for Donald Trump? https://t.co/AsuwDgfI07,0
2613,4th best in league with depleted roster &amp; still gets fired? https://t.co/vkVtZGSclq,0
4173,Millions of ppl eat #McDonalds and #Wendys #dollar menu Not only the #unemployed #justsaying 🍟🍔 https://t.co/IM6948PaJe,0
1401,Unemployed Under-Employed Unhappily Employed? Find jobs &amp; career solutions on LinkedIn in JCD The Job Seeker &amp;... http://t.co/I4eIURAHmP,0
3687,Unemployed.... What am I gonna do with myself?,0
2378,Is anywhere hiring at all ??,1
4304,Anyone looking for a job because mine is hiring !?,0
3402,An earlier recruiter had me filling out an I-9 form and theres been silence for 3 weeks now on that position. No new info when I ask.,1
319,I have lost my keys my wallet &amp;amp; now my IPad TF is going on today,0
2057,Looking for a job? Potential employers are looking at YOUR social media. Keep it clean! #JobTips #GetHired https://t.co/HW8XJhesAP,0
4260,I have had 3 Co workers ask me if Ive quit. Im on personal leave as in leave me alone!,0
4957,Anyone know whos hiring ? I need to quit my job,1
3633,Looking to serve on a nonprofit board or grow in your skill-set as a current board member?  The Johnson Center... http://t.co/prSRdIGj0B,0
1969,My boss really pisses me off I dont even know why I started working here again. Hopefully I get this new job,1
1854,Why Fiat Chrysler Automobiles Laid off 1300 Workers #FiatChryslerAutomobiles https://t.co/kHT8yPVV1X #FiatChryslerAutomobiles,0
4684,Well I also applied for jobs so hopefully I get hired,1
87,Went job hunting today and the 1st place I went was boca tanning I got hired on the spot without even filling out an application☺️ #yayme,0
173,I worked 7-3 today got off went to class when I get out of class i go back to work 11-7 then back to work at 3-11 tomorrow,0
5467,Looking to quit your day job and do something that you actually love and care about? RSVP http://t.co/ZE8deWyrg6 #drinks #happyhour #nyc,0
4291,does anyone know of any jobs hiring rn????,1
2652,Hello my name is Senor Benjamin and I want to submit my resume for the position of manager. Skills: Preparing for massacre.,1
4135,Jessica got fired from being a Lobbyist and Im trying to get her a new job.Jaik is a Paramedic.Both are Knowledge aspiration~,0
3110,Hopefully I will generate new ideas about starting a business while I am at @beantraders since I was laid off in March.,1
2359,Whos hiring?????? Help,1
2366,does anyone know of a place hiring?!,1
4562,Why dont people want to hire in the middle of the summer??? Broke life aint fun,1
3613,Recently I just been fuckin and making art exactly what I saw myself doing in the future 5 years ago,0
4569,I am an #unemployed #bipolar #overweight #blogger looking for a #job Is there #stigma attached to it? Will a #company hire me if qualified?,1
3090,My uncle told me since I lost my job if Im not working soon I can come back to the jungle. I responded by getting one fast cuz I never quit!,0
2350,Anyone selling weekend passes??? #minegotstolen http://t.co/aZJtjws7A8,0
4536,My hands dont like to be unemployed they like to work,0
4305,Anyone know who is hiring?? Need a second maybe 3rd job asap!!,1
3960,Got hired at a food truck today then worked 7 hours. Now I have something to occupy my time,0
3905,So Ive been all stressed cause work has announced theyre closing for renovations. Then they pushed it back another month. Well last Monday I went out and beat the pavement. I got hired on the spot at another sushi/pho restaurant. If I was at GDQ as planned no new job.,0
2373,Anyone hiring...more than $14,1
5383,One computer is unexpectedly shutting down. Another the battery is dead and needs replacing. My virtual private server is currently down for routine maintenance for 2 hours. Perhaps I should assume the fetal position. Tsunami must be next.,0
3171,Hi guys. I officially got laid off today. Send beer. Thanks. Also please hire me.,1
3328,Quit or fired? https://t.co/t98FZ7Ytj0,0
4584,RT @womenbiznetwork: Ready Set Action! Searching for a New #Job http://t.co/AM52tdIj51 via @ItsJustTami #unemployed,1
4220,I am currently trying to not get worked up and anxious over what is quite possibly nothing at all. I am not good at this.,0
3458,I didnt fire anyone today. I suppose thats a good first day to position myself is a benevolent leader.,0
4576,Tired of being unemployed especially after searching for so long. All I need is an entry level job people! Come on!,1
3754,oooOOoOOOh a girl with purple hair a giant sweatshirt on a dirty street with graffiti and alcohol wE CALL THAT UNEMPLOYMENT NOT HIPSTER,0
4228,I am unable to quit because I am currently to legit,0
5421,Heres Everywhere In America You Can Still Get Fired For Being Gay Or Trans https://t.co/W7iFB11ZmH,0
