id,text,is_hired_1mo
3048,fuck dude I quit my job yesterday. Now how do I pay my phone bill and buy weed and cigarettes,0
3049,I quit a job 2 weeks ago after 3 days then they call me today to offer a different job. When does this happen?!,0
3050,So I quit my job today....,0
3051,Everyday I wake up and wanna quit my job,0
3052,I quit my job at Starbucks so I could have more time for school but then I my depression came back &amp; I havent done shit since week 2 fml,0
3053,I almost quit my job yesterday but my manager called me and said dont quit just come in you have a child to think about,0
3054,I get closer and closer everyday to quitting my job,0
3055,I called my hoe n said I quit my job today,0
3056,In other news I quit my job today,0
3057,yesterday I quit my job &amp; today I spent all day riding roller coasters,0
3058,I cant quit my job not when both sibling and father are losing theirs,0
3059,My shipping scale is broken I lost the keys for the place I housesat for and my place is a mess because my scale is broken. Today I quit.,0
3060,I quit my job today I feel good about it,0
3061,Fell asleep at the wheel the other nightbrakes failed and got in car accident yesterdayquit job tonight then got pulled over what the fuck,0
3062,So I quit my job yesterday LOL,0
3063,So I quit my job today. Does anybody know if Office Depot is looking for animators?,0
3064,today I found out that I can’t dye my hair any color at my job &amp; I nearly quit then and there.,0
3065,Two people at my job today quit sorry but when things get hard you have to persevere or life will hit you harder and harder,0
3066,Today my manager told me I need to quit smoking cigarettes if I want to have a career someday? #ok,0
3067,I should quit my job today cause they played me into working but..,0
3068,A co worker quit today. While they were emotional it was a good thing for her. I have 3 bosses and they are real tools,0
3069,Everyday I get more and more over this job but I cant quit #YET,0
3070,My boss &amp; coworkers voted for Trump.......... I need to quit today lmao,0
3071,today I quit both my jobs accepted Jesus back into my life and quit all hard drugs,0
3072,Today I quit my side job..... Just got bored and left. #bored,0
3073,Oh yeah I quit my serving job today also!  Gosh its just a bad month,0
3074,I quit my job and 3 people have texted me since then saying they quit too.,0
3075,I didnt lose it its not like whoops whered my job go? I quit! Someone pass the asparagus please.,0
3076,I have to go quit one of my jobs today I wanna die,0
3077,Today I fell down some stairs and hurt my muñequita but some nice man helped so its ok,0
3078,Well I quit my job today.....,0
3079,I tried to drive to school today and I got lost and quit,0
3080,I just repeatedly called a woman the wrong name in a meeting at work. Everyone laughed at me a lot. Unrelated I quit my job today.,0
3081,I almost lost it today.. Everything. My drive. I almost lost all motivation to continue on this lonely road I travel on. I was about to quit,0
3082,I lost my red indians hat too... I quit man,0
3083,Almost quit my job today...then I came to my senses and bought wine,0
3084,also i tried to quit my job today and my managers just kind of laughed..,0
3085,I quit my job and my car broke down all today so now Im a broke bitch with no whip. smh life.,0
3086,our maid quit like 4 days ago and the worst thing possible happened to me today,0
3087,Momma said Im a winner not a quitter not today momma cause when I hit Ima quit her,0
3088,i tried making a stop motion video today &amp; i felt like ben wyatt after he quit his job,0
3089,I quit my job where i was sitting all day to a job where I am standing/running around all day and thought there would be no problems,0
3090,My uncle told me since I lost my job if Im not working soon I can come back to the jungle. I responded by getting one fast cuz I never quit!,1
3091,Sooo when I tried to quit today my boss looked at me like I had shot her or something...,0
3092,damn I quit my job today shit got real I need to rob a bank,0
3093,One Month After QUITTING 2nd Job… I LOST 15 POUNDS - WHY? WAS I  GETTING MY ASS UP AT 3 AM EVERY FUCKIN MORNING? ANYBODY KNOW?? WHY???,0
3094,Lost a 3 year old friend today for no reason. He just apparently hates me all of a sudden. Prob just going to quit for good.,0
3095,I officially quit Target today I learned my self worth and they are so disrespectful &amp; petty  their Im over it,0
3096,So I quit my job yesterday. Is this when I should start watching How To Live With Your Parents? #PleaseKnock,0
3097,Today I quit my job and immediately had some retail therapy.. because logic 🤷🏻‍♀️,0
3098,I broke a nail today &amp; almost quit. It hurt so bad.,0
3099,My mama say baby you a winner not a quitter . Well not today ..,0
3100,Needless to say I am nailing it currently and wouldnt have been able to do that without getting laid off so THANKS old employer!,0
3101,Im #laid off and #looking for new #job opportunities in the #Chicago area.  Microbiology Molecular Biology scientist.  #recruiter  DM me.,0
3102,I got laid off earlier this month so I started a blog. Check it out! https://t.co/YJbRTiFuiE. #ThePinkSlip #UnemployedAndAnnoyed,0
3103,Ive been revising a resume for a former client who has recently been laid off. If youre in the Houston area and... http://t.co/nFUgf6SiCG,0
3104,We feel for those laid off from #Target and are always looking for top talent. Search for open positions: http://t.co/kjMcH7u9G3,0
3105,Hey all- one of my good friends just got laid off :-( Shes looking for admin assistant positions so if you know of any please pass along!,0
3106,I recently found out that I’m being laid off of my job... https://t.co/pqH4KMpYrj #vlogger #youtuber #smallyoutuber #RWOYT #youtube,0
3107,Urgent - if you know of a marketing/communications job opening please let me know. Ive been laid off. Thank you.,0
3108,@cressler_nico nah sadly got laid off so I been searching. Woo! How have things been for you?,0
3109,yeah since i got laid off my job ive been looking for work. so there will be a open job interview thing next... http://t.co/8xhACMqSVX,0
3110,Hopefully I will generate new ideas about starting a business while I am at @beantraders since I was laid off in March.,0
3111,One of my clients landed a job a couple months after being laid off/contacting me. She landed a job in the same city for $20K more. #win,0
3112,@DMRegister not well recently laid off. Struggle making essential payments. Looking for new opportunities all I can find is for lower pay.,0
3113,I got laid off from my job and for some reason Pa. Dept. of Labor thinks I dont deserve unemployment benefits so thats really fun.,0
3114,My coworker just got fired/laid off because they decided to get rid of his position. :(,0
3115,Also after getting laid off last year I was offered to interview at a place that wanted me to supply my own laptop for the interview.,0
3116,I need like 8 more months of employment.  I really hope I dont get laid off.  Its on my mind everyday.  But... Hunting season,0
3117,I hate looking for and switching jobs. I have a poor track record of being the first to be let go/laid off and not for any real reasin,0
3118,@DeptVetAffairs I recently got laid off and I dont qualify for unemployment because I havent worked there long enough.,0
3119,@laidoffleftout I am also one who is laid off from the construction industry and got a better education who still cant find work. #renewui,0
3120,Finding A New Calling After Being Laid Off At 50:  Turning 50 is challenging enough. But losing a job at 50 in... http://t.co/B3T1KMlLXn,0
3121,I have multiple friends even thise with business degrees who havve been laid off 3 times past ten years. Struggling to find good jobs...,0
3122,I was laid off from my job April 7. Seeking editing job. Appreciate all leads. View my LinkedIn profile: http://t.co/ogRrXD1eNZ,0
3123,@RetroFlea well I was laid off 2 weeks ago searching for a job because my job laid 18 thousand + people so I think I can bitch (:,0
3124,Oh hai I got laid off/downsized/let go for economic reasons. Cant wait to file for unemployment. I needed a vacation.,0
3125,Are you looking for a part time job to make some extra money or did you just get laid off &amp; need fast cash?... http://t.co/SVkJqn23KL,0
3127,Finding A New Calling After Being Laid Off At 50:  Turning 50 is challenging enough. But losing a job at 50 in... http://t.co/ezskd9xChz,0
3128,Finding A New Calling After Being Laid Off At 50 https://t.co/ND7K3zRm9r via @WendiDragonfly #aging #midlife,0
3129,I should get laid off and collect unemployment like all the rest. #Wordlotto http://t.co/XucuAND45F,0
3130,I am still waiting to see you put how many people you laid off while CEO of HP on your website @CarlyFiorina.,0
3131,Getting laid off is tough but @BusinessInsider gives some tips to get through it  https://t.co/8bvnSGBSDy https://t.co/HR1oQbY4yS,0
3132,Being laid off has brought more blessings than I can count but this job search is close to breaking me. Rise and grind!,0
3133,just found out that the new Haggens grocery store in my area laid off an employee of 12 years due to his mental handicap and I am sick.,0
3134,The greatest rewards in life go to the risk takers.I took a risk when I was unable to find employment after being laid off in 2011....,0
3135,#esurancesave30 Since I just got laid off and not sure how long it will take me to find a new day job.,0
3136,Officially found out Im getting laid off for the month of June and no longer guaranteed a job in July. Let the search begin.,0
3137,Anyone know of any SSRS opportunities in DFW? Friend got laid off and is seeking opportunities.,0
3138,My boyfriend got laid off and hes looking for work but hes got two weeks to make rent. If you can help at all or just spread the word...,0
3139,Have you been laid off?  Are you looking for a new opportunity?  Come talk to me and let me help you.,0
3140,@jennmckee sorry you got laid off.  I fully understand applying for a job after job. I know how talented you are. You will be ok :),0
3141,my swag is currently middle age dad who while searching for a new job after being laid off has finally landed that dream job hes wanted,1
3142,If I get laid off the last thing I want is unemployment benefits.  I would be looking all day and maybe all night for another job.,0
3143,RT @jacobkleinman: Well i just got laid off at Mic. If you know of any positions in gaming tech media hit me up,0
3144,Teaching is my 2nd career! I got laid off from my 1st career and now I have an itch to make another career change in a year or two! ; ),0
3145,And with that...I am officially unemployed...laid off from the Mortgage Specialists. If anyone knows of a local... http://t.co/fODGkqNqQV,0
3146,Have you been laid off fired or just downsized and need financial planning help? http://t.co/Gx9E39HENl,0
3147,Come to internship find glass of Koolaid on desk and scream Get this damn koolaid off my desk! Becoming an old man everything annoys me.,0
3148,Duped: I was laid off received severance package which allowed me to find another position within a large wor... http://t.co/3iRsq2KyYY,0
3149,Being laid off I need to find something to do that normally I couldnt cause I had to go to work... Any thoughts? Offers?,0
3150,@beaglebets can i ask which one? SO is looking for one to attend after getting laid off.,0
3151,Some old friends at a CT agency were just laid off. Give me a shout if you need design talent.,0
3152,Looking for a new opportunity in Seattle as I was just laid off with half of Cheeseburger. Contact me or Shauna Swerland at GloCap with an …,0
3153,Are you retired laid off looking for extra income? Join our Jan 13 webinar - Starting an Encore Business! https://t.co/1mJlsr3NWu#PCCSBDC https://t.co/pAyVYhe2uo,0
3154,@E_Megas I am looking for freelance gigs. I was laid off a steady 3 year gig. This is the longest Ive been out of work.,0
3155,I for one am looking forward to those govt employees who have been state supporters for decades getting pushed to retirement or laid off,0
3156,Twin Cities Network: Searching for a venue to sponsor meetings for people laid off or in transition. Visit: http://t.co/YzaqMZIAJb - thanks!,0
3157,i need to find a new job since im being laid off next month buuut i have no ideas,0
3158,I was laid off from my first post grad school job 6 years ago today.,0
3159,God is good laid off almost two months ago. Now finally multiple offers and meetings for positions that are not... http://t.co/qhQ6oE7vEp,0
3160,Debating whether to switch jobs rn to a better company with higher pay OR stay at my current job till I get laid off &amp; then go there? 🤔🙃,0
3161,A very close friend of mine got laid off today. Hes an amazing person and wonderful to work with. He is looking for positions in HR and li…,0
3162,Got laid off today anyone who knows of good places hiring pls let me know,0
3163,Got laid off and paid today. W.e. Im in the union I start working in the next 2 days.,1
3164,Today my boss got laid off &amp; my gentleman-friend also got laid off (unrelated). Dont they save that shit for Friday afternoons anymore???,0
3165,I GOT LAID OFF YESTERDAY AND GOT TO JOBS TODAY 😊☺😊😊😆😆,1
3166,Should of done my unemployment the following day I got laid off...,0
3167,Wow I just realized I got laid off and hired in one month. Laid off April 7th hired May 7th. Really got a job in one month.,1
3168,Got my contract today and didnt get laid off #teacherappreciation,0
3169,btw being laid off isnt that bad wasnt happy there I got 2 weeks severance AND unemployment.  Itll be ok,0
3170,I got laid off of my job today..... Perfect :/,0
3171,Hi guys. I officially got laid off today. Send beer. Thanks. Also please hire me.,0
3172,Got laid off from my job today.... #universityofiowa #pissedoff,0
3173,I find frustrating that I learn on the internet our region commissioner was fired and a new one appointed. how about a phone call or email?,0
3174,Looking for a job. I was fired two weeks ago .,0
3175,Looking for a job in Operations?  is hiring! $1000 bonus - Sign up to drive   #fired #layoff #work https://t.co/oWl7EkHh8N https://t.co/ETbCoH8rnn,0
3176,Seeking a Coal Fired Plant Mechanical O &amp; M Engineer for position in CO. Please email: dbeken@thinkingahead.com /call: 800-533-7977 x3,0
3177,smbinfosec: RT SearchSecurity: How to find a new #CISO position after getting fired https://t.co/QZ68asn0rQ,0
3178,need to find a job lmao lets see how long it takes before I am fired.,0
3179,Im finding new bestfriends 👌 all you hoes are fired 😒,0
3180,Im losing track of all the people who quit or have been fired.https://t.co/9IdAWF4znD https://t.co/9IdAWF4znD,0
3181,I am starting a petition to get mrs cook fired &amp; have @cbaddley020 take her place as the chemistry teacher,0
3182,My boss is interviewing someone for the position my friend had who just got fired Thursday. I want to cry 😭,0
3183,I am hereby finding every which way of @rhondamhartman fired. Bully for you bitch.,0
3184,I am Fired Up #Success #Fortune #Wealth https://t.co/xbxnL6C5id,0
3185,Some #USC players are finding out via Twitter that Sarkisian is fired. Position coaches also have texted their players.,0
3186,I am predicting Tom Coughlin to be fired following this season.,0
3187,That time when my lawyer released my case before I fired him... Now I am dead serious in needing a new lawyer. #help,0
3188,I am trying to get myself fired up to testify against Indiana SB292 - a huge TRAP law tomorrow am. @OhDianeMarie,0
3189,I dont know if my manager is kiddin or not but if she really just got fired I will look for a new job ASAP. No. No. No. NOPE.,0
3190,The manager made it clear she doesnt need/want me there after looking at a new job &amp; gave me the option quit or be fired. Why not be nc/ns?,0
3191,trying to figure out the best way to get fired so i can collect unemployment until i start this new job..,1
3192,My boss hired a new hostess named Kaitlyn. Like is this a sign? Am I gonna be fired?,0
3193,I dont know who decided to promote me to adult but they should be fired. I should be fired from adulting. The position does not suit me.,0
3194,I needa find a new job .-. I get bored af home. Why did I have to get fired -.-,0
3195,We need @SpeakerBoehner fired as speaker. He doesnt represent the Republican Party.  If he does then I need to find a new home. #SellOut,0
3196,Just fired up my GPS from 1999. New batteries and in 30 seconds it found a position indoors! http://t.co/gWZXkx2L2w,0
3197,Seeking a Maintenance Superintendent for Coal Fired Power Plant. Please call: 800-533-7977 x3 or email: dbeken@thinkingahead.com,0
3198,Can Prospective Employers Find Out My Last Employer Fired Me? via @forbes https://t.co/VOyvg8hvwF #humanworkplace,0
3199,I am retiring from being a sports fan. Sark needs to be fired.,0
3200,lmao omar just fired me I need a new job.,0
3201,My latin teacher either quit or got fired and my new teacher actually isnt a teacher and shes in college to become an english teacher...ok,0
3202,I got fired for organizing a union with my coworkers and it has been extremely difficult for us to find work. It’s not a good time to look for work https://t.co/FCCuyrYJV8,0
3203,Vacation has me wanting to get fired so I can live off unemployment for awhile.,0
3204,I am starting a protest at Broad Ripple High Woodys alma mater until hes fired. Who will join me?,0
3205,I have been tested and got fired.,0
3206,I got a new female best friend position opening cus @ZoyaMonay is EXTREMELY fired serious inquires only! Dm your resume😊,0
3207,Im seeing some different trump advocates. Maybe some were fired or quit.,0
3208,I have Quit been Fired and Retired! https://t.co/TRH9vaZ1tc,0
3209,I am positioning myself so that I can move in the full power of Christ. I am fired up.#boldness #christ,0
3210,well once again i have been fired from another salon.  i am new to hair cutting only having done it for a year and a half. but i think..,0
3211,I am hearing from sources that Dwight Howard has indeed signed with the Boston Bruins &amp; demanded that Claude Julien be fired.  #dwightmare,0
3212,I am visiting my graduate school #syracuseuniversity after 16 years. This is the first job I had in #usa at #dunkindonuts and I was fired in two days in the year 2000. Lol @ Syracuse University,0
3214,Currently seeking a whole new staffeverybody fired,0
3215,I am firing my personal assistant. He never does anything I tell him... #sorryPeanut #Dogassistant #fired,0
3216,I Was Fired From My Old Job 4 Days Ago And Already Have A New One,1
3217,I am going to have to hire a new personal assistant cause apparently getting ready for a football game is more important than me. Fired,0
3218,RT @CBSMoneyWatch: You made a mistake on the job and got fired - how do you address that when searching for a new gig? http://t.co/uEG0tQyx…,0
3219,Looking for a career in the fire service? Dont miss a chance to join a top-notch fire department! @PhillyFireDept https://t.co/Gz4ZZPTbya,0
3220,Rescue coordinator fired: Teton County Search and Rescue is searching for a new coordinator after longtime... http://t.co/C2LfL41BMd,0
3221,My 3rd new voter registration card this week came in the mailPanicked change of address filing online &amp; in person &amp; via phone has backfired,0
3222,I think I should add that I have not been fired. Theres just been some restructuring &amp; I will love my new responsibilities but miss the old,0
3223,I feel like everybody here is trying to push me out and pressure me into quitting so that they wont have to pay unemployment if Im fired.,0
3224,Looking for that perfect job? Download the BlazeJobs app now! #okcjobs #job #nowhiring #getfiredhttps://t.co/fSivfOKPmx,0
3225,I am rereading Voegeli while (watching the Return of The Mod Squad)  ... gets me fired up,0
3226,To be on Twitter or work. That is the question smh. Youre fired https://t.co/hvkqgoFBIF,0
3227,I dont want to find a new job but I honestly feel like I have no choice. Either I quit or get fired.,0
3228,I am dead ass never getting called back into work just to think I quit and in the end I got fired,0
3229,Today I searched for what does .45 ACP smell like after its fired. This job is weird. #amwriting,0
3230,In the process of finding a new college team...my top 5 is....1.Texas A&amp;M2. Georgia3. Auburn4. Texas5. Miami (If DC is fired),0
3231,If I have any adult industry friends looking for a new alias. Marcus Firedong. Please use it.,0
3232,need to find a way to get a certain someone fired from work this will be a challenge but i will find a way.,0
3233,By the way I didnt get fired or anything I was pretty much just informed that my position will eventually be dissolved.,0
3235,Ron Roenicke has the cachet to not get fired. Thus I am cheering for the Angels to fire Mike Scioscia and subsequently court RRR.,0
3236,How to find a new job after you were #Fired! https://t.co/00cYBo92Dr  #jobsearch #jobseekers #careers #careertips,0
3237,I almost fought a customer today tbh i was gonna beat tf outta him then i got threatened i would get fired.,0
3238,I got fired today then hired seconds later HA!! #MyLife,1
3239,Got fired on Wednesday got my job back yesterday and I work today haYesterday was my day off too so its like I was never fired at allMy manager hates me even more now I know it aha,1
3240,Gave my supervisor a evaluation today also I got fired today,0
3241,And the bitch I hate at work got fired today #yes,0
3242,Got fired today from a job I worked 12 yearsAfter getting shift covered for Sunday.All because I  working at a new job..,0
3243,I did a gig today where I got hired fired and rehire all in 30 minutes.,1
3244,I got fired today......,0
3245,Ahh first time i get fired..after like 20 jobs of never getting fired i did today lol and somehow i think its funny lol ohh well,0
3246,Nigga I been fired from 5 jobs had to quit from 3 AND my whole workplace got laid off today Im 20 homie fuck that you just gotta #Maintain,0
3247,I was hired on April 1st started on the 2nd and today got my first write up. At this rate Ill be fired before the 15th!,1
3248,Got fired today..,0
3249,I got fired today bcuz I didnt feel like working and I dont even care.,0
3250,Salty i got fired today lol Ill have a job bye tomorrow tho aint tripping,0
3251,I find it funny that I was fired yesterday and then rehired lol,1
3252,i got fired and then rehired haha,1
3253,Baby you are fired and your girl hired but if you dont mind ima keep you on call,0
3254,I was out of the office for a week and they hired like 3 hot guys and now Ill never know their names and also this tweet might get me fired,0
3255,@hm earlier this week I had an interview in soho. I wasnt hired I feel for personal reasons.. I was given a look and shared interview,0
3256,I was hired for GameStop and worked like 2 weeks and then the manager completely stopped communicating with me so I was like...fired? Idk,0
3257,Pizza Hut manager fired for closing on Thanksgiving rehired after backlash Personally i am against any shopping on this day. Dine in.,0
3258,Fired for the day unfortunately Ill be rehired tomorrow #familyfarmprobs,0
3259,I fired my Life Coach and hired an Inbox Coach. Look out email!,0
3260,Now Im being fired for making the bride cry instead of passing hor doeuvres as I was hired to do. Well if that dont beat all!!,0
3261,Apple Hires Burberry CEO To Improve Customer Experience: Earlier this week it was announced that Apple hired Burberrys CEO Angela Ah...,0
3262,I cant fire these guys. I hired them for 3 days a week and they just started showing up everyday. That was 4 years ago.,0
3263,Dead ass Macys must have hired me 5 time and fired me 5 times.,0
3264,I just got fired to get rehired as a cashier lmao,1
3265,Got fired for two hours then rehired. Wtff #NOBITCH I need to start looking for a new job,1
3266,Paula Deen gets fired for saying what rappers get hired to do.,0
3267,I remember My pinky Got slammed On By a Tote &amp; It Was Red &amp; Swollen . They fired Me 😂 Then Hired me Back The following Week 💀,1
3268,Quit my job last night got hired on the spot this morning.,1
3269,i got fired again today by Alex English. usually happens once a week. today ill bring him lukes lobster so i can get re hired...,0
3270,dude wtfffff my middle school principle was fired because she hired people without degrees and she robbed money from the school,0
3271,Bitch lied to my dad talking about she fired me cause of my attitude BITCH ya lying U FIRED ME CAUSE I WAS ON MY PHONE AND YOU HIRED TO MANY,0
3272,Photo: c4ss: A Tupelo woman hired earlier this month by a KFC was fired Monday after the franchise owner... http://t.co/a1DINJ9Iji,0
3273,I fired my bitch &amp;&amp; I hired her friend😜,0
3274,Got fired last week got hired this week lol,1
3275,baby you fired your girlfriend hired but if you dont mind ima keep you on call,0
3276,I hired my sister but now I want to fire her. What to do? https://t.co/RWkWuTlxOD,0
3277,Oh. My. Goodness. Kevins employer just re-hired the guy that they fired for the SIXTH time last week. How? Why?,0
3278,I got hired at a job last week &amp; quit the next day &amp; skipped two interviews that I had this week. I cant with myself.,1
3279,I was fired because Im trying to get hired somewhere else 😕,0
3280,Rick Tyler was fired by #TedCruz for dishonesty. Rick Tyler has been hired by @MSNBC.Talk about failing the fuck up.I hate everything.,0
3281,Austin Absher was hired earlier this week as Medora Community School Corp.s next principal.Read the story in Fridays Tribune.,0
3282,At a job interview this morning an employee peeked around the corner and mouthed YOU DO NOT WANT TO WORK HERE. I was hired. #badsign,1
3283,Natasha got fired and I got hired,1
