id,text,is_hired_1mo
0,I just got laid off I think I cried a little inside... worked for this company for so long....,0
1,Laid off and had to sell my 2 tickets to @Pink! Show so I could pay rent. Ill never take a state or city job again!,0
2,I wasnt fired from my job I was laid off. You wouldnt know the difference.,0
3,I feel like I lost my job. I didn’t get laid off but I came there for the culture a culture that was obliterated over ten minutes.,0
4,GOT LAID OFF FROM MY JOB 2 WEEKS AGO AND I WAS KINDA SAD but thank god bc now Im doing photo work for Drais beach club,1
5,I was laid off from my last job a year ago tomorrow. It was surprising and scary. Im forever grateful to those that took the time,0
6,I was laid off with a severance package-so of course that softened my blow. But I was unemployed nonetheless. Ive never relaxed so well.,0
7,So I was laid off today (1 of 3 employees)..... But this right here makes me forget how much this… http://t.co/BbUMa7rB5L,0
8,I WASNT FIRED I WAS LAID OFF BUT YOU WOULDNT KNOW THE DIFFERENCE,0
9,My parents both worked in the mortgage industry &amp; got laid off the same day in 2008. We almost lost our home. Guess thats just business https://t.co/F3QirFTSL0,0
10,I just got laid off had to drive home in rush hour traffic and my car broke. Fuck you too life.,0
11,I had one job that I worked my ass off for before and made good money. got laid off now I work two jobs that are bit easier that I match.,0
12,I wasnt fired from my job. I was laid off!,0
13,@pixelatedboat Me: And in this scene Marnies boyfriend eats her assLaid off auto worker: I lost my job and my friends are all dying,0
14,I thought I was going to get laid off. I had plans for those unemployment checks lol.,0
15,Today my dad was laid off with no warning from a job he had for over 20 years. And people think starting a business is risky.,0
16,I wasnt fired from my job! I was laid off!!! But you wouldnt know the difference! #stepbrothers,0
17,I was recently laid off by a large bank. Today they sent me a credit line increase and some fake CC checks. Dont they know Im out of work?,0
18,jesus christ: recently laid off tesla employees are publicly thanking elon musk after losing their jobshttps://t.co/l3JQBXqnNy https://t.co/iEV5xNDX3r,0
19,Being laid off sucks but it was more like jumping ship knowing it was about to sink lol. Yeah I will be fine. It is easy to lose a job.,0
20,Worst Places in the World to Be Laid Off and Lose Your Job? U.S. followed by Switzerland http://t.co/B6FwBYV1 via eFinancialCareers,0
21,One of my parents friends just got laid off today... I know I complain a lot but Im so grateful for the job I have. Even tho it part time,0
22,So rumor is that 300 people are getting laid off at my job site tomorrow. Wish me luck the I survive the cut.,0
23,I wasnt fired I was laid off! You wouldnt know the difference!,0
24,Everytime I lose one I bounce back with 2 how you think I got you somebody got laid off...,0
25,Laid off in my graphics career so took job cake decorating cant even pay bills. Just wanna know why is there no @taylorswift13 cake kit?!,0
26,officially starting may 11 at my new job wooooooo. i got laid off early feb and this new job seems like a step up in a lot of ways.,1
27,Now that my co-worker got laid off work goes by even slower lol,0
28,Recently laid off? Download my complimentary workbook to move from panic to purpose! https://t.co/6YlKiAjjTv,0
29,So my least favorite boss ever now works for my least favorite employer ever where my whole ex-chain of command got laid off. #ILove2014,0
30,Well my first week being laid off I have no idea how I ever had time to work.  This week has been crazy busy with lake trip &amp; garage sale.,0
31,Recently laid off? Download my complimentary workbook to move from panic to purpose! https://t.co/iripWgSHcz https://t.co/Q1yFX9o5Mu,0
32,After 4 months of unemployment (being laid off sucks) I was going to celebrate 1 week of my new job by buying myself a ticket to see @OldDominion @TheBigEFair since I haven’t see them since last September at Foxwoods. Just went to the website and the show is sold out!  :( 😭,1
33,Its been 8 years now that I got laid off from my corporate job at Dell Computers and started what Im doing now.,0
34,Met an ex-co-worker last night and heard that there is another round of laid off coming next week at the place I used to work (for 21 years),0
35,I got laid off two weeks ago now I got another job # All can do is thank God,1
36,Funny how its now a year to the day I got laid off from my old job. Just thought of that while @ work earlier today. #lifeisacircle,0
37,I just got laid off from the warehouse I work in. Anybody know of any warehousing temp agencies prefe... http://t.co/WqMS3k21Vm #reddit,0
38,Suuurrrrrree I couldnt get laid off 3 weeks ago BEFORE I bought my new car. #unemployed #hireme #job #FML,0
39,Start my new job 6/30. Havent worked in an office in 6 yrs. Laid off 2 yrs ago...and worked from home the 4 yrs prior.,1
40,Recently laid off? Here’s a few reasons why...http://t.co/bTb2umHpi6 http://t.co/ZGQVh2CfP3,0
41,Bad news: laid off from my recreation position. Good news: I was offered another job at the same building. Less hours but its a job.,1
42,Next time I get laid off or quit my job abruptly I’m totally going to start an Unemployed Blog. Seems like the perfect topic for a blog.,0
43,Ill check this out within the coming days because Ive been terminated laid off and or locked out from my previous job. Thank you benefits,0
44,Just graduated college and got laid off before starting work. Not sure how to maximize my severance package - https://t.co/n7fgL3fDFR #tax…,0
45,Dec is 4 yrs since I was laid off as a paralegal started accepting advertisements on my blog before that I only ran charity ads pro bono.,0
46,Ever since the sr. Director was laid off I feel like my job has become real. Need a raise naow!,0
47,After being laid off in 2009 I walked into a Manpower office.  Today I have worked in that office staffing for over 5 years #myworkmystory,0
48,My Mom just called to wake me up and tell me that my bro got laid off. And asking could I do his unemployment wtf. Ugh.,0
49,Well got laid off from the job and love Madpack so lets give this streaming thing a try. http://t.co/1OyR5N2sou. Stream starting!!!,0
50,Since being laid off at least 3 people have quit. Work is piling up. Im wondering how long it will be before my phone rings.,0
51,My grandpa worked at Cessna for the last 53 years without getting laid off and he also only has one hand. #Badass,0
52,21 year old and I recently moved out now I may be getting laid off? - https://t.co/n7fgL3fDFR #taxreturn #taxes #taxrefund #personalfinan…,0
53,I got laid off from three internships... and I dont regret it! I have the dream job of any one of my classmates right now! #ItGetsBetter,0
54,2. I was laid off from my BRAND NEW job Thursday. I havent fully processed that yet.,0
55,Well my dad just got laid off. Im now the only person with a full-time job in the family. That means Im getting old.,0
56,Wow great economy I have just been laid off my second job this year. #Obama #economy,0
57,Well Ive just been laid off two months before I was supposed to leave my job anyway. Anybody have openings?,0
58,With recently being laid off I now have the opportunity to go to London for 14 months!,0
59,My former bosses—who had me laid off for trying to work from home one day a week to get therapy that I need—stalk then block me on Twitter.,0
60,About to be laid off from receptionist job at hair salon (going out of business). Rethinking my life. Suggestions/advice/mockery welcome.,0
61,Was just laid off due to the company closing.  Ive got 4.5 years of assisting experience. @taylorswift13 need an assistant? Insert panic.😩,0
62,I got laid off from an IT job and became an #UberDriver instead of going back to a 9-to-5 office job. One of the best things Ive ever done,0
63,So I just got laid off work. #sucksballs but hey it just a job,0
64,Crazy how I got laid off just last week &amp; got a new job already,1
65,So I got laid off of from my job a couple weeks ago. A first for me. I was upset and a bit stressed at first of... https://t.co/3FArucZPX3,0
66,My dad got laid off last week. Got hyped up by the hiring manager for new company taking over for the old and ended up not getting the job.,0
67,Today is the one-year anniversary of when I got laid off Im going to celebrate by working at a restaurant.,0
68,My boss isnt going to let me forget that I took time off last fall (for family reasons) expect to get laid off at some point.,0
69,I share how I got laid off and started my business with @gjhickman on @leavingcorp #podcast http://t.co/5hVJBqD9G8 #success #entrepreneur,0
70,hmmm to become a full time streamer since i got laid off? hmmmmmmmmmm yeah right better off with selling my body.,0
71,8 Years Ago… I woke up unemployed: 8 years ago I was laid off.  Friday the 13th was my last day at my job (get... http://t.co/p12SAfGOtP,0
72,In a matter of two weeks my boyfriend and I have been laid off of 4 jobs. Aint that something?,0
73,I was laid off last fall. My heart goes out to those laid off from @IrrationalGames recently.,0
74,I Just Got Laid Off … Now What? http://t.co/gqVcv99got #jobsearch,0
75,I got laid off at my last job from trying to play hero give a fuck about no work problems cuz.,0
76,Today is the one year anniversary of getting laid off from my last job. Today is also the day that I hit 5 figures in MRR on Credo.,0
77,I got laid off 3 days ago and I still havent received my final paycheck. You better believe Im about to get paid for those 3 days!,0
78,Permanently laid off from my job jumping in to my own business! WEEK 1 UPDATE via /r/Entrepreneur https://t.co/WT40E9r96J,0
79,At work. Im inspired by ex-Twitter employees helping recently laid off Twitter employees find work. That should inspire everyone #DemDebate,0
80,I got hired as a camp counselor for short term teaching chorus and adventure time at Camp Waldemar!!!! Today is good. God is good.,1
81,Got hired and unhired because I tested positive good morning,1
82,I got hired at 2 places.. God is so good yall,1
83,My best friend got hired to her 1st job today woot woot !,0
84,Got hired at a bank life is good,1
85,8 years ago today I got hired at Arundel Lodge. That seems impossibly long ago.,0
86,I got hired to cook fathers day dinner tomorrow...cuz Im nice in the kitchen.,1
87,Went job hunting today and the 1st place I went was boca tanning I got hired on the spot without even filling out an application☺️ #yayme,1
88,I went on a job interview today and broke my sandal and had to duct tape it to my foot so if I dont get hired someones buying me new shoes,0
89,Got hired in as a full time custodian today at a college. #IFeelHappy,1
90,I got hired and quit in the same day,0
91,liz &amp; i got hired at 2 diff places today &amp; were like ok let me use ur discount &amp; u can use mine ok ?,1
92,Got hired on the spot. God is so good to me,1
93,Today I got proletariatainized... Got hired on permanently at a company.,1
94,I got hired for 2 jobs today knowing damn well I dont like to work....idk which one Ima take,1
95,Walked into polo to shop but instead I got hired again when I wasnt planning on applying today #idiot,1
96,I got hired at Chulas today...,1
97,I just got hired and today is my first day and I already really dont wanna go to work,1
98,Got hired on the spot &amp; some random guy took the dent out my car for $20..today a good ass day lol,1
99,I got hired 4 Jamba Juice God is Good,1
100,I may get hired back at Apple again spoke to my buddy who is a store leader over a store and hes considering hiring me back again,0
101,I got hired at Safeway today (*^o^*),1
102,Got hired as a music sales rep today so entirely expect my life to get much more Mad Men-y,1
103,I had a job interview today baby and i got hired start work in the morning @DVP387,1
104,I JUST GOT HIRED ON THE SPOT AND I ALREADY LOVE MY BOSS HES SO NICE OMG I LOVE STARBUCKS,1
105,on a brighter note I got hired today so Im stoked n I start tomorrow,1
106,The Macys I got hired at is on a spree apply if you can,0
107,So I got hired @ this financial service place &amp; I already quit today.,1
108,Hey guys I just got hired at starbucks,1
109,I got hired on at 8.50,1
110,Yesterday I applied everywhere within view saw the worlds end slept for 3 hours got ready for an interview hired on the spot.,1
111,Ya girl got hired to cocktail and possibly bartend at one of the busiest bars in town will I finally be out of debt?? Well see,1
112,my g/f lost her job so today she was hired by me to moe the lawn. I feel really good about this.,0
113,My boss at Shelterwood (Dillon) who re-hired me quit. Yesterday was his last day. Weird.,0
114,lost my job today which sucks but a friend hired me right away to watch her twins starting tomorrow. So tomorrow is a beach day!,1
115,Lost my job yesterday. Jus got hired again LOLLL,1
116,i got 107 likes on an instagram photo of a bike so i hired an agent and quit my job today #NeverGiveUp,0
117,Yesterday I hired move-out cleaners for my SF spot and I ended today drinking a beer in my shower in Oakland. But the story is not all win.,0
118,Today I had to do math for work. MATH!!!! They hired the wrong person...,0
119,I aint never have a job fire me then my block came and hired me ...,0
120,Quit my job last Monday and got rehired again today. Woo! So long unemployment,1
121,I think I just got fired 3 times but rehired 4 times. My heart cant take this!,0
122,My cat fired me. Then hired me back the next morning.,0
123,Today I was rehired for my job! :),1
124,Today I hired a new accounting firm and fired two rather incompetent individuals. They screwed me over but I still feel bad for firing them.,0
125,Quit my crap job yesterday today I got hired at a restaurant opening in March. #favor,1
126,So I got fired today and then rehired.. Fuck you Im fired. Im out,0
127,I found out by DCI agent Stevens Mr Bass did not lose his job in fact was hired as a cop????? Stalker a cop?????,0
128,Craziest thing happened to me today..i lost my job..then got hired by another one an hour later..pure awesomeness,1
129,Lost a shift at work because they hired new classifieds okay but I still need that money sooo..,0
130,I just fired my ⛽️ man and hired a new one,0
131,Today I hired someone wrote someone up and fired someone...who am I 😂,0
132,Today I was hired back into the food business. Yay. Aug 2 cant come fast enough. I just wanna teach my 5th grade hooligans,1
133,good news: I made $20 busking today. bad news: novelty store that hired me part-time unhired me before I started to hire back old employee.,1
134,whats funny is the job i had today wasnt even mine the guy didnt show up at all i just took over &amp; the designer hired me #blessed💃🏽,1
135,This is an open letter to employers who never hired me - Today I bought donuts for the office. Your loss.,0
136,God moved all week .....I hired someone to help me ....I got more contracts ....all because of God..... I let the security go today ..,0
137,I quit #mydunkin got rehired by #mydunkin then got fired by #mydunkin,0
138,Another job called me and I am hired I aint get to call them back yet,1
139,The person that hired me just quit today.,0
140,Almost broke a fax machine AND copy machine today... How am I ever gonna get hired after I graduate,0
141,So today my manager told me she hired me because of my hair..,0
142,So the boss that fired me an  2 hours before mania for no reason and rehired me the next day is in deep shit w/ the cops. LOL,0
143,work called today wanting me to help with ship from store.. I swear I was hired as a cashier not apparel yet i do everything but that..,0
144,My job fired me and just hired me back wtf is my life 😩😂,1
145,today my lease started on my #chicago apartment and they hired my replacement at work. i think im really leaving,0
146,I then walked out the same job I got rehired at... I feel kinda guilty,0
147,Some dude quit I took his place since then they hired me and Im the ONLY one who fixes computers. I should just start another business,0
148,I didnt get fired but I just got hired.,1
149,I bet I fucc around and get hired by somebody today aha I feel it,0
150,Today in a nutshell: hired 1 person fired 1 person altered my job description again ate 10 pieces of chocolate cried 1 time.,0
151,Fired someone today. Hired someone today. I still feel like I came out ahead.,0
152,my job hired some grown ass white girl who is next level obsessed with horses how do i get her fired,0
153,I had one job then they fired me then a drug dealer came and hired me,0
154,Husband lost job right after being hired  financial options? #financial https://t.co/6xB08pgFEQ,0
155,Monday is the stupidest day to work.. every since I got my friends hired I been working the stupidest shifts.,0
156,When I told my boss I was quitting he was like wow I was the one that hired you yup and youre the one that put me in the back today 🙄,0
157,Ugh after my work hired and Amish person I really didnt think it could get any worse. I was wrong after seeing what they hired today...,0
158,My mommy went to an interview yesterday got the job on spot went to another interview and got hired on spot as well. 👏🏽👏🏽👏🏽😁😁😁😩😩😩,0
159,A woman approached me today holding a kitten while I was pumping gas. Asked for a job and said she was amazing at coloring.... hired!,0
160,Hated work today tho. I hate my supervisors but love get paid weekly,0
161,Girl we got hired the same day go ask someone else and let me do my work GEEEEEEEEZ,0
162,The fact that i got work today &lt;&lt;&lt;&lt;,0
163,Today I worked then got an oil change and my tires rotated and ran errands and I think Im adulting maybe,0
164,I came to dance and literally got hired to work here lol my first day is today Im FR LIT 🙌🏻,1
165,My uncle died today then my car gets stolen. Why cant people work for their own shit for real!,0
166,Got interviewed and hired and worked all in the same day. #EMPLOYED,1
167,I got a raise today then showed up to work 30 mins late..,0
168,Yesterday no one yelled at me today 1 supervisor on phone asked for my supervisor another customer said I was boring him to death #work,0
169,I worked from home today........Ok ok I lied. I worked from the mall 󾌱󾌱󾌱 I worked so hard I got home and pass out. 󾠣󾠣󾠣,0
170,I got wrote up today for being 5 minutes late 2 weeks ago I work for the most ignorant people,0
171,Haha I get paperwork yesterday and today they call me to come in because Im getting an award,0
172,My shift got cut today sooo no work for me I get to be lazy,0
173,I worked 7-3 today got off went to class when I get out of class i go back to work 11-7 then back to work at 3-11 tomorrow,0
174,today at work my boss wrote me up then I got a promotion offer,0
175,Today I went to the Home Depot and omg was I lost I couldnt find what I wanted and couldnt explain to the workers lol,0
176,Today at worked I served a man who a tattoo of the converse logo on his neck ??!!! And only had $100 bills in his wallet,0
177,So today i got car sick had a boring day at work had to take a 2 hour bus ride home in the middle if the night &amp; said bus was an hour late,0
178,today i served on a jury for 7 hours and then went to work for meetings and now am doing laundry okay who wants my life no clamoring!!,0
179,The news I got today at work &lt;&lt;&lt;&lt;&lt;,0
180,I got to have a productive day today I been doing nothing but hooping but I got to get this work together and apartment together,0
181,In two different stores today other customers asked for my assistance like I work in the store...,0
182,So today at work this blackguy was starring at one of my managers ass and he saw me laughing ran over to me &amp; gave me $3 to not say anything,0
183,Came to a call center today to apply and I got in! Training for 2 week at over 9$hr &amp; after 45 days of working it goes up to 10$! 😍😃😁🙏,1
184,Today I got called a worthless piece of crap that will drop out of college bc I didnt put enough ice in a residents iced tea at work,0
185,Its a good day working at Chipotle is awesome and I just got hired at Jamba,1
186,I told work I couldnt come in today on Sunday and they called me asking why I wasnt there??? I told 2 managers I couldnt come jeesh,0
187,I worked yesterday I worked today I work tomorrow I work Saturday I work Sunday and I work Monday,0
188,Work was amazing today put in 12 hours and got 3 leases today on my 3rd day!!,1
189,They had me on service desk to working the book to the door from self check to a register.. I worked today,0
190,i got hired on the spot by Mister E...or just E the finance guy who worked at HYundai Mazda and @HarrelsonNissan ask tre about E,1
191,I got hired thinking everyone that works here is super professional then i find out everyone is FUCKING EACH OTHER LOL,0
192,Long day work today I worked overtime so i got out at 12 am,0
193,Good day today just got off work found out i got paid early and best of all spurs re signed my favorite player @Patty_Mills  yeahhhhh!,0
194,I did 10 hours at work today then went an sat for another 10 hours getting my hair done&lt;&lt;&lt;,0
195,My coworker was mad today bc I got to leave early bc I was sick. She leaves early all the time and then complains about not getting hours..,0
196,Well I came into work late. They gonna fire me. I can feel it!!!! WHO HIRING,0
197,Today a customer came up to where I work &amp; called me stupid insulted my boss &amp; said racist slurs to my co-worker. Good times,0
198,Today I lost my dog my best friend. Coupled with losing my girlfriend and stuff going on at work its been the worst couple weeks,0
199,Today I ripped off my eyelashes. I lost my car keys. Lost my card and my moms card. I get out of work at 5 but  I have my last class at 5,0
200,.......and i lost all the work i did today,0
201,Lost my hat at work and my manager got in a car accident today I have to tell him tomorrow that I lost my hat I wonder what will happen.,0
202,After Obama taxes that are taken out for the poor and worthless I lost money working today... Coolllllll,0
203,I lost my wallet I got a flat tire &amp; had to come in to work &amp; people are just assholes today. ugh.,0
204,Now Im kinda happy I worked made some money while I lost some today,0
205,Today I lost a coworker carpool partner gym buddy and close friend. RIP@grandmoff,0
206,Today I drew something at work &amp; nigga threw my shit away. Ironically when I checked everybody nobody knew what happened to it,0
207,Today when I got off work I could not find my keys ANYWHERE. &amp; since I worked at an event I was scared I lost them there,0
208,Lost my keys at work yesterday too &lt;&lt;&lt;,0
209,Today I tried to spit out mouthwash in the grass but it all went in my hair &amp; if you think I washed it out before working 7 hrs youre wrong,0
210,So I had to work yesterday from 430 till 1030 and then was driven home at 1230 and need to go in from 630 until whenever and no sleep,0
211,I lost a coworker today too...I am reminded how truly fragile life is today,0
212,one of my co workers moved out of country a while ago &amp; he showed up out of no where today &amp; surprised everyone &amp; I almost cried,0
213,I am losing my personal desktop printer at work today so I am going on a printing spree - who wants the screenplay to Sharknado??,0
214,Today I literally died getting out of bed so I wore yesterdays make up &amp; hair &amp; when I got to work my boss still said I looked nice #win,0
215,My English teacher lost all my Fucken work.....,0
216,today I had a me day so I bought myself coffee got my nails done worked out &amp; now Im doing a face mask &amp; Im ready to take over the world,0
217,Lost my dad suddenly at 59 few years ago. I worked 2 days later. Bradshaws dad died at 86 and he cant work biggest day of year. Unreal.,0
218,Lost my favorite Uncle today to cancer. He was so awesome worked for dept of forestry all his life &amp; was a great husband &amp; father.,0
219,Lost my wallet today and yungboi at the gas station near my work held onto it for me. Good ass kid didnt even take a cent,0
220,My sister Iris lost her house and everything she so worked hard for in a fire today even their dog. Thankfully her &amp; my nephews are okay,0
221,lost my debit card yesterday and had no clue where it was. come to find out my sleepy ass left in it the work fridge... THE FRIDGE.,0
222,So today I worked a 9 hour shift and I lived and now I feel like I can do anything,0
223,Today I slipped right under a truck twice at work and busted my ass.... i came home looking like I fought a hippo,0
224,Today I worked at 7:45am then chased my dog in a park because she slipped through her harness &amp; ran away from me so thats how my day went,0
225,My old coworker lost her fiancé &amp; the father of her child yesterday in a car crash.,0
226,Yesterday i lost my wallet dropped my phone in the bathtub &amp; everything ive worked on in the last 4 months is gone. LIFE,0
227,Well today fucking sucks and I lost money snow plowing... How does that work?,0
228,Today at work someone came through my line &amp; said hello how are you then handed me Adeles album &amp; I lost it,0
229,today I called my dad &amp; he had to get back to work so I called my mom &amp; she set the phone down &amp; forgot she was on the phone SO theres that,0
230,So I worked today with a fever and I wanted to die/go home I kept going in the bathroom and just sitting there in the stall,0
231,I am not feeling work today what so ever.,0
232,Today I lost homework scoured campus for my keys and fought with a team. But @NEEDTOBREATHEs live album came out so everything is fine.,0
233,Today a Rabbi said I must not have a life because he found out my work hours...hes right &amp; probably has more of a life,0
