id,text,is_hired_1mo
1114,I am job searching for: Work at home jobs! http://t.co/4tgcXWg6JK — Walker Inklebarger (@Walker_marocliv.... http://t.co/2Krzj9OxCV,0
1115,I am searching jobs in New Jersey on http://t.co/rwQS6slTU4,0
1116,I am searching for a good job but i am not getting it .i am already 29 yrs and i dont know wen i will http://t.co/xeAPAYWQPu #pray #prayer,0
1117,Searching for a new career? Visit our open positions today! http://t.co/JAV4yVgPA3 #MilwaukeeJobs #Jobs #Milwaukee,0
1118,I am job searching for: Work at home jobs! http://t.co/4tgcXWg6JK — Walker Inklebarger (@Walker_marocliv.... http://t.co/Vdm4dkCNzU,0
1119,I am looking for a job as property manager as part-time job.Let me know if you have something,0
1120,I am job searching for: Work at home jobs! http://t.co/4tgcXWg6JK — Walker Inklebarger (@Walker_marocliv... http://t.co/BySThx8jDz,0
1121,I am job searching for: Work at home jobs! http://t.co/4tgcXWg6JK — Walker Inklebarger (@Walker_marocliv.... http://t.co/R7ZDddAHBm,0
1122,I am searching jobs in New Jersey on http://www.employmentladdercom,0
1123,I am job searching for: Work at home jobs! http://t.co/4tgcXWg6JK — Walker Inklebarger (@Walker_marocliv.... http://t.co/7XD2J95J3X,0
1124,I am job searching for: Work at home jobs! http://t.co/4tgcXWg6JK — Walker Inklebarger (@Walker_marocliv.... http://t.co/prNqkTD5sJ,0
1125,I am looking for a new job. give me ideas,0
1126,I am getting a job as a trader on Wall Street and buying a house in New Jersey. Also I have found Jesus.,1
1127,I am seeking evening/weekend job opportunities. If you know of any available I would greatly appreciate it if you could send them my way.,0
1128,Yes I am sending resumes and filing out job applications on Christmas.,0
1129,Well today was the first time in my working career that I was fired laid off I mean furloughed due to the #governmentshutdown. Smh,0
1130,Got laid off today. No warning. Sigh. Im really screwed now. #fml #unemployedlife,0
1131,Yay I got laid off today! I get to freelance now. #freedom http://t.co/0dYs8X4P7s,0
1132,I got laid off my job today. If anyone knows someone looking for a social/digital marketer with a can do attitude in the LA area hit me up.,0
1133,So I got laid off from toys r us yesterday and hired at chipotle today. #TYBG  🙏🙏🙏,1
1134,Talking about my sister my dad says no she didnt get fired she just got laid off while they were hiring LOL,0
1135,Got laid off from my day job. (makes jungle),0
1136,Today I got 5 followers 10 RTs and 20 favs on a single tweet about limp bizkit but I also got laid off so balance is restored I guess,0
1137,Got laid off today....got a lot of time on my hands I guess. #layoff,0
1138,Today: I got a raise to $15 an hour!Tomorrow: I got laid off. #ThankaDemocrathttp://t.co/IClVMKl2pw,0
1139,I just got laid off today from my first job Ive ever had its weird,0
1140,I got laid off from work yesterday need a job asap near Indianapolis IN can start tomorrow need help #jobless #helpneeded,0
1141,damn 2 niggas got fired today 7 got laid off. shittttt I wish that was me! lol,0
1142,Ppl today get laid off and then sit on their ass for months collecting unemployment.. What happened to getting laid off and getting a JOB?!,0
1143,Got laid off yesterday. Non stop job hunting today. -_-,0
1144,My coworker got laid off today... I fasho dressed up today and was on time lmao,0
1145,Two people got laid off today. Im sweating my job right now.,0
1146,I got laid off today and I angrily played need for speed most wanted for 2 hours to cool off,0
1147,@jettward I got hired laid off hired laid off...over and over again. then we saw the mills go. we knew it was over then.,0
1148,Today I got a 95% on my college algebra exam then I was told that I didnt have a check and I got laid off my job :( What a day!!!!,0
1149,Oh uh to clarify I didnt get laid off today. I left in the summer Im just now getting my shit together to find new employment.,0
1150,Exactly last month I was laid off. Today I was called and offered 2 jobs on the same day. #Blessed,0
1151,well I was laid off today because the season is over so looks like its back to job hunting for me,0
1152,I wasnt fired I got laid off you wouldnt know the difference,0
1153,Got approved for a new car today then got told I was going to be laid off just got a call saying since someone quit I get to stay. 🤷🏽‍♀️,0
1154,Boy oh boy...havent been on here in awhile. Not since I got laid off and am now forced to deal with real life shit. You employed bastards.,0
1155,Got laid off today. #OnTheBrightSide I have more time to write! #BangOutABook #NaNoWriMo2016 #amwriting #PB #MG,0
1156,Today I got laid off but at least things in this ARG are really heating up. #ingame,0
1157,Just got laid off whose hiring,0
1158,Got laid off today. My company couldve done it so much better. #movingon,0
1159,So shocked hearing my boss who is also my cousin got laid off today from the Taj. Put in 20 good years and they dont care.,0
1160,Got laid off today fml,0
1161,Yeah I got laid off today because of some faggot dooshbag that turned into a bitch.,0
1162,Well today just became the worst day ever. Got laid off my job due to budget cuts. #BrokeAsAJoke,0
1163,Got laid off today. Kinda wanna die now. Am I being a debbie downer? :(,0
1164,I Got laid off today 🖕🏻 https://t.co/kevVjENAby @gifboomapp #gifboom,0
1165,I got laid off today sucks!!,0
1166,Got laid off today... bittersweet... not! Now I cam focus all my efforts on Real Estate! Lemme know how I can help you!,0
1167,I got laid off the day before Champs man Ive been using my unemployment to make sure that Niagara &amp; Anaheim went well. @EnD_Lanneerrr,0
1168,Got laid off and rehired by the same people as full time 1-2 weeks later..,1
1169,In other news I got laid off today. #ayyyyyye,0
1170,I got laid off today. Im fuckedddd,0
1171,I got laid off today.  Im ready to persue makeup.  Chicago beauties...any job leads?,0
1172,30 people were laid off today at my place of employment. To say today wasnt tough is an understatement,0
1173,@HireHeroesUSA forgot to tell you guys that I got laid off from My Eye Media about two years ago right around the time I asked for a raise.,0
1174,Got laid off today. If 2016 could stop trying to crush my fucking soul...I would be so grateful.,0
1175,I had an employee tell me today that they don’t care if they get laid off because unemployment will pay them $300/week. #americanway,0
1176,Just got laid off? Need work?  Come to Express!!Apply today- work tomorrow 503.654.3600,0
1177,TODAY.TIME 2 FIND A NEW THERAPIST. MINE GOT LAID OFF BECAUSE OF BUDGET CUTS. REAL BUMMER CAUSE WE DID ART THERAPY &amp; I THRIVED!! BN,0
1178,One year ago this same time I was laid off from my job. Today Im thanking and praising God for not 1 but 2 jobs. #wontHedoit,0
1179,Only thing good about today: The tech reporter got laid off 10 minutes before I did.,0
1181,Also 7 yrs today since I got laid off (aka I missed too much work). Luckily I went on State Disability &amp; SSDI started from that day.,0
1182,Yesterday my employer laid off 10 people. Coming in today felt like heading to a funeral.,0
1183,Got laid off today.  Maybe Ill be negative in weeks/months ahead but today I am enjoying being out of that place.,0
1184,So the company I do freelance for stopped production and I got basically laid off this week but Im going to start working fulltime at regular job and just asked for a big raise today so ¯\_(ツ)_/¯ well see,0
1185,2 weeks ago I got laid off 2 weeks later I got 2 jobs paying more than the one that laid me off! 😁😳,1
1186,I feel #determined today idk why. I am ready to get things done. I am so over this laid off shit!!,0
1187,A year ago today I got laid off from Cheez. Yay?,0
1188,Good news bad news time. Bad news I got laid off from one of my jobs. Good news just got a  position at one of the 8+ Gamestops near me,1
1189,Sweet jesus they laid off so many people today I am 100% lucky as fuck to still have this job and to have gotten a raise at all.,0
1190,Got laid off today almost like they knew how far behind I am on Mad Men.,0
1191,Ironic I drop the #EAT today and jus got laid off from my job..,0
1192,Got laid off 4-5 weeks ago waiting on new@job for training. Have benefits to collect.,0
1193,84 people got laid off at work and my name was originally on the list until my supervisor told HR hell no.,0
1194,Just got laid off from my job today. :(,0
1195,Just ran into my neighbor he was laid off over 2 years ago still no job his wife works at Allstate 25+ years also laid off today 75 total,0
1196,Today I was laid off the day before I was going to put in my two weeks notice. My wife brought me home this! - #Pics https://t.co/KVcmqtbdkI,0
1197,@LetGoBeFreeDoU.I know I got laid off not fired but w/ all those office jokes I do here abt getting fired really shows the irony in life.,0
1198,Got laid off today. The Oilfield industry is brutal right now. Time to find a new job 😔,0
1199,Yes I Got Laid Off! Thank Goodness For Severance Packages - http://t.co/56o9gOiU8c via @FinancialSamura #Yakezie,0
1200,My co worker got laid off :(  I want to cry.,0
1201,Sorry to the squeenix people that got laid off today. :( ArenaNet is hiring! http://t.co/bNRvyeZkkg,0
1202,A year ago I was laid off by an evil VP. Today I got an awesome job review. Same company. I’m still me. Hmmm.,0
1203,Today I was laid off from my ultrasound job due to cutbacks. But its all good bc Ill be at the @jakeowen concert next Thursday!!,0
1204,Ok got laid off.. Who needs a computer techie?  #unemployed,0
1205,Got laid off today :/#work,0
1206,got laid off today #LoL #WTF DRINK A #Beer for #Dinner,0
1207,So you were laid off or fired via Couponing 4 You - So you got laid off or fired today all these ... http://t.co/hr8vFz57nr,0
1208,Yesterday I was laid off. Today I played with my kiddo talked with a TON of people am sprucing up my resume coffee meeting at 2. #islay,0
1209,how uu think i got uu somebody got laid off,0
1210,Great Place to Work Institute posted a job you might be interested in. Senior Sales Account Manager - Greater Ne... http://t.co/jCGSILVsBv,0
1211,Heres an opportunity to work for a family owned company doing great things in the marketplace. https://t.co/98X1pfuwUG,0
1212,You might work in social media if anyone you meet under the age of 18 is subjected to an informal interview about what social networks...,0
1213,Amazon Lab126 posted a job you might be interested in. Software Development Engineer - Framework - San Francisco B… http://t.co/DbY9m0pug1,0
1214,RT @continimarco: InfoCert posted a job you might be interested in: Engineering Talent Network - Italy IT.,0
1215,Here Is An Opportunity For You To Earn Additional Income Without Any Investment. You Can Work From Home O... http://t.co/WQLOPR9rmQ cssp,0
1216,Is your congregation doing working to fight poverty? Here is a grant that you might be interested in.... http://t.co/U38ntWkeRG,0
1217,And heres a petition you can sign to support precarious workers and unpaid interns in Canada! http://t.co/dbKvUiS4Iy,0
1218,Here is a business opportunity that works - http://t.co/6sN4Vn5fk5 - DO NOT GIVE UP! http://t.co/V8mqu2UTT4,0
1219,Interested in Real Estate Careers? A networking event you might attend is 4/11. Register: http://t.co/Ya4Dfnr6S7 http://t.co/48vr4CWO2d,0
1220,Great Place to Work Institute posted a job you might be interested in. Temporary Financial Controller  - San Franc… http://t.co/YTb5NWVa4p,0
1221,Hey LinkedIn just FYI all the jobs that youve ever thought I might be interested in are way way off the mark. Keep up the good work.,0
1222,Heres a #free #workfromhome opportunity. You have nothing to lose and financial freedom to gain! http://t.co/6awhtL7PS1  #makemoney,0
1223,You might work next to a fellow Tulane alum and not even know it! Find each other with Green Wave @ Work http://t.co/DiSE6oouz2,0
1224,If youre interested in working at @jump  you might be interested in this response to one of our challenges.,0
1225,Here is a great part-time opportunity to work with a fantastic team! https://t.co/EB75E59hda,0
1226,Hi Moms - heres a work from home opportunity I think some of you may be interested in! Hulafrog is looking to... https://t.co/Q6LcMQmmtn,0
1227,Heres a great opportunity for someone with a strong hunter mentality who would like to work at a company that... http://t.co/7nQHJtNcIY,0
1228,Interested in working in the energy field? Heres the job fair for you! RSVP now for Thursdays job fair &gt;&gt;&gt; https://t.co/8PChRwTLhG #OYP4DC https://t.co/Tu0cu2WM0U,0
1229,Heres a paid opportunity to work with smart nice people and write for feminist media! https://t.co/tbmymJQCYC,0
1230,You might be keeping someone else from what they love to do while you spend pastoral hours doing admin work. #getanassistant,0
1231,We are currently looking to hire someone to work nights(4-8:30) and weekends! If you or someone you know is interested bring us a resume!,0
1232,If someone in a Lowes or Home Depot offer you assistance but doesnt work there then you may be in Texas.,0
1233,Here is an opportunity for you to be seen and get some work out there. Please check out Dark Heart Creative. Some... https://t.co/LIllO6dHmU,0
1234,A business opportunity you can work from home and get paid daily!!  http://t.co/pIMK53yJfx,0
1235,Here is an opportunity for each of you to get some work in the off season.  Practices are… https://t.co/uCqSXYwBpb,0
1236,Bc you dont know if what youre doing rn is exactly what you wanna be doing so you test the waters to see what you might be interested in. Also youre still trying to figure out how life works at this stage,0
1237,Here are work at home business opportunities that you can get involved with to start earning income almost... http://t.co/vxqh2yqFmx,0
1238,Al-Futtaim Group Real Estate posted a job you might be interested in. Project Manager – Network Development | Auto… …,0
1239,You might be a student who works full time if you get home from a full day of work take a nap and then stay up late doing homework. #somethingisoffaboutthat,0
1240,Heres a way to make a lot of money...if youre willing to do the work,0
1241,A young professional near Roseville? Heres a networking opportunity for you. https://t.co/5ucoEzwSAx #HireACat,0
1242,A work-from-home opportunity that lets you go places. #WorkFromHome #smallbusiness #entrepreneurs #Canada http://t.co/Kvj3RG6NLz,0
1243,A2. Use assignment opportunities in the hiring process to show off your skills if you might be worried about experience. #WorkTrends,0
1244,Once you find agency opportunities you are interested in contact the agency to find out what paperwork is required to bid for the contract.,0
1245,the guys at amp.fm might be interested in working with the @GoMusicBubble crowd.  #pdxsw,0
1246,If you have an opportunity to know how to be wealthy And never have to work again take it. Take the chance to try it out,0
1247,This #job might be a great fit for you: LPN/RN Interested in working 12 hour night shifts!! - https://t.co/iJpqtXbN61 #Raleigh NC #Hiring,0
1248,Here is your opportunity to make money free tour lets you in the back office http://t.co/V4Eh4ORSy5 #work #workathome #payday,0
1249,Heres an opportunity to work as the Controller of a rapidly growing e-commerce organization http://t.co/qF3usHczCr #accountingjobs,0
1250,Here is a great opportunity for an RN who wants to work in the Mother/Baby department: http://t.co/gcOCeLBiFn #jobs http://t.co/i1zk8DRky6,0
1251,Opportunity will present itself when it sees you working.,0
1252,Here are three (more) reasons you might not want to hire a foreign worker:  https://t.co/DWFyAmEPJB #employees,0
1253,Here’s an #IRS tip on #NDEAM: Giving someone a work opportunity may translate into your opportunity to claim a business tax credit. https://t.co/wIboOnHDo1,0
1254,Here is a great opportunity to work for a great company. https://t.co/GTsJ3Qdhiz,0
1255,Opportunity for #wholesale inside #sales #professional. https://t.co/lD937OyNwj this #job might be a great fit for you. #work #careers #jobs,0
1256,Opportunity is missed by most people because it is dressed in overalls and looks like work. jobSearch,0
1257,Here is a perfect work from home opportunity that requires less than 30 hours per week. Become a… https://t.co/gpqXBbczKp,0
1258,Here is your opportunity to make money from home free tour lets you in the back office http://t.co/V4Eh4ORSy5 #work #workathome,0
1259,I might be interested in working at best buy.,0
1260,Have you ever been interested in working for a really innovative start up? Here is your chance. https://t.co/LWMeBspHoi,0
1261,See How Allah Works. I Might A Part Time Job Opportunity.,0
1262,You might work in a childrens hospital if someone is stoked on diarrhea studies.,0
1263,Here is what to do when a hiring manager asks you to work for free as part of the #interview process - https://t.co/rkBwUrzaNk,0
1264,One day you might find yourself working on a pursuit then all of a sudden lose all interest and have no qualms about it.,0
1265,Undergrad interested in library archive or museum work? Heres an opportunity for you: https://t.co/v8EDjM7hyS @UO_UROP @UOregonLibNews https://t.co/Ki2hgtY6cG,0
1266,Here is what you might have missed -national EMP was revised up in the past two months showing a stranger Econ@keithlawing @workforcecenter,0
1267,you might work at phoenix wok and grill...if you listen to country music at a chinese restaurant,0
1268,You might work for a conversation agency...if you dig through the trash to recycle something.,0
1269,Interested in working at @sus_org? Check out what opportunities might be waiting for you!  https://t.co/brX0vRwl8Y https://t.co/gsBowjXCrq,0
1270,Interested in working a temporary seasonal job this holiday season? Here is why you should be- https://t.co/xogOEw2vsh,0
1271,Here is an opportunity to intern over the summer working on a political campaign: https://t.co/GVvSjtf2xu,0
1272,I am currently not: working cleaning doing laundry or going to the grocery store. I may do one responsible thing &amp; go to the gym.,0
1273,I am currently working at a gas station with no gas.,0
1274,I am currently marathoning Harry Potter and working on Christmas cards. This is the life,0
1275,9/11 - I am currently in Saudi Arabia working and think a lot about the attack on the US by a group of people. I am not saying anything a...,0
1276,Currently not doing anything with my life ATM. Just working for my car...,0
1277,Wifi currently not working at home.... What is there to do rn.... Where da weed man at,0
1278,I am currently working on being Patient.,0
1279,Julie is currently drunk &amp; I am at work. What is wrong with this situation...?,0
1280,My wifi at home is not working for reason so I go to Tim Hortons to get their wifi and the guy was like our wifi is currently not working,0
1281,I have disability case I am not working i well have to wait 18 month before my case herd in court but mr Obama paid millions in destroying,0
1282,I am currently working on my 2nd Million I gave up on the 1st.,0
1283,currently working on suny/cuny/common app(s) and i am stressed and sweaty and its unsightly and i hate it,0
1284,I am still working Im not home what Im doing Im working I will not be home till late tonight I am working what am I doing Im working I wont tweet till tomorrow why because Im working I wont be till tomorrow because Im working why because Im working,0
1285,Currently suffering the forced reboot config by my work computer. Sorry coworkers I am effectively not at work...,0
1286,I am currently working through an existential crisis.,0
1287,I am currently without a working phone... I am not ignoring anyone!,0
1288,I am currently working a sale with a real estate agent that does NOT work on the weekend! #whatnottodo #REagent #realtor,0
1289,Am currently the people greeter at work..,0
1290,Phone is currently not working message me on twitter or facebook to contact me for the mean time.,0
1291,Dont submit then quit. Apply for jobs like Corporate Communications Specialist at Republic National Distributing Company  then look for people you might know at the company. You might be able to reach out to HR directly. Ready to apply? Check out the link in our bio.,0
1292,Quitting is easy &amp; #success is hard. You will never be a success if you always quit. Here is an #opportunity for you. http://t.co/UzU6jjeR84,0
1293,Here is a way to drive down premiums quit trying to run a socialist healthcare system..,0
1294,Heres a solution to those PhDs getting by on 3 part-time teaching jobs for 8 years. Quit. Do something else. Quit being exploited,0
1295,Dont submit then quit. Apply for jobs like Regular Classroom Teacher at San Francisco Unified School District then look for people you might know at the company. You might be able to reach out to HR directly. Ready to apply? Check out the link in our bio. Educator Teacher,0
1296,This #Finance #job might be a great fit for you: Financial Analyst - Private Equity Co. - Great Opportunity - http://t.co/GyGt02EXf8,0
1297,You might not want to quit on #TV just yet. https://t.co/5YbjHK5NO6,0
1298,Interested in a #job in #Mesquite TX? This could be a great fit: https://t.co/wqJiTWI366 #Retail #Hiring,0
1299,Interested in a #job near #Mesquite TX? This could be a great fit: https://t.co/GI5f8i0cdy #IHOP #restaurants https://t.co/reNS8SUSGO,0
1300,Here is an idea to save money on trade show equipment rentals - RentalCompare an eBay for event/equipment rentals. This is an equity...,0
1301,You might be tempted to abandon your family and stay in #Tasmania. Its really quite a place. http://t.co/QQTOOxdWMj http://t.co/I4cBmTqmMM,0
1302,Heres a fun game to play at work: every time someone cant believe its June already you quit your job.,0
1303,Interested in this job? Take a look: Sr. Application Architect (Acquity Group) in Chicago IL http://t.co/QSsFxAPuWA #job,0
1304,Here is an epic  I quit  Do you have a good job resignation story?http://t.co/ewOYjPHgsB http://t.co/Y2gVNYva4q,0
1305,Job Opportunity -  Java Equity Derivatives Developer in New York NY http://t.co/yf1R8YPwoW #jobs #java #trading,0
1306,If you are thinking of #quitting here are 5 #nursing jobs at home you can try. https://t.co/DAFHLwiOSM #athomenurse https://t.co/PVhr7iwjSP,0
1307,Interested in a #job in #Quitman TX? This could be a great fit: https://t.co/7tEt93KQrL #Retail #Hiring #CareerArc,0
1308,Heres a tool to help you challenge cravings for COCAINE @ http://t.co/qcFaI2Ml! It reminds you why you quit in the first place!  CJDaniel,0
1309,Dont submit then quit. Apply for jobs like Retail Sales Consultant at AT&amp;T then look for people you might know at the company. You might be able to reach out to HR directly. Ready to apply? Check out the link in our bio.,0
1310,Interested in a #job in #Quitman TX? This could be a great fit: https://t.co/iF9GEKXU2z #Diversity #Retail #Hiring https://t.co/OJCT91rJrL,0
1311,You might be closer to success than you everthink. Dont quit now....,0
1312,You might think about quitting your job today at 1:42 p.m. http://t.co/8CYVvHWCkP,0
1313,You might be tempted to abandon your dog and your family and stay in #Tasmania. Its really quite a place. http://t.co/QQTOOxdWMj #australia,0
1314,Statistically speaking if you employ me theres a 33% chance Im gonna quit and a 66% chance youre gonna fire me... hire me? :),0
1315,You might be tryin........But the question is how quick do yo quit???????,0
1316,Interested in a #Labor #job near #Mesquite TX? This could be a great fit: http://t.co/oSVXXpnvvf #IHOP #Hiring #CareerArc,0
1317,Here’s How You Can Switch Careers Without Actually Quitting https://t.co/wybkV9kJrv by @fortunemagazine https://t.co/8qg3ANRmhR,0
1318,Job Opportunity: Core Java or C# Equity Derivatives Developer. Are you a fit? in New York NY http://t.co/MoNbJKFZML #jobs #java #csharp,0
1319,You might work in public health if a quick assessment of your pens = 1 smoking quitline 1 seatbelt safety and 3 for Greenlight Pinellas.,0
1320,Here Is a Work-at-Home Mom Spoofing the I Quit Dance Video Meme http://t.co/t9Y4BMyTEB,0
1321,Interested in a #job in #Mesquite TX? This could be a great fit: https://t.co/QyhuaoF5Ql #parttime #Hospitality #Veterans #Hiring,0
1322,Here is 19 Billion Reasons why you should quit your job and start  an app company! http://t.co/VmuKA4wPjX,0
1323,Everybody has that one job that you would gladly quit school move wherever and take a pay cut for given the opportunity,0
1324,Job Opportunity -  Java/Scala Equity Derivatives Developer in New York NY https://t.co/3wPhydpT3M #jobs #java #scala,0
1325,Heres a compelling scientific reason to quit a job you hate https://t.co/4i7GGdxAHT,0
1326,Here’s why you may want to stop writing a monthly rent check and start building equity in a home! Via @Trulia https://t.co/h6v5vvGina,0
1327,If youve ever been interested in quitting your part time job wanted to be your own boss  or run your own business send me a message!,0
1328,Interested in a #job in #Mesquite TX? This could be a great fit: https://t.co/iKvp48XwUa #Retail #Hiring #CareerArc,0
1329,Here is an awesome app that shows you how long ago you quit smoking -&gt; https://t.co/69F7MYabG6 #vaping #eliquid,0
1330,Interested in a #Labor #job near #Mesquite TX? This could be a great fit: https://t.co/DDBCK5YZAS #Hiring #CareerArc,0
1331,If you had the opportunity to quit your job and work here...would you do it? #strains #cannabis #marijuana #weed😱😱 https://t.co/CohavSDbJE,0
1332,Interested in a #job in #Mesquite TX? This could be a great fit: https://t.co/5ovnROc70Z #Retail #Hiring #CareerArc,0
1333,Interested in a #Retail #job near #Mesquite TX? This could be a great fit: http://t.co/C6n3qbvZeW #Hiring #CareerArc,0
1334,Here’s how you can switch careers without actually quitting https://t.co/M13HVH0Ock https://t.co/mjN4Hvs10m,0
