id,text,is_hired_1mo
2181,Probably got fired after that performance at work yesterday... #unemployed,0
2182,A week ago I was unemployed and now I work for ESPN. God is good and He never ceases to amaze me with HIS plan!  🙌🏻,1
2183,I was unemployed in Yakima. now Im over here asking god for more than 23.8 hours in a day.,0
2184,@percoset i might use this. rn its how do u know if ur fired bc it was i was hired on a trial basis but before unemployed &amp; depressed,0
2185,Unemployed again. Pass me the booze.,0
2186,1st week I didnt get a video up but theres1 coming! Heres a link share subscribe! https://t.co/rNxBOl6s6P #YouTube #unemployed #jobhunt,0
2187,Officially unemployed. Im gonna miss all the little kids from work some good memories with them.,0
2188,officially unemployed and just spent the last of my green on textbooks. broke joke over here,0
2189,Starting week #2 of being unemployed and I am still freaking out :( I need a job and soon...,0
2190,And another Big Brother contestant is fired from their job without knowing it. That brings us up to 3 or 4. Good news for the unemployed.,0
2191,Today I became unemployed.   Please visit http://t.co/zH0tVlyhdv and let me know how I can help your company,0
2192,Bad News Rob Ryan Was Fired. Good News Rob Ryan Is Unemployed And Living In New Orleans https://t.co/YJMaUrfKZw https://t.co/owjz95HINM,0
2193,Have you seen my mid-week video? I decided to vlog whilst unemployed! http://t.co/amOAs5ZxF8 #lbloggers #crazybloggers #bdib,0
2194,Of course Ed Orgeron resigned. Hes only going to be unemployed for about 15 minutes after the season ends.,0
2195,i graduated on monday so now im just an unemployed 20-something,0
2196,Officially unemployed. Anybody want to give me a job?,0
2197,Beyond stoked for Catching Fire. May re-read the whole series this week. Hey I did it in 3 days the first time. Granted I was unemployed,0
2198,The truth about how I found myself #unemployed and #unemployable - http://t.co/kq08eayplc #entrepreneur #fired #corporate,0
2199,I was unemployed for 5 months.. 6 months ago. Now I drive one of the least common mustangs in NM. Wont God do it!! https://t.co/BWXQ7OJI7Z,0
2200,Lord. As of 30 minutes ago Im officially unemployed and I couldnt feel better about everything.,0
2201,Im now unemployed. This feels odd.,0
2202,I am officially unemployed now. Yay.,0
2203,Being unemployed is not good for me. I thought today was Monday.,0
2204,I am on month 4 of being unemployed and I only JUST figured out the perfect configuration of couch pillows-throw pillows-hot water bottle-laptop and I am equal parts thrilled and inconsolable that it didnt happen sooner,0
2205,Officially unemployed. Can anyone recommend a good soap opera? Please summarize story up to now. Thx.,0
2206,well just wrapped up my last lunch break at IPS. this time tomorrow Ill be a free unemployed man,0
2207,Temporarily unemployed. Time to catch up on my anime! Why did I wait this long to watch #Shokugeki no Soma??,0
2208,Have you seen my mid-week video? I decided to vlog whilst unemployed! http://t.co/HrrU0wdnx7 #lbloggers #crazybloggers #bdib,0
2209,I am now unemployed and that feels weird.,0
2210,Week 1 of offseason: The unfortunate realization that self employed actually means unemployed.,0
2211,And now Im unemployed again 😒 #fucking#sequester http://t.co/mkRlgxwihe,0
2212,And I am now officially unemployed,0
2213,Unemployed for 12 minutes; how I went from #fired to #CEO http://t.co/SYRtS6zFWK #entrepreneur #corporate #unemployed #unemployable,0
2214,Two minutes ago I was unemployed. Then I got a text message. #fuckyafreelance,1
2215,Today marks a week that I have been unemployed.  I will admit that it is very scary.  I have applied at... http://t.co/Odp4ei4bwd,0
2216,Still unemployed; not b/c the station didnt hire me but b/c of legal reasons. I was the only 1 interviewed and HR requires 2 more.,0
2217,Two weeks officially #unemployed and Ive recon firmed that being a #SAHM is not my thing. Best enjoy it whilst I can!,0
2218,Unemployed for a month now. I feel like such a bum.,0
2219,Im having work email withdrawals. #day1 #unemployed,0
2220,INSURANCE ISSUES FIXED. Im now covered by the insurance I paid for. This has been bothering me for so long. Still unemployed but insured!,0
2221,Somebody clipped their toenails in the front lounge and left clippings everywhere. When I find out who it was they might be unemployed.,0
2222,Ive been unemployed for a month. Sent two important lengthy emails today. Im tired. Im excited.,0
2223,Have you seen my mid-week video? I decided to vlog whilst unemployed! http://t.co/MAppy5oxiT #lbloggers #crazybloggers #bdib,0
2224,I was employed and now im unemployed again. #walmart #seasonal #temp lmao.,0
2225,So technically Im unemployed now. At least until Monday morning. ;),1
2226,Unemployed since Friday. This sucks.,0
2227,Im sorry all I heard was that youre unemployed.,0
2228,A month ago I was unemployed and now next week I have work every day,1
2229,So Im technically unemployed until Monday.  This hasnt been a thing in over 10 years.  What do I do with my time?,0
2230,Unemployed again. Hello ramen my old friend.,0
2231,Last summer I was making 300 dollars a week now Im unemployed and probably -$600,0
2232,So i got shitty news today and Im unemployed once again. My life pretty much sucks right now. #sadday #fml,0
2233,So I put my two weeks in at work last week.  Five more days and I am gainfully unemployed :),0
2234,@ProfKFH all Im unemployed. I was fired 2 weeks ago. So be blessed you have one. :),0
2235,Its been a really long week.  Took until today for me to really break down and sob.  I am unemployed and it sucks.,0
2236,Im an unemployed lump so Ill be staying up as late as I please for the next week or so until I get my resume in order to send out.,0
2237,I skipped work one day and was bored out my mind RT @FullMoonVoodoo: Ive been unemployed for 28 fucking days. This shit is not for me.,0
2238,@CoolerThan_Cool Boyyyy subway just fired my goofy ass today. So right now Im unemployed until I workout a schedule for DD.,0
2239,Unemployed or Looking For a Way to Make Extra Money? --&gt;&gt; http://t.co/mFbXVSQUqM,0
2240,Unemployed or looking for a new career path? Discuss options with a certified career coach https://t.co/XudrjfueWN #jobverse #jobsearch,0
2241,Ad: Unemployed? Looking for a new Job or Career? Work at Home Positions avail $80-$90 a hr http://t.co/QctV6WLzVk,0
2242,Unemployed or looking for a new career path? Discuss options with a certified career coach https://t.co/bVetho3MN1 #jobverse #jobsearch,0
2243,Looking for office #job #training? @UnitedSouthEnd offers a program that prepares under - and unemployed workers for administrative employment with career potential.  Learn more on their website! https://t.co/cjUz8kn8eG https://t.co/vAcev5fc9n,0
2244,Ad: Unemployed? Looking for a new Job or Career? Work at Home Positions avail $80-$90 a hr http://t.co/GSqMoc2L,0
2245,Unemployed or looking for a new career? Apply this trick to get your dream job... https://t.co/RBryAGzrwf,0
2246,Ad: Unemployed? Looking for a new Job or Career? Work at Home Positions avail $80-$90 a hr http://t.co/c8bUQ2kpV9,0
2247,Ad: Unemployed? Looking for a new Job or Career? Work at Home Positions avail $80-$90 a hr http://t.co/VYzQ5vRXTY,0
2248,Ad: Unemployed? Looking for a new Job or Career? Work at Home Positions avail $80-$90 a hr http://t.co/cI4XEi6f,0
2249,Ad: Unemployed? Looking for a new Job or Career? Work at Home Positions avail $80-$90 a hr http://t.co/RcIrQLrMi0,0
2250,Unemployed or looking for a change? See our available job opportunities and apply here: https://t.co/aSpjfusiCt https://t.co/g2d5FzjA1i https://t.co/SCyEz2QIqf,0
2251,Unemployed? Looking to be financially independent? Join us on Monday night for Financial Survival Strategies http://t.co/aPg4e4UBJp,0
2252,RT @JPCVServices: Looking for a new job in 2016? If so are unemployed seeking internal promotion or looking to move company?,0
2253,Looking to make a career change or find a new job? @HireOurHeroes is holding dozens of hiring fairs nationally http://t.co/Ahw31eOdQ8,0
2254,Looking for a new challenge or feel stuck in a job you hate? We can help! #javascript #java #ruby #angular https://t.co/AuL0e2zuaY,0
2255,Looking for a paralegal job? MT Lawyer classifieds has several new position listings! https://t.co/iyk4AAhdif https://t.co/822hkk9ayP,0
2256,Looking for a new job and have legal questions about what employers can or cant ask? Tweet using the hashtag #fox29weekend!,0
2257,Looking for a job in #Management? 100s of new positions were added to the BRR Job Board: https://t.co/ZNPyvVdGA2 https://t.co/17jKo4AFu6,0
2258,Looking for a great part time job OR a career change? Visit http://t.co/s5v4e7q0Jf today! #jobs #employment,0
2259,Looking for an opportunity to work for a company that positively impacts student lives? http://t.co/KVs0e8SEBN #SeattleJobs #tempjobs,0
2260,Looking for a job? Superintendent II - Wind Energy Group (IRC9674)Job Details at M. A. Mortenson ... http://t.co/WhG0hzJtru #green #jobs,0
2261,Looking for a new #job? CNS Job Market is the place for #psychiatry and #primarycare jobs: https://t.co/5vILTLPf92 https://t.co/psWpTrRMuJ,0
2262,Looking for a WBB job? 2 new HC positions (DI + NAIA) posted today on our WBB site: https://t.co/v0inkWe8c1 https://t.co/Efwi849BQT,0
2263,Looking for a job? Energy Engineer/Resource Efficiency Manager(13005062) at Northrop Grumman (AK) http://t.co/0fdWzVCWvf #green #jobs,0
2264,Looking for a job? (Raleigh 1) Renewable Energy Crew Laborer at Baker Roofing Company (Raleigh NC) http://t.co/ZaC5mTCM #green #jobs,0
2265,Looking for a job? Electrical Engineer - Renewable Energy at Black &amp; Veatch (Centennial CO) http://t.co/Jj3c5xvcGk #green #jobs,0
2266,Looking for a new career path? The FAA is hiring 1400 air traffic controllers. #jobs https://t.co/HZQ9HGlESC https://t.co/3RDDaYhpqh,0
2267,Looking for a part-time position? CT Technologist - As Needed - Windsor NC https://t.co/3ctcDCmlTM #vidantjobs https://t.co/g51RgSpBmE,0
2268,Looking for a Career change? Growth Opportunity? Salary plus Benefits (Los Angeles) http://t.co/UDcPchw9 #LASocialMediaJobs #SocialMedia ...,0
2269,looking for a customer service position ? Montreal Job (Quebec QC)  http://t.co/m7hLuBE5Sk  #job #jobs #Quebec,0
2270,Looking for a job? Senior Program Manager- Renewable Energy at Epri (San Francisco CA) http://t.co/7ioP77lq #green #jobs,0
2271,Looking for a job or internship? Register for the SEC/ACC Virtual Career Fair Wed Apr 1 &amp; Thu Apr 2: http://t.co/VExsy3fCtN,0
2272,Looking for a job? Energy Efficiency Engineer (2 105445 229519) at Adecco (Portland OR) http://t.co/eJQ850nzKd #green #jobs,0
2273,Looking for a Want to be on the cusp of development? Ruby on Rails/Java developers in Morrisville NC http://t.co/CHRt4eRCpO #job,0
2274,Searching for a new #career? #Job openings incl Servers Managers Cooks &amp; more! App &amp; additional info https://t.co/mKh9KpXfVv @TriRestJobs,0
2275,Looking for a job in retail? Radial is #hiring thousands of #warehouse workers across the country w/ great benefits. Say YES to Radial today + apply online for new positions available in #Kentucky #Virginia #Florida + more: https://t.co/vI06YmKv9S  #jobs https://t.co/tQOWHsDIQJ,0
2276,Looking for a job? Energy Efficiency Outreach Coordinator at Honeywell International (York) http://t.co/Y9mP5a4jcM #green #jobs,0
2277,Looking for a job a new career or more job satisfaction? 51 Career and Job Affirmations. http://t.co/Zkv30ItwAy,0
2278,Looking for a job? Energy Engineer/Resource Efficiency Manager 3 at Northrop Grumman (Barksdale Afb) http://t.co/5ertaYMFl4 #green #jobs,0
2279,Looking for a job? Superintendent II - Wind Energy Group (IRC9674)Job Details at M. A. Mortenson ... http://t.co/QwGh7Ady3n #green #jobs,0
2280,Looking for a new career? CNNMoney released its top ten fastest-growing jobs in the US of the decade: http://t.co/nWYbnrZikF,0
2281,Looking for a job or seeking to advance professionally? CALBOs 3rd Annual Job Fair &amp; Career Development Day Thursday March 29 2018 from 8:30am - 12:00pmFree Admission! https://t.co/GA20tITSOG,0
2282,Looking for a job? Integrated Construction Coordinator II - Renewable Energy Group (IRC10233)Job ... http://t.co/G0n6uoPeaw #green #jobs,0
2283,Looking for a rewarding job in a great working environment? Look @ jobs posted on the Penn Emblem Careers page: http://t.co/dAg5WuGPT2,0
2284,Looking for a job? CFO Construction and/or Renewable Energy at Design Staffing (San Mateo) http://t.co/PrC0xvUlp8 #green #jobs,0
2285,Looking for new job or contemplating a career change? #DYK that new positions are posted to our Work In Optics job center every week? Check it out today: https://t.co/HAMh0SaSVo #NewJob #CareerChange https://t.co/sVuHTeFo4W,0
2286,Looking for a new #career? BCM is #hiring a Research Technician III in #Pediatric Nutrition apply online at http://t.co/oZaFo57j3y #JOBS,0
2287,Looking to make a career/job change AND leave your current employer? Here are the challenges &amp; advice on what to do: http://t.co/TSXXwF6fZm,0
2288,Looking for a Spring semester Work-Study job?  Purdue School of Nursing has a Clerical Assistant position to scan files to archive make copies make student IDs file cover phones type and other clerical tasks. https://t.co/zEDTdoCG8I,0
2289,Looking for a job? Energy Project Manager/Resource Efficiency Manager at Northrop Grumman (Davis ... http://t.co/elPmIfukOs #green #jobs,0
2290,Looking for an Entry-Level Job Near Nanuet? Sales Positions Lead Nation in Availability https://t.co/mZFXUrFcmf,0
2291,Looking to fill an open PR or corp comms job? The 6 qualities to look for in a new employee http://t.co/g9JMTfJrIX,0
2292,Looking for a new job?  Cumulus #Indianapolis is hiring for experienced and motivated #radio account executives http://t.co/f1lmF6aSx6 #JOBS,0
2293,Looking for a challenging rewarding position with a growth-industry leader? Highwinds is hiring! http://t.co/y6b6y2qaTU #techjobs #jobs,0
2294,Looking for a Accounts Payable Data Anayst (Consultant Position) Job (#NewYork) http://t.co/8JsIUi2Xmj #job http://t.co/JTauIEoJox,0
2295,Looking for a career change? RT @Forbes: 7 out of 10 of highest paid professions are in the healthcare industry: http://t.co/NXAD0DhJaq #job,0
2296,Looking for a job in publishing? Hachette Book Group shares practical advice for job seekers: http://t.co/jbNgWy6uMi,0
2297,Looking for a great part-time job? #Housekeeper position in #Columbus #MN --  http://t.co/cOWsX60nFH -- #nowhiring #cleaning #hospitality,0
2298,Looking for a new job any places hiring ??,0
2299,Looking for a #(NEW #POSITION) Associate Director Regulatory Affairs Advertising and Labeling #jobs https://t.co/nVyls7e1Kj,0
2300,Looking for a flexible entry level job? Look no further: http://t.co/aob01O6jyd #hiring #workremotely #flexibility,0
2301,Looking for a new job? #qualifiedstaffing #hotjobs #employmentnews http://t.co/T4kupFlIMl http://t.co/99reXJl3RF,0
2302,Looking for a (new) job? Veteran? RecruitMilitary Veteran Job Fair is on October 6 at Soldier Field https://t.co/Xy06CO7poW,0
2303,Looking for a #CERTIFIED #PHARMACY TECHNICIANS (15 New Positions!) #jobs https://t.co/fJwBkDslsr https://t.co/NrMnIefsPd,0
2304,Looking for a career change? Check out available Financial Center jobs. &gt;&gt;&gt; http://t.co/FC4gLpWV9e,0
2305,Looking for new job prospects? Alumni are invited to the Fall Career Expo hosted by @RiceCCD on Sept. 19 on campus. http://t.co/hkHxuqQcf3,0
2306,Looking for a job? Safety Engineer II - Wind Energy Group (IRC7055)Job Details at M. A. Mortenson... http://t.co/gvEbauRiAN #green #jobs,0
2307,Searching for a new career? CNN gives the top 10 fastest-growing jobs in the country of this year: http://t.co/ADl4BHuByg,0
2308,Oh boy... Now I can change my job occupation from student to unemployed ...Oh 21st Century you are THE BEST!,0
2309,I HATE UNEMPLOYMENT!!!! I HAVENT RECEIVED A PAYMENT IN 3 MONTHS AND HAD 2 JOBS SINCE. #BROKE #HOMELESS #HUNGRY WITH 6 KIDS AND A WIFE #BS,0
2310,And I remember now why I shut down and didnt do job applications for a while. It makes me very aware of how long I have been unemployed,0
2311,The reason why I am #homeless after losing my job is that after taxes rent and medical bills I could not afford rent or a car anymore,0
2312,Hubby turns 50 tomorrow.We had planned to go out to dinner but then he lost his job so instead I will make him some peanut butter cookies.still waiting for a decision from unemployment,0
2313,Well has of yesterday I am unemployed (quit my job). Yes had enough my body and health can not take it anymore. Start looking tomorrow.,0
2314,Now there is emergency jobless benefits as a supplement to longer unemployment.,0
2315,I use to be the only one of my friends with a job now Im the unemployed one #dammit,0
2316,I will never understand unemployed people cause Ive NEVER been without a job.,0
2317,Omg my friend has been unemployed for hella long and just got a sweet ass job and I feel like I won the happiness for my friend lottery,0
2318,DID MY UNEMPLOYMENT DID MY RESUME NOW I GOTTA FILE MY TAXES AND WAIT FOR Securitas TO HIT ME UP FOR DIS JOB..................,0
2319,I was unemployed for 3 weeks. I couldve started a job sooner but I choose not to so now I have to train myself to go to bed before 5am lol,0
2320,I know that as much as the #jobhunt is going out and chasing the other part is waiting and boy is my mind hurting from waiting. #unemployed,0
2321,I complain about my job but I dont wanna quit bc I am so scared of being unemployed haha,0
2322,I went from being unemployed to now having 2 jobs in a months time! Im a living witness that with God ALL things are possible!,1
2323,I wish I could just be irresponsible and not care and just quit my job.  But nope unemployment basically  = death in our society,0
2324,Bitch collects UNEMPLOYMENT because she cant hold a job YET she hates on me for working from home. This skank got me fucked up.,0
2325,Ive been unemployed now for about 5 days...I am not about this life #ineedanotherjob,0
2326,oh man im like unemployed for three days. but also new job in three days! also also three day weekend!,1
2327,I had so much fun being unemployed for 3 days after quitting my job but now I have to go back to work fuck my life lmao,1
2328,Can we all take a moment to appreciate how a job finder account tweeted me when I wrote I NEED MONEY and not when I wrote UNEMPLOYED...,0
2329,Now Im home only to eat and sleep then wake up at 7 am for both jobs tomorrow,0
2330,Unemployed for three months constantly submitting applications and nothing... Now I get two job offers in the same day wtf,0
2331,Now I am actively looking for jobs in Manhattan and uggh I hate looking for jobs,0
2332,I’ve only been unemployed for 10 days and I was blessed with a job when I wasn’t even looking and I start tomorrow. A bitch just want 2 sleep!!,1
2333,weird mind place bc my job made me depressed which led me to drink dangerously but I can tell Im a different depressed being unemployed,0
2334,anyones job hiring?? seriously done w crappy Main Event,0
2335,anybody know any places hiring??,0
2336,Anyone know of any oilfield jobs or good paying jobs??? Let me know my brother is looking,0
2337,Anyone know of anyplace hiring?¿,0
2338,Anyone looking to hire a smart educated talented writer/producer/designer/photographer?  What Im saying is I am awesome.,0
2339,Anyone looking for a Paid Summer internship??? If so check out http://t.co/vp1Lqn72i9,0
2340,Encourage female developers or hire a woman for the night? https://t.co/Q5CIU9CgBn,0
2341,Anyone know of places newly hiring in Sierra Vista Tombstone Bisbee Fort Huachuca Benson or anywhere within 30 miles of here?,0
2342,Anyone knows about a music studio thats hiring ?,0
2343,Is anywhere hiring?? Someone please tell me of somewhere,0
2344,Live alone? One-person households increased from 7.8% in 1940 to 26.7% in 2010 http://t.co/QNUAoYCFqq,0
2345,Anyone Dreaming??Powerball jackpot reaches $400M for Wednesday  http://t.co/RuIpy8NYl1,0
2346,Does anyone know of any place hiring? http://t.co/4ggPlrcnNp #reddit,0
2347,Whos job is hiring ???,0
2348,Anyone looking for a project car?? 1970 #Ford #Maverick #FordMaverick #DM offers https://t.co/3a5TlSv0tq,0
2349,Anybody hiring this summer??,0
2350,Anyone selling weekend passes??? #minegotstolen http://t.co/aZJtjws7A8,0
2351,Anyone looking for a job? Sprint is hiring.,0
2352,Independent Contractor or Employee? https://t.co/A0tfWmjJcw,0
2353,Who hiring???!!!,0
2354,Whos hiring!? Anyone!? Bueller!?,0
2355,Anyone smoke...?,0
2356,Does anyone know where theyre hiring?? I need a job because Im a lazy bum and 2014 and idk,0
2357,Does anyone know any places hiring? #needajob,0
2358,Anyone know of places hiring?!,0
2359,Whos hiring?????? Help,0
2360,Anyone trying to sell an xbox?? If so message me,0
2361,Whos job is hiring and hires felons?!,0
2362,Someone hiring ice cream cookie sandwich maker...... IS THIS REAL?!?!,0
2363,Whos hiring ????,0
2364,Does anyone know of any places in Mesa/Gilbert that are hiring right now??? PLZ help a girl out. I need that cash money flow,0
2365,Does anyone know any places hiring .....,0
2366,does anyone know of a place hiring?!,0
2367,Anyone checking up on Mike Pettines daughters twitter account? She gave up the hire maybe shell tweet the fire? #Browns,0
2368,HELLO SAN JOSE yall hiring????????,0
2369,Anyone tired of these agencies?https://t.co/qEye7z1Mko https://t.co/Xyq90h6CVj,0
2370,Interested in sports law? Law firm hiring someone to help represent schools in NCAA compliance and infraction cases: http://t.co/e2ZLscv4m0,0
2371,Anyone want to coach football?  The NFL is hiring! (Hey maybe someone will take Greg Roman),0
2372,Anyone looking to work for a great company? The Lowes of Leesburg VA is now hiring. Let me know if you are interested! Hiring 161 people!,0
2373,Anyone hiring...more than $14,0
2374,Who is hiring???,0
2375,Who job hiring ??,0
2376,Who hiring??,0
2377,Who hiring ??,0
2378,Is anywhere hiring at all ??,0
2379,Does anyone know of any place (not a restaurant or fast food joint) hiring part time? Needing semi-constant hours each week.,0
2380,UNEMPLOYED ? sell someone elses products http://t.co/rGoFC3cOO1 http://t.co/JyUtcljJVJ ways to beat economy info news links ideas,0
2381,Anyone know a good website for resumes or someone know how to edit one??,0
2382,but who is hiring is the real question,0
2383,Anyone trying to sell and iPhone? (-:,0
2384,Hire or Outsource? 7 Benefits of a Digital Agency https://t.co/3X7fGG7kp4,0
2385,Anyone looking for an iPhone 4S for AT&amp;T??,0
2386,Anyone taking applications for a personal chef? http://t.co/eOyw6Kodbs,0
2387,Harassed for being unmanly? Title VII violation http://t.co/SbbavH1oCV  #employment law #harassment,0
2388,girlfriend or independent contractor?  https://t.co/sfntHitOEo,0
2389,Anyone selling their iPhone 5 on Verizon??,0
2390,Does anyone know anywhere thats hiring??,0
2391,Anyone hiring foodmonsters in NY? plz hire me full time I swear Ill try my hardest to leave you a pizza slice...,0
2392,Anyone wanna go to the rodeo  flea market park mall etc???,0
2393,Elixir or Erlang Developer? HelloSign (YC W11) Is Hiring https://t.co/OhfeR6vg4K,0
2394,anyone easily turn a wordpress site into an app that also has a payment gateway attached? via /r/Entrepreneur https://t.co/7RJN5o0VKJ,0
2395,Can you recommend anyone for this #job? Senior Technical Accountant (2015) - http://t.co/LKQK2szF6L #Auto #Hiring http://t.co/gjUjJagIYg,0
2396,Anyone have 50¢?? https://t.co/9vt33wog0p https://t.co/UGGvUqVgsO,0
2397,Okay who knows of any place that is hiring right now!!!!!!,0
2398,Does anyone know anywhere in denton thats hiring? Help a sista move out!,0
2399,ANYONE WANT AN ID THAT DOESNT EXPIRE TILL 2017?? BOYS ONLY $$,0
2400,Anyone know of any places that are hiring?Im DESPERATE!!!!,0
2401,Why hire ppl at Walmart when they dont know where anything is?????,0
2402,Anyone hype? https://t.co/hyy0iyYtpB,0
2403,Whos hiring at the mall!!??,0
2404,Employee or contractor? Labor seeks to clarify rules http://t.co/p2sLYJSTR4,0
2405,Microsoft posted a job you might be interested in. Senior Software Engineer- Xbox Recommendation - Israel IL via LinkedIn.,0
2406,Amazon posted a job you might be interested in: IT Support Engineer - Amazon Web Services Australia - Sydney Area Australia AU.,0
2407,IBM posted a job you might be interested in: Java &amp; GUPP Business Analyst - Beijing City China CN.,0
2408,Lockheed Martin posted a job you might be interested in: Tax Accountant Senior (Compliance) - Washington D.C. Metro Area US.,0
2409,Apple posted a job you might be interested in: TR-Pazar Lideri - Turkey TR.,0
2410,Target posted a job you might be interested in: Pharmacy Manager Full Time - Dothan AL - Dothan Alabama Area US.,0
2411,Yahoo! posted a job you might be interested in. Incident Management Analyst - Buffalo/Niagara New York Area US... http://t.co/WIJ7UoIojs,0
2412,Yahoo! posted a job you might be interested in. Tech Yahoo Software Dev Eng Sr - San Francisco Bay Area US via… http://t.co/DZPNRJoR7u,0
2413,Hilton Worldwide posted a job you might be interested in: Assistant Manager Bars and Lounges - Orlando Florida Area US.,0
2414,Gelia posted a job you might be interested in: Account Executive - Buffalo/Niagara New York Area US.,0
2415,Bookish? Outdoorsman former Flint cop hired as Muskegon Countys new top librarian http://t.co/N6tHl1p1G0,0
2416,Nobody hired me Im just a nice guy who likes to protect @POTUSes because he loves his country,0
2417,To get hired by the Feds (American citizens) social media is checked during background check but not immigration? https://t.co/5qMspHOxeB,0
2418,Looking to hire or to be hired in #Seattle? Register for the Job Fair at #ChaseBasecamp on 11/18 during #SSW2016. https://t.co/ncbROxwFvb,0
