id,text,class
5088,My 1st week at my new job went good &amp; on top of that I already hit overtime,1
7633,Love museums and working with the public? We have job openings you might be interested in! http://t.co/1gusOb7kGf,0
5093,First night at my new job is goin well! Still not sure how Im goin to work a FT and PT job???,1
6620,I lost my job today but its all the same im more insane each day but Ikk be ok but its all in my head in my head again the things you said,0
5274,This is how I feel as unemployed,0
4161,Currently unemployed seeking full-time employment in or near Bakersfield. Message me for resume.,0
1446,Are you a first-time job seeker currently unemployed or looking to change career paths? We can help &gt;&gt; https://t.co/5MJQvfrsIy,0
3972,Lost #Job . Evicted. Worst of all just hired as a #college educated cashier. #MyHolidayConfession 🎄 #MakeMeHappyIn3Words #donate for #fundraising 👉https://t.co/WvHLsOesTp👈 #saturdaymorning #Shame #AHSCult #art imitates #life #Homeless for #Christmas https://t.co/emk93WZhCj,1
8277,Damn near about to have 3 jobs but I just got hired at my other one yesterday plus my sport start so 1 is good for now #Blessed🙏🏽💋,1
4039,Searching for #work in Brooklyn NY? Send your #resume to nyc associates. http://t.co/bs1RfxkcXL #gethired,0
3691,I guess I got the job??? I got an email from dominos telling me to full out new hire paperwork. Hooray?????,1
4090,Starbucks hired me today and have me double shots and so much coffee and now I am powerful,1
4777,How dare a judge tell me to get a job! Last week a judge told unemployed Danielle to seek… https://t.co/xbtmKuSJ8P https://t.co/7lbqYiPcVB,0
2975,I went to a job interview and got offered a supervisor position. Look at God,1
191,i got hired on the spot by Mister E...or just E the finance guy who worked at HYundai Mazda and @HarrelsonNissan ask tre about E,1
6184,SO EXCITED TO START MY NEW JOB :) I got a first shift position every other weekend and second shift Tuesdays and Thursdays :),1
4870,Anyone know any decent places to work that are hiring ??,0
2317,Oh boy... Now I can change my job occupation from student to unemployed ...Oh 21st Century you are THE BEST!,0
6801,Dude i fckin hate working at lil Caesars. Anyone know a place hiring?,0
1365,If I showed you a way to make some extra money without quitting your job would you be interested?,0
6807,Okay cool so someone wanna hire me to work Warped 2017???,0
9384,Looking for your dream job in data science? Get Hired at #ODSC UK! https://t.co/UI4WK5OTjP https://t.co/V6OegO8q0p,0
1004,Interested in a #job in #Louisville Kentucky? This could be a great fit: https://t.co/hfcCmtHAis #NowHiring #GetHired #Manufacturing,0
5908,My new job orientation features a literal spitting image of @Eyehatelucas in female form.,1
2183,Today was a fail and tomorrow is Monday. Oh wait I graduated and Im unemployed! Tomorrow will be fine haha,0
5032,I literally got fired 1 week and a day ago and is now about to start a new job next week. Cant stop my flow #NewDay,1
6988,Moms just finding out 2weeks later I got fired lol,0
4794,Applying for jobs like crazy!! Need to find work soon cause being unemployed sucks. I am going stir crazy and its only been a week!,0
4281,Unemployed Man Spent $2.10  Million On Cars Strippers  https://t.co/InSfdaH0Ws,0
8417,@aquamarina21 I DIDNT GET FIRED I WAS LAID OFF BUT YOU WOULDNT KNOW THE DIFFERENCE,0
4109,Fuck yes got hired at Eskimo Joes. I will not miss Oreganos one bit.,1
373,I am currently looking for an intern to work 2-4 days a week for 3 months in Brooklyn. Stipend negotiable. Please RT.,0
96,I got hired at Chulas today...,1
5809,Does anyone know any places that are hiring? I cant stand my job anymore and my parents wont let me quit until I find a new one first 😭,0
2011,I recently started working a part-time job in addition to building my biz because I have big giving dreams and goals. #GetFit #Dream #Give,1
3752,Looking for a tech job where you work w/ smart people &amp; can have an impact?http://t.co/cxanNgUQ6O #dotnet @InnovateMS http://t.co/bLvn14Q27U,0
8655,God fired like 2 hours ago from the restaurant . But the warehouse called me back to work rn 🙏🏼 God out here watching after me,1
7399,Went from quitting my job to being out of work for 2 months and now I have 2 jobs,1
3553,Yes I Got The Job Im No Longer Unemployed Now I Really Dont Need Nobody All This Is For DaMorra My First Pay Check Going All On Her!!!!,1
6106,@lartist … you’re hired!,1
6820,SAIC posted a job you might be interested in. Storage Area Network (SAN) Support SME - Washington D.C. Metro Area… http://t.co/2nWFmX18IQ,0
592,ima ask this all the time until I get hired... whose hiring???,0
133,Today I was hired back into the food business. Yay. Aug 2 cant come fast enough. I just wanna teach my 5th grade hooligans,1
2240,Last summer I was making 300 dollars a week now Im unemployed and probably -$600,0
5887,Dont submit then quit. Apply for jobs like RN Nurse Manager at Canterbury Woods then look for people you might know at the company. You might be able to reach out to HR directly. Ready to apply? Check out the link in our bio.,0
8147,I am currently in the progress of moving and it maybe some time before I can stream also looking for a new job. Thanks for understanding.,0
4074,Got hired today  get my braces off tomorrow .. Ok April good shit,1
3621,When unemployed ppl tell someone how to fill out job apps... lol ok,0
7861,So I started my new job this week at Newsit its been quite an interesting week working mostly from home #tech #startup,1
1639,Are you seriously searching for a business opportunity so that you can quit your job and live life on your terms?... http://t.co/8as6A3QcNq,0
4995,Hey anyone know some place thats hiring? Im still in school but get out really early and am 18 sum1 hmu with a job offer,0
3684,2nd day at my new job still sitting around doing paperwork. Thats going to end real quick cant wait to start!,1
6179,I recently accepted a full-time position with benefits... and I still feel like a failure. #itsnotinmyfield,1
2796,Got hired to work at Olive Garden turn up!,1
4672,I quit my job today to pursue my dream of being unemployed which I achieved immediately. Its all happening so fast!,0
8818,I officially got hired on today to the SMS Infocomm Corporation...so excuse my drunkness.,1
5156,I got fired Friday. Job interview Monday. Accepted the job offer Tuesday. First day of work Thursday. This is all happening so fast!,1
189,Work was amazing today put in 12 hours and got 3 leases today on my 3rd day!!,1
2009,I recently quit my job to pull in $5641 from my phone PRESS THE LINK INSIDE BIO to do it too https://t.co/Z9ohtJsp9P,0
5082,Well first 2 weeks at my new job and its a totally different shift than my last job Im liking the new atmosphere,1
4481,I want a job so bad  whos hiring ???,0
6682,I knew today was a bad day. I just quit my 2nd job,0
3794,#SOTU #Obama I dont qualify for health care because Im an unemployed teacher thanks for nothing! His plan doesnt cover unemployed!,0
2372,Whos hiring ????,0
2108,Searching for #work in Call TX? Send your #resume to B2B Workforce Inc. http://t.co/VTMCzFzys4 #gethired,0
750,A friend is looking to hire an entry level marketing position. Let me know if you are interested. #mnjobs,0
8480,Got offered today by my manager and district manager to take on the job as assistant manager.,1
108,Hey guys I just got hired at starbucks,1
3025,First day at my new job on the 17th been out of work a month to long now and I hate that shit,1
7106,Ok been unemployed for the last month and have been trying to catch up on the past episodes of @thechew before ABC stops airing them for good. It was my grandmas favorite daytime show and mine when I played hooky. 😊Boo ABC @clinton_kelly @carlahall @chefsymon,0
2902,now I work at value village. where will I work next week? any bets???,1
5058,Dude totally getting fired. Oh well Im starting a new job soon.,1
3013,Yay my new boss is pretty cool and hes letting my employer train me! Sweet so I will be working Sundays maybe 4am to 12,1
8317,I have a feeling Im going to get hired at my new job before Black Friday and them niggas gana have me working,1
2280,Looking for a job or internship? Register for the SEC/ACC Virtual Career Fair Wed Apr 1 &amp; Thu Apr 2: http://t.co/VExsy3fCtN,0
729,If you are in the greater Sacramento area and you or someone you know might be interested reach out to us. We are looking to fill a position ASAP. @ Granite Bay California https://t.co/f8LzDCfX1t,0
6724,Today I start my new work-from-home position and I could cry I NEVER HAVE TO LEAVE THE HOUSE AGAIN 🙌🏻,1
8059,I am working on a great opportunity for someone who is seeking a position in the Northern Kentucky area.  Great opportunity for someone wit…,0
3051,My first day of work at my new job is done! Wow crazy how time is flying by.,1
9486,Technically I was unemployed for 37 minutes yesterday.,1
999,Interested in a #job in #Coppell TX? This could be a great fit: https://t.co/hVtBUAjDjq #NowHiring #GetHired #Manufacturing #Hiring,0
3459,Who gets fired then hired in the same day???? @AlyciaLeee #BALLER,1
1024,The woman who hired me has not called in 5 days and is not answering when I call. I called like 7 times throughout the day yesterday.,1
3405,Needless to say anybody know anyone hiring? #Imightgetfired,0
8289,Ive been with my new job for a month now. Its going well and I like it. Hopefully I can keep going and Ill be hired on in two months.,1
8811,I am having such a hard time deciding which FT job I want to take. One is where Im at now in MD the other is in DE. I was hired here PRN,0
8803,I just got hired and am filling out my W-4 form for 2013. Previously my father has been filing my taxes under... http://t.co/6uh4yw4Adn,1
5966,Damn the 2 people who got my mom fired for no reason two months agai just got fired this month wow yall watch what you,0
7745,I am currently hiring for work at home tech support call center work. There is a fee for background check... http://t.co/63pijPqzrv,0
8845,Tomorrow is pay day at work. I was hired on over a month ago and still havent received one. My paycard still isnt in yet aka bad fing news,1
3399,I think Ima get fired soon anybody hiring?,0
4110,I got hired at both of the jobs I had interviews at today. I am going to vomit,1
53,2. I was laid off from my BRAND NEW job Thursday. I havent fully processed that yet.,1
3125,I didnt lose it its not like whoops whered my job go? I quit! Someone pass the asparagus please.,0
3224,I GOT LAID OFF YESTERDAY AND GOT TO JOBS TODAY 😊☺😊😊😆😆,1
4785,For months I have been unemployed and looking for a job. Today it is comforting to prepare for a new job (cont) http://t.co/GkR1zPJtMn,1
5148,Boss tried to tell me if I didnt stay late I was fired. Jokes on her I start a better job Monday so I just walked out on that bitch,1
5053,I GOT A NEW JOB THAT STARTS IN A MONTH JUST INCASE I GET FIRED FROM MY CURRENT JOB BEFORE THAT.,1
2991,So I recently started work for a pet boarding/doggie daycare and someone was REALLY fucking happy to see me this mo… https://t.co/GDPFizGxUw,1
6664,today I got a job &amp; today I also lost that job smh,1
4115,I got hired again to babysit and made $30 I FEEL RICH!!!!,1
2350,Anyone know of places newly hiring in Sierra Vista Tombstone Bisbee Fort Huachuca Benson or anywhere within 30 miles of here?,0
5340,I worked a paid internship for 2 months and got a full time position. I dont have time to be waiting around for old fucks to retire,1
2493,Interested in a #job in #Richardson Texas? This could be a great fit: https://t.co/CS81xnDmc3 #NowHiring #GetHired #IT #Hiring,0
908,Got hired at best buy mobile last week &amp;amp;amp;amp; today I have an interview with FedEx for a customer service rep position! #needthat,1
6665,Today I got a job serving donuts hit on someone drank a whole bottle of wine &amp; almost drunk bought a ticket to Boston for No Pants Day.,1
2034,Looking for a great career? Get Hired! https://t.co/1vxCFQSFja  #jobs #trending #jobsearch #career #job #gethired #hired #job #RT #CEO #CFO Join The eCoinNetwork. Learn all about #cryptocurency https://t.co/SV0UOOuy0T #ecoin #Bitcoin #ecoinnetwork #ethereum #tron https://t.co/6yDS133WHI,0
48,Well got laid off from the job and love Madpack so lets give this streaming thing a try. http://t.co/1OyR5N2sou. Stream starting!!!,0
2263,Looking for a new challenge or feel stuck in a job you hate? We can help! #javascript #java #ruby #angular https://t.co/AuL0e2zuaY,0
8839,I hate working 12 hours but am grateful for even having the opportunity to get rehired. I love all my patients!!! :),1
8541,experienced the most uncomfortable video chat job interview 2day but I got hired aka now I dont have to shower today,1
7420,WELL Im unemployed ... Never got fired before ..... Crying and laughing at the same time . Right as I clock out for vacation too ........,0
3711,I like my new job. Its fun and my co workers are nice!,1
4064,I got hired in two different places today wtf lol now i have 3 jobs,1
1160,Got laid off today fml,0
5047,This job I got hired to fired me via a text message saying I did not catch on in the first 2 shifts how can anyone catch on that quickly?!,1
9424,WOOOO one step closer to not being unemployed! #hired #wwddd https://t.co/ORocOEKpa0,1
1258,Here is your opportunity to make money from home free tour lets you in the back office http://t.co/V4Eh4ORSy5 #work #workathome,0
5784,Its the middle of the night and I started a Twitter. #unemployedprobs,0
9408,Okay so tomorrow is when I found out I get hired. Job job job money money money,0
9483,First time ever I am now unemployed...,0
9268,This is a great opportunity! 3 positions in Greenville SC Columbia SC and Macon GA! Share with anyone who might be interested! https://t.co/kQfZx5CbI8,0
4959,I am in Pittsburgh! Next steps: get an apartment get hired work keep loving life. :),0
5030,My old job already fired my replacement and wants me to come back and help. Oh man Im going to be making mad money this year #6Figures,0
6546,Got fired today and then they reversed the termination. Still employed baby!,1
974,Interested in a #job in #NebraskaCity NE? This could be a great fit: https://t.co/DR8EvBkTZk #NowHiring #GetHired #Manufacturing #Hiring,0
4454,i need a job is anyone hiring??,0
9430,WHO IS HIRING IN BUFORD/FB/GAINSEVILLE AREA I am unemployed as all heck.,1
6574,Got fired from one of my jobs any one know of a place that is hiring,0
6811,I need a new Good job wit set hours *9-5* I cant work random hours once my baby is born!! Anybody job hiring??,0
1098,Looking for a #remote position? We are seeking a #Category Manager for an #IT division #jobs #categorymanagement http://t.co/d3ahhLkGfZ,0
9161,I WASNT FIRED FROM MY JOB I WAS LAID OFF..... BUT U WOULDNT KNOW THE DIFFERENCE,0
6139,My new position is going to be cake! Good EASY money! Working the first hour then the next 11 hours sitting down being bored lol.,1
9183,I am now unemployed called off on my last day,1
8573,Lost my work card and called my manger the wrong name today. I really kill it with new jobs,1
3449,anyone know of any job openings? ya boy might get fired,0
5399,I wish I had the balls to quit my job who hiring!?!?!?,0
8357,So I just find out about 15 ppl got laid off at my job smh guess its time to start looking,0
7996,Interested in additional income? DM me I would love to share this business opportunity with you!  #WorkFromHome #SingleMoms #Unemployed,0
3326,I just got fired to get rehired as a cashier lmao,1
4821,I GOT A JOB. AFTER A MONTH AND A HALF OF DESPERATELY SEARCHING AND BEING UNEMPLOYED I GOT A JOB!!! NOT... http://t.co/2ySacheO0R,1
932,today I got hired on to a new position that Im not even qualified for with a higher pay than I ever wouldve expected.... Im in awe ❤,1
3696,Oh hey I updated my profile to reflect the move and the new job.,1
5338,RT @Flashy_Words: 6 weeks of unemployment &amp; I accepted a position today. I’m gonna treat myself to drinks &amp; sushi &amp; a pedicure!,1
7162,i was unemployed for less than 1 week this is like going by too fast,1
6171,First week working my new position and already I love everything about it. I feel very blessed! https://t.co/hpAKmW2yhJ,1
2016,Ight so I started this new job today right so Im in training class and the big manager dude ask who knows someone that works here this,1
1737,Laid off Friday unemployment office Monday sigh,0
3777,Now I cant go back to sleep because when I go back to Georgia ill be unemployed 😭😩😢😥,0
6134,First day at work at my new position went pretty smooth. A lot to take in tho.,1
6014,@Militarydotcom: Capital One @capitalonejobs wants to hire #veterans : http://t.co/zXuiLC5GFU #hiring #job,0
8681,Looking for a new job? Why not work for yourself? Try our free 7 day course &gt;&gt;&gt; http://t.co/6zJyjZ1QU3  #jobsearch #jobs #changeyourlife,0
1094,Today I am searching for a job pretty desperately again need to be busy and getting paid for it...,0
945,So today I got a new job and at the end of the day they fired the guy who interviewed me and gave me his position + desk. #BallerShit,1
3053,I really would consider moving if I hadnt recently started working.,1
8086,Im searching for a company or graphic design firm needing to fill a Graphic Design position in the San Francisco Bay Area #jobs,0
1978,Been working hard at my new job so I decided to reward myself! gibson #sg #gibson #custom #guitar http://t.co/o3HDIJvfLL,1
892,Looking for a new #job? Check out these open positions! http://t.co/3XV4XWp6ui,0
7893,Everything was going great at my new job until they sent me the new hire/orientation email in comic sans. Gonna have to quit now :/,1
4952,OMG. I went in for a job interview today and I just got hired,1
904,Today was a good day! Found out I got the position I wanted &amp; some woman randomly gave me a $5 tip,1
8885,So getting laid off kind of sucks! Related anyone hiring?,0
3378,This Week Couldnt Get any Better. #Seahawks Still Playing Return Of The #Sonics &amp; I Got Hired.,1
3361,I start at Aldo this week AND my best friend got hired there too?! We bout to fuck shit up ;),1
6842,Amazon posted a job you might be interested in. Software Development Engineer EC2 Networking - Greater Seattle Ar… http://t.co/b7EepFmcb8,0
3029,Well the new job barely has work for me too at least Im still getting paid.,1
4132,People w/BA are either unemployed or underemployed. This is your opportunity to turn it around http://t.co/7P0fVDrJ,0
4708,Today is the start of getting up at 430 everyday for workbut I could still be unemployed trying to be the very the best like no one ever was,1
4897,Currently seeking new employment.  Anyone know of any places hiring? Willing to work asap,0
923,Got hired  t best buy mobile last week &amp; today I have an interview with FedEx for a customer service rep position! #needthat#,1
3343,I got hired at a job last week &amp; quit the next day &amp; skipped two interviews that I had this week. I cant with myself.,1
4693,Its now 4:23 am gotta get up soon for work. HaHa Lol   Im unemployed.    Oh how I love Bed sores.,0
4080,I got hired with that what these bitches want from a nigga on my voice mail tho...,1
6552,I am a 4.0 GPA student w/ lots of experience. I got hired today for $15 an hour. I wonder who will get fired when they raise the wage to $15,1
2308,Looking for a #(NEW #POSITION) Associate Director Regulatory Affairs Advertising and Labeling #jobs https://t.co/nVyls7e1Kj,0
3366,So it seems like I was fired and re-hired and didnt even know it or some shit.,1
2306,Looking for a great part-time job? #Housekeeper position in #Columbus #MN --  http://t.co/cOWsX60nFH -- #nowhiring #cleaning #hospitality,0
6244,BP International posted a job you might be interested in: Regional Information Security Officer (RISO) GTEL - London United Kingdom GB.,0
3347,At a job interview this morning an employee peeked around the corner and mouthed YOU DO NOT WANT TO WORK HERE. I was hired. #badsign,1
9019,I just quit one of my part time jobs to make time for myself. Naturally 8 more positions are available and are interested,0
7548,I am looking for a job in bangalore. I am unemployed from last 3 months and~ https://t.co/29i7q1jESF #pray #prayer https://t.co/YdXgnBfKJf,0
4686,BROWN RECLUSE IN THE BATHROOM AT WORK LETS JUSTS I AM NOW UNEMPLOYED,0
5231,@AlphaTwat Where do you apply for that? I got laid off yesterday.,0
8312,I got hired at a Bangladesh sweatshop. Meet my 9-year-old boss http://t.co/KHFydTBoiZ via @torontostar,1
1746,RT @erinannie: How many times have I been laid off? The unemployment commission didnt issue a new PIN. They reactivated my old one. Pat…,0
82,I got hired at 2 places.. God is so good yall,1
3672,my new job wants me available full-time but only pays me for part-time https://t.co/vW4qyomFKC,1
2966,So my job just offered me my position full time just after me working two weeks which I did full time..,1
4957,YOUR HIRED! IF YOU NEED A JOB OR JUST WANT MORE MONEY WATCH THIS: https://t.co/Rjm2d0D6  #unemployed #needajob #needmoney,0
9428,Sweet. Im hired now I gotta tell these fucks that I quit,1
6203,So. God threw me a curveball. I got offered a full time position at LA Fitness earlier this week. Today...I accepted it!,1
1351,Interested in a #job in #Mesquite TX? This could be a great fit: https://t.co/OfubySvBJE #jobsearch #Nursing #Hiring,0
9316,I am looking for a buyer on 3803 Tulane Ct #Nashville #TN http://t.co/dIQMAzXcKE #realestate http://t.co/pA8hKUqzUg,0
6952,I Was Fired for Making Fun of Trump https://t.co/8vzN2YLfjA,0
5136,I got fired earlier and as soon as the store closed I went back to ask for my job back and they immediately said yes lol,1
7594,JPMorgan Chase &amp; Co. posted a job you might be interested in: Executive Admin Asst - COMMERCIAL BANK - CCB - NY NY - Greater New York Ci...,0
5361,I accepted a position after being unemployed 2 weeks. Pay not up to scale but it is a job.. #NoBamaCare,1
145,My job fired me and just hired me back wtf is my life 😩😂,1
6727,$ILIV going crazy I took a position yesterday morning $$$,1
8662,Looking for an opportunity to grow and succeed with a top Tampa workplace? #BGHIRES &gt;&gt;&gt; https://t.co/3XdGgYCTEV https://t.co/GYBqv87BCh,0
4635,i got hired at 678! time to quit todai!#todai #toDIE!!!!,1
6722,I had my phone interview but the position got mixed up so now i have to wait for someone else to call me and what if they never call.......,0
344,I am looking to find a fellow wine fan who would like to collaborate on some blog work.  DM me for details.,0
4899,I am looking for work.... anyone hiring?  Ive been looking and applying my heart out!,0
242,Got hired for a new job today. Pays $4 more than my current job full time + benefits. Moving up in the world!,1
6221,Microsoft posted a job you might be interested in. Berater Systems Management (m/w) - Cologne Area Germany DE via LinkedIn.,0
4071,I GOT HIRED TODAY THE DUDE IS ACTING WEIRD NO WORRIES THE JOB I WANT IS GETTING READY TO CALL ME BAC SO ON IT WAS ON HOLD SOMETHING HAPPEN,1
1949,I recently started working at a new job and now I have weekends off and a normal schedule and I don’t have to dread the weekend anymore,1
972,Interested in a #job in #Ohio 20226? This could be a great fit: https://t.co/eLTq7v9hOw #NowHiring #GetHired #Manufacturing #Hiring,0
4040,Searching for #work in Iowa City IA? Send your #resume to Department of Veterans Affairs. http://t.co/za2MoXL6sa #gethired,0
9343,Tomorrow Im going to a conference for my business internship that I still dont know how I got hired for??? What is going on this weekend,1
1734,To all of my baseball fan family:I was laid off yesterday and am unemployed 1st time in 20 yrs. Send leads my way pls! @BaseballDo @TepidP,0
2983,Weird state of my life. Yesterday I was being interviewed for a position today I was interviewing people for a position.,1
846,#jobs #unemployed Traveling PICU RN Registered Nurse: Palm Springs CA - Seeking PICU ... http://t.co/6dQlNgBqdn http://t.co/1Jnuthnk56,0
383,I am looking for some extra help. I am adding an auto repair technician to my workforce. Email me twonutsmessage@gmail.com,0
4465,In desperate need of a job  anyone know of any places that are hiring ???,0
4299,@Kirk_Hinote @catwahler unemployed sorry. Will 🙏4them.,0
6529,I Got hired and cause of that shut down shit now I got fired before I started and I was gonna start tomorrow  Lol smh Im mad,1
7882,Just started a new job 2 days ago. Tomorrow already got another job interview . So Ima quit my new job and get the other one 😎😂,1
9319,Looking for a new #job? Check out these open positions! https://t.co/GPYjd9ce5Z,0
8112,Ashoka posted a job you might be interested in. General Manager Youth Venture - Washington D.C. Metro Area US v… http://t.co/rHJUftmNOL,0
2252,Looking for office #job #training? @UnitedSouthEnd offers a program that prepares under - and unemployed workers for administrative employment with career potential.  Learn more on their website! https://t.co/cjUz8kn8eG https://t.co/vAcev5fc9n,0
1994,Ever since I started working at my new job Ive been watchin reality tv less and less now. I will be watch LHHATL tho next Monday!!!,1
3328,Got fired for two hours then rehired. Wtff #NOBITCH I need to start looking for a new job,1
1555,alright every who needs to pay me back better do it now cuz I just got fired from my job,0
6093,@RaLphy_ReLLo Sears hired me lol,1
3106,So I worked at this yogurt place and quit for another job just emailed today asking if I could come back,0
254,Got hired today by just luck. Rewarding my week of sobriety by celebrating being employed again. http://t.co/Qlm6pfvEDV,1
3709,My new job has an office dog. THIS IS THE BEST PLACE ON EARTH. THANK YOU FOR BLESSING ME WITH THIS OPPORTUNITY,1
4611,Today I said fuck a job and quit.,0
2995,My new boss is the nicest guy. Actually looking forward to start working,1
