id,text,class
1680,today I signed a contract quit my old job quit my new job then unquit my old job  so that was just great 🎃🔫,1
4111,I just got hired as a electrician and I start tomorrow,1
6143,Last day at the old job. Next week I start a new position which I found through @coreintjobs!,1
963,Get HIRED Today to Work for @LoveNightClubDc were HIRING for Multiple positions Txt 3013436531 for application http://t.co/xK878Mxvip,0
6537,I got a job today 2s later I got fired,1
4078,whatever i got hired today so thats good,1
1948,At my new job some guy had a dog in his office &amp; I asked my boss about it &amp; he casually told me they sometimes just BRING DOGS TO WORK!!!,1
4486,Anyone looking for a job wanting to drive a tow truck?!?! Get ahold of me kalebs looking to hire someone asap!,0
7868,My employment has been rocky this year. I quit my job today after my supervisor threw her badge at me.  I needed her credentials for my refund request for a customer. New job stars next week Nebraska this weekend to see family!! Short vacation!!,1
1269,Interested in working at @sus_org? Check out what opportunities might be waiting for you!  https://t.co/brX0vRwl8Y https://t.co/gsBowjXCrq,0
4928,After being unemployed for 5 months i went into Olive Garden interviewing for a to go position &amp; got hired on the spot as a SERVER!#blessed,1
4052,Got hired today to work at The Cheese Cake Factory. Got a job,1
253,I GOT HIRED MOFUCKA!,1
2166,Searching for #work in Santa Fe NM? Send your #resume to New Mexico State Personnel Office. http://t.co/4krwNDdDYo #gethired,0
7544,Job searching is never easy but anybody who knows me know I wont be unemployed for long,0
8815,Good news! I have been hired by an employer today! However i am currently broke and seeking funds for… https://t.co/7SAzBWsXFj,1
5719,I got laid off on Monday needing to find a job quickly also hoping my house~ https://t.co/EBlIQaTyhn #pray #prayer https://t.co/KK4e7zDX6b,0
1422,Unemployed Under-Employed Unhappily Employed? Find jobs &amp; career solutions on LinkedIn in JCD The Job Seeker &amp;... http://t.co/Rmgc5mEYNh,0
4978,Anybody hiring ?!?!?! ya girl needs a job,0
4028,Yea so I got hired as manager of a pizza place so prob nvr eating pizza again thats my new thing,1
3222,Got laid off today... And then got another job 5 hours later,1
513,Saw my first check from my new job today &amp; I never been happier that I got fired from my last job God is good,1
109,I got hired on at 8.50,1
3024,just started my new job and some bitch i work with decided to tell me that my bf fucked her in HS? Like ok? Do you want a cookie?,1
115,Lost my job yesterday. Jus got hired again LOLLL,1
3047,Ive learned more &amp; talked more with my co-workers in 3 days at my new job than I did in 3 weeks at Dicks. extremely grateful &amp; happy.,1
4621,Thanks to Marquita I got hired turn up,1
7867,I started a new job yesterday and I think I want to quit already omg what am I doing,1
2544,Looking for an exciting new #job? Opportunities include a Senior UI Developer position in #Arlington VA. #... https://t.co/dClbbeWAtU,0
6549,I get hired on the first fired on the second,1
7701,Default isnt an option. I was laid off from my previous position. Scared shitless. I found a new position back in Louisiana. #VICEonHBO,1
3356,Star Wars hired me as a celebrity endorser of their new products. I was immediately fired http://t.co/9MvRJ9n1Up,1
8496,Got hired for a new job today that will definitely change my life. Very thankful.,1
3308,I was hired on April 1st started on the 2nd and today got my first write up. At this rate Ill be fired before the 15th!,1
9359,Got called from an extras service in California to work tomorrow and Friday on a movie set. I was picture chosen by producers..UNION VOUCHER,1
4510,Microsoft posted a job you might be interested in. Sr Solution Spec SURFC ADR - SMSG - Beijing - Beijing City China CN via LinkedIn.,0
2539,Looking for a campaign position in Minneapolis in 2016? Apply to be a DFL Regional Organizing Dir. (ROD) today! https://t.co/bP4N8ket8j,0
2746,#Job #Milwaukee Sales Opportunity (Waukesha): Position Information Position: Automotive Program Sales Consult... http://t.co/fh6DujIP3Z,0
1080,Well I am actively searching for a new job.,0
922,Last week I got hired as the Scenic Designer of an awesome play! Today I was offered the Art Director position for a TV show! So thrilled!!!,1
9499,Today I left the ranks of the unemployed and joined the workforce again. #happyhappyhappy,1
1676,I just got hired in today and im already thinking of quitting by the end of the year....smh,1
2036,Looking for a #NewJob? #CareerCast has all your #Job and #Career needs at your fingertips. https://t.co/TP0fqqrlDk #CareerAdvice #GetHired,0
8315,my roommate got hired right after me and our friend who lives on our floor works there too this is so cute,1
6721,Well I injured my back at work in June. My RN position was posted at work. Not able to work. depression is severe just dont know anymore,0
9209,I woke up this morning realising Im still #unemployed so I went back to bed.,0
2232,Have you seen my mid-week video? I decided to vlog whilst unemployed! http://t.co/MAppy5oxiT #lbloggers #crazybloggers #bdib,0
1105,I am looking for a job as property manager or assistant property manager as full-time job.Let me know if you have something,0
6791,Anyone know any lawnmower repair person that charges fairly and does good/quick work???,0
1987,Im already subject to termination at work and I started 3 weeks ago lol . I need more clientele to end this job saga,1
9446,I was unemployed yesterday and have two jobs today lol #helookingoutforme,1
6018,@courtneycaw33: Praying I get this job!,0
4068,Got hired for a magic show tomorrow night who has a party on a Monday I do not know but I got hard for it,1
1991,First day at my new new job &amp; my boss is 10 mins late when I was 10 mins early..Hmm.,1
6507,I was just offered a position at the Seven Inlets Spa and I am still waiting to hear back from Massage Envy. Not sure what to do. #Decisions,0
4102,Hey I got hired full time today :),1
1993,I was stressing over leaving my old job but my new job treat me like I own the place. You really gotta be willing to progress,1
1076,am looking for a job i lost my job due to the misunderstanding btwn me and my manager according to the increment of my salary,0
5328,Unemployment its been real - but Ive got a new friend now. Its a senior-level position at RED Digital Cinema. They help make movies.,1
1534,Im not fired btw but I have a job interview next week becauSe this guy is FUCKING crazy lmao,0
6838,Network for Good posted a job you might be interested in. Product Manager - Washington D.C. Metro Area US via ... https://t.co/a6veGrMt1f*,0
4106,I applied yesterday and I got hired today lmao @ahricynthia5 @__AdamCCXX,1
7493,I am disabled veteran been unemployed since 2009 and I cant get disability benefits. I would like to do computer work (administrative or billing). My email:barryevanslive@gmail.com https://t.co/9CBcfriM5P,0
4061,Received a phone call today from Dollar General.  I got Hired! Woot woot!,1
3738,Looking for a new #job in #Kentucky? Subscribe to #JobAlerts! http://t.co/nlyggAo5xX,0
9406,My manager offered me 100 dollars for every person I bring in to apply and get hired.......... who needs a job?,0
2792,I got hired yesterday and started working the same day too 🖖🏽,1
8587,Unemployed or Looking For a Way to Make Extra Money? --&gt;&gt; http://t.co/OvRAR4rAEe,0
3763,Looking for a #Adjunct #Position – ​Principles of Marketing #jobs http://t.co/7U5AhGKDtN http://t.co/Mc4bIS0vxx,0
5037,On a personal noteI was recently fired because my job knew I was about to leave for a (much)better position.Inadvertent blessing though. :),1
6438,Laid off yesterday morning and got a temporary gig today? Still looking for a permanent position but its better than nothing.,1
9309,#Job #Birmingham Want to hire sexy muscle men (Birmingham): I am searching for built men to work on web cam from home http://t.co/xKu8mDd9NU,0
4024,I just got hired at my new job congratulations. I plan on buying my own firearm to carry around.,1
8093,Looking for a new #job? Look no further—Brivo is #hiring! Find out the details of our open positions: https://t.co/qnKnTrBgfV,0
4063,Got hired today to write two new Batman chapter books. Which villains should I choose?,1
4058,I got hired before I got laid off today #boilergypsy,1
4451,Teacher friend and I are in the works for a new job watching dogs sleep or blogging about hit shows each week.  Anyone hiring??,0
9445,I was unemployed for all of three hours yesterday Im not even kidding new job starts today,1
4803,I have been unemployed for 6 months however this is my future. Sending Bernie Sanders delegates to Philly. https://t.co/mZNoVM9HFV,0
4488,Does anyone know of any place hiring?! #asap I need a new job!,0
3214,i need to find a new job since im being laid off next month buuut i have no ideas,0
1031,As of June 8th no longer unemployed... just got hired as a data analyst / programmer at Cigna in Bloomfield...,1
3759,Looking for a job in #Bedford #MA? Environmental Engineer (16 https://t.co/lcJruuwUQe #jobs #hiring,0
2745,#Job #Memphis Jr. Java Developer: TN-Memphis Position Overview Provides application software development serv... http://t.co/kTK6jdehWO,0
5084,This position I got at my new job is love God is good all the tune,1
63,Crazy how I got laid off just last week &amp; got a new job already,1
5049,Ive been at my new job for a week and I just broke a fucking table in half so Im sure Im getting fired.,1
4874,Is anyone working somewhere that is hiring!? #pleaseletmeknow,0
1685,Quit my job yesterday got a new one today,1
8402,I was in a really good mood this morn after a tumultuously emotional week so of course this evening I got the news I am being laid off.,0
5974,Hi Dorothysorry I missed your greeting this morningI was just hired yesterday for another temp job-start tomorrow https://t.co/zutSNPqclg,1
5771,Im recently unemployed yet headed to Mohegan this weekend and Saratoga next weekend. Is that irresponsible?#toughlife,0
6224,Microsoft posted a job you might be interested in. Dir Solution Sales PROD - Greater Chicago Area US via LinkedIn.,0
2013,First day at the new job and my emotions  are everywhere #still dont know if thats a good thing or a bad one but Im rolling with it,1
2942,Same day call interview and Hire! Thank You Jesus! I will officially have a teaching position this upcoming school year!,1
4319,Not wrkin for no pussy ill stay unemployed,0
5732,First day of being unemployed and it feels sooo bad. I needa be on the go,0
9378,Looking For Entry-Level Social Media Work? 5 Tips To Get Hired http://t.co/LICfNcWh9D,1
5087,I started at my new job without quitting my 1st job. Who wants to dig me out of this one?,1
8880,Anybody wanna hire me? Just got laid off and need a job...,0
748,Looking to make great #money and have 2 years experience then we might have a #position for you! #loda #jobs #hiring http://t.co/uhgd61aA3b,0
7142,this time yesterday I was asleep and unemployed,0
4509,IBM posted a job you might be interested in. Intern-Recruitment - Gurgaon India IN via LinkedIn http://t.co/QdwHOGJMlN,0
1564,This morning I got a call from Walmart thats my 4th job offer this week I had to tell them I was no longer... https://t.co/Y9qMRo1BM4,1
5036,I am late on my first day at my new job and Im prob gonna get fired already I suck,1
2576,Looking for a role that has a direct impact on your community? Check out #Fremonts firefighter/paramedic position https://t.co/VyB1VjIy35,0
5508,Laid off? Tired of working for someone else? Let us help you find the right opportunity. https://t.co/gu6nGiFBAA,0
6194,I love my new position at wrk but man... Ive nvr ended a shift wishing that I worked at least 3 more hrs just to finish up paperwork.,1
5317,Well since Im unemployed now who wants to watch some daytime TV with me???????,0
8972,Looking for a job? OSD’s open positions can be seen here: http://t.co/c1ix0kU8qk,0
2734,#Job #Houston (USA-TX-Houston) SMB Sales Representative II: An mid-level sales position targeting small-to-med... http://t.co/M5KeHPGHTI,0
4963,Well I also applied for jobs so hopefully I get hired,0
8985,My unemployment has been approved which is incredibly helpful while I try for some Day job positions… http://t.co/Sop5ft27FL,0
7654,I got laid off after working with MB for 5 years...I got laid off at 23 years old?! Holy shit this is ridiculous,0
8942,Laid Off? Start a - Work at Home Business in 24 Hours or Less-  http://t.co/ty7TAItcGj,1
6428,This blog post is about me getting laid off yesterday: Unemployed http://t.co/r3TkMKxp #employment #arts #nonprofits #veg #vegan,0
728,That moment when the position you interned in as a college student is now up for grabs. Yes here is my application please and thank ya,0
8447,I am job searching for: Work at home jobs! http://t.co/4tgcXWg6JK — Walker Inklebarger (@Walker_marocliv.... http://t.co/mY5DQRYH1f,0
104,I JUST GOT HIRED ON THE SPOT AND I ALREADY LOVE MY BOSS HES SO NICE OMG I LOVE STARBUCKS,1
114,lost my job today which sucks but a friend hired me right away to watch her twins starting tomorrow. So tomorrow is a beach day!,1
7319,Boss told me to clean my desk out. 3rd time Ive been fired,0
8,I WASNT FIRED I WAS LAID OFF BUT YOU WOULDNT KNOW THE DIFFERENCE,0
1436,Need to Make a Career Move?  Need a New Job?  Unemployed? @leezabyers Can Help: http://t.co/hwaFiCd9qZ,0
9280,Positions we are looking for is  a DJ Graphic Designer and a Camera Person if your interested inbox me you will be compensated.,0
6737,A week ago I quit my job accepted another position &amp; started working out again #fitgirls #lifeisgood #finally,1
2557,Looking for a summer job?  There are over 120 positions on the #WWU Student Employment Centers website. http://t.co/QAhs9xDyDf,0
7832,Ive been at my new job for 2 weeks &amp; theyve texted almost every day asking me to cover a shift. I already hate this &amp; want to quit.,1
9402,This is my last full week of unemployment! Ill be so happy when I see my first grown up paycheck! #someonefinallyhiredme ☺,1
8808,Tired and hired. I now have 3 jobs.,1
92,Got hired on the spot. God is so good to me,1
3970,So I got hired I feel like a fucking boss YEaaaa!!! #winning,1
167,Got interviewed and hired and worked all in the same day. #EMPLOYED,1
977,If youre a hard worker and interested in making real money as a delivery driver hmu and Ill get you hired,0
8820,Just bought more equipment for trip and future work I got going on. Can’t wait to get a gimbal but my next buy with be this cage ! Already got hired to do someone music video ! I am hyped to start this new venture of my life! https://t.co/DAtn3DmPpm,1
8264,Anyone know places that are hiring? Just got fired.,1
2328,I was unemployed for 3 weeks. I couldve started a job sooner but I choose not to so now I have to train myself to go to bed before 5am lol,0
950,Job hunting with @Pshwazzy today step brothers style went well. Got hired on the spot and offered management positions. life,1
3611,Im really unemployed right now lmao Ive had a job since I was 16 its weird.,0
6158,Im off of work for the next 2 weeks until I start my new position.,1
3572,I got the job!!!!! You can call me what you want but you cant call me unemployed!!!! Lol,1
9281,If you are looking for an Accounting Specialist position or know someone that is here is an excellent opportunity: https://t.co/M1jLiULECz,0
2329,I know that as much as the #jobhunt is going out and chasing the other part is waiting and boy is my mind hurting from waiting. #unemployed,0
294,Got hired right after I interviewed,1
3969,Almost won in the works bingo for $50 and I got hired today lmao,1
3061,Im bout to start back working out Yall. My new job has a gym,1
2938,I had the shortest job ever. Got hired on Friday &amp; boss told me he changed his mind about offering the position when I came in 1st day. :O,1
8851,I have a permit and I literally got hired at a job last week you are not in my life anymore you know nothing https://t.co/XWNJJXJZAr,1
5362,Unemployed?? Start Now were now HIRING Full time positions available http://t.co/YPoc1t7fI2,0
7980,When you are long term unemployed for whatever reason one day blends into another. Now how to turn that into an opportunity?,0
8858,I have been Hired by Exeter. #FootballManager,1
8591,Unemployed or Looking For a Way to Make Extra Money? --&gt;&gt; http://t.co/2oeyhGBvca,0
2541,Looking for a #Academic #Psychiatrist Position Available #jobs https://t.co/eZ2ERrcrEX https://t.co/pKuZmCStvm,0
1392,Unemployed Under-Employed Unhappily Employed? Find #jobs &amp; career solutions on #LinkedIn in the Job &amp; Career... http://t.co/TKj3x6Gnoc,0
9397,All hired. Now I just gotta take my drug test,1
9365,Looking for a Contract Negotiator Job?  Email info@hiredbyfriday.com http://t.co/9Erin7S8VV,0
4455,Well shit i needa find a new job anyone know any hiring???,0
7834,So I quit the mover job last week and today was my first day at the new job. Back working at a warehouse.Definitely gotta get use to 5am-1pm,1
8633,UNEMPLOYED ? sell someone elses products http://t.co/4tQ8OWO0O2 http://t.co/0hdE2gVztr ways to beat economy info news links ideas,0
2703,#Intel: #Multiple #Positions For Wounded Ill or Injured Veterans in New Mexico and Oregon in #Hillsboro #job http://t.co/rr9v5vG1fu,0
4258,I am applying for every fellowship I can find in 2018. I am so fired up to learn and share knowledge! My brain is ready to expand.,0
4108,Well I was gonna go job hunting in CC tomorrow but ended up getting hired like 5 minutes ago,1
3549,I had the worst job interview today. I feel bad for whomever takes that position. yikes.,0
8518,Got promoted at my day job and got a new night job today also signed the lease to a new apartment! Wow its been a crazy day!,1
1400,Unemployed Under-Employed Unhappily Employed? Find #jobs &amp; career solutions on #LinkedIn in the Job &amp; Career... http://t.co/Gs7XVm0VAU,0
5852,Bloomberg is hiring a Software Developer C/C++ - Equity Products Job http://t.co/wRTnFZfP4e #job http://t.co/jKGAuxsYFt,0
8284,Got hired at my new job AND got free tickets to tomorrows Mexico vs. Nigeria game? Sounds like a great day to me ,1
107,So I got hired @ this financial service place &amp; I already quit today.,1
8867,Hey guys I just got hired for a new modelling thing and also Im on two new reality tv shows for #2014 and make guest appearances on two!,1
4624,Quit my job yesterday and got a job today #merica,1
8334,Im already hired at my new job just waiting for my background check then Im good to start😌,1
6762,I was recently been given a position to volunteer once a week in a library at A.C.T.  -Exciting times- :D,1
3348,Natasha got fired and I got hired,1
4500,anyone in #inlandempire know of anyone hiring? its time for a new chapter/better job,0
377,Looking for a new career re-entering the workforce or just want to work with kids? Tutoring opportunities available http://t.co/6M3QZKPNrj,0
5060,Gave two weeks notice 3 weeks ago. Started new job yesterday. Yesterday the old job was telling people they fired me. I’m not ok with this.,1
8063,I searching for someone to fill a leadership position on my team! If you are passionate about natural health alternatives please contact me!,0
3679,My new job is the shit and this my first day,1
4820,Being unemployed has allowed me the time to pursue things I love. For example naps,0
9245,Anyone looking for a job? @AvantLink is hiring an account rep position: http://t.co/SEOJiiS7Ry,0
5874,RT @RunningCrazy1: Quit blaming each other and fix the fucking problem!-what I just said in this meeting.-oops-anyone hiring?,0
3313,I find it funny that I was fired yesterday and then rehired lol,1
8721,Looking for a Fun and Flexible Work at Home Job? https://t.co/o4kQHiBEXW #Moms #Jobs https://t.co/5hA2Z3Hexc,0
4754,Anyone kno of places near glassboro thats hiring? #mommyneedsajob,0
5723,I am no longer reporting on education @indystar - laid off Friday. 110% unexpected. Still bent on journalism/covering ed so plz RT,0
7587,Amazon posted a job you might be interested in. Sr. Software Engineer - Amazon App for Android - Greater Seattle A… http://t.co/NYAewKds2n,0
4648,OmG I just got hired at the bank I applied to ha Im quiting my current job thank you jesus thank you lady who interviewed me,1
8827,Just got hired as a part-time web developer. Woo!!,1
9560,RT @clarissa: Im a UX designer/developer/strategist looking for a new position preferably to work remotely. Anyone hiring?,0
8926,@TheGreenClovers know any places in the area that are hiring? Got laid off today.,1
2282,Looking for a Want to be on the cusp of development? Ruby on Rails/Java developers in Morrisville NC http://t.co/CHRt4eRCpO #job,0
6580,Got fired today but at least I got a haircut and my eyebrows done. ha,0
2235,Unemployed since Friday. This sucks.,0
5764,This place just sent me 5 emails to tell me I didnt get the job. I get it. I suck and will forever remain unemployed,0
3660,I officially began my new job yesterday. The whole crew there is really nice and they sent me home today since Im sick lol.,1
6764,Last week I was offered full time my sister just got a new job that is full time and my bf might start a new position at his #Godisgood,1
6788,Anyone hiring #graphicdesigners? Go to http://t.co/r3oym8xtCr #adobe #photoshop #portfolio #artist #designer #graphic #work #career #job,0
3991,MY JOB HIRED ME BACK!!! Im hype af!!!,1
8340,BK fired me Saturday I was a little upset  &amp; Monday Macys hired me 😂😭 Lol whoooop everything happens for a reason !,1
8320,My Internship at the lab ended  today. Got hired at another job soon after  I hope training goes well. 😝 cant wait!,1
1184,So the company I do freelance for stopped production and I got basically laid off this week but Im going to start working fulltime at regular job and just asked for a big raise today so ¯\_(ツ)_/¯ well see,1
8325,So finally my job gave me the date for orientation. Like come on I was hired like 3 weeks ago lol,1
1679,just got hired at Cal sun 2 weeks ago and I already am quitting LOL,1
9510,First thing I am told upon my return to work: Youre laid off next week.Great...Now I have to burn another 5 days of holiday pay. fml,0
5662,Laid off engineers: An early retirement or your own startup? Help to decide is here https://t.co/3ldrxreHTl,0
7475,Now baby girl the dump she no loger wants me Im no longer hired she said that i been fired,1
9511,Laid off. 28 years old. First time without a job since I was 16. Im lost anxious and overwhelmed. Please lend me your ears and provide a…,0
2805,Today gone be a good ass day! I just keep getting good news! 1st I get hired in. Then found out ion have to work tomorrow.,1
9501,@VAMOSteph UNNNNNGHHHHH THIS IS RIDICULOUS NEWS FOR SOMEONE MY AGE. However I AM recently unemployed... (Oh yeah I got laid off Wed!),0
6178,Super thankful for my new position I love my job,1
7947,I quit this week again.,0
4073,today I got 2 awesome things got my Texas driver license and 2... FINALLY GOT FUCKING HIRED!,1
289,I JUST GOT HIRED TO BE A WAITER AT BUNKER HILL BAR AND GRILL WHICH IS A NEW RESTAURANT OPENING UP AT THE MALL HOLY FUCK IM SO HAPPY😫🙏,1
1116,I am searching for a good job but i am not getting it .i am already 29 yrs and i dont know wen i will http://t.co/xeAPAYWQPu #pray #prayer,0
9100,A1. Getting the email that said my position had been eliminated I had never been laid off before that was scary #Internpro,0
9128,Hi i got laid off and also lost a brand new iphone 7 who wants to paypal me $180 for a replacement pls ive been having such a rough time,0
3251,trying to figure out the best way to get fired so i can collect unemployment until i start this new job..,1
3057,Today I made a customers day and a customer made mine: So I recently started a second job working in retail ... http://t.co/osuM8pFwt2,1
8327,The place I just got hired at is closing next month so things are going swell for me,1
7710,@DescovaUAsh yeah things are ok. I got laid off from my job so now Im looking for another graphic design position. Hope to land one soon.,0
4470,Anyone know where is hiring?? #NeedAJob,0
8801,Just moved in NYC hired in Google amazing tech crazy life in Manhattan. I am living a dream and its my bday ;) http://t.co/dOCgfiOjFF,1
4280,Two new rts join the family after financial and mental health debate. Autumn and Drizzle are here to stay #unemployedbiograd!,0
8817,I have gone from underemployed to (temporarily) over employed lol. Havent done a class session since I was hired but I can tell by the end of next week Im going to be exhausted T-T,1
7591,Ingram Micro posted a job you might be interested in: Cloud Business Manager - Orange County California Area US.,0
6285,Microsoft posted a job you might be interested in. Senior GD&amp;I Manager - Greater Seattle Area US via LinkedIn.,0
8712,Looking for a new career opportunity in 2019?  Join our Consumer Leadership team for a Career Fair on Tuesday December 18th from 5:00pm-7:00pm.   Learn why BOK Financial was chosen by @Glassdoor Best Place to Work in 2019!  #LookatBOKF #BPTW    13230 W. Little York 77041,0
135,whats funny is the job i had today wasnt even mine the guy didnt show up at all i just took over &amp; the designer hired me #blessed💃🏽,1
372,I am getting no hours at work. Searching for a new job.,0
4831,I know I am. Since my contract ended #unemployed I have readjusted my life priorities to focus on stuff that makes me happy people I love,0
7126,Ive been unemployed 8 months ask me how many people referred me to anything.,0
4091,Lol not sure why but today I got hired for a real job,1
1650,But people ask me I cant believe you quit your job to find a new one lol you know how hard it is to job search when you work office hours,0
