id,text,class
8838,i just got hired as a sales rep yesterday at dish network. as of today im the manager in charge of my own squad.#GreatWorkEthic,1
7592,Here is an opportunity for you to create a #startups and become an online #entrepreneur. Get your start here. - http://t.co/LnOwNmremq,0
5739,I was unemployed for 4 months and about to give up. Then I just got 2 jobs in the past 24 hours. Life is unpredictable.,1
4086,finally I got hired! thank god after I move its gonna be 5-10mins away.,1
284,I got hired a week ago but I havent started yet like what gives,1
2728,#Job #Gadsden Over the Road Driver Company Driver Needed! (USA): Immediate position available for experienced ... https://t.co/rM99CVhBfk,0
3350,my dad just fired and rehired me within five minutes so thats fun.,1
1106,#NashvilleGigs I AM SEEKING A CRAIGSLIST POSTER. EARN EXTRA CASH POSTING ADS http://t.co/RxKM3YzGJ9 #Nashville #NashvilleJobs #gigs,0
7094,My boobs are loving this unemployed thing. They dont have to go to boob jail everyday. #NewGirl,0
1126,I am getting a job as a trader on Wall Street and buying a house in New Jersey. Also I have found Jesus.,1
6777,does anybody thats working know if the place youre working at is hiring? needa job,0
8697,Looking for greater challenges new opportunities and a working environment that lets you challenge yourself and showcase your skills? Look no further! Join us: Intern https://t.co/VIaGW2Lqtb #Veterans #CareerArc,0
4753,Now whos hiring?!?!,0
4065,So I got hired today yay,1
8777,Looking for a job? Project Manager I - Wind Energy Group (IRC9852)Job Details at M. A. Mortenson ... http://t.co/AR6c2sySUt #green #jobs,0
3599,Going 2 be unemployed for a week until my new job starts but I cant afford that wait so now I gotta sell my body like the bonafide hoe I am,1
84,Got hired at a bank life is good,1
8605,Employed? Unemployed?Join the Network of Employable professionals at https://t.co/zxLDzgc4uJ Get Listed!&gt;&gt;&gt;Get Noticed&gt;&gt;&gt;Get Employed,0
2286,Looking for a job a new career or more job satisfaction? 51 Career and Job Affirmations. http://t.co/Zkv30ItwAy,0
3525,Working earlier now in my new position. I am more than thankful for it. Thank you Lord.,1
3510,I set my goal earlier this year. Now I work on it. Resumes sent out tonight for Electrical Supervisor positions. Lets see what happens.,0
495,Well I didnt get fired on my first day at my new big girl job so thats something I can be proud of for fifteen minutes.,1
7327,So I got a part time job counseling kids and families. Was fired today. Riding Harleys and smoking cigars was cited as reason. Bad example.,0
520,Yea Im happy I got a new job. This white lady at my old job wouldve been hype this morning if I went in. I wouldve gotten fired today.,1
6850,Dell posted a job you might be interested in: Network Design Consultant - Dallas/Fort Worth Area US.,0
5981,I was hired! 😄🎉💕,1
3141,My uncle told me since I lost my job if Im not working soon I can come back to the jungle. I responded by getting one fast cuz I never quit!,1
5430,I got fired wednesday now I have orientation wednesday look how God works.,1
4502,Anyone needing a job? Five Guys Burgers and Fries ( Uptown Station in Fort Walton ) is now hiring crew members.... http://t.co/D4xrCYDZHJ,0
1352,Interested in a #job near #Mesquite TX? This could be a great fit: https://t.co/C5lequ0zFW #Labor #Hiring #CareerArc,0
2516,Looking for a new opportunity at a company that values employee engagement hard work and community - with a whole lot of fun mixed in? Consider applying for our Administrative Assistant Position! Details in the link below: https://t.co/0IzrjcFozg https://t.co/GuHIIkbOh2,0
3530,I got the phone call for a better position @ my job you know this a good week for me,0
6511,I am working on a new FT Business Analyst position with a growing company in the Hunt Valley area. My client is hiring immediately! Want to…,0
1435,RT @Neil_ODonnell: Unemployed or looking for a new career path? Discuss options with a certified career coach https://t.co/bVetho3MN1 #jobv…,0
5819,one of our hostesses quit today so Chilis is hiring !!,0
4009,Not gonna lie if I get hired at this new job Im gonna miss my coworkers at McDonalds well some of them.,0
349,I am job searching for: Work at home jobs! http://t.co/4tgcXWg6JK — Walker Inklebarger (@Walker_marocliv.... http://t.co/eXIeEZM9cC,0
9010,Unemployed? Use The Social Web App to see open Social Media positions. http://t.co/p2cUeusKjL #unemployed #jobs,1
70,hmmm to become a full time streamer since i got laid off? hmmmmmmmmmm yeah right better off with selling my body.,0
6809,Looking for work for the summer . Anyone know where they are hiring??,0
4444,does anyone know of any jobs hiring rn????,0
2757,I am looking for a social worker internship. If anyone knows of anything please let me know. I have to have an internship by June,0
9018,I got the position! I am now a part-time sports clerk for the Charleston Gazette!,1
6261,Heres an opportunity that you wont want to pass up: Supervisor - https://t.co/JfcIk50g1G #Retail #Austin TX #Job #Jobs #Hiring #CareerArc,0
8550,Today I was hired to teach skateboarding lessons at a birthday party. It was a group of 10 kids. Out of the 10 only 1 tried skateboarding for about 10 minutes of the 60 minute lesson. The rest of the kids rode scooters. But I did teach a them a scooter trick. Still did my job,1
9358,Bitches really put me on medical leave. They lucky I got a second job today,1
9388,The world’s most famous unemployed quarterback is unemployed no longer.ESPN announced Monday that it has hired... http://t.co/QXOcDjjrC2,1
5760,Guys at my work started talking about anime. I am now unemployed and looking for a new job.,0
3195,my swag is currently middle age dad who while searching for a new job after being laid off has finally landed that dream job hes wanted,1
6869,You mightget warnings and write ups can be late for work  And not get fired Only take me one time and I get fired,0
1539,Yesterday I got a job and today I got a call from them and I was like oh no this is where they found my Twitter and tell me I’m fired but false alarm it’s all good.,1
8996,RT @arrowt: If anyones company has any Windows/UNIX/data center positions open let me know please thanks. (I am getting unemployment so.),0
677,Hey so I smacked a bitch today at work cause she would shut the duck up so I had to. So today I got fired and now I am a stay at home mom while my bae is at work,0
4095,I got hired at 2 places today! Aye..bitches gettin paper;),1
7119,Hell yeah I got the job! :) It all started thanks to http://t.co/9RhBgP5osj #unemployed #resume,1
5050,New job paying me 50 cent more than my old one. Im glad i got fired from that mufucka doe. Bounced back even harder.,1
3112,So I quit my job today. Does anybody know if Office Depot is looking for animators?,0
2555,Looking for a teaching or education position? @cityyear @cschools &amp; @AUSLChicago are attending the Winter Career &amp; Internship Fair,0
126,Quit my crap job yesterday today I got hired at a restaurant opening in March. #favor,1
6763,New position is twice the work for the same pay and my new super seems like a dick. Awesome,1
8847,just got hired on to be a Student Events Planner at USC i will be working alongside the Director of Student Events Planner :),1
2931,WELL I GOT OFFICIALLY HIRED FOR THAT CASHIER POSITION AT LEASTWOOP WOOP GIMME DAT INCOME,1
7917,wait ok this time last week i was in philly and TWY just now opens a pop up shop on the same street my hotel was on JFC I QUIT.,0
3973,I just got hired at a dental office things couldnt get better,1
7459,Now baby girl have dumped me. She no longer wants me. Im no longer hired. She says that Ive been fired.,0
7644,Are you or someone you know interested in a Account Executive role? Check out this job! #jobs http://t.co/Zlw5ElxJWu,0
643,Just got hired to clean another store at water side shops named Panerai boutique .. Does anyone know what kind store is that ?,1
2882,After 141 days of unemployment I am so excited to be at work tomorrow morning!,1
1983,Recently I was talking to my therapist about how since I got my new job I stopped crying all the time.,1
8779,Looking for a job? Solar Energy Consultant at Company Name Withheld (Ontario CA) http://t.co/Xcvd6PINju #green #jobs,0
2344,anybody know any places hiring??,0
8271,I got hired at a Bangladesh sweatshop. Meet my 9-year-old boss [video] http://t.co/QzU28IMnCF #hackernews,1
3018,Ok so I just started my new job and found out 4 of the girls I work with are lesbians,1
9156,My company laid off 500 people today. At least I was told I was getting the axe well in advance.,0
2381,Anyone looking to work for a great company? The Lowes of Leesburg VA is now hiring. Let me know if you are interested! Hiring 161 people!,0
5897,First day at new job 7 a.m. car crosses the center line coming at me in a sharp curve I ended up off the road and bent a rim on my car.,1
2070,Looking to hire or get hired? Check out our Career Fair http://t.co/4DMP0xj9ZR @k985waterloo,0
1666,Just got hired and Im finna quit real quick,1
493,First day at my big girl job complete. Didnt get fired. Id say Im off to a good start.,1
4476,Anyone know places in CLE/Akron that are hiring?!! I am having a hard time finding a job. Please let me know of any,0
8452,I am job searching for: Work at home jobs! http://t.co/4tgcXWg6JK — Walker Inklebarger (@Walker_marocliv.... http://t.co/8RY7nmzhIb,0
1039,Just got hired on the spot full time factory job awesome shift very laid back. I am happy 😋😋😋,1
753,#Maintenance Technician #Are you interested in an entry-level position with a growingproperty management company? If you are ready to start your career this couldbe the opportunity for you! RHP Properties* ( https://t.co/2NXiLmE1pD via @jobsearchmoney #jobs #search https://t.co/DP3a3YL2As,0
5792,i have been unemployed for so long kinda enjoying it but hate not having income,0
3383,#Uber fired more people for worse reasons and rehired them back yet wont rehire me for being choosy &amp; actually wanting longer trips #LOL,0
4443,Anyone know any jobs hiring ???,0
5130,Last week: I was looking for other jobs. This week: got a raise got 2 interviews as well.,0
6671,Hey guys. I still cant get ios7 and I lost my job today lmao what a good day,0
1830,I am seeking people who have professional service support businesses. Not people who believe they have a business by sales affiliate or ma…,0
3914,#Accounting #Job in #Milwaukee WI: Accounts Payable Coordinator at http://t.co/TqEt5Bf00c #Jobs #TweetMyJobs,0
6806,who is hiring that lets you take vacation days whenever and work 10 hour days ??,0
6852,Oomfs just got hired now is on his way bout to get fired,1
3712,Recently I just been fuckin and making art exactly what I saw myself doing in the future 5 years ago,0
5750,I work tomorrow... 😅.. I so understand why people stay unemployed now hahaahha,1
9291,We are looking for Automotive Detailers for full time positions! Message me if you or anyone you know might be interested.,0
6718,Crazy how I lost my job then got a different position at the same company now Im making more,1
8676,Looking for a new opportunity? Bartlett &amp; West is seeking a public works focused manager to work in Fort Worth TX. https://t.co/6Ni26cVNH1,0
5468,Long Island town fired me for complaining about racist coworkers https://t.co/YeGWAbEAlO https://t.co/vryxjzgDUv,0
5813,Nothing like losing your week vacation because someone else quit. Anybody Hiring?,0
3739,Looking for a #Full #Time Assistant 3rd Shift Grocery Manager Trainee - Central Avenue #jobs http://t.co/yeDq4MSKHg http://t.co/1tkXESwv0t,0
4660,I just got hired at TGIF at the Rim and I already wanna quit and get a job at BJs at the Rim lmao,1
1238,Al-Futtaim Group Real Estate posted a job you might be interested in. Project Manager – Network Development | Auto… …,0
2352,Is anywhere hiring?? Someone please tell me of somewhere,0
4054,On the bright side I got hired today and the weather is nice.,1
8795,Looking for a new career? Qualified Staffing has lots of openings- take a look now! #qualifiedstaffing... http://t.co/FVmKXp9Ok1,0
1977,I should of starting working at this new job this week now Im home bored asf,1
3602,I have gone from unemployed &amp; going nowhere to 2 jobs &amp; registered for school in about a month . Im proud of me .,1
8297,I got hired at a Bangladesh sweatshop. Meet my 9-year-old boss http://t.co/GNZNTQPpC0 via @torontostar,1
367,I am looking for a videographer who can do some outstanding music videos. I got a project I am working on,0
292,OMG I GOT HIRED @ A&amp;F. #Happiness #Menlo,1
2127,Looking for a #NewJob? #CareerCast has all your #Job and #Career needs at your fingertips. https://t.co/iG4z5uHE7u #CareerAdvice #GetHired,0
6616,Dylan lost his job &amp; I got a job today ...funny,1
7730,Looking to launch a career in #Nursing? You might want to consider relocating to one of these 10 cities. https://t.co/3ZVv3AFhPP,0
121,Quit my job last Monday and got rehired again today. Woo! So long unemployment,1
5891,I started my full time job about a month ago. Does that mean I can retire now? #kovalchuk,1
7345,I quit my job to be a travel writer and now Im broke and unemployed https://t.co/T25xyR7HKR https://t.co/0nJ5qTKVK1,0
1111,I am Looking for work in fixing computers or security jobs.https://t.co/HsApvrA7Se#fintech #bitcoin #rimbit #crypto,0
4279,They keep saying there is no workforce. What about the 23% of our community that is unemployed? Do we matter? @MayorHodges @mncapitol,0
5763,Ive Now Been Unemployed For Four Months Now. I Cant Start My New Job Until I Get My Fingerprinting Physical &amp; PPD Test Done.,1
8082,Searching for an accounting position in Knoxville? MVP is seeking a FT GL Specialist. Contact me for info. http://t.co/aCr4FG5j7S,0
6652,So in 4 days I lost my job and my apartment. Ive got 19 days to find a place to stay and income. Im fucked.,0
5321,Hmmm so this is what unemployed people do all day,0
2799,Went applying today got hired on the spot. Worked a 12 hours shift now Im tired af,1
4105,today i got hired at a nice paying nice job AND I BOUGHT TICKETS TO SEE BOB THE DRAG QUEEN DURING PRIDE WEEKEND,1
2342,weird mind place bc my job made me depressed which led me to drink dangerously but I can tell Im a different depressed being unemployed,0
3986,That was crazy fast. I applied on Thursday interviewed Monday got hired today (Tuesday) woahhh,1
3748,Looking for a new assignment or ft consulting job in the USA? http://t.co/iUt9icxf Very inexpensive to post your spots,0
3630,Hey I got laid off today. @FBI you hiring?,0
1058,Currently applying for jobs....,0
5445,My work called two hours ago while I was sleeping this is why Im going to get fired not even after a week lol,1
6235,Ashoka posted a job you might be interested in. Volunteer Fundraiser (Virtual) - United States US via LinkedIn http://t.co/7M0gq58U7e,0
2042,Looking to make a career change? http://t.co/4Ij4flTi9y       #linkedin #monster #hotjobs #gethired #careerbuilder #jobs #hiring #management,0
4625,Today I said fuck it..I quit my job and became a #unicron,0
7988,Heres a nifty internship for your unemployed college grad or unemployed college-going teenager.  As an added... http://t.co/JPdSm4AGR9,0
258,Got hired and fired in the same day😐,1
9099,@hollak77 @cneesam i actually got hired at one in madison and then laid off before my first shift so that was nice,0
1110,I am job searching for: Work at home jobs! http://t.co/4tgcXWg6JK — Walker Inklebarger (@Walker_marocliv.... http://t.co/Wzgp5pE2qL,0
405,#Job #NewJersey Client Services Director – Account Management CPG: NJ-Newark Full Time Permanent Position for... http://t.co/2Z2apfYPYF,0
5747,Youre not talking to me lost my zippo unemployed and my best friend hasnt spoken to me in idk how long.,0
4055,So i got hired today rite away and start tomorrow at my new job,1
8537,went to interview today i got the job yall!!!,1
961,I went in American Eagle and filled out for a seasonal position less than an hour ago &amp; they just called &amp; ask me to work tomorrow,1
4098,Got hired today at port of Miami which means I get to meet all the bad bitches on the ship 😍,1
2503,Interested in a #job in #Murfreesboro Tennessee? This could be a great fit: https://t.co/LlleR0g6NU #NowHiring #GetHired #Manufacturing,0
6141,I just started my new job like two weeks ago and my boss just took me outside to offer me a new position #NoThanks #ImOuttaHereInTwoMonths,1
8846,Just got hired on to work on the Campaign for Georgette Gomez for City Council.  I like her as a candidate and... https://t.co/PO4sBykLNW,1
6996,Looking for a job as Nurse? ! $1000 bonus - Sign up to drive   #fired #layoff #work https://t.co/XEKH9eaDfG https://t.co/4ilKpZTL3y,0
5149,I was fired from my job for being a witch https://t.co/zR5BHkgIfU https://t.co/EwO9ovOy4G,0
2039,Looking for a new #career in #technical support? Get hired by doing this one thing http://t.co/hPzi6392Dl,0
8710,Looking for a chance to network with UF faculty/staff and dynamic student leaders? #MeetUF https://t.co/MkOAzYNUhT http://t.co/ouMj7sjCGB,0
9420,I am one of those #overeducated #unemployed  - My education scares companies to be hired #HumanResources #TalentDevelopment @HillaryClinton,0
8624,Any College Students or Unemployed Individuals Interested In Marketing or Blogging? Apply Today: https://t.co/lhAqQTPRBZ https://t.co/R5Q8lpLnJh,0
9214,I am no longer unemployed! Today shall be the last day I submit for unemployment. Huzzah!,1
3985,I just got fired from my job and rehired all within 15 minutes 😐,1
6822,Here is an employment opportunity to work with one of the coolest products on the planet earth.  Apply Today! http://t.co/ih0DONBS57,0
6170,My new boss seems to like me so far.But i know hes not pushing for anything this week since im new to the position.,1
2047,Looking to make a career change? http://t.co/rA54iIaZKx  #linkedin #monster #hotjobs #gethired #careerbuilder #jobs #hiring #management,0
6,I was laid off with a severance package-so of course that softened my blow. But I was unemployed nonetheless. Ive never relaxed so well.,0
98,Got hired on the spot &amp; some random guy took the dent out my car for $20..today a good ass day lol,1
1198,Got laid off today. The Oilfield industry is brutal right now. Time to find a new job 😔,0
6553,Today I got hired promoted &amp; then fired from a Briarcrest commercial...thats all. #actress,1
4157,I think my Chinese house mate is currently living on Chinese time. I am living on unemployed borrowed time.,0
3298,I got fired today and got hired somewhere else with more money 30mins later lol,1
3661,I cant believe working 2 weeks straight is a normal thing at my new job,1
4851,I am now homeless and unemployed.... Thanks college.,0
4846,Im watching the Doctor Who 50th Anniversary Special because Im a big Doctor Who fan and Im also very unemployed.,0
4602,Monday Kohls hired me. Tuesday/Wednesday I got a call from Starbucks &amp; got hired after the interview so I quit Kohls.,1
5033,I was recently fired from my job seeking unemployment and better work,0
2058,Looking for a New Job? Interested in a Career Change? #CareerCast Has Everything You Need and More! - https://t.co/eHENJJMqu4 #GetHired,0
964,I had 2 job interviews today &amp; nailed both. got the offer for both position on the spot! now I just gotta pick.,0
2005,Just ended my shift at my new job and now Im about to start my shift at my old job literally kill me,1
10,I just got laid off had to drive home in rush hour traffic and my car broke. Fuck you too life.,0
3926,#Albany #Jobs Gas station cashier needed for overnights. (clifton park): I am looking for a full time cashier ... http://t.co/SyXgIEpZKs,0
8300,I have been at my new job for a week. Thought it was gonna be a good job. I hate it. Hired as a driver but yet to make one delivery.,1
7005,Fired Fed Up or Just Ready for Change? Here are Your 10 Next Right Career Moves http://t.co/xkV3IqzIAl #career #jobhunt #recruiting,0
1711,How can Ex-Non-profit workers receive Unemployment?: I was recently laid off from a non-profit and was informed ... http://t.co/tndpQOXu,0
2793,got hired at two places todayand got all my homework done ahead of time. adderal goes the hardest,1
7515,Currently unemployed.,0
7838,I quit my job yesterday and start my new job on Monday. Dad calls me this morning: How does it feel to be an unemployed Mexican? #jokester,1
25,officially starting may 11 at my new job wooooooo. i got laid off early feb and this new job seems like a step up in a lot of ways.,1
6736,Quit my job so my last day was yesterday and today I got a job position offered to me. Holla @ having a new job already. 😎,1
3276,I Was Fired From My Old Job 4 Days Ago And Already Have A New One,1
917,Got hired at best buy mobile last week &amp;amp; today I have an interview with FedEx for a customer service rep position! #needthat,1
2292,Looking for a rewarding job in a great working environment? Look @ jobs posted on the Penn Emblem Careers page: http://t.co/dAg5WuGPT2,0
2573,Looking to make a difference? Make a difference with us! Home Health and Hospice positions available https://t.co/BtEq4L6aPY https://t.co/We9bmXrRBc,0
6142,Just started this new position last week but I may be putting in my 2 weeks notice,1
2049,Looking to Hire or Be Hired? Turn to Social Media (Job Recruiters Love It Too) http://t.co/AM4dwL9eTe,0
7661,Was laid off this past Friday. If anyone knows of any job openings please let me know :) #Thankyou,0
8066,We are looking for great designers!!!  If you are looking for a new position message me!,0
905,Today was a pretty good day. Found out I got the position I wanted &amp; some woman randomly gsve me a $5 tip,1
5738,I went from being unemployed to having 4 jobs in two days...my body wasnt,1
7414,@AgeroProvider  then they fired me told me I  terminated me then I file for unemployment and they told them I quit which I didnt do!,0
7577,CSG International posted a job you might be interested in: Web UI Test Engineer - Greater Omaha Area US.,0
2019,5 other people got hired the same time as me this week and by today ( the 3rd day) I was the only one to show up to work haha,1
7222,Looking for a #Student #Equity Coordinator (Categorically Funded) #jobs http://t.co/ROiyoUrqXk http://t.co/MpeTtWvr7l,0
4499,Anyone hiring? Im in desperate need of a job ... Just got kicked out with nothing.,0
8471,Well got dismissed today. first time I have ever been sacked from a job I wanted,0
6210,Microsoft posted a job you might be interested in. Enterprise Architect - Northeast District US Enterprise Services - United States US v…,0
8321,I got hired at a Bangladesh sweatshop. Meet my 9-year-old boss http://t.co/8TsBtR8glr via @torontostar,1
6746,Of course when I tell my old job about my new job they offer me a full time position. Where was that about 3 weeks ago?,1
6752,I recently moved to #Minneapolis #Minnesota and Im looking for a position with #PR B2B or B2C relations #marketing. APPX 2 years exp.,0
8854,OK WOW I BASICALLY GOT HIRED DURING MY INTERVIEW SO HMU FOR ALL UR FANCY JUICE NEEDS.,1
555,I was fired same day.,0
4840,Im just got paid today drunk but Im unemployed. SMH fam,0
2864,Ahh last day on the bench. starting work Monday what do I do with my last day of unemployment!!??,1
8856,Employed and self-employed commute?: I was recently hired as an ultrasound tech at a hospital in Illinois and ... http://t.co/tmqc0Y29Ap,1
116,I quit and got hired in then same day because i sold another car ya boi is on fire lmao,1
9461,Up early. Taking commissions! Hit me up! Gotta pay the light bill now that Im unemployed. Oh I got the lay off. #news,0
7498,Im ill so can i get ni credits towards a state pension_ steve webb replies _ this is money health insurance unemployed I am a 61 year ...,0
2142,Searching for #work in Greenwood IN? Send your #resume to Innovative construction. http://t.co/IwWj2u7TNH #gethired,0
101,I got hired at Safeway today (*^o^*),1
9150,I didnt get fired I got laid off,0
1951,Recently started my first FT job. Should I be paying more than the minimum on my student loans? - https://t.co/n7fgL3fDFR #taxreturn #taxe…,1
2375,does anyone know of a place hiring?!,0
2295,Looking for a new #career? BCM is #hiring a Research Technician III in #Pediatric Nutrition apply online at http://t.co/oZaFo57j3y #JOBS,0
4518,Tesla Motors posted a job you might be interested in. Legal Assistant - Beijing City China CN via LinkedIn http://t.co/HYoGa29kJi,0
4101,Got hired today for a really good new job but theyre asking me to cut my hair...,1
1370,Interested in a #job near #Mesquite TX? This could be a great fit: https://t.co/9u74BCVmIc #Veterans #Hiring #CareerArc,0
4070,So like having a job is cool an all and I know I just got hired like 4 days ago but can I get Monday off? And possibly Tuesday?,1
8863,Just got hired to write the next series of Fast and Furious sequels. Ill be posting the titles with Hashtag #fastsequels,1
408,#Job #NewYork (USA-NY-New York) Analyst HR Operations: Position Summary:The Analyst HR Operatio... https://t.co/koiePr7CBq,0
7254,i got hired today for the same reasons ive been fired before.if every songs a circus imagine how youd hear - #daisy,1
8586,Unemployed or Looking For a Way to Make Extra Money? --&gt;&gt; http://t.co/mFbXVSzjze,0
3046,I have a new job work 4 hours unlike the hours I worked at my old job and get paid every Thursday Im gonna work to buy a Iphone 5.,1
9477,I started my new job today working for the family business...Thank you Father GOD for re-hiring me. I will not be unemployed again.,1
8299,I was talking to this girl when I was filling out my application. When I was done she saidyoure hired Turns out I was talking to my boss,1
2678,#AECOM is hiring for @WaterAECOM. Interested? Apply online or follow @aecomjobs to learn about more positions! https://t.co/A4MLOjwdin,0
