id,text,class
4818,You ever tweet so solid you put it on your resume? HAHAHAHA Im unemployed,0
4125,Job Opportunity: Payroll Administrator in Cambridge MA http://t.co/ktLW8Hz37j #unemployed,1
1701,Lost your Job? laid Off? Need extra cash? Be Healthier? Love Social media? work from Home? I have an amazing... http://t.co/x07xSODZf4,1
1122,Searching for a new career? Visit our open positions today! http://t.co/JAV4yVgPA3 #MilwaukeeJobs #Jobs #Milwaukee,1
5456,Laid off? Tired of working for someone else? Let us help you find the right opportunity. https://t.co/wR7G0sTlDg,1
41,Bad news: laid off from my recreation position. Good news: I was offered another job at the same building. Less hours but its a job.,0
7616,Looking for Work? Amazon Plans Job Fair for 50000 Positions - The Wall Street Journal #Amazon $AMZN https://t.co/ivmnk1bBm2,1
3159,yeah since i got laid off my job ive been looking for work. so there will be a open job interview thing next... http://t.co/8xhACMqSVX,0
2362,Anybody hiring this summer??,0
7151,I Am Currently Unemployed and I Will Be Receiving $20k From A Settlement I Could Use Some Advice - https://t.co/n7fgL3fDFR #taxreturn #ta…,0
357,I am looking for work full or part-time(fly-in) work as a data acquisition/assistant engineer.  Sports Cars or Open-wheel. Particularly int…,0
5784,Bloomberg is hiring a Software Developer C/C++ - Equity Products Job http://t.co/wRTnFZfP4e #job http://t.co/jKGAuxsYFt,1
920,Got hired at best buy mobile last week &amp;amp; today I have an interview with FedEx for a customer service rep position! #needthat,0
2385,Anyone looking to work for a great company? The Lowes of Leesburg VA is now hiring. Let me know if you are interested! Hiring 161 people!,1
2236,Have you seen my mid-week video? I decided to vlog whilst unemployed! http://t.co/MAppy5oxiT #lbloggers #crazybloggers #bdib,0
1591,Looking for a job a new career or more job satisfaction? 51 #Career &amp; #Job Affirmations. https://t.co/8hR97kCZPj#hr,1
260,Dang somebody got fired today...,0
4855,Who hiring? Who got work? Who got weight that need to be moved? Who need a FUCKIN BABY SITTER! IM HUNGRY,0
2332,I was unemployed for 3 weeks. I couldve started a job sooner but I choose not to so now I have to train myself to go to bed before 5am lol,0
3356,I start at Aldo this week AND my best friend got hired there too?! We bout to fuck shit up ;),0
996,Interested in a #job in #Pennsylvania 526? This could be a great fit: https://t.co/Qifzt9Yt8F #NowHiring #GetHired #Hiring,1
971,Today I applied for the @santamonicacity Jailer position hopefully I get an email and/or a callback,0
5099,I got fired earlier and as soon as the store closed I went back to ask for my job back and they immediately said yes lol,0
1167,Well today just became the worst day ever. Got laid off my job due to budget cuts. #BrokeAsAJoke,0
1407,Unemployed Under-Employed Unhappily Employed? Find jobs &amp; career solutions on LinkedIn in JCD The Job Seeker &amp;... http://t.co/I4eIURAHmP,1
4482,Are there any jobs that are hiring???,0
4799,I GOT A JOB. AFTER A MONTH AND A HALF OF DESPERATELY SEARCHING AND BEING UNEMPLOYED I GOT A JOB!!! NOT... http://t.co/2ySacheO0R,0
3722,Looking to serve on a nonprofit board or grow in your skill-set as a current board member?  The Johnson Center... http://t.co/prSRdIGj0B,1
6927,Looking for a #Receptionist #- Private Equity - Temporary to permanent - $16/hr #jobs https://t.co/3uQ1TfNaKy,1
4840,ANYONE HIRING????? I AM SUCH A GOOD WORKER AND I MAKE SEMI FUNNY JOKES AND I LIKE WORKING AND I GOT NO MONEY,0
776,I know I have some friends that are looking for work. Here is a position that should be of interest. Amazing chance …http://t.co/WHPT2TZpxS,1
6380,I got fired from one job today &amp; hopped on another job today &amp; start tomorrow man god is good. #bless🙏,0
3886,#ABF is hiring a #City #Driver Full-Time Combined Dock/P in #Dallas apply now! #job http://t.co/t6RCrYueam http://t.co/uKeJoPeDbT,1
368,I am looking for a videographer who can do some outstanding music videos. I got a project I am working on,1
2494,Interested in a #job in #Reno Nevada? This could be a great fit: https://t.co/otkNxkGqlH #NowHiring #GetHired #Manufacturing #Hiring,1
1577,Looking for a new career? Rain Bird has the right environment for a thriving career. Sr. Project Engineer (electronics) #Tucson AZ #job #hiring #career https://t.co/Ff36w7Zbi8 #Engineer #Extrusion #Plastics #CareerArc,1
1736,@SpeakerBoehner Ive had 4 back surgeries no disability both my wife and I are laid off. No unemployment! Need emergency EDD. Please help!,0
17,I was recently laid off by a large bank. Today they sent me a credit line increase and some fake CC checks. Dont they know Im out of work?,0
6362,I got fired today for getting caught having sex in the bathroom with a fine young woman...,0
64,Crazy how I got laid off just last week &amp; got a new job already,0
4777,If I dont find a job soon I will die from boredom... #unemployed,0
4456,Anyone know jobs that are hiring???,0
5913,My mom is really looking for a hired chef.... Anyone interested?😑,1
3752,Looking for a #Adjunct #Position – ​Principles of Marketing #jobs http://t.co/7U5AhGKDtN http://t.co/Mc4bIS0vxx,1
2174,Searching for #work in Madison NJ? Send your #resume to International Assets Advisory LLC. http://t.co/u2yCMGEHlk #gethired,1
2080,Looking for #career growth opportunities? Join GE in #Budapest #Hungary:  Lead #Accountant  @GECareers http://t.co/iTeYZMs09E #gethired,1
894,Looking for C2C companies with  Sr. Java Developers with EADs....4 positions open ! Message me for details,1
7611,Looking to make a difference/leave a lasting legacy for causes u believe in? Apply today for the IIR position in #HHS http://t.co/5vuR7GtrBH,1
4858,With that being said anyone hiring? I can basically do anything and can work like 5 am-2pm every day because I go to work at 3. Hit me up,0
6144,LinkedIn posted a job you might be interested in: Talent Acquisition Coordinator_LinkedIn China - Beijing City China CN.,1
4004,#ppc Started a New Job Working for a PPC/SEM team: I was recently hired on as an assistant for a company... https://t.co/DmXdITkyjK #seo,0
3531,This morning I interviewed for a sprayer position but there were other applicants coming after me. I want to make myself known to ki,0
6383,Well looks like I got fired today...,0
4046,I got hired before I got laid off today #boilergypsy,0
3741,Looking for a tech job where you work w/ smart people &amp; can have an impact?http://t.co/cxanNgUQ6O #dotnet @InnovateMS http://t.co/bLvn14Q27U,1
3704,Looking for a #Counselor/Generalist #(2 Positions) #jobs http://t.co/uVB4umJ1EM http://t.co/GWdRvGeS1O,1
1593,Looking for a new position? #Sprint Retail Sales Associate-Part Time Job #JobHunt #jobsearch #Jobs #SanAntonio #TX https://t.co/FSiOtppaZp,1
4694,unemployed and its never felt better....why do I need to work ?,0
4180,Currently unemployed https://t.co/vc4QKBPoVt,0
6323,I am dusting off the resume and seeking a management /training or compliance position. If your job has an opening contact me. Thanks,0
7424,Long term position for Android development x 2 developers: I am looking for two developers to co-operate into de... http://t.co/Pe2t7Jai,1
1586,Looking for a job? Energy Engineer/Resource Efficiency Manager 3 at Northrop Grumman (NJ) http://t.co/2dXGw2tE7G #green #jobs,1
3740,Looking for a job in #Newark #NJ? Supervisor https://t.co/gHawIDCDx6 #jobs #hiring,1
354,Im in search of people that want to work part-time. No sales. No start-up costs. I am offering a $25 sign on bonus and would like to get...,1
2217,I am on month 4 of being unemployed and I only JUST figured out the perfect configuration of couch pillows-throw pillows-hot water bottle-laptop and I am equal parts thrilled and inconsolable that it didnt happen sooner,0
1853,I am looking for a position that will get me closer to where I was. Who has had success with resumes on video? #LOOKINGFORAJOB #Accountants,0
5704,started re-watching #GIRLS at 2am. as a new college graduate slash currently unemployed person this is probably not the healthiest idea.,0
1065,I am Looking for work in the Oakland California area.https://t.co/GYOhEV0xqG#JobListing #JobOpening #JobTips #Résumé,0
6248,I officially get laid off from Wells Fargo on the 10th. I thought theyd keep me around but I guess I was mistaken.,0
5622,laid off due to job elimination &amp; now employer is hiring: 6/11/14 I was laid off Jan 2014 for job eliminatio... http://t.co/yiLgnrkv62,0
1349,Interested in a #Retail #job near #Mesquite TX? This could be a great fit: https://t.co/uD484Gxn8y #Hiring #CareerArc,1
3533,I didnt fire anyone today. I suppose thats a good first day to position myself is a benevolent leader.,0
2718,#Job #Boulder Two Moms in the Raw- Join the Family!! Order Fulfillment Coordinator: Open Position -- Order Pr... https://t.co/qtkltHPh8k,1
2146,Searching for #work in Greenwood IN? Send your #resume to Innovative construction. http://t.co/IwWj2u7TNH #gethired,1
5222,I love a challenge and thrive on proving people wrong so yes compliments are the reason Im unemployed,0
4175,Just finished my last day at work after 4 years. I am officially unemployed,0
1605,Looking for an exciting new career opportunity in Detroit? https://t.co/1JbvAXo4wl    #jobopportunity #detroit https://t.co/PnYS6qcN34,1
1104,I am job searching for: Work at home jobs! http://t.co/4tgcXWg6JK — Walker Inklebarger (@Walker_marocliv.... http://t.co/QIM3fwjwaZ,0
4017,Being employed has Its ups and downs lol I just kinda wish target would have hired me,0
5316,Now accepting applications as part time food provider for Waco Willman. This is a coveted position and will go quickly. DM me if interested!,1
150,I didnt get fired but I just got hired.,0
4710,The Michigan unemployment office has been the most difficult group of people to try and work with. I have received no help whatsoever.,0
6895,Last day of work was yesterday. Feels weird to be unemployed by choice.,0
1991,Im already subject to termination at work and I started 3 weeks ago lol . I need more clientele to end this job saga,0
1077,Lost my job 7 years ago and have not been able to get another I am searching for a job but dont have a car to claim as my own. for a job,0
6086,Microsoft posted a job you might be interested in. Enterprise Architect - Northeast District US Enterprise Services - United States US v…,1
6756,Looking for a job as Nurse? ! $1000 bonus - Sign up to drive   #fired #layoff #work https://t.co/XEKH9eaDfG https://t.co/4ilKpZTL3y,1
2116,Looking for a new job? These ones pay well and dont require higher education: https://t.co/HLXvWvgrf5 #success #gethired,1
7600,Recently laid off? Check out the #ILworkNet Layoff Recovery Guide to get back on track with your employment goals! https://t.co/5RUFutgcF8,1
2702,#Georgia #Jobs Test Center Manager: Augusta Test Center Manager Job ID 2014-26903 of Positions 1 Posted Date 7... http://t.co/R17B3MjLQR,1
3917,#Allentown PA #Healthcare #Job: Mental Health Technician - MHT at Sacred Heart Hospital https://t.co/fYazQlovnx #Jobs #Hiring #CareerArc,1
1747,@crookedhooligan Im so sorry autumn :/ if I didnt just get laid off I would in a sec. When unemployment kicks in I will. Thoughts w/ you🙏🏼,0
1095,I am seeking a #Marketing position in #NYC. Please share my #LinkedIn profile - http://t.co/at90iZQ9m4  #jobsearch #jobhunt Open to relocate,0
2027,My sudden job change is proof of this. Fired 1/14 hired 1/23 at a better job. God is good we just ha http://t.co/xLQj6tqut2,0
3756,Looking for an Extra Income? Join the ClaudiaG Growing Network of Skilled Independent Consultants https://t.co/02fQT52ZNa via @born2impress,1
1451,Are you a first-time job seeker currently unemployed or looking to change career paths? We can help &gt;&gt; https://t.co/5MJQvfrsIy,1
6587,Okay cool so someone wanna hire me to work Warped 2017???,0
2705,#Intel: #Multiple #Positions For Wounded Ill or Injured Veterans in New Mexico and Oregon in #Hillsboro #job http://t.co/rr9v5vG1fu,1
1169,I Got laid off today 🖕🏻 https://t.co/kevVjENAby @gifboomapp #gifboom,0
5360,Earlier I was told I need a raise and Ive only been here for 2 weeks. #HardWorker,0
6850,Hell yeah I got the job! :) It all started thanks to http://t.co/zpKlS01DiV #unemployed #resume,0
3248,trying to figure out the best way to get fired so i can collect unemployment until i start this new job..,0
7439,Ashoka posted a job you might be interested in. General Manager Youth Venture - Washington D.C. Metro Area US v… http://t.co/rHJUftmNOL,1
6364,I got a job today 2s later I got fired,0
7204,Attention marketers in #SanDiego heres a cool job opportunity where youll be able to change some lives. http://t.co/u6bxlpFs #marketing,1
497,I was fired from an amusement park job before starting my first day. MT @SVbizjournal: My worst summer job was __________________________.,0
1595,Looking for a FULL time job or looking to stay competitive in a tough job market? FREE Career workshop http://t.co/aGmP7fhpy1,1
4302,Its a sunny day and Im (misty) unemployed yall,0
384,I am looking for some extra help. I am adding an auto repair technician to my workforce. Email me twonutsmessage@gmail.com,1
6591,I need a new Good job wit set hours *9-5* I cant work random hours once my baby is born!! Anybody job hiring??,0
716,Guess I am fired not showing up last two days. Well I was gonna he tossed like garbage on a key error or whatever,0
5286,Just did 4 applications then when I get to work I gotta talk to somebody about a full time position. Im sleepy but cant sleep,0
4027,Searching for #work in Brooklyn NY? Send your #resume to nyc associates. http://t.co/bs1RfxkcXL #gethired,1
5243,Well Im the dope man yeah boy wearing corduroys money up too here but unemployed,0
383,Looking to make an extra income? I am not looking for employees I am looking for motivated people that will work... http://t.co/wjoaiRxb,1
1083,(IN) I quit my advertising job because i lacked the passion for it. I am searching for a job that i am passionate about but im running out…,0
7185,Google posted a job you might be interested in: Software Engineer University Graduate - Munich Area Germany DE.,1
1097,I am seeking a Java Middle/Backend Developer for a C2C opportunity in alpharetta GA #job #J2EE #EJB http://t.co/qoHzje3gA0,1
3128,Well I quit my job today.....,0
2370,Does anyone know any places hiring? #needajob,0
6393,Man got fired but bout to get re hired to another job man I got this with gods help,0
1274,Interested in working at @sus_org? Check out what opportunities might be waiting for you!  https://t.co/brX0vRwl8Y https://t.co/gsBowjXCrq,1
5664,I walked out of my job Saturday. This is the first time since 2011 that Ive been unemployed.,0
5575,I also had an internship and quit it since the time we talked. Im looking  for a new one as we speak.,0
4504,IBM posted a job you might be interested in: Client Representative (NJ/HZ/WH/Chengdu/Xian) - Chengdu Sichuan China CN.,1
1131,I am getting a job as a trader on Wall Street and buying a house in New Jersey. Also I have found Jesus.,0
865,Dont mind if I do... #unemployed http://t.co/0kD55NAlkN,0
100,I got hired 4 Jamba Juice God is Good,0
852,@EVSTGHXST feel it man. Im currently unemployed as of today as well. Shit is rough. Just gotta keep on keeping on.,0
247,got hired to be tutor in my summer statistics class even though I know as much about statistics as the guy Im tutoring,0
3803,*SCREECH* WHY ARE BEYONCÉ AND JAY Z GOING ON TOUR WHEN I:A- AM UNEMPLOYEDB- NEED TO BUY A NEXT GEN CONSOLE SOONC- FUCKING PAX TICKETS,0
7529,Unemployed or Looking For a Way to Make Extra Money? --&gt;&gt; http://t.co/Yz8xAA3vk2,1
731,If you are in the greater Sacramento area and you or someone you know might be interested reach out to us. We are looking to fill a position ASAP. @ Granite Bay California https://t.co/f8LzDCfX1t,1
2722,#Job #California (USA-CA-North Hollywood) Copy and Print Associate: *Position Summary:*The Copy and Print Ass... https://t.co/TWPhqm7ixT,1
6494,Recently started a day job. Now that I have a source of income I really want to compile a good wishlist.,0
943,Well got hired for a new position here in the admissions office as a fellow. Hopefully it can help transition into a full time counselor,0
1090,Searching For a LinkedIn Marketing Superstar! - oDesk: I am seeking an experience LinkedIn ... http://t.co/tK73BjLJ6H #sales #mktg #jobs,1
1117,I am looking for #JavaScript devs for a position in Austin. Angular bootstrap. Grunt and bower. #javascriptjobs,1
3173,I was laid off from my job April 7. Seeking editing job. Appreciate all leads. View my LinkedIn profile: http://t.co/ogRrXD1eNZ,0
2004,I recently quit my job to pull in $9023 from my phone PRESS THE LINK INSIDE BIO to do it too https://t.co/tcQvOqeLXW,0
6449,I quit my job today &amp; i could care less ... Life goes on &amp; McDonalds was never intended to be a career for me anyways !,0
6842,Oh perfect now I get to pay $260 a month for health insurance when Im unemployed. Merry christmas to me!,0
1321,Interested in a #Labor #job near #Mesquite TX? This could be a great fit: http://t.co/oSVXXpnvvf #IHOP #Hiring #CareerArc,1
5349,Anyone looking for a part time business idea or something to quit your day job for? http://t.co/rdgpZnatLM,1
2904,now I work at value village. where will I work next week? any bets???,0
7577,Looking for a job in the #management industry? Apply as Store Manager Trainee via ForesterLink http://t.co/L0cyT4HBSz #foresters #jobs,1
1286,I have disability case I am not working i well have to wait 18 month before my case herd in court but mr Obama paid millions in destroying,0
5153,Wage insurance for new jobs that pay less than a laid off job? Im interested.,0
4968,Anyone know where they are hiring ??! Need a new job I hate mine already I have to patience for my GM !,0
845,#Unemployed? New #jobs for Bank Teller in #LA http://t.co/E3nmLrEDFd,1
2278,Looking for a job? Electrical Engineer - Renewable Energy at Black &amp; Veatch (Centennial CO) http://t.co/Jj3c5xvcGk #green #jobs,1
6596,SAIC posted a job you might be interested in. Storage Area Network (SAN) Support SME - Washington D.C. Metro Area… http://t.co/2nWFmX18IQ,1
3050,My first day of work at my new job is done! Wow crazy how time is flying by.,0
1004,Interested in a #job in #Coppell TX? This could be a great fit: https://t.co/hVtBUAjDjq #NowHiring #GetHired #Manufacturing #Hiring,1
3810,So is Obama also unemployed today?,0
2715,#Job #Boston Part-times Sales ideal position for High school Senior  (Middleton): Part-times Sales ideal posit... http://t.co/rp9A7OPOpC,1
7508,Well I quit my job today lol... Oh well I got another interview tomorrow and my money straight,0
6716,My mom fired me from helping her for being too neat ??,0
7284,Going to start an online job search for Lexington. Im definitely planning on moving up there when I get laid off at the falls,0
3120,today I quit both my jobs accepted Jesus back into my life and quit all hard drugs,0
2970,I lost my fish and position all in one night. Wheres my gold star?,0
525,I got fired from my new job because of a family members behavior my fish fell down the food… https://t.co/kjHtS5PmeN,0
7370,I quit my job yesterday and start my new job on Monday. Dad calls me this morning: How does it feel to be an unemployed Mexican? #jokester,0
2305,Looking for a new job?  Cumulus #Indianapolis is hiring for experienced and motivated #radio account executives http://t.co/f1lmF6aSx6 #JOBS,1
7175,this whole job search/being unemployed thing is not really for me any more. i would like it to over with now.,0
417,#Job #Richmond (USA-VA-Richmond) Press Operator III SPS - 3PM - 11PM: * Position Summary: * This position... http://t.co/nQhlYIRCoH,1
6579,Who can get me a job or it who is hiring??? I hate working in Restaurants,0
2133,Searching for #work in San Francisco CA? Send your #resume to Skyline Recruiting Corporation. http://t.co/h4CgEvXqra #gethired,1
4727,Anyone hiring...I really need a job. I am so tired of getting screwed over and stupid people getting picked over me.,0
7184,RT @uygarradikal: Oracle posted a job you might be interested in. Sr. Database Administrator - Jacksonville Florida Area US via... http:…,1
5322,Wow. Worst day ever at work so far.. I think imma quit. I cant take it anymore. Anyone know a good place to work that is hiring? :),0
1094,job searching is the worst. please give me money i am just trying to survive capitalism,0
2950,I lost my job for standing up for what was right and you are in a better position than I was to do that https://t.co/ATeErb1m29,0
3960,I just got hired at a dental office things couldnt get better,0
5679,Tomorrows my last day of being unemployed... what to do what to do?,0
5570,Searching for #work in Las Vegas NV? Send your #resume to Paramount Equity Mortgage. http://t.co/0fgQIXXqYU #gethired,1
5641,As of now I am officially laid off. Yippee.,0
2498,Interested in a #job in #Charlotte North Carolina? This could be a great fit: https://t.co/gmiUfbTT3y #NowHiring #GetHired #Engineering,1
6306,I am currently Recruiting for CDL A &amp; B drivers for positions in the Worcester Boston and Southern New Hampshire area. All drivers need to…,1
3821,I like to refer to myself as an artist. Because it sounds better than saying unemployed. #PointsMe,0
3526,Applied to a job a few days ago.then it was reposted as two separate positions.CAN YOU SEND ME A LETTER OF DECLINATION,0
2837,Looking for a Fun and Flexible Work at Home Job? https://t.co/0bPKtWeg9p #Moms #Jobs https://t.co/4cVAM5EIqh,1
1159,Boy oh boy...havent been on here in awhile. Not since I got laid off and am now forced to deal with real life shit. You employed bastards.,0
4758,RT @mmangen: Ready Set Action! Searching for a New #Job http://t.co/wljctC3w2O via @ItsJustTami #unemployed,0
1210,Got laid off today :/#work,0
3897,#Accounting #Job in #BOULDER CO: Accounts Payable Clerk at Robert Half Finance &amp; Accounting http://t.co/76bCBKV8MV #Jobs #Hiring,1
3733,Looking for a new #job in #Pennsylvania? Subscribe to #JobAlerts! http://t.co/NZniIuH90n,1
7532,Any College Students or Unemployed Individuals Interested In Marketing or Blogging? Apply Today: https://t.co/Szj0twdbHM https://t.co/78vsYGuSjn,1
5707,Being unemployed (sorry a small business owner) has afforded me the time to do exciting things like put salsa in my scrambled eggs.,0
783,Our Consumer Insurance Department (CID) is looking to hire a Manager Inside Sales Position. To learn more about this opportunity visit...,1
5334,Anyone hiring? I need to quit this job,0
3262,I have been tested and got fired.,0
1342,Interested in a #job in #Mesquite TX? This could be a great fit: https://t.co/yF8nC10Bbg #Retail #Hiring #CareerArc,1
3896,#Accounting #Job alert: Controller | Robert Half Management Resources | #CLEVELAND  OH http://t.co/LrNHsZkkjr #Jobs,1
1089,Im searching for another job so I can get my money up &amp; move.,0
1027,Interested in a #job in #Florida 526? This could be a great fit: https://t.co/TgcF5ehP4R #NowHiring #GetHired #Hiring,1
984,Interested in a #job in #Clearwater FL? This could be a great fit: https://t.co/j1viX3A3Nb #NowHiring #GetHired #Manufacturing #Hiring,1
643,Looking for a career as a professional driver? HIRED is offering a 7 week training program on Driver and... http://t.co/UR0D8VbwHG,1
1955,I recently quit my job to start making $5641 from my phone PRESS THE LINK INSIDE BIO to do the same https://t.co/HTiei6WdjV,1
2420,IBM posted a job you might be interested in: Java &amp; GUPP Business Analyst - Beijing City China CN.,1
3610,When unemployed ppl tell someone how to fill out job apps... lol ok,0
2323,And I remember now why I shut down and didnt do job applications for a while. It makes me very aware of how long I have been unemployed,0
4448,Anyone know if there job is hiring ??,0
4886,Looking for spring and summer work? Ferguson Township seeks PT Road Workers and Landscape Laborers. https://t.co/FAD3PMBTnx,1
2698,#Dallas #Jobs OPEN HOUSE** Mailroom Position===FT/PT____ $965Wk: The Imaging positions are responsible for ima... https://t.co/OStoljBgBy,1
130,Craziest thing happened to me today..i lost my job..then got hired by another one an hour later..pure awesomeness,0
3567,today is the first day in 2 years that I really am unemployed with no job &amp; it feel GREAT! 😂,0
2489,Want a #job? Check out our featured openings and you might just get #hired. #OracleJobs - http://t.co/LN1MT7vN,1
1594,Looking for a job a new career or more job satisfaction? 51 Career and Job Affirmations. http://t.co/iqFB281fs5,1
1086,I am searching for jobs in the religious sector. I am specifically interested in a position as a hermit. I... http://t.co/e3iypkxFbL,0
1850,I AM IN SEARCH OF MODELS WHO WANT TO BE IN A CREATIVE BRIDAL PHOTOSHOOT!!! RT &amp; DM ME ✨,1
1303,Interested in a #job in #Mesquite TX? This could be a great fit: https://t.co/wqJiTWI366 #Retail #Hiring,1
7433,Im searching for someone who has Java Hybris experience.  Position will be based in Richardson. https://t.co/orTsufdQHR,1
4024,Searching for #work in Akron NY? Send your #resume to Adesa Inc.. http://t.co/Ayu0sVtnde #gethired,1
2528,Looking for a permanent position? Lead Creative Developer position is still open: http://t.co/ROBDKgoQuz #dctech @dcww @dctechmeetup,1
1378,Are you a job seeker 55+ looking for part time work? (7 U.S. locations) http://t.co/slgG8bXyVs#job #jobsearch #jobhunt #unemployed,1
3715,Looking for a #career change? Dealertrack is #hiring a Director of Inside Sales. #Jobs https://t.co/kV9L4dHCFN #job,1
1954,I recently started working at a new job and now I have weekends off and a normal schedule and I don’t have to dread the weekend anymore,0
2834,Looking for work or ready for a new career? Learn #howto become a #truckdriver. https://t.co/JhDAh18mHo  #cdllife #jobs #paidtraining,1
