id,text,class
2310,Looking for a great part-time job? #Housekeeper position in #Columbus #MN --  http://t.co/cOWsX60nFH -- #nowhiring #cleaning #hospitality,0
2326,Well has of yesterday I am unemployed (quit my job). Yes had enough my body and health can not take it anymore. Start looking tomorrow.,1
5701,This place just sent me 5 emails to tell me I didnt get the job. I get it. I suck and will forever remain unemployed,0
494,First day at my big girl job complete. Didnt get fired. Id say Im off to a good start.,0
1081,am looking for a job i lost my job due to the misunderstanding btwn me and my manager according to the increment of my salary,1
2291,Looking for a job? Energy Engineer/Resource Efficiency Manager 3 at Northrop Grumman (Barksdale Afb) http://t.co/5ertaYMFl4 #green #jobs,0
6377,Today I got hired promoted &amp; then fired from a Briarcrest commercial...thats all. #actress,1
2362,Anybody hiring this summer??,0
2682,#Austin #Jobs (USA-TX-Austin) Registered Nurse (RN): Position SummaryResponsible for implementation of the g... http://t.co/SCN7bpMfPI,0
3310,I find it funny that I was fired yesterday and then rehired lol,1
2339,oh man im like unemployed for three days. but also new job in three days! also also three day weekend!,1
796,I am currently seeking a Position in the Logistics /Supply Chain areas. I live in Jacksonville Florida 32226. I bring excel. References.,0
5511,A client called my phone verbally harassed me &amp; disrespected me. I tell my boss and he blames it on me &amp; says Im the problem so I quit.,1
7358,I recently quit my job to generate $9023 from my phone PRESS THE LINK INSIDE BIO to do it too https://t.co/qH0OezdPW3,1
115,lost my job today which sucks but a friend hired me right away to watch her twins starting tomorrow. So tomorrow is a beach day!,1
5713,I just basically told my boss from work last year to fuck off so I am officially unemployed at CMU lol,1
6447,I just lost my job today. Sometimes the bad times are really BAD,1
3205,Looking for a new opportunity in Seattle as I was just laid off with half of Cheeseburger. Contact me or Shauna Swerland at GloCap with an …,1
4618,i got hired at 678! time to quit todai!#todai #toDIE!!!!,0
4127,Hey everyone- Im once again unemployed. If you know of any opportunities PLEASE contact me asap! It would be greatly appreciated #wompwomp,1
1678,My Assignment at my job ends today. Quit my delivery job on weekends but I got interview Monday and Footba season almost back at metlife !,1
4175,Just finished my last day at work after 4 years. I am officially unemployed,1
7162,I am unemployed and #need #money #now https://t.co/GzJbNDpkU8,0
899,Looking for a challenging and exciting new position ? Here is a great PM position in mobile for you : http://t.co/4pGBr95TOo,0
2225,And I am now officially unemployed,1
1691,Quit my job yesterday got a new one today,1
3898,#Accounting #Job in #BuddLake  NJ: Accountant - Entry Level at Accountemps http://t.co/g834qqV2Xs #Jobs #TweetMyJobs,0
4772,Applying for jobs like crazy!! Need to find work soon cause being unemployed sucks. I am going stir crazy and its only been a week!,1
3549,Applying for jobs is like dating If you try too hard it could go bad if you dont try enough it could go bad. Overall I am still unemployed,0
5401,Monday was a work day yesterday was my birthday and today I got fired. :/,1
2422,Apple posted a job you might be interested in: TR-Pazar Lideri - Turkey TR.,0
414,#Job #Raleigh (USA-NC-Raleigh) Dockworker Part-time: FedEx Freight Inc.This is a part time position.Transp... http://t.co/qFtKySXEIb,0
2936,I applied and got offered a position today in which Ill be able to use my college degree,0
3982,I just got fired then immediately re-hired.,1
2762,I am Looking for work in fixing #computers or #security #jobs.https://t.co/Bm4FAwHaSz#Oakland #Bayarea,0
6865,Hell yeah I got the job! :) It all started thanks to http://t.co/ZonHtLooEP #unemployed #resume,0
371,Im searching for a part-time PE/dance teacher. Do you know anyone who would like to work 1-2 hours per day?... https://t.co/ocMOYXIsuh,0
710,My boss straight fired me and I have YET (after working like 4weeks) to receive a paycheck http://t.co/5nSY7uvm5M,1
7273,So I got laid off like I thought I would.....Got an interview for another job right away though so hopefully I can get this new position.,1
1195,Got laid off today almost like they knew how far behind I am on Mad Men.,1
3962,Literally lost a job and 5 min later got hired somewhere else #peopleskills #closeddoor #openwindow #happy #lucky,1
4662,Today I quit my job while at a concert so...,1
767,@renewaldb I might be interested.  Is there a job posting where I can see position description?,0
112,Ya girl got hired to cocktail and possibly bartend at one of the busiest bars in town will I finally be out of debt?? Well see,0
3154,We feel for those laid off from #Target and are always looking for top talent. Search for open positions: http://t.co/kjMcH7u9G3,0
4725,Anybody hiring ? #lexx,0
4959,Does anyone know whos hiring ?? #Job Hunting,0
285,I got hired a week ago but I havent started yet like what gives,0
4183,So as of 430 today I am currently unemployed again :( although we still have one paycheck left,1
5318,@VictoryCRussell in prev. position core presentation had factual grammatical errors. No editing allowed. Couldnt give it. Now unemployed,1
1508,I havent worked in 2 months and place I applied for BEFORE losing my job are contacting me right now,0
3539,I had the worst job interview today. I feel bad for whomever takes that position. yikes.,0
6253,I came back from vacation to be told that Ive been laid off b/c the business wasnt doing well...this right after going to an $$ con ;____;,1
75,I Just Got Laid Off … Now What? http://t.co/gqVcv99got #jobsearch,1
4638,Started A New Job Yesterday  And Quit Today,1
2072,Looking for a new #career as an Administrative Assistant? Get hired here by doing this one thing http://t.co/hPzi6392Dl,0
3145,I officially quit Target today I learned my self worth and they are so disrespectful &amp; petty  their Im over it,1
3319,Now Im being fired for making the bride cry instead of passing hor doeuvres as I was hired to do. Well if that dont beat all!!,1
1916,I was laid off and couldnt find a job then raised $1M to help people hunt jobs! A real story needs a great writer! You?,0
792,I am currently sourcing for a position for a Junior Assistant to work in an Entertainment company in NYC. If you love music.. this may be p…,0
1928,Between the news of being laid off yesterday and then spending this afternoon in the ER with my oldest for a... http://t.co/8A3xzoZtKO,1
7135,I am disabled veteran been unemployed since 2009 and I cant get disability benefits. I would like to do computer work (administrative or billing). My email:barryevanslive@gmail.com https://t.co/9CBcfriM5P,0
2222,I am now unemployed and that feels weird.,1
3986,I went in for an interview today and got hired on the spot. I was so fuckin juiced lmfaoooo,0
4,GOT LAID OFF FROM MY JOB 2 WEEKS AGO AND I WAS KINDA SAD but thank god bc now Im doing photo work for Drais beach club,1
3142,damn I quit my job today shit got real I need to rob a bank,1
1161,Today I got laid off but at least things in this ARG are really heating up. #ingame,1
2521,Looking to see who #PennState hoops has offered for 2015? FREE list of offers designated by position here: http://t.co/xBgLcZu1HT #PSUBB,0
6124,Heres an opportunity that you wont want to pass up: Bartender - https://t.co/zUq1X44lCq #Bartender #ChulaVista CA #Job #Jobs #Hiring #CareerArc,0
4189,my old manager is trying to tell unemployment that I never called in on October 11th. Please explain this? Also I was fired on October 13th and my paycheck was ready 3 days later. If I stopped showing up why did I get a check so soon? I normally receive DP 🤷‍♀️ @ChipotleTweets https://t.co/JyjxOMGlCR,1
1991,Im already subject to termination at work and I started 3 weeks ago lol . I need more clientele to end this job saga,0
740,Mikes is hiring for Daytime host positions if your interested please come in and fill out an application,0
2738,#Job #Irvine Case manager assistant/ discharge planner: San Ramon The individual in this position works under ... http://t.co/9rSCTRHjg3,0
1151,I got laid off today and I angrily played need for speed most wanted for 2 hours to cool off,1
546,I Was Fired for Making Fun of Trump https://t.co/dPvM6tltSPI can only hope that I have enough character and backbone to be fired one day for making fun of our perpetually mediocre or worse political leaders. In this life stand for something or be blown over in the wind.,0
5024,Damn I got fired from my first job  I got to find another job soon cuz I want to buy iPad 4 and htc one.,0
2012,I recently quit my job to roll in $9023 from my phone PRESS THE LINK INSIDE BIO to do it too https://t.co/D3vFJfPToV,1
2839,New post: Looking for part time work or a work from home business or a job in Tampa? http://t.co/scGJr97Xo0 #Money #Online #Ways,0
3896,#Accounting #Job alert: Controller | Robert Half Management Resources | #CLEVELAND  OH http://t.co/LrNHsZkkjr #Jobs,0
4831,Unemployed life will be over by 27th January  i am sad and happy at the same time,0
4651,I quit my job today...,1
5660,I am no longer reporting on education @indystar - laid off Friday. 110% unexpected. Still bent on journalism/covering ed so plz RT,1
5061,I recently quit my job to make $9023 from my phone PRESS THE LINK INSIDE BIO to do it too https://t.co/ELSPM9eL3e,1
7364,I recently quit my job so Im feeling pretty useless at the moment. Im too nervous to find a new one bc Im a piece of shit.,1
4147,Im currently unemployed and Im not going to school till Jan I can literally chill all day,0
5335,Is anyones job hiring? I want to quit Wendys already.,0
2231,Unemployed for a month now. I feel like such a bum.,1
1682,I just got hired in today and im already thinking of quitting by the end of the year....smh,0
146,My job fired me and just hired me back wtf is my life 😩😂,1
3579,I am building a fellowship of unemployed people. Lord of the Job! #lotr #unemployment,0
4485,Ummmm anyone hiring ?? Need a good paying job asap,0
4219,Currently taking applications for someone new to caption my photos bc @TooSlick_Rick is fired... the job has no benefits except that you will get to see never before seen photos of me that may never actually be posted,0
79,Permanently laid off from my job jumping in to my own business! WEEK 1 UPDATE via /r/Entrepreneur https://t.co/WT40E9r96J,1
6234,This week has been so horrendous I cant even begin to explain. Get laid off Friday the cops come to the house to talk to...(continued),1
6390,so uh whos hiring cause I just got fired lmao,1
6554,Last week I was offered full time my sister just got a new job that is full time and my bf might start a new position at his #Godisgood,0
6235,YO JUST LEARNED I WAS GONNA BE LAID OFF NEXT WEEK BUT I ALREADY QUIT. IM BLESSED!!!!,1
3733,Looking for a new #job in #Pennsylvania? Subscribe to #JobAlerts! http://t.co/NZniIuH90n,0
7192,Ingram Micro posted a job you might be interested in: Cloud Business Manager - Orange County California Area US.,0
5723,Im also now unemployed which is cool.,0
6147,Tesla Motors posted a job you might be interested in. Tool and Die Supervisor - San Francisco Bay Area US via ... https://t.co/Y4wskvfUOJ*,0
3095,I quit a job 2 weeks ago after 3 days then they call me today to offer a different job. When does this happen?!,1
897,Looking for a new career in the IT field? Head over to our website http://t.co/38APTLRqc2 for our complete list of open positions!,0
3665,I start that new job Wednesday at 6 am. I gotta stop this bullshit 3 am stuff,0
2508,This week I started my new position at the ACS as Sr. Manager of Community Events!,0
4484,anyone in #inlandempire know of anyone hiring? its time for a new chapter/better job,0
7283,Finding A New Calling After Being Laid Off At 50 http://t.co/AYUDSi0a0P via @HuffPost50,0
5375,I got fired wednesday now I have orientation wednesday look how God works.,1
4989,I got fired from Rite Aid today....,1
6408,I got fired today https://t.co/T02DAaHfUJ,1
3914,#Albany #Jobs general appartment  maintenance  (local): experienced person part time with tools and transporta... http://t.co/iL1ZX2QpIv,0
4057,Today I got hired on the spot tomorrow I start. Here comes some monaaaay!!!,0
2513,This week I resigned from my position... - Jean-François Gariépy | Facebook - (via This week I resigned from my … http://t.co/PODrij5QLn,1
549,Yeah just fired me seriously.,1
4556,@Greenstoner1 yeah your boy got fired from Petsmart so now Im about to work at costco,1
6701,I was fired yesterday because I was told by my boss I was not aloud to take a break without first asking permission.,1
244,Went to unemployment today! They all knew me! really They are all listeners! hey guys thanks for your help!,0
4643,Im about to quit so whos job is hiring ?,0
6844,Ive missed writing lately. So Ive started a blog about my experiences being #unemployed. Heres first one: http://t.co/hErLGL1uI5,0
2964,UH sucks so bad. Lost my job becuz of funding and now every position I try to apply for cant hire me becuz of funding -_-,0
6726,I just got fired oops I meab I quit I mean I dropped outta school just to be the shit,1
1015,Interested in a #job in #Hopkins Minnesota? This could be a great fit: https://t.co/oLOHzAwnyO #NowHiring #GetHired #Accounting #Hiring,0
3231,Looking for a job in Operations?  is hiring! $1000 bonus - Sign up to drive   #fired #layoff #work https://t.co/oWl7EkHh8N https://t.co/ETbCoH8rnn,0
2151,Trying to get hired at a few places I am letting fate decide if I go back in Fall or not. If I dont get a job by the 15th I am going back.,0
65,So I got laid off of from my job a couple weeks ago. A first for me. I was upset and a bit stressed at first of... https://t.co/3FArucZPX3,1
6274,Well looks like after next week imma get laid off. Still looking for full time work.,0
1934,News alert: I just got laid off so I guess that means Im a full time #streamer. Eeek 😶 #twitch,1
6754,Looking for a job in PMP?  hiring! $1000 bonus - Sign up to drive   #fired #layoff #work https://t.co/g9Afa37P4h https://t.co/182OLJGeT4,0
4810,Car was towed today alhough Ive been unable to drive for a month &amp; I have to find 100s to get it even tho Ive been unemployed for a month.,1
3303,Ahh first time i get fired..after like 20 jobs of never getting fired i did today lol and somehow i think its funny lol ohh well,1
2309,Looking for a job in publishing? Hachette Book Group shares practical advice for job seekers: http://t.co/jbNgWy6uMi,0
347,On Friday we learned of a reduction in workforce and now I am searching  for a new opportunity. https://t.co/hfX15on1uo,1
1442,Unemployed Under-Employed Unhappily Employed? Find #jobs &amp; career solutions on #LinkedIn in the Job Seeker &amp;... http://t.co/vquOX8kf1O,0
4475,Anyone hiring C++ Developers or Linux Admins? Im in the job market :-),0
2019,I unknowingly started my new job today so yeah thats great,0
4601,I quit my job today &amp;amp; my general manager begged me to stay haha,1
418,#Job #Sarasota Quality and Regulatory Compliance Manager: Sarasota POSITION DESCRIPTION Voalte is on the prowl... http://t.co/nRnRZb2Vsl,0
5642,I was just laid off.If you need an accessibility analyst or perhaps a front-end developer let me know.,1
1410,Unemployed Under-Employed Unhappily Employed? Find jobs &amp; career solutions on LinkedIn in JCD The Job Seeker &amp;... http://t.co/PU1at6It70,0
2224,And now Im unemployed again 😒 #fucking#sequester http://t.co/mkRlgxwihe,1
5812,Would you recommend a friend for this opportunity? Busser - https://t.co/pubk9ry6Hh #Labor #Mesquite TX #Job #Jobs #Hiring #CareerArc,0
3824,If youre having waitress problems I feel bad for you sonI got 99 problems but now Aladdins aint one✌ #unemployed,0
2316,Looking for a #CERTIFIED #PHARMACY TECHNICIANS (15 New Positions!) #jobs https://t.co/fJwBkDslsr https://t.co/NrMnIefsPd,0
547,Well this week starts as me basically being fired as a driver which means big pay cut which means shit,1
1632,Looking for a great new #FOH #Job?@AquitaineCH is #hiring SERVERS and BUSSERS: https://t.co/AUCu2MGfk5 #bostonjobs,0
4933,Well I also applied for jobs so hopefully I get hired,0
2565,Looking for a new position? Visit @McCormickSems job board for open opportunities across the country &gt;&gt; https://t.co/6zddyM6joi,0
7008,Today I got fired from work got my final paycheck. Gave my parents all my money $100 in cash &amp; told them I dont want it they can have it.,1
1343,Interested in a #job in #Mesquite TX? This could be a great fit: https://t.co/Ml3p0JzHxs #Retail #Hiring #CareerArc,0
6495,@adamjw84 Lost my job beginning of Sept not not in a position to right now. Starting a new job Monday when situation improves I will.,0
3029,Well the new job barely has work for me too at least Im still getting paid.,0
709,Idk maybe its just me but I would hate ppl tweeting me constantly about a job I was fired from. Especially when Im not currently working.,0
6,I was laid off with a severance package-so of course that softened my blow. But I was unemployed nonetheless. Ive never relaxed so well.,0
1356,Interested in a #job in #Mesquite TX? This could be a great fit: https://t.co/OfubySvBJE #jobsearch #Nursing #Hiring,0
7566,I was fired today. Im a badass,1
7045,I will not be waking up tomorrow to go to that stupid job that i quit! They  can all fuck off! :)  i will be unemployed however oops...,1
6401,Got fired today but at least I got a haircut and my eyebrows done. ha,1
118,i got 107 likes on an instagram photo of a bike so i hired an agent and quit my job today #NeverGiveUp,1
3081,i quit my job today cause who cares i do not i realized i am smarter than everyone and now my head hurts,1
4499,Microsoft posted a job you might be interested in. software engineer 2 - ARD - Suzhou - Suzhou Jiangsu China CN via LinkedIn.,0
2239,Unemployed since Friday. This sucks.,1
7569,Looking for a #career change? Dealertrack is #hiring a Sr. Software Engineer- Python. #Jobs https://t.co/SLz2FGEtE9 #job,0
5841,My new Job site has 4 floorsa Elevator and a pool https://t.co/D0W7wLa1l6,0
1247,A work-from-home opportunity that lets you go places. #WorkFromHome #smallbusiness #entrepreneurs #Canada http://t.co/Kvj3RG6NLz,0
4915,No longer unemployed in the last 2 weeks I got 2 jobs today I got hired at Sprouts #happytobeworkingagain,0
6273,Fuck Man bought my phone then 2 weeks later get laid off from work and I got one month until the next bill comes! Agh damn!,1
4083,I got hired at 2 places today! Aye..bitches gettin paper;),0
6323,I am dusting off the resume and seeking a management /training or compliance position. If your job has an opening contact me. Thanks,0
7163,I am unemployed and desperately need a job Please pray so that i may be de~ https://t.co/xnnLQy9GmU #pray #prayer https://t.co/Gxai3wOsFT,0
3097,So I quit my job today....,1
3551,Okay I need to get a job now this unemployment life was nice for awhile lol,0
4687,Day 4 of unemployment finds me debating about doing freelance work vs working for another company vs being a international jewel thief.,1
3262,I have been tested and got fired.,1
130,Craziest thing happened to me today..i lost my job..then got hired by another one an hour later..pure awesomeness,1
1197,Got laid off 4-5 weeks ago waiting on new@job for training. Have benefits to collect.,1
1138,So I got laid off from toys r us yesterday and hired at chipotle today. #TYBG  🙏🙏🙏,1
5719,I put in my 2 weeks to start full time at a new job this week. &amp; havent gotten a schedule.  Im just gonna assume Im unemployed now #fuck,1
6533,Quit my job so my last day was yesterday and today I got a job position offered to me. Holla @ having a new job already. 😎,1
5931,@Militarydotcom: Capital One @capitalonejobs wants to hire #veterans : http://t.co/zXuiLC5GFU #hiring #job,0
7365,I recently quit my job to make $5641 from my phone PRESS THE LINK INSIDE BIO to do it too https://t.co/uqpGSxmwfv,1
3818,its funny because i feel like people will be all but you watched it in 2 days!!! and i am like bish im unemployed of course i did,0
2912,Today is the day I get to see if I got the position or not....,0
6035,First day on my new position and mid day thru it all my boss hands me a beer. Life is good!,0
6500,i got fired today and am full of shame. i want to skate it out. i dont think thats how it works #lesigh #fetalposition,1
4827,I think Ive been taking stupid pills. I swear I get thicker everyday I dont use my brain &amp; I didnt have much to start with! #Unemployed,0
4830,Since I am now unemployed...-I dont have to drive anywhere tomorrow in the snow-I dont have to listen to shitty people say shitty things,1
35,I got laid off two weeks ago now I got another job # All can do is thank God,1
5619,The architecture firm laid off a group of employees and unfortunately I was one of them. I am currently in shock... http://t.co/IFToIYFbg8,1
3128,Well I quit my job today.....,1
4798,Being unemployed has allowed me the time to pursue things I love. For example naps,0
5086,Was fired from HS coaching job earlier this week https://t.co/BC2WA6vV6Z,1
3534,Alright got fired from a volunteer position new low in life whatever still setting milestones.,1
6964,I got fired frm my first real job today,1
2908,So Ive been unemployed for like 3 hours and I need to work.,1
2248,Its been a really long week.  Took until today for me to really break down and sob.  I am unemployed and it sucks.,0
2270,Looking for a job in #Management? 100s of new positions were added to the BRR Job Board: https://t.co/ZNPyvVdGA2 https://t.co/17jKo4AFu6,0
6943,Looking for a #Student #Equity Coordinator (Categorically Funded) #jobs http://t.co/ROiyoUrqXk http://t.co/MpeTtWvr7l,0
4978,I got fired from my job today!  Its about time!  I hated that place,1
2008,everyone at my new job calls me Kimberly &amp; I feel like this is a great opportunity for me to have an alter ego,0
3013,Yay my new boss is pretty cool and hes letting my employer train me! Sweet so I will be working Sundays maybe 4am to 12,0
7500,I am Looking for work in fixing computers or security jobs.https://t.co/fcU9W9DZYV#fintech #bitcoin https://t.co/kZnAbftxGN,0
7145,I am  unemployed assistance would be appreciated regarding any employment opportunities. LinkedIn Profile:  http://t.co/EIxW4D8aE6,0
339,I am looking for a local tweeter for hire? Looking to rec. someone for a 2 month gig for a nonprofit for a campaign. PT work.,0
5620,Just got laid off and am pursuing potential career openings in the IT industry. If you know of any please let me... http://t.co/24FLT5UsIA,1
3334,Got fired last week got hired this week lol,1
1155,Exactly last month I was laid off. Today I was called and offered 2 jobs on the same day. #Blessed,1
7014,So I got fired today..,1
3259,I got fired for organizing a union with my coworkers and it has been extremely difficult for us to find work. It’s not a good time to look for work https://t.co/FCCuyrYJV8,0
722,I have been fired by Pepsi. I tested positive for Coke.,0
6436,Lost my job yesterday already have an interview tomorrow. :),1
6534,A week ago I quit my job accepted another position &amp; started working out again #fitgirls #lifeisgood #finally,1
6013,@lartist … you’re hired!,0
3379,Haha! 3 of the girls that got hired with me quit forever21 too,1
4190,GFS calls me telling me that I work today but they fired me on Sunday?????,1
6239,Laid off as of this coming Friday.,1
5348,Just quit my job lmao anyone hiring ?,1
7508,Well I quit my job today lol... Oh well I got another interview tomorrow and my money straight,1
6750,Moms just finding out 2weeks later I got fired lol,1
2586,Looking for a #(NEW #POSITION) Senior Tax Analyst #jobs http://t.co/1LcsImla3K http://t.co/pGYpwjvGNB,0
6380,I got fired from one job today &amp; hopped on another job today &amp; start tomorrow man god is good. #bless🙏,1
1128,I am job searching for: Work at home jobs! http://t.co/4tgcXWg6JK — Walker Inklebarger (@Walker_marocliv.... http://t.co/7XD2J95J3X,0
3373,so the place i got hired at 3 weeks ago is going out of business. alright.,0
2795,got hired at two places todayand got all my homework done ahead of time. adderal goes the hardest,0
5777,Now hiring: someone to stand near me whose sole job is to swat Mosquitos!!! #plague,0
7246,I was just laid off for the week...Meaning FATE HAS DESTINED ME TO FINISH THIS NOVEL!#amwriting #amwritingscifi#CampNaNoWriMo #nanowrimo https://t.co/d8oTiGCLeU,1
6267,So I got laid off today. About to take my account private so if youve been meaning to tell someone to follow me nows the time.,1
7637,A2: Im currently not working but I am looking forward to use more of the suggested leanings like  cost per conversion etc. #mgmt6650,0
7370,I quit my job yesterday and start my new job on Monday. Dad calls me this morning: How does it feel to be an unemployed Mexican? #jokester,1
3566,Unemployment has done 2 things for me: 1. Made me obsessed with any &amp; all things on Netflix 2.Turned me into a pretty decent cook #INeedAJob,0
6398,i got fired today... whoopty fucken doo,1
4168,I had 4 jobs in 2015 😂😂 I cant keep a job and am currently unemployed so a New Years resolution of mine is to become an adult,0
251,Got fired today... Awesome,1
7094,Wyoming car salesman drew penis on his business card gave it to woman. Fired. Can’t draw unemployment,1
4079,Lol not sure why but today I got hired for a real job,0
6383,Well looks like I got fired today...,1
6858,Hell yeah Im unemployed my baby daddy down my back.,0
3722,Looking to serve on a nonprofit board or grow in your skill-set as a current board member?  The Johnson Center... http://t.co/prSRdIGj0B,0
5117,I got fired Friday. Job interview Monday. Accepted the job offer Tuesday. First day of work Thursday. This is all happening so fast!,1
