id,text,class
128,So I got fired today and then rehired.. Fuck you Im fired. Im out,0
941,Today I got a paid summer lab position bought a suit got to see my family from CT and got a new car!!! Its been a damn good day.,0
3620,Hey I got laid off today. @FBI you hiring?,0
3986,I went in for an interview today and got hired on the spot. I was so fuckin juiced lmfaoooo,0
4057,Today I got hired on the spot tomorrow I start. Here comes some monaaaay!!!,0
932,Got hired to be a music reviewer again next semester but idk if I should take the position or not? Hmm.. decisions decisions.,0
4109,If your unemployed or underemployed. This is the Career for you.,1
3890,#Abbott is hiring a 2015 #National Black #MBA Opportunities apply now! (#Illinois) #job https://t.co/byg4s1rAC7,1
752,A friend is looking to hire an entry level marketing position. Let me know if you are interested. #mnjobs,1
6138,Amazon posted a job you might be interested in. Senior HR Business Partner - London United Kingdom GB via LinkedIn http://t.co/S2cFMos7lX,1
2551,Looking for a #Registered #Nurse RN Progressive Care PCU New Grad Position #jobs https://t.co/iMVpWAlIKc,1
1445,Unemployed - Looking to get back to work? https://t.co/TgScR5Sasl #HRGirlfriends https://t.co/M9nRxX6IDP,1
1063,Currently applying for jobs....,0
7604,@burmeisterd1 No. Laid off a few weeks ago. Anyone looking for cheap labor?,0
2424,Yahoo! posted a job you might be interested in. Incident Management Analyst - Buffalo/Niagara New York Area US... http://t.co/WIJ7UoIojs,1
4016,Yea so I got hired as manager of a pizza place so prob nvr eating pizza again thats my new thing,0
3771,Unemployment is the meaning of my life. https://t.co/R0thZDoIZ0,0
2114,Searching for #work in Washington DC? Send your #resume to Ame Management Group. http://t.co/SmgXPWvwsp #gethired,1
4096,Well I was gonna go job hunting in CC tomorrow but ended up getting hired like 5 minutes ago,0
1831,I am looking for a designer team.,1
3154,We feel for those laid off from #Target and are always looking for top talent. Search for open positions: http://t.co/kjMcH7u9G3,1
1102,I am Looking for work in fixing computers or security jobs.https://t.co/jvptE989VG#fintech #bitcoin #rimbit #crypto,0
7030,hey mom uh please!! dont!!! remind me of how Jobless i am rn. ive constantly had unemployment on my mind ever since i quit and im just trying to figure out a job that i actually yknow wont hate,0
3712,Looking for a new source of money?https://t.co/Sx1int0qkwhttps://t.co/VfuuWEJoWI https://t.co/9rNxd1rZxh,1
1347,Any positions for an equity trader with 15+ years experience @jobs4ATX?  Other i-banking opportunities would also be of interest.  Thanks!,0
1332,If youve ever been interested in quitting your part time job wanted to be your own boss  or run your own business send me a message!,1
6265,Good thing I got laid off this week.,0
979,Interested in a #job in #NebraskaCity NE? This could be a great fit: https://t.co/DR8EvBkTZk #NowHiring #GetHired #Manufacturing #Hiring,1
2704,#Insurance #Jobs Insurance Staff Position - State Farm Agent Team Member - Scott Krevat Insurance Agency Inc -... http://t.co/xABfRUObsH,1
3826,I am back on the Job Market! Is anyone looking for a Test or Technical Manager? https://t.co/gCBJh8nyQD #gamedev #gamejobs #unemployment,0
6985,Why is reddit whiteknighting so much for the mod that got fired yesterday? I actually lost my job yesterday too. Wheres my lemming army?,0
3975,Worst time of the year when I gotta go on the out of work list at my union hall and I cant smoke till I get hired on again,0
409,#Job #NewYork (USA-NY-New York) Analyst HR Operations: Position Summary:The Analyst HR Operatio... https://t.co/koiePr7CBq,1
1549,Showed up to work today thinking I still had a job and my uncle told me to gtfo and never come back... looks like he actually did fire me...,0
4640,So to answer a few ??s about the fine dining job they lied about my hours/pay/job description so I quit Tuesday so I went to Hooters today,0
5023,Dude totally getting fired. Oh well Im starting a new job soon.,0
2541,Looking for a postdoc position to study metabolic and/or tumor immunology? Childrens National Medical Center: http://t.co/amnsldR5GS,1
3804,Well fuck unemployment was declined... Im so fucked right now #morebadthings,0
1609,Looking for an investor relations job or career? Visit the NIRI Career Center to see open positions &amp; post a resume http://t.co/OvV3fE0KTy,1
1232,Heres a great opportunity for someone with a strong hunter mentality who would like to work at a company that... http://t.co/7nQHJtNcIY,1
7435,I am seeking 2 local positions here in SLC. A customer service agent and a order entry coordinator. Play it forward if you know of anyone. …,1
6078,Lord please give me favor to get this other position at my job so I can have better pay and benefits. I even start paying dues to the union,0
6121,The Honest Company posted a job you might be interested in. QA Automation Engineer - Greater Los Angeles Area U... http://t.co/hodyLuVHUG,1
4436,Teacher friend and I are in the works for a new job watching dogs sleep or blogging about hit shows each week.  Anyone hiring??,0
5662,Just got laid off so making music is keeping me spirits up:) https://t.co/1R6347CLMU,0
6602,Here is a job opportunity with a company that is working with our school:ROLE: Event WorkerIN SHORT:We are a... http://t.co/hM78jIIYIO,1
2687,#Brooklyn #Jobs Care Coordinator Mental Health - (Brooklyn): Job Description: Position Overview: Company Ove... https://t.co/xmRAmWQ51M,1
6866,Yeah Im unemployed with a schedule lol.,0
1260,Opportunity for #wholesale inside #sales #professional. https://t.co/lD937OyNwj this #job might be a great fit for you. #work #careers #jobs,1
5341,I quit. Is anyone hiring?,0
5600,Is there life after being laid off from your job? YES. http://t.co/iCgRnrlXQI #career #unemployment,1
2865,Well I guess technically I work for Obama because he gives me that unemployment check every 2 weeks,0
6617,Amazon posted a job you might be interested in. Software Development Engineer EC2 Networking - Greater Seattle Ar… http://t.co/b7EepFmcb8,1
2756,Searching for an IT Project Manager skilled at working on complex projects ERP etc. Please reach out so I can share some details about a …,1
1437,Unemployed Under-Employed Unhappily Employed? Find jobs &amp; career solutions on LinkedIn in JCD The Job Seeker &amp;... http://t.co/LyDXdplJs2,1
1612,Looking for a new career? Rain Bird has the right environment for a thriving career. Sr. Tooling Engineer #Tucson AZ #job #hiring #career https://t.co/k9hK5oTSM4 #Engineer #Extrusion #Plastics #CareerArc,1
418,#Job #Sarasota Quality and Regulatory Compliance Manager: Sarasota POSITION DESCRIPTION Voalte is on the prowl... http://t.co/nRnRZb2Vsl,1
359,Im looking to hire a TRIM carpenter. Im looking for someone with some talent and wants to work hard. Im NOT looking for a helper or...,1
6,I was laid off with a severance package-so of course that softened my blow. But I was unemployed nonetheless. Ive never relaxed so well.,0
2143,Searching for #work in Cleveland OH? Send your #resume to Cleveland Metropolitan School District. http://t.co/e9RnS0cEvB #gethired,1
3235,Having failed to be drafted thus far I have fired my agent.,0
1005,Interested in a #job in #Edison New Jersey? This could be a great fit: https://t.co/c0Ziv9UwKq #NowHiring #GetHired #Clerical #Hiring,1
355,I am looking for a presentation layer architect familiar with Java technology who wants to work in Alpharetta.,1
1088,I am seeking a mid-level #SQLServerDeveloper for a perm position in N. #CharlotteNC. Send resumes to mhamilton@tmfloyd.com! #SQL #ITjobs #RT,1
3157,Urgent - if you know of a marketing/communications job opening please let me know. Ive been laid off. Thank you.,0
3034,even though I only been working at my new job for 4 days Im already gonna be running the second store by myself tomorrow,0
1393,Unemployed Under-Employed Unhappily Employed? Find #jobs &amp; career solutions on #LinkedIn in the Job Seeker &amp;... http://t.co/DEBmswo4Ql,1
2545,Looking for a #Academic #Psychiatrist Position Available #jobs https://t.co/eZ2ERrcrEX https://t.co/pKuZmCStvm,1
4031,Searching for #work in Dover NH? Send your #resume to Measured Progress Inc.. http://t.co/HdPdBR7TjQ #gethired,1
2288,Looking for a job in retail? Radial is #hiring thousands of #warehouse workers across the country w/ great benefits. Say YES to Radial today + apply online for new positions available in #Kentucky #Virginia #Florida + more: https://t.co/vI06YmKv9S  #jobs https://t.co/tQOWHsDIQJ,1
4481,Anybody know somebody who knows somebody that knows if a job is hiring??,0
3842,Does WWE think Im some stupid unemployed virgin? Oh wait....,0
1733,Crazy tho. I got laid off and now TWO jobs want me. Im spechul,0
2324,The reason why I am #homeless after losing my job is that after taxes rent and medical bills I could not afford rent or a car anymore,0
7620,Goodness son did you brush ur teeth before getting on the Blue Bird? 🙌 my mistake. I forgot youre unemployed. I have open position call me,1
3296,I got fired today then hired seconds later HA!! #MyLife,0
3408,Who hiring? I just got fired,0
2164,Searching for #work in Miami FL? Send your #resume to New Directions Staffing. http://t.co/CxCd7jW4HM #gethired,1
1314,Dont submit then quit. Apply for jobs like Retail Sales Consultant at AT&amp;T then look for people you might know at the company. You might be able to reach out to HR directly. Ready to apply? Check out the link in our bio.,1
2740,#Job #KansasCity Bakery Clerk- Shawnee Price Chopper: Shawnee This position is responsible for preparing and p... http://t.co/AJ0IFOBalC,1
6105,Apple posted a job you might be interested in: Genius - Retail Technical Support - Santa Barbara California Area US.,1
3575,I need to start my new job already! I just realized Im watching COPS! Unemployment life is not for me! #daytimetv #cops #inbetweenjobs,0
496,Well I didnt get fired on my first day at my new big girl job so thats something I can be proud of for fifteen minutes.,0
5811,Job Opportunity: Looking for a way to do work centered around social justice and equity? Are you interested in marketing and advertising?,1
3764,I’ve just been avoiding social interaction for days because I really really don’t feel like showering #unemployment,0
7214,Would you recommend a friend for this opportunity? Supervisor - https://t.co/nMiiiK1TmF #Retail #Houston TX #Job #Jobs #Hiring,1
5810,Dont submit then quit. Apply for jobs like Java developer at Cognizant then look for people you might know at the company. You might be able to reach out to HR directly. Ready to apply? Check out the link in our bio.,1
2755,I am looking for FOUR new It Works business partners who are ready… https://t.co/BJGIFs4EBy,1
4102,Got hired...now I have to start waking up early again!,0
710,My boss straight fired me and I have YET (after working like 4weeks) to receive a paycheck http://t.co/5nSY7uvm5M,0
335,I am looking for a digital marketer that has run a marathon and worked on the Obama campaign. Any thoughts?,1
6582,is anyone hiring? like to do from home work?,0
1236,We are currently looking to hire someone to work nights(4-8:30) and weekends! If you or someone you know is interested bring us a resume!,1
4873,I am looking for work.... anyone hiring?  Ive been looking and applying my heart out!,0
3777,I dont like to call myself unemployed.. I prefer self employed bc there is money to be made out there,0
6539,Of course when I tell my old job about my new job they offer me a full time position. Where was that about 3 weeks ago?,0
6615,If you are a Data Science specialist interested in working in a financial domain here is an opportunity with Fidelity India. #FidelityAssociate #FidelityIndia https://t.co/Sb3CetY1t7,1
5812,Would you recommend a friend for this opportunity? Busser - https://t.co/pubk9ry6Hh #Labor #Mesquite TX #Job #Jobs #Hiring #CareerArc,1
4237,Searching for a second job that wont conflict with my first job and get me fired 😒,0
6726,I just got fired oops I meab I quit I mean I dropped outta school just to be the shit,0
1435,Unemployed Under-Employed Unhappily Employed? Find #jobs &amp; career solutions on #LinkedIn in the Job Seeker &amp;... http://t.co/hxsHnwtNrl,1
4043,So i got hired today rite away and start tomorrow at my new job,0
1243,Al-Futtaim Group Real Estate posted a job you might be interested in. Project Manager – Network Development | Auto… …,1
2727,#Job #FortWorth (USA-TX-FORT WORTH) Shift Supervisor (US): Job Summary and MissionThis position contributes... https://t.co/TpYKaIaQJf,1
2137,Searching for #work in Carmel IN? Send your #resume to Home Care Providers Inc.. http://t.co/jovv6B5v61 #gethired,1
2421,Lockheed Martin posted a job you might be interested in: Tax Accountant Senior (Compliance) - Washington D.C. Metro Area US.,1
4590,Money was made. Got put back on the schedule at work after quitting. I mean today overall was really good.,0
6090,Zynga posted a job you might be interested in. Principal Data Scientist  - Toronto Canada Area CA via LinkedIn http://t.co/SRqwcKX3KJ,1
1020,Interested in a #job in #Irvine California? This could be a great fit: https://t.co/fNCxRBzqk8 #NowHiring #GetHired #IT #Hiring,1
6400,Well I got fired from my job today for stupid reasons...,0
5024,Damn I got fired from my first job  I got to find another job soon cuz I want to buy iPad 4 and htc one.,0
2200,Officially unemployed. Im gonna miss all the little kids from work some good memories with them.,0
7197,Heres The Number One Quality Future Employers Want In A Job Candidatehttps://t.co/cuWsLGu5E6 via @forbes https://t.co/Jha3r97ymb,1
1050,Shit I just got hired at ANOTHER job plus I go to school.. Life is hard,0
4734,Anyone kno of places near glassboro thats hiring? #mommyneedsajob,0
3111,So I quit my job today. Does anybody know if Office Depot is looking for animators?,0
1206,Sorry to the squeenix people that got laid off today. :( ArenaNet is hiring! http://t.co/bNRvyeZkkg,1
910,Got offered a full time position at work which I took! Got a car yesterday &amp; if someone moves out before the 17th I will have my own place!,0
4776,Still in search for a job I cant continue being this unemployed nigga.,0
5774,Know someone for this job? Java Equity Developer (3 roles) in New York NY https://t.co/BIR6YPYvS2 #java #dev #techjob,1
5640,Please pray that God leads me to a full time job. I was laid off and am not receiving responses to my http://t.co/R7QDi3NFx7 #pray #prayer,0
6137,Lockheed Martin posted a job you might be interested in: Flight Sciences Handling Qualities Flight Test Engineer - Washington D.C. Metro ...,1
997,Interested in a #job in #MorristownMorris New Jersey? This could be a great fit: https://t.co/mq3i0pAUkA #NowHiring #GetHired #Hiring,1
720,Well just got fired from my job but its ok I can move forward while my former alcoholic boss is still dealing with highschool kids,0
2831,Looking for a #Palliative #Care Social Worker- Field Position - San Antonio TX #jobs http://t.co/f3Yxaj4mwW http://t.co/nEgjs1H40f,1
2723,#Job #Cambridge (USA-MA-Cambridge) Manager of Event Content: Manager of Event Content*The Position:*As a... http://t.co/D3XQe8JRXm,1
1656,But people ask me I cant believe you quit your job to find a new one lol you know how hard it is to job search when you work office hours,0
6554,Last week I was offered full time my sister just got a new job that is full time and my bf might start a new position at his #Godisgood,0
1219,RT @continimarco: InfoCert posted a job you might be interested in: Engineering Talent Network - Italy IT.,1
5284,Unemployed? To see open Social Media positions use The Social Web App. http://t.co/p2cUeub9bH #JobOpening #Jobs,1
7410,Unemployed? Head North young man or lady...N. Dakota has 3 job openings for every unemployed person: #jobs http://t.co/YMcaesNBDt,1
2237,I was employed and now im unemployed again. #walmart #seasonal #temp lmao.,0
6608,Accenture posted a job you might be interested in: Titanium Appcelerator &amp; IBM Worklight Professionals - Pune Area India IN.,1
1979,I recently quit my job to make $9023 from my phone PRESS THE LINK INSIDE BIO to do it too https://t.co/E9a1gJhVqX,1
1416,Unemployed Under-Employed Unhappily Employed? Find jobs &amp; career solutions on LinkedIn in JCD The Job Seeker &amp;... http://t.co/JLU45SnxYg,1
4181,I am unemployed for the next 72 hours so Im getting weird.,0
5128,Recently laid off? Turn #lemonIntoLemonade and build your own #enterprise #giant with @softwaredevin https://t.co/Vg71rYVKBV,1
3603,Now actively seeking employment. I hate job hunting! But such are the times in todays job climate.,0
5178,RT juliarosen: Interested in hiring some of the laid off Bernie staffers? Fill out this form: https://t.co/NUaVPvLaRD - People4Bernie,1
755,#Maintenance Technician #Are you interested in an entry-level position with a growingproperty management company? If you are ready to start your career this couldbe the opportunity for you! RHP Properties* ( https://t.co/2NXiLmE1pD via @jobsearchmoney #jobs #search https://t.co/DP3a3YL2As,1
4189,my old manager is trying to tell unemployment that I never called in on October 11th. Please explain this? Also I was fired on October 13th and my paycheck was ready 3 days later. If I stopped showing up why did I get a check so soon? I normally receive DP 🤷‍♀️ @ChipotleTweets https://t.co/JyjxOMGlCR,0
2112,Searching for #work in Call TX? Send your #resume to B2B Workforce Inc. http://t.co/VTMCzFzys4 #gethired,1
5132,Laid Off? Start a - Work at Home Business in 24 Hours or Less-  http://t.co/STSAzIPWTT,1
4498,Microsoft posted a job you might be interested in. Prinicipal Data Scientist - Greater Seattle Area US via LinkedIn.,1
1610,Looking for a job? 7 employers to participate in Murfreesboro job fair Tuesday: https://t.co/nae9f18F1S https://t.co/9cVDR6jLFf,1
2347,anyones job hiring?? seriously done w crappy Main Event,0
5318,@VictoryCRussell in prev. position core presentation had factual grammatical errors. No editing allowed. Couldnt give it. Now unemployed,0
1082,I seriously have pages and pages of Job Openings I want to apply for but I am addicted to Internet Job Searching &amp; avoiding the applications,0
5783,Anyone looking for a job Panera is hiring overnight bakers. One guy just quit and they fired a guy yesterday,1
1230,Here is a great part-time opportunity to work with a fantastic team! https://t.co/EB75E59hda,1
3276,Looking for a career in the fire service? Dont miss a chance to join a top-notch fire department! @PhillyFireDept https://t.co/Gz4ZZPTbya,1
3753,Looking for a great career opportunity? Qualified Staffing can help! https://t.co/IpsOJHZF5d https://t.co/2w2SAjJ64B,1
3964,oh right my boss emailed me today ASKING IF I WANT TO GET REHIRED FUCK YEAH I DO,1
1424,Unemployed Under-Employed Unhappily Employed? Find #jobs &amp; career solutions on #LinkedIn in the Job Seeker &amp;... http://t.co/y843fQJ3yx,1
151,I bet I fucc around and get hired by somebody today aha I feel it,0
7176,I am having the worst luck with finding a job. #someonehireme #imresponsible #iswear #unemployed4ever #ihopenot,0
4665,Being unemployed sucks balls...But on the bright side I now have more time for twitter! Will work for food...,0
6130,Tesla Motors posted a job you might be interested in. Store Manager - Shanghai - China CN via LinkedIn http://t.co/Ti7TWAmX4a,1
3723,Looking for a Facility Electrical Engineer position? Apply to Design Systems Inc. in Roo Career Network!,1
2504,Interested in a #job in #Redmond Washington? This could be a great fit: https://t.co/GVTiIwc1QJ #NowHiring #GetHired #Manufacturing,1
136,whats funny is the job i had today wasnt even mine the guy didnt show up at all i just took over &amp; the designer hired me #blessed💃🏽,0
6959,@artiequitter boy Artie you are awfully randy now that you are unemployed,0
98,I just got hired and today is my first day and I already really dont wanna go to work,0
71,hmmm to become a full time streamer since i got laid off? hmmmmmmmmmm yeah right better off with selling my body.,0
2354,Anyone know of places newly hiring in Sierra Vista Tombstone Bisbee Fort Huachuca Benson or anywhere within 30 miles of here?,0
1970,I recently quit my job to roll in $5641 from my phone PRESS THE LINK INSIDE BIO to do the same https://t.co/xPpC0pZGEV,0
6099,IBM posted a job you might be interested in. Business Analyst - Shanghai City China CN... http://t.co/o6RaS5paFY http://t.co/Pk22NiRRUF,1
6603,Dell posted a job you might be interested in: Network Security Sr. Analyst - Firewall Engineer - Guadalajara Area Mexico MX.,1
4484,anyone in #inlandempire know of anyone hiring? its time for a new chapter/better job,0
6586,Does anyone know any places that are hiring or good places to work?!? :))),0
1119,I am job searching for: Work at home jobs! http://t.co/4tgcXWg6JK — Walker Inklebarger (@Walker_marocliv.... http://t.co/2Krzj9OxCV,0
1750,Unemployment Day June 18 2013 Location: San Diego County FairBe our guest if youve been laid off work!If you... http://t.co/U6uC2Ii5ZJ,1
4500,Here are job opportunities you might be interested in. http://t.co/cdBCKrlXeM,1
6092,Microsoft posted a job you might be interested in. Sr Mktg Mgr Xbox Lifecycle Mgr - Greater Seattle Area US via LinkedIn.,1
6580,anyone 18+ need a job with lots of hours? justice is hiring we desperately need people that arent minors who can work during the week,1
4794,Some dude offered me a job at Burlington. WHERE WERE YOU 5 WEEKS AGO WHEN I WAS UNEMPLOYED?! HUH?!,1
2157,Searching for #work in Columbia SC? Send your #resume to Palmetto Baptist Columbia SC. http://t.co/IhFw5nWjEH #gethired,1
1616,Looking for a summer job? Housing has multiple positions available https://t.co/gjNa5aKPnd. @CCU_DSO @CHANT_411 http://t.co/DHjLciWWIr,1
2184,Searching for #work in Short Hills NJ? Send your #resume to OMEGA Brands TN. http://t.co/QQ5H2WJV0f #gethired,1
3130,I just repeatedly called a woman the wrong name in a meeting at work. Everyone laughed at me a lot. Unrelated I quit my job today.,0
7002,Our cashier lost money and my boss thinks an employee stole it and says were all fired..,0
1345,Interested in a #job near #MESQUITE TX? This could be a great fit: https://t.co/M16Tp4BYc3 #Sales #Hiring #CareerArc,1
983,Interested in a #job in #Alabama 20080? This could be a great fit: https://t.co/0Fp8r3f0rw #NowHiring #GetHired #Hiring,1
3285,I am dead ass never getting called back into work just to think I quit and in the end I got fired,0
3708,Looking for a #career change? Dealertrack is #hiring a Lender Development Manager. #Jobs https://t.co/3RgAU1x4XI #job,1
2279,Looking for a new career path? The FAA is hiring 1400 air traffic controllers. #jobs https://t.co/HZQ9HGlESC https://t.co/3RDDaYhpqh,1
2125,Searching for #work in Carmel IN? Send your #resume to Cox Automotive. http://t.co/K3pIbfn7Zf #gethired,1
105,I JUST GOT HIRED ON THE SPOT AND I ALREADY LOVE MY BOSS HES SO NICE OMG I LOVE STARBUCKS,0
780,New Yorkers: its hard to compete with the sunny weatherbut we have an intern position you might be interested in. check us out on FB.,1
7570,Looking for a new career? The CHPs goal is to hire 600 cadets per year. #PatchCalifornia http://t.co/NRViDdtszO,1
1188,Got laid off today.  Maybe Ill be negative in weeks/months ahead but today I am enjoying being out of that place.,0
6610,Heres a job opportunity for someone with an HCI background interested in mental health and able to work in Chicago. Were trying to make digital mental health work! https://t.co/gD8OK3llKs,1
3748,Looking for a job in #Bedford #MA? Environmental Engineer (16 https://t.co/lcJruuwUQe #jobs #hiring,1
3515,Yesterday was the first day on my own in the new position. It went stupid well. Fingers crossed today does as well.,0
891,Looking for a new #job? Check out these open positions! http://t.co/m1o5QoGS5L,1
334,I am looking for a conservative online radio network to host a new radio show Either live or prerecorded 1-4 times a month. Know of any?,1
2169,Searching for #work in Lathrup Village MI? Send your #resume to Charter One. http://t.co/IY9r5QPNDj #gethired,1
4571,@MikeyG5643 they fired me,0
905,Looking for a new #job opportunity? Apply for one of our many #intern positions today! https://t.co/x3AoUMU4FE https://t.co/BFHwZ6xUVI,1
3751,Looking to join Department of Veterans Affairs (@JobsatVA) Premier Anesthesia (@WorkatPremier) or Locum Leaders (@LocumLeaderJobs)? View 43 openings from these companies and more. https://t.co/Qe4cEifw7g,1
3774,cant believe i was just unemployed 50K divorce debt 40K hit by IRS no health insurance forced to buy it from the government or be fined..,0
2290,Looking for a job a new career or more job satisfaction? 51 Career and Job Affirmations. http://t.co/Zkv30ItwAy,1
6873,What is crazy is that by the time I start my new gig I will have been unemployed for 2 months. That is the longest period since 2005.,0
3783,Unemployment is cool because I get to sit here all day and reflect on how much of a piece of shit I am,0
2686,#Bloomington #Job ASM Service &amp; Operations - Mall of America #135: MN-Bloomington Job Description : Position... https://t.co/J5hgGBr9Rs,1
3650,I officially began my new job yesterday. The whole crew there is really nice and they sent me home today since Im sick lol.,0
1195,Got laid off today almost like they knew how far behind I am on Mad Men.,0
4490,Microsoft posted a job you might be interested in. PFE (Premier Field Engineer)- Exchange - Israel IL via LinkedIn.,1
5702,Hey now that Im #unemployed I can watch late night talk shows and can see Craig Fergusons new studio its mad shiny.,0
2291,Looking for a job? Energy Engineer/Resource Efficiency Manager 3 at Northrop Grumman (Barksdale Afb) http://t.co/5ertaYMFl4 #green #jobs,1
2313,Looking for a flexible entry level job? Look no further: http://t.co/aob01O6jyd #hiring #workremotely #flexibility,1
