id,text,class
1712,Jared says: I am laid off for two weeks n I filed a claim for unemployment when I went to certify I answer... http://t.co/w253Vh9jMQ,0
500,I GOT FIRED FROM MY JOB so now I have lots of time to read books and make smoothies and think hateful thoughts about my former employers.,0
4979,I Lost My Job Now What | How It Feels to be FIRED: http://t.co/nqiwiKQlc5 via @YouTube,0
5490,Maybe you just got laid off from Future and are looking for freelance work? GET AT ME! Also youve got my hugs.,1
2553,Looking for a position that offers plenty of perks &amp; opportunities for career growth? USAA is hiring an Auto... https://t.co/cHkwQRc8Mk,1
4693,To think I am unemployed? Who the fuck is working at @NBC that they are still producing sucky ass shows? You better not fuck up @heroes,0
4802,Are You Unemployed? Want to Learn Social Media while you are looking? http://t.co/NUE04Eoi2i  Earn while you learn,1
2312,Looking for a #(NEW #POSITION) Associate Director Regulatory Affairs Advertising and Labeling #jobs https://t.co/nVyls7e1Kj,1
4773,My new hobby is filling out job applications. #GetAJob #Unemployed #HireMe!,0
4848,Is anyone working somewhere that is hiring!? #pleaseletmeknow,0
6570,Anyone looking for part time work? Our company - American Healthcare Group - is hiring.,1
7243,Was laid off this past Friday. If anyone knows of any job openings please let me know :) #Thankyou,0
2271,Looking for a great part time job OR a career change? Visit http://t.co/s5v4e7q0Jf today! #jobs #employment,1
1138,So I got laid off from toys r us yesterday and hired at chipotle today. #TYBG  🙏🙏🙏,0
6345,Currently I am accepting resumes for a full time LPN position at Dr. E.J. Jones office. If you are interested... https://t.co/8CZ9ovWarP,1
4426,Anyone hiring entry level positions in a tech or imaging / photography / arts job? ANYTHING. In Chicago preferably but will relocate.,0
3073,Almost lost my job today. Need to quit but I got bills so Ill just look for another one,0
2092,Top Story: Looking for a great career? Get Hired! https://t.co/1vxCFQSFja  #jobs #trending #jobsearch #career #job #gethired #hired #job https://t.co/6Jak1J2OG5,1
116,Lost my job yesterday. Jus got hired again LOLLL,0
2912,Today is the day I get to see if I got the position or not....,0
5730,Looking at job openings on my down time can be pretty sad. Especially as I sit next to the new intern aka an unemployed smarty with an MBA,0
2180,Searching for #work in Granville OH? Send your #resume to Acuity Brands Lighting. http://t.co/YG9yt1eQ2B #gethired,1
494,First day at my big girl job complete. Didnt get fired. Id say Im off to a good start.,0
6477,Hey guys. I still cant get ios7 and I lost my job today lmao what a good day,0
2266,Looking to make a career change or find a new job? @HireOurHeroes is holding dozens of hiring fairs nationally http://t.co/Ahw31eOdQ8,1
2297,Looking for a job? CFO Construction and/or Renewable Energy at Design Staffing (San Mateo) http://t.co/PrC0xvUlp8 #green #jobs,1
3934,@MKFlynn 3DAYS 2RAISE2820$ PLEASE DONATE 2$&gt;MYPAYPAL IS anthonyperrone@rocketmail.com 4EVICTION/CAR/BILLS.CANT WORK DISABLED LAID OFF!HELP!!,0
374,I am currently looking for an intern to work 2-4 days a week for 3 months in Brooklyn. Stipend negotiable. Please RT.,1
1022,Interested in a #job in #Robinson Illinois? This could be a great fit: https://t.co/HD7oKBvAbI #NowHiring #GetHired #Manufacturing,1
4672,My laundry consists of swimsuits pajamas work out clothes and towels #unemployed,0
5544,Does your company/school need a trainer? I am currently looking for a training position in the greater Philadelphia area. Im quite decent,0
5737,I remember the time I told a girl I was unemployed and she ignored me for the rest of my life. Yeah so thats me right now.,0
1596,Looking for a new job or recruiting new staff? Facebook rolls out job postings plus other social media news stories:https://t.co/U1wHYlMIpH https://t.co/4gD8R9qPy5,1
6525,Today I start my new work-from-home position and I could cry I NEVER HAVE TO LEAVE THE HOUSE AGAIN 🙌🏻,0
3381,Im no longer hired he said that I been fired,0
6026,Can you recommend anyone for this #job in #NewYork New York? https://t.co/4RIacDvrlo #NowHiring #GetHired #Clerical #Hiring,1
1002,Interested in a #job in #Dallas TX? This could be a great fit: https://t.co/lbGcop8336 #NowHiring #GetHired #Clerical #Hiring https://t.co/zXqk4P1Lu6,1
2178,Searching for #work in Memphis TN? Send your #resume to I.C. System Inc.. http://t.co/us9F7TE0be #gethired,1
2123,Searching for #work in New Haven CT? Send your #resume to New Haven School District. http://t.co/i60vuBNBsw #gethired,1
2399,Anyone taking applications for a personal chef? http://t.co/eOyw6Kodbs,0
7522,Lost my work card and called my manger the wrong name today. I really kill it with new jobs,0
801,I AM CURRENTLY SEEKING A FULL TIME NIGHT SHIFT POSITION IN LA -- Have any suggestions?,0
1453,Need to Make a Career Move?  Need a New Job?  Unemployed? @leezabyers Can Help: http://t.co/1Q58suYV9A,1
1084,I am looking for a UI UX designer for a Perm FTE position in #Sacramento Do you know anyone? Reach out to me. 916-403-4076 #ITjobs #looking…,1
6853,Ok been unemployed for the last month and have been trying to catch up on the past episodes of @thechew before ABC stops airing them for good. It was my grandmas favorite daytime show and mine when I played hooky. 😊Boo ABC @clinton_kelly @carlahall @chefsymon,0
4468,Anyone likes their job &amp; by any chance are hiring ?? Hook your girl up pls,0
3832,the only reason i go to school is because i donn’t wanna be an unemployed college drop out. i wanna be an unemployed college graduate,0
1315,Interested in a #job in #Quitman TX? This could be a great fit: https://t.co/iF9GEKXU2z #Diversity #Retail #Hiring https://t.co/OJCT91rJrL,1
7133,.  @PlusGlamDiva I was hoping 2 get unemployment but this guy told me they had never fired anyone in 60 years and  I was like I gotta go,0
2277,Looking for a job? (Raleigh 1) Renewable Energy Crew Laborer at Baker Roofing Company (Raleigh NC) http://t.co/ZaC5mTCM #green #jobs,1
2841,Looking for a Fun and Flexible Work at Home Job? https://t.co/GUvgEfjS14 #Moms #Jobs https://t.co/8D6Pmj7u30,1
7192,Ingram Micro posted a job you might be interested in: Cloud Business Manager - Orange County California Area US.,1
761,Looking for an accountant position? Then this job with you at Hayden CPA SC might be for you!JOB POST: Accountant https://t.co/KyRpOKaBsl,1
2099,Looking to relocate? Join PepsiCo as a Sales District Leader - Designate. Apply: https://t.co/YjsNFaLOQ3 #GetHired #Career,1
1012,Interested in a #job in #Warren NJ? This could be a great fit: https://t.co/FOBavhvUPW #NowHiring #GetHired #OpenSource #Hiring,1
2141,Searching for #work in Loudon NH? Send your #resume to Levy Restaurant Limited Partnership. http://t.co/CiB5zAuOru #gethired,1
4690,Im not unemployed Im living in post-work america,0
4827,I think Ive been taking stupid pills. I swear I get thicker everyday I dont use my brain &amp; I didnt have much to start with! #Unemployed,0
2836,Looking for Job Security? Hiring Trends Point to Expanding Workforcehttp://t.co/qqOMMSb9wA http://t.co/EczJaySr0r,1
6082,This week: relationship ended got great advice quit my job got a position as a teaching assistant met with dept. head about research.,0
7128,I got fired from @GenieIndustries this week because I didnt qualify to be rolled over for attendance issues. BUT. I had been asking for months for my occurances to be forgiven because they were for my health. Mentally and physically. #unemployed,0
3462,Can you recommend anyone for this #job? Fired Ware Utility - https://t.co/i6ZHvwO3EL #Spartanburg SC #Manufacturing #Hiring,1
4438,Does anyone know of any places hiring??  This girl needs a job,0
7416,@ShorterPearson I have so many unemployed PhDs bitching at me all day every day. Heres an opportunity for well-paid work.,1
4104,I  put in my notice today at one job and got hired 30 minutes later to another 😁😁😁,0
4996,My old job already fired my replacement and wants me to come back and help. Oh man Im going to be making mad money this year #6Figures,1
503,My boss saw me tweeting on the job. I got fired.,0
2720,#Job #Buffalo Commodity Specialist - Brady Corporation (buffalo new york): Job Description:/h3:Position Summa... https://t.co/p71ZSr5rB5,1
7191,Evernote - Redwood City CA posted a job you might be interested in: Product Marketing Manager - San Francisco Bay Area US.,1
1233,Interested in working in the energy field? Heres the job fair for you! RSVP now for Thursdays job fair &gt;&gt;&gt; https://t.co/8PChRwTLhG #OYP4DC https://t.co/Tu0cu2WM0U,1
5623,The good thing about not working is that Im not getting laid off right before Christmas.,0
5669,I managed to stay unemployed for all of 2014..wth happened to me?!,0
81,I got hired as a camp counselor for short term teaching chorus and adventure time at Camp Waldemar!!!! Today is good. God is good.,0
4522,#viral Fox Sports Reporter Emily Austen Fired After Insensitive Comments About Race... https://t.co/7OvnhO0cxY https://t.co/QPBwQrisTf,0
4772,Applying for jobs like crazy!! Need to find work soon cause being unemployed sucks. I am going stir crazy and its only been a week!,0
2544,Looking for a #Seasonal #Position - General Merchandise Salesfloor Teammate #jobs https://t.co/2GbQodZEjS https://t.co/miZiiRONmO,1
4784,Second update on job. Im unemployed again. So the search continues. Why cant I plant my feet? Whats wrong with me? Is my mind fucked up?,0
4956,Anyone know whos hiring???? Im dying for a job so my jeep can be done by Halloween!!!! :(,0
1608,Looking for a full time or part time job?A new store is hiring in Tyler#watchcbs19http://t.co/ijso7au11Y http://t.co/OybsR3Ey0v,1
1584,Looking to join the autonomous vehicle industry or post a job? Over 100 current positions listed now at https://t.co/hWUvBTbx2o. @v2vjobs,1
2144,Searching for #work in Columbus OH? Send your #resume to Express. http://t.co/6yG91nNBZM #gethired,1
1690,I quit my job today lol Going to start looking for a new job,0
2721,#Job #Buffalo Transit Road Part-Time Produce Customer Service w / age requirement- load position: Buffalo Want... http://t.co/ldHeOehwiZ,1
6589,Looking for work for the summer . Anyone know where they are hiring??,0
2041,Looking for a #NewJob? #CareerCast has all your #Job and #Career needs at your fingertips. https://t.co/zqpYVpjdjv #CareerAdvice #GetHired,1
5130,Fired? Laid Off? Join me TODAY and make money FROM HOME! - Classified Ad http://t.co/zKoS2EG3Ud  via @sharethis,1
3594,I dont like that stay at home moms have to be called unemployed. I DO have a job and Im a very busy person!,0
2162,Searching for #work in Cleveland OH? Send your #resume to American Sugar Refining Inc.. http://t.co/X0qgVL4mm3 #gethired,1
4927,I be applying to jobs I dont even qualify for and get hired.,0
2696,#Columbus GA #Retail #Job: Retail Store Positions at CVS Health https://t.co/tG9OZatDVl #Jobs #Hiring #CareerArc,1
6438,I quit my uncles job today everyone was sad i quit. But its been heavy on me having 2 jobs. Its hard being home only 3 hrs a day.,0
1439,Unemployed Under-Employed Unhappily Employed? Find #jobs &amp; career solutions on #LinkedIn in the Job Seeker &amp;... http://t.co/5L48mUcvvK,1
387,Im Searching for an Executive Sous Chef in DC to work for an award winning Chef...must be cutting edge creative positive with amazing e…,1
1409,Need to Make a Career Move?  Need a New Job?  Unemployed? @leezabyers Can Help: http://t.co/y07mPvIKJe,1
2009,Just ended my shift at my new job and now Im about to start my shift at my old job literally kill me,0
1645,Are you seriously searching for a business opportunity so that you can quit your job and live life on your terms?... http://t.co/8as6A3QcNq,1
6119,Heres an opportunity that you wont want to pass up: Supervisor - https://t.co/br1Kfhsoi9 #Retail #SanDiego CA #Job #Jobs #Hiring,1
2703,#Hiring: Receptionist: Location : Lakewood Ranch FL USDescription: The primary function of this position is to… https://t.co/LB2Tible2M,1
638,Anyone looking to get hired at ADP? I can get you an interview/referral! Message me.,1
361,I am job searching for: Work at home jobs! http://t.co/4tgcXWg6JK — Walker Inklebarger (@Walker_marocliv)... http://t.co/yN2e891rUT,0
2103,Looking for new challenges? On @Hired_HQ the best #rails #python #javascript companies compete for you. #railsconf http://t.co/vlLcjfTocy,1
4589,crazy how I quit my job yesterday &amp; got called back for 3 jobs this morning,0
6109,Amazon posted a job you might be interested in. AWS Global Accounts Solutions Architect (Houston) - Houston Texas… http://t.co/EMveYGYUds,1
6433,I lost my job today but its all the same im more insane each day but Ikk be ok but its all in my head in my head again the things you said,0
6311,I am currently seeking 3 interns to work with our team at LiJL Radio Network - these are not VA positions. Email... https://t.co/7YliK4xSKR,1
5680,Found out today that I was living in povertyhad a poor education and am most likely unemployed https://t.co/y36naZBnnj,0
3814,And.... Now Im unemployed.,0
2884,After 141 days of unemployment I am so excited to be at work tomorrow morning!,0
6254,Got laid off last week and now this. Needless to say Im not in a good mood.,0
1151,I got laid off today and I angrily played need for speed most wanted for 2 hours to cool off,0
6088,Microsoft posted a job you might be interested in. Enterprise Architect Northeast District US Enterprise Services - United States US ...,1
6932,Looking for a job in #Mesquite #TX? Veterinary Assistant https://t.co/FEsGeJzlp1 #jobs #hiring,1
6255,So I was laid off due to downsizing today. Which normally isnt the sort of stuff Id post on twitter but I have a fantastic network so...,0
2747,#Job #Memphis Jr. Java Developer: TN-Memphis Position Overview Provides application software development serv... http://t.co/kTK6jdehWO,1
893,I searching for a position as a registered nurse. #focusclass,0
6858,Hell yeah Im unemployed my baby daddy down my back.,0
411,#Job #Omaha Senior Internal Auditor at KP Recruiting Group (Omaha NE): Position Title Senior Internal Auditor... http://t.co/nvIl32tqbW,1
6030,Dedicated flatbed and regional runs are open now for new driver at DM Bowman. Call 844-805-4846 to get hired today. https://t.co/hkXv6SAEag,1
5474,How cool is it that I thought I was getting a different position and instead I got laid off.,0
5271,Hmmm so this is what unemployed people do all day,0
6578,Anyone out there looking for work as Bartender Host or Cocktail server?? http://t.co/56wiTy0WE1,1
6656,Heres an application to be a sandwich artist RT @xmasape Coach Shanahan youre fired http://t.co/nK7yvFWTo3,1
1204,Yes I Got Laid Off! Thank Goodness For Severance Packages - http://t.co/56o9gOiU8c via @FinancialSamura #Yakezie,0
5538,Looking for a new #career? In #Coquitlam BC #Canada? Check out our new positions for #engineers #job $SYRX https://t.co/rzDPPFJV9w,1
3041,I wish I took 4/20 off but I just couldnt do that at a store I just started working at recently,0
5476,its terrible being poor and desperately looking for a job..being laid off sucks,0
7187,Unilever posted a job you might be interested in: Camarista - Brazil BR.,1
7203,Quintiles posted a job you might be interested in: CRA/SR CRA sponsor dedicated - home based Madrid - Madrid Area Spain ES.,1
4779,I #need #cash #fast but i am unemployed https://t.co/j8o355OMXz,0
4938,Anyone looking for a serving job??? Chilis is hiring and I want to recruit some friends!!,1
4475,Anyone hiring C++ Developers or Linux Admins? Im in the job market :-),0
2101,Looking for a #job? Check out the #gethired workshops at #ROC libraries http://t.co/RMpoM1lVwg,1
6120,Apple posted a job you might be interested in: Software Quality Assurance Engineer - Beijing City China CN.,1
1956,Recently started my first FT job. Should I be paying more than the minimum on my student loans? - https://t.co/n7fgL3fDFR #taxreturn #taxe…,0
2083,Looking for a Career Change? Join this #Sales / #Marketing team. https://t.co/4uPBz2auIw #gethired #collegeathlete,1
4120,People w/BA are either unemployed or underemployed. This is your opportunity to turn it around http://t.co/7P0fVDrJ,1
860,Being unemployed is getting old.,0
5061,I recently quit my job to make $9023 from my phone PRESS THE LINK INSIDE BIO to do it too https://t.co/ELSPM9eL3e,0
7115,Just got fired.  I know I should be worried about being unemployed BUT IM SO HAPPY I FEEL LIKE SKIPPING IN CIRCLES!,0
1308,Interested in this job? Take a look: Sr. Application Architect (Acquity Group) in Chicago IL http://t.co/QSsFxAPuWA #job,1
4760,I #need #cash #fast but i am unemployed https://t.co/KJTx3OJpX6,0
1433,Unemployed Under-Employed Unhappily Employed? Find #jobs &amp; career solutions on #LinkedIn in the Job &amp; Career... http://t.co/4MFBNsNtBi,1
2273,Looking for a job? Superintendent II - Wind Energy Group (IRC9674)Job Details at M. A. Mortenson ... http://t.co/WhG0hzJtru #green #jobs,1
4458,I need another job. Anyone hiring???,0
757,We are in search of an apparel designer various staff positions and content creators. If you are interested in any of this ask for a DM.,1
4641,I just got hired at TGIF at the Rim and I already wanna quit and get a job at BJs at the Rim lmao,0
6098,Electronic Arts posted a job you might be interested in: EA Mobile: Senior Development Director (41968) - Austin Texas Area US.,1
122,Quit my job last Monday and got rehired again today. Woo! So long unemployment,0
6871,Looks like Im unemployed again lets see if I can beat my record of starting a new job in 4 days.,0
5294,Now hiring for Full-Time and Part-Time positions. Come fill out a application!!!  300 S. 17th Lincoln Ne  #Jobs #Occupation #Career #Help,1
3024,just started my new job and some bitch i work with decided to tell me that my bf fucked her in HS? Like ok? Do you want a cookie?,0
2550,Looking for a #Claims #Adjuster Trainee - San Francisco Future Positions #jobs https://t.co/ULL1HVbfgK https://t.co/cOgl5K4ZwP,1
2576,Looking for a career with more #compensation? We have 200 interviewer and management trainee positions starting $8.25/hr. Increase in 90...,1
2073,Looking for a full-time gig?@luckyslounge is #hiring full-time LINE COOKS w/ room to grow: https://t.co/wX8mmSFwhn #bostonjobs #GetHired,1
6267,So I got laid off today. About to take my account private so if youve been meaning to tell someone to follow me nows the time.,0
7233,Are you or someone you know interested in a Account Executive role? Check out this job! #jobs http://t.co/Zlw5ElxJWu,1
5841,My new Job site has 4 floorsa Elevator and a pool https://t.co/D0W7wLa1l6,0
938,NOW HIRING!! For All Positions! Come pick up your application TODAY,1
2160,Searching for #work in Concord CA? Send your #resume to Volt Workforce Solutions. http://t.co/4Q31onhycN #gethired,1
2258,Unemployed or looking for a new career? Apply this trick to get your dream job... https://t.co/RBryAGzrwf,1
986,Interested in a #job in #PiscatawayTownship NJ? This could be a great fit: https://t.co/iczpaOpj8H #NowHiring #GetHired #IT #Hiring,1
1639,If I don’t find an internship for next semester I am not finishing grad school. Like I’m quitting. I give up.,0
6667,Heres a solution. Youre all fired. Apply at Kaleida.  https://t.co/QXytIYVV9K,1
5335,Is anyones job hiring? I want to quit Wendys already.,0
6379,Got fired today lol this day cant get any better,0
2281,Looking for a Career change? Growth Opportunity? Salary plus Benefits (Los Angeles) http://t.co/UDcPchw9 #LASocialMediaJobs #SocialMedia ...,1
6577,55 or older? Elder Services of Cape Cod has immediate openings through their Bridge Back to Work program. http://t.co/1DSlpkZvVu,1
5082,I just showed up at my job and they asked me why I am here???? I said I could finish the week? You never responded to my resignation???,0
2346,weird mind place bc my job made me depressed which led me to drink dangerously but I can tell Im a different depressed being unemployed,0
4958,Anyone hiring? Im trying to quit my job doing bodywork....,0
198,Well I came into work late. They gonna fire me. I can feel it!!!! WHO HIRING,0
1106,I am on the search for a second job.,0
2681,#Anchorage #Job Fairbanks AK Special Education Teacher Position: Anchorage Fairbanks AK Special Education Te... http://t.co/vmVajCIUQz,1
6197,Looking for a business opportunity to either quit your job or supplement your income? Look at @BuildTheStore http://t.co/lotEfDZ7VU #bizop,1
146,My job fired me and just hired me back wtf is my life 😩😂,0
1338,Interested in a #Retail #job near #Mesquite TX? This could be a great fit: http://t.co/C6n3qbvZeW #Hiring #CareerArc,1
6576,Anyone know any lawnmower repair person that charges fairly and does good/quick work???,1
1855,I am looking for GUEST BLOGGERS REALTORS and SMALL BUSINESS OWNERS.  Are you one of these?,1
5916,Now #Hiring @Google is seeking a Software Engineer ARCore to join their team in #SanFrancisco Apply Here &gt;&gt; https://t.co/XdP58hOWem #engineering #JOBHIRED https://t.co/vSOQH6Li4f,1
6583,Is anyone job hiring ?? I need a job that I could work from like 6-2,0
7524,Unemployed or Looking For a Way to Make Extra Money? --&gt;&gt; http://t.co/OvRAR4rAEe,1
5201,Unemployed Under-Employed Unhappily Employed? Find #jobs &amp; career solutions on #LinkedIn in the Job &amp; Career... http://t.co/vhJxithv7a,1
3899,#Accounting #Job in #DENVER CO: Senior Supervising Accountant at Robert Half Finance &amp; Accounting http://t.co/lhRHgqTgGx #Jobs #Hiring,1
5697,Guys at my work started talking about anime. I am now unemployed and looking for a new job.,0
7024,so first i lost my bitch as job because i was tired of being disrespected and the one time i defend myself i get fired,0
3176,Are you looking for a part time job to make some extra money or did you just get laid off &amp; need fast cash?... http://t.co/SVkJqn23KL,1
5302,Oh yeah i have a job interview on Monday for a position that pays double what I make now??? Things are looking up????,0
2072,Looking for a new #career as an Administrative Assistant? Get hired here by doing this one thing http://t.co/hPzi6392Dl,1
7223,Heres a great opportunity for any veterans interested in pursuing careers in entrepreneurship.... http://t.co/UqLKpFNjKB,1
3898,#Accounting #Job in #BuddLake  NJ: Accountant - Entry Level at Accountemps http://t.co/g834qqV2Xs #Jobs #TweetMyJobs,1
3866,Wanted Clerk IV/ Communications Coordinator Computer Science Amherst Massachusetts US Permanent #amherstjobs https://t.co/5vcsNgWMft,1
83,I got hired at 2 places.. God is so good yall,0
6436,Lost my job yesterday already have an interview tomorrow. :),0
7260,My résumé at this moment: does not do any extracurricular activities; has been laid off from nannying jobColleges - if ur reading Im jp,0
2991,So I recently started work for a pet boarding/doggie daycare and someone was REALLY fucking happy to see me this mo… https://t.co/GDPFizGxUw,0
5692,Totally lost track of time today. I cant believe its already 4 p.m. So goes the life of the unemployed.,0
2104,Looking for a new way to hire or BE hired? check out http://t.co/UU5ax8MLHb to create an @myzumay . Fire your #resume ! #jobsearch #jobs,1
5307,Job Offer withdrawal: Hello. After being terminated from my previous employer I was offered a position at a ba... http://t.co/5w8hPeQgJJ,0
4783,Looking for work? Super smart advice here! #unemployed #jobsearch https://t.co/mKiQMvJwhj,1
763,Heres a good one JOB SEEKERS! THIS POSITION IS LOCAL TO NASHVILLE AREA! If interested please forward your... http://t.co/zQqwUpRRGf,1
2252,Unemployed or Looking For a Way to Make Extra Money? --&gt;&gt; http://t.co/mFbXVSQUqM,1
6244,@Anti_twatwaffle Im unemployed. I was laid off and then fired. LETS DO THIS!,0
3342,At a job interview this morning an employee peeked around the corner and mouthed YOU DO NOT WANT TO WORK HERE. I was hired. #badsign,0
5293,if any of my friends are also unemployed rn just letting you know there is a gravedigger position listed on craigslist,1
2518,Well I was scheduled for a test for that job position but the fire alarm went off.  Been sitting outside for 30mins and the FPD is here,0
5458,RT @markweaver: I got laid off today. Looking for a new gig full time or freelance. Hit me up ✌,0
6557,Well I start my new job on Monday. Same company just different position. I am confident I will kick ass as a planner.,0
1049,Literally not applying to jobs I know I will get hired for. #aimhigh,0
3559,PRAISE JESUS AND THE LORD GOD after a MONTH of unemployment I. HAVE. A. JOB!!!!!!,0
5889,Motherfuckers fired me for stupid shit,0
6313,I am currently looking for an accounting / cost accounting position in the Yuba City/Roseville/Rocklin/Sacramento area! SALT is a specialty.,0
644,Just got hired to clean another store at water side shops named Panerai boutique .. Does anyone know what kind store is that ?,0
5579,Searching for #work in Chicago IL? Send your #resume to Equity Residential. http://t.co/RofwLzg8Yf #gethired,1
2066,Looking for a New Job? Interested in a Career Change? #CareerCast Has Everything You Need and More! - https://t.co/2EwWIgqfwP #GetHired,1
6495,@adamjw84 Lost my job beginning of Sept not not in a position to right now. Starting a new job Monday when situation improves I will.,0
3135,I quit my job and my car broke down all today so now Im a broke bitch with no whip. smh life.,0
1064,I am currently looking for paid Sales Interns.  Send your resume to scott.m.herlin@sherwin.com #jobs #jobhunt #resume #intership,1
5780,Anyone friends with an iOS eng looking for a side project? (Ideally based out of NYC). $$/ equity on the table depending on experience,1
7569,Looking for a #career change? Dealertrack is #hiring a Sr. Software Engineer- Python. #Jobs https://t.co/SLz2FGEtE9 #job,1
2749,I am looking for THREE new It Works business partners who are ready… https://t.co/NMqfEE6cM6,1
