id,text,class
3441,anyone know of any job openings? ya boy might get fired,0
7079,Soooo...anyone know of anyone hiring in El Paso?? Lol#Unemployed,1
2739,#Job #Jobs #Hiring RN-ER - Travel Nursing: Emergency Travel Nursing Position available in Turlock CA https://t.co/jzA8N2oj8A,0
1218,Amazon Lab126 posted a job you might be interested in. Software Development Engineer - Framework - San Francisco B… http://t.co/DbY9m0pug1,0
2218,Officially unemployed. Can anyone recommend a good soap opera? Please summarize story up to now. Thx.,1
1181,Just got laid off? Need work?  Come to Express!!Apply today- work tomorrow 503.654.3600,0
927,Got hired  t best buy mobile last week &amp; today I have an interview with FedEx for a customer service rep position! #needthat#,0
6846,My fav thing about being unemployed again is that my dogs prefer to hang out with me rather than my employed brother.,1
745,You may be closer to qualifying for your ideal #dreamjob than you know. Compare your skills experience education and background to job descriptions to see if your background supports the positions in which you are interested. https://t.co/QmiRjHqg5z https://t.co/hT2KWowcIf,0
4189,my old manager is trying to tell unemployment that I never called in on October 11th. Please explain this? Also I was fired on October 13th and my paycheck was ready 3 days later. If I stopped showing up why did I get a check so soon? I normally receive DP 🤷‍♀️ @ChipotleTweets https://t.co/JyjxOMGlCR,1
6113,Microsoft posted a job you might be interested in. Software Engineer II - Greater Seattle Area US via LinkedIn.,0
6606,Heres a work-from-home opportunity to explore your passion for #fitness &amp; #nutrition. #hiring #careers #BeTheForce https://t.co/sdzyNSXmEe,0
6619,here is a cool job opportunity at my company in our Boston office. youd get to work with me! writing/engineering: http://t.co/oTFW37S81B,0
6994,So my coworker got me fired today because of what happened last night thats a bitch ass move but fuck him &amp; that business i worked for,1
5045,I been out sick for like 4 shifts in a row... Im def getting fired 🙃 time to look for a new pt job,0
3949,i just got laid off??????? or fired?????? for budget reasons??????? even though they hired some new guy last week??????? Im gonna puke?????,1
7274,Laid off again in banking industry.    Searching career in the media or entertainment environment,1
7670,Looking for a new #job? Check out these open positions! https://t.co/2AUO0rkGGo,0
5707,Being unemployed (sorry a small business owner) has afforded me the time to do exciting things like put salsa in my scrambled eggs.,1
4251,Looking for a job in Operations?  is hiring! $1000 bonus - Sign up to drive   #fired #layoff #work https://t.co/doGSHK7SVj https://t.co/CeGPYwMmxX,0
500,I GOT FIRED FROM MY JOB so now I have lots of time to read books and make smoothies and think hateful thoughts about my former employers.,1
7366,I quit my old job over a month ago and I STILL get weekly schedules and emails ????,1
4024,Searching for #work in Akron NY? Send your #resume to Adesa Inc.. http://t.co/Ayu0sVtnde #gethired,0
4762,One reason I am unemployed is that I will not settle for just a J.O.B &amp; at age 45 w/my background the right opportunity will find me!,1
2391,Is anywhere hiring at all ??,0
3117,Today I quit my job and found out I offically work at Agaci. Life is great,0
2561,Looking for a summer job?  There are over 120 positions on the #WWU Student Employment Centers website. http://t.co/QAhs9xDyDf,0
5710,I told my mom that Im the job version of being single after I finally quit my old job for good. #unemployed?,1
729,You might be just what we are looking for - consider applying with us - we are hiring for a lot of positions! https://t.co/Ol9UGuzhln,0
4998,I literally got fired 1 week and a day ago and is now about to start a new job next week. Cant stop my flow #NewDay,1
1,Laid off and had to sell my 2 tickets to @Pink! Show so I could pay rent. Ill never take a state or city job again!,1
4450,I need a job  anyones work hiring ???,1
4062,Got hired today  get my braces off tomorrow .. Ok April good shit,0
6967,My job fired me wow,1
1311,If you are thinking of #quitting here are 5 #nursing jobs at home you can try. https://t.co/DAFHLwiOSM #athomenurse https://t.co/PVhr7iwjSP,0
5703,so about five hours worth of money made at my previous jobi kinda hate being unemployed a lot,1
1089,Im searching for another job so I can get my money up &amp; move.,0
5307,Job Offer withdrawal: Hello. After being terminated from my previous employer I was offered a position at a ba... http://t.co/5w8hPeQgJJ,1
1393,Unemployed Under-Employed Unhappily Employed? Find #jobs &amp; career solutions on #LinkedIn in the Job Seeker &amp;... http://t.co/DEBmswo4Ql,0
5316,Now accepting applications as part time food provider for Waco Willman. This is a coveted position and will go quickly. DM me if interested!,0
1709,everett says: I was laid off in Aug 2012 with the intention of not filing for unemployment but still dont have... http://t.co/FY6ZiAEs,1
5657,My project got killed this weekend and in the process I was laid off meaning that I am available for new opportunities lets talk...,1
407,#Job #NewJersey Community Director Bergen County Area: NJ-Pine Brook Position Purpose This position will impl... http://t.co/EbNuCzFaeP,0
5736,In recent news I redownloaded the Kim K Hollywood app so as an unemployed 24 year old Id say my life is going well.,1
913,Got hired at best buy mobile last week &amp;amp;amp; today I have an interview with FedEx for a customer service rep position! #needthat,0
990,Interested in a #job in #Ontario 20200? This could be a great fit: https://t.co/8qWUxC1g24 #NowHiring #GetHired #CustomerService #Hiring,0
6853,Ok been unemployed for the last month and have been trying to catch up on the past episodes of @thechew before ABC stops airing them for good. It was my grandmas favorite daytime show and mine when I played hooky. 😊Boo ABC @clinton_kelly @carlahall @chefsymon,1
4851,Anybody Hiring?? Quick Learner! I put heart into my work! I have applied to so many places and continue too! I am reaching out to everyone!,1
4734,Anyone kno of places near glassboro thats hiring? #mommyneedsajob,1
3897,#Accounting #Job in #BOULDER CO: Accounts Payable Clerk at Robert Half Finance &amp; Accounting http://t.co/76bCBKV8MV #Jobs #Hiring,0
2554,Looking for a new career opportunity? Positions available for servers hosts and cafe at Tavolino restaurant at... http://t.co/br6Urm6rCf,0
775,For anyone looking for a new opportunity here is a chance for an entry level position for a great company! Plz RT!https://t.co/vyC7umrAJy,0
357,I am looking for work full or part-time(fly-in) work as a data acquisition/assistant engineer.  Sports Cars or Open-wheel. Particularly int…,0
1163,Got laid off today. My company couldve done it so much better. #movingon,1
7541,Looking for a new job? Why not work for yourself? Try our free 7 day course &gt;&gt;&gt; http://t.co/kssDPgurYr  #jobsearch #jobs #changeyourlife,0
1136,Yay I got laid off today! I get to freelance now. #freedom http://t.co/0dYs8X4P7s,1
19,Being laid off sucks but it was more like jumping ship knowing it was about to sink lol. Yeah I will be fine. It is easy to lose a job.,1
3699,These people at my new job are hilarious singing loud as hell lol,0
1310,Job Opportunity -  Java Equity Derivatives Developer in New York NY http://t.co/yf1R8YPwoW #jobs #java #trading,0
2386,Anyone hiring...more than $14,0
5375,I got fired wednesday now I have orientation wednesday look how God works.,0
1391,Unemployed? Underemployed? Looking for a new opportunity in Huron? http://t.co/EAH8A6gwDG,0
6336,Im currently looking for new Talent Acquisition/Recruiter positions! (FT contract or employee) divtwins@gmail.com,0
2247,@ProfKFH all Im unemployed. I was fired 2 weeks ago. So be blessed you have one. :),1
2323,And I remember now why I shut down and didnt do job applications for a while. It makes me very aware of how long I have been unemployed,1
340,I am looking for someone to do some carpentry work.,0
6430,Dylan lost his job &amp; I got a job today ...funny,0
4941,Anyone know of anywhere hiring????? I hate my job,0
3095,I quit a job 2 weeks ago after 3 days then they call me today to offer a different job. When does this happen?!,1
2950,I lost my job for standing up for what was right and you are in a better position than I was to do that https://t.co/ATeErb1m29,1
4093,today i got hired at a nice paying nice job AND I BOUGHT TICKETS TO SEE BOB THE DRAG QUEEN DURING PRIDE WEEKEND,0
1673,Got fired got hired and quit a job all in the same day 😂 aint that some SHITTT,1
91,I got hired and quit in the same day,1
3690,I recently submitted my resume to Sony... But they canceled the interview.,0
5523,I am quite possibly getting interviews/job offers tomorrow please school go by quickly,1
5640,Please pray that God leads me to a full time job. I was laid off and am not receiving responses to my http://t.co/R7QDi3NFx7 #pray #prayer,1
1690,I quit my job today lol Going to start looking for a new job,1
2156,Searching for #work in Warsaw IN? Send your #resume to Ivy Tech Community College. http://t.co/LWP93OYNuc #gethired,0
2028,A girl we hired three weeks ago married my client for his money which is a million dollars and fired me,1
3890,#Abbott is hiring a 2015 #National Black #MBA Opportunities apply now! (#Illinois) #job https://t.co/byg4s1rAC7,0
520,Welp it happened i have 4 job interviews on the table after 2 weeks of getting fired.  Wow thats amazing.,1
4458,I need another job. Anyone hiring???,0
6870,Well I am now officially unemployed and sold my car. Thankfully it is all on purpose ahead of my move to Portland.,1
2558,Looking to make a difference? Make a difference with us! Home Health and Hospice positions available https://t.co/BtEq4LnLHw https://t.co/Yn5E57M2Eq,0
6615,If you are a Data Science specialist interested in working in a financial domain here is an opportunity with Fidelity India. #FidelityAssociate #FidelityIndia https://t.co/Sb3CetY1t7,0
5811,Job Opportunity: Looking for a way to do work centered around social justice and equity? Are you interested in marketing and advertising?,0
6875,I havent ate all day because Im too lazy to make anything. #unemployedlife,1
6626,Dam I got fired today! Smh who hiring?,1
6984,I lost my apartment my car 2 jobs. Well I quit one..fired from the other. I had nerve damage in my shoulder.,1
946,right so today I went to apply for a cashier position at this restaurant and it was hella fancy and I had no,0
2173,Searching for #work in New York NY? Send your #resume to Ernst &amp; Young MY. http://t.co/FTJ1Ossx4p #gethired,0
5728,Hell yeah I got the job! :) It all started thanks to http://t.co/JDWIP6NvwK #unemployed #resume,0
3175,Oh hai I got laid off/downsized/let go for economic reasons. Cant wait to file for unemployment. I needed a vacation.,1
3084,so basically I put my notice in to quit today so uh yeah,1
7197,Heres The Number One Quality Future Employers Want In A Job Candidatehttps://t.co/cuWsLGu5E6 via @forbes https://t.co/Jha3r97ymb,0
2444,Just got hired yesterday but have a job interview tomorrow. CFA or FL?!?,0
2564,Looking for an opportunity to position yourself for a career in the professional sports industry? https://t.co/O8eTCCnVLE,0
4950,Anyone hiring? I need a job...,1
994,We can help you get that Direct-Hire opportunity..See How! http://t.co/zOkpkQfBMo #services #GetHired #HireMe,0
846,#Unemployed? New #jobs for Senior PHP Developer - LAMP Linux Apache in #NY http://t.co/CLFfF94Blj,0
2406,Elixir or Erlang Developer? HelloSign (YC W11) Is Hiring https://t.co/OhfeR6vg4K,0
1419,Need to Make a Career Move?  Need a New Job?  Unemployed? @leezabyers Can Help: http://t.co/5ZMLVu0q38,0
6033,I like how a job I recently applied for (the same job and same position with the same company in a different state) said that I wasnt qualified for the job... bitch I WORKED THERE ALREADY!! How am I not qualified for the job?!,0
6414,Got fired todayworse job ever!!!!,1
7133,.  @PlusGlamDiva I was hoping 2 get unemployment but this guy told me they had never fired anyone in 60 years and  I was like I gotta go,1
5750,Any restaurants hiring in buffalo? I need to quit my job like today,0
1426,Unemployed Under-Employed Unhappily Employed? Find jobs &amp; career solutions on LinkedIn in JCD The Job Seeker &amp;... http://t.co/kQ3H09h5ag,0
2521,Looking to see who #PennState hoops has offered for 2015? FREE list of offers designated by position here: http://t.co/xBgLcZu1HT #PSUBB,0
1812,I am searching for a project general manager based in Sydney for a top real estate company from China tell me if  interested,0
1115,I am job searching for: Work at home jobs! http://t.co/4tgcXWg6JK — Walker Inklebarger (@Walker_marocliv.... http://t.co/Wzgp5pE2qL,0
5023,Dude totally getting fired. Oh well Im starting a new job soon.,0
5722,Welp now that Im officially unemployed my new full time job is looking for a full time job,1
5062,I recently quit my job to generate $7146 from my phone PRESS THE LINK INSIDE BIO to do the same https://t.co/cELZO3LBYz,1
2324,The reason why I am #homeless after losing my job is that after taxes rent and medical bills I could not afford rent or a car anymore,1
185,Came to a call center today to apply and I got in! Training for 2 week at over 9$hr &amp; after 45 days of working it goes up to 10$! 😍😃😁🙏,0
2576,Looking for a career with more #compensation? We have 200 interviewer and management trainee positions starting $8.25/hr. Increase in 90...,0
7546,Looking for a Fun and Flexible Work at Home Job? https://t.co/FDMQIcZv9X #Moms #Jobs https://t.co/RUJhtYGnZV,0
1723,Photo: Today I was laid off #layoff #unemployed :-( I am very sad but optimistic anyway…. One door slaps me... http://t.co/RMgG27F6vd,1
3408,Who hiring? I just got fired,1
6309,Currently looking for a Director of Basketball Operations or Video Coordinator job within College Basketball. If anyone has any information on colleges/universities looking for one of these positions please let me know.,0
3090,I quit today. Actually I quit this week can it be the weekend??,1
3520,Fired my best friend today accepting applications for the new position https://t.co/RsJPSXEALe,0
809,Currently researching HR/Labor positions in the Ocean County NJ area however am willing to travel or relocate. Have 2.8 years experience…,0
4955,Anyone hiring???I need a job ASAP,1
6398,i got fired today... whoopty fucken doo,1
5153,Wage insurance for new jobs that pay less than a laid off job? Im interested.,1
1020,Interested in a #job in #Irvine California? This could be a great fit: https://t.co/fNCxRBzqk8 #NowHiring #GetHired #IT #Hiring,0
784,Tulsa OK #job seekers may be interested in this position!https://t.co/JkctzEf1Qe,0
2941,I ALSO GOT PROMOTED TODAY  finally have a management position 🎉,0
6449,I quit my job today &amp; i could care less ... Life goes on &amp; McDonalds was never intended to be a career for me anyways !,1
2907,Man being unemployed is the best. You get so much shit done when you dont have all that work shit getting in the way. A++ would recommend,1
5642,I was just laid off.If you need an accessibility analyst or perhaps a front-end developer let me know.,1
6466,So I just lost my job today and my bills due next week,1
2559,Looking for a teaching or education position? @cityyear @cschools &amp; @AUSLChicago are attending the Winter Career &amp; Internship Fair,0
5043,One of my managers took me off the schedule for a whole week or fired meBut just got a new job offer from a different place god is good,1
1015,Interested in a #job in #Hopkins Minnesota? This could be a great fit: https://t.co/oLOHzAwnyO #NowHiring #GetHired #Accounting #Hiring,0
4100,I just quit my job cause I got hired some where else &amp; I start today YES GAWD!,0
5575,I also had an internship and quit it since the time we talked. Im looking  for a new one as we speak.,1
7161,Currently unemployed. What now.,1
3971,Hey lucky me!! I got fired today with no notice for the sole reason that the owner hired a friend. Fucking Awesome!!,1
2910,Being #unemployed will fuck up my diet but I will hav time to work out~,1
1906,Hall of Fame Trucking is #hiring Truck Driver – Class A CDL – Laid off from the oil fiel http://t.co/3270MSPJef #jobs #Amarillo,0
3798,Everyday is my day off.  Unemployment is great!.....not really.,1
4781,I have been unemployed for 6 months however this is my future. Sending Bernie Sanders delegates to Philly. https://t.co/mZNoVM9HFV,1
2498,Interested in a #job in #Charlotte North Carolina? This could be a great fit: https://t.co/gmiUfbTT3y #NowHiring #GetHired #Engineering,0
6579,Who can get me a job or it who is hiring??? I hate working in Restaurants,0
3569,I cant wait till I get a job so I can tweet about actual accomplishments instead of how drunk I am all the time #unemployment,1
1169,I Got laid off today 🖕🏻 https://t.co/kevVjENAby @gifboomapp #gifboom,1
43,Ill check this out within the coming days because Ive been terminated laid off and or locked out from my previous job. Thank you benefits,1
2795,got hired at two places todayand got all my homework done ahead of time. adderal goes the hardest,0
2206,Have you seen my mid-week video? I decided to vlog whilst unemployed! http://t.co/amOAs5ZxF8 #lbloggers #crazybloggers #bdib,1
3530,Teammate of mine who got an interview for position I was in for yesterday got a denied email and I did not. No word is good right?,0
1605,Looking for an exciting new career opportunity in Detroit? https://t.co/1JbvAXo4wl    #jobopportunity #detroit https://t.co/PnYS6qcN34,0
5679,Tomorrows my last day of being unemployed... what to do what to do?,1
4840,ANYONE HIRING????? I AM SUCH A GOOD WORKER AND I MAKE SEMI FUNNY JOKES AND I LIKE WORKING AND I GOT NO MONEY,1
4094,I applied yesterday and I got hired today lmao @ahricynthia5 @__AdamCCXX,0
5055,Im gone have 56 hours on my first check at my new job .,0
6494,Recently started a day job. Now that I have a source of income I really want to compile a good wishlist.,0
6965,i got hired today for the same reasons ive been fired before.if every songs a circus imagine how youd hear - #daisy,0
3842,Does WWE think Im some stupid unemployed virgin? Oh wait....,1
1014,Interested in a #job in #Burnaby British Columbia? This could be a great fit: https://t.co/4poW5AZgdC #NowHiring #GetHired #Construction,0
3598,Temp job was just offered. I wanted to take it but too far. Vehicle in shop.lost the battle but will win this war on unemployment,1
1756,Freshly laid off checklist:✔ Call partner✔ Call Mom✔ Call Dad-- Wait on hold forever with unemployment. 😓,1
6502,Oh and today I was offered a 3rd interview with Boeing but for a different position out in Seattle. I dont even know if I wanna take it..,0
4819,I have taken over 40 pictures of my brothers cat. TRUE LIFE: I am an unemployed cat sitter.,1
5120,I was fired today from my part time job in california because i did not go to work. They update... https://t.co/y05XxIuHPX,1
6603,Dell posted a job you might be interested in: Network Security Sr. Analyst - Firewall Engineer - Guadalajara Area Mexico MX.,0
2759,I am looking for a social worker internship. If anyone knows of anything please let me know. I have to have an internship by June,0
4462,Anyone know a place thats hiring?? #needajob #asap 😁,1
6698,My english teachers freaking me out!!! After he saw my quiz score he said I was fired??? fired from what? i didnt know i had a job!,1
6104,Bloomberg LP posted a job you might be interested in: Global Data- Bloomberg New Energy Finance (BNEF) Analyst- London - London United Kin…,0
5048,Well first 2 weeks at my new job and its a totally different shift than my last job Im liking the new atmosphere,0
6948,I shouldve waited to quit and got unemployment,1
391,I Am Seeking A Virtual Strategic Sourcing and / or Recruiting position (for me).  I am successful working in...: http://t.co/BqNhZvNj6C,0
6137,Lockheed Martin posted a job you might be interested in: Flight Sciences Handling Qualities Flight Test Engineer - Washington D.C. Metro ...,0
1963,I recently started at Stryker and like everyone I had the New Job Jitters.  Here are some great tips to minimize…https://t.co/6nhgxWdljT,0
272,Finally got a job interview... See I knew today was a good day,0
2837,Looking for a Fun and Flexible Work at Home Job? https://t.co/0bPKtWeg9p #Moms #Jobs https://t.co/4cVAM5EIqh,0
7,So I was laid off today (1 of 3 employees)..... But this right here makes me forget how much this… http://t.co/BbUMa7rB5L,1
1978,So I recently quit my job and I gotta look for another one tomorrow. I can do it!!,1
1700,TODAY I QUIT MY JOB...in three weeks,1
4630,Yaaaaas quit my job today and got hired at another 👌👏🙌💯,1
2135,Searching for #work in Medina OH? Send your #resume to Northern Ohio Electric. http://t.co/qsR8w4VhxN #gethired,0
2085,Looking to hire talented #dev #design #sales #data #product people? Check out my new company @Hired_HQ: http://t.co/qabAZJZ2Rf,0
4752,If anyone knows anywhere thats hiring please let me know. I dont want to be an unemployed person that sits around and collects a check,1
638,Anyone looking to get hired at ADP? I can get you an interview/referral! Message me.,0
2520,Looking for a new opportunity at a company that values employee engagement hard work and community - with a whole lot of fun mixed in? Consider applying for our Administrative Assistant Position! Details in the link below: https://t.co/0IzrjcFozg https://t.co/GuHIIkbOh2,0
6701,I was fired yesterday because I was told by my boss I was not aloud to take a break without first asking permission.,1
2574,Looking for an exciting new #job? Opportunities include an ETL/Tableau Developer position in #Arlington VA. #... https://t.co/jJMLJ4zEHV,0
32,After 4 months of unemployment (being laid off sucks) I was going to celebrate 1 week of my new job by buying myself a ticket to see @OldDominion @TheBigEFair since I haven’t see them since last September at Foxwoods. Just went to the website and the show is sold out!  :( 😭,0
2243,Unemployed again. Hello ramen my old friend.,1
2756,Searching for an IT Project Manager skilled at working on complex projects ERP etc. Please reach out so I can share some details about a …,0
1712,Jared says: I am laid off for two weeks n I filed a claim for unemployment when I went to certify I answer... http://t.co/w253Vh9jMQ,1
3310,I find it funny that I was fired yesterday and then rehired lol,0
5247,lol and it looks like I will continue to be UNEMPLOYED,1
3552,Unemployment is playing with my life 🙄 I just wanna job already 😩,1
3232,Seeking a Coal Fired Plant Mechanical O &amp; M Engineer for position in CO. Please email: dbeken@thinkingahead.com /call: 800-533-7977 x3,0
3576,Being an NBA team president would have to classify as one of the greatest jobs in the world @cavsdan I am unemployed lets get it done,1
3591,I have gone from unemployed &amp; going nowhere to 2 jobs &amp; registered for school in about a month . Im proud of me .,0
1191,I feel #determined today idk why. I am ready to get things done. I am so over this laid off shit!!,1
23,I wasnt fired I was laid off! You wouldnt know the difference!,1
372,I am looking for full-time work (and am willing to relocate!) if anyone knows of anyone hiring.,0
4915,No longer unemployed in the last 2 weeks I got 2 jobs today I got hired at Sprouts #happytobeworkingagain,0
7413,Are you unemployed or underemployed? Do you know someone who is? If so you or someone you know needs this opportunity!Working from...,0
2089,Looking for a #HolidayJob? These #companies are #hiring! #seasonal #PartTimeJobs #GetHired http://t.co/qSlQN21hzd http://t.co/cWoLM9giI3,0
3700,I like my new job. Its fun and my co workers are nice!,0
5829,Im so blessed by my new job. Yall are gonna get sick of me tweeting about it all the time but sorry not sorry.,0
1561,alright every who needs to pay me back better do it now cuz I just got fired from my job,1
5380,Last week at this time I was walking home. This week Im at work.,0
4454,Anyone know where is hiring?? #NeedAJob,1
4246,Im done job searching! Have applied to many places over last year since being fired &amp; only interview I got was at Starbucks. #economysucks,1
6884,I woke up this morning and I was unemployed.,1
6179,I QUIT IM DONE ABSOLUTELY FUCKING STUPID ASS DECISION YOU ARE ALL FIRED,1
2991,So I recently started work for a pet boarding/doggie daycare and someone was REALLY fucking happy to see me this mo… https://t.co/GDPFizGxUw,0
782,Interested in working for the Swedish Consulate? Well heres your chance! Apply for their driver &amp; office/administrative assistant positions https://t.co/NfiiHhCTHo,0
1161,Today I got laid off but at least things in this ARG are really heating up. #ingame,1
6895,Last day of work was yesterday. Feels weird to be unemployed by choice.,1
7500,I am Looking for work in fixing computers or security jobs.https://t.co/fcU9W9DZYV#fintech #bitcoin https://t.co/kZnAbftxGN,0
7168,I am looking for a job in bangalore. I am unemployed from last 3 months and~ https://t.co/29i7q1jESF #pray #prayer https://t.co/YdXgnBfKJf,1
1335,Interested in a #Labor #job near #Mesquite TX? This could be a great fit: https://t.co/DDBCK5YZAS #Hiring #CareerArc,0
1589,Looking for a job? Service Technician (Wind Energy Industry) at SOS Employment Group (OK) http://t.co/Ko37HlZk #green #jobs,0
7215,Here is a good job opportunity for you we have the easiest surest and the most effective way to earn mo... http://t.co/bcBYuDP2kV cssp,0
3013,Yay my new boss is pretty cool and hes letting my employer train me! Sweet so I will be working Sundays maybe 4am to 12,0
1569,I was terminated from my job this morning in my bosss kitchen. He ate toast I had some reality.,1
