id,text,class
970,I have a class in 2 hours and then I can come back home and sleep...NOT! and I have to train for a position I got hired for ugh!,0
2019,I unknowingly started my new job today so yeah thats great,0
5271,Hmmm so this is what unemployed people do all day,1
3350,Im no longer hired she say that i been fired.,1
2710,#Job #Anchorage (M-f) Part-Time Customer Service Associate II: Anchorage Position DescriptionResponsible for p... http://t.co/k9HH2rmQnZ,0
4439,i need a job is anyone hiring??,1
5060,I recently quit my job to bring in $5641 from my phone PRESS THE LINK INSIDE BIO to do it too https://t.co/BKYKp6wuxj,1
6272,This blog post is about me getting laid off yesterday: Unemployed http://t.co/r3TkMKxp #employment #arts #nonprofits #veg #vegan,1
6054,My new position didnt have a title so my boss and my big boss just made one up. lol Ill take it.,0
3518,@KoderKev HR did say the shorter they needed me for the temp the better it would be for the permanent position but it feels like I was fired,1
6103,Amazon posted a job you might be interested in. Recruiter - Hyderabad Area India IN via LinkedIn http://t.co/BSVn8aocRs,0
5716,My job turnover rate is incredible lol Its Friday and I am officially unemployed again. Happy hour awaitssss @Nico_Ricooo @__jessicaaaaa,1
1637,Looking for an internship and dont quite know how to start? @sdsucareerserv writes about the beginning steps: https://t.co/HLLXGR7tnX,0
2002,my trainer at my new job lied about me to our boss http://t.co/GUmotcFpDh #hr #advice #manager,0
3943,Started the day off losing my job... An hour after got hired for a better one you could say its been a great day,0
3339,I was fired because Im trying to get hired somewhere else 😕,1
3130,I just repeatedly called a woman the wrong name in a meeting at work. Everyone laughed at me a lot. Unrelated I quit my job today.,1
4953,anyone know a place thats hiring??? need a second job,0
7594,Laid off? You may qualify for training programs funded by the U.S. Department of Labor. http://t.co/FSinRck1nJ,0
7623,8 Months Unemployed. Please consider me for Project Management or Quality Assurance positions.  Amenable to reloca…http://Unemployed.Please,1
2533,Looking for a part-time position for full time pay? (Tampa Bay) https://t.co/O1RXqVNc11,0
3855,This is where Im at with life right now. #unemployed http://t.co/PCMKpa10Pk,1
5,I was laid off from my last job a year ago tomorrow. It was surprising and scary. Im forever grateful to those that took the time,1
3595,unemployment office told me to go back to school so when Im done I can apply for a non-existant job in a non-growing economy,1
2272,Looking for an opportunity to work for a company that positively impacts student lives? http://t.co/KVs0e8SEBN #SeattleJobs #tempjobs,0
678,Hey so I smacked a bitch today at work cause she would shut the duck up so I had to. So today I got fired and now I am a stay at home mom while my bae is at work,1
5935,@courtneycaw33: Praying I get this job!,0
3037,Omg everyone at this new job I work at is like still in high school lol....,0
5895,Damn the 2 people who got my mom fired for no reason two months agai just got fired this month wow yall watch what you,1
4556,@Greenstoner1 yeah your boy got fired from Petsmart so now Im about to work at costco,1
1229,If youre interested in working at @jump  you might be interested in this response to one of our challenges.,0
905,Looking for a new #job opportunity? Apply for one of our many #intern positions today! https://t.co/x3AoUMU4FE https://t.co/BFHwZ6xUVI,0
5681,Instead of saying I was unemployed on my resume I just say that I was great at The Price Is Right.,1
4017,Being employed has Its ups and downs lol I just kinda wish target would have hired me,1
4016,Yea so I got hired as manager of a pizza place so prob nvr eating pizza again thats my new thing,0
2122,Searching for #work in Lexington KY? Send your #resume to Department of Veterans Affairs. http://t.co/X5aRjrbmPP #gethired,0
6747,Whats up I am fired this morning  alot of people  up this morning the neighbor cop  just got in,1
2585,Looking for a change? New Digital #Marketing Project Manager position in #Chicago: http://t.co/39pgeuqe0q http://t.co/xOLPjMIWrh,0
3810,So is Obama also unemployed today?,1
3712,Looking for a new source of money?https://t.co/Sx1int0qkwhttps://t.co/VfuuWEJoWI https://t.co/9rNxd1rZxh,0
6729,I was fired for supporting Trump. https://t.co/7I11nmKe7b,1
4841,Anyone working in retail know places hiring ???,0
7538,Looking for Temporary Employment? Temporary Solutions helps State agencies fill workforce needs http://t.co/Ezl4zh3uyK #ncgov #Work4NC,0
3298,Gave my supervisor a evaluation today also I got fired today,1
955,Job hunting with @Pshwazzy today step brothers style went well. Got hired on the spot and offered management positions. life,0
405,#Job #Nashville Manager Recovery Resolutions - Franklin TN: Franklin Position Description: Youll join a high ... http://t.co/xic9ZM35OF,0
969,I had 2 job interviews today &amp; nailed both. got the offer for both position on the spot! now I just gotta pick.,0
3772,I am now officially unemployed lol,1
1026,Interested in a #job in #California 20005? This could be a great fit: https://t.co/P1olM6R1xG #NowHiring #GetHired #Hiring,0
5490,Maybe you just got laid off from Future and are looking for freelance work? GET AT ME! Also youve got my hugs.,0
3803,*SCREECH* WHY ARE BEYONCÉ AND JAY Z GOING ON TOUR WHEN I:A- AM UNEMPLOYEDB- NEED TO BUY A NEXT GEN CONSOLE SOONC- FUCKING PAX TICKETS,1
3859,I. Hate. Being. Unemployed.,1
2037,Looking for a great career? Get Hired! https://t.co/1vxCFQSFja  #jobs #trending #jobsearch #career #job #gethired #hired #job #RT #CEO #CFO Join The eCoinNetwork. Learn all about #cryptocurency https://t.co/SV0UOOuy0T #ecoin #Bitcoin #ecoinnetwork #ethereum #tron https://t.co/o0XbEgYRZb,0
54,2. I was laid off from my BRAND NEW job Thursday. I havent fully processed that yet.,1
1195,Got laid off today almost like they knew how far behind I am on Mad Men.,1
2568,Looking to join a talented creative team and help businesses grow? Check out @WeidertGroups Copywriter position: https://t.co/779ygRf1eQ https://t.co/u3pjFL2Vmg,0
5342,Anyone know whos hiring ? I need to quit my job,0
2550,Looking for a #Claims #Adjuster Trainee - San Francisco Future Positions #jobs https://t.co/ULL1HVbfgK https://t.co/cOgl5K4ZwP,0
6600,Here is a job opportunity to work with SIM. If your interested check it out: http://t.co/Plv2WpH7yE http://t.co/jnraK6Y5PR,0
2868,My mom came home early from work Bc she feels I do nothing all day....UMM THATS WHAT I LIKE DOING...last week of unemployment,1
3670,My Mama Just Called &amp; Congratulated meh on my new job,0
3517,this chick who took the position i applie to stopped showing up so my chances are high.,0
6377,Today I got hired promoted &amp; then fired from a Briarcrest commercial...thats all. #actress,1
1167,Well today just became the worst day ever. Got laid off my job due to budget cuts. #BrokeAsAJoke,1
3764,I’ve just been avoiding social interaction for days because I really really don’t feel like showering #unemployment,1
3493,So my position was eliminated last week now I find out that the owners (nephew I think?) began working there a few days later. Hmmm.,1
1233,Interested in working in the energy field? Heres the job fair for you! RSVP now for Thursdays job fair &gt;&gt;&gt; https://t.co/8PChRwTLhG #OYP4DC https://t.co/Tu0cu2WM0U,0
7494,So I got laid off this week and kicked down a few notches by some. Oh its hard to focus on the positive some days but Im trying.,1
2291,Looking for a job? Energy Engineer/Resource Efficiency Manager 3 at Northrop Grumman (Barksdale Afb) http://t.co/5ertaYMFl4 #green #jobs,0
2343,Unemployed for three months constantly submitting applications and nothing... Now I get two job offers in the same day wtf,1
1208,Today I was laid off from my ultrasound job due to cutbacks. But its all good bc Ill be at the @jakeowen concert next Thursday!!,1
2273,Looking for a job? Superintendent II - Wind Energy Group (IRC9674)Job Details at M. A. Mortenson ... http://t.co/WhG0hzJtru #green #jobs,0
1997,I was stressing over leaving my old job but my new job treat me like I own the place. You really gotta be willing to progress,0
965,Get HIRED Today to Work for @LoveNightClubDc were HIRING for Multiple positions Txt 3013436531 for application http://t.co/bJXKRYU5iy,0
1757,Im getting laid off for the first time in 13 years..still love my union! No fault of ours we make the paycheck for the salary guys!,1
1405,Unemployed Under-Employed Unhappily Employed? Find #jobs &amp; career solutions on #LinkedIn in the Job &amp; Career... http://t.co/Gs7XVm0VAU,0
2392,Does anyone know of any place (not a restaurant or fast food joint) hiring part time? Needing semi-constant hours each week.,0
3819,I know its spring training but the #Phillies guy doing play by play hasnt bothered to learn the #RedSox names. Yet I remain unemployed.,1
4900,Well I just applied for a few jobs to day and I hope I get hired so I can get more money coming so I can afford to have a boyfriend.,1
7033,I just quit... Wheres my unemployment check,1
1097,I am seeking a Java Middle/Backend Developer for a C2C opportunity in alpharetta GA #job #J2EE #EJB http://t.co/qoHzje3gA0,0
561,Roadhouse fired me? You cant fire me,1
5943,Choose a job you love and youll never have to work a day in your life. Were hiring! https://t.co/6X0KNEL5uF https://t.co/ruUw9ga4sD,0
3307,I got fired today bcuz I didnt feel like working and I dont even care.,1
1175,I got laid off today. Im fuckedddd,1
3567,today is the first day in 2 years that I really am unemployed with no job &amp; it feel GREAT! 😂,1
4470,Anyone looking for a job wanting to drive a tow truck?!?! Get ahold of me kalebs looking to hire someone asap!,0
2877,now i am back working  i am just going pay the salon to do my hair.,0
4862,Anyone hiring that pays $10 an hour that I can work evenings??,1
4463,Anyone know of any jobs hiring????,0
6624,Interested in working with older adults after graduation? Here is a $500 scholarship opportunity! Due May 28!  http://t.co/cQzyP5jcw0,0
5044,I got fired from my job but I gets busy,1
2734,#Job #GrandRapids Hi-lo Warehouse (Grand Rapids): Warehouse Material Handler position. This is an opportunity... http://t.co/ceBCC1MUoz,0
6605,For those of you in the @NIEHS_PEPH network here is a job announcement you might be interested in. https://t.co/rdYhluIAxh,0
7142,Since I am unemployed at the momentI have to do alot of #bargain #shopping,1
7592,Searching for #work in Palestine TX? Send your #resume to City of Palestine. http://t.co/IYn4goJt9C #gethired,0
5706,Still after a year officially still unemployed. I have survived on Unemployment a stock cash out selling my stuff on ebay. More to come.,1
1696,Dang got my first check today!!! Then saw how much I paid In taxes and now I wanna quit. Rather do nothing and get paid.,0
4784,Second update on job. Im unemployed again. So the search continues. Why cant I plant my feet? Whats wrong with me? Is my mind fucked up?,1
7032,Life is so peaceful since I quit my job!! #unemployed #peaceful #stressfree #nomoreMcD,1
1697,So the break room at work hat a TV with Netflix. Means a co worker put on the office 5 min later a bitch comes up and puts on riverdale with out asking...needless to say I quit my job today,1
3834,I am now officially unemployed! Yatta!,1
1240,Here is an opportunity for each of you to get some work in the off season.  Practices are… https://t.co/uCqSXYwBpb,0
2862,Looking for job openings internships or work study positions? Check out Bearcat Central for updated information! https://t.co/agVV4QTDxI,0
4078,Starbucks hired me today and have me double shots and so much coffee and now I am powerful,0
404,I am Looking for work in fixing #computers or #security #jobs.https://t.co/qDiujyCA9J#Oakland #Bayarea Please Repost,0
1069,i HAVE BOTH INTERVIEW TOMORROW I AM NOT TRY TO BE FUNNY I AM NOT TELLING WHERE UNTIL I GET THE JOB,0
4460,Anyone know places in CLE/Akron that are hiring?!! I am having a hard time finding a job. Please let me know of any,1
4751,Looking for work?  Are you unemployed?  We are now hiring. http://t.co/uwCbHWfUuh http://t.co/5XtEXTT8e8,0
3038,So far my first week at my new store I have been sick and have lost my voice last 2 times I worked.,0
2906,I worked all winter long in the freezing temps and now that is warm outside Im. Unemployed wtf,1
1630,Looking for a skilled iOS developer who can play a leadership role in a startup. Pay &amp; equity. Please message me if you know someone.,0
2416,Whos hiring at the mall!!??,1
3573,ok Im done being unemployed I want a job,1
1545,Yesterday I got a job and today I got a call from them and I was like oh no this is where they found my Twitter and tell me I’m fired but false alarm it’s all good.,0
4787,I have been unemployed for the past 5 months. Today there is a solid chance (I hope) that I might be offered a job. Should I negotiate sala…,1
5099,I got fired earlier and as soon as the store closed I went back to ask for my job back and they immediately said yes lol,0
3158,@cressler_nico nah sadly got laid off so I been searching. Woo! How have things been for you?,1
5712,Being mostly unemployed my new job titles appear to be House Spouse and Mocha Delivery Boy.,1
968,Get HIRED Today to Work for @LoveNightClubDc were HIRING for Multiple positions Txt 3013436531 for application http://t.co/xK878Mxvip,0
3596,I keep buying cute work clothes yet I dont have a job yet embarrassing #hireme #unemployed,1
4456,Anyone know jobs that are hiring???,0
4749,Searching for #jobs as a #Christian who is #unemployed ... Read http://t.co/fzkRHJXiXB,1
3997,Not gonna lie if I get hired at this new job Im gonna miss my coworkers at McDonalds well some of them.,0
4004,#ppc Started a New Job Working for a PPC/SEM team: I was recently hired on as an assistant for a company... https://t.co/DmXdITkyjK #seo,0
2248,Its been a really long week.  Took until today for me to really break down and sob.  I am unemployed and it sucks.,1
71,hmmm to become a full time streamer since i got laid off? hmmmmmmmmmm yeah right better off with selling my body.,1
2216,Being unemployed is not good for me. I thought today was Monday.,1
2096,&gt; Looking for work? &lt;  Get hired anywhere in the US check out.. http://t.co/TgLyjet1a2 #hiring #jobs #employement #money #workflow #careers,0
3022,right when Im trying to get a new job a cute girl starts working there lmao fuck me right,1
6442,I lost my job and the only keys I had to my moms car all within 20 minutes... Hows your day going?,1
4759,Tired of being unemployed especially after searching for so long. All I need is an entry level job people! Come on!,1
259,Got hired and fired in the same day😐,1
1102,I am Looking for work in fixing computers or security jobs.https://t.co/jvptE989VG#fintech #bitcoin #rimbit #crypto,0
3317,Fired for the day unfortunately Ill be rehired tomorrow #familyfarmprobs,1
3531,This morning I interviewed for a sprayer position but there were other applicants coming after me. I want to make myself known to ki,0
6056,Been working at my new job for a month and today I got offered a shift manager position. Couldnt be more thankful for the opportunity. 👍,0
6424,I just got pull over today two tickets i got my car impounded and after i caught a cab to work i got got fired lmao #mylife,1
5191,Might be wise to explore another income stream......because eyan le get laid off any fuckn time.,0
6710,I Was Fired for Making Fun of Trump https://t.co/jjn8MH8z7M,1
6082,This week: relationship ended got great advice quit my job got a position as a teaching assistant met with dept. head about research.,0
1131,I am getting a job as a trader on Wall Street and buying a house in New Jersey. Also I have found Jesus.,0
1130,I am looking for a new job. give me ideas,0
2146,Searching for #work in Greenwood IN? Send your #resume to Innovative construction. http://t.co/IwWj2u7TNH #gethired,0
6142,RT @continimarco: Microsoft posted a job you might be interested in: Tech Solutions Prof STORSM - Greater New York City Area US.,0
781,Job opportunity: senior software engineer with experience in #PHP or #Java wanted for new development position using open source. Message me,0
6390,so uh whos hiring cause I just got fired lmao,1
6964,I got fired frm my first real job today,1
1629,Looking for a Equity Quant Job (#NewYork) http://t.co/gZgT4mCQIE #job http://t.co/olvlqHaQx8,0
4829,I learn by fucking up shit. In other news I am unemployed,1
2379,does anyone know of a place hiring?!,1
2914,And just today I got offered a full time position with a past employer today must be my day :),0
115,lost my job today which sucks but a friend hired me right away to watch her twins starting tomorrow. So tomorrow is a beach day!,1
6378,I got fired today lol man thats the second time this year,1
6094,Tesla Motors posted a job you might be interested in. General Ledger Accountant - Amsterdam Area Netherlands N... http://t.co/d8hsTmv6eI,0
6129,EF Education First posted a job you might be interested in: Business Controller - EF Corporate Solutions - Shanghai City China CN.,0
6769,Me losing my job today https://t.co/TH4NOV0QSp,1
6898,UNEMPLOYED FOR THE LAST 3 WEEKS BUT TOMORROW IT HAS TO BE GROSS WHEN I ACTUALLY HAVE TO LEAVE MY HOUSE. COOL.,1
988,Interested in a #job in #PiscatawayTownship NJ? This could be a great fit: https://t.co/cjOSDPpnXa #NowHiring #GetHired #WebDesign,0
6177,RT @AristotlesNZ: Fired? You cant fire me I quit! Seriously I quit like 6 weeks ago. Ive just been coming here for the free wifi &amp; donu…,1
7380,My job that I worked a week and quit is acting scant about that one week check lol Hire someone new dont be salty.,1
3914,#Albany #Jobs general appartment  maintenance  (local): experienced person part time with tools and transporta... http://t.co/iL1ZX2QpIv,0
7024,so first i lost my bitch as job because i was tired of being disrespected and the one time i defend myself i get fired,1
7051,Why are you unemployed? Arent you like 20? — Yeah im 19 but i quit my job like 3 weeks ago bc I... https://t.co/9ZM6nHmpjb,1
744,you might be interested in: Director of Academic Success Position at Drake University Law https://t.co/NUPFhGH7MC,0
5700,Ive Now Been Unemployed For Four Months Now. I Cant Start My New Job Until I Get My Fingerprinting Physical &amp; PPD Test Done.,1
1597,Looking for a job? Developmental Intern - Energy Efficiency (E&amp;D) at New York Power Authority (Wh... http://t.co/S0NkmkrLbt #green #jobs,0
3308,Salty i got fired today lol Ill have a job bye tomorrow tho aint tripping,1
6445,lost my job today due to budget cuts what a way to start the new year. I know I will get a new job being without one is scary.,1
2103,Looking for new challenges? On @Hired_HQ the best #rails #python #javascript companies compete for you. #railsconf http://t.co/vlLcjfTocy,0
3235,Having failed to be drafted thus far I have fired my agent.,1
5544,Does your company/school need a trainer? I am currently looking for a training position in the greater Philadelphia area. Im quite decent,1
2747,#Job #Memphis Jr. Java Developer: TN-Memphis Position Overview Provides application software development serv... http://t.co/kTK6jdehWO,0
6319,Just got contacted about a business intelligence manager position. That is a title and pay increase I could not pass up sending my resume,0
5298,My boss is playing Imogen Heap and Frou Frou. YES!! My day became 10x better! And I landed an interview for a design position!,0
1745,I have been laid off since Dec 22 and tomorrow is my first day back to work. Bye bye life,1
6121,The Honest Company posted a job you might be interested in. QA Automation Engineer - Greater Los Angeles Area U... http://t.co/hodyLuVHUG,0
2306,Looking for a challenging rewarding position with a growth-industry leader? Highwinds is hiring! http://t.co/y6b6y2qaTU #techjobs #jobs,0
2239,Unemployed since Friday. This sucks.,1
7214,Would you recommend a friend for this opportunity? Supervisor - https://t.co/nMiiiK1TmF #Retail #Houston TX #Job #Jobs #Hiring,0
3814,And.... Now Im unemployed.,1
2061,Looking for a #new and #exciting #job that #pays well? Let #Forbes walk you through the Top Ten selection. #hired http://t.co/jBmzDRUiXy,0
546,I Was Fired for Making Fun of Trump https://t.co/dPvM6tltSPI can only hope that I have enough character and backbone to be fired one day for making fun of our perpetually mediocre or worse political leaders. In this life stand for something or be blown over in the wind.,1
1450,Unemployed? No job? Looking for employment?  Now hiring! http://t.co/uwCbHWfUuh http://t.co/yy9ubUoHY3,0
6405,Bad day at work today I got fired but  its cool. Im just mad a midget fired me tho lol,1
2159,Searching for #work in Ames IA? Send your #resume to Wilson Toyota Scion. http://t.co/EDTBzwrFuA #gethired,0
2801,Went applying today got hired on the spot. Worked a 12 hours shift now Im tired af,0
5731,Well I just worked my last shift at Gate. So now Im unemployed and soon to be broke.,1
5028,So I decided to delete my Twitter in a couple days so I dont get fired when I start working at this new job for something I put up,0
4507,@rsalcido92: Its about time I say that..... I got fired today :((((  fuck Target!! Haha,1
4662,Today I quit my job while at a concert so...,1
3225,btw being laid off isnt that bad wasnt happy there I got 2 weeks severance AND unemployment.  Itll be ok,1
410,#Job #Northbrook Assistant Superintendent: Golf About the Job Jobing Description Position: Assistant Superinte... http://t.co/b8FyF6NYUy,0
7112,Today marks my 12 year anniversary of being unemployed. Getting fired at my last job was one of the best things... http://t.co/BlcrPZ2YNi,1
4060,Got hired today and my boss told me I could close the store early today. Omg YAS! #staywinning,0
1083,(IN) I quit my advertising job because i lacked the passion for it. I am searching for a job that i am passionate about but im running out…,1
3594,I dont like that stay at home moms have to be called unemployed. I DO have a job and Im a very busy person!,1
3788,Im losing my mind. I miss waking up early and doing shit. #unemployed,1
1145,I got laid off from work yesterday need a job asap near Indianapolis IN can start tomorrow need help #jobless #helpneeded,1
1356,Interested in a #job in #Mesquite TX? This could be a great fit: https://t.co/OfubySvBJE #jobsearch #Nursing #Hiring,0
6899,Fired... I guess me and a job werent meant to be 😂 #unemployed,1
2335,I went from being unemployed to now having 2 jobs in a months time! Im a living witness that with God ALL things are possible!,0
254,I GOT HIRED MOFUCKA!,0
3831,Facebook needs to stop asking me who my current employer is and rubbing my unemployment in my face,1
6750,Moms just finding out 2weeks later I got fired lol,1
1640,last resort is to give up searching quit my current pt job and go work ft thru the temp agency....,0
2295,Looking for a job? Integrated Construction Coordinator II - Renewable Energy Group (IRC10233)Job ... http://t.co/G0n6uoPeaw #green #jobs,0
295,Got hired right after I interviewed,0
6040,Just started this new position last week but I may be putting in my 2 weeks notice,0
4440,Well shit i needa find a new job anyone know any hiring???,0
4715,anytime I hear the words I cant I have work I take it as an attack TBH like I GET IT!!!!! I AM STILL UNEMPLOYED BY CHOICE LEAVE ME OLONE,1
6589,Looking for work for the summer . Anyone know where they are hiring??,1
1252,This #job might be a great fit for you: LPN/RN Interested in working 12 hour night shifts!! - https://t.co/iJpqtXbN61 #Raleigh NC #Hiring,0
1841,I am attempting to find a job that allows piercings yes its shooting high. But does anyone have any ideas?,1
6749,Today I was fired for being a considerate person. Thats cool.,1
3102,I called my hoe n said I quit my job today,1
6365,i got fired today... hooray me,1
4863,Whos hiring?! Cant keep working at these Hyundai suppliers! Cant work in these STEEL TOE shoes!! #Diabetic,0
7163,I am unemployed and desperately need a job Please pray so that i may be de~ https://t.co/xnnLQy9GmU #pray #prayer https://t.co/Gxai3wOsFT,1
5720,Unemployed until the new place is finished. Cant wait to start my new job.,1
5259,Im at party in LA and ppl are asking me what I do Im unemployed loser baby but Im saying cartoonist hehehehhoohohohhaha :o),1
255,Got hired today by just luck. Rewarding my week of sobriety by celebrating being employed again. http://t.co/Qlm6pfvEDV,0
6302,#Job #Philadelphia Software Engineer: Cherry Hill I am currently working on a Software Engineer position with ... http://t.co/hGU2Ka5YSZ,0
4989,I got fired from Rite Aid today....,1
1042,I am resigning from cell tower work and would like to book some audio recording/hired gun drumming. Please let me... http://t.co/X1FH7ZVwKZ,0
3219,Got laid off and paid today. W.e. Im in the union I start working in the next 2 days.,1
7094,Wyoming car salesman drew penis on his business card gave it to woman. Fired. Can’t draw unemployment,1
5256,I am now officially unemployed and Im going to go home and cry,1
5229,Now that Im unemployed by NFL I need to know is bum fights still a thing and whats the payout Last time it was creepy oral sex Ina dumpster,1
2104,Looking for a new way to hire or BE hired? check out http://t.co/UU5ax8MLHb to create an @myzumay . Fire your #resume ! #jobsearch #jobs,0
6034,First day at work at my new position went pretty smooth. A lot to take in tho.,0
1985,I recently started my first #law job. I am feeling overwhelmed. Any advice? https://t.co/RNsmj6AEyB,0
5493,Laid off from Golder Associates or URS? Find your place with Group Delta! http://t.co/A8x08Zv59d,0
1451,Are you a first-time job seeker currently unemployed or looking to change career paths? We can help &gt;&gt; https://t.co/5MJQvfrsIy,0
