id,text,class
26,officially starting may 11 at my new job wooooooo. i got laid off early feb and this new job seems like a step up in a lot of ways.,0
6854,Wow Im so sick of everyone asking where Im working now. Ive been unemployed for less than three weeks. Im still on vacation bitch.,1
1213,Yesterday I was laid off. Today I played with my kiddo talked with a TON of people am sprucing up my resume coffee meeting at 2. #islay,1
1424,Unemployed Under-Employed Unhappily Employed? Find #jobs &amp; career solutions on #LinkedIn in the Job Seeker &amp;... http://t.co/y843fQJ3yx,0
1698,I quit my job yesterday &amp; got a raise today :),1
1145,I got laid off from work yesterday need a job asap near Indianapolis IN can start tomorrow need help #jobless #helpneeded,1
2601,Job fired you? Or laid you off?Looking for a job and no one will hire you?Hire yourself  this has worked for... http://t.co/fR0Wx7N4vJ,0
7046,I quit my job!Quit my job! I am done with legal seafoods and I could not be happier to be unemployed at the moment! http://t.co/9o1dG1D7kf,1
1949,Recently lost my job and Im doing what I can to stay positive and plan the next few months. I feel theyre crucial.,1
5269,The great thing about being unemployed is that now I can go to gallery openings!!!,0
6279,Laid off yesterday morning and got a temporary gig today? Still looking for a permanent position but its better than nothing.,1
5089,Well I was fired from my job today (officially seeing how it is I have been suspended since last Wednesday).  Life goes on.,1
1174,In other news I got laid off today. #ayyyyyye,1
3351,Star Wars hired me as a celebrity endorser of their new products. I was immediately fired http://t.co/9MvRJ9n1Up,1
1191,I feel #determined today idk why. I am ready to get things done. I am so over this laid off shit!!,0
5643,Just got laid off... am I too late for recruiting? http://t.co/2585gBm2qc,1
7494,So I got laid off this week and kicked down a few notches by some. Oh its hard to focus on the positive some days but Im trying.,1
7676,RT @clarissa: Im a UX designer/developer/strategist looking for a new position preferably to work remotely. Anyone hiring?,0
3412,Left?  Or were fired? https://t.co/WUOjtV1IE8,0
6362,I got fired today for getting caught having sex in the bathroom with a fine young woman...,1
5433,@markschlereth Just got laid off any tips for staying busy while looking for a new job? #QuestionMark,1
1978,So I recently quit my job and I gotta look for another one tomorrow. I can do it!!,1
4970,Is there anyone hiring anywhere in Jacksonville?!?! #INEEDAJOB,0
2477,Interested in a #job in #Halls TN? This could be a great fit: https://t.co/F1ITTEHUed #NowHiring #GetHired #Manufacturing #Hiring,0
6175,How I should have quit earlier this week http://t.co/4Lb6GshHLk,1
2624,O/H: you cant get fired for looking for a new job #HR #recruiting #jobsearch #jobseeker,0
110,I got hired on at 8.50,0
2228,Today marks a week that I have been unemployed.  I will admit that it is very scary.  I have applied at... http://t.co/Odp4ei4bwd,1
1231,Hi Moms - heres a work from home opportunity I think some of you may be interested in! Hulafrog is looking to... https://t.co/Q6LcMQmmtn,0
1189,So the company I do freelance for stopped production and I got basically laid off this week but Im going to start working fulltime at regular job and just asked for a big raise today so ¯\_(ツ)_/¯ well see,1
2356,Is anywhere hiring?? Someone please tell me of somewhere,0
3964,oh right my boss emailed me today ASKING IF I WANT TO GET REHIRED FUCK YEAH I DO,0
1587,Looking for a job on campus? Student career fair today in the Ohio Union from 11am-3pm for both work study and regular wage positions.,0
5741,I havent been unemployed for 4 years its going to feel weird starting a new job,1
1739,Day 8 of being unemployed: From laid off to unemployed http://t.co/ho30xFHS #jobsearch #blog #unemployed #jobs #nonprofit,1
806,Currently applying for a controller position in N. Alabama for giggles. I meet all the qualifications &amp; it meets my salary requirements!,0
2842,Looking for part time work or a work from home business or a job in Berkeley?: http://t.co/BfA6s0Tsk0 via @YouTube,0
7155,So I am not unemployed anymore (: 💰,0
4863,Whos hiring?! Cant keep working at these Hyundai suppliers! Cant work in these STEEL TOE shoes!! #Diabetic,0
2039,Looking for a #job? 2890 small #employers in #Pittsburgh in accommodation and food service http://t.co/ocbSIfiljk #gethired #jobs,0
6158,So mater called me after practice and told me I was fired because I didnt get all 7 pens back. Jokes on her that was my sign of quitting,1
5232,Since i am unemployed now i am becoming the family taxi and errand runner :(,1
1148,Got laid off yesterday. Non stop job hunting today. -_-,1
763,Heres a good one JOB SEEKERS! THIS POSITION IS LOCAL TO NASHVILLE AREA! If interested please forward your... http://t.co/zQqwUpRRGf,0
3230,Looking for a job. I was fired two weeks ago .,1
932,Got hired to be a music reviewer again next semester but idk if I should take the position or not? Hmm.. decisions decisions.,0
3223,Wow I just realized I got laid off and hired in one month. Laid off April 7th hired May 7th. Really got a job in one month.,1
92,liz &amp; i got hired at 2 diff places today &amp; were like ok let me use ur discount &amp; u can use mine ok ?,0
3084,so basically I put my notice in to quit today so uh yeah,1
5063,I quit my job earlier this week... What should I do now,1
2838,Looking To Work From Home? #workfromhome #entrepreneur #successhttps://t.co/U9Z2qqiyB6 #WorkFromHome #Success #Entrepreneur https://t.co/OStZ4IGFRO,0
1165,Got laid off today fml,1
3188,Well my life has changed again. I was laid off from my position yesterday due to sales has decreased drastically... http://t.co/NtesFPKvky,1
7656,I was fired from my job I was laid off but you wouldnt know the difference!!,1
4620,I quit my job whos hiring?,1
6389,I real life just got fired today is anyone’s job hiring /.\,1
1064,I am currently looking for paid Sales Interns.  Send your resume to scott.m.herlin@sherwin.com #jobs #jobhunt #resume #intership,0
3226,I got laid off of my job today..... Perfect :/,1
2120,Searching for #work in Lynn MA? Send your #resume to IBERIA Foods Co. of New England Inc.. http://t.co/CPOO3KWX7C #gethired,0
2905,Be unemployed is not fun but being able to spend more time in Chelsea working to collaborate &amp; get things done has been fulfilling,0
3994,Recently quit my job wanted to be more creative so I just got hired at a Makeup company while I can peruse my passions. #YOLO,0
7078,Listening to my daughter describe what she thinks my unemployed day is like is actually quite depressing.,0
6898,UNEMPLOYED FOR THE LAST 3 WEEKS BUT TOMORROW IT HAS TO BE GROSS WHEN I ACTUALLY HAVE TO LEAVE MY HOUSE. COOL.,1
4860,Anyone working in a bar/pub that is hiring?,0
4818,You ever tweet so solid you put it on your resume? HAHAHAHA Im unemployed,0
43,Ill check this out within the coming days because Ive been terminated laid off and or locked out from my previous job. Thank you benefits,1
3324,i am the only one who can be fired and rehired within 1 hour,1
2345,I’ve only been unemployed for 10 days and I was blessed with a job when I wasn’t even looking and I start tomorrow. A bitch just want 2 sleep!!,1
7028,Ah yes another very productive day of doing nothing. Unemployment is going quite well thank you,0
6982,So the man over my manager at Papa Johns let me and two others go today -_- not as in fired tho but he fucking with my money,1
6372,Basically got fired today. But hey I still have my health,1
3685,Oh hey I updated my profile to reflect the move and the new job.,0
4674,Its now 4:23 am gotta get up soon for work. HaHa Lol   Im unemployed.    Oh how I love Bed sores.,0
5630,I was laid off on Friday.  I am still in shock! Pray for me. If you are looking to hire please let me know @RosieRivera_JRR I live in Reseda,1
927,Got hired  t best buy mobile last week &amp; today I have an interview with FedEx for a customer service rep position! #needthat#,0
5646,22 years old and have already been laid off. Regency Beauty Institute has closed down and I have no job. If anyone has any leads let me know,1
503,My boss saw me tweeting on the job. I got fired.,1
6410,Well I basically got fired today from my job soo thats cool,1
3907,#Adjunct #Instructor - Communications needed in #Richmond at Bryant &amp; Stratton College. Apply now! #jobs https://t.co/AVNYYaqH6Z,0
4998,I literally got fired 1 week and a day ago and is now about to start a new job next week. Cant stop my flow #NewDay,1
7473,So excited to start working. This is the first time Ive been hired. Yeah worked side jobs dish washer at a bar coffee grinder at a cafe,0
2170,Searching for #work in Santa Fe NM? Send your #resume to New Mexico State Personnel Office. http://t.co/4krwNDdDYo #gethired,0
2727,#Job #FortWorth (USA-TX-FORT WORTH) Shift Supervisor (US): Job Summary and MissionThis position contributes... https://t.co/TpYKaIaQJf,0
554,I just got FIRED ! well not fired like that but yeah I got dismissed,1
4589,crazy how I quit my job yesterday &amp; got called back for 3 jobs this morning,1
1697,So the break room at work hat a TV with Netflix. Means a co worker put on the office 5 min later a bitch comes up and puts on riverdale with out asking...needless to say I quit my job today,1
5172,Im sorry to hear about those that got laid off at @ibtimes. BUT if youre interested in real estate lets talk. Could be your lucky day.,0
2113,Searching for #work in Auburn MA? Send your #resume to Sears Holdings Corp.. http://t.co/WDUy24xjXX #gethired,0
5587,Im trying to quit mine bt I need to find another one first..,0
1435,Unemployed Under-Employed Unhappily Employed? Find #jobs &amp; career solutions on #LinkedIn in the Job Seeker &amp;... http://t.co/hxsHnwtNrl,0
2882,Division of unemployment can kiss my ass is this 2week break over yet ?? Cause Im ready go back work !!!!,1
2404,Anyone hiring foodmonsters in NY? plz hire me full time I swear Ill try my hardest to leave you a pizza slice...,0
3391,Anyone fired/ laid off and they want 2 get back in control of their finances? go to http://t.co/kWPW8XgPrj &amp; then DM me W/ contact info!,0
5212,Hell yeah Im unemployed baby daddy down my back,0
6378,I got fired today lol man thats the second time this year,1
4641,I just got hired at TGIF at the Rim and I already wanna quit and get a job at BJs at the Rim lmao,0
2161,Looking for a #NewJob? #CareerCast has all your #Job and #Career needs at your fingertips. https://t.co/IgteR0FQRs #CareerAdvice #GetHired,0
1779,So who wants to buy a GoPro package at a reduced price!? Unfortunately I got laid off my job and need to sell a GoPro....,1
2139,Searching for #work in Fordyce AR? Send your #resume to Arkansas Department of Human Services. http://t.co/lson5LnyAj #gethired,0
2747,#Job #Memphis Jr. Java Developer: TN-Memphis Position Overview Provides application software development serv... http://t.co/kTK6jdehWO,0
6152,UPDATE: Apparently I was not fired I was just asked to leave for the day so I just decided to quit with this dope letter of resignation https://t.co/K6UMuq0vJz,1
683,Well unemployed again just got fired for not knowing how to use a tape measure. Hello I am freaking dog. https://t.co/H10B3fj3Q5,1
3354,I Got Fired  &amp; Rehired lol,1
4496,Microsoft posted a job you might be interested in. Sr. SW Engineer for Windows System - Beijing City China CN via LinkedIn.,0
2939,I had the shortest job ever. Got hired on Friday &amp; boss told me he changed his mind about offering the position when I came in 1st day. :O,1
1723,Photo: Today I was laid off #layoff #unemployed :-( I am very sad but optimistic anyway…. One door slaps me... http://t.co/RMgG27F6vd,1
78,I got laid off 3 days ago and I still havent received my final paycheck. You better believe Im about to get paid for those 3 days!,1
2813,Who is hiring? Im down to work my 40 hrs/overtime/can lift 50+ lbs weights.,0
5201,Unemployed Under-Employed Unhappily Employed? Find #jobs &amp; career solutions on #LinkedIn in the Job &amp; Career... http://t.co/vhJxithv7a,0
1169,I Got laid off today 🖕🏻 https://t.co/kevVjENAby @gifboomapp #gifboom,1
6716,My mom fired me from helping her for being too neat ??,0
5413,Long Island town fired me for complaining about racist coworkers https://t.co/YeGWAbEAlO https://t.co/vryxjzgDUv,0
2186,Last Saturday was my last day of work at Sukis. Being unemployed feels strange..lol,1
2236,Have you seen my mid-week video? I decided to vlog whilst unemployed! http://t.co/MAppy5oxiT #lbloggers #crazybloggers #bdib,0
5655,As of 4pm today I am officially laid off. #unsurehowtofeel,1
6519,My job just offered a forklifting position....Man God is Great!!!! #blessings,0
6420,my mom said I was gon get fired yesterday and I did today,1
7012,Yesterday I got fired for helping my disabled mother run errands. I had already put in my notice but thats not the point. Capitalism sucks,1
2995,My new boss is the nicest guy. Actually looking forward to start working,0
7591,Searching for #work in Danville IN? Send your #resume to CONTRACT http://t.co/D19TqrYSxU. http://t.co/N8VW9nZm3R #gethired,0
7495,I am job searching for: Work at home jobs! http://t.co/4tgcXWg6JK — Walker Inklebarger (@Walker_marocliv.... http://t.co/drC4Y9lvOW,0
7598,Fired? Laid off? This is just what the #freemarket ordered: http://t.co/OLHpZ2B7mx RSVP for May 31 #houstontx #txcot #income,0
3103,In other news I quit my job today,1
3567,today is the first day in 2 years that I really am unemployed with no job &amp; it feel GREAT! 😂,1
2230,Two weeks officially #unemployed and Ive recon firmed that being a #SAHM is not my thing. Best enjoy it whilst I can!,1
1211,got laid off today #LoL #WTF DRINK A #Beer for #Dinner,1
2347,anyones job hiring?? seriously done w crappy Main Event,0
6248,I officially get laid off from Wells Fargo on the 10th. I thought theyd keep me around but I guess I was mistaken.,1
5621,I only worked 2 months &amp; already getting laid off,1
4999,I was recently fired from my job seeking unemployment and better work,1
5272,I Cant stand being unemployed,0
2241,A month ago I was unemployed and now next week I have work every day,1
784,Tulsa OK #job seekers may be interested in this position!https://t.co/JkctzEf1Qe,0
5306,Anyone who wants to make money email me your résumé! Keithn1990@yahoo.com I am hiring for part time sales position start asap!,0
3325,Got fired for two hours then rehired. Wtff #NOBITCH I need to start looking for a new job,1
1395,Need to Make a Career Move?  Need a New Job?  Unemployed? @leezabyers Can Help: http://t.co/IsOfPodCss,0
3453,Who gets fired for not answering their employers calls on their APPROVED requested days off!? #ThisGirl #Lame #ImMad,1
4441,Who knows of any jobs hiring ? Morning afternoon night shift whatever,0
813,#nopressure RT @TomSullBoston: I just quit my job for #TheBachelor Ben.,0
3511,So to elaborate on an earlier tweet I am interviewing for a possible co-manager position tomorrow. I will know more by the end of the week.,0
1117,I am looking for #JavaScript devs for a position in Austin. Angular bootstrap. Grunt and bower. #javascriptjobs,0
2324,The reason why I am #homeless after losing my job is that after taxes rent and medical bills I could not afford rent or a car anymore,0
1855,I am looking for GUEST BLOGGERS REALTORS and SMALL BUSINESS OWNERS.  Are you one of these?,0
7271,I have been officially laid off from my one steady PT day job gig (not my fault). Hopefully this end will become an awesome beginning soon.,1
361,I am job searching for: Work at home jobs! http://t.co/4tgcXWg6JK — Walker Inklebarger (@Walker_marocliv)... http://t.co/yN2e891rUT,0
384,I am looking for some extra help. I am adding an auto repair technician to my workforce. Email me twonutsmessage@gmail.com,0
6449,I quit my job today &amp; i could care less ... Life goes on &amp; McDonalds was never intended to be a career for me anyways !,1
4752,If anyone knows anywhere thats hiring please let me know. I dont want to be an unemployed person that sits around and collects a check,0
6640,If you are a journalist joining Times of India might be your best bet. Never publish anything remotely close to editorial never get fired.,0
41,Bad news: laid off from my recreation position. Good news: I was offered another job at the same building. Less hours but its a job.,1
1113,I am job searching for: Work at home jobs! http://t.co/4tgcXWg6JK — Walker Inklebarger (@Walker_marocliv... http://t.co/SQmarqg5CO,0
4221,My boss fired me Friday and is now refusing to pay me for the hours w: I work in a private home doing care for... http://t.co/8UjRkVTu0J,1
1456,Need to Make a Career Move?  Need a New Job?  Unemployed? @leezabyers Can Help: http://t.co/RYnfp9miQk,0
5187,@AlphaTwat Where do you apply for that? I got laid off yesterday.,1
1142,Got laid off today....got a lot of time on my hands I guess. #layoff,1
3157,Urgent - if you know of a marketing/communications job opening please let me know. Ive been laid off. Thank you.,1
3284,I dont want to find a new job but I honestly feel like I have no choice. Either I quit or get fired.,0
3221,I GOT LAID OFF YESTERDAY AND GOT TO JOBS TODAY 😊☺😊😊😆😆,1
128,So I got fired today and then rehired.. Fuck you Im fired. Im out,1
2825,I finally got hire at walmart I been working at walgreens for like 3 and a half months. Tomorrow my last day at walgreens,0
2051,Looking to make a career change? http://t.co/rA54iIaZKx  #linkedin #monster #hotjobs #gethired #careerbuilder #jobs #hiring #management,0
3175,Oh hai I got laid off/downsized/let go for economic reasons. Cant wait to file for unemployment. I needed a vacation.,1
7213,Here is a way you can make over $350/day online https://t.co/mNIcAp4grG https://t.co/SodZqI11QJ,0
3741,Looking for a tech job where you work w/ smart people &amp; can have an impact?http://t.co/cxanNgUQ6O #dotnet @InnovateMS http://t.co/bLvn14Q27U,0
910,Got offered a full time position at work which I took! Got a car yesterday &amp; if someone moves out before the 17th I will have my own place!,0
5989,@AnnalynKurtz @CNN I got hired for my 3rd job at Chick fil a! #Igotajob #gonnabebusynextsemster,0
38,Suuurrrrrree I couldnt get laid off 3 weeks ago BEFORE I bought my new car. #unemployed #hireme #job #FML,1
1355,Interested in a #Retail #job near #Mesquite TX? This could be a great fit: http://t.co/C490xwjT7i #Hiring #CareerArc,0
2340,I had so much fun being unemployed for 3 days after quitting my job but now I have to go back to work fuck my life lmao,1
4633,Yup I quit today,1
7649,not working is cool bc I get to work out so maybe I can find a sugar daddy instead when I have a new bod in 2 weeks.,0
4060,Got hired today and my boss told me I could close the store early today. Omg YAS! #staywinning,0
5647,Unfortunely I was laid off today I am actively looking for other employment However an... http://t.co/RcgHPnyYL8,1
3484,I got fired from my GM position 😔😔 https://t.co/eUem1QNWPa,1
3596,I keep buying cute work clothes yet I dont have a job yet embarrassing #hireme #unemployed,0
7223,Heres a great opportunity for any veterans interested in pursuing careers in entrepreneurship.... http://t.co/UqLKpFNjKB,0
6254,Got laid off last week and now this. Needless to say Im not in a good mood.,1
4841,Anyone working in retail know places hiring ???,0
6703,i had a panic attack that resulted in me throwing up on and off so i called into work and now i’m firedhow’s your day going ??,1
6363,Lol I got fired from my minimum wage job today and got hired for an above wage job the same day. #merica,1
4930,Now Im not gonna get hired.,0
539,So last week I was forced to leave work early due a situation with my diabetes. I was fired. Are you fucking serious? Cant I sue you now?,1
7066,Quit my job thinking i had the other in the bag. Long story short.....i had to go on unemployment last week. Good news is i found another job so there you go,1
49,Well got laid off from the job and love Madpack so lets give this streaming thing a try. http://t.co/1OyR5N2sou. Stream starting!!!,1
4494,Microsoft posted a job you might be interested in. Sr Solution Spec SURFC ADR - SMSG - Beijing - Beijing City China CN via LinkedIn.,0
4963,does anyone know anywhere hiring?? Im bout to quit my job,0
258,Where at in beachwood? I just got hired out there too. @LoveMee_Lyn,0
2213,Lord. As of 30 minutes ago Im officially unemployed and I couldnt feel better about everything.,1
5028,So I decided to delete my Twitter in a couple days so I dont get fired when I start working at this new job for something I put up,0
6455,SubhanAllah i lost my job but yesterday my bros wanted to go out so i said ok Allah will give back This morning I find money on my account,1
6871,Looks like Im unemployed again lets see if I can beat my record of starting a new job in 4 days.,1
6358,I Got hired and cause of that shut down shit now I got fired before I started and I was gonna start tomorrow  Lol smh Im mad,1
5625,Im still here yall I got laid off so my schedule is off they took my work phone so need to get a new phone for now on my iPad,1
2553,Looking for a position that offers plenty of perks &amp; opportunities for career growth? USAA is hiring an Auto... https://t.co/cHkwQRc8Mk,0
1964,I recently started a job in child dependency I posted this a while ago about the two jobs that led me to it. #blog https://t.co/CrfDajGev7,0
3296,I got fired today then hired seconds later HA!! #MyLife,1
6419,I got so fired today guys,1
4478,Does anyone know any place that is hiring?!? I have the worst luck with jobs.,0
3209,I could totally use money from the @MoneyMonster #MoneyMonsterPays #Sweeps I was laid off in January &amp; havent found a new job yet.,0
3228,Got laid off from my job today.... #universityofiowa #pissedoff,1
5688,And now Im unemployed! #winning,1
6277,Looking for a #Oil #Field Drivers Just Get Laid Off??? CDL-A DRY VAN OTR DRIVERS NEEDED NOW #jobs https://t.co/jNoGJptp1s,0
6979,My boss at work fired me today then told me not to take it personally.  I said I know I wont.  Then 30 min. later I burned his house down,1
5340,Anybody hiring in Mesquite? I need a second job...,0
5838,My new job orientation features a literal spitting image of @Eyehatelucas in female form.,0
3648,Wow what a change working full time but I love my new job and man am I getting into shape walking and climbing stairs all day..LOL,0
3297,Got fired on Wednesday got my job back yesterday and I work today haYesterday was my day off too so its like I was never fired at allMy manager hates me even more now I know it aha,1
3610,When unemployed ppl tell someone how to fill out job apps... lol ok,0
3977,Im no longer hired he said that I been fired,1
1171,Got laid off today... bittersweet... not! Now I cam focus all my efforts on Real Estate! Lemme know how I can help you!,1
3866,Wanted Clerk IV/ Communications Coordinator Computer Science Amherst Massachusetts US Permanent #amherstjobs https://t.co/5vcsNgWMft,0
7243,Was laid off this past Friday. If anyone knows of any job openings please let me know :) #Thankyou,1
6082,This week: relationship ended got great advice quit my job got a position as a teaching assistant met with dept. head about research.,1
7133,.  @PlusGlamDiva I was hoping 2 get unemployment but this guy told me they had never fired anyone in 60 years and  I was like I gotta go,1
2089,Looking for a #HolidayJob? These #companies are #hiring! #seasonal #PartTimeJobs #GetHired http://t.co/qSlQN21hzd http://t.co/cWoLM9giI3,0
1311,If you are thinking of #quitting here are 5 #nursing jobs at home you can try. https://t.co/DAFHLwiOSM #athomenurse https://t.co/PVhr7iwjSP,0
2377,Does anyone know of any places in Mesa/Gilbert that are hiring right now??? PLZ help a girl out. I need that cash money flow,0
2686,#Bloomington #Job ASM Service &amp; Operations - Mall of America #135: MN-Bloomington Job Description : Position... https://t.co/J5hgGBr9Rs,0
6374,I get hired on the first fired on the second,1
7478,So I got laid off this week. Company I worked for is going under it seams. I hate change  but change is probably the best thing right now.,1
2124,Searching for #work in Huntington NY? Send your #resume to Executive Parking Service Inc.. http://t.co/gFoCZF2iGI #gethired,0
350,I am job searching for: Work at home jobs! http://t.co/4tgcXWg6JK — Walker Inklebarger (@Walker_marocliv.... http://t.co/eXIeEZM9cC,0
7433,Im searching for someone who has Java Hybris experience.  Position will be based in Richardson. https://t.co/orTsufdQHR,0
5674,I went from being unemployed to having 4 jobs in two days...my body wasnt,0
4648,I quit my job yesterday nigga had me so fucked up trying to play me,1
3891,#Accenture #Technology Analyst (15/16)+ needed in #Boston at Accenture. Apply now! #jobs http://t.co/MzLLmt0PJY http://t.co/zl5pEKTAMe,0
2028,A girl we hired three weeks ago married my client for his money which is a million dollars and fired me,1
1498,Lost my job cause I was lock up on the day I was to work wow.....still getting money tho ha idc bout to party this weekend and the next,1
1641,This job search is wearing me out. Im about ready to give up but to do that apparently I need 3+ years of quitting experience.,0
2038,Looking for a great career? Get Hired! https://t.co/1vxCFQSFja  #jobs #trending #jobsearch #career #job #gethired #hired #job #RT #CEO #CFO Join The eCoinNetwork. Learn all about #cryptocurency https://t.co/SV0UOOuy0T #ecoin #Bitcoin #ecoinnetwork #ethereum #tron https://t.co/6yDS133WHI,0
7148,Currently unemployed spending money I shouldnt.,1
64,Crazy how I got laid off just last week &amp; got a new job already,1
362,I am Looking for work in fixing #computers or #security #jobs.https://t.co/pI6e6gT3Y5 #resumes #careers https://t.co/ZqDXrZgyGO,0
6251,i got laid off this morning and now Im watching SNL for the third time. https://t.co/NkNYlILDyY,1
