id,text,class
2832,Looking for a #career worth having? #JCPenney is seeking sensational #talent for part time and... https://t.co/O8YKDi9rZp #IWork4JCP https://t.co/LhKcNp3UMn,1
6129,EF Education First posted a job you might be interested in: Business Controller - EF Corporate Solutions - Shanghai City China CN.,1
1216,Heres an opportunity to work for a family owned company doing great things in the marketplace. https://t.co/98X1pfuwUG,1
4844,Anyone work at a show place thats hiring and pays more than $8.25??? #NeedThat,0
7384,My employment has been rocky this year. I quit my job today after my supervisor threw her badge at me.  I needed her credentials for my refund request for a customer. New job stars next week Nebraska this weekend to see family!! Short vacation!!,0
2694,#CareerArc #internship #Job alert: Marketing/Sales Internship Position | Move. | #Savannah GA http://t.co/PWk8mAXtT8 #Jobs #Hiring,1
4949,Anyone out there in need of a job?? Ledo Pizza is looking for servers bussers and kitchen workers! #PublicServiceAnnouncement,1
6077,I got another job offer yesterday. Its another admin position and the coordinator was really excited when she was telling me about it,1
1367,Interested in a #job in #Mesquite TX? This could be a great fit: https://t.co/272Su5OcSF #Finance #Hiring #CareerArc,1
2026,Im getting fired because the people you hired 6 months after me want to work full time? Ive been asking for 9 months go fuck yourself.,0
1443,Need to Make a Career Move?  Need a New Job?  Unemployed? @leezabyers Can Help: http://t.co/TM8D0jFSEs,1
5715,On my way to my first day at my new job after being unemployed for what felt like forever. Im tired as hell but Im stoked.,0
3151,Im #laid off and #looking for new #job opportunities in the #Chicago area.  Microbiology Molecular Biology scientist.  #recruiter  DM me.,0
6785,Lost my girlfriend and job in less than 24 hrs best day ever :),0
379,I am looking for FOUR new It Works #business partners who are ready to become business #owners… https://t.co/PuBfmec07p,1
3734,Looking for an accounting internship?  Apply on Colonial Trak for the McConway &amp; Torley LLC Accouting Internship Position.  Job ID 44616https://t.co/HOBoCgn9kW https://t.co/eiRzlUzs6u,1
3728,Looking for a #Full #Time Assistant 3rd Shift Grocery Manager Trainee - Central Avenue #jobs http://t.co/yeDq4MSKHg http://t.co/1tkXESwv0t,1
388,I am seeking a female (preferably a WOC) website/graphic designer to work with for my business need quotes to incorporate into fundraising.,1
5536,I am in search of a plow person... I live down a long dirt driveway in South Berwick My plowman has quit plowing... http://t.co/Asc0oiyK16,1
2523,Looking for a new career in the tech industry? LightEdge has several open positions in both Des Moines &amp; KC! http://t.co/5LXVR8GD34,1
4691,Being unemployed is cool. I guess its time I put my ass to work and pick a corner now. R.I.p. whichway pizza.:(,0
4961,I need a second job like right now! Anyone hiring????,0
2298,Looking for new job or contemplating a career change? #DYK that new positions are posted to our Work In Optics job center every week? Check it out today: https://t.co/HAMh0SaSVo #NewJob #CareerChange https://t.co/sVuHTeFo4W,1
3979,MY JOB HIRED ME BACK!!! Im hype af!!!,0
2583,Looking to make an impact and join an amazing team? Check out our open positions! https://t.co/zzC82UDWkj https://t.co/fBfzKNwIhi,1
7366,I quit my old job over a month ago and I STILL get weekly schedules and emails ????,0
6640,If you are a journalist joining Times of India might be your best bet. Never publish anything remotely close to editorial never get fired.,1
5236,My mom is the busiest retired person I know and I am the busiest unemployed person I know :-) Together we are M&amp;M.,0
999,Interested in a #job in #Pottsville PA? This could be a great fit: https://t.co/B0WL4PKqQR #NowHiring #GetHired #Manufacturing #Hiring,1
6936,Looking for a job in #Mesquite #TX? Medical Customer Service https://t.co/XuJpy5xBRi #jobs #hiring,1
2132,Searching for #work in Omaha NE? Send your #resume to Heartland Automotive Services. http://t.co/eQJyD9yNVV #gethired,1
2097,Looking for new challenges? On @Hired_HQ the best #rails #python #javascript companies compete for you. http://t.co/X0oGVy8IZR,1
7,So I was laid off today (1 of 3 employees)..... But this right here makes me forget how much this… http://t.co/BbUMa7rB5L,0
1058,Currently laying on my floor in fetal position chanting I need a new job. I need a new job,0
1611,Looking for a career that offers job flexibility or a fat paycheck? Here are 10 that offer both: http://t.co/jzHClB9htM,1
7188,Yahoo! posted a job you might be interested in. Community Manager - Entertainment and Travel - Jordan JO via L... http://t.co/XnGzR8K17J,1
1405,Unemployed Under-Employed Unhappily Employed? Find #jobs &amp; career solutions on #LinkedIn in the Job &amp; Career... http://t.co/Gs7XVm0VAU,1
1319,Statistically speaking if you employ me theres a 33% chance Im gonna quit and a 66% chance youre gonna fire me... hire me? :),0
2492,Interested in a #job in #Louisville Kentucky? This could be a great fit: https://t.co/6SWTdQfpTX #NowHiring #GetHired #Manufacturing,1
6619,here is a cool job opportunity at my company in our Boston office. youd get to work with me! writing/engineering: http://t.co/oTFW37S81B,1
1323,Job Opportunity: Core Java or C# Equity Derivatives Developer. Are you a fit? in New York NY http://t.co/MoNbJKFZML #jobs #java #csharp,1
2221,Have you seen my mid-week video? I decided to vlog whilst unemployed! http://t.co/HrrU0wdnx7 #lbloggers #crazybloggers #bdib,0
1720,Welp.  Laid off again.  If I do such good work whys no one wanna keep me around?#unemployed,0
744,you might be interested in: Director of Academic Success Position at Drake University Law https://t.co/NUPFhGH7MC,1
4863,Whos hiring?! Cant keep working at these Hyundai suppliers! Cant work in these STEEL TOE shoes!! #Diabetic,0
2546,Looking for a new view? Seacoast National Bank is looking for a Support Engineer. This position is more geared... http://t.co/SeuDvW2OVd,1
6555,Finishing up my temporary job as an alternative assessment reader. Now time to start a new position. Can you help? Let me know.,0
6920,LOOKING FOR A WAY TO MAKE EXTRA MONEY WITHOUT QUITTING YOUR JOB?JOIN WAKEUPNOWhttp://t.co/Fot1qF35xV http://t.co/bF4blUfJ6M,1
2848,Looking for an opportunity to work with children?  Open House today from 12-5pm at 2288 Second Street Pike Suite 1 Newtown PA 18940.,1
5708,Ive decided to liberally use the word sabbatical as to what Im doing when Im between work. Im not unemployed - Im on sabbatical,0
1568,This week i ditched my job ended a once great but now toxic friendship and cleared a major body image hurdle. I am on a roll.,0
5058,I recently quit my job to pull in $7146 from my phone PRESS THE LINK INSIDE BIO to do it too https://t.co/HxsI0vEDKg,1
2499,Its a good time to be an #ExecutiveChef. Its an even better time to be an Executive Chef whos looking for a new job. Heres one opportunity (of many) available through @EHSGetHired  : https://t.co/VbQ60Bucup,1
6369,Sooo i whipped my managers ass with a wet towel today and got fired &lt;&lt;&lt;,0
3345,my dad just fired and rehired me within five minutes so thats fun.,0
1840,I am looking for a #BookingAgent looking for great sales person For more info and to apply:  http://t.co/IjViG3EACn #jobs via @skillpages,1
2051,Looking to make a career change? http://t.co/rA54iIaZKx  #linkedin #monster #hotjobs #gethired #careerbuilder #jobs #hiring #management,1
2849,Looking for a new #production job? #Canton OH manufacturer seeking 2nd shift workers. Call 330-494-9243 for details. #hiring #jobs,1
5499,Stagnant?Im a highly skilled white collar worker &amp; I cant even find a damn job after being laid off! A nation of homeless ppl is coming. https://t.co/064d1cMiUq,0
1615,Looking for a job? Superintendent II - Wind Energy Group (IRC9674)Job Details at M. A. Mortenson ... http://t.co/xHNlZQnrdx #green #jobs,1
4141,I am currently unemployed,0
6158,So mater called me after practice and told me I was fired because I didnt get all 7 pens back. Jokes on her that was my sign of quitting,0
4878,Work in Radio?  Cox Media Group in Jacksonville is hiring an Account Executive. http://t.co/PS00zCcEv1 #digitalmedia #salesjobs,1
7550,Looking for a new job? The best companies to work for are hiring right now https://t.co/IemwNUmW6F #100BestCos https://t.co/FKx8xhj4jE,1
1691,Quit my job yesterday got a new one today,0
2585,Looking for a change? New Digital #Marketing Project Manager position in #Chicago: http://t.co/39pgeuqe0q http://t.co/xOLPjMIWrh,1
1130,I am looking for a new job. give me ideas,0
2317,Looking for a career change? Check out available Financial Center jobs. &gt;&gt;&gt; http://t.co/FC4gLpWV9e,1
385,I am seeking the next batch of leaders to work side by side with to go out there and change some lives. PM me.... http://t.co/bwqMjlUafu,1
2434,Looking for a job in the cannabis industry? Read this guide on how to get hired: https://t.co/fpbgP343Df #I502 #Seattle #PDX #CO #staylifted https://t.co/CvtO3zWTT7,1
994,We can help you get that Direct-Hire opportunity..See How! http://t.co/zOkpkQfBMo #services #GetHired #HireMe,1
1446,Unemployed? No job? Looking for employment?  Now hiring! http://t.co/uwCbHWfUuh http://t.co/cxOeKSTG1o,1
5717,Being #unemployed and looking for a new #job takes a surprising amount of time and effort. Sorry #youtubechannel I got some things to do.,0
770,Here is an opening position announcement for anyone who might be interested. Machesney Park is in the Rockford... http://t.co/JRpgNUqOSV,1
7618,If I dont get one of the 63 healthcare positions Ive applied for soon then Im going to go insane. Curse you unemployment!!!,0
2908,So Ive been unemployed for like 3 hours and I need to work.,0
3706,Looking for a #(NEW) #Billing Associate - Facilities Construction or Trade Expertise #jobs https://t.co/JcuSvQVZTj https://t.co/ZmHoNTajdH,1
1300,Dont submit then quit. Apply for jobs like Regular Classroom Teacher at San Francisco Unified School District then look for people you might know at the company. You might be able to reach out to HR directly. Ready to apply? Check out the link in our bio. Educator Teacher,1
2182,Searching for #work in New Smyrna Beach FL? Send your #resume to Volusia County FL. http://t.co/YxikTl8ofI #gethired,1
4620,I quit my job whos hiring?,0
4967,Any retail jobs hiring ???,0
1963,I recently started at Stryker and like everyone I had the New Job Jitters.  Here are some great tips to minimize…https://t.co/6nhgxWdljT,0
1263,Here is your opportunity to make money from home free tour lets you in the back office http://t.co/V4Eh4ORSy5 #work #workathome,1
3901,#Accounting #Job in #Milwaukee WI: Accounts Payable Coordinator at http://t.co/TqEt5Bf00c #Jobs #TweetMyJobs,1
4928,YOUR HIRED! IF YOU NEED A JOB OR JUST WANT MORE MONEY WATCH THIS: https://t.co/Rjm2d0D6  #unemployed #needajob #needmoney,1
7067,I used to work in a sweat shop but I quit &amp; jumped on welfare &amp; made triple the amount. Like I can afford the shoes I used to make. #Boss,0
2147,Searching for #work in Campbell CA? Send your #resume to Kaiser Permanente. http://t.co/iJQs4AxFWH #gethired,1
6106,Ashoka posted a job you might be interested in. Volunteer Fundraiser (Virtual) - United States US via LinkedIn http://t.co/7M0gq58U7e,1
1452,Need to Make a Career Move?  Need a New Job?  Unemployed? @leezabyers Can Help: http://t.co/4TTHGTCKnm,1
1599,Looking for a great place to work?  Senior Solution Architect (Java)http://t.co/MNuIVgC2NB #job,1
4446,Let me ask this again lol. Is anyone hiring.? Coming back home in 5 days and need a job .!,0
1410,Unemployed Under-Employed Unhappily Employed? Find jobs &amp; career solutions on LinkedIn in JCD The Job Seeker &amp;... http://t.co/PU1at6It70,1
7034,I quit my job to be a travel writer and now Im broke and unemployed https://t.co/T25xyR7HKR https://t.co/0nJ5qTKVK1,0
1836,I am seeking people who have professional service support businesses. Not people who believe they have a business by sales affiliate or ma…,1
3615,The vicious cycle of unemployment is 100% caused by the fact that I have never had 3 professional references for a job application.,0
5564,I am looking for the following:2 to 3 Associates to join the Private Equity and M&amp;A group.  I am seeking individuals with a wide range of…,1
4465,I want a job so bad  whos hiring ???,0
4346,Interested in a #Transportation #job near #MESQUITE TX? This could be a great fit: https://t.co/spexfbi5pX #Hiring #CareerArc,1
1333,Interested in a #job in #Mesquite TX? This could be a great fit: https://t.co/iKvp48XwUa #Retail #Hiring #CareerArc,1
1828,I am seeking employment with an agency whos ideology is about the well-being and care of the elderly.,0
2316,Looking for a #CERTIFIED #PHARMACY TECHNICIANS (15 New Positions!) #jobs https://t.co/fJwBkDslsr https://t.co/NrMnIefsPd,1
2857,Looking for greater challenges new opportunities and a working environment that lets you challenge yourself and showcase your skills? Look no further! Join us: Associate Technical Account Manager https://t.co/RIe53pCooQ #Veterans #CareerArc,1
5539,I am looking for moms  dads  students full time employees ready to quit their 40 hr jobs  people… https://t.co/eqKm4WGJbI,1
3334,Got fired last week got hired this week lol,0
4219,Currently taking applications for someone new to caption my photos bc @TooSlick_Rick is fired... the job has no benefits except that you will get to see never before seen photos of me that may never actually be posted,1
3174,@RetroFlea well I was laid off 2 weeks ago searching for a job because my job laid 18 thousand + people so I think I can bitch (:,0
2285,Looking for a job? Energy Efficiency Engineer (2 105445 229519) at Adecco (Portland OR) http://t.co/eJQ850nzKd #green #jobs,1
1100,I am job searching for: Work at home jobs! http://t.co/4tgcXWg6JK — Walker Inklebarger (@Walker_marocliv.... http://t.co/7lxxMP4mdn,0
6964,I got fired frm my first real job today,0
4248,I was job searching &amp; wlc is looking for a new tech guy. Pretty sure Mr. Ballou got fired...,0
5319,In a favorable position where Im now encouraging loved ones and giving out jobs. Bless the lord,1
7367,So I quit the mover job last week and today was my first day at the new job. Back working at a warehouse.Definitely gotta get use to 5am-1pm,0
7448,Currently jobless ATM being an introvert who worked customer service/food service for 12-14 years makes it harder for job choices. Especially when I dont want to come home half dead and not do anything.,0
2024,Got fired a few weeks ago for showing up a few minutes late several times. You can ask my boss. Got hired back and put on days. Its cool.,0
2064,Looking for a New Job? Interested in a Career Change? #CareerCast Has Everything You Need and More! - https://t.co/v51WbHj8NF #GetHired,1
6625,Dell posted a job you might be interested in: Network Design Consultant - Dallas/Fort Worth Area US.,1
5053,I recently quit my day job. It was one of the toughest decisions Ive had to make in a very long time. Somehow... http://t.co/vn8PJbOxqF,0
2299,Looking for a new #career? BCM is #hiring a Research Technician III in #Pediatric Nutrition apply online at http://t.co/oZaFo57j3y #JOBS,1
6943,Looking for a #Student #Equity Coordinator (Categorically Funded) #jobs http://t.co/ROiyoUrqXk http://t.co/MpeTtWvr7l,1
4586,Monday Kohls hired me. Tuesday/Wednesday I got a call from Starbucks &amp; got hired after the interview so I quit Kohls.,0
74,I was laid off last fall. My heart goes out to those laid off from @IrrationalGames recently.,0
3914,#Albany #Jobs general appartment  maintenance  (local): experienced person part time with tools and transporta... http://t.co/iL1ZX2QpIv,1
4615,I quit H&amp;M on the 2nd day but I went in there yesterday for some jackets....yall think theyll hire me back just for the discount again ?,0
2925,Interview today...n JUST got an interview for the position I really wanted TOMORROW. things are starting to fall into place,0
7161,Currently unemployed. What now.,0
7059,I quite my job on Saturday. My boss was bullying me and even accused me of possessing illegal drugs. Fighting unemployment now. #mylife,0
1120,I am searching jobs in New Jersey on http://t.co/rwQS6slTU4,0
6967,My job fired me wow,0
4717,OK #Nashville - I have a 19 year old with brains and muscles (my son) who needs a job. Anyone hiring or know of an opportunity?,0
4866,Anyone hiring where you actually have to do work??,0
4861,Anyone looking for work? (FLW) Amazon Publishing Is Hiring Says Belle http://t.co/Mmyo3JxZch via @publisherswkly,1
2118,Looking for a new #career? Get Hired By the BEST event May 4. Award-winning employers. Register today! https://t.co/6TXkU51LRw #GetHired,1
2519,Looking for 16B pitcher: Looking to add a 3rd pitcher that can play other positions when not in the pitching.... https://t.co/liM1mgw1kk,1
1137,I got laid off my job today. If anyone knows someone looking for a social/digital marketer with a can do attitude in the LA area hit me up.,0
7434,Looking for a new position as a Montessori teacher admin or teacher educator? Check out our Employment Center&gt;&gt; http://t.co/11ohNL5NTF,1
7598,Fired? Laid off? This is just what the #freemarket ordered: http://t.co/OLHpZ2B7mx RSVP for May 31 #houstontx #txcot #income,1
1766,KY #GED grad Yvonne Brumley: I got laid off and I am applying for jobs at businesses I couldnt apply at before (I earned my diploma).,0
2754,i am looking for someone who is experienced with designing and making flyers. Please hit me up i have some work to be done. will pay,1
4100,I just quit my job cause I got hired some where else &amp; I start today YES GAWD!,0
6739,i think they fired me at fusion without telling me bc i didnt get the schedule for this week whoops,0
3232,Seeking a Coal Fired Plant Mechanical O &amp; M Engineer for position in CO. Please email: dbeken@thinkingahead.com /call: 800-533-7977 x3,1
5938,All I need is this much space on your couch Kyrie I aint got no job http://t.co/smZgpAulEh,0
1646,Relocated to Tucson AZ. Well not quite done yet. Relocating. Now Im searching in earnest for a Remote Front-End Developer position.,0
2425,Yahoo! posted a job you might be interested in. Tech Yahoo Software Dev Eng Sr - San Francisco Bay Area US via… http://t.co/DZPNRJoR7u,1
7666,Interested in this job? Electro-Mechanical Technician (2 positions available)   (DH) in Milwaukee WI http://t.co/VYRvMU29Gk #job,1
4900,Well I just applied for a few jobs to day and I hope I get hired so I can get more money coming so I can afford to have a boyfriend.,0
2430,Looking to Hire or Be Hired? Turn to Social Media (Job Recruiters Love It Too) http://t.co/26aUm1zStc via @marketingprofs #socialmedia,1
1600,Looking for a job? Instructor - Adjunct - Energy Efficiency at Education Corporation of America (... http://t.co/GICorAoj0U #green #jobs,1
5624,I got sick &amp; hospitalized w/ no insurance got laid off. am recovering still on the road to recovery while job hunting AGAIN @BarackObama,0
3391,Anyone fired/ laid off and they want 2 get back in control of their finances? go to http://t.co/kWPW8XgPrj &amp; then DM me W/ contact info!,1
2543,Looking for a campaign position in Minneapolis in 2016? Apply to be a DFL Regional Organizing Dir. (ROD) today! https://t.co/bP4N8ket8j,1
1276,Here is an opportunity to intern over the summer working on a political campaign: https://t.co/GVvSjtf2xu,1
6152,UPDATE: Apparently I was not fired I was just asked to leave for the day so I just decided to quit with this dope letter of resignation https://t.co/K6UMuq0vJz,0
4184,as of today for the first time in two years.....I am officially unemployed,0
2241,A month ago I was unemployed and now next week I have work every day,0
2065,Looking for a #JOB!? Get hired here &gt;&gt; https://t.co/ktalbUlaA7 https://t.co/ukyz9UC2X6,1
2931,Got a position as a lead teacher in the education field. I am employed. Hallelujah.  Thank you Jesus.!!!!!Glory to GOD!!!!!,0
2243,Unemployed again. Hello ramen my old friend.,0
1876,@SSUSAJoe @AmyF222 @tomirvin44 @derikhunt915 @LoriMills4 @LuisGarzam89 I used to work for Barnum and Bailey but got laid off!!,0
3267,well once again i have been fired from another salon.  i am new to hair cutting only having done it for a year and a half. but i think..,0
1849,Searching for a new job. My expertise are HRM Admin Intelligence services and Tele Communications.,0
6447,I just lost my job today. Sometimes the bad times are really BAD,0
7179,Heres an opportunity you might of pass by ==&gt; http://t.co/4D2FPchmCK #jobsearch #jobs #parttime #biz,1
2166,Searching for #work in Walker MI? Send your #resume to EmploymentGroup. http://t.co/jB6hhIz3Ge #gethired,1
6175,How I should have quit earlier this week http://t.co/4Lb6GshHLk,0
134,Today I was hired back into the food business. Yay. Aug 2 cant come fast enough. I just wanna teach my 5th grade hooligans,0
6884,I woke up this morning and I was unemployed.,0
1343,Interested in a #job in #Mesquite TX? This could be a great fit: https://t.co/Ml3p0JzHxs #Retail #Hiring #CareerArc,1
1756,Freshly laid off checklist:✔ Call partner✔ Call Mom✔ Call Dad-- Wait on hold forever with unemployment. 😓,0
6612,Google posted a job you might be interested in: Assist Program Manager Google for Work - San Francisco Bay Area US.,1
5439,Are you laid off and looking for work with little success? Work a few hours from your home http://t.co/3HQeJg7M4Y http://t.co/te2xyKLbcJ,1
3709,Looking for a freelance position? - Check out #jobsboard with 50822+ jobs includings freelance work - http://t.co/bUfvdLRs9v,1
4264,We are seeking a social media expert/writer who is fired up about libraries archives and museums. Join us! http://t.co/rV097IQ3zr,1
2176,Searching for #work in Milwaukee WI? Send your #resume to Harley-Davidson. http://t.co/i8RQh5ToDF #gethired,1
2701,#Georgia #Jobs Field Supervisor- Temporary - Spectra Georgia: Norcross Position overview:to field inspect job ... http://t.co/ofuHQavtoL,1
847,#jobs #unemployed Caviar Courier - Nights: Caviar - San Francisco CA - Deliver food ... https://t.co/rTMDctONJ8 https://t.co/gnOhY7zTKT,1
2177,Searching for #work in Sunderland MA? Send your #resume to Property Star Services Inc.. http://t.co/DwR1sPjGna #gethired,1
792,I am currently sourcing for a position for a Junior Assistant to work in an Entertainment company in NYC. If you love music.. this may be p…,1
2301,Looking for a Spring semester Work-Study job?  Purdue School of Nursing has a Clerical Assistant position to scan files to archive make copies make student IDs file cover phones type and other clerical tasks. https://t.co/zEDTdoCG8I,1
2732,#Job #Georgia Trainer Plant Maintenance at http://t.co/MaYS1DgaSa (Cumming GA): SUMMARY: This position is resp... http://t.co/kCxvW9pnDH,1
2155,Searching for #work in San Jose CA? Send your #resume to Kaiser Permanente. http://t.co/oe5c7tvrBU #gethired,1
5260,The more unemployed I am the more of an asshole I become.  Ive become an even more terrifying sass master.,0
1389,Looking for a job? Ditch the resume tips and open a marketing book: For many unemployed yo... http://t.co/WVoxnkYvh5 #startup #JoyCookPR,1
2102,Top Story: Looking for a great career? Get Hired! https://t.co/1vxCFQSFja  #jobs #trending #jobsearch #career #job #gethired #hired #job #RT https://t.co/y7PJ31eEjV,1
7045,I will not be waking up tomorrow to go to that stupid job that i quit! They  can all fuck off! :)  i will be unemployed however oops...,0
4097,Fuck yes got hired at Eskimo Joes. I will not miss Oreganos one bit.,0
6113,Microsoft posted a job you might be interested in. Software Engineer II - Greater Seattle Area US via LinkedIn.,1
12,I wasnt fired from my job. I was laid off!,0
2040,Looking for a #NewJob? #CareerCast has all your #Job and #Career needs at your fingertips. https://t.co/TP0fqqrlDk #CareerAdvice #GetHired,1
1247,A work-from-home opportunity that lets you go places. #WorkFromHome #smallbusiness #entrepreneurs #Canada http://t.co/Kvj3RG6NLz,1
7271,I have been officially laid off from my one steady PT day job gig (not my fault). Hopefully this end will become an awesome beginning soon.,0
1348,Interested in a #job in #Quitman GA? This could be a great fit: https://t.co/PTRMC1O3I8 #Automotive #Hiring #CareerArc,1
1877,@fsmikey @FSBigBob last day listening at 6am for a little while. Getting laid off at noon. Thanks for the laughs! #Illbeback,0
6110,Zynga posted a job you might be interested in. Product Manager - Bengaluru Area India IN via LinkedIn http://t.co/BhkqF7QTra,1
5063,I quit my job earlier this week... What should I do now,0
2267,Looking for a new challenge or feel stuck in a job you hate? We can help! #javascript #java #ruby #angular https://t.co/AuL0e2zuaY,1
5227,I am now unemployed and there is nothing to blame except for #ObamaCare #AffordableCareAct   #ThanksObama,0
1995,First day at my new new job &amp; my boss is 10 mins late when I was 10 mins early..Hmm.,0
1246,A young professional near Roseville? Heres a networking opportunity for you. https://t.co/5ucoEzwSAx #HireACat,1
7664,Got my heart smashed laid off and lost business to a crazy lady. And thats just within 24 hours. So Im eating my sorrows away,0
6302,#Job #Philadelphia Software Engineer: Cherry Hill I am currently working on a Software Engineer position with ... http://t.co/hGU2Ka5YSZ,1
2730,#Job #Gadsden Over the Road Driver Company Driver Needed! (USA): Immediate position available for experienced ... https://t.co/rM99CVhBfk,1
4922,The camp I worked at last year is HIRING! Running to apply now yes Jesus I hope I get hired,0
371,Im searching for a part-time PE/dance teacher. Do you know anyone who would like to work 1-2 hours per day?... https://t.co/ocMOYXIsuh,1
