id,text,class
2257,Ad: Unemployed? Looking for a new Job or Career? Work at Home Positions avail $80-$90 a hr http://t.co/GSqMoc2L,0
2964,UH sucks so bad. Lost my job becuz of funding and now every position I try to apply for cant hire me becuz of funding -_-,1
4745,I am opening 4 commission spots at half price since I am unemployed. $25 each for pencil &amp; inks single figure! Email tweet or DM me!,1
4626,I quit a job today &amp; got two other job offers 😏,1
7276,@johnurschel Im searching at the Development Director level in MA. I was laid off in January.,1
3683,New job offer opening up a lot of opportunities for me Im very excited about the possibilities,0
2314,Looking for a new job? #qualifiedstaffing #hotjobs #employmentnews http://t.co/T4kupFlIMl http://t.co/99reXJl3RF,0
327,i am thinking of changing my internship workplace if it is Gods will and i am searching for a place  http://t.co/GuAdDjDAku #pray #prayer,0
2186,Last Saturday was my last day of work at Sukis. Being unemployed feels strange..lol,1
7182,Hewlett-Packard posted a job you might be interested in: Backup and Restore(Recovery) Engineer - Bengaluru Area India IN.,0
6719,Ron Jon just fired me because I forgot about my shift today sorry I was asleep on my bathroom floor,1
4356,I am currently working with client in Uptown Dallas that is in the venture capital/private equity space and is looking to bring on a Staff …,0
2099,Looking to relocate? Join PepsiCo as a Sales District Leader - Designate. Apply: https://t.co/YjsNFaLOQ3 #GetHired #Career,0
4099,I just got hired as a electrician and I start tomorrow,0
6858,Hell yeah Im unemployed my baby daddy down my back.,1
5236,My mom is the busiest retired person I know and I am the busiest unemployed person I know :-) Together we are M&amp;M.,1
5130,Fired? Laid Off? Join me TODAY and make money FROM HOME! - Classified Ad http://t.co/zKoS2EG3Ud  via @sharethis,0
324,I am searching to work for a company/department that develops clean technology. https://t.co/EFVYYkaxPu,0
5496,Being laid off sucks. So they say there is about 80 to 100 applicants to each available job. So should I apply 80 to 100 times to get hired?,1
94,Today I got proletariatainized... Got hired on permanently at a company.,0
4822,Im watching the Doctor Who 50th Anniversary Special because Im a big Doctor Who fan and Im also very unemployed.,1
5643,Just got laid off... am I too late for recruiting? http://t.co/2585gBm2qc,1
6337,I am actively seeking a position in Customs Compliance. Please contact me at senta.schreiber@gmail.com.,0
7612,Looking for a job?  Quick Med Claims has work at home positions available for qualified applicants.  www.quickmedclaims/employment.php,0
2290,Looking for a job a new career or more job satisfaction? 51 Career and Job Affirmations. http://t.co/Zkv30ItwAy,0
723,Iowa Supreme Court says a woman can be fired for being too irresistible. I am unemployed. COINCIDENCE?!?!,1
5690,Being unemployed helps you make discoveries! Today I discovered Boy Meets World is on tv in the middle of the day! #discovery,1
2181,Searching for #work in Cleveland OH? Send your #resume to Colliers International. http://t.co/kQyGqqjYfq #gethired,0
6035,First day on my new position and mid day thru it all my boss hands me a beer. Life is good!,0
5239,I hate late hours like this I get in my feelings bc Im still unemployed,1
3152,I got laid off earlier this month so I started a blog. Check it out! https://t.co/YJbRTiFuiE. #ThePinkSlip #UnemployedAndAnnoyed,1
3110,So I quit my job yesterday LOL,1
496,Well I didnt get fired on my first day at my new big girl job so thats something I can be proud of for fifteen minutes.,0
4651,I quit my job today...,1
5222,I love a challenge and thrive on proving people wrong so yes compliments are the reason Im unemployed,1
7289,I found out today that due to corporate budget cuts the Quality/Health &amp; Safety position is no longer needed. As such Ive been laid off.,1
1953,At my new job some guy had a dog in his office &amp; I asked my boss about it &amp; he casually told me they sometimes just BRING DOGS TO WORK!!!,0
6331,I am currently needing to fill several Restaurant Management positions.  Please send me your email address and I...: http://t.co/KT49ESWs,0
4433,I need a job. Anybody hiring??,1
125,Today I was rehired for my job! :),0
6966,I got fired today.. Fml,1
1196,Ironic I drop the #EAT today and jus got laid off from my job..,1
6932,Looking for a job in #Mesquite #TX? Veterinary Assistant https://t.co/FEsGeJzlp1 #jobs #hiring,0
4176,I am self-employed which is an arrogant way of saying unemployed. http://t.co/Fsz2vytSSs by @RobertPunchur,1
6856,This is the first time since I was 14 that I have been unemployed. Life feels weird,1
5621,I only worked 2 months &amp; already getting laid off,1
2220,Temporarily unemployed. Time to catch up on my anime! Why did I wait this long to watch #Shokugeki no Soma??,1
2262,Ad: Unemployed? Looking for a new Job or Career? Work at Home Positions avail $80-$90 a hr http://t.co/RcIrQLrMi0,0
2794,I got hired yesterday and started working the same day too 🖖🏽,0
2681,#Anchorage #Job Fairbanks AK Special Education Teacher Position: Anchorage Fairbanks AK Special Education Te... http://t.co/vmVajCIUQz,0
1079,I am looking for a position as a Talent Acquisition coordinator or Recruiter. Masters in HR new to field. In metro ATL area  #ReignyDayJobs,0
999,Interested in a #job in #Pottsville PA? This could be a great fit: https://t.co/B0WL4PKqQR #NowHiring #GetHired #Manufacturing #Hiring,0
3120,today I quit both my jobs accepted Jesus back into my life and quit all hard drugs,1
3741,Looking for a tech job where you work w/ smart people &amp; can have an impact?http://t.co/cxanNgUQ6O #dotnet @InnovateMS http://t.co/bLvn14Q27U,0
7028,Ah yes another very productive day of doing nothing. Unemployment is going quite well thank you,1
6963,I got fired from my job today. But thats ok because the place was very ghetto,1
7499,I am job searching for: Work at home jobs! http://t.co/4tgcXWg6JK — Walker Inklebarger (@Walker_marocliv.... http://t.co/6u6sdhSaOA,0
4640,So to answer a few ??s about the fine dining job they lied about my hours/pay/job description so I quit Tuesday so I went to Hooters today,1
2874,my hands dont like to be unemployed they like to work,1
6228,It was a year ago yesterday that I was laid off. It happened 10 minutes after returning from a two week vacation.,1
758,you might be interested in: Assistant Director/Director of Academic Support Position at Thurgood Marshall https://t.co/XtRzKsjw9k,0
7672,Got hired today!!!,0
4741,Anyone know where theyre hiring ?? Lmk,0
5637,So today I started out my birthday with being laid off work. Unemployment here I come. :/,1
1877,@fsmikey @FSBigBob last day listening at 6am for a little while. Getting laid off at noon. Thanks for the laughs! #Illbeback,0
1348,Interested in a #job in #Quitman GA? This could be a great fit: https://t.co/PTRMC1O3I8 #Automotive #Hiring #CareerArc,0
4221,My boss fired me Friday and is now refusing to pay me for the hours w: I work in a private home doing care for... http://t.co/8UjRkVTu0J,1
1076,I am really searching for some Great not average Mortgage Originators that know how to get the job done. There are some reps that take your…,0
4859,Does anyone know of any shops hiring??yah girl is trying to not work in inglewood anymore💁😭,0
1094,job searching is the worst. please give me money i am just trying to survive capitalism,1
7635,I am currently looking for work in or near downtown Los Angeles. #hireme Office Assistant/Receptionist/Data Entry http://t.co/x49rUa6vDx,0
3593,I came to Orlando worried about being unemployed and now I have 2 job offers to choose from #sweg,1
4978,I got fired from my job today!  Its about time!  I hated that place,1
4102,Got hired...now I have to start waking up early again!,0
1340,Interested in a #job in #Mesquite TX? This could be a great fit: https://t.co/zAaZtHyq6E #Retail #Hiring #CareerArc,0
4248,I was job searching &amp; wlc is looking for a new tech guy. Pretty sure Mr. Ballou got fired...,0
7223,Heres a great opportunity for any veterans interested in pursuing careers in entrepreneurship.... http://t.co/UqLKpFNjKB,0
5931,@Militarydotcom: Capital One @capitalonejobs wants to hire #veterans : http://t.co/zXuiLC5GFU #hiring #job,0
801,I AM CURRENTLY SEEKING A FULL TIME NIGHT SHIFT POSITION IN LA -- Have any suggestions?,0
5660,I am no longer reporting on education @indystar - laid off Friday. 110% unexpected. Still bent on journalism/covering ed so plz RT,1
756,We have a great job opportunity in the Lake Oswego area for those who are seeking an office position. If you are interested in applying...,0
3956,Almost won in the works bingo for $50 and I got hired today lmao,0
421,@BriReid64: Im DONE! 😂😂 I QUIT!!!! http://t.co/S4X12f33aP holy shit. I think I just peed myself 😂😂😂,1
4743,I need a job. Ive been officially unemployed for 2 days and Im already wanting to be working. I hope I find something...,1
89,I went on a job interview today and broke my sandal and had to duct tape it to my foot so if I dont get hired someones buying me new shoes,0
1632,Looking for a great new #FOH #Job?@AquitaineCH is #hiring SERVERS and BUSSERS: https://t.co/AUCu2MGfk5 #bostonjobs,0
3362,Today: my mother fired me from work and then rehired me. Oh.,0
4025,Searching for #work in Columbus IN? Send your #resume to Bob Evans Inc.. http://t.co/4xkDUpiUaf #gethired,0
5094,Last week: I was looking for other jobs. This week: got a raise got 2 interviews as well.,0
6109,Amazon posted a job you might be interested in. AWS Global Accounts Solutions Architect (Houston) - Houston Texas… http://t.co/EMveYGYUds,0
6106,Ashoka posted a job you might be interested in. Volunteer Fundraiser (Virtual) - United States US via LinkedIn http://t.co/7M0gq58U7e,0
1771,RT @CoopSoSarc: *gets LAID off*explains reason for DISCHARGE*reviews severance PACKAGEUnemployment is HARD,1
1029,The woman who hired me has not called in 5 days and is not answering when I call. I called like 7 times throughout the day yesterday.,0
1372,Interested in a #Sales #job near #Mesquite TX? This could be a great fit: https://t.co/8GhahyfA73 #Hiring #CareerArc,0
7519,Today I have lost my job kicked out of my house Lost my girlfriend and all~ https://t.co/S68mZfKQxn #pray #prayer https://t.co/8b7FWjM6e2,1
5203,Baby Im a boss and yah man unemployed,1
341,I am looking for Lanyard Locket Ambassadors.  I am looking for 5 people who wear name badges in your workplace to... http://t.co/RM7uLKWSbK,0
1055,I have a shoulder injury and am currently a nurse. I cant use my left arm what jobs are can i do that pay? https://t.co/xt2TYztJ4E,0
3951,Today I was hired for a summer job at a gift shop. :D  I wont be unemployed forever!,0
3099,I quit my job at Starbucks so I could have more time for school but then I my depression came back &amp; I havent done shit since week 2 fml,1
3773,i was employed for two days but now i am Unemployed,1
2693,#CareerArc #Retail #Job alert: Retail Store Positions | CVS Health | #Montgomery OH http://t.co/2rRevwPCh2 #Jobs #Hiring,0
2322,I HATE UNEMPLOYMENT!!!! I HAVENT RECEIVED A PAYMENT IN 3 MONTHS AND HAD 2 JOBS SINCE. #BROKE #HOMELESS #HUNGRY WITH 6 KIDS AND A WIFE #BS,1
6556,Finally started my new position today at work and man oh man am I happy $,0
7658,My best friend died and I got laid off from my job in a span of less than 5 days. I need a goddamn ice cream,1
769,Interested in a position as an Administrative Assistant? Check out this great opportunity: http://t.co/6u7p8VG9Il #foresters #jobsearch,0
6576,Anyone know any lawnmower repair person that charges fairly and does good/quick work???,0
7029,I Quit My #Job To Be A Travel Writer And Now Im Broke And Unemployed https://t.co/QZ1UKWaiHw https://t.co/ijeFCYa58d,1
6864,Ive been unemployed for a little over a year now. Now I know why. https://t.co/ED9Lgr1WAj,1
866,FYI I love Psychology...I am just poking fun at my profession technically Im an unemployed nobody.,1
4814,today i sat outside drinking coffee went to a record store ate a slab of ribs and am going bowling. being unemployed rules,1
4855,Who hiring? Who got work? Who got weight that need to be moved? Who need a FUCKIN BABY SITTER! IM HUNGRY,1
4001,This new job I got hired for&gt;&gt;&gt;&gt;,0
1567,I was fired from my job after a complaint yet Im not sorry.  God is working on my behalf even now.,1
897,Looking for a new career in the IT field? Head over to our website http://t.co/38APTLRqc2 for our complete list of open positions!,0
6534,A week ago I quit my job accepted another position &amp; started working out again #fitgirls #lifeisgood #finally,0
4744,I am an #unemployed #bipolar #overweight #blogger looking for a #job Is there #stigma attached to it? Will a #company hire me if qualified?,1
7074,Unemployment pays more! Imrich biatch!! #QuitYourJobIn5Words,1
936,today I got hired on to a new position that Im not even qualified for with a higher pay than I ever wouldve expected.... Im in awe ❤,0
5326,So last night I quit my job as an April Fools joke looked at my phone and realized it was 11:57. Anyone know any places hiring?,1
2004,I recently quit my job to pull in $9023 from my phone PRESS THE LINK INSIDE BIO to do it too https://t.co/tcQvOqeLXW,1
6324,Currently recruiting for positions in the Fixed Income Industry (institutional sales and trades). Please follow me if you are interested.,0
6427,2 weeks ago i was in car crash messed up mebup. Last week i lost my job due to the crash. Today someone charged something to my debit card,1
5206,I have *TRIED* to take on the white feminists and misogyny within social justice movements and here I am unemployed being told to keep going,1
5183,The world seems to assume that if you arent working its because you got fired laid off disabled etc......,1
72,8 Years Ago… I woke up unemployed: 8 years ago I was laid off.  Friday the 13th was my last day at my job (get... http://t.co/p12SAfGOtP,1
3354,I Got Fired  &amp; Rehired lol,0
791,I am currently exploring new career opportunities. Please contact me to discuss any possible positions.,0
3931,The role of the part-time employee is precarious.  I was offered the chance to go full-time. When I declined I was laid off.,1
4687,Day 4 of unemployment finds me debating about doing freelance work vs working for another company vs being a international jewel thief.,1
3539,I had the worst job interview today. I feel bad for whomever takes that position. yikes.,0
7524,Unemployed or Looking For a Way to Make Extra Money? --&gt;&gt; http://t.co/OvRAR4rAEe,0
5785,RT @vexroid: Autocorrect changed breakfast taquitos to breakfast tequilas and who am I to argue?And is anyone hiring?,0
2214,Im now unemployed. This feels odd.,1
2276,Looking for a job? Energy Engineer/Resource Efficiency Manager(13005062) at Northrop Grumman (AK) http://t.co/0fdWzVCWvf #green #jobs,0
4183,So as of 430 today I am currently unemployed again :( although we still have one paycheck left,1
7162,I am unemployed and #need #money #now https://t.co/GzJbNDpkU8,1
1766,KY #GED grad Yvonne Brumley: I got laid off and I am applying for jobs at businesses I couldnt apply at before (I earned my diploma).,1
4476,Hey does anyone know jobs that are hiring with summer coming and what not?? #letmeknow,0
4465,I want a job so bad  whos hiring ???,1
7365,I recently quit my job to make $5641 from my phone PRESS THE LINK INSIDE BIO to do it too https://t.co/uqpGSxmwfv,1
1105,I am job searching for: Work at home jobs! http://t.co/4tgcXWg6JK — Walker Inklebarger (@Walker_marocliv... http://t.co/WZfdKpUsEG,0
2754,i am looking for someone who is experienced with designing and making flyers. Please hit me up i have some work to be done. will pay,0
5805,Looking for a job in #Mesquite #TX? Retail Sales Teammate https://t.co/NhlZVQJoT6 #jobs #hiring,0
6607,Amazon posted a job you might be interested in. Software Development Engineer - Amazon WorkDocs - San Francisco Ba… http://t.co/yW0ntVsDGq,0
2161,Looking for a #NewJob? #CareerCast has all your #Job and #Career needs at your fingertips. https://t.co/IgteR0FQRs #CareerAdvice #GetHired,0
7179,Heres an opportunity you might of pass by ==&gt; http://t.co/4D2FPchmCK #jobsearch #jobs #parttime #biz,0
3094,fuck dude I quit my job yesterday. Now how do I pay my phone bill and buy weed and cigarettes,1
1005,Interested in a #job in #Edison New Jersey? This could be a great fit: https://t.co/c0Ziv9UwKq #NowHiring #GetHired #Clerical #Hiring,0
5997,@Lawwren__ We saw that you need a job we would like to hire you To become a part of or team now go to this page @_YouAreHired_,0
6453,I lost my job today~seems Im not cut out to be a plumbing dispatcher.....its in Gods hands now ~&lt;3~,1
5699,Recently discovered the unemployed life does not suit me feel as though Im living through an eternity of bored-ness.,1
4691,Being unemployed is cool. I guess its time I put my ass to work and pick a corner now. R.I.p. whichway pizza.:(,1
4142,I am currently unemployed. Temporarily but still very strange feeling.,1
6404,well its official.  i got fired today. #jobhuntisreal,1
1157,I wasnt fired I got laid off you wouldnt know the difference,1
2326,Well has of yesterday I am unemployed (quit my job). Yes had enough my body and health can not take it anymore. Start looking tomorrow.,1
2160,Searching for #work in Concord CA? Send your #resume to Volt Workforce Solutions. http://t.co/4Q31onhycN #gethired,0
5883,I was fired from my internship for writing a proposal for a more flexible dress code https://t.co/qIWDl7jHYJ via... https://t.co/FIZzSt928j,1
2573,Looking for a new position in a fun industry?  Palmetto Boat Center is accepting applications for a Parts... https://t.co/c4FllFg1eE,0
5066,My job thinks they slick sending me a termination paper bitch please not showing up to work that last 4 times didnt tell you i quit?,1
1960,I started a new job last night. My new boss is a good fella I am looking forward to working with him!,0
6460,So in 4 days I lost my job and my apartment. Ive got 19 days to find a place to stay and income. Im fucked.,1
5261,i know there is a link between weight gain and unemployed-ness. as i am sitting here eating a whole box of cookie crisp #smdh,1
6578,Anyone out there looking for work as Bartender Host or Cocktail server?? http://t.co/56wiTy0WE1,0
247,got hired to be tutor in my summer statistics class even though I know as much about statistics as the guy Im tutoring,0
6871,Looks like Im unemployed again lets see if I can beat my record of starting a new job in 4 days.,1
2341,Can we all take a moment to appreciate how a job finder account tweeted me when I wrote I NEED MONEY and not when I wrote UNEMPLOYED...,1
2881,The one good thing about unemployment- I get to workout for 3 hours in the middle of the day.  #BeastMode #Rage,1
3189,Officially found out Im getting laid off for the month of June and no longer guaranteed a job in July. Let the search begin.,0
3091,Today i quit my job. Everything is about to change for the better time to take a leap of faith with my career do what you love and do it well it’s time. Last year being broke,1
2680,#AECOM is hiring for @WaterAECOM. Interested? Apply online or follow @aecomjobs to learn about more positions! https://t.co/A4MLOjwdin,0
5630,I was laid off on Friday.  I am still in shock! Pray for me. If you are looking to hire please let me know @RosieRivera_JRR I live in Reseda,1
7002,Our cashier lost money and my boss thinks an employee stole it and says were all fired..,1
4966,Anyone know of places that are hiring?????? #needjob,1
6488,I lost my job Saturday got diagnosed Sunday..what a shitty weekend I had.,1
7045,I will not be waking up tomorrow to go to that stupid job that i quit! They  can all fuck off! :)  i will be unemployed however oops...,1
41,Bad news: laid off from my recreation position. Good news: I was offered another job at the same building. Less hours but its a job.,0
3838,Currently eating a twix in bed surrounded by laundry. #unemployed,1
2408,Can you recommend anyone for this #job? Senior Technical Accountant (2015) - http://t.co/LKQK2szF6L #Auto #Hiring http://t.co/gjUjJagIYg,0
6510,I just got fired on the spot for a position that Ive poured my heart and soul into because I asked for a raise (I make $12 an hour),1
3205,Looking for a new opportunity in Seattle as I was just laid off with half of Cheeseburger. Contact me or Shauna Swerland at GloCap with an …,1
2153,Searching for #work in Ames IA? Send your #resume to PMI. http://t.co/1X5z7LvQr8 #gethired,0
4258,i got fired from my job and havent been able to find another. if i could NOT do commissions for a living for an easier job i would.,1
4922,The camp I worked at last year is HIRING! Running to apply now yes Jesus I hope I get hired,0
7360,I recently quit my job to produce $7146 from my phone PRESS THE LINK INSIDE BIO to do it too https://t.co/31s1ZKDDkX,1
7015,I got fired. Writing a letter to corporate will NOT and will NEVER get my job back. Its dead.,1
2137,Searching for #work in Carmel IN? Send your #resume to Home Care Providers Inc.. http://t.co/jovv6B5v61 #gethired,0
3467,An earlier recruiter had me filling out an I-9 form and theres been silence for 3 weeks now on that position. No new info when I ask.,1
7661,Hi i got laid off and also lost a brand new iphone 7 who wants to paypal me $180 for a replacement pls ive been having such a rough time,1
1438,Unemployed Under-Employed Unhappily Employed? Find jobs &amp; career solutions on LinkedIn in JCD The Job Seeker &amp;... http://t.co/ti6iepAsh5,0
1445,Unemployed - Looking to get back to work? https://t.co/TgScR5Sasl #HRGirlfriends https://t.co/M9nRxX6IDP,0
4836,so bye everyone I am basically canceling all my friendships because I dont believe I am worth your time whilst unemployed and depressed,1
3514,Working earlier now in my new position. I am more than thankful for it. Thank you Lord.,0
5128,Recently laid off? Turn #lemonIntoLemonade and build your own #enterprise #giant with @softwaredevin https://t.co/Vg71rYVKBV,0
7259,Just got my unemployment awards letter  after getting laid off last Friday and it is a fucking joke. Need to find a new job asap!,1
4168,I had 4 jobs in 2015 😂😂 I cant keep a job and am currently unemployed so a New Years resolution of mine is to become an adult,1
2882,Division of unemployment can kiss my ass is this 2week break over yet ?? Cause Im ready go back work !!!!,1
1735,Tuh I would love to have a job at McDonalds.. Im sitting here unemployed and my mama just got laid off too? shit.,1
3010,Recently started working at a sex shop...got me thinkin...what are your thoughts on graffita covered sex toys @imcorinnemec,0
7667,Here is a wonderful opportunity for a full-time Administrative position in Banking and Finance! #jobs #greenemployers http://t.co/16BeeVGQmt,0
300,Main manager hired me back 5 mins later,0
3207,@E_Megas I am looking for freelance gigs. I was laid off a steady 3 year gig. This is the longest Ive been out of work.,1
2117,Searching for #work in Lancaster PA? Send your #resume to Housing Development Corporation MidAtlantic. http://t.co/2lA3UrOHBl #gethired,0
6590,Work in Radio?  Cox Media Group in Jacksonville is hiring an Account Executive. http://t.co/w8wOalvqsB #digitalmedia #salesjobs,0
1075,I am searching for jobs anybody got any suggestions?,0
1065,I am Looking for work in the Oakland California area.https://t.co/GYOhEV0xqG#JobListing #JobOpening #JobTips #Résumé,0
7584,Ahhhhh I am now officially hired at Super Model Inc. Omg yay!!,0
1127,I am searching jobs in New Jersey on http://www.employmentladdercom,0
3752,Looking for a #Adjunct #Position – ​Principles of Marketing #jobs http://t.co/7U5AhGKDtN http://t.co/Mc4bIS0vxx,0
2032,Looking for a great career? Get Hired! https://t.co/1vxCFQSFja  #jobs #trending #jobsearch #career #job #gethired #hired #job #RT #CEO #CFO https://t.co/srkvLSYBqg,0
3603,Now actively seeking employment. I hate job hunting! But such are the times in todays job climate.,1
2930,got woken up by some company looking to hire me for a c++ position. guy has a thick Indian accent so already expectations were low.,0
2582,Looking for a job in the political arena? #Saratoga mayor-elect puts out call for available positions: http://t.co/h6canKDT4u,0
1916,I was laid off and couldnt find a job then raised $1M to help people hunt jobs! A real story needs a great writer! You?,0
2540,Looking for an opportunity? Log onto F&amp;MConnects to browse positions uploaded specifically for the F&amp;M community: https://t.co/ZfGFEgTyVP,0
1908,Laid Off Lessons: Five Things I’ve Learned While Unemployed  https://t.co/Vl5xsn1b8y,1
2703,#Hiring: Receptionist: Location : Lakewood Ranch FL USDescription: The primary function of this position is to… https://t.co/LB2Tible2M,0
7153,I am now unemployed until I arrive at Texas.,1
5739,In between jobs for the moment so Im officially unemployed. Oh and I live in my moms basement. No joke.,1
5086,Was fired from HS coaching job earlier this week https://t.co/BC2WA6vV6Z,1
5626,I was part of a corporate restructuring at my FT job.  I was laid off this week.  I am offici... https://t.co/cAU4uhMswe,1
3701,Recently I just been fuckin and making art exactly what I saw myself doing in the future 5 years ago,1
4756,The other side of my life as an Artist is Im am unemployed person searching for employment. So hopeful for opportunity. Eludes me.,1
865,Dont mind if I do... #unemployed http://t.co/0kD55NAlkN,1
3763,hell yeah i qualify for unemployment woo woo,1
855,@boothead Sorry I cant do it justice right now. Unemployed working on the book prepping for contract work.,1
3935,A little part of my heart left after getting laid off,1
4801,Sometimes I feel like a big failure because I am unemployed and Milbury is not.,1
