id,text,class
148,Some dude quit I took his place since then they hired me and Im the ONLY one who fixes computers. I should just start another business,0
4470,Anyone know where is hiring?? #NeedAJob,1
3354,@Gillian_Leighh i got hired earlier this week &amp; worked 4 days straight was wondering why i didn’t see ya ass,0
4181,My company prepaid for 14 night stay. I am now likely unemployed and without transportation home. This is unacceptable,0
5264,Girl you know Im unemployed trynna be fancy,1
4794,Applying for jobs like crazy!! Need to find work soon cause being unemployed sucks. I am going stir crazy and its only been a week!,1
2011,I recently started working a part-time job in addition to building my biz because I have big giving dreams and goals. #GetFit #Dream #Give,0
9240,Anyone looking for a job with decent pay? Full time or part time positions open and must be 18,0
3146,I officially quit Target today I learned my self worth and they are so disrespectful &amp; petty  their Im over it,1
1131,Yay I got laid off today! I get to freelance now. #freedom http://t.co/0dYs8X4P7s,1
666,Here Are The 32 States Where You Can Be Fired For Being LGBT http://t.co/KxwxqN8xMu,0
6524,On Feb 28th on stk twits I put on SLW short position called 27.  am not taking any off.  My new tgt is 24,0
1739,I have been laid off since Dec 22 and tomorrow is my first day back to work. Bye bye life,1
5879,Dont submit then quit. Apply for jobs like Java developer at Cognizant then look for people you might know at the company. You might be able to reach out to HR directly. Ready to apply? Check out the link in our bio.,0
7479,No you dont get unemployment because you failed a drug test and got fired! DUH!~,0
1130,Got laid off today. No warning. Sigh. Im really screwed now. #fml #unemployedlife,1
6281,RT @continimarco: Microsoft posted a job you might be interested in: Tech Solutions Prof STORSM - Greater New York City Area US.,0
5783,Being #unemployed and looking for a new #job takes a surprising amount of time and effort. Sorry #youtubechannel I got some things to do.,1
7710,@DescovaUAsh yeah things are ok. I got laid off from my job so now Im looking for another graphic design position. Hope to land one soon.,1
2467,Here is the big secret about getting black women hired at Marvel and elsewhere: people currently employed there must give a fuck,0
8,I WASNT FIRED I WAS LAID OFF BUT YOU WOULDNT KNOW THE DIFFERENCE,1
8771,Looking For A Nursing Home In North Hollywood Toluca Lake? Medicare Offers Comparison Guide https://t.co/WPMt66BkE9,0
1174,Got laid off today. If 2016 could stop trying to crush my fucking soul...I would be so grateful.,1
8821,My company just hired two hot guys and I am leaving in a couple weeks. WHY.,0
8407,@Qthrul bummer so I got laid off as opposed to fired that’s disappointing,1
6381,Today I experienced one of the worst days ever as about 50 of my co-workers were laid off. And I’ve been left with about a week as well.,0
596,Social networks play a positive role in #hiring. But does this advantage carry over once someone is hired? https://t.co/bav276oSgn #HR,0
4999,Anyone know where they are hiring ??! Need a new job I hate mine already I have to patience for my GM !,0
6115,Bird Becky in ARDEN NC hired a local Wedding DJ. Register FREE: http://t.co/pyEYYIjpOx #Wedding #BrideToBe #Brides #BridesMaid,0
8150,Currently exploring job opportunities. If anyone knows of anything please let me know.,1
4455,Well shit i needa find a new job anyone know any hiring???,0
9448,Today I am essentially a rich housewife. Went to the gym shopped got my nails done and went to whole foods. I dont hate being unemployed,1
3189,Well my life has changed again. I was laid off from my position yesterday due to sales has decreased drastically... http://t.co/NtesFPKvky,1
2217,Have you seen my mid-week video? I decided to vlog whilst unemployed! http://t.co/HrrU0wdnx7 #lbloggers #crazybloggers #bdib,1
6445,Go hard for a boss or get laid off...,0
9192,They are keeping me unemployed and forced me on medicare to make me appear to be crazy and uneducated,1
7613,Here is your opportunity to make money free tour lets you in the back office http://t.co/V4Eh4ORSy5 #work #workathome #payday,0
7371,See my answer on @Avvo to: Can I claim unemployment if I quit due to stress and cause for conc... #unemployment http://t.co/pIdKFqg8Nb,0
18,jesus christ: recently laid off tesla employees are publicly thanking elon musk after losing their jobshttps://t.co/l3JQBXqnNy https://t.co/iEV5xNDX3r,0
5368,I am getting this job as an intern got my rotation I wanted got elected a prestigious position and am doing well in school!,0
4872,Anyones work hiring or know a place that is hiring ??,1
8179,I need to be sleep got to work 8am-4pm then other job is 5-10. Smfh.,0
4159,Im currently unemployed and Im not going to school till Jan I can literally chill all day,1
9378,Looking For Entry-Level Social Media Work? 5 Tips To Get Hired http://t.co/LICfNcWh9D,1
3323,Apple Hires Burberry CEO To Improve Customer Experience: Earlier this week it was announced that Apple hired Burberrys CEO Angela Ah...,0
7918,When I left tonight my manager said to me dont quit jokingly and I just thought bro just dont fire me first at this rate lool,0
6257,The Honest Company posted a job you might be interested in. QA Automation Engineer - Greater Los Angeles Area U... http://t.co/hodyLuVHUG,0
7902,Another new hire quit. The rate of retention sucks here so either Im tough  good  desperate or a mix of all of them,0
2325,I will never understand unemployed people cause Ive NEVER been without a job.,0
5309,Im at party in LA and ppl are asking me what I do Im unemployed loser baby but Im saying cartoonist hehehehhoohohohhaha :o),1
8221,A writer understands his work as something that originates with him but then with any luck gets away... http://t.co/CyHLlENS,0
9392,GOT THE INTERVIEW IN THE AM I HOPE I GET HIRED ON THE SPOT CAUSE I GOT CAUGHT UP WITH MY UNEMPLOYMENT THEY FOUND OUT I WORKED FOR 6 HRS LOL,1
912,I applied for a job position and surprisingly I got a call back today ya girl is making moves,1
1244,Once you find agency opportunities you are interested in contact the agency to find out what paperwork is required to bid for the contract.,0
2095,Looking to relocate? Join PepsiCo as a Sales District Leader - Designate. Apply: https://t.co/YjsNFaLOQ3 #GetHired #Career,0
9099,@hollak77 @cneesam i actually got hired at one in madison and then laid off before my first shift so that was nice,1
599,Has anyone else hired a professional deep cleaner? https://t.co/CbI0GfvLoQ #clean https://t.co/ZNX8hBjCz8,0
4007,I recently hired a personal trainer. Because I missed having a man in my life asking me to pick up his dead weight. #ikid,0
2051,Looking to hire or be hired? Check out our job board for all your employment opportunities &gt;&gt; https://t.co/n5Odyl7Bvs,0
7537,I am currently unemployed. But I do wish both teams and teammates the best of luck and injury free season https://t.co/l0NwPJOM3L,1
5091,Im gone have 56 hours on my first check at my new job .,0
306,i got paid today and i didnt even know i was getting paid IT WAS A GOOD DAY,0
4395,I am unable to quit as I am currently legit.,0
8364,So I got laid off this week. Company I worked for is going under it seams. I hate change  but change is probably the best thing right now.,1
3394,So does Rutgers actually do employment background checks or do they just hire whoever?! And the persons hiring should be fired too!!!,0
74,I Just Got Laid Off … Now What? http://t.co/gqVcv99got #jobsearch,1
2200,Today I became unemployed.   Please visit http://t.co/zH0tVlyhdv and let me know how I can help your company,1
2587,Jesse Sorensen claims that Dixie Carter is a liar and fired him after telling him he would always have a job in TNA. Thoughts? #RumorTalk,0
2240,Last summer I was making 300 dollars a week now Im unemployed and probably -$600,1
9250,Strong developing background? Senior Java Software Developer Position available in Boca Raton FL http://t.co/8Hcaa13ndv,0
5845,Now hiring: someone to stand near me whose sole job is to swat Mosquitos!!! #plague,0
2399,Does anyone know anywhere thats hiring??,1
5447,So earlier this week I was joking about getting sick so I wouldnt have to go to work and now im actually sick,0
8762,Looking for the best way to create new business? Lead Generation is #1 http://t.co/3gAqPcQehB #LeadFlash #LeadGen #LeadGeneration #Affiliate,0
499,I GOT FIRED FROM MY JOB so now I have lots of time to read books and make smoothies and think hateful thoughts about my former employers.,1
3502,Got another 2 interviews this week but i really think i got this position i really want as a substance abuse counselor. Patiently waiting,1
7741,I am currently a vegetable. No joke.,0
4188,Just finished my last day at work after 4 years. I am officially unemployed,1
1208,Yesterday I was laid off. Today I played with my kiddo talked with a TON of people am sprucing up my resume coffee meeting at 2. #islay,1
9134,I pretty much got laid off because the manager didnt do his job of calling me and apparently I missed two shifts. He put that on himself,1
6294,Manager got on my ass cause a customer got mad earlier..Nigga I quit in a week anyway!Fuck out my faceee ! lol,0
7180,Looking to invest in private equity w/ a self directed ira? https://t.co/5y1gRAEDzh #selfdirectedira #privateequity https://t.co/ycY3H1enaj,0
2694,#Columbus GA #Retail #Job: Retail Store Positions at CVS Health https://t.co/tG9OZatDVl #Jobs #Hiring #CareerArc,0
2212,Being unemployed is not good for me. I thought today was Monday.,1
5685,I got sick &amp; hospitalized w/ no insurance got laid off. am recovering still on the road to recovery while job hunting AGAIN @BarackObama,1
5960,Motherfuckers fired me for stupid shit,1
4812,I am seriously thinking if running for office as a broke unemployed shlub. I have more in common with average people than millionaire twits.,1
900,If you are searching for a job or internship follow my feed. I will do my best to retweet all positions that come my way.,0
9410,#EverydaySexism Constantly not being hired for jobs because I am a mother has become worse now that I am a single mother.,1
81,Got hired and unhired because I tested positive good morning,1
9440,Got complemented on the accomplishments of my widely duties today. Day number 1 as an unemployed housewife: complete.,1
758,Interested in a new #Mobile #Applications job? Its your lucky day! We have more than 37.7K open positions here: https://t.co/VWu9on7N6M,0
2340,Now I am actively looking for jobs in Manhattan and uggh I hate looking for jobs,1
6916,you might get fired and you might not be able to get a job just because you think this and that about their religion! this stupid attitude,0
4154,I am currently unemployed. Temporarily but still very strange feeling.,1
4863,#unemployed How to keep a great attitude 85%+ of the time during unemployment? Feed your mind and spirit with positive stuff. Avoid drama!,0
5689,My job laid off 600 people at hospital. I am scared hours decreased. I am ultrasound tech. Hard to ~ https://t.co/JI2GIUFoO2 #pray #prayer https://t.co/WYzcnmtGVl,0
7029,So i lost 200 dollars today from a transaction at work... It is lit..,0
4611,Today I said fuck a job and quit.,1
6599,One of my friends/co-workers got fired today &amp; as I was going through a car wash thinking about it. The worker there said pray for him. Amen,0
5252,I have *TRIED* to take on the white feminists and misogyny within social justice movements and here I am unemployed being told to keep going,1
3367,Steven just got hired for a job he didnt apply for but I applied for a job and got fired in a day,1
4801,I #need #cash #fast but i am unemployed https://t.co/j8o355OMXz,1
9464,I cleaned up my house today because being unemployed I have no excuse for how filthy it was.,1
8220,A lot of people are like you when theyre drunk. What are you like? -a coworker,0
8391,I didnt get fired I was laid off. But you Wudnt no the difference.,1
3105,yesterday I quit my job &amp; today I spent all day riding roller coasters,1
1015,Interested in a #job in #Irvine California? This could be a great fit: https://t.co/fNCxRBzqk8 #NowHiring #GetHired #IT #Hiring,0
5772,Being unemployed (sorry a small business owner) has afforded me the time to do exciting things like put salsa in my scrambled eggs.,1
3571,Im tired of hearing Obama Care this Obama Care that Im tired of hearing a bunch of phony numbers about jobs unemployment etc. (Cont).,0
2697,#Fremont #Job Retail Sales Associate (part:time) Job - (fremont california): Req188916BRPosition TitleRetail ... https://t.co/pj5yfJkNCS,0
8410,@eight_oh_eight I wasnt fired I was laid off but you wouldnt know the difference!!!,1
7660,New job have being laid off for 9 months!!  Work is tiring!,0
7703,I have been laid off for two years.I need the Lord to help me find a source of income.In Jesus name A http://t.co/BW12CkiOK5 #pray #prayer,1
8588,Unemployed or Know Someone Who Is? Latest on Benefits Debate: A look at the current debate over the extension of... http://t.co/NSjpNyKVIn,0
9215,8th day being unemployed I think some fabric tore inside of my leg fuck my life,1
1536,Apple rewards CEO Tim Cook with $58M for bang-up job on Wall Street: Apple CEO Tim Cook earlier this week was... http://t.co/yXt9VhVTi2,0
8778,Looking to start a new career? GIS jobs to grow 20% over next decade. Check the AUM GIS program. http://t.co/9T04gn1hlh. #chooseaum,0
3460,Do You Hire A Previously Fired Head Coach or Up And Coming Assistant Coach? Discussion Thread - http://t.co/PxeNDb8AXg #titans,0
5910,My new Job site has 4 floorsa Elevator and a pool https://t.co/D0W7wLa1l6,0
1294,Heres a solution to those PhDs getting by on 3 part-time teaching jobs for 8 years. Quit. Do something else. Quit being exploited,0
4745,Anyone hiring...I really need a job. I am so tired of getting screwed over and stupid people getting picked over me.,1
5072,So my manager got fired from my job making around 30000 a year and now hes getting paid 80000-120000 at his new job #blessingindisguise,0
2712,#Job #Baltimore Seeking __workers/ Assemblers/ production type Position ~$21.50-$21.50p/h: We are seeking 26 m... https://t.co/BX8eoUKEAJ,0
6112,@yeshireda godddd yes lol in the summer its so humid and hot,0
3763,Looking for a #Adjunct #Position – ​Principles of Marketing #jobs http://t.co/7U5AhGKDtN http://t.co/Mc4bIS0vxx,0
8541,experienced the most uncomfortable video chat job interview 2day but I got hired aka now I dont have to shower today,0
4569,@GameDiviner @CHOBITCOIN @Yeefi @SKScarbine45 *salivates*You know I still havent fired a true WW2 battle rifle. I fired a Thompson and,0
9505,20 years working a job get laid off. Now its back to beginning,1
4233,My boss fired me Friday and is now refusing to pay me for the hours w: I work in a private home doing care for... http://t.co/8UjRkVTu0J,1
7897,At my job I recently quit they suspended you if you even look at yo phone lol,1
2105,Searching for #work in Andover MA? Send your #resume to Pfizer Korea Inc.. http://t.co/8PCDPg9Dxr #gethired,0
8490,My day is of to a good start just got called in for a job interview tomorrow,1
2983,Weird state of my life. Yesterday I was being interviewed for a position today I was interviewing people for a position.,0
6680,Well I lost my job today because of some bullshit so if anybody know somewhere that is hiring hmu,1
4184,Can anyone direct me to a job? I am currently unemployed and every job I have applied to has told me im not qualified. I have two college,1
3230,Hi guys. I officially got laid off today. Send beer. Thanks. Also please hire me.,1
6412,RT @billboard: At least 10 employees of Capitol Music Group were laid off late this week https://t.co/llNhGKlC7j,0
2152,Searching for #work in Warsaw IN? Send your #resume to Ivy Tech Community College. http://t.co/LWP93OYNuc #gethired,0
5836,Any of yall niggas hiring ? Im quitting my job,0
3741,Looking for #faculty opportunities?  #kstateHFRR has a position open as an Assistant Professor (5276): http://t.co/mAyx2sArNJ #agjobs,0
7451,Im officially unemployed today. :-( I did not get fired but the contract with my school ended today. #unemployed,1
168,I got a raise today then showed up to work 30 mins late..,0
4538,#viral Fox Sports Reporter Emily Austen Fired After Insensitive Comments About Race... https://t.co/7OvnhO0cxY https://t.co/QPBwQrisTf,1
8365,I Got Laid Off from My Dream Job—Heres What I Learned: From Marie Claire In 2008 I got laid off from my fir... https://t.co/sH30N5e1dU,1
7366,My journey has been from Quite a bit of arson to poor strippers to Look the fuck out to Unemployed artists https://t.co/FPb6XsIk4n,1
8136,My mom wants me to get a job but bitches that I cant bc I have appointments. Currently forking my eyes out,1
8710,Looking for a chance to network with UF faculty/staff and dynamic student leaders? #MeetUF https://t.co/MkOAzYNUhT http://t.co/ouMj7sjCGB,0
3020,I recently started getting up extra early to find more time to prepare for the day (i.e. working out meditating etc.). Its really helped me kick start the day amazingly! https://t.co/paYEUhpVRm,0
6869,You mightget warnings and write ups can be late for work  And not get fired Only take me one time and I get fired,1
3383,#Uber fired more people for worse reasons and rehired them back yet wont rehire me for being choosy &amp; actually wanting longer trips #LOL,1
4783,One reason I am unemployed is that I will not settle for just a J.O.B &amp; at age 45 w/my background the right opportunity will find me!,1
9457,Been unemployed since December. Not a single interview or call back. All of the sudden this week Ive had 2 phone interviews! #hireme,1
7344,I am now the lowest paid manager at work. Time to quit.,0
4478,Anyone know a place thats hiring?? #needajob #asap 😁,1
1197,@LetGoBeFreeDoU.I know I got laid off not fired but w/ all those office jokes I do here abt getting fired really shows the irony in life.,1
8613,Anyone hiring young people? Were getting a little P-Oed about hearing about jobs and not finding them. #unemployed #youth #collegegraduate,1
4841,You ever tweet so solid you put it on your resume? HAHAHAHA Im unemployed,1
9510,First thing I am told upon my return to work: Youre laid off next week.Great...Now I have to burn another 5 days of holiday pay. fml,1
3097,Today I quit my Sunday job... Need me a day off dammit,1
4465,In desperate need of a job  anyone know of any places that are hiring ???,1
4481,I want a job so bad  whos hiring ???,1
5397,Anyone Trying to Quit Smoking? http://t.co/XByKAA3u9N,0
5549,Or always be laid off RT @CNNMoney: Go to law school. Rack up debt. Earn just $62000?? Yup.http://t.co/VBjsX3H9uy http://t.co/vn7HIAdHaN,0
2521,Looking to become a student leader? Organizations within @LSUCampusLife have several open positions for the 2015 calendar year!,0
9237,Looking for a part-time or seasonal position? The Underground Movement is hiring!  https://t.co/CBVeG6K1qS,0
1420,Unemployed Under-Employed Unhappily Employed? Find #jobs &amp; career solutions on #LinkedIn in the Job &amp; Career... http://t.co/yxLgi683Wn,0
5046,Yesterday at a work bbq my new boss earnestly asked me if I was married and I laughed in his face while eating cake am I fired,0
909,I got offered a position at an artisan cheese and wine shop today hehe how fun,0
8200,@Thad_CastIe: When someone reminds the teacher we had homework http://t.co/kpTpzrqEAt,0
4501,Ummmm anyone hiring ?? Need a good paying job asap,1
5430,I got fired wednesday now I have orientation wednesday look how God works.,0
2991,So I recently started work for a pet boarding/doggie daycare and someone was REALLY fucking happy to see me this mo… https://t.co/GDPFizGxUw,0
5013,I Lost My Job Now What | How It Feels to be FIRED: http://t.co/nqiwiKQlc5 via @YouTube,1
1396,Are Unemployed Doing All They Can To Find Work? http://t.co/yn3vCGbFLd #jobs,0
1519,Ive recently started parking on the 5th floor in the parking garage at work and I take the stairs. By recently I mean this week ;)!,0
7138,Now that Im unemployed for the first time in two decades its time to start focusing on my true love. Becoming a Patent Troll.,1
8449,I am job searching for: Work at home jobs! http://t.co/4tgcXWg6JK — Walker Inklebarger (@Walker_marocliv.... http://t.co/1xsVyjqnJg,1
3310,I got fired today bcuz I didnt feel like working and I dont even care.,1
6693,Two people in my job position were let go no ones safe so that means job hunting for me,0
8996,RT @arrowt: If anyones company has any Windows/UNIX/data center positions open let me know please thanks. (I am getting unemployment so.),0
2701,#Hiring: Receptionist: Location : Lakewood Ranch FL USDescription: The primary function of this position is to… https://t.co/LB2Tible2M,0
1281,I have disability case I am not working i well have to wait 18 month before my case herd in court but mr Obama paid millions in destroying,1
5262,I think at this time in my life  Im ok with being unemployed,1
5658,Just heard someone say I wish I could get laid off to get unemployment.... You should be grateful to have a job.,0
6400,The lady was like you said you were fired but it sounds like you were laid off me: Ok but those terms are so subjective and no one seems to know what they mean really Her [paraphrased]: You were laid off get your money,1
4971,Any part time afternoon jobs hiring ???,0
5732,First day of being unemployed and it feels sooo bad. I needa be on the go,1
4556,@BlueberryBatman this has backfired big time. lol,0
7454,I am now dancing at my desk because Stay the Night by the Millionaires just came on if I get fired you know why.,0
2542,Looking for a new view? Seacoast National Bank is looking for a Support Engineer. This position is more geared... http://t.co/SeuDvW2OVd,0
1052,Currently at work then gotta go straight to my 2nd job! Excited!,0
208,Today when I got off work I could not find my keys ANYWHERE. &amp; since I worked at an event I was scared I lost them there,0
4463,Anyone know of places hiring??? I want a 2nd job! Im money hungry.,0
5882,Heres a real WTF moment is Canadas cannabis legalization. You can get screwed by potential employers for QUITTING and being honest bout your medical use--despite Canadas laws!Canadian Man Loses Job Offer After Disclosing Medical Cannabis Use - https://t.co/ISZB9UVrn7,0
1788,I am currently hating my existence.,0
135,whats funny is the job i had today wasnt even mine the guy didnt show up at all i just took over &amp; the designer hired me #blessed💃🏽,0
4176,Im currently unemployed,1
2346,Anyone know of anyplace hiring?¿,1
7392,Wow the @VanityFair rules for smoking weed are awkward and quite unfriendly. Bongs are the sound of unemployment? You need new friends VF.,0
437,Im going to quit apo-people who dont actually quit apo,0
8003,Job opportunity: Payroll Administrator. Are you a fit? in Cambridge MA http://t.co/0OBom94gkC #unemployed,0
2661,Did a Big Law partner get fired for supporting LGBT Causes?   https://t.co/3Ih1uH3OwF,0
4886,Anyone working in a bar/pub that is hiring?,0
362,I am looking for a PR person or company to work with for my upcoming Book and Gallery tour. Looking for any... http://t.co/lj2Tj6Z1tK,0
2218,I am now unemployed and that feels weird.,1
5741,Been unemployed for a long time? Heres how to explain it to your interviewer https://t.co/IY90OJ2dvS  via @MONEY,0
3920,#Adjunct #Instructor - Communications needed in #Richmond at Bryant &amp; Stratton College. Apply now! #jobs https://t.co/AVNYYaqH6Z,0
6241,Cisco posted a job you might be interested in: Finance Business Analyst (Business Operations Japan) - Within 23 wards Tokyo Japan JP.,0
3866,oooOOoOOOh a girl with purple hair a giant sweatshirt on a dirty street with graffiti and alcohol wE CALL THAT UNEMPLOYMENT NOT HIPSTER,0
4732,I am now 110% over my work day.,0
4877,Anybody Hiring?? Quick Learner! I put heart into my work! I have applied to so many places and continue too! I am reaching out to everyone!,1
6414,RT @omglazerkittens: In case you didnt know I was laid off this week. However I already have some contract jobs lined up and am looking…,1
1417,Unemployed Under-Employed Unhappily Employed? Find jobs &amp; career solutions on LinkedIn in JCD The Job Seeker &amp;... http://t.co/P7tLPmcrn7,0
1407,Seeking Employment Opportunities/Underemployed/Unemployed? Be Your Own Boss! - Register now http://t.co/RrG1tTKE1g http://t.co/PFetXsLoI5,0
9554,Anyone looking for a CFO position? http://t.co/AhzlCvBkCM,0
9127,I wasnt fired from my job I was laid off but you wouldnt know the difference!!,1
2863,Well I guess technically I work for Obama because he gives me that unemployment check every 2 weeks,1
6077,5 Steps to Getting Hired at The Perfect Company for You http://t.co/wbuEVOS8tM via @MarkSBabbitt,0
4728,Having nothing to do on the last day of finals while friends are in exams/work all day must be what grown-up unemployment feels like,0
7193,Looking for a new job in 2015? 6 things to do before you quit: Here comes 2015. You know this is going to be y... http://t.co/ebZPvvbOQG,0
8334,Im already hired at my new job just waiting for my background check then Im good to start😌,0
4808,I have been unemployed for the past 5 months. Today there is a solid chance (I hope) that I might be offered a job. Should I negotiate sala…,1
2044,Looking 4 a job or internship? Wildcat CareerLink is your resource for #internship &amp; #job searching. #GattonGetHired http://t.co/WILSuWLQYz,0
406,#Job #NewJersey Community Director Bergen County Area: NJ-Pine Brook Position Purpose This position will impl... http://t.co/EbNuCzFaeP,0
7242,I Quit My #Job To Be A Travel Writer And Now Im Broke And Unemployed https://t.co/67smVjPL7C https://t.co/VWamgwWcJG,1
7333,nothing says unemployment quite like a psychology major.,0
1055,I am currently in the job market want to help me network to find employment? Share my LinkedIn profile! http://t.co/6TknMV94sn,1
