id,text,class
2466,Job Seekers heres a great way to increase your job interview rate and get hired faster https://t.co/6QQFFjnWNR https://t.co/G7kJTF1ldm,0
3182,I am still waiting to see you put how many people you laid off while CEO of HP on your website @CarlyFiorina.,0
5235,Might be wise to explore another income stream......because eyan le get laid off any fuckn time.,0
6721,Well I injured my back at work in June. My RN position was posted at work. Not able to work. depression is severe just dont know anymore,1
1971,I make more in one week working as a waitress than I did when I worked at spotted cow lol so glad I have a new job,0
2941,1 year today Ive been in a supervisor position. Toughest work year of my life but I got through it and learned a lot.,0
4005,Working with my GM today for the first time since I got hired 8 months ago... Killing myself.,0
7131,Looks like Im unemployed again lets see if I can beat my record of starting a new job in 4 days.,1
3306,Ahh first time i get fired..after like 20 jobs of never getting fired i did today lol and somehow i think its funny lol ohh well,1
1076,am looking for a job i lost my job due to the misunderstanding btwn me and my manager according to the increment of my salary,1
3646,My co-worker at my new job just messaged me on facebook how did he find me.,0
2339,Unemployed for three months constantly submitting applications and nothing... Now I get two job offers in the same day wtf,1
7435,Wyoming car salesman drew penis on his business card gave it to woman. Fired. Can’t draw unemployment,1
2618,Fired From A Job? How To Explain It To Future Employers http://t.co/avA7lJrfFo,0
2959,My landlord propositioned me today. Im disgusted. I wish I could afford to move.,0
5343,if any of my friends are also unemployed rn just letting you know there is a gravedigger position listed on craigslist,1
3608,Well currently unemployed job hunting.  It sucks . But on a good note Im alive.,1
1714,Welp.  Laid off again.  If I do such good work whys no one wanna keep me around?#unemployed,1
3333,i got fired again today by Alex English. usually happens once a week. today ill bring him lukes lobster so i can get re hired...,1
4016,#ppc Started a New Job Working for a PPC/SEM team: I was recently hired on as an assistant for a company... https://t.co/DmXdITkyjK #seo,0
3048,Son being at the mall gets me hype to start working again.,1
9502,Only 14 more days until I get laid off from my grossly underpaid job and transition into unemployment that will be even less . Oh yippeeeee!,0
6570,Got fired today...looking for a new job,1
5702,Please pray that God leads me to a full time job. I was laid off and am not receiving responses to my http://t.co/R7QDi3NFx7 #pray #prayer,1
7896,I recently quit smoking (3 weeks clean now) and I did it because I needed a new job howeve… http://t.co/45LHs6wzNO http://t.co/9ViEl9UMKA,0
9222,RT @jdh5484: @RepWebster Lost my business. Now unemployed. Please sign the discharge petition to #RenewUI .,1
4288,# unemployed 😔,1
2334,Ive been unemployed now for about 5 days...I am not about this life #ineedanotherjob,1
5473,ANYWAY i woke up 40 min late for work i hope they fire me,0
731,If a potential employer were to Google you would you be offered the position?,0
2741,#Job #Lexington Assistant Professor: Richmond Position Summary The Department of Psychology invites applicatio... http://t.co/FflRyzRyFq,0
1524,I recently got to work at a camp for the Phoenix Day School for the Deaf Had a great time!  #whyIsign! #Wednesday https://t.co/EmGbNNRYC1,0
7230,I shouldve waited to quit and got unemployment,1
3257,Seeking a Maintenance Superintendent for Coal Fired Power Plant. Please call: 800-533-7977 x3 or email: dbeken@thinkingahead.com,0
2769,I worked out in the morning and I got off work on time. I got time today,0
5736,I quit my job before I had another one lined up!Heres how I made it happen. #work #unemployed https://t.co/7b8yOUb0Tk https://t.co/laFjf0rxKr,1
9285,Maybe you or someone you know might be interested in the attached position ...,0
2100,Looking for a new way to hire or BE hired? check out http://t.co/UU5ax8MLHb to create an @myzumay . Fire your #resume ! #jobsearch #jobs,0
4997,Anyone know of places that are hiring?????? #needjob,1
9493,Got invited to a corporate open bar Christmas party for one of our partner companies... Pray for me I may become unemployed. 😅,0
4981,Anyone hiring? I need a job...,1
5042,In the past 2 weeks 2 people got FIRED at my new job #help,0
4814,I resigned a few days ago. Technically Im unemployed lol,1
3601,I am going to #tweet about my #unemployment until I find a #job I am from #LosAngeles #California living in #NorthCarolina,1
1315,You might be tryin........But the question is how quick do yo quit???????,0
5410,I went into work 3 hrs late the other day please dont fire me,0
3878,Wait masturbation?? Whos suffering there?? Making class discussions awkward is my job.,0
7521,I Am Unemployed And Need Cash Now http://t.co/5xHQ54RmEp,1
2822,Today was shitty but I got promoted @ work and got a $2 raise so now my shitty day is a whole lot better,0
4639,Ima quit my job today &amp; try to get hired back again tomorrow 🌚,0
8928,Laid off via text message?! Read on for the best and worst hiring and firing stories from 2012 http://t.co/m1C19WNi #hired #fired,0
1162,Well today just became the worst day ever. Got laid off my job due to budget cuts. #BrokeAsAJoke,1
6226,I am Charlie Brown. LInkedin is Lucy. The jobs you might be interested in is the football.,1
4643,I quit a job today &amp; got two other job offers 😏,1
9167,got scheduled for work cant find coverage but will still be in DC this weekend...pretty sure Ill be unemployed this time next week #fired,0
8211,@kay_alise: I just go to school work and mind my business.,0
97,I just got hired and today is my first day and I already really dont wanna go to work,0
8644,Anyone know who is hiring? Still unemployed stressing me out :/,1
6557,I got fired from one job today &amp; hopped on another job today &amp; start tomorrow man god is good. #bless🙏,0
1359,Interested in this job? Take a look: Private Equity Associate- Pre-MBA in Connecticut http://t.co/IAdZ6JRqEO #job,0
7165,Some shady shit went down this morning with at my regular freelance gig and now there are a lot of unemployed pissed off editors out there.,0
4986,Anyone hiring???I need a job ASAP,1
8163,Currently getting paid to sit poolside drinking coffee and reading...my job is awful,0
2072,Looking for a career in Advertising? 3 Tips for Millennials Trying to Get Hired http://t.co/qs2ckM129L #HireMe http://t.co/oh2S7Ofi1L,0
4194,I am unemployed for the next 72 hours so Im getting weird.,1
4800,RT @womenbiznetwork: Ready Set Action! Searching for a New #Job http://t.co/AM52tdIj51 via @ItsJustTami #unemployed,1
6506,I am actively seeking a position in Customs Compliance. Please contact me at senta.schreiber@gmail.com.,0
519,Welp it happened i have 4 job interviews on the table after 2 weeks of getting fired.  Wow thats amazing.,1
3826,And.... Now Im unemployed.,1
1749,I hope my husband at Cat is laid off instead of bumped down to $13/hr. Make more on unemployment...,0
2470,If you apply for the job and the job hires you do the job you applied for! Simple equation-apply= interview = hired= work = paid!,0
5249,Baby Im a boss and yah man unemployed,1
3594,Minimum wage is now 10.10?!! Now I just need a job for the summer...,1
7164,And now Im unemployed,1
7499,RT @dontsave: just wrote a program that updates the drop shadow in my avatar to match the time of day. yes i am currently unemployed,1
8561,My board broke today and I lost my job.. Life is going just great right now,1
6781,College athletes or unpaid workers? http://t.co/xwyIswR498,0
2010,First time working by myself at this new job,0
7761,I am currently suffering brain damage.,0
4074,Got hired today  get my braces off tomorrow .. Ok April good shit,0
6956,oh I just remembered when the movie theater fired me 2 months ago I forgot to clock out,1
4830,Are You Unemployed? Want to Learn Social Media while you are looking? http://t.co/IfyM43hF3f  Earn while you learn,0
3016,New girl started working at the restaurant on FRIDAY and is already tryna get my Wednesday shift like I dead ass will cut this bitch,0
2129,Searching for #work in San Francisco CA? Send your #resume to Skyline Recruiting Corporation. http://t.co/h4CgEvXqra #gethired,0
9419,Man i hope i get hired bruh. I just wanna work hard bruh.,1
7031,Today I broke my work badge in half and dropped a co-workers badge down the elevator shaft. So Im buying a #Powerball ticket. Or 12.,0
1355,Here quite possibly might not be anything that pisses me off more than someone doubting my integrity and/or my work ethic. 😡😡😡,0
7144,I was unemployed for less than two days. Quit my job monday,0
4236,my manager just called me to let me know Ive been fired https://t.co/hpJM91JvNf,1
2026,@tiitlefiight they fired me that day and then rehired the next,0
7,So I was laid off today (1 of 3 employees)..... But this right here makes me forget how much this… http://t.co/BbUMa7rB5L,1
1968,Ive now spent my night scrolling through about 800 job listings applied for about 20 or so. #Fingerscrossed for new life in my #jobhunt.,1
7115,NOT TO MENTION THAT I JUST CHECKED MY WALLET AND SOMEONE STOLE ALL MY MONEY LASTNIGHT WOW THANKS FROM THE GIRL WHO IS UNEMPLOYED.,1
7294,So i got fired today lol,1
5291,I have been living my best unemployed life all summer long,1
7209,Looking for a job in #Mesquite #TX? Veterinary Assistant https://t.co/FEsGeJzlp1 #jobs #hiring,0
2760,I am Looking for work in fixing #computers or #security #jobs.https://t.co/Bm4FAwHaSz#Oakland #Bayarea,0
4660,I just got hired at TGIF at the Rim and I already wanna quit and get a job at BJs at the Rim lmao,0
7500,I am unemployed.,1
5197,Are you laid off from the coal industry and interested in a career in utility services? Eastern Kentucky CEP and... https://t.co/iAi6ROUQxj,0
3035,recently started working out now im feeling a pulling pain on the muscle right next to my armpit when lifting my… http://t.co/HFjYwnj4Qh,0
6429,Fuck Man bought my phone then 2 weeks later get laid off from work and I got one month until the next bill comes! Agh damn!,1
7408,Listening to my daughter describe what she thinks my unemployed day is like is actually quite depressing.,1
6676,today was horrible lost my job got banned from xbox live and i have no clue why living off hope right now because negativity gets me nowhere,1
1703,everett says: I was laid off in Aug 2012 with the intention of not filing for unemployment but still dont have... http://t.co/FY6ZiAEs,1
7728,If anyone in the NYC/Westchester Region hears of a IT tech position my very good friend has been laid off and needs a job. DM me for info!,0
9208,Everyones laughing at my festival tweet but really I wasted 20 dollars. Guys Im unemployed I dont have much money you dont understand.,1
7328,My coworker told me today that I should be fired cuz I dont like coffee ?????,0
5079,I been out sick for like 4 shifts in a row... Im def getting fired 🙃 time to look for a new pt job,0
9475,today was my last day at work... not too excited about being unemployed again but cant wait to see what opportunities are out there,1
7285,Today I was fired from my job bc I had to take time off when my grandmother died. This has been irrefutably the worst month of my life.,1
6945,I was fired from the Orange Juice Plant last week. I just couldnt concentrate.,1
23,I wasnt fired I was laid off! You wouldnt know the difference!,1
9540,Anyone in (or know someone in) Manhattan looking for a Visual Designer position? https://t.co/OBd15R0j5S,0
5028,My old job hired my best friend and then 3 days later fired me for using my cell phone. I found you a new employee then you fired me lol,1
539,I was an hour late on Friday and now Im late again today wow Im so fired,0
7884,My boss just pissed me off to the point where once I get my new job Im quitting immediately.Fuck this 2 weeks bullshit.,0
9017,RT @Afromighty: Yo @linkedin What do you mean Unemployed as Fuck isnt a position?,1
721,Iowa Supreme Court says a woman can be fired for being too irresistible. I am unemployed. COINCIDENCE?!?!,1
1548,Got fired from my morning job. Oh well Outback has my heart anyways.,1
9181,Today is 4 years at my job!  So much has changed since then. I was unemployed horrid cold and in my last apartment.,0
8732,I was at the craft store earlier this week...I was compelled to make giant eye balls with Styrofoam balls and jar... http://t.co/rcyQNZD3ny,0
8487,I was filling out an application today and a guy from at&amp;t asked if I needed a job bc theyre hiring and I said yeah they asked how old I,1
8604,Anyone in #NYC know of places that are #hiring? #NY #Job #unemployed #help,1
8735,Who else is fired up about only having to work Monday &amp; Tuesday this week,0
628,Whos getting hired? Whos moving up? Our latest Denver People on the Move: http://t.co/LL9lCm5rLc,0
9213,Unemployed and my fucking car just broke! Fuck today. Fuck it all.,1
7985,I got jobs for you unemployed hoes that may be interested.,0
3625,Two years ago I was fat unemployed and not in school. Now I got a degree have a full time job and am pretty as fuck. What you got now b?,0
3848,Ive noticed that there are alot of unemployed rappers on twitter! I do what brings home the bacon. I rap because its one of my talents!,0
854,@ravenbones_ yeaaaahhh tho that was a few weeks ago and im still unemployed.....Its for an ice cream place like 10 minutes away,1
7096,One upside to being newly unemployed is I now have some time to sit in the sun and catch up on my reading. #artofwo… http://t.co/mawCRcMcsD,1
5767,so about five hours worth of money made at my previous jobi kinda hate being unemployed a lot,1
9261,LinkedIn why do you have a jobs you may be interested in section when theyre actually volunteer positions? #unhelpful,1
5602,Does your company/school need a trainer? I am currently looking for a training position in the greater Philadelphia area. Im quite decent,1
7361,I am officially unemployed. Feels weird. I dont quite believe it yet.,1
4407,Currently have 2 jobs but havent been to one of my jobs for 3 weeks now. Why couldnt they just let me quit?,0
1021,Interested in a #job in #California 20005? This could be a great fit: https://t.co/P1olM6R1xG #NowHiring #GetHired #Hiring,0
8790,Looking to buy a house for a 50% discount of fair market value? We fund em #HUD #Housinghttp://t.co/CocoR9GpYA,0
3109,I quit my job today I feel good about it,1
2213,I am on month 4 of being unemployed and I only JUST figured out the perfect configuration of couch pillows-throw pillows-hot water bottle-laptop and I am equal parts thrilled and inconsolable that it didnt happen sooner,1
5776,my #1 ❤️  has been unemployed for 3 years &amp; he just started working again &amp; took the day off to watch me play 🙏🏼,0
4306,Being single and unemployed is the best feeling in the world. I dont want this to ever end &lt;3,1
5724,Im raising money for Single Mom Laid Off. Needs Rent.!. Click to Donate:  https://t.co/JZOHjKvQjS,0
2884,Now that Im unemployed I have no reason not to clean go to the gym do homework tan... but I sit here on Twitter &amp; Tumblr eating... hm.,1
512,I got fired from my full time job by my part time job manager wtf...,1
4427,Currently living off a credit card... Not quite where I want to be #college,0
9105,Work laid off 100 employees today. Hurts. Very good people affected. I survived but it gives me PTSD from when I didnt 2 yrs ago this week,0
9465,Im probably top 5 today in the distance driven to get Jamba Juice (unemployed) category,1
5278,Now that Im unemployed by NFL I need to know is bum fights still a thing and whats the payout Last time it was creepy oral sex Ina dumpster,1
6959,Niggas at work probably think I got fired lol I been gone all week,0
766,Job Opportunity -  Are You Interested in an Administrative Position? in Las Vegas NV http://t.co/R3dnucUiIk #job,0
8226,As my artists statement explains my work is utterly incomprehensible and is therefore full of deep significance.,0
863,FYI I love Psychology...I am just poking fun at my profession technically Im an unemployed nobody.,1
8650,Bosses left on vacation on friday.Since then I havent gone to bed on time havent gotten a lot of sleep and been at work beyond my hours.,0
5395,Well I just quit my job... So anyone know anywhere hiring?,1
4765,I am opening 4 commission spots at half price since I am unemployed. $25 each for pencil &amp; inks single figure! Email tweet or DM me!,1
5823,Can you recommend anyone for this #job? Store Team Member - https://t.co/WXnjQCrkH8 #Retail #Mesquite TX #Hiring,0
8357,So I just find out about 15 ppl got laid off at my job smh guess its time to start looking,0
9391,lies down and cries because i was hired for my first full-time job in my field almost 2 years ago and now im working 2 day jobs i hate,0
1375,First-time job seeker currently unemployed or looking to change career paths? We have a FREE service to help! https://t.co/DNV5iwbNgn,0
9491,The biggest decision Ive had to make today was That 70s Show or Friends? #unemployed #hireBecca,1
6541,Got hired and fired from the same place 3 times. They cant figure out if they love me or hate me.,1
2171,Searching for #work in Cleveland OH? Send your #resume to Amotec Inc.. http://t.co/bNF6YGmSrA #gethired,0
3513,Somehow I did not tweet about Grace Hoppers birthday yesterday! I should be fired from this voluntary position!,0
4809,I feel like I got the job but I am still applying to a lot of places bc nervous bc unemployed bc need $$$$$,1
1919,@RelianK312 @cochese4 @Tarbaby_ten had many friends get laid off with severance get a new job and double dip,0
8464,I possibly got someone a job and saved someone else $285 in attorneys fees yesterday so then God rewards me today.,1
4876,Anyone work in the long-term care industry (e.g. nursing homes)? via /r/Entrepreneur http://t.co/nM0Dxrxrwh,0
3524,i was fired off of my music supervisor position on Bee Movie for replacing the entire score with this: https://t.co/W28k7bbJLi,1
6218,Tesla Motors posted a job you might be interested in. General Ledger Accountant - Amsterdam Area Netherlands N... http://t.co/d8hsTmv6eI,0
5868,Salary or equity? This website wants to help you understand startup job offers https://t.co/KAHoKU2wCT https://t.co/viBbuUIkEI,0
7009,Dolphins already fired their head coach. Who else will have open positions after the season? (fired or leave)Lions?Colts?Redskins?Jags?,0
5280,AKA #unemployed: I received an MBA &amp; used it in my business career. Now am using erudite methods to build up my background #dating,1
4070,So like having a job is cool an all and I know I just got hired like 4 days ago but can I get Monday off? And possibly Tuesday?,0
8472,I GOTTA JOB INTERVIEW THIS MORNING BUT I NEED TO PRINT THIS RESUME OUT BY 11A.MWHO GOT A PRINTER,1
6348,Looking to leverage your home equity to cover renovations or other major expenses? A cash-out refinance could be your best bet!https://t.co/8tFT6XhyOE https://t.co/uYBhJPvaxL,0
6632,I lost my job all because I lost my transportation because of the timing belt.......,1
3314,i got fired and then rehired haha,0
7487,Bow Wow retiring is like walking into a job that fired you in 06 and yelling I quit.,0
7597,Heres The Number One Quality Future Employers Want In A Job Candidatehttps://t.co/cuWsLGu5E6 via @forbes https://t.co/Jha3r97ymb,0
5991,My mom is really looking for a hired chef.... Anyone interested?😑,0
7078,I accidentally missed a shift and Im really really scared that Im gonna lose my job !!,0
9223,Nancy just voluntarily bought my meal so is this what its like to be unemployed???,1
2352,Is anywhere hiring?? Someone please tell me of somewhere,0
3795,Unemployment is cool because I get to sit here all day and reflect on how much of a piece of shit I am,1
2259,Unemployed or looking for a change? See our available job opportunities and apply here: https://t.co/aSpjfusiCt https://t.co/g2d5FzjA1i https://t.co/SCyEz2QIqf,0
5912,I had a girlfriend earlier this week too. Idk what happened tho.,0
2968,I passed my hard course but lost my job. Couldnt have put me in a harder position.,1
5672,If you have been laid off fired or quit your job a bare bones budget can help. https://t.co/a9N9gCLJvI,0
9172,Siri I lost my usb converter please help I cant be unemployed AND not have a usb converter,1
2878,My mom is seriously arguing with me about my bra size... SCUZE ME WHERE DO I WORK? AND HOWS BEING UNEMPLOYED FOR 6 YEARS NOW? bye girly,0
2871,I smoke everyday at all time bc I work my ass off and I can afford it. It would be bad if I was smoking errday but was a lazy unemployed guy,0
3346,Austin Absher was hired earlier this week as Medora Community School Corp.s next principal.Read the story in Fridays Tribune.,0
2271,Looking for a WBB job? 2 new HC positions (DI + NAIA) posted today on our WBB site: https://t.co/v0inkWe8c1 https://t.co/Efwi849BQT,0
8548,Today was a long ass day. Woke up at 5:30 went to work 7-3:30 got out stop for food. Then to my second job till 9:30 but all I see is $_$,0
4822,While technically I have now been unemployed a full month it is the 1st week without any real structure. Trying to find a new life rhythm.,1
5006,Im actually rooting for the lions to lose today so dumbass Schwartz can lose his job. If he doesnt get fired Im boycotting them next year,0
9196,Being unemployed means I got to sleep in after that Colts/Broncos game. But I woke up with a headache so its not all win.,1
487,After getting fired from my new job I’m ready for a new one.  Hello? World? Where’s that f*ing open door,1
3520,Last night I applied for a full-time good-pay position as a haha I wish but nOW I HAVE AN INTERVIEW ON WEDNESDAY???,1
1902,Laid Off Lessons: Five Things I’ve Learned While Unemployed  https://t.co/Vl5xsn1b8y,1
1132,I got laid off my job today. If anyone knows someone looking for a social/digital marketer with a can do attitude in the LA area hit me up.,1
8409,I was laid off this morning... via text message. I prayed Sunday with Josiah for doors that needed to close would... https://t.co/FjDf5osqtm,1
3809,Now my wife &amp; I are retired &amp; our total family income is down 60%! Even though Im sickly these groups expect me to cough up money as before,1
5713,I got laid off.  Why is not an emergency?  http://t.co/s8LUiWqMx2,1
3409,Anybody in weatherford hiring? #igotfired,1
1929,RT @Salondotcom: ‘I had to eat five of my seventeen cats’: Amanda Marcottes slide into poverty and desperation after being laid off from p…,1
6596,Got fired todayworse job ever!!!!,1
9124,I got laid off from my job on the 11th. While on medical leave. Good times!,1
418,#Loser seated outside by my self having a #cigarette 🚬👎 #imsoover #needhelp #iwantyoquit. The pic is… http://t.co/HOoZ9EOxQT,0
5023,I got fired from Rite Aid today....,1
1916,Sources: Health Startup Practice Fusion Laid Off Up To 75 People Ahead Of Possible IPO: Practice Fusion a hea... https://t.co/OsH3GR3mgW,0
2829,Looking for a #Palliative #Care Social Worker- Field Position - San Antonio TX #jobs http://t.co/f3Yxaj4mwW http://t.co/nEgjs1H40f,0
5314,I can sleep late and still get in dumb sleep.... that unemployed lifestyle,1
9100,A1. Getting the email that said my position had been eliminated I had never been laid off before that was scary #Internpro,1
6627,I quit my uncles job today everyone was sad i quit. But its been heavy on me having 2 jobs. Its hard being home only 3 hrs a day.,1
5922,Regretfully I was fired as the varsity defensive coordinator from  Brother Rice football yesterday.,1
8322,My dads pissed at me bc I dont have a job rn. Ive applied at a few places. Sorry no one has hired me!,1
2161,Searching for #work in Orange CA? Send your #resume to Focus Employment Inc.. http://t.co/gXzeDQTwG3 #gethired,0
1067,Hey guys so I just recently started rooming with a good friend of mine and I am currently in between jobs... https://t.co/XML4ZHEoJ4,1
3386,Haha! 3 of the girls that got hired with me quit forever21 too,1
2617,Fired from a job via #Skype? Is that professional or unprofessional? #RalphKrueger #oilers #nhl http://t.co/Kv970Ksofn,0
2571,Looking for a job? Employer with a position to fill? Energy JobsHQ is the new O&amp;G job board that has you covered! http://t.co/sPsVDISJQ6,0
7466,Just got fired.  I know I should be worried about being unemployed BUT IM SO HAPPY I FEEL LIKE SKIPPING IN CIRCLES!,1
7783,Im currently just working on music and getting back into school. So no events till there is something to show https://t.co/WC9Tcm1SVD,1
1724,#talkpay after being laid off it took 3 weeks to get my first unemployment check: $300 minus reported income from part-time contract work,1
8843,i got hired at journeys almost 2 weeks ago and the manager still hasnt given me my schedule or told me when i start https://t.co/2YMXeWXEl3,0
5346,4 Reasons to Hire The Unemployed – The Unemployed Value Proposition http://t.co/od5AYIoqVw,0
5764,This place just sent me 5 emails to tell me I didnt get the job. I get it. I suck and will forever remain unemployed,1
7560,Im at local spot in Pilsen searching jobs on my laptop with all these other unemployed mfers. Someone hire me this is sad,1
8993,I find myself unemployed again. My latest former employer decided after only 3 months the new position wasnt working. I miss writing...,1
9174,yesterday i almost pass out today i burn my hand off..... i should just  be unemployed :) https://t.co/yBOxARMZPg,0
3861,Annnnnd now I am officially unemployed.,1
6922,You could be enjoying the nice weather instead of filling out tons of #jobapplications! #okclocal #okc #getfired https://t.co/73x1LAREDU,1
8754,Thats the 1st time I ever been fired.  Interesting.,1
9327,Being in job search has been a revelation - even for an HR guy.  I am meeting some amazing helpful people. Thank you!  #grateful,1
