id,text,class,ProcessedText,ProcessedText_length
3048,Son being at the mall gets me hype to start working again.,1,son being at the mall gets me hype to start working again.,12
9502,Only 14 more days until I get laid off from my grossly underpaid job and transition into unemployment that will be even less . Oh yippeeeee!,0,only 14 more days until i get laid off from my grossly underpaid job and transition into unemployment that will be even less . oh yippeeeee!,26
6570,Got fired today...looking for a new job,1,got fired today...looking for a new job,7
5702,Please pray that God leads me to a full time job. I was laid off and am not receiving responses to my http://t.co/R7QDi3NFx7 #pray #prayer,1,please pray that god leads me to a full time job. i was laid off and am not receiving responses to my http://t.co/r7qdi3nfx7 #pray #prayer,25
7896,I recently quit smoking (3 weeks clean now) and I did it because I needed a new job howeve… http://t.co/45LHs6wzNO http://t.co/9ViEl9UMKA,0,i recently quit smoking (3 weeks clean now) and i did it because i needed a new job howeve… http://t.co/45lhs6wzno http://t.co/9viel9umka,21
9222,RT @jdh5484: @RepWebster Lost my business. Now unemployed. Please sign the discharge petition to #RenewUI .,1,rt @jdh5484: @repwebster lost my business. now unemployed. please sign the discharge petition to #renewui .,16
4288,# unemployed 😔,1,# unemployed 😔,3
2334,Ive been unemployed now for about 5 days...I am not about this life #ineedanotherjob,1,ive been unemployed now for about 5 days...i am not about this life #ineedanotherjob,14
5473,ANYWAY i woke up 40 min late for work i hope they fire me,0,anyway i woke up 40 min late for work i hope they fire me,14
731,If a potential employer were to Google you would you be offered the position?,0,if a potential employer were to google you would you be offered the position?,14
2741,#Job #Lexington Assistant Professor: Richmond Position Summary The Department of Psychology invites applicatio... http://t.co/FflRyzRyFq,0,#job #lexington assistant professor: richmond position summary the department of psychology invites applicatio... http://t.co/fflryzryfq,14
1524,I recently got to work at a camp for the Phoenix Day School for the Deaf Had a great time!  #whyIsign! #Wednesday https://t.co/EmGbNNRYC1,0,i recently got to work at a camp for the phoenix day school for the deaf had a great time!  #whyisign! #wednesday https://t.co/emgbnnryc1,24
7230,I shouldve waited to quit and got unemployment,1,i shouldve waited to quit and got unemployment,8
3257,Seeking a Maintenance Superintendent for Coal Fired Power Plant. Please call: 800-533-7977 x3 or email: dbeken@thinkingahead.com,0,seeking a maintenance superintendent for coal fired power plant. please call: 800-533-7977 x3 or email: dbeken@thinkingahead.com,16
2769,I worked out in the morning and I got off work on time. I got time today,0,i worked out in the morning and i got off work on time. i got time today,17
5736,I quit my job before I had another one lined up!Heres how I made it happen. #work #unemployed https://t.co/7b8yOUb0Tk https://t.co/laFjf0rxKr,1,i quit my job before i had another one lined up!heres how i made it happen. #work #unemployed https://t.co/7b8youb0tk https://t.co/lafjf0rxkr,20
9285,Maybe you or someone you know might be interested in the attached position ...,0,maybe you or someone you know might be interested in the attached position ...,14
2100,Looking for a new way to hire or BE hired? check out http://t.co/UU5ax8MLHb to create an @myzumay . Fire your #resume ! #jobsearch #jobs,0,looking for a new way to hire or be hired? check out http://t.co/uu5ax8mlhb to create an @myzumay . fire your #resume ! #jobsearch #jobs,24
4997,Anyone know of places that are hiring?????? #needjob,1,anyone know of places that are hiring?????? #needjob,8
9493,Got invited to a corporate open bar Christmas party for one of our partner companies... Pray for me I may become unemployed. 😅,0,got invited to a corporate open bar christmas party for one of our partner companies... pray for me i may become unemployed. 😅,23
4981,Anyone hiring? I need a job...,1,anyone hiring? i need a job...,6
5042,In the past 2 weeks 2 people got FIRED at my new job #help,0,in the past 2 weeks 2 people got fired at my new job #help,14
4814,I resigned a few days ago. Technically Im unemployed lol,1,i resigned a few days ago. technically im unemployed lol,10
3601,I am going to #tweet about my #unemployment until I find a #job I am from #LosAngeles #California living in #NorthCarolina,1,i am going to #tweet about my #unemployment until i find a #job i am from #losangeles #california living in #northcarolina,21
1315,You might be tryin........But the question is how quick do yo quit???????,0,you might be tryin........but the question is how quick do yo quit???????,12
5410,I went into work 3 hrs late the other day please dont fire me,0,i went into work 3 hrs late the other day please dont fire me,14
3878,Wait masturbation?? Whos suffering there?? Making class discussions awkward is my job.,0,wait masturbation?? whos suffering there?? making class discussions awkward is my job.,12
7521,I Am Unemployed And Need Cash Now http://t.co/5xHQ54RmEp,1,i am unemployed and need cash now http://t.co/5xhq54rmep,8
2822,Today was shitty but I got promoted @ work and got a $2 raise so now my shitty day is a whole lot better,0,today was shitty but i got promoted @ work and got a $2 raise so now my shitty day is a whole lot better,24
4639,Ima quit my job today &amp; try to get hired back again tomorrow 🌚,0,ima quit my job today &amp; try to get hired back again tomorrow 🌚,14
8928,Laid off via text message?! Read on for the best and worst hiring and firing stories from 2012 http://t.co/m1C19WNi #hired #fired,0,laid off via text message?! read on for the best and worst hiring and firing stories from 2012 http://t.co/m1c19wni #hired #fired,21
1162,Well today just became the worst day ever. Got laid off my job due to budget cuts. #BrokeAsAJoke,1,well today just became the worst day ever. got laid off my job due to budget cuts. #brokeasajoke,18
6226,I am Charlie Brown. LInkedin is Lucy. The jobs you might be interested in is the football.,1,i am charlie brown. linkedin is lucy. the jobs you might be interested in is the football.,17
4643,I quit a job today &amp; got two other job offers 😏,1,i quit a job today &amp; got two other job offers 😏,12
9167,got scheduled for work cant find coverage but will still be in DC this weekend...pretty sure Ill be unemployed this time next week #fired,0,got scheduled for work cant find coverage but will still be in dc this weekend...pretty sure ill be unemployed this time next week #fired,24
8211,@kay_alise: I just go to school work and mind my business.,0,@kay_alise: i just go to school work and mind my business.,11
97,I just got hired and today is my first day and I already really dont wanna go to work,0,i just got hired and today is my first day and i already really dont wanna go to work,19
8644,Anyone know who is hiring? Still unemployed stressing me out :/,1,anyone know who is hiring? still unemployed stressing me out :/,11
6557,I got fired from one job today &amp; hopped on another job today &amp; start tomorrow man god is good. #bless🙏,0,i got fired from one job today &amp; hopped on another job today &amp; start tomorrow man god is good. #bless🙏,21
1359,Interested in this job? Take a look: Private Equity Associate- Pre-MBA in Connecticut http://t.co/IAdZ6JRqEO #job,0,interested in this job? take a look: private equity associate- pre-mba in connecticut http://t.co/iadz6jrqeo #job,15
7165,Some shady shit went down this morning with at my regular freelance gig and now there are a lot of unemployed pissed off editors out there.,0,some shady shit went down this morning with at my regular freelance gig and now there are a lot of unemployed pissed off editors out there.,26
4986,Anyone hiring???I need a job ASAP,1,anyone hiring???i need a job asap,6
8163,Currently getting paid to sit poolside drinking coffee and reading...my job is awful,0,currently getting paid to sit poolside drinking coffee and reading...my job is awful,13
2072,Looking for a career in Advertising? 3 Tips for Millennials Trying to Get Hired http://t.co/qs2ckM129L #HireMe http://t.co/oh2S7Ofi1L,0,looking for a career in advertising? 3 tips for millennials trying to get hired http://t.co/qs2ckm129l #hireme http://t.co/oh2s7ofi1l,17
4194,I am unemployed for the next 72 hours so Im getting weird.,1,i am unemployed for the next 72 hours so im getting weird.,12
4800,RT @womenbiznetwork: Ready Set Action! Searching for a New #Job http://t.co/AM52tdIj51 via @ItsJustTami #unemployed,1,rt @womenbiznetwork: ready set action! searching for a new #job http://t.co/am52tdij51 via @itsjusttami #unemployed,14
6506,I am actively seeking a position in Customs Compliance. Please contact me at senta.schreiber@gmail.com.,0,i am actively seeking a position in customs compliance. please contact me at senta.schreiber@gmail.com.,14
519,Welp it happened i have 4 job interviews on the table after 2 weeks of getting fired.  Wow thats amazing.,1,welp it happened i have 4 job interviews on the table after 2 weeks of getting fired.  wow thats amazing.,21
3826,And.... Now Im unemployed.,1,and.... now im unemployed.,4
1749,I hope my husband at Cat is laid off instead of bumped down to $13/hr. Make more on unemployment...,0,i hope my husband at cat is laid off instead of bumped down to $13/hr. make more on unemployment...,19
2470,If you apply for the job and the job hires you do the job you applied for! Simple equation-apply= interview = hired= work = paid!,0,if you apply for the job and the job hires you do the job you applied for! simple equation-apply= interview = hired= work = paid!,25
5249,Baby Im a boss and yah man unemployed,1,baby im a boss and yah man unemployed,8
3594,Minimum wage is now 10.10?!! Now I just need a job for the summer...,1,minimum wage is now 10.10?!! now i just need a job for the summer...,14
7164,And now Im unemployed,1,and now im unemployed,4
7499,RT @dontsave: just wrote a program that updates the drop shadow in my avatar to match the time of day. yes i am currently unemployed,1,rt @dontsave: just wrote a program that updates the drop shadow in my avatar to match the time of day. yes i am currently unemployed,25
8561,My board broke today and I lost my job.. Life is going just great right now,1,my board broke today and i lost my job.. life is going just great right now,16
6781,College athletes or unpaid workers? http://t.co/xwyIswR498,0,college athletes or unpaid workers? http://t.co/xwyiswr498,6
2010,First time working by myself at this new job,0,first time working by myself at this new job,9
7761,I am currently suffering brain damage.,0,i am currently suffering brain damage.,6
4074,Got hired today  get my braces off tomorrow .. Ok April good shit,0,got hired today  get my braces off tomorrow .. ok april good shit,14
6956,oh I just remembered when the movie theater fired me 2 months ago I forgot to clock out,1,oh i just remembered when the movie theater fired me 2 months ago i forgot to clock out,18
4830,Are You Unemployed? Want to Learn Social Media while you are looking? http://t.co/IfyM43hF3f  Earn while you learn,0,are you unemployed? want to learn social media while you are looking? http://t.co/ifym43hf3f  earn while you learn,18
3016,New girl started working at the restaurant on FRIDAY and is already tryna get my Wednesday shift like I dead ass will cut this bitch,0,new girl started working at the restaurant on friday and is already tryna get my wednesday shift like i dead ass will cut this bitch,25
2129,Searching for #work in San Francisco CA? Send your #resume to Skyline Recruiting Corporation. http://t.co/h4CgEvXqra #gethired,0,searching for #work in san francisco ca? send your #resume to skyline recruiting corporation. http://t.co/h4cgevxqra #gethired,16
9419,Man i hope i get hired bruh. I just wanna work hard bruh.,1,man i hope i get hired bruh. i just wanna work hard bruh.,13
7031,Today I broke my work badge in half and dropped a co-workers badge down the elevator shaft. So Im buying a #Powerball ticket. Or 12.,0,today i broke my work badge in half and dropped a co-workers badge down the elevator shaft. so im buying a #powerball ticket. or 12.,25
1355,Here quite possibly might not be anything that pisses me off more than someone doubting my integrity and/or my work ethic. 😡😡😡,0,here quite possibly might not be anything that pisses me off more than someone doubting my integrity and/or my work ethic. 😡😡😡,22
7144,I was unemployed for less than two days. Quit my job monday,0,i was unemployed for less than two days. quit my job monday,12
4236,my manager just called me to let me know Ive been fired https://t.co/hpJM91JvNf,1,my manager just called me to let me know ive been fired https://t.co/hpjm91jvnf,13
2026,@tiitlefiight they fired me that day and then rehired the next,0,@tiitlefiight they fired me that day and then rehired the next,11
7,So I was laid off today (1 of 3 employees)..... But this right here makes me forget how much this… http://t.co/BbUMa7rB5L,1,so i was laid off today (1 of 3 employees)..... but this right here makes me forget how much this… http://t.co/bbuma7rb5l,21
1968,Ive now spent my night scrolling through about 800 job listings applied for about 20 or so. #Fingerscrossed for new life in my #jobhunt.,1,ive now spent my night scrolling through about 800 job listings applied for about 20 or so. #fingerscrossed for new life in my #jobhunt.,24
7115,NOT TO MENTION THAT I JUST CHECKED MY WALLET AND SOMEONE STOLE ALL MY MONEY LASTNIGHT WOW THANKS FROM THE GIRL WHO IS UNEMPLOYED.,1,not to mention that i just checked my wallet and someone stole all my money lastnight wow thanks from the girl who is unemployed.,24
7294,So i got fired today lol,1,so i got fired today lol,6
5291,I have been living my best unemployed life all summer long,1,i have been living my best unemployed life all summer long,11
7209,Looking for a job in #Mesquite #TX? Veterinary Assistant https://t.co/FEsGeJzlp1 #jobs #hiring,0,looking for a job in #mesquite #tx? veterinary assistant https://t.co/fesgejzlp1 #jobs #hiring,12
2760,I am Looking for work in fixing #computers or #security #jobs.https://t.co/Bm4FAwHaSz#Oakland #Bayarea,0,i am looking for work in fixing #computers or #security #jobs.https://t.co/bm4fawhasz#oakland #bayarea,12
4660,I just got hired at TGIF at the Rim and I already wanna quit and get a job at BJs at the Rim lmao,0,i just got hired at tgif at the rim and i already wanna quit and get a job at bjs at the rim lmao,24
7500,I am unemployed.,1,i am unemployed.,3
5197,Are you laid off from the coal industry and interested in a career in utility services? Eastern Kentucky CEP and... https://t.co/iAi6ROUQxj,0,are you laid off from the coal industry and interested in a career in utility services? eastern kentucky cep and... https://t.co/iai6rouqxj,21
3035,recently started working out now im feeling a pulling pain on the muscle right next to my armpit when lifting my… http://t.co/HFjYwnj4Qh,0,recently started working out now im feeling a pulling pain on the muscle right next to my armpit when lifting my… http://t.co/hfjywnj4qh,22
6429,Fuck Man bought my phone then 2 weeks later get laid off from work and I got one month until the next bill comes! Agh damn!,1,fuck man bought my phone then 2 weeks later get laid off from work and i got one month until the next bill comes! agh damn!,26
7408,Listening to my daughter describe what she thinks my unemployed day is like is actually quite depressing.,1,listening to my daughter describe what she thinks my unemployed day is like is actually quite depressing.,17
6676,today was horrible lost my job got banned from xbox live and i have no clue why living off hope right now because negativity gets me nowhere,1,today was horrible lost my job got banned from xbox live and i have no clue why living off hope right now because negativity gets me nowhere,27
1703,everett says: I was laid off in Aug 2012 with the intention of not filing for unemployment but still dont have... http://t.co/FY6ZiAEs,1,everett says: i was laid off in aug 2012 with the intention of not filing for unemployment but still dont have... http://t.co/fy6ziaes,22
7728,If anyone in the NYC/Westchester Region hears of a IT tech position my very good friend has been laid off and needs a job. DM me for info!,0,if anyone in the nyc/westchester region hears of a it tech position my very good friend has been laid off and needs a job. dm me for info!,28
9208,Everyones laughing at my festival tweet but really I wasted 20 dollars. Guys Im unemployed I dont have much money you dont understand.,1,everyones laughing at my festival tweet but really i wasted 20 dollars. guys im unemployed i dont have much money you dont understand.,23
7328,My coworker told me today that I should be fired cuz I dont like coffee ?????,0,my coworker told me today that i should be fired cuz i dont like coffee ?????,16
5079,I been out sick for like 4 shifts in a row... Im def getting fired 🙃 time to look for a new pt job,0,i been out sick for like 4 shifts in a row... im def getting fired 🙃 time to look for a new pt job,24
9475,today was my last day at work... not too excited about being unemployed again but cant wait to see what opportunities are out there,1,today was my last day at work... not too excited about being unemployed again but cant wait to see what opportunities are out there,24
7285,Today I was fired from my job bc I had to take time off when my grandmother died. This has been irrefutably the worst month of my life.,1,today i was fired from my job bc i had to take time off when my grandmother died. this has been irrefutably the worst month of my life.,28
6945,I was fired from the Orange Juice Plant last week. I just couldnt concentrate.,1,i was fired from the orange juice plant last week. i just couldnt concentrate.,14
23,I wasnt fired I was laid off! You wouldnt know the difference!,1,i wasnt fired i was laid off! you wouldnt know the difference!,12
9540,Anyone in (or know someone in) Manhattan looking for a Visual Designer position? https://t.co/OBd15R0j5S,0,anyone in (or know someone in) manhattan looking for a visual designer position? https://t.co/obd15r0j5s,14
5028,My old job hired my best friend and then 3 days later fired me for using my cell phone. I found you a new employee then you fired me lol,1,my old job hired my best friend and then 3 days later fired me for using my cell phone. i found you a new employee then you fired me lol,30
539,I was an hour late on Friday and now Im late again today wow Im so fired,0,i was an hour late on friday and now im late again today wow im so fired,17
7884,My boss just pissed me off to the point where once I get my new job Im quitting immediately.Fuck this 2 weeks bullshit.,0,my boss just pissed me off to the point where once i get my new job im quitting immediately.fuck this 2 weeks bullshit.,23
9017,RT @Afromighty: Yo @linkedin What do you mean Unemployed as Fuck isnt a position?,1,rt @afromighty: yo @linkedin what do you mean unemployed as fuck isnt a position?,14
721,Iowa Supreme Court says a woman can be fired for being too irresistible. I am unemployed. COINCIDENCE?!?!,1,iowa supreme court says a woman can be fired for being too irresistible. i am unemployed. coincidence?!?!,17
1548,Got fired from my morning job. Oh well Outback has my heart anyways.,1,got fired from my morning job. oh well outback has my heart anyways.,13
9181,Today is 4 years at my job!  So much has changed since then. I was unemployed horrid cold and in my last apartment.,0,today is 4 years at my job!  so much has changed since then. i was unemployed horrid cold and in my last apartment.,24
8732,I was at the craft store earlier this week...I was compelled to make giant eye balls with Styrofoam balls and jar... http://t.co/rcyQNZD3ny,0,i was at the craft store earlier this week...i was compelled to make giant eye balls with styrofoam balls and jar... http://t.co/rcyqnzd3ny,22
8487,I was filling out an application today and a guy from at&amp;t asked if I needed a job bc theyre hiring and I said yeah they asked how old I,1,i was filling out an application today and a guy from at&amp;t asked if i needed a job bc theyre hiring and i said yeah they asked how old i,30
8604,Anyone in #NYC know of places that are #hiring? #NY #Job #unemployed #help,1,anyone in #nyc know of places that are #hiring? #ny #job #unemployed #help,13
8735,Who else is fired up about only having to work Monday &amp; Tuesday this week,0,who else is fired up about only having to work monday &amp; tuesday this week,15
628,Whos getting hired? Whos moving up? Our latest Denver People on the Move: http://t.co/LL9lCm5rLc,0,whos getting hired? whos moving up? our latest denver people on the move: http://t.co/ll9lcm5rlc,14
9213,Unemployed and my fucking car just broke! Fuck today. Fuck it all.,1,unemployed and my fucking car just broke! fuck today. fuck it all.,12
7985,I got jobs for you unemployed hoes that may be interested.,0,i got jobs for you unemployed hoes that may be interested.,11
3625,Two years ago I was fat unemployed and not in school. Now I got a degree have a full time job and am pretty as fuck. What you got now b?,0,two years ago i was fat unemployed and not in school. now i got a degree have a full time job and am pretty as fuck. what you got now b?,31
3848,Ive noticed that there are alot of unemployed rappers on twitter! I do what brings home the bacon. I rap because its one of my talents!,0,ive noticed that there are alot of unemployed rappers on twitter! i do what brings home the bacon. i rap because its one of my talents!,26
854,@ravenbones_ yeaaaahhh tho that was a few weeks ago and im still unemployed.....Its for an ice cream place like 10 minutes away,1,@ravenbones_ yeaaaahhh tho that was a few weeks ago and im still unemployed.....its for an ice cream place like 10 minutes away,22
7096,One upside to being newly unemployed is I now have some time to sit in the sun and catch up on my reading. #artofwo… http://t.co/mawCRcMcsD,1,one upside to being newly unemployed is i now have some time to sit in the sun and catch up on my reading. #artofwo… http://t.co/mawcrcmcsd,25
5767,so about five hours worth of money made at my previous jobi kinda hate being unemployed a lot,1,so about five hours worth of money made at my previous jobi kinda hate being unemployed a lot,18
9261,LinkedIn why do you have a jobs you may be interested in section when theyre actually volunteer positions? #unhelpful,1,linkedin why do you have a jobs you may be interested in section when theyre actually volunteer positions? #unhelpful,19
5602,Does your company/school need a trainer? I am currently looking for a training position in the greater Philadelphia area. Im quite decent,1,does your company/school need a trainer? i am currently looking for a training position in the greater philadelphia area. im quite decent,22
7361,I am officially unemployed. Feels weird. I dont quite believe it yet.,1,i am officially unemployed. feels weird. i dont quite believe it yet.,12
4407,Currently have 2 jobs but havent been to one of my jobs for 3 weeks now. Why couldnt they just let me quit?,0,currently have 2 jobs but havent been to one of my jobs for 3 weeks now. why couldnt they just let me quit?,23
1021,Interested in a #job in #California 20005? This could be a great fit: https://t.co/P1olM6R1xG #NowHiring #GetHired #Hiring,0,interested in a #job in #california 20005? this could be a great fit: https://t.co/p1olm6r1xg #nowhiring #gethired #hiring,17
8790,Looking to buy a house for a 50% discount of fair market value? We fund em #HUD #Housinghttp://t.co/CocoR9GpYA,0,looking to buy a house for a 50% discount of fair market value? we fund em #hud #housinghttp://t.co/cocor9gpya,18
3109,I quit my job today I feel good about it,1,i quit my job today i feel good about it,10
2213,I am on month 4 of being unemployed and I only JUST figured out the perfect configuration of couch pillows-throw pillows-hot water bottle-laptop and I am equal parts thrilled and inconsolable that it didnt happen sooner,1,i am on month 4 of being unemployed and i only just figured out the perfect configuration of couch pillows-throw pillows-hot water bottle-laptop and i am equal parts thrilled and inconsolable that it didnt happen sooner,36
5776,my #1 ❤️  has been unemployed for 3 years &amp; he just started working again &amp; took the day off to watch me play 🙏🏼,0,my #1 ❤️  has been unemployed for 3 years &amp; he just started working again &amp; took the day off to watch me play 🙏🏼,26
4306,Being single and unemployed is the best feeling in the world. I dont want this to ever end &lt;3,1,being single and unemployed is the best feeling in the world. i dont want this to ever end &lt;3,19
5724,Im raising money for Single Mom Laid Off. Needs Rent.!. Click to Donate:  https://t.co/JZOHjKvQjS,0,im raising money for single mom laid off. needs rent.!. click to donate:  https://t.co/jzohjkvqjs,15
2884,Now that Im unemployed I have no reason not to clean go to the gym do homework tan... but I sit here on Twitter &amp; Tumblr eating... hm.,1,now that im unemployed i have no reason not to clean go to the gym do homework tan... but i sit here on twitter &amp; tumblr eating... hm.,28
512,I got fired from my full time job by my part time job manager wtf...,1,i got fired from my full time job by my part time job manager wtf...,15
4427,Currently living off a credit card... Not quite where I want to be #college,0,currently living off a credit card... not quite where i want to be #college,14
