id,text,class,ProcessedText,ProcessedText_length
2772,I was late again got work today. They gonna fire the shit outta me one day,0,i was late again got work today. they gonna fire the shit outta me one day,16
1205,Got laid off today :/#work,1,got laid off today :/#work,5
4512,Microsoft posted a job you might be interested in. Sr. SW Engineer for Windows System - Beijing City China CN via LinkedIn.,0,microsoft posted a job you might be interested in. sr. sw engineer for windows system - beijing city china cn via linkedin.,22
7249,Now the owners wife is having a breakdown and saying she wanna quit. This is hilarious,0,now the owners wife is having a breakdown and saying she wanna quit. this is hilarious,16
9453,I am happy today. Good. Time to get some food and do some work on Unemployed. Season 2 premiere is scary really liking what I have though,1,i am happy today. good. time to get some food and do some work on unemployed. season 2 premiere is scary really liking what i have though,27
7348,day 10: im thankful that im quit my job and my two weeks notice is almost upstaying home in bed? yep the unemployed life is life for me,1,day 10: im thankful that im quit my job and my two weeks notice is almost upstaying home in bed? yep the unemployed life is life for me,28
1766,Laid off next week. Ahhhh #CorporateAmerica #Merica #unemployment,0,laid off next week. ahhhh #corporateamerica #merica #unemployment,8
5353,Now I have to do illegal shit to obtain this money. See the position you put me in big face financial companies?,1,now i have to do illegal shit to obtain this money. see the position you put me in big face financial companies?,22
7912,Well no chance of that since Im the ONLY lunch closer the other guy quit earlier this week.  #awesome #fml,0,well no chance of that since im the only lunch closer the other guy quit earlier this week.  #awesome #fml,21
8532,I got a job at diamond pizza bc I go there so much aND THEY GAVE ME AN ENTIRE PIZZA FOR FREE TODAY OMFG,0,i got a job at diamond pizza bc i go there so much and they gave me an entire pizza for free today omfg,24
7678,Well its official Im being laid off next week...... sucks.... but i might look for there other GameStop to apply too hoping they are hiring,1,well its official im being laid off next week...... sucks.... but i might look for there other gamestop to apply too hoping they are hiring,25
2981,I was offered a supervisor position today. The wrong people are giving me job offers and this is very distressing.,0,i was offered a supervisor position today. the wrong people are giving me job offers and this is very distressing.,20
1769,Laid Off Now they want me back. - https://t.co/n7fgL3fDFR #taxreturn #taxes #taxrefund #personalfinance #money #,1,laid off now they want me back. - https://t.co/n7fgl3fdfr #taxreturn #taxes #taxrefund #personalfinance #money #,15
59,About to be laid off from receptionist job at hair salon (going out of business). Rethinking my life. Suggestions/advice/mockery welcome.,0,about to be laid off from receptionist job at hair salon (going out of business). rethinking my life. suggestions/advice/mockery welcome.,20
6677,FML! Just lost my job yesterday and I went outside and my car was fucking stolen!,1,fml! just lost my job yesterday and i went outside and my car was fucking stolen!,16
4760,Looking to organize #payroll? BBVA Compass Payroll Service provides efficient online management.https://t.co/SfpG9DlxKI,0,looking to organize #payroll? bbva compass payroll service provides efficient online management.https://t.co/sfpg9dlxki,12
7401,Now Im quitting McDonalds altogether.  󾌦 https://t.co/qXwLCmt7Zi,0,now im quitting mcdonalds altogether.  󾌦 https://t.co/qxwlcmt7zi,8
6459,Am currently lying on couch in the fetal position biting my nails in anticipation of this game. Excited &amp; nervous at the same time,0,am currently lying on couch in the fetal position biting my nails in anticipation of this game. excited &amp; nervous at the same time,24
5680,The architecture firm laid off a group of employees and unfortunately I was one of them. I am currently in shock... http://t.co/IFToIYFbg8,1,the architecture firm laid off a group of employees and unfortunately i was one of them. i am currently in shock... http://t.co/iftoiyfbg8,22
8658,Why cant they fired me I dont wanna work anymore,0,why cant they fired me i dont wanna work anymore,10
7698,I have been officially laid off from my one steady PT day job gig (not my fault). Hopefully this end will become an awesome beginning soon.,1,i have been officially laid off from my one steady pt day job gig (not my fault). hopefully this end will become an awesome beginning soon.,26
3087,Today my coworker was like HEY U QUIT? and I was like nah just told them my last day bc Im going to school Im stuck here!,0,today my coworker was like hey u quit? and i was like nah just told them my last day bc im going to school im stuck here!,27
6804,Live in Boston or DC? Register for a free AAUW Work Smart salary negotiation workshop: https://t.co/P62C7rhhPk #equalpay,0,live in boston or dc? register for a free aauw work smart salary negotiation workshop: https://t.co/p62c7rhhpk #equalpay,17
8307,Ugh- I just got hired for two jobs that Ive recently applied too. 😶 I was hoping for a new job soon &amp;I got double the luck! 😛,0,ugh- i just got hired for two jobs that ive recently applied too. 😶 i was hoping for a new job soon &amp;i got double the luck! 😛,28
4774,I need a job. Or a hobby. Or to volunteer somewhere. #unemployedlife,1,i need a job. or a hobby. or to volunteer somewhere. #unemployedlife,12
6594,So asshole boss fired me today,1,so asshole boss fired me today,6
7504,currently unemployed thanks for reminding me  https://t.co/BlfDZmzlPo,1,currently unemployed thanks for reminding me  https://t.co/blfdzmzlpo,8
1454,my manager lost her voice and I cant hear well because of congestionwork was a blast today,0,my manager lost her voice and i cant hear well because of congestionwork was a blast today,17
3044,So we did secret Santa at work... and I got the girl I recently got into it with. I think this is a sign I need a new job,0,so we did secret santa at work... and i got the girl i recently got into it with. i think this is a sign i need a new job,29
7340,Im tied of working 70+ hrs a week Im quitting and getting unemployment idgaf 😂,0,im tied of working 70+ hrs a week im quitting and getting unemployment idgaf 😂,15
2132,Searching for #work in Washington DC? Send your #resume to Department of Veterans Affairs. http://t.co/khcdy3C0Hd #gethired,0,searching for #work in washington dc? send your #resume to department of veterans affairs. http://t.co/khcdy3c0hd #gethired,16
5299,baby Im a boss an ya man unemployed,1,baby im a boss an ya man unemployed,8
317,I lost my ID &amp; my credit card... basically I lost my wallet,0,i lost my id &amp; my credit card... basically i lost my wallet,13
2385,Who hiring??,0,who hiring??,2
4850,my heart dont work Im unemployed,1,my heart dont work im unemployed,6
8810,Just got hired by an add company and just got fired! So if you like my work Im available to hire! http://t.co/XrNzPnrerE,1,just got hired by an add company and just got fired! so if you like my work im available to hire! http://t.co/xrnzpnrere,22
6405,i got laid off this morning and now Im watching SNL for the third time. https://t.co/NkNYlILDyY,1,i got laid off this morning and now im watching snl for the third time. https://t.co/nknylildyy,16
4004,I applied to 7 Subways today. I better get fucking hired.,1,i applied to 7 subways today. i better get fucking hired.,11
8166,Ok.Im job seeking.Not currently working. Ive been told by hr pros recruiters to tell my network friends FB. Didnt tell LinkedIn. (1),1,ok.im job seeking.not currently working. ive been told by hr pros recruiters to tell my network friends fb. didnt tell linkedin. (1),22
8493,I have work Monday thru Saturday &amp; I got called in yesterday to work my 2nd job yesterday night,0,i have work monday thru saturday &amp; i got called in yesterday to work my 2nd job yesterday night,19
8819,my work hired a girl with the same name as me.....this is not okay,0,my work hired a girl with the same name as me.....this is not okay,14
796,I just had a baby so I am in no position to help as I am not working https://t.co/OhDOevXF6b,1,i just had a baby so i am in no position to help as i am not working https://t.co/ohdoevxf6b,19
9111,My best friend died and I got laid off from my job in a span of less than 5 days. I need a goddamn ice cream,1,my best friend died and i got laid off from my job in a span of less than 5 days. i need a goddamn ice cream,26
4338,@69kykid @TrevBales do some work #TeamGetOurMembersBack,0,@69kykid @trevbales do some work #teamgetourmembersback,6
560,Roadhouse fired me? You cant fire me,1,roadhouse fired me? you cant fire me,7
4523,@rsalcido92: Its about time I say that..... I got fired today :((((  fuck Target!! Haha,1,@rsalcido92: its about time i say that..... i got fired today :((((  fuck target!! haha,16
6238,Interested in a Sales job? A career in Real Estate might be for you! Come meet us for career opportunities! https://t.co/nz937tWwn4,0,interested in a sales job? a career in real estate might be for you! come meet us for career opportunities! https://t.co/nz937twwn4,21
7101,I made a friend who is also unemployed and in their early/mid 20s and we both might be going to Providence together tomorrow. Up tha punx.,1,i made a friend who is also unemployed and in their early/mid 20s and we both might be going to providence together tomorrow. up tha punx.,26
1733,Day 8 of being unemployed: From laid off to unemployed http://t.co/ho30xFHS #jobsearch #blog #unemployed #jobs #nonprofit,1,day 8 of being unemployed: from laid off to unemployed http://t.co/ho30xfhs #jobsearch #blog #unemployed #jobs #nonprofit,16
4651,Yup I quit today,1,yup i quit today,4
4700,Now i got work in an hr &lt;&lt;&lt;&lt;,0,now i got work in an hr &lt;&lt;&lt;&lt;,8
8799,I am doing a UX study on a real website. Its a fake study but its to practice my skills to possibly get hired. Here is a link to a survey…,0,i am doing a ux study on a real website. its a fake study but its to practice my skills to possibly get hired. here is a link to a survey…,31
8519,I guess today i got promoted &amp; certified at my taco job lmao now i can quit my week job &amp; just work weekends &amp; still make the same money😂😮,0,i guess today i got promoted &amp; certified at my taco job lmao now i can quit my week job &amp; just work weekends &amp; still make the same money😂😮,30
8419,So many people were laid off from my job this week. Thankful for what I have.,0,so many people were laid off from my job this week. thankful for what i have.,16
7509,I am officially unemployed.. Worst job ever goodnight,1,i am officially unemployed.. worst job ever goodnight,8
8770,Looking for a job or want to polish your skills? Attend John Bernardi Job Fair 5/13 to 5/16.http://t.co/fNB6ad6Pim @OmahaLibrary,0,looking for a job or want to polish your skills? attend john bernardi job fair 5/13 to 5/16.http://t.co/fnb6ad6pim @omahalibrary,19
8499,Ive put in 3 job applications today what are the odds I dont get hired now,1,ive put in 3 job applications today what are the odds i dont get hired now,16
5026,i recently got fired for sleeping on the job. i ddnt really like being a pilot that much anyway,1,i recently got fired for sleeping on the job. i ddnt really like being a pilot that much anyway,19
5416,Im honestly just waiting for Carls Jr to fire me because I never checked this weeks schedule so I just havent gone to work oops,0,im honestly just waiting for carls jr to fire me because i never checked this weeks schedule so i just havent gone to work oops,25
5261,I am now unemployed,1,i am now unemployed,4
8269,My new job wants to celebrate me getting hired and wants to celebrate my b day too!!! 😢😢,0,my new job wants to celebrate me getting hired and wants to celebrate my b day too!!! 😢😢,18
7339,Life is so peaceful since I quit my job!! #unemployed #peaceful #stressfree #nomoreMcD,1,life is so peaceful since i quit my job!! #unemployed #peaceful #stressfree #nomoremcd,13
5178,Here is what you do after you get laid off. http://t.co/Pyk3cEN8Rq,0,here is what you do after you get laid off. http://t.co/pyk3cen8rq,11
9175,S/O to everyone who is unemployed or had to call out of work today to attend Kanyes 2am show. Ya didnt see shit &amp; lost ya money. Good job.,0,s/o to everyone who is unemployed or had to call out of work today to attend kanyes 2am show. ya didnt see shit &amp; lost ya money. good job.,29
5489,@markschlereth Just got laid off any tips for staying busy while looking for a new job? #QuestionMark,1,@markschlereth just got laid off any tips for staying busy while looking for a new job? #questionmark,17
2427,Looking to hire or to be hired in #Seattle? Register for the Job Fair at #ChaseBasecamp on 11/18 during #SSW2016. https://t.co/ncbROxwFvb,0,looking to hire or to be hired in #seattle? register for the job fair at #chasebasecamp on 11/18 during #ssw2016. https://t.co/ncbroxwfvb,21
7976,someone hire me pls I do not like the unemployed life,1,someone hire me pls i do not like the unemployed life,11
4328,RT @MsVanessa137: So he missed 3 FGs Tampa Bay is down by 9...Nick Folk you will be unemployed tomorrow.,0,rt @msvanessa137: so he missed 3 fgs tampa bay is down by 9...nick folk you will be unemployed tomorrow.,19
3966,Whoops-I missed the 12 year anniversary of quitting my day job for the life of a hired gun which was last Saturday. Cheers!,0,whoops-i missed the 12 year anniversary of quitting my day job for the life of a hired gun which was last saturday. cheers!,23
8387,The 7 Biggest Lessons I Learned After Being Laid Off: http://t.co/txrIwt74io #jobseekers,1,the 7 biggest lessons i learned after being laid off: http://t.co/txriwt74io #jobseekers,12
4069,Today I got hired on the spot tomorrow I start. Here comes some monaaaay!!!,0,today i got hired on the spot tomorrow i start. here comes some monaaaay!!!,14
821,&gt;6 win streak. &gt;go up against an Ultra Silver Nash player &gt;close game &gt;he ragequits SD Im about to win&gt;we match again next,0,&gt;6 win streak. &gt;go up against an ultra silver nash player &gt;close game &gt;he ragequits sd im about to win&gt;we match again next,23
1837,I am planning weekends in #Venice Beach selling #art on the boardwalk. Looking for someone to hang out. help watch my stuff. Sell your own,0,i am planning weekends in #venice beach selling #art on the boardwalk. looking for someone to hang out. help watch my stuff. sell your own,25
5538,Have you Been Laid Off and Need a STABLE Career??? (Lancaster) http://t.co/dEPWzSk4jb,0,have you been laid off and need a stable career??? (lancaster) http://t.co/depwzsk4jb,12
7765,I am currently losing brain cells due to this situation &amp; people.,0,i am currently losing brain cells due to this situation &amp; people.,12
9538,Know anyone for this job?  Big Data Architect permanent position in Milwaukee WI (BP) in Milwaukee WI https://t.co/RoNGfDy9SF #job,0,know anyone for this job?  big data architect permanent position in milwaukee wi (bp) in milwaukee wi https://t.co/rongfdy9sf #job,20
1443,Need to Make a Career Move?  Need a New Job?  Unemployed? @leezabyers Can Help: http://t.co/cCLOHZIwPQ,0,need to make a career move?  need a new job?  unemployed? @leezabyers can help: http://t.co/cclohziwpq,17
3584,ok Im done being unemployed I want a job,1,ok im done being unemployed i want a job,9
7555,Looking for work?  Are you unemployed?  We are now hiring. http://t.co/uwCbHWfUuh http://t.co/ryNj95gBih,0,looking for work?  are you unemployed?  we are now hiring. http://t.co/uwcbhwfuuh http://t.co/rynj95gbih,14
4295,@BethMatuga @iamsharpe When does Matugas Mission for unemployed campaign staffers open?,0,@bethmatuga @iamsharpe when does matugas mission for unemployed campaign staffers open?,11
2667,Feel like my love life is finished.. Ive been avoiding commitment.. Thats why Im in this position,0,feel like my love life is finished.. ive been avoiding commitment.. thats why im in this position,17
6730,Man do I see a lot of Red on the Screen got saved in $MPC but I have a ton of losing positions today,0,man do i see a lot of red on the screen got saved in $mpc but i have a ton of losing positions today,24
5522,RT @jonfisher: Hey guys. My position was eliminated today and I got laid off. If you know anyone looking for a designer / project manager…,1,rt @jonfisher: hey guys. my position was eliminated today and i got laid off. if you know anyone looking for a designer / project manager…,25
6758,Ive done the new job thing 4 times in the past 7 years. And Ive twice experienced having the position I work closest with be a new hire 1/,0,ive done the new job thing 4 times in the past 7 years. and ive twice experienced having the position i work closest with be a new hire 1/,29
7501,I am unemployed and all my friends are busy. Woo?,1,i am unemployed and all my friends are busy. woo?,10
2905,Man being unemployed is the best. You get so much shit done when you dont have all that work shit getting in the way. A++ would recommend,1,man being unemployed is the best. you get so much shit done when you dont have all that work shit getting in the way. a++ would recommend,27
9426,@bobbarker_2014 Im actually unemployed at the moment. Im sorry are you the king now sense you just got hired 4 hours ago to clean shit?,1,@bobbarker_2014 im actually unemployed at the moment. im sorry are you the king now sense you just got hired 4 hours ago to clean shit?,25
7947,I quit this week again.,1,i quit this week again.,5
939,Well got hired for a new position here in the admissions office as a fellow. Hopefully it can help transition into a full time counselor,0,well got hired for a new position here in the admissions office as a fellow. hopefully it can help transition into a full time counselor,25
1152,I wasnt fired I got laid off you wouldnt know the difference,1,i wasnt fired i got laid off you wouldnt know the difference,12
6382,Soo two more guys got laid off this week Im hoping I dont. I like this job no matter how much work it is,0,soo two more guys got laid off this week im hoping i dont. i like this job no matter how much work it is,24
9258,Here is a fun opportunity for an entry-level Motorcycle Sales Position in #CT #jobs #sales #hireapatriot http://t.co/yh480yXLon,0,here is a fun opportunity for an entry-level motorcycle sales position in #ct #jobs #sales #hireapatriot http://t.co/yh480yxlon,17
4792,I been unemployed for 8 months yet have years experience  been working since 18. Yet my new provider pushes work4dole on second interview?!,1,i been unemployed for 8 months yet have years experience  been working since 18. yet my new provider pushes work4dole on second interview?!,24
3585,Im unemployed and I dont care Im unemployed and I dont care Im unemployed and I dont care cause Im finally out of that job!,1,im unemployed and i dont care im unemployed and i dont care im unemployed and i dont care cause im finally out of that job!,25
9186,i just gave away my last shift ever and now Im officially 100% #unemployed,1,i just gave away my last shift ever and now im officially 100% #unemployed,14
117,i got 107 likes on an instagram photo of a bike so i hired an agent and quit my job today #NeverGiveUp,1,i got 107 likes on an instagram photo of a bike so i hired an agent and quit my job today #nevergiveup,22
1496,A really close co worker of mine lost his Father today. I want to call him but I dont know what to say.,0,a really close co worker of mine lost his father today. i want to call him but i dont know what to say.,23
116,I quit and got hired in then same day because i sold another car ya boi is on fire lmao,0,i quit and got hired in then same day because i sold another car ya boi is on fire lmao,20
4183,I am now unemployed.,1,i am now unemployed.,4
1672,My Assignment at my job ends today. Quit my delivery job on weekends but I got interview Monday and Footba season almost back at metlife !,1,my assignment at my job ends today. quit my delivery job on weekends but i got interview monday and footba season almost back at metlife !,26
1335,Interested in a #job in #Mesquite TX? This could be a great fit: https://t.co/zAaZtHyq6E #Retail #Hiring #CareerArc,0,interested in a #job in #mesquite tx? this could be a great fit: https://t.co/zaazthyq6e #retail #hiring #careerarc,17
7656,I got laid off but I paid most of my bills from my 5 Minute Investment Plan  https://t.co/GjmJtE0btW https://t.co/RiZB4kbhdf,1,i got laid off but i paid most of my bills from my 5 minute investment plan  https://t.co/gjmjte0btw https://t.co/rizb4kbhdf,20
6663,So I quit my day job to focus on my music today lol my manager was like you a fool basically I laugh so fuckin hard to him I already a job,1,so i quit my day job to focus on my music today lol my manager was like you a fool basically i laugh so fuckin hard to him i already a job,32
3607,I keep buying cute work clothes yet I dont have a job yet embarrassing #hireme #unemployed,1,i keep buying cute work clothes yet i dont have a job yet embarrassing #hireme #unemployed,16
2279,Looking for a job? Senior Program Manager- Renewable Energy at Epri (San Francisco CA) http://t.co/7ioP77lq #green #jobs,0,looking for a job? senior program manager- renewable energy at epri (san francisco ca) http://t.co/7iop77lq #green #jobs,17
5768,started re-watching #GIRLS at 2am. as a new college graduate slash currently unemployed person this is probably not the healthiest idea.,1,started re-watching #girls at 2am. as a new college graduate slash currently unemployed person this is probably not the healthiest idea.,21
4849,i dont like being unemployed anymore lol,1,i dont like being unemployed anymore lol,7
7532,Can I File Bankruptcy If I Am Unemployed? http://t.co/ijTGOOfpRO #bankruptcy,1,can i file bankruptcy if i am unemployed? http://t.co/ijtgoofpro #bankruptcy,10
8862,boss calls me at 1pm to discuss work next week and im still in bed...he fired me #dontworryimrehired #theinternship,1,boss calls me at 1pm to discuss work next week and im still in bed...he fired me #dontworryimrehired #theinternship,19
6507,I was just offered a position at the Seven Inlets Spa and I am still waiting to hear back from Massage Envy. Not sure what to do. #Decisions,0,i was just offered a position at the seven inlets spa and i am still waiting to hear back from massage envy. not sure what to do. #decisions,28
3738,Looking for a new #job in #Kentucky? Subscribe to #JobAlerts! http://t.co/nlyggAo5xX,0,looking for a new #job in #kentucky? subscribe to #jobalerts! http://t.co/nlyggao5xx,11
8502,Saw a snake in my job today I quit my job today,1,saw a snake in my job today i quit my job today,12
2703,#Intel: #Multiple #Positions For Wounded Ill or Injured Veterans in New Mexico and Oregon in #Hillsboro #job http://t.co/rr9v5vG1fu,0,#intel: #multiple #positions for wounded ill or injured veterans in new mexico and oregon in #hillsboro #job http://t.co/rr9v5vg1fu,18
6812,does anyone know anywhere hiring that works w people schedules???,1,does anyone know anywhere hiring that works w people schedules???,10
4172,I Am Officially Unemployed https://t.co/IKnjFc1HS7 https://t.co/1Xzd5mz31w,1,i am officially unemployed https://t.co/iknjfc1hs7 https://t.co/1xzd5mz31w,6
6764,Last week I was offered full time my sister just got a new job that is full time and my bf might start a new position at his #Godisgood,0,last week i was offered full time my sister just got a new job that is full time and my bf might start a new position at his #godisgood,29
4900,Unable to work? Social Security Disability Insurance is a program that provides benefits to people who can no longer continue working a job.,0,unable to work? social security disability insurance is a program that provides benefits to people who can no longer continue working a job.,23
7124,Yeah Im unemployed with a schedule lol.,1,yeah im unemployed with a schedule lol.,7
6893,Here’s how to answer #interview questions when you’ve been fired. https://t.co/NU5EADjcow https://t.co/S6JiclIlBt— Work It Daily (WorkI…,0,here’s how to answer #interview questions when you’ve been fired. https://t.co/nu5eadjcow https://t.co/s6jiclilbt— work it daily (worki…,16
274,I got paid on friday $540.00 and today i only have $18.00 LOL,0,i got paid on friday $540.00 and today i only have $18.00 lol,13
7883,So my boss quit her job so Im outta work hows your Monday?,1,so my boss quit her job so im outta work hows your monday?,13
7998,RT @JaimeCallica: I always smile when @LinkedIn sends those jobs you may be interested in emails. Im like: Im a happily unemployed act…,1,rt @jaimecallica: i always smile when @linkedin sends those jobs you may be interested in emails. im like: im a happily unemployed act…,23
8040,I am looking for an APRN or RN with CPOE experience for a direct hire position.,0,i am looking for an aprn or rn with cpoe experience for a direct hire position.,16
151,Today in a nutshell: hired 1 person fired 1 person altered my job description again ate 10 pieces of chocolate cried 1 time.,0,today in a nutshell: hired 1 person fired 1 person altered my job description again ate 10 pieces of chocolate cried 1 time.,23
4215,My working from home office assistant is about to get fired. Lazy. http://t.co/3xHRNWNDci,0,my working from home office assistant is about to get fired. lazy. http://t.co/3xhrnwndci,13
83,My best friend got hired to her 1st job today woot woot !,0,my best friend got hired to her 1st job today woot woot !,13
6954,My mom fired me from helping her for being too neat ??,1,my mom fired me from helping her for being too neat ??,12
