id,text,class,ProcessedText,ProcessedText_length
6177,I recently had to do an interview to renew my clearance (which I did successfully I might add)  but now hold a position that I only need the public trust if I get another position as long as my clearance level has not expired then I wont have to go through the whole process.,0,i recently had to do an interview to renew my clearance (which i did successfully i might add)  but now hold a position that i only need the public trust if i get another position as long as my clearance level has not expired then i wont have to go through the whole process.,55
5789,Im also now unemployed which is cool.,1,im also now unemployed which is cool.,7
9503,@sqeptiq I got laid off from the auto body shop on Friday dontcha know. Im an Unemployed Cake again.,1,@sqeptiq i got laid off from the auto body shop on friday dontcha know. im an unemployed cake again.,19
857,Being unemployed is getting old.,1,being unemployed is getting old.,5
5762,Recently discovered the unemployed life does not suit me feel as though Im living through an eternity of bored-ness.,1,recently discovered the unemployed life does not suit me feel as though im living through an eternity of bored-ness.,19
6637,I also lost my job today I think LMAO,1,i also lost my job today i think lmao,9
8478,Today i got discriminated for my tattoos trying to get a upgraded job sucks how they can judge huh...sucks,0,today i got discriminated for my tattoos trying to get a upgraded job sucks how they can judge huh...sucks,19
1116,I am searching for a good job but i am not getting it .i am already 29 yrs and i dont know wen i will http://t.co/xeAPAYWQPu #pray #prayer,0,i am searching for a good job but i am not getting it .i am already 29 yrs and i dont know wen i will http://t.co/xeapaywqpu #pray #prayer,28
3309,Got fired today..,1,got fired today..,3
6537,I got a job today 2s later I got fired,1,i got a job today 2s later i got fired,10
698,So for the first time in 30 years...I got fired today.  I am looking for work or marketing work but let me know... https://t.co/99ZRjqBdJQ,1,so for the first time in 30 years...i got fired today.  i am looking for work or marketing work but let me know... https://t.co/99zrjqbdjq,25
8372,@SueScoby I know what you mean! I worked there while I was laid off from another job. Got my employee discounts worth!!,0,@suescoby i know what you mean! i worked there while i was laid off from another job. got my employee discounts worth!!,22
831,.@Lana Defensively no. Might leave quite the void in the middle of the order though. #MLB,0,.@lana defensively no. might leave quite the void in the middle of the order though. #mlb,16
7752,I am currently lamenting not grabbing a beautiful notebook from supply yesterday that someone else now took.,0,i am currently lamenting not grabbing a beautiful notebook from supply yesterday that someone else now took.,17
3598,Thomas Pridgen was once asked what the secret to his success was and he said I never worked a day job.And that is why I am unemployed.,1,thomas pridgen was once asked what the secret to his success was and he said i never worked a day job.and that is why i am unemployed.,27
288,I went to the new hire session yesterday to sign my contract..,0,i went to the new hire session yesterday to sign my contract..,12
386,Im Searching for an Executive Sous Chef in DC to work for an award winning Chef...must be cutting edge creative positive with amazing e…,0,im searching for an executive sous chef in dc to work for an award winning chef...must be cutting edge creative positive with amazing e…,24
9424,WOOOO one step closer to not being unemployed! #hired #wwddd https://t.co/ORocOEKpa0,1,woooo one step closer to not being unemployed! #hired #wwddd https://t.co/orocoekpa0,11
6417,Well this sucks... Got laid off with a 2 week notice my last day is Feb 13th anyone looking for an awesome person out there?,1,well this sucks... got laid off with a 2 week notice my last day is feb 13th anyone looking for an awesome person out there?,25
7020,Today my car broke and then my laptop broke.. Should I start anticipating mourning the loss of my phone too Orr?.... #BadThingsComeInThrees,0,today my car broke and then my laptop broke.. should i start anticipating mourning the loss of my phone too orr?.... #badthingscomeinthrees,22
7539,I am unemployed,1,i am unemployed,3
64,So I got laid off of from my job a couple weeks ago. A first for me. I was upset and a bit stressed at first of... https://t.co/3FArucZPX3,1,so i got laid off of from my job a couple weeks ago. a first for me. i was upset and a bit stressed at first of... https://t.co/3faruczpx3,28
490,Recently fired. And needed to get some business cards. So I had a fotoshoot... Thank God for being… http://t.co/Krh5wgwJQL,1,recently fired. and needed to get some business cards. so i had a fotoshoot... thank god for being… http://t.co/krh5wgwjql,19
1608,Looking for a job? Superintendent II - Wind Energy Group (IRC9674)Job Details at M. A. Mortenson ... http://t.co/A6gO3vpNCz #green #jobs,0,looking for a job? superintendent ii - wind energy group (irc9674)job details at m. a. mortenson ... http://t.co/a6go3vpncz #green #jobs,20
5535,Scared of being laid off from your #job? Start your own online La Bella Baskets #gift basket and #fl http://t.co/wNCgfJMRh6,0,scared of being laid off from your #job? start your own online la bella baskets #gift basket and #fl http://t.co/wncgfjmrh6,20
7128,I was once told I wasnt hungry enough for a job. Oh @lenadunham I believe girls is the anthem of my unemployed self.,0,i was once told i wasnt hungry enough for a job. oh @lenadunham i believe girls is the anthem of my unemployed self.,23
5195,Wage insurance for new jobs that pay less than a laid off job? Im interested.,1,wage insurance for new jobs that pay less than a laid off job? im interested.,15
3850,BUT HEY I START TWO NEW JOBS IN THE NEXT TWO DAYS AFTER 6 MONTHS OF UNEMPLOYMENT SO YAY ME,1,but hey i start two new jobs in the next two days after 6 months of unemployment so yay me,20
8772,Looking for a paid internship in DC? AFFs looking for a detail-oriented Development intern #intern #jobseekers  -http://t.co/xTrQlNlc0L,0,looking for a paid internship in dc? affs looking for a detail-oriented development intern #intern #jobseekers  -http://t.co/xtrqlnlc0l,18
8268,Who gets hired fired promoted? The application of people analytics in human resources: #bigdata http://t.co/4oVEmgiQt6,0,who gets hired fired promoted? the application of people analytics in human resources: #bigdata http://t.co/4ovemgiqt6,15
3618,Teacher says if your unemployed and not actively looking for a job you are a lazy bum.,0,teacher says if your unemployed and not actively looking for a job you are a lazy bum.,17
3233,Looking for a job. I was fired two weeks ago .,1,looking for a job. i was fired two weeks ago .,11
6322,I QUIT IM DONE ABSOLUTELY FUCKING STUPID ASS DECISION YOU ARE ALL FIRED,1,i quit im done absolutely fucking stupid ass decision you are all fired,13
4972,Anyone know of anywhere hiring????? I hate my job,0,anyone know of anywhere hiring????? i hate my job,9
8973,Looking for a #Healthy #and Hunger-Free AmeriCorps Position. Application Deadline: 8/26/15! #jobs http://t.co/mKWTub0gOM,0,looking for a #healthy #and hunger-free americorps position. application deadline: 8/26/15! #jobs http://t.co/mkwtub0gom,13
6604,I just got fired lol piece of shit job.... Whos hiring???,1,i just got fired lol piece of shit job.... whos hiring???,11
2019,5 other people got hired the same time as me this week and by today ( the 3rd day) I was the only one to show up to work haha,0,5 other people got hired the same time as me this week and by today ( the 3rd day) i was the only one to show up to work haha,30
3845,the only reason i go to school is because i donn’t wanna be an unemployed college drop out. i wanna be an unemployed college graduate,1,the only reason i go to school is because i donn’t wanna be an unemployed college drop out. i wanna be an unemployed college graduate,25
2523,Looking for a rewarding and unique experience? Apply today for our Live-In Overnight Residential Aide position. https://t.co/id95nvBBDE,0,looking for a rewarding and unique experience? apply today for our live-in overnight residential aide position. https://t.co/id95nvbbde,17
8052,I am in search of a full-time permanent human resource position!,1,i am in search of a full-time permanent human resource position!,11
4757,Does anyone know of anyone hiring? I am looking for a part time/ full time gig during the midnight hours. Anyone? Anything? #WesternMass,1,does anyone know of anyone hiring? i am looking for a part time/ full time gig during the midnight hours. anyone? anything? #westernmass,23
3580,I cant wait till I get a job so I can tweet about actual accomplishments instead of how drunk I am all the time #unemployment,1,i cant wait till i get a job so i can tweet about actual accomplishments instead of how drunk i am all the time #unemployment,25
2508,Earlier this year I was offered an attractive VP position that would have included a move to Miami. If it wasnt... http://t.co/KSXi0Wruea,0,earlier this year i was offered an attractive vp position that would have included a move to miami. if it wasnt... http://t.co/ksxi0wruea,22
9402,This is my last full week of unemployment! Ill be so happy when I see my first grown up paycheck! #someonefinallyhiredme ☺,1,this is my last full week of unemployment! ill be so happy when i see my first grown up paycheck! #someonefinallyhiredme ☺,22
3557,Now I have to figure out what #book Im going to #read next... I need some #inspiration for when I finally find a #job. #reading #unemployed,1,now i have to figure out what #book im going to #read next... i need some #inspiration for when i finally find a #job. #reading #unemployed,26
5161,Fiorina: Steve Jobs said been there done that the day after I was fired #GOPDebate,1,fiorina: steve jobs said been there done that the day after i was fired #gopdebate,15
2007,New job is chill. Im the only dude that works at this boutique tho.,0,new job is chill. im the only dude that works at this boutique tho.,14
7393,I used to work in a sweat shop but I quit &amp; jumped on welfare &amp; made triple the amount. Like I can afford the shoes I used to make. #Boss,1,i used to work in a sweat shop but i quit &amp; jumped on welfare &amp; made triple the amount. like i can afford the shoes i used to make. #boss,31
9093,MY WIFI NOT WORKING MY LTE NOT WORKING SOMEBODY IS TO BLAME,0,my wifi not working my lte not working somebody is to blame,12
3879,Wanted Clerk IV/ Communications Coordinator Computer Science Amherst Massachusetts US Permanent #amherstjobs https://t.co/5vcsNgWMft,0,wanted clerk iv/ communications coordinator computer science amherst massachusetts us permanent #amherstjobs https://t.co/5vcsngwmft,13
6728,My old job called me today and wants to offer me a better position with better pay smh. Blessed.,0,my old job called me today and wants to offer me a better position with better pay smh. blessed.,19
8517,EVERYONES GETTING JOBS AND IM JUST HERE LIKE WHY WONT HOT TOPIC HIRE ME applies more eyeliner,1,everyones getting jobs and im just here like why wont hot topic hire me applies more eyeliner,17
346,On Friday we learned of a reduction in workforce and now I am searching  for a new opportunity. https://t.co/hfX15on1uo,1,on friday we learned of a reduction in workforce and now i am searching  for a new opportunity. https://t.co/hfx15on1uo,20
3145,Lost a 3 year old friend today for no reason. He just apparently hates me all of a sudden. Prob just going to quit for good.,0,lost a 3 year old friend today for no reason. he just apparently hates me all of a sudden. prob just going to quit for good.,26
1238,Al-Futtaim Group Real Estate posted a job you might be interested in. Project Manager – Network Development | Auto… …,0,al-futtaim group real estate posted a job you might be interested in. project manager – network development | auto… …,20
593,Did anyone else get hired at the mall for seasonal???,0,did anyone else get hired at the mall for seasonal???,10
4932,I need to get hired on so I can get paid while getting drunk,1,i need to get hired on so i can get paid while getting drunk,14
6179,I recently accepted a full-time position with benefits... and I still feel like a failure. #itsnotinmyfield,0,i recently accepted a full-time position with benefits... and i still feel like a failure. #itsnotinmyfield,16
6964,I just got fired oops I meab I quit I mean I dropped outta school just to be the shit,1,i just got fired oops i meab i quit i mean i dropped outta school just to be the shit,20
1543,Showed up to work today thinking I still had a job and my uncle told me to gtfo and never come back... looks like he actually did fire me...,1,showed up to work today thinking i still had a job and my uncle told me to gtfo and never come back... looks like he actually did fire me...,29
2233,I was employed and now im unemployed again. #walmart #seasonal #temp lmao.,1,i was employed and now im unemployed again. #walmart #seasonal #temp lmao.,12
6981,In fact I got fired cause I was inspired by all of my friends to stage a robbery the third Saturday I clocked in.,1,in fact i got fired cause i was inspired by all of my friends to stage a robbery the third saturday i clocked in.,24
3221,Got laid off and paid today. W.e. Im in the union I start working in the next 2 days.,1,got laid off and paid today. w.e. im in the union i start working in the next 2 days.,19
7729,Despite the fact that many DJs are being laid off I really want to purchase a Apple laptop a lot of remix music programs and such so....,0,despite the fact that many djs are being laid off i really want to purchase a apple laptop a lot of remix music programs and such so....,27
9517,Anyone looking for a full-time position working on mobile/iOS app design? Salary + benefits. hi (at) http://t.co/fCWA9Cvz8K,0,anyone looking for a full-time position working on mobile/ios app design? salary + benefits. hi (at) http://t.co/fcwa9cvz8k,17
9438,Yooooo today is the first day Ive been unemployed in 7 years fuck my life,1,yooooo today is the first day ive been unemployed in 7 years fuck my life,15
5587,Currently trying to learn how to skateboard again and I hate myself for ever quitting,0,currently trying to learn how to skateboard again and i hate myself for ever quitting,15
1828,I still search for that one employer who doesnt see me as a risk because I would really love a bit more financial security...,0,i still search for that one employer who doesnt see me as a risk because i would really love a bit more financial security...,24
4499,Anyone hiring? Im in desperate need of a job ... Just got kicked out with nothing.,1,anyone hiring? im in desperate need of a job ... just got kicked out with nothing.,16
9060,I am currently working on mt resume instead of doing my work. Happy Monday,0,i am currently working on mt resume instead of doing my work. happy monday,14
1985,I recently quit my job to bring in $9023 from my phone PRESS THE LINK INSIDE BIO to do the same https://t.co/r6sg27fltC,1,i recently quit my job to bring in $9023 from my phone press the link inside bio to do the same https://t.co/r6sg27fltc,22
3791,I am now a libertarian.,0,i am now a libertarian.,5
6791,Anyone know any lawnmower repair person that charges fairly and does good/quick work???,0,anyone know any lawnmower repair person that charges fairly and does good/quick work???,13
8845,Tomorrow is pay day at work. I was hired on over a month ago and still havent received one. My paycard still isnt in yet aka bad fing news,1,tomorrow is pay day at work. i was hired on over a month ago and still havent received one. my paycard still isnt in yet aka bad fing news,29
9220,So I turned 17 today still unemployed and cant drive.. At least I got a full stomach. #blessed,1,so i turned 17 today still unemployed and cant drive.. at least i got a full stomach. #blessed,18
270,Got a job at @CottonOn today! Was hired right on the spot! A very good day! Really made me feel good since the start of the week was bad,0,got a job at @cottonon today! was hired right on the spot! a very good day! really made me feel good since the start of the week was bad,29
4982,Anyones jobs hiring???,0,anyones jobs hiring???,3
8393,Was I Fired or Laid Off? https://t.co/gMxZ8Ae3n5,1,was i fired or laid off? https://t.co/gmxz8ae3n5,7
5102,My job thinks they slick sending me a termination paper bitch please not showing up to work that last 4 times didnt tell you i quit?,1,my job thinks they slick sending me a termination paper bitch please not showing up to work that last 4 times didnt tell you i quit?,26
6943,This week I fired more than 900 rounds in training to defend myself &amp; my family against criminals and tyranny. What did you do?,0,this week i fired more than 900 rounds in training to defend myself &amp; my family against criminals and tyranny. what did you do?,24
6446,Looking for something to do in todays Real Estate Market? Ask me about the Eddie Nivens story. He started from scratch after being laid off,0,looking for something to do in todays real estate market? ask me about the eddie nivens story. he started from scratch after being laid off,25
627,Too Young to Retire Too Old to Get Hired?  http://t.co/V7z8EdIAgX  http://t.co/lE5pbEarfx,0,too young to retire too old to get hired?  http://t.co/v7z8ediagx  http://t.co/le5pbearfx,13
991,Interested in a #job in #Pennsylvania 526? This could be a great fit: https://t.co/Qifzt9Yt8F #NowHiring #GetHired #Hiring,0,interested in a #job in #pennsylvania 526? this could be a great fit: https://t.co/qifzt9yt8f #nowhiring #gethired #hiring,17
1728,I hope your happy paying all us unemployment Obama!! Cuz looks like here soon were all getting laid off,0,i hope your happy paying all us unemployment obama!! cuz looks like here soon were all getting laid off,19
8660,Earlier this week I was asked what I thought was the most valuable marketing skills. A: growing network prototyping &amp; value creation.,0,earlier this week i was asked what i thought was the most valuable marketing skills. a: growing network prototyping &amp; value creation.,22
3562,Okay I need to get a job now this unemployment life was nice for awhile lol,1,okay i need to get a job now this unemployment life was nice for awhile lol,16
3843,I am now a drafting engineer what an opportunity.,0,i am now a drafting engineer what an opportunity.,9
9101,i havent worked in like 3 months. no way i got fired. must be laid off.,1,i havent worked in like 3 months. no way i got fired. must be laid off.,16
6234,Apple posted a job you might be interested in: Genius - Retail Technical Support - Santa Barbara California Area US.,0,apple posted a job you might be interested in: genius - retail technical support - santa barbara california area us.,20
5407,Metro is def about to fire me lol I only work there once a week and I had to call out the last two weeks bc sick and now again this week bc,0,metro is def about to fire me lol i only work there once a week and i had to call out the last two weeks bc sick and now again this week bc,33
7335,Ah yes another very productive day of doing nothing. Unemployment is going quite well thank you,1,ah yes another very productive day of doing nothing. unemployment is going quite well thank you,16
3556,I do my job well why you think you unemployed,0,i do my job well why you think you unemployed,10
6885,You Might Get Fired for Talking Trash Against #Hillary and #Donald but in a liberal world we can  by Paul Haeder https://t.co/DXR5GQbXCK,0,you might get fired for talking trash against #hillary and #donald but in a liberal world we can  by paul haeder https://t.co/dxr5gqbxck,23
8235,Character Analysis Case Files work well for any novel or short story!  Your students will act as t http://t.co/FTb2FKlgTS,0,character analysis case files work well for any novel or short story!  your students will act as t http://t.co/ftb2fklgts,20
4686,BROWN RECLUSE IN THE BATHROOM AT WORK LETS JUSTS I AM NOW UNEMPLOYED,1,brown recluse in the bathroom at work lets justs i am now unemployed,13
3482,So they fired the jackasses that were in charge yesterday and today I was told that Im in pole position to take over smh,0,so they fired the jackasses that were in charge yesterday and today i was told that im in pole position to take over smh,24
9433,One of coworkers fist bumped me and blew it up today so now Im unemployed again.,1,one of coworkers fist bumped me and blew it up today so now im unemployed again.,16
882,RT @josephlawler: 2016 is really the 1st year of the recovery in which unemployed people began finding jobs rather than quitting the… ,0,rt @josephlawler: 2016 is really the 1st year of the recovery in which unemployed people began finding jobs rather than quitting the…,22
960,Get HIRED Today to Work for @LoveNightClubDc were HIRING for Multiple positions Txt 3013436531 for application http://t.co/bJXKRYU5iy,0,get hired today to work for @lovenightclubdc were hiring for multiple positions txt 3013436531 for application http://t.co/bjxkryu5iy,17
2320,The reason why I am #homeless after losing my job is that after taxes rent and medical bills I could not afford rent or a car anymore,1,the reason why i am #homeless after losing my job is that after taxes rent and medical bills i could not afford rent or a car anymore,27
4846,Im watching the Doctor Who 50th Anniversary Special because Im a big Doctor Who fan and Im also very unemployed.,1,im watching the doctor who 50th anniversary special because im a big doctor who fan and im also very unemployed.,20
6042,Kaine who did a terrible job in NJ &amp; he was not very popular in NJ You mean Virginia? Is there anything not beyond Trump? #DNCinPhilly,0,kaine who did a terrible job in nj &amp; he was not very popular in nj you mean virginia? is there anything not beyond trump? #dncinphilly,26
4749,Who hiring??????,0,who hiring??????,2
1203,Today I was laid off from my ultrasound job due to cutbacks. But its all good bc Ill be at the @jakeowen concert next Thursday!!,1,today i was laid off from my ultrasound job due to cutbacks. but its all good bc ill be at the @jakeowen concert next thursday!!,25
1983,Recently I was talking to my therapist about how since I got my new job I stopped crying all the time.,0,recently i was talking to my therapist about how since i got my new job i stopped crying all the time.,21
326,i am thinking of changing my internship workplace if it is Gods will and i am searching for a place  http://t.co/GuAdDjDAku #pray #prayer,0,i am thinking of changing my internship workplace if it is gods will and i am searching for a place  http://t.co/guaddjdaku #pray #prayer,24
778,New Yorkers: its hard to compete with the sunny weatherbut we have an intern position you might be interested in. check us out on FB.,0,new yorkers: its hard to compete with the sunny weatherbut we have an intern position you might be interested in. check us out on fb.,25
2273,Looking for a job? (Raleigh 1) Renewable Energy Crew Laborer at Baker Roofing Company (Raleigh NC) http://t.co/ZaC5mTCM #green #jobs,0,looking for a job? (raleigh 1) renewable energy crew laborer at baker roofing company (raleigh nc) http://t.co/zac5mtcm #green #jobs,19
8288,I got hired at a Bangladesh sweatshop. Meet my 9-year-old boss [video] http://t.co/huyYR3Ti9U,0,i got hired at a bangladesh sweatshop. meet my 9-year-old boss [video] http://t.co/huyyr3ti9u,13
3114,Two people at my job today quit sorry but when things get hard you have to persevere or life will hit you harder and harder,0,two people at my job today quit sorry but when things get hard you have to persevere or life will hit you harder and harder,25
5432,Leaving work and knowing you have to be back in less than 9 hours feels how comm arts smelled earlier this week bad.,0,leaving work and knowing you have to be back in less than 9 hours feels how comm arts smelled earlier this week bad.,23
5011,I got fired from my job today!  Its about time!  I hated that place,1,i got fired from my job today!  its about time!  i hated that place,16
2209,Lord. As of 30 minutes ago Im officially unemployed and I couldnt feel better about everything.,1,lord. as of 30 minutes ago im officially unemployed and i couldnt feel better about everything.,16
1806,I am searching for a project general manager based in Sydney for a top real estate company from China tell me if  interested,0,i am searching for a project general manager based in sydney for a top real estate company from china tell me if  interested,24
4825,How would you like to be #unemployed and not be able to find a job? I am trying to create my own jobs. http://t.co/oqPVgtJel2 Help please.,1,how would you like to be #unemployed and not be able to find a job? i am trying to create my own jobs. http://t.co/oqpvgtjel2 help please.,26
5745,Instead of saying I was unemployed on my resume I just say that I was great at The Price Is Right.,1,instead of saying i was unemployed on my resume i just say that i was great at the price is right.,21
5186,Here are 4 critical lessons one person learned after getting laid off that you may be able to relate to: http://t.co/fEu3pwrNeD #careertips,0,here are 4 critical lessons one person learned after getting laid off that you may be able to relate to: http://t.co/feu3pwrned #careertips,22
3561,I asked my mom when shes gonna buy me an IPad and she said and I quote When you gonna get a job shes crazy. #Unemployment,1,i asked my mom when shes gonna buy me an ipad and she said and i quote when you gonna get a job shes crazy. #unemployment,26
6424,My sister was laid off yesterday just in time for the holidays. Way to take care of your people @HiltonHotels.,0,my sister was laid off yesterday just in time for the holidays. way to take care of your people @hiltonhotels.,20
