id,text,class,ProcessedText,ProcessedText_length
4455,Well shit i needa find a new job anyone know any hiring???,0,well shit i needa find a new job anyone know any hiring???,12
9448,Today I am essentially a rich housewife. Went to the gym shopped got my nails done and went to whole foods. I dont hate being unemployed,1,today i am essentially a rich housewife. went to the gym shopped got my nails done and went to whole foods. i dont hate being unemployed,26
3189,Well my life has changed again. I was laid off from my position yesterday due to sales has decreased drastically... http://t.co/NtesFPKvky,1,well my life has changed again. i was laid off from my position yesterday due to sales has decreased drastically... http://t.co/ntesfpkvky,21
2217,Have you seen my mid-week video? I decided to vlog whilst unemployed! http://t.co/HrrU0wdnx7 #lbloggers #crazybloggers #bdib,1,have you seen my mid-week video? i decided to vlog whilst unemployed! http://t.co/hrru0wdnx7 #lbloggers #crazybloggers #bdib,16
6445,Go hard for a boss or get laid off...,0,go hard for a boss or get laid off...,9
9192,They are keeping me unemployed and forced me on medicare to make me appear to be crazy and uneducated,1,they are keeping me unemployed and forced me on medicare to make me appear to be crazy and uneducated,19
7613,Here is your opportunity to make money free tour lets you in the back office http://t.co/V4Eh4ORSy5 #work #workathome #payday,0,here is your opportunity to make money free tour lets you in the back office http://t.co/v4eh4orsy5 #work #workathome #payday,19
7371,See my answer on @Avvo to: Can I claim unemployment if I quit due to stress and cause for conc... #unemployment http://t.co/pIdKFqg8Nb,0,see my answer on @avvo to: can i claim unemployment if i quit due to stress and cause for conc... #unemployment http://t.co/pidkfqg8nb,22
18,jesus christ: recently laid off tesla employees are publicly thanking elon musk after losing their jobshttps://t.co/l3JQBXqnNy https://t.co/iEV5xNDX3r,0,jesus christ: recently laid off tesla employees are publicly thanking elon musk after losing their jobshttps://t.co/l3jqbxqnny https://t.co/iev5xndx3r,17
5368,I am getting this job as an intern got my rotation I wanted got elected a prestigious position and am doing well in school!,0,i am getting this job as an intern got my rotation i wanted got elected a prestigious position and am doing well in school!,24
4872,Anyones work hiring or know a place that is hiring ??,1,anyones work hiring or know a place that is hiring ??,11
8179,I need to be sleep got to work 8am-4pm then other job is 5-10. Smfh.,0,i need to be sleep got to work 8am-4pm then other job is 5-10. smfh.,15
4159,Im currently unemployed and Im not going to school till Jan I can literally chill all day,1,im currently unemployed and im not going to school till jan i can literally chill all day,17
9378,Looking For Entry-Level Social Media Work? 5 Tips To Get Hired http://t.co/LICfNcWh9D,1,looking for entry-level social media work? 5 tips to get hired http://t.co/licfncwh9d,12
3323,Apple Hires Burberry CEO To Improve Customer Experience: Earlier this week it was announced that Apple hired Burberrys CEO Angela Ah...,0,apple hires burberry ceo to improve customer experience: earlier this week it was announced that apple hired burberrys ceo angela ah...,21
7918,When I left tonight my manager said to me dont quit jokingly and I just thought bro just dont fire me first at this rate lool,0,when i left tonight my manager said to me dont quit jokingly and i just thought bro just dont fire me first at this rate lool,26
6257,The Honest Company posted a job you might be interested in. QA Automation Engineer - Greater Los Angeles Area U... http://t.co/hodyLuVHUG,0,the honest company posted a job you might be interested in. qa automation engineer - greater los angeles area u... http://t.co/hodyluvhug,21
7902,Another new hire quit. The rate of retention sucks here so either Im tough  good  desperate or a mix of all of them,0,another new hire quit. the rate of retention sucks here so either im tough  good  desperate or a mix of all of them,25
2325,I will never understand unemployed people cause Ive NEVER been without a job.,0,i will never understand unemployed people cause ive never been without a job.,13
5309,Im at party in LA and ppl are asking me what I do Im unemployed loser baby but Im saying cartoonist hehehehhoohohohhaha :o),1,im at party in la and ppl are asking me what i do im unemployed loser baby but im saying cartoonist hehehehhoohohohhaha :o),23
8221,A writer understands his work as something that originates with him but then with any luck gets away... http://t.co/CyHLlENS,0,a writer understands his work as something that originates with him but then with any luck gets away... http://t.co/cyhllens,19
9392,GOT THE INTERVIEW IN THE AM I HOPE I GET HIRED ON THE SPOT CAUSE I GOT CAUGHT UP WITH MY UNEMPLOYMENT THEY FOUND OUT I WORKED FOR 6 HRS LOL,1,got the interview in the am i hope i get hired on the spot cause i got caught up with my unemployment they found out i worked for 6 hrs lol,31
912,I applied for a job position and surprisingly I got a call back today ya girl is making moves,1,i applied for a job position and surprisingly i got a call back today ya girl is making moves,19
1244,Once you find agency opportunities you are interested in contact the agency to find out what paperwork is required to bid for the contract.,0,once you find agency opportunities you are interested in contact the agency to find out what paperwork is required to bid for the contract.,24
2095,Looking to relocate? Join PepsiCo as a Sales District Leader - Designate. Apply: https://t.co/YjsNFaLOQ3 #GetHired #Career,0,looking to relocate? join pepsico as a sales district leader - designate. apply: https://t.co/yjsnfaloq3 #gethired #career,16
9099,@hollak77 @cneesam i actually got hired at one in madison and then laid off before my first shift so that was nice,1,@hollak77 @cneesam i actually got hired at one in madison and then laid off before my first shift so that was nice,22
599,Has anyone else hired a professional deep cleaner? https://t.co/CbI0GfvLoQ #clean https://t.co/ZNX8hBjCz8,0,has anyone else hired a professional deep cleaner? https://t.co/cbi0gfvloq #clean https://t.co/znx8hbjcz8,11
4007,I recently hired a personal trainer. Because I missed having a man in my life asking me to pick up his dead weight. #ikid,0,i recently hired a personal trainer. because i missed having a man in my life asking me to pick up his dead weight. #ikid,24
2051,Looking to hire or be hired? Check out our job board for all your employment opportunities &gt;&gt; https://t.co/n5Odyl7Bvs,0,looking to hire or be hired? check out our job board for all your employment opportunities &gt;&gt; https://t.co/n5odyl7bvs,18
7537,I am currently unemployed. But I do wish both teams and teammates the best of luck and injury free season https://t.co/l0NwPJOM3L,1,i am currently unemployed. but i do wish both teams and teammates the best of luck and injury free season https://t.co/l0nwpjom3l,21
5091,Im gone have 56 hours on my first check at my new job .,0,im gone have 56 hours on my first check at my new job .,14
306,i got paid today and i didnt even know i was getting paid IT WAS A GOOD DAY,0,i got paid today and i didnt even know i was getting paid it was a good day,18
4395,I am unable to quit as I am currently legit.,0,i am unable to quit as i am currently legit.,10
8364,So I got laid off this week. Company I worked for is going under it seams. I hate change  but change is probably the best thing right now.,1,so i got laid off this week. company i worked for is going under it seams. i hate change  but change is probably the best thing right now.,29
3394,So does Rutgers actually do employment background checks or do they just hire whoever?! And the persons hiring should be fired too!!!,0,so does rutgers actually do employment background checks or do they just hire whoever?! and the persons hiring should be fired too!!!,22
74,I Just Got Laid Off … Now What? http://t.co/gqVcv99got #jobsearch,1,i just got laid off … now what? http://t.co/gqvcv99got #jobsearch,10
2200,Today I became unemployed.   Please visit http://t.co/zH0tVlyhdv and let me know how I can help your company,1,today i became unemployed.   please visit http://t.co/zh0tvlyhdv and let me know how i can help your company,19
2587,Jesse Sorensen claims that Dixie Carter is a liar and fired him after telling him he would always have a job in TNA. Thoughts? #RumorTalk,0,jesse sorensen claims that dixie carter is a liar and fired him after telling him he would always have a job in tna. thoughts? #rumortalk,25
2240,Last summer I was making 300 dollars a week now Im unemployed and probably -$600,1,last summer i was making 300 dollars a week now im unemployed and probably -$600,15
9250,Strong developing background? Senior Java Software Developer Position available in Boca Raton FL http://t.co/8Hcaa13ndv,0,strong developing background? senior java software developer position available in boca raton fl http://t.co/8hcaa13ndv,14
5845,Now hiring: someone to stand near me whose sole job is to swat Mosquitos!!! #plague,0,now hiring: someone to stand near me whose sole job is to swat mosquitos!!! #plague,15
2399,Does anyone know anywhere thats hiring??,1,does anyone know anywhere thats hiring??,6
5447,So earlier this week I was joking about getting sick so I wouldnt have to go to work and now im actually sick,0,so earlier this week i was joking about getting sick so i wouldnt have to go to work and now im actually sick,23
8762,Looking for the best way to create new business? Lead Generation is #1 http://t.co/3gAqPcQehB #LeadFlash #LeadGen #LeadGeneration #Affiliate,0,looking for the best way to create new business? lead generation is #1 http://t.co/3gaqpcqehb #leadflash #leadgen #leadgeneration #affiliate,18
499,I GOT FIRED FROM MY JOB so now I have lots of time to read books and make smoothies and think hateful thoughts about my former employers.,1,i got fired from my job so now i have lots of time to read books and make smoothies and think hateful thoughts about my former employers.,27
3502,Got another 2 interviews this week but i really think i got this position i really want as a substance abuse counselor. Patiently waiting,1,got another 2 interviews this week but i really think i got this position i really want as a substance abuse counselor. patiently waiting,24
7741,I am currently a vegetable. No joke.,0,i am currently a vegetable. no joke.,7
4188,Just finished my last day at work after 4 years. I am officially unemployed,1,just finished my last day at work after 4 years. i am officially unemployed,14
1208,Yesterday I was laid off. Today I played with my kiddo talked with a TON of people am sprucing up my resume coffee meeting at 2. #islay,1,yesterday i was laid off. today i played with my kiddo talked with a ton of people am sprucing up my resume coffee meeting at 2. #islay,27
9134,I pretty much got laid off because the manager didnt do his job of calling me and apparently I missed two shifts. He put that on himself,1,i pretty much got laid off because the manager didnt do his job of calling me and apparently i missed two shifts. he put that on himself,27
6294,Manager got on my ass cause a customer got mad earlier..Nigga I quit in a week anyway!Fuck out my faceee ! lol,0,manager got on my ass cause a customer got mad earlier..nigga i quit in a week anyway!fuck out my faceee ! lol,22
7180,Looking to invest in private equity w/ a self directed ira? https://t.co/5y1gRAEDzh #selfdirectedira #privateequity https://t.co/ycY3H1enaj,0,looking to invest in private equity w/ a self directed ira? https://t.co/5y1graedzh #selfdirectedira #privateequity https://t.co/ycy3h1enaj,15
2694,#Columbus GA #Retail #Job: Retail Store Positions at CVS Health https://t.co/tG9OZatDVl #Jobs #Hiring #CareerArc,0,#columbus ga #retail #job: retail store positions at cvs health https://t.co/tg9ozatdvl #jobs #hiring #careerarc,14
2212,Being unemployed is not good for me. I thought today was Monday.,1,being unemployed is not good for me. i thought today was monday.,12
5685,I got sick &amp; hospitalized w/ no insurance got laid off. am recovering still on the road to recovery while job hunting AGAIN @BarackObama,1,i got sick &amp; hospitalized w/ no insurance got laid off. am recovering still on the road to recovery while job hunting again @barackobama,24
5960,Motherfuckers fired me for stupid shit,1,motherfuckers fired me for stupid shit,6
4812,I am seriously thinking if running for office as a broke unemployed shlub. I have more in common with average people than millionaire twits.,1,i am seriously thinking if running for office as a broke unemployed shlub. i have more in common with average people than millionaire twits.,24
900,If you are searching for a job or internship follow my feed. I will do my best to retweet all positions that come my way.,0,if you are searching for a job or internship follow my feed. i will do my best to retweet all positions that come my way.,25
9410,#EverydaySexism Constantly not being hired for jobs because I am a mother has become worse now that I am a single mother.,1,#everydaysexism constantly not being hired for jobs because i am a mother has become worse now that i am a single mother.,22
81,Got hired and unhired because I tested positive good morning,1,got hired and unhired because i tested positive good morning,10
9440,Got complemented on the accomplishments of my widely duties today. Day number 1 as an unemployed housewife: complete.,1,got complemented on the accomplishments of my widely duties today. day number 1 as an unemployed housewife: complete.,18
758,Interested in a new #Mobile #Applications job? Its your lucky day! We have more than 37.7K open positions here: https://t.co/VWu9on7N6M,0,interested in a new #mobile #applications job? its your lucky day! we have more than 37.7k open positions here: https://t.co/vwu9on7n6m,20
2340,Now I am actively looking for jobs in Manhattan and uggh I hate looking for jobs,1,now i am actively looking for jobs in manhattan and uggh i hate looking for jobs,16
6916,you might get fired and you might not be able to get a job just because you think this and that about their religion! this stupid attitude,0,you might get fired and you might not be able to get a job just because you think this and that about their religion! this stupid attitude,27
4154,I am currently unemployed. Temporarily but still very strange feeling.,1,i am currently unemployed. temporarily but still very strange feeling.,10
4863,#unemployed How to keep a great attitude 85%+ of the time during unemployment? Feed your mind and spirit with positive stuff. Avoid drama!,0,#unemployed how to keep a great attitude 85%+ of the time during unemployment? feed your mind and spirit with positive stuff. avoid drama!,23
5689,My job laid off 600 people at hospital. I am scared hours decreased. I am ultrasound tech. Hard to ~ https://t.co/JI2GIUFoO2 #pray #prayer https://t.co/WYzcnmtGVl,0,my job laid off 600 people at hospital. i am scared hours decreased. i am ultrasound tech. hard to ~ https://t.co/ji2giufoo2 #pray #prayer https://t.co/wyzcnmtgvl,24
7029,So i lost 200 dollars today from a transaction at work... It is lit..,0,so i lost 200 dollars today from a transaction at work... it is lit..,14
4611,Today I said fuck a job and quit.,1,today i said fuck a job and quit.,8
6599,One of my friends/co-workers got fired today &amp; as I was going through a car wash thinking about it. The worker there said pray for him. Amen,0,one of my friends/co-workers got fired today &amp; as i was going through a car wash thinking about it. the worker there said pray for him. amen,27
5252,I have *TRIED* to take on the white feminists and misogyny within social justice movements and here I am unemployed being told to keep going,1,i have *tried* to take on the white feminists and misogyny within social justice movements and here i am unemployed being told to keep going,25
3367,Steven just got hired for a job he didnt apply for but I applied for a job and got fired in a day,1,steven just got hired for a job he didnt apply for but i applied for a job and got fired in a day,23
4801,I #need #cash #fast but i am unemployed https://t.co/j8o355OMXz,1,i #need #cash #fast but i am unemployed https://t.co/j8o355omxz,9
9464,I cleaned up my house today because being unemployed I have no excuse for how filthy it was.,1,i cleaned up my house today because being unemployed i have no excuse for how filthy it was.,18
8220,A lot of people are like you when theyre drunk. What are you like? -a coworker,0,a lot of people are like you when theyre drunk. what are you like? -a coworker,16
8391,I didnt get fired I was laid off. But you Wudnt no the difference.,1,i didnt get fired i was laid off. but you wudnt no the difference.,14
3105,yesterday I quit my job &amp; today I spent all day riding roller coasters,1,yesterday i quit my job &amp; today i spent all day riding roller coasters,14
1015,Interested in a #job in #Irvine California? This could be a great fit: https://t.co/fNCxRBzqk8 #NowHiring #GetHired #IT #Hiring,0,interested in a #job in #irvine california? this could be a great fit: https://t.co/fncxrbzqk8 #nowhiring #gethired #it #hiring,18
5772,Being unemployed (sorry a small business owner) has afforded me the time to do exciting things like put salsa in my scrambled eggs.,1,being unemployed (sorry a small business owner) has afforded me the time to do exciting things like put salsa in my scrambled eggs.,23
3571,Im tired of hearing Obama Care this Obama Care that Im tired of hearing a bunch of phony numbers about jobs unemployment etc. (Cont).,0,im tired of hearing obama care this obama care that im tired of hearing a bunch of phony numbers about jobs unemployment etc. (cont).,24
2697,#Fremont #Job Retail Sales Associate (part:time) Job - (fremont california): Req188916BRPosition TitleRetail ... https://t.co/pj5yfJkNCS,0,#fremont #job retail sales associate (part:time) job - (fremont california): req188916brposition titleretail ... https://t.co/pj5yfjkncs,14
8410,@eight_oh_eight I wasnt fired I was laid off but you wouldnt know the difference!!!,1,@eight_oh_eight i wasnt fired i was laid off but you wouldnt know the difference!!!,14
7660,New job have being laid off for 9 months!!  Work is tiring!,0,new job have being laid off for 9 months!!  work is tiring!,13
7703,I have been laid off for two years.I need the Lord to help me find a source of income.In Jesus name A http://t.co/BW12CkiOK5 #pray #prayer,1,i have been laid off for two years.i need the lord to help me find a source of income.in jesus name a http://t.co/bw12ckiok5 #pray #prayer,25
8588,Unemployed or Know Someone Who Is? Latest on Benefits Debate: A look at the current debate over the extension of... http://t.co/NSjpNyKVIn,0,unemployed or know someone who is? latest on benefits debate: a look at the current debate over the extension of... http://t.co/nsjpnykvin,21
9215,8th day being unemployed I think some fabric tore inside of my leg fuck my life,1,8th day being unemployed i think some fabric tore inside of my leg fuck my life,16
1536,Apple rewards CEO Tim Cook with $58M for bang-up job on Wall Street: Apple CEO Tim Cook earlier this week was... http://t.co/yXt9VhVTi2,0,apple rewards ceo tim cook with $58m for bang-up job on wall street: apple ceo tim cook earlier this week was... http://t.co/yxt9vhvti2,22
8778,Looking to start a new career? GIS jobs to grow 20% over next decade. Check the AUM GIS program. http://t.co/9T04gn1hlh. #chooseaum,0,looking to start a new career? gis jobs to grow 20% over next decade. check the aum gis program. http://t.co/9t04gn1hlh. #chooseaum,21
3460,Do You Hire A Previously Fired Head Coach or Up And Coming Assistant Coach? Discussion Thread - http://t.co/PxeNDb8AXg #titans,0,do you hire a previously fired head coach or up and coming assistant coach? discussion thread - http://t.co/pxendb8axg #titans,19
5910,My new Job site has 4 floorsa Elevator and a pool https://t.co/D0W7wLa1l6,0,my new job site has 4 floorsa elevator and a pool https://t.co/d0w7wla1l6,12
1294,Heres a solution to those PhDs getting by on 3 part-time teaching jobs for 8 years. Quit. Do something else. Quit being exploited,0,heres a solution to those phds getting by on 3 part-time teaching jobs for 8 years. quit. do something else. quit being exploited,23
4745,Anyone hiring...I really need a job. I am so tired of getting screwed over and stupid people getting picked over me.,1,anyone hiring...i really need a job. i am so tired of getting screwed over and stupid people getting picked over me.,21
5072,So my manager got fired from my job making around 30000 a year and now hes getting paid 80000-120000 at his new job #blessingindisguise,0,so my manager got fired from my job making around 30000 a year and now hes getting paid 80000-120000 at his new job #blessingindisguise,24
2712,#Job #Baltimore Seeking __workers/ Assemblers/ production type Position ~$21.50-$21.50p/h: We are seeking 26 m... https://t.co/BX8eoUKEAJ,0,#job #baltimore seeking __workers/ assemblers/ production type position ~$21.50-$21.50p/h: we are seeking 26 m... https://t.co/bx8eoukeaj,15
6112,@yeshireda godddd yes lol in the summer its so humid and hot,0,@yeshireda godddd yes lol in the summer its so humid and hot,12
3763,Looking for a #Adjunct #Position – ​Principles of Marketing #jobs http://t.co/7U5AhGKDtN http://t.co/Mc4bIS0vxx,0,looking for a #adjunct #position – ​principles of marketing #jobs http://t.co/7u5ahgkdtn http://t.co/mc4bis0vxx,10
8541,experienced the most uncomfortable video chat job interview 2day but I got hired aka now I dont have to shower today,0,experienced the most uncomfortable video chat job interview 2day but i got hired aka now i dont have to shower today,21
4569,@GameDiviner @CHOBITCOIN @Yeefi @SKScarbine45 *salivates*You know I still havent fired a true WW2 battle rifle. I fired a Thompson and,0,@gamediviner @chobitcoin @yeefi @skscarbine45 *salivates*you know i still havent fired a true ww2 battle rifle. i fired a thompson and,20
9505,20 years working a job get laid off. Now its back to beginning,1,20 years working a job get laid off. now its back to beginning,13
4233,My boss fired me Friday and is now refusing to pay me for the hours w: I work in a private home doing care for... http://t.co/8UjRkVTu0J,1,my boss fired me friday and is now refusing to pay me for the hours w: i work in a private home doing care for... http://t.co/8ujrkvtu0j,26
7897,At my job I recently quit they suspended you if you even look at yo phone lol,1,at my job i recently quit they suspended you if you even look at yo phone lol,17
2105,Searching for #work in Andover MA? Send your #resume to Pfizer Korea Inc.. http://t.co/8PCDPg9Dxr #gethired,0,searching for #work in andover ma? send your #resume to pfizer korea inc.. http://t.co/8pcdpg9dxr #gethired,15
8490,My day is of to a good start just got called in for a job interview tomorrow,1,my day is of to a good start just got called in for a job interview tomorrow,17
2983,Weird state of my life. Yesterday I was being interviewed for a position today I was interviewing people for a position.,0,weird state of my life. yesterday i was being interviewed for a position today i was interviewing people for a position.,21
6680,Well I lost my job today because of some bullshit so if anybody know somewhere that is hiring hmu,1,well i lost my job today because of some bullshit so if anybody know somewhere that is hiring hmu,19
4184,Can anyone direct me to a job? I am currently unemployed and every job I have applied to has told me im not qualified. I have two college,1,can anyone direct me to a job? i am currently unemployed and every job i have applied to has told me im not qualified. i have two college,28
3230,Hi guys. I officially got laid off today. Send beer. Thanks. Also please hire me.,1,hi guys. i officially got laid off today. send beer. thanks. also please hire me.,15
6412,RT @billboard: At least 10 employees of Capitol Music Group were laid off late this week https://t.co/llNhGKlC7j,0,rt @billboard: at least 10 employees of capitol music group were laid off late this week https://t.co/llnhgklc7j,17
2152,Searching for #work in Warsaw IN? Send your #resume to Ivy Tech Community College. http://t.co/LWP93OYNuc #gethired,0,searching for #work in warsaw in? send your #resume to ivy tech community college. http://t.co/lwp93oynuc #gethired,16
5836,Any of yall niggas hiring ? Im quitting my job,0,any of yall niggas hiring ? im quitting my job,10
3741,Looking for #faculty opportunities?  #kstateHFRR has a position open as an Assistant Professor (5276): http://t.co/mAyx2sArNJ #agjobs,0,looking for #faculty opportunities?  #kstatehfrr has a position open as an assistant professor (5276): http://t.co/mayx2sarnj #agjobs,17
7451,Im officially unemployed today. :-( I did not get fired but the contract with my school ended today. #unemployed,1,im officially unemployed today. :-( i did not get fired but the contract with my school ended today. #unemployed,19
168,I got a raise today then showed up to work 30 mins late..,0,i got a raise today then showed up to work 30 mins late..,13
4538,#viral Fox Sports Reporter Emily Austen Fired After Insensitive Comments About Race... https://t.co/7OvnhO0cxY https://t.co/QPBwQrisTf,1,#viral fox sports reporter emily austen fired after insensitive comments about race... https://t.co/7ovnho0cxy https://t.co/qpbwqristf,14
8365,I Got Laid Off from My Dream Job—Heres What I Learned: From Marie Claire In 2008 I got laid off from my fir... https://t.co/sH30N5e1dU,1,i got laid off from my dream job—heres what i learned: from marie claire in 2008 i got laid off from my fir... https://t.co/sh30n5e1du,24
