,neg_model,pos_model,text
1197218,0.039525326,0.96047467,Annnndddd work blew this morning.. I hate OU fans. Always tip bad.
7625095,0.039531473,0.96046853,I just threw up at work lmao
2645019,0.03954202,0.9604579,I swear after lab this mornin I just quit the rest of the day
6237847,0.039552283,0.9604476999999999,@notrinap bruh I threw up in the morning before work a couple of weeks ago and still went. Gotta keep grindin
6985377,0.039555494,0.9604444999999999,"I got food poisoning, and tried to flush it out with beer last night. Didn't work."
6620783,0.039559443,0.9604405999999999,I saw my ex broken down with 2 flat tires this mornin which made me late for work..9 times I drove past before he noticed me laughin at him.
6142151,0.039565064,0.960435,Hit myself in the face with the vacuum cleaner at work now it's swollen.
711569,0.039568044,0.960432,Smashed my pinky at work. It hurts!
3326539,0.039572347,0.9604277,I think my boss forgot to come to work today...
8059611,0.039581686,0.96041834,Went outside for 10 seconds and I got bit by a mosquito.
