,neg_model,pos_model,text
5483721,0.05319024,0.9468098,My friends get mad about working at 9 and staying up until 1.. I stay up until 5 and still accidentally wake up at 7:30 fuck sleep
72740,0.05319334,0.9468067,Lol I've had 4 days to do my homework and I still haven't done it
7654156,0.053194728,0.9468053,"Fuck you rain! Go away, I'm trying to go to work."
7084110,0.053197563,0.94680244,Now that I got laid off I still.don't have a life! What the hell is wrong with me? I shower daily
5742626,0.05320319,0.9467968,Wow idk why I am so axnious to be off work rn lol I am litterallly not gonna do anything when I get home.
5894742,0.053205676,0.94679433,"I :hat  these stupid social networks , I just get on cuss I be bored"
2211934,0.05320927,0.94679075,Damn I'm tired and I still gotta do homework like wow life sucks at times
3569206,0.053210147,0.9467898,@RandallSimental I got fired 😂
9153417,0.05321526,0.9467847,Underwork binders succccks I am bruised all over
339460,0.05321557,0.9467844,Y'all just wanna keep up with ppl on social networks that don't give a fuck about y'all anyway. My rant is over lol.
618899,0.05321653,0.94678354,My works internet is down. TO FUCKING SMOKE WEED DOG!
5655329,0.053216584,0.9467834,Well not hate but I do find her real real fuckin annoying. Like I want her fired annoying lol. I'm sorry 😭
8374340,0.053218316,0.9467817,I'm jobless now.
6866318,0.05322079,0.94677925,I have I go to work shortly and I just realized the kitchen sink is leaking and flooding my kitchen.
1967695,0.05322346,0.94677657,I have decided to quit school and become a cannibal.
4995138,0.05322367,0.94677633,Sonita gone ask me am I coming home from work.. like I dontt have a life.
6100011,0.053224057,0.9467759,Everytime I try and quit smoking I end up back smoking smh. Want to quit but I cant.
656359,0.05322545,0.94677454,I'm mad bored at work. I've been prank calling mad people none of them successfully because I end up laughing. Lmao I'm mad childish
3260163,0.0532266,0.94677335,Called out and took some PTO. Fuck it. I’m sick and have been working like a slave thru it all. I just need a day.