id,text,class
1280,My wifi at home is not working for reason so I go to Tim Hortons to get their wifi and the guy was like our wifi is currently not working,0
5033,RT @markweaver: I got laid off today. Looking for a new gig full time or freelance. Hit me up ✌,1
4994,So earlier this week I was joking about getting sick so I wouldnt have to go to work and now im actually sick,0
3325,Hired or Fired :) https://t.co/H9xZDjqJmt,0
1666,Got fired got hired and quit a job all in the same day 😂 aint that some SHITTT,1
4457,Today I said fuck it..I quit my job and became a #unicron,1
4252,I am unable to quit as I am currently too legit.,0
4235,Employer just emailed a link for a juice cleanse. I am quitting.,0
3749,Annnnnd now I am officially unemployed.,1
2217,Two weeks officially #unemployed and Ive recon firmed that being a #SAHM is not my thing. Best enjoy it whilst I can!,1
2178,You can tell Ive been unemployed for 2 weeks. Wrote 2012 on all of my paperwork this morning. Oops.,1
624,Has anyone ever been #hired concurrently with their new #boss?  Who comes first in the #hiring #process?,0
4792,Well I was fired from my job today (officially seeing how it is I have been suspended since last Wednesday).  Life goes on.,1
2945,I recently decided that I need to make less garbage which means cutting down heavily on plastics. This means not ordering lunch every day at work one of the things I look forwards to the most at work.This is gonna be rough.,0
4066,GFS calls me telling me that I work today but they fired me on Sunday?????,1
5357,Amazon posted a job you might be interested in. Technical Account Manager - Beijing City China CN via LinkedIn http://t.co/34zWPHtZuB,0
1713,Welp.  Laid off again.  If I do such good work whys no one wanna keep me around?#unemployed,1
4603,Car was towed today alhough Ive been unable to drive for a month &amp; I have to find 100s to get it even tho Ive been unemployed for a month.,1
5069,Recently laid off? Worried about losing health coverage or the high cost of the alternative option? Think you... http://t.co/u8S6yR3UyL,0
2004,As you all know I recently was let go at my job. You also know I am in Love with Jamberry. So here I go I just started on my journey wit...,1
2019,Looking for a new job in 2016? NPA Career Central - Connecting Parking Pros &amp; Employers. Get Hired! Hire Smart! https://t.co/A293evFzvd,0
1132,I got laid off my job today. If anyone knows someone looking for a social/digital marketer with a can do attitude in the LA area hit me up.,1
4888,Since i am unemployed now i am becoming the family taxi and errand runner :(,1
3336,The 49rs fired Natalies dad just go hire Chip Kelly??!,0
5169,Bad news: got laid off at work today. Good news: I now have time for that nap I desperately need.,1
3540,HeyI got laid off from Alorica. Of anyone knows a place thats hiring Let me know.,1
5355,Interested in a Sales job? A career in Real Estate might be for you! Come meet us for career opportunities! https://t.co/nz937tWwn4,0
3645,Looking for an accounting internship?  Apply on Colonial Trak for the McConway &amp; Torley LLC Accouting Internship Position.  Job ID 44616https://t.co/HOBoCgn9kW https://t.co/eiRzlUzs6u,0
1514,i recently started doing this thing where if someone randomly pops into my mind i say a quick prayer for them and i can 100% see God working in those relationships.,0
3170,I got laid off of my job today..... Perfect :/,1
3632,Looking for a #Senior #Litigation Paralegal - New Position!! #jobs http://t.co/7lZCvQeQ4L,0
1169,In other news I got laid off today. #ayyyyyye,1
5165,As of now I am officially laid off. Yippee.,1
1879,RT @newsobserver: Did Pat McCrory really get laid off as he says in campaign video? https://t.co/s748inmQSw #ncpol https://t.co/oef2pkyb0e,0
5162,So today I started out my birthday with being laid off work. Unemployment here I come. :/,1
497,I GOT FIRED FROM MY JOB so now I have lots of time to read books and make smoothies and think hateful thoughts about my former employers.,1
1691,I quit my job yesterday &amp; got a raise today :),1
3418,I got fired from my GM position 😔😔 https://t.co/eUem1QNWPa,1
3172,Got laid off from my job today.... #universityofiowa #pissedoff,1
3097,Today I quit my job and immediately had some retail therapy.. because logic 🤷🏻‍♀️,1
5534,I wasnt fired from my job I was laid off but you wouldnt know the difference!,1
4250,My laptop will not work and the light in my room just broke.. So I quit today.,0
2873,So Ive been unemployed for like 3 hours and I need to work.,1
647,Heres how to turn fired into hired http://t.co/tepZOs1ClD @CAREEREALISM,0
2283,Looking for a rewarding job in a great working environment? Look @ jobs posted on the Penn Emblem Careers page: http://t.co/dAg5WuGPT2,0
1700,Id love to get laid off (unemployment!),0
4185, I put my heart and my soul into my work and have lost my mind in the process -Van Gogh… https://t.co/F2CgTdZGW0,0
1721,@moulinroux get sick so you have to take short term disability? Ummm get laid off and take unemployment?,0
3439,I was told a month ago id have a new position and a raise. So far ive only done it for not even 2 weeks and have had a decrease in pay,0
2158,Searching for #work in Minnetonka MN? Send your #resume to BMW of Minnetonka. http://t.co/f8CMsxol1q #gethired,0
2950,My girlfriend recently started working nights. I’ve been wa... https://t.co/aWqpJdjXRT | https://t.co/9RmyT4AAU1 https://t.co/SqCF10id6j,0
5235,Salary or equity? This website wants to help you understand startup job offers https://t.co/68q1T3IYt2,0
4216,Currently out of cigarettes. Soon comes the decision to quit smoking which is subject to change when I wake up for work tomorrow,0
5117,Looking for a programmer that is willing to do equity work...solid idea with a good following. Msg me please,0
509,My best friend / boss fired me on Friday but I guess Im gonna meet him for a drink right now lol hope hes paying bc Im unemployed,1
2965,Crazy I began working at my store already a year ago. And started working at Calvin Klein 2 years ago.,0
3249,I got fired today bcuz I didnt feel like working and I dont even care.,1
3352,anyone know where I should work next?? turns out I got fired and didnt really know so I guess Im on the prowl,1
3078,Well I quit my job today.....,1
3513,I dont like that stay at home moms have to be called unemployed. I DO have a job and Im a very busy person!,0
1449,Been long-term unemployed? Great advice here about how to get back into the workforce: https://t.co/PWzp2KGtUR https://t.co/1WvkriFsUO,0
2825,Looking for a new strategy to help control workers’ comp claim costs? See workplace wellness grant: http://t.co/liR7eBBH7h #BWCsafe,0
4758,My boss fired me as I was about quit haha its all good Ill be getting more pay,1
1684,Quit my job yesterday got a new one today,1
847,3L In Charge Of Alumni Giving Encourages Unemployed 3Ls Not To Give http://t.co/WggfMlX70N via @atlblog,0
5212,My job turnover rate is incredible lol Its Friday and I am officially unemployed again. Happy hour awaitssss @Nico_Ricooo @__jessicaaaaa,1
1877,RT @USMC_DD1: This deal ended up costing Tax payers $7.5 million and Carrier laid off 900 people after it. -200 jobs. If HRC did… ,0
1165,I got laid off today sucks!!,1
2217,Two weeks officially #unemployed and Ive recon firmed that being a #SAHM is not my thing. Best enjoy it whilst I can!,1
1082,I am searching jobs in New Jersey on http://t.co/p0ilvTJkLN,0
610,Looking to Hire or Be Hired? Turn to Social Media #management - http://t.co/JV6ScdbBSa,0
5151,Just got laid off and am pursuing potential career openings in the IT industry. If you know of any please let me... http://t.co/24FLT5UsIA,1
4371,#RandyGalloway: Getting Fired By #JerryJones Was Stroke Of Good Luck For #TomLandry http://t.co/bpeJdqxwCR,0
1190,Got laid off today almost like they knew how far behind I am on Mad Men.,1
1593,Looking for a job? Instructor - Adjunct - Energy Efficiency at Education Corporation of America (... http://t.co/GICorAoj0U #green #jobs,0
128,Craziest thing happened to me today..i lost my job..then got hired by another one an hour later..pure awesomeness,1
1420,Unemployed Under-Employed Unhappily Employed? Find jobs &amp; career solutions on LinkedIn in JCD The Job Seeker &amp;... http://t.co/kQ3H09h5ag,0
5045,Just Got Laid Off? This Is The Two-Month Plan You Need To Follow https://t.co/50eHekJEoE,0
4312,Anyone know any jobs that are hiring??,0
3155,I for one am looking forward to those govt employees who have been state supporters for decades getting pushed to retirement or laid off,0
1686,3 people quit at the DQ in Morris today and I applied.. if I dont get hired Im giving up all hope,0
5329,Damn the 2 people who got my mom fired for no reason two months agai just got fired this month wow yall watch what you,1
712,Wait I just got fired before I even got to work so does this mean Im unemployed again!??,1
3080,I just repeatedly called a woman the wrong name in a meeting at work. Everyone laughed at me a lot. Unrelated I quit my job today.,1
536,So last week I was forced to leave work early due a situation with my diabetes. I was fired. Are you fucking serious? Cant I sue you now?,1
385,Im Searching for an Executive Sous Chef in DC to work for an award winning Chef...must be cutting edge creative positive with amazing e…,0
3347,Left?  Or were fired? https://t.co/WUOjtV1IE8,0
3246,Nigga I been fired from 5 jobs had to quit from 3 AND my whole workplace got laid off today Im 20 homie fuck that you just gotta #Maintain,1
893,Looking for a new career in the IT field? Head over to our website http://t.co/38APTLRqc2 for our complete list of open positions!,0
1805,I am searching for a hotel for @A1A_Marathon. Any suggestions?,0
5167,Just got laid off... am I too late for recruiting? http://t.co/2585gBm2qc,1
4480,Yup I quit today,1
3825,As someone who was laid off from Sony this year I feel for the Twitter employees. Talented people will lead to great opportunities though.,0
1128,Yes I am sending resumes and filing out job applications on Christmas.,0
4463,I quit H&amp;M on the 2nd day but I went in there yesterday for some jackets....yall think theyll hire me back just for the discount again ?,1
1143,Got laid off yesterday. Non stop job hunting today. -_-,1
2226,Unemployed since Friday. This sucks.,1
727,That moment when the position you interned in as a college student is now up for grabs. Yes here is my application please and thank ya,0
2789,Also got yelled at by a guy today &amp; he told me youre gonna regret this you dont even know who I work for,0
3444,I got a schooling email today with a job listing for my position. Wow way to learn youve been fired...,1
4319,Anyone know places in CLE/Akron that are hiring?!! I am having a hard time finding a job. Please let me know of any,0
2756,today I got leatherworker and am working on weaver,0
1555,I got fired from one of my jobs bitch Im straight to the Welfare office like can i get some food stamps or nah,1
1133,So I got laid off from toys r us yesterday and hired at chipotle today. #TYBG  🙏🙏🙏,1
494,I was fired from an amusement park job before starting my first day. MT @SVbizjournal: My worst summer job was __________________________.,1
1571,Looking for a job a new career or more job satisfaction? 51 Career and Job Affirmations. http://t.co/TcakfW48TV,0
4429,@OpieRadio &amp; @AnthonyCumia where mentioned on the Dan Patrick show today. In reference to the Atlanta radio hosts getting fired.,0
1821,I am seeking a cofounder with programming experience...please no companies,0
3365,Who are the police hiring? Lee County deputy fired after ignoring 911 call to eat lunch - woman dies. http://t.co/mEhlGcNqNI,0
4729,I literally got fired 1 week and a day ago and is now about to start a new job next week. Cant stop my flow #NewDay,1
1658,well work got hard today guy just quit and i had to takeover what he was doing. (had a hard time but it ended well),0
2082,Looking for a new #career in Medical Billing? Get hired here by doing this one thing http://t.co/hPzi63q5Fl,0
5050,This is so unfair. People who get unemployment worked many for years before being laid off or downsized. Wow! http://t.co/26zabsxjYz,0
3198,Can Prospective Employers Find Out My Last Employer Fired Me? via @forbes https://t.co/VOyvg8hvwF #humanworkplace,0
3752,I am now the lowest paid manager at work. Time to quit.,0
3688,Unemployed sex is the best sex. Dont let these new rules change you.,0
998,Heres a joke I wrote to explain where all the jobs are:10 developers walk into an interview.They are all hired.,0
4152,@AdamtheBullFAN I knew I could count on you brother. Farmer rightly should be on the hot seat if not unemployed soon.,0
977,If youre a hard worker and interested in making real money as a delivery driver hmu and Ill get you hired,0
4378,#whitegirlsdoitbetter really backfired. Good job twitter,0
575,If I can collect unemployment for being fired for not being available I would do it in a heartbeat. Can I? Can I?,0
3983,I just quit my job cause I got hired some where else &amp; I start today YES GAWD!,1
4065,my old manager is trying to tell unemployment that I never called in on October 11th. Please explain this? Also I was fired on October 13th and my paycheck was ready 3 days later. If I stopped showing up why did I get a check so soon? I normally receive DP 🤷‍♀️ @ChipotleTweets https://t.co/JyjxOMGlCR,1
3071,today I quit both my jobs accepted Jesus back into my life and quit all hard drugs,1
5171,Every day I go in hoping I wont be called to the office for a Im sorry but... talk. In 09 was laid off (80% of the shop) for 3 months.,0
1268,You might work for a conversation agency...if you dig through the trash to recycle something.,0
3056,In other news I quit my job today,1
4781,Earlier this week Calvin Johnson mentions retirement. Later in the week pats head of scouting rumored to take GM job in Detroit@scottzolak,0
2927,I passed my hard course but lost my job. Couldnt have put me in a harder position.,1
4932,Now accepting resumes for the position of my valentine.  Must be able to pass a background check and have a beard.,0
5010,All week I was running late for work and pretty sure same thing tomorrow,0
4097,My boss fired me Friday and is now refusing to pay me for the hours w: I work in a private home doing care for... http://t.co/8UjRkVTu0J,1
3035,i quit my job today cause who cares i do not i realized i am smarter than everyone and now my head hurts,1
1732,Day 8 of being unemployed: From laid off to unemployed http://t.co/ho30xFHS #jobsearch #blog #unemployed #jobs #nonprofit,1
3269,i got fired again today by Alex English. usually happens once a week. today ill bring him lukes lobster so i can get re hired...,1
755,you might be interested in: Assistant Director/Director of Academic Support Position at Thurgood Marshall https://t.co/XtRzKsjw9k,0
2784,I just got a letter from the HR dept of the company I work for saying that my last day on payroll was in March...I definitely got paid today,0
3397,Can you recommend anyone for this #job? Fired Ware Utility - https://t.co/i6ZHvwO3EL #Spartanburg SC #Manufacturing #Hiring,0
169,I worked from home today........Ok ok I lied. I worked from the mall 󾌱󾌱󾌱 I worked so hard I got home and pass out. 󾠣󾠣󾠣,0
4473,I quit a job today &amp; got two other job offers 😏,1
366,I am looking for a videographer who can do some outstanding music videos. I got a project I am working on,0
5162,So today I started out my birthday with being laid off work. Unemployment here I come. :/,1
3096,So I quit my job yesterday. Is this when I should start watching How To Live With Your Parents? #PleaseKnock,1
2441,We hired a Alabama graduate and player?? 😳 #huskers,0
3699,With vine dead every vine famous person needs to go to the unemployment line now.,0
1492,Lost my earring at work yesterday and today my #italian wallet was #stolen ... #mondays seem to haunt the rest of my week! #ugh #somad,0
17,I was recently laid off by a large bank. Today they sent me a credit line increase and some fake CC checks. Dont they know Im out of work?,1
5033,RT @markweaver: I got laid off today. Looking for a new gig full time or freelance. Hit me up ✌,1
3877,I just got fired then immediately re-hired.,1
2359,Whos hiring?????? Help,0
3845,i just got laid off??????? or fired?????? for budget reasons??????? even though they hired some new guy last week??????? Im gonna puke?????,1
1651,I try to get a job find a girl that work there quit and have her take care of me but it reverses CTFU,0
1542,Showed up to work today thinking I still had a job and my uncle told me to gtfo and never come back... looks like he actually did fire me...,1
10,I just got laid off had to drive home in rush hour traffic and my car broke. Fuck you too life.,1
1687,One of my co-worker quit today n they already lookin for replacements,0
390,I am Looking for work in fixing #computers or #security #jobs.https://t.co/yIniDqgefP #resumes https://t.co/AfjLPoEMsC,0
4466,i got hired at 678! time to quit todai!#todai #toDIE!!!!,0
341,I am looking at doing for my PHD research cyber-bullying in the work place.looking for sponsorship and funding,0
35,I got laid off two weeks ago now I got another job # All can do is thank God,1
5373,This blog post is about me getting laid off yesterday: Unemployed http://t.co/r3TkMKxp #employment #arts #nonprofits #veg #vegan,1
1690,So the break room at work hat a TV with Netflix. Means a co worker put on the office 5 min later a bitch comes up and puts on riverdale with out asking...needless to say I quit my job today,1
3216,I Was Fired From My Old Job 4 Days Ago And Already Have A New One,1
1191,Ironic I drop the #EAT today and jus got laid off from my job..,1
4730,I was recently fired from my job seeking unemployment and better work,1
3239,Got fired on Wednesday got my job back yesterday and I work today haYesterday was my day off too so its like I was never fired at allMy manager hates me even more now I know it aha,1
4921,The new coworker that was late for their interview and paperwork then didnt have 2 forms of ID is making more than I am. Same position.,0
5428,Here’s how to answer #interview questions when you’ve been fired. https://t.co/5Ar4DbIZID https://t.co/0xKvwSIbMi,0
1172,30 people were laid off today at my place of employment. To say today wasnt tough is an understatement,0
4202,@FreshLit_L: Gotta be at work at 4 am.. dayumm better get some sleep,0
2882,I got to be in a leadership position today in ROTC.. And everything went well,0
1356,Heres a chart to help writers. It is quite helpful in leading you towards a better way to express something.,0
4574,I too am unemployed looking for a #teaching job https://t.co/Rl6teoUf09,0
2473,Here is a great website you can use to create the perfect resume and #GetHired https://t.co/ZjQUxeQLM4,0
232,Today I lost homework scoured campus for my keys and fought with a team. But @NEEDTOBREATHEs live album came out so everything is fine.,0
3354,Can someone start a new magazine and hire everyone Murdoch fired and create a Subversive National Geographic please? #journalism,0
2714,#Job #Houston Head UI  + UX Designer (houston tx): Position: Head UI + UX Designer Location: Houston Status:... http://t.co/NfoBHqRWlf,0
4835,If youre a Twitter employee and was laid off today now is the perfect time to start that startup youve been thinking about.,0
1164,I Got laid off today 🖕🏻 https://t.co/kevVjENAby @gifboomapp #gifboom,1
4411,@IheartsBrit thats Good I told U They Fired Us Right?,0
5389,I got fired from my job yesterday no call no show supposedly chick I had cover my shift called the manager who wrote up termination..,1
74,I Just Got Laid Off … Now What? http://t.co/gqVcv99got #jobsearch,1
2187,Officially unemployed. Im gonna miss all the little kids from work some good memories with them.,1
3652,Looking for a tech job where you work w/ smart people &amp; can have an impact?http://t.co/cxanNgUQ6O #dotnet @InnovateMS http://t.co/bLvn14Q27U,0
5411,Interested in joining a workplace in which you truly can make a difference?Travelers Insurance might be it!https://t.co/6eN07r8OK3,0
785,I am currently employed &amp; still searching for a payroll specialist position in the Kansas City MO or KS area. Anybody plz forward any leads,0
2168,Searching for #work in Cleveland OH? Send your #resume to Colliers International. http://t.co/kQyGqqjYfq #gethired,0
4941,@VictoryCRussell in prev. position core presentation had factual grammatical errors. No editing allowed. Couldnt give it. Now unemployed,1
2159,Searching for #work in Blytheville AR? Send your #resume to Arkansas Department of Human Services. http://t.co/LGVbSsiMzT #gethired,0
3798,#Accounting #Job in #BuddLake  NJ: Accountant - Entry Level at Accountemps http://t.co/g834qqV2Xs #Jobs #TweetMyJobs,0
1925,News alert: I just got laid off so I guess that means Im a full time #streamer. Eeek 😶 #twitch,1
1135,Got laid off from my day job. (makes jungle),1
65,So I got laid off of from my job a couple weeks ago. A first for me. I was upset and a bit stressed at first of... https://t.co/3FArucZPX3,1
3756,This is where Im at with life right now. #unemployed http://t.co/PCMKpa10Pk,0
4214,https://t.co/EFA2GoapGv #JobSeek.us #Jobs #JobsIN This is an excellent opportunity for driven individuals with 1+ years experience in Private Equity Big Four Transaction Services or Investment Banking that are interested in working in a client... https://t.co/ZTGxst1KoC,0
4760,One of my managers took me off the schedule for a whole week or fired meBut just got a new job offer from a different place god is good,1
4037,Yes I am drinking on a tuesday no I  am not unemployed.,0
2211,And now Im unemployed again 😒 #fucking#sequester http://t.co/mkRlgxwihe,1
3339,Hasnt anyone been fired or cut yet? #Vikings,0
2544,Looking for a flexible position where you make a impact? You just found it. https://t.co/hF3HppLJB4,0
3102,I got laid off earlier this month so I started a blog. Check it out! https://t.co/YJbRTiFuiE. #ThePinkSlip #UnemployedAndAnnoyed,1
3227,I dont want to find a new job but I honestly feel like I have no choice. Either I quit or get fired.,0
4294,Anybody Hiring??? Looking for a 2nd job,0
786,I am currently looking for a part time position in a library or office.,0
928,Yesterday I got hired for a teaching position in the fall! Thankful for how God opens doors and provides!,0
3240,Gave my supervisor a evaluation today also I got fired today,1
1148,Today I got a 95% on my college algebra exam then I was told that I didnt have a check and I got laid off my job :( What a day!!!!,1
134,whats funny is the job i had today wasnt even mine the guy didnt show up at all i just took over &amp; the designer hired me #blessed💃🏽,0
5513,Just got laid off from one of my jobs to kick the new year off right! Dont forget to follow @KnottyGamers and get ready for the flooding.,1
2004,As you all know I recently was let go at my job. You also know I am in Love with Jamberry. So here I go I just started on my journey wit...,1
5172,Well my job only lasted 7 days &amp; I got laid off again! I still need your Thoughts &amp; Prayers my Facebook &amp; Twitter... https://t.co/KeCe7JBcIo,1
2308,Oh boy... Now I can change my job occupation from student to unemployed ...Oh 21st Century you are THE BEST!,1
3210,well once again i have been fired from another salon.  i am new to hair cutting only having done it for a year and a half. but i think..,1
4774,I quit my job earlier this week... What should I do now,1
2494,Haha. Some fucking idiot English faculty member who never should have been in an admin position fucked up paperwork before I got here.,0
5434,Boss fired me for not being able to work 100hrs this week due to me having my kids like i do every week . The owner found out and isnt happy his Dozer got canned 😂. So needless to say that wasnt the best move on her part 😂.,1
3631,Looking to purchase or rent a home in a smarter bolder and faster way? Visit https://t.co/E6GTmXJvWH #realestate https://t.co/OinoT6ZRui,0
3209,I am positioning myself so that I can move in the full power of Christ. I am fired up.#boldness #christ,0
1643,The Mexican named Jesus quit today so now I have to find new help to take his place. Do you have any idea how hard it is to replace Jesus?,0
2219,Im having work email withdrawals. #day1 #unemployed,1
2075,Looking for new challenges? On @Hired_HQ the best #rails #python #javascript companies compete for you | http://t.co/xGmlpp2dVF,0
3974,Hey I got hired full time today :),0
1699,Sucks being laid off. Least I get unemployment,0
4059,So as of 430 today I am currently unemployed again :( although we still have one paycheck left,1
1775,I am currently babysitting a 28 year old... Dont ask me how i do it,0
5328,I was fired today after 21 years of police service with #MDPD. Im so hurt right now.,1
4084,My boss unfollowed me I think I may be getting fired,0
1638,Are you seriously searching for a business opportunity so that you can quit your job and live life on your terms?... http://t.co/8as6A3QcNq,0
5190,Quote of the day from yesterday: everyday is a party when youre unemployed.,0
2887,Interview today...n JUST got an interview for the position I really wanted TOMORROW. things are starting to fall into place,0
4491,Went to class still drunk got a A on my presentation and quit my job. Today waZ gud,1
503,New owners and managers wanna get me whether on the street atthe job or fired,0
4335,I need a new job anyone hiring?!?!?,0
488,Recently fired. And needed to get some business cards. So I had a fotoshoot... Thank God for being… http://t.co/Krh5wgwJQL,1
5195,And now Im unemployed! #winning,1
4716,so i got fired today,1
696,So for the first time in 30 years...I got fired today.  I am looking for work or marketing work but let me know... https://t.co/99ZRjqBdJQ,1
3251,I find it funny that I was fired yesterday and then rehired lol,1
