id,text,class
680,Well unemployed again just got fired for not knowing how to use a tape measure. Hello I am freaking dog. https://t.co/H10B3fj3Q5,1
3268,Quit my job last night got hired on the spot this morning.,1
3749,Annnnnd now I am officially unemployed.,1
4558,Needing a second job (preferably retail) anybody hiring?,0
2468,being hired in a company run by a boss like Trump - you would quit. Now is the last chance to stop the Zombie Cabinet and his masters,0
4164,Delinquent Student Loans Hit Record 30% Of 20-24 Year Olds Are Unemployed And Not In School http://t.co/TDkfYpcZWXPuts my salesnperspectiv,0
3943,I got hired at a job yesterday but Im quitting today because a better job came along does that look bad?,0
3446,@KoderKev HR did say the shorter they needed me for the temp the better it would be for the permanent position but it feels like I was fired,1
4053,I am unemployed. I have a judgement against me. I am on my patents checking accounts as a signer for emergencies... http://t.co/r1y9nsqbaj,0
1968,I recently quit my job to make $9023 from my phone PRESS THE LINK INSIDE BIO to do it too https://t.co/E9a1gJhVqX,1
2332,I’ve only been unemployed for 10 days and I was blessed with a job when I wasn’t even looking and I start tomorrow. A bitch just want 2 sleep!!,1
2093,Searching for #work in Lowell MA? Send your #resume to Pharmascent. http://t.co/Iwv7RQBIXX #gethired,0
4799,I got fired earlier and as soon as the store closed I went back to ask for my job back and they immediately said yes lol,1
4457,Today I said fuck it..I quit my job and became a #unicron,1
1076,am looking for a job i lost my job due to the misunderstanding btwn me and my manager according to the increment of my salary,1
1160,Got laid off today fml,1
363,I am job searching for: Work at home jobs! http://t.co/4tgcXWg6JK — Walker Inklebarger (@Walker_marocliv)... http://t.co/28YdPjRzIA,0
4790,this * time lst week i was walking home from being fired and i am now walking to me new job ooo,1
1671,My Assignment at my job ends today. Quit my delivery job on weekends but I got interview Monday and Footba season almost back at metlife !,1
683,Current project at work I feel will either get me fired (like the last 4 who worked on it) or hired full time (unlike the others).,0
5503,I left Pacsun for 5 days and like 3 people got fired 3 are quitting I have no boss right now like wow okay this is cool,0
44,Just graduated college and got laid off before starting work. Not sure how to maximize my severance package - https://t.co/n7fgL3fDFR #tax…,1
657,A social cause might have you so fired up today that you cant... More for Leo https://t.co/UsJ2eOL3Jl,0
4497,I quit my job today...,1
557,Fired jail employee says she was treated unfairly: A former county jail employee fired earlier this week for… http://t.co/nutav1vF3w,1
4860,@AlphaTwat Where do you apply for that? I got laid off yesterday.,1
2680,#Georgia #Jobs Field Supervisor- Temporary - Spectra Georgia: Norcross Position overview:to field inspect job ... http://t.co/ofuHQavtoL,0
5166,I was just laid off.If you need an accessibility analyst or perhaps a front-end developer let me know.,1
3973,Got hired today for a really good new job but theyre asking me to cut my hair...,0
4644,so is anyone hiring? my coworkers are laughing in the face of another coworker a black nigerian immigrant that practices islam.,0
1672,simultaneously quit &amp; got fired today. They tried to fire me I showed up 2 hrs early &amp; quit first. #BitchesCantBeTrusted,1
4725,i recently got fired for sleeping on the job. i ddnt really like being a pilot that much anyway,1
962,Got an interview tomorrow afternoon for a leadership position at work... and to think just 5 months ago I was a little seasonal hire. #grind,0
5370,RT @olivierlacan: Firing People https://t.co/WPZazjnjawThe best thing I’ve ever read about getting fired or laid off.,0
2222,Ive been unemployed for a month. Sent two important lengthy emails today. Im tired. Im excited.,1
4815,Hey guys. I was laid off from http://t.co/7N4tnSH0ra yesterday. Please let me know if you know of somewhere hiring.,1
133,good news: I made $20 busking today. bad news: novelty store that hired me part-time unhired me before I started to hire back old employee.,1
1868,@fsmikey @FSBigBob last day listening at 6am for a little while. Getting laid off at noon. Thanks for the laughs! #Illbeback,1
1536,Well my coworker who I caught in a lie earlier this week thanked me for getting him a side job painting by getting me a bottle of whiskey.,0
290,One of my sets got hired FUCKING YES,0
74,I Just Got Laid Off … Now What? http://t.co/gqVcv99got #jobsearch,1
645,If you were fired and had a chance to take a better paying job in a different city Im pretty sure youd take it. Good luck Julius Peppers.,0
4175,Please check out my latest blog called Stop Ignoring The Unemployed:  http://t.co/c7fvzG8Alb  #JobSearch #Unemployment,0
1160,Got laid off today fml,1
771,Looking to join a dynamic innovative team? #Fremonts City Land Surveyor position might be for you. Check it out https://t.co/B8Yxpiq7RE,0
3386,Who gets fired then hired in the same day???? @AlyciaLeee #BALLER,1
3716,And.... Now Im unemployed.,1
4147,#AlaskaJobs #Alaska #jobs #unemployed Laborer - Halliburton - Prudhoe Bay AK #jobposting http://t.co/Dcv7Trctqw,0
5015,Last week a customer hit me at work I defended myself and took him down and now I get suspended!,0
1919,Between the news of being laid off yesterday and then spending this afternoon in the ER with my oldest for a... http://t.co/8A3xzoZtKO,1
2443,They hired who? Flyers hope gamble on college coach Dave Hakstol pays off with playoff berth http://t.co/JnspuJzI65 http://t.co/v1jzEdhQjH,0
38,Suuurrrrrree I couldnt get laid off 3 weeks ago BEFORE I bought my new car. #unemployed #hireme #job #FML,1
4594,i have sent out 40 job applications and had 3 interviews…how am i still unemployed?,0
1553,I smelled weed before I got into my uber earlier this week and my driver did a terrible job of hiding his role in its creation. #fasttimes,0
2085,Looking for new challenges? On @Hired_HQ the best #rails #python #javascript companies compete for you. http://t.co/X0oGVy8IZR,0
3250,Salty i got fired today lol Ill have a job bye tomorrow tho aint tripping,1
2016,A girl we hired three weeks ago married my client for his money which is a million dollars and fired me,1
3541,Got laid off today.  :(  Will rest this July 4th weekend and then start looking next Tuesday.  Anyone wants to hire me?,1
5019,@markschlereth Just got laid off any tips for staying busy while looking for a new job? #QuestionMark,1
1729,@SpeakerBoehner Ive had 4 back surgeries no disability both my wife and I are laid off. No unemployment! Need emergency EDD. Please help!,0
4134,Brandon is fired for trying to trade @LexieGordon3 . We are now considering myself or Ira Crawely to fill the position.,0
1058,Currently applying for jobs....,0
15,Today my dad was laid off with no warning from a job he had for over 20 years. And people think starting a business is risky.,0
869,RT @AlisaValentin: Boxed In: How a Criminal Record Keeps You Unemployed For Life | The Nation http://t.co/LWHUF7VRJy via @thenation,0
1338,Interested in a #job in #Mesquite TX? This could be a great fit: https://t.co/Ml3p0JzHxs #Retail #Hiring #CareerArc,0
1541,This week I got into a massive fight with the guy who got me pregnant got fired from my job broke my new phone and tomorrow I have to go get std testing done because I was raped a few weeks ago. It’s only Wednesday. If there is a higher power it wants me to give up.,1
4303,IS ANY PLACE HIRING??? THIS GIRL NEEDS A JOB YO.,0
5041,Laid Off? In Between Jobs?: Laid Off? In Between Jobs? Need To Make $100+ Per Day? -Do you have a home compu... http://t.co/ocUetgkroh,0
1631,I am looking for a buyer on 1234 W MESQUITE TREE Lane San Tan Valley AZ. http://t.co/c19nsG29ba,0
1157,Just got laid off whose hiring,1
4447,Dude got hired 3 weeks ago. Comes up and says this job aint for me I quit and leaves. I wiiiish I could do that haha,0
1583,Looking for a new career in 2013 or to enhance the job youve already got? Win free coaching w/ @MaggieMistal http://t.co/somMEU4j,0
4792,Well I was fired from my job today (officially seeing how it is I have been suspended since last Wednesday).  Life goes on.,1
4443,Today I said fuck a job and quit.,1
2196,Officially unemployed. Anybody want to give me a job?,1
2907,I put myself in a bad position by quitting today but eh 2 weeks to find a job isnt that bad,1
1281,I have disability case I am not working i well have to wait 18 month before my case herd in court but mr Obama paid millions in destroying,0
5011,LaRosas just fired me for not coming into work after I tried to go and couldnt because I was sliding all over the road.,1
2162,Searching for #work in Cleveland OH? Send your #resume to Amotec Inc.. http://t.co/bNF6YGmSrA #gethired,0
2798,I finally got hire at walmart I been working at walgreens for like 3 and a half months. Tomorrow my last day at walgreens,0
4486,So to answer a few ??s about the fine dining job they lied about my hours/pay/job description so I quit Tuesday so I went to Hooters today,1
3870,Worst time of the year when I gotta go on the out of work list at my union hall and I cant smoke till I get hired on again,1
61,Was just laid off due to the company closing.  Ive got 4.5 years of assisting experience. @taylorswift13 need an assistant? Insert panic.😩,1
2994,My girlfriend recently started working nights. Ive been waking up to a lot of worrying texts. https://t.co/fxQiRpawF7,0
2228,A month ago I was unemployed and now next week I have work every day,1
24,Everytime I lose one I bounce back with 2 how you think I got you somebody got laid off...,0
2485,Heres a fact if your kid is hired by Disney. Then most likely they will either go batshit crazy or in rehab.,0
4767,I got my last check from my old job yesterday and will get a check from my new job right on time in exactly two weeks.. that worked out well,1
2125,Searching for #work in Richmond IN? Send your #resume to Ivy Tech Community College. http://t.co/RfpHrcluE3 #gethired,0
3252,i got fired and then rehired haha,1
1369,Interested in a #job near #Mesquite TX? This could be a great fit: https://t.co/ZCr5SbNmdN #Legal #Hiring #CareerArc,0
320,Today I watched someone lose their finger...,0
3038,so basically I put my notice in to quit today so uh yeah,1
4503,I quit today my spirit was crippled by the man so i had to move around,1
3258,Fired for the day unfortunately Ill be rehired tomorrow #familyfarmprobs,1
1528,I recently find myself wishing that I had one big block of time each day to work on my own work...,0
5059,Is There Life After Being Laid Off? via @amazonkindle #newprice #careers http://t.co/wjLUzTWV,0
1203,Today I was laid off from my ultrasound job due to cutbacks. But its all good bc Ill be at the @jakeowen concert next Thursday!!,1
116,i got 107 likes on an instagram photo of a bike so i hired an agent and quit my job today #NeverGiveUp,1
2209,I am now unemployed and that feels weird.,1
4339,anyone in #inlandempire know of anyone hiring? its time for a new chapter/better job,0
3866,Hey lucky me!! I got fired today with no notice for the sole reason that the owner hired a friend. Fucking Awesome!!,1
4236,Well my charger quit working and I have 3% battery.,0
1841,I AM IN SEARCH OF MODELS WHO WANT TO BE IN A CREATIVE BRIDAL PHOTOSHOOT!!! RT &amp; DM ME ✨,0
1693,TODAY I QUIT MY JOB...in three weeks,1
5430,I was fired yesterday because I was told by my boss I was not aloud to take a break without first asking permission.,1
2108,Searching for #work in New Brunswick NJ? Send your #resume to Rutgers The State University of New Jersey. http://t.co/bzFgC2m2V8 #gethired,0
3411,While watching @Andy Cohen tonight I realized that Billy Bush was put in a really awkward position by Trump and should not have been fired.,0
5159,I was just laid off and am looking for some babysitting dog sitting personal assistant or personal organizer work.,1
1773,Got laid off Monday and now my boss askin can I work next week. Make up to damn mind!!! Smh,1
4421,@MarcAg_ same as fired and sumlin has already done that before,0
1113,So while searching for a job Im going to offer services as structural editor/copywriter/general wordsmith.,0
1507,Today I worked 6:30am-8:30pm get on my level,0
4189,23 Struggles Of Working In The Fast Food Industry - http://t.co/7Z8FSw7rEN  weightloss fashion hot fitness motivation art,0
37,I just got laid off from the warehouse I work in. Anybody know of any warehousing temp agencies prefe... http://t.co/WqMS3k21Vm #reddit,1
2742,I got work today doe  trying to re up on my cash flow,0
4603,Car was towed today alhough Ive been unable to drive for a month &amp; I have to find 100s to get it even tho Ive been unemployed for a month.,1
5212,My job turnover rate is incredible lol Its Friday and I am officially unemployed again. Happy hour awaitssss @Nico_Ricooo @__jessicaaaaa,1
4099,my manager just called me to let me know Ive been fired https://t.co/hpJM91JvNf,1
3063,So I quit my job today. Does anybody know if Office Depot is looking for animators?,1
3100,Needless to say I am nailing it currently and wouldnt have been able to do that without getting laid off so THANKS old employer!,0
3073,Oh yeah I quit my serving job today also!  Gosh its just a bad month,1
3588,I cant wait to start workin at my new job.,0
5344,Bird Becky in ARDEN NC hired a local Wedding DJ. Register FREE: http://t.co/pyEYYIjpOx #Wedding #BrideToBe #Brides #BridesMaid,0
5061,Laid off? Go out in style like this former Tumblr employee did. #MMJsem http://t.co/E7hnjVbi8z,0
4462,My coworker got accepted to Utah state &amp; quit today and my supervisors are mad af,0
2028,Looking for a #NewJob? #CareerCast has all your #Job and #Career needs at your fingertips. https://t.co/TP0fqqrlDk #CareerAdvice #GetHired,0
1208,Yesterday I was laid off. Today I played with my kiddo talked with a TON of people am sprucing up my resume coffee meeting at 2. #islay,1
1219,Interested in Real Estate Careers? A networking event you might attend is 4/11. Register: http://t.co/Ya4Dfnr6S7 http://t.co/48vr4CWO2d,0
3715,Being unemployed has me so bored omg 🙄,0
1199,Yes I Got Laid Off! Thank Goodness For Severance Packages - http://t.co/56o9gOiU8c via @FinancialSamura #Yakezie,1
41,Bad news: laid off from my recreation position. Good news: I was offered another job at the same building. Less hours but its a job.,1
2209,I am now unemployed and that feels weird.,1
5354,Apple posted a job you might be interested in: Genius - Retail Technical Support - Santa Barbara California Area US.,0
3315,Haha! 3 of the girls that got hired with me quit forever21 too,1
3639,Looking for a #Full #Time Assistant 3rd Shift Grocery Manager Trainee - Central Avenue #jobs http://t.co/yeDq4MSKHg http://t.co/1tkXESwv0t,0
2282,Looking for a job? Integrated Construction Coordinator II - Renewable Energy Group (IRC10233)Job ... http://t.co/G0n6uoPeaw #green #jobs,0
2531,Looking for an exciting new #job? Opportunities include a Senior UI Developer position in #Arlington VA. #... https://t.co/dClbbeWAtU,0
4266,Currently cannot do my homework because my mom is singing to Ben Rector quite loud. #notmad,0
5000,Monday was a work day yesterday was my birthday and today I got fired. :/,1
1771,So who wants to buy a GoPro package at a reduced price!? Unfortunately I got laid off my job and need to sell a GoPro....,1
53,I got laid off from three internships... and I dont regret it! I have the dream job of any one of my classmates right now! #ItGetsBetter,0
3118,@DeptVetAffairs I recently got laid off and I dont qualify for unemployment because I havent worked there long enough.,1
1764,RT @CoopSoSarc: *gets LAID off*explains reason for DISCHARGE*reviews severance PACKAGEUnemployment is HARD,1
1955,I recently left my day job to start my own businesses. Work hard for what you want. For who is there to stop you? #MonkofKnowledge,1
8,I WASNT FIRED I WAS LAID OFF BUT YOU WOULDNT KNOW THE DIFFERENCE,0
120,Quit my job last Monday and got rehired again today. Woo! So long unemployment,1
3459,Alright got fired from a volunteer position new low in life whatever still setting milestones.,1
3312,Well the guy that quit and then we rehired just walked out. What a piece of shit!,0
4412,@InManibusDei The ticket prices of several inaugural balls just cut $$ to 1/4 of original $$ so the buses just fired up.,0
1562,I was terminated from my job this morning in my bosss kitchen. He ate toast I had some reality.,1
2988,I recently conducted a 4-hour sales training workshop and had a great group of managers that were eager to learn! #storage #bealearner,0
1110,I am job searching for: Work at home jobs! http://t.co/4tgcXWg6JK — Walker Inklebarger (@Walker_marocliv.... http://t.co/Wzgp5pE2qL,0
5437,Yesterday a counselor threw a bucket of water at me after I told him not to and then I cried and this morning he got fired so yay,0
2130,Searching for #work in Cleveland OH? Send your #resume to Cleveland Metropolitan School District. http://t.co/e9RnS0cEvB #gethired,0
370,I am looking for full-time work (and am willing to relocate!) if anyone knows of anyone hiring.,0
2739,I am playing GTA Online what I did was go into a solo session press start go under online and hit find a new session and it worked!,0
58,With recently being laid off I now have the opportunity to go to London for 14 months!,1
2164,Searching for #work in Sunderland MA? Send your #resume to Property Star Services Inc.. http://t.co/DwR1sPjGna #gethired,0
3840,Started the day off losing my job... An hour after got hired for a better one you could say its been a great day,1
3370,got fired because my foot is broken. where is hiring?,1
3343,Who hiring? I just got fired,1
4495,I got out of my car to get gas and lost my keys by the time I got back in... I quit at life today. Hahah,0
951,Came in today long 450 $IP as my biggest position. Left with no position and $28k in my pocket lol,1
4868,Been unemployed for awhile? Contracting can help you get back in the game: https://t.co/VKsHLP3Unh,0
2083,Looking for a new #career in architecture?  Get hired here by doing this one thing! http://t.co/O6ccG3AlV7,0
1137,Got laid off today....got a lot of time on my hands I guess. #layoff,1
1874,RT @Mark_JekyllHyde: If all non Essential fed employees are laid off why is Obama and Reid still on TV today?,0
5030,Laid off? Tired of working for someone else? Let us help you find the right opportunity. https://t.co/gu6nGiFBAA,0
4130,Im losing my home and car due to being fired and not being able to find job to cover immediate bills not ... http://t.co/eKwWHiZbWZ,0
1789,I am currently working under my desk. Lol http://t.co/N4q0si46dZ,0
116,i got 107 likes on an instagram photo of a bike so i hired an agent and quit my job today #NeverGiveUp,1
2809,Looking for Job Security? Hiring Trends Point to Expanding Workforcehttp://t.co/qqOMMSb9wA http://t.co/EczJaySr0r,0
1824,I am looking for a buyer on 375 Sanders Rd #Georgetown #TN http://t.co/bN3IAeY30Q #realestate http://t.co/sA9UPQI8G5,0
5151,Just got laid off and am pursuing potential career openings in the IT industry. If you know of any please let me... http://t.co/24FLT5UsIA,1
1901,Reports: If shutdown lingers up to 20000 state workers could be laid off official says  @crainsdetroit http://t.co/EpfBCgyIbO,0
3165,I GOT LAID OFF YESTERDAY AND GOT TO JOBS TODAY 😊☺😊😊😆😆,1
4091,Sleeping on the plane backfired and I still have not slept. I must nap immediately.,0
4468,I quit my job whos hiring?,1
4468,I quit my job whos hiring?,1
1022,Interested in a #job in #Florida 526? This could be a great fit: https://t.co/TgcF5ehP4R #NowHiring #GetHired #Hiring,0
5351,Starting to get the hang of my new position at my job.  Im really liking it.,0
3565,Shift is almost over also I have the chance of possibly getting a new shift hmm wondering should I do it or not. Im think no my boss sucks,0
1629,I am quitting smoking.,0
2326,oh man im like unemployed for three days. but also new job in three days! also also three day weekend!,1
1887,RT @virgiltexas: Dont worry about me I wasnt laid off today. Im still Gawkers editor-in-chief of doing false flags against gamers.,0
1171,I got laid off today.  Im ready to persue makeup.  Chicago beauties...any job leads?,1
3174,Looking for a job. I was fired two weeks ago .,1
3285,my dad just fired and rehired me within five minutes so thats fun.,1
3879,The lady I was hired to take over her job temporarily while she was on maternity leave resigned. I smell an extension of my internship 🤑🤑🤑,0
4060,as of today for the first time in two years.....I am officially unemployed,1
4812,I was fired today from my part time job in california because i did not go to work. They update... https://t.co/y05XxIuHPX,1
5441,Moms just finding out 2weeks later I got fired lol,1
3252,i got fired and then rehired haha,1
3095,I officially quit Target today I learned my self worth and they are so disrespectful &amp; petty  their Im over it,1
1059,I am currently looking for paid Sales Interns.  Send your resume to scott.m.herlin@sherwin.com #jobs #jobhunt #resume #intership,0
4725,i recently got fired for sleeping on the job. i ddnt really like being a pilot that much anyway,1
2423,Too Young To Retire; Too Old To Get Hired? http://t.co/grbwIFBgLq,0
5132,Im excited to see whats to come. I went from employed to laid off to aspiring entrepreneur in just 3 days.,1
3084,also i tried to quit my job today and my managers just kind of laughed..,0
4720,I think I got fired from my job. Oh well,1
866,Job Hunting? 160+ Openings at Meetup N.Y. Philharmonic and More #Tech: Unemployed underemployed or somewher... http://t.co/OMxfzVWZ06,0
1544,lol the job that fired me this summer was holding training in the same studio that I worked with TADA in this week.... #fuckthem,0
4671,No longer unemployed in the last 2 weeks I got 2 jobs today I got hired at Sprouts #happytobeworkingagain,0
5177,I am no longer reporting on education @indystar - laid off Friday. 110% unexpected. Still bent on journalism/covering ed so plz RT,1
4475,So I quit my job today guys..ITS LIT,1
2506,Looking to see who #PennState hoops has offered for 2015? FREE list of offers designated by position here: http://t.co/xBgLcZu1HT #PSUBB,0
4419,@MBSchwietz We are looking into the issue -- the pump stations didnt automatically activate like they should. We fired them up manually.,0
4968,I went into work 3 hrs late the other day please dont fire me,0
4774,I quit my job earlier this week... What should I do now,1
1135,Got laid off from my day job. (makes jungle),1
544,Well this week starts as me basically being fired as a driver which means big pay cut which means shit,1
2084,&gt; Looking for work? &lt;  Get hired anywhere in the US check out.. http://t.co/TgLyjet1a2 #hiring #jobs #employement #money #workflow #careers,0
4224,Currently getting attacked by mosquitos in my own home. Absolutely miserable and in too much pain someone be a homie and help me out.,0
279,Got fired as from my nurse job today,1
3087,Momma said Im a winner not a quitter not today momma cause when I hit Ima quit her,0
316,I lost my ID &amp; my credit card... basically I lost my wallet,0
3067,I should quit my job today cause they played me into working but..,0
54,2. I was laid off from my BRAND NEW job Thursday. I havent fully processed that yet.,1
3127,Finding A New Calling After Being Laid Off At 50:  Turning 50 is challenging enough. But losing a job at 50 in... http://t.co/ezskd9xChz,0
4374,#VPDebate shots fired shots fired lol get em Tim #ImWithHer,0
1205,Got laid off today :/#work,1
1129,Well today was the first time in my working career that I was fired laid off I mean furloughed due to the #governmentshutdown. Smh,1
1442,Need to Make a Career Move?  Need a New Job?  Unemployed? @leezabyers Can Help: http://t.co/cCLOHZIwPQ,0
1351,Interested in a #job in #Mesquite TX? This could be a great fit: https://t.co/OfubySvBJE #jobsearch #Nursing #Hiring,0
255,Whos Job Is Hiring?!?! Hook Me Up Nigga!!!!,0
115,Lost my job yesterday. Jus got hired again LOLLL,1
3494,Im unemployed and I dont care Im unemployed and I dont care Im unemployed and I dont care cause Im finally out of that job!,1
1215,Here Is An Opportunity For You To Earn Additional Income Without Any Investment. You Can Work From Home O... http://t.co/WQLOPR9rmQ cssp,0
5039,RT @jonfisher: Hey guys. My position was eliminated today and I got laid off. If you know anyone looking for a designer / project manager…,1
177,So today i got car sick had a boring day at work had to take a 2 hour bus ride home in the middle if the night &amp; said bus was an hour late,0
3243,I did a gig today where I got hired fired and rehire all in 30 minutes.,1
3766,Wait masturbation?? Whos suffering there?? Making class discussions awkward is my job.,0
5283,I recently started using @ginacipollas Spotify. I apologize 2 her Facebook friends 4 the outburst of 1D &amp; Nick Jonas. I take responsibility,0
2211,And now Im unemployed again 😒 #fucking#sequester http://t.co/mkRlgxwihe,1
4373,#ShotsFired RT@ddockett Patrick peterson follows the #1 receiver..... But just pay me no mind Im gonna go lay down and rest my knee. Ttyl,0
5195,And now Im unemployed! #winning,1
2872,Man being unemployed is the best. You get so much shit done when you dont have all that work shit getting in the way. A++ would recommend,0
2186,1st week I didnt get a video up but theres1 coming! Heres a link share subscribe! https://t.co/rNxBOl6s6P #YouTube #unemployed #jobhunt,0
1542,Showed up to work today thinking I still had a job and my uncle told me to gtfo and never come back... looks like he actually did fire me...,1
143,work called today wanting me to help with ship from store.. I swear I was hired as a cashier not apparel yet i do everything but that..,0
