id,text,class
5258,Bloomberg is hiring a Software Developer C/C++ - Equity Products Job http://t.co/wRTnFZfP4e #job http://t.co/jKGAuxsYFt,0
1552,This weeknd I took a couple days off so I could drive down to eugene for a job interview. Also gotta move into my new house.,1
4324,Anyone in #Fresno know anyone thats hiring??? #ineedanewjob,1
1219,Interested in Real Estate Careers? A networking event you might attend is 4/11. Register: http://t.co/Ya4Dfnr6S7 http://t.co/48vr4CWO2d,0
1198,Got laid off today. The Oilfield industry is brutal right now. Time to find a new job 😔,1
412,#Job #Raleigh (USA-NC-Raleigh) Dockworker Part-time: FedEx Freight Inc.This is a part time position.Transp... http://t.co/qFtKySXEIb,0
1005,Here you have the hired law firm conservatorship overseer that supervises Britney Spears by California court order. http://t.co/Cfi3UeZo0X,0
1805,I am searching for a hotel for @A1A_Marathon. Any suggestions?,0
3457,I also applied for a job with apple last night.. Not the same position but HOLY CRAP PICK ME,1
3145,And with that...I am officially unemployed...laid off from the Mortgage Specialists. If anyone knows of a local... http://t.co/fODGkqNqQV,1
2247,Ad: Unemployed? Looking for a new Job or Career? Work at Home Positions avail $80-$90 a hr http://t.co/VYzQ5vRXTY,0
5414,Amazon posted a job you might be interested in. Software Development Engineer - Amazon WorkDocs - San Francisco Ba… http://t.co/yW0ntVsDGq,0
2196,Officially unemployed. Anybody want to give me a job?,1
4663,I was hired and now have health insurance and can pay for my sons daycare. Thanks Obama.,0
2375,Who job hiring ??,1
909,Okay so my g.m. Offered me a manager position yesterday plus I got my key to my apartment today # WINNING,0
4320,Whose hiring!?? Im looking for a new job tired of the same bullshit everyday from people who arent even my supervisor but 2 hrs a day.,1
4814,My bf got laid off from his job :(Are any places hiring!?,0
4735,I recently had a dream of missing my return flight and getting fired for missing work.The former has happened before but not the latter. https://t.co/GG0t9Ub8ea,0
1590,Looking for a job? Developmental Intern - Energy Efficiency (E&amp;D) at New York Power Authority (Wh... http://t.co/S0NkmkrLbt #green #jobs,0
3886,My co worker saw me from behind today and thought we hired someone new haha,0
37,I just got laid off from the warehouse I work in. Anybody know of any warehousing temp agencies prefe... http://t.co/WqMS3k21Vm #reddit,1
2578,Jay Gruden is in a unique position.  He can either be fired or get an HC position.  Whats that say about the #nfl? #Bengals,0
4925,I am not in the financial position to give up only paying $165 bucks a month for rent and bills but I wish I was for another persons sake,0
4784,I was fired from my previous job for having sex with the bartender... I was the bartender.,0
2366,does anyone know of a place hiring?!,1
4295,I need a job. Anybody hiring??,1
4944,Wow. Worst day ever at work so far.. I think imma quit. I cant take it anymore. Anyone know a good place to work that is hiring? :),1
3119,@laidoffleftout I am also one who is laid off from the construction industry and got a better education who still cant find work. #renewui,1
310,I lost my cat.... in my house..,0
5122,I also had an internship and quit it since the time we talked. Im looking  for a new one as we speak.,1
1143,Got laid off yesterday. Non stop job hunting today. -_-,1
4675,The camp I worked at last year is HIRING! Running to apply now yes Jesus I hope I get hired,1
1912,RT @paulcarr: Whenever I see Greenwald I dont think internatl jounro rockstar so much as recently laid off Ghostbuster http://t.co/r…,0
4621,Anyone working in retail know places hiring ???,1
271,My hired day was yesterday Walmart finally called me in for orientation thank god 🙌🏾👏🏾🙏🏾,0
5278,Dont submit then quit. Apply for jobs like RN Nurse Manager at Canterbury Woods then look for people you might know at the company. You might be able to reach out to HR directly. Ready to apply? Check out the link in our bio.,0
5431,Well Today WAS My OFF Day  But She Put Me On The Schedule Since She Fired Somebody,0
3282,At a job interview this morning an employee peeked around the corner and mouthed YOU DO NOT WANT TO WORK HERE. I was hired. #badsign,0
2331,Now I am actively looking for jobs in Manhattan and uggh I hate looking for jobs,1
1151,well I was laid off today because the season is over so looks like its back to job hunting for me,1
2645,Starting a New Job? How to Avoid Getting Fired in Your First 6 Months http://t.co/m43mdyfqEV,0
4130,Im losing my home and car due to being fired and not being able to find job to cover immediate bills not ... http://t.co/eKwWHiZbWZ,1
1114,I am job searching for: Work at home jobs! http://t.co/4tgcXWg6JK — Walker Inklebarger (@Walker_marocliv.... http://t.co/2Krzj9OxCV,1
3707,After hitting 90 movies each of the last 2 years Id like to thank my unemployment for getting me to 101 this year #HalloweenRules,0
3352,anyone know where I should work next?? turns out I got fired and didnt really know so I guess Im on the prowl,1
5285,Now On my way to my first corporate job which I got on my own #blessed . NEVER GIVE UP !,0
1638,Are you seriously searching for a business opportunity so that you can quit your job and live life on your terms?... http://t.co/8as6A3QcNq,0
4293,Any jobs hiring?? Let ya girl know,1
4308,Anyone know of places hiring??? I want a 2nd job! Im money hungry.,1
4010,Avoid using these 4 toxic words while you are job searching: unemployed nice try and open. Heres why: http://t.co/pHKbmfGC,0
3202,I got fired for organizing a union with my coworkers and it has been extremely difficult for us to find work. It’s not a good time to look for work https://t.co/FCCuyrYJV8,1
2496,I applied for a position with @SJMjobs yesterday evening. #Motivated #JobSearch,1
2397,Okay who knows of any place that is hiring right now!!!!!!,1
1404,Unemployed Under-Employed Unhappily Employed? Find jobs &amp; career solutions on LinkedIn in JCD The Job Seeker &amp;... http://t.co/PU1at6It70,0
3861,Ive been fired and rehired by my boss 8 year old son 9 times in the last 45 minutes. Its been a rough day.,0
3981,I got hired at both of the jobs I had interviews at today. I am going to vomit,0
4288,Anyone hiring entry level positions in a tech or imaging / photography / arts job? ANYTHING. In Chicago preferably but will relocate.,1
1298,Interested in a #job in #Mesquite TX? This could be a great fit: https://t.co/wqJiTWI366 #Retail #Hiring,0
3741,Unemployment is at a 49-year low and I still dont have a job.,1
959,Got offered the position I interviewed for yesterday \o/ Howeverthe offered rate was a bit lower than I wantedand below the min. in the ad,1
4903,Guy on the train is wearing a shirt that says suck my Richard lol how funny is that I am just dying this just screams unemployed.,0
321,Great friend lost his job today.  I am deeply saddened.,0
1121,I am job searching for: Work at home jobs! http://t.co/4tgcXWg6JK — Walker Inklebarger (@Walker_marocliv.... http://t.co/R7ZDddAHBm,1
3430,I set my goal earlier this year. Now I work on it. Resumes sent out tonight for Electrical Supervisor positions. Lets see what happens.,1
4295,I need a job. Anybody hiring??,1
1826,I still search for that one employer who doesnt see me as a risk because I would really love a bit more financial security...,1
866,Job Hunting? 160+ Openings at Meetup N.Y. Philharmonic and More #Tech: Unemployed underemployed or somewher... http://t.co/OMxfzVWZ06,0
3959,finally I got hired! thank god after I move its gonna be 5-10mins away.,0
2398,Does anyone know anywhere in denton thats hiring? Help a sista move out!,1
1053,Currently laying on my floor in fetal position chanting I need a new job. I need a new job,1
991,Interested in a #job in #Pennsylvania 526? This could be a great fit: https://t.co/Qifzt9Yt8F #NowHiring #GetHired #Hiring,0
1439,Unemployed - Looking to get back to work? https://t.co/TgScR5Sasl #HRGirlfriends https://t.co/M9nRxX6IDP,0
1749,Freshly laid off checklist:✔ Call partner✔ Call Mom✔ Call Dad-- Wait on hold forever with unemployment. 😓,0
2131,Searching for #work in Columbus OH? Send your #resume to Express. http://t.co/6yG91nNBZM #gethired,0
3525,Now Im in medschool which feels like 4 jobs at once most days.,0
1593,Looking for a job? Instructor - Adjunct - Energy Efficiency at Education Corporation of America (... http://t.co/GICorAoj0U #green #jobs,0
4640,I am looking for work.... anyone hiring?  Ive been looking and applying my heart out!,1
4682,I applied to 5 jobs while watching ultra. I get shit done why arent I hired yet?,1
4467,Officially gonna quit my job. Whos hiring?!?!,1
5148,If you have been laid off just gotten out of the military or new to the job market you can contact your local EDD. http://t.co/EGmdfbUe0k,0
1840,Searching for a new job. My expertise are HRM Admin Intelligence services and Tele Communications.,1
1170,I got laid off today. Im fuckedddd,0
227,Well today fucking sucks and I lost money snow plowing... How does that work?,0
4697,Anyone hiring? Im trying to quit my job doing bodywork....,1
1291,Dont submit then quit. Apply for jobs like Corporate Communications Specialist at Republic National Distributing Company  then look for people you might know at the company. You might be able to reach out to HR directly. Ready to apply? Check out the link in our bio.,0
4477,Yaaaaas quit my job today and got hired at another 👌👏🙌💯,0
1080,Well I am actively searching for a new job.,1
4335,I need a new job anyone hiring?!?!?,1
453,#DramaAlert @sK_Shades claims hes quitting knifing! Is he trollin? Well find out on the 32nd of January,0
4464,If McDonalds say Im hires today. I swear I wouldnt quit this time,1
4623,Anyone work at a show place thats hiring and pays more than $8.25??? #NeedThat,1
1143,Got laid off yesterday. Non stop job hunting today. -_-,1
4930,My boss is playing Imogen Heap and Frou Frou. YES!! My day became 10x better! And I landed an interview for a design position!,1
4103,I havent been to my work &amp; learn in at least 2 months how have I not been fired,0
1631,I am looking for a buyer on 1234 W MESQUITE TREE Lane San Tan Valley AZ. http://t.co/c19nsG29ba,0
1327,If youve ever been interested in quitting your part time job wanted to be your own boss  or run your own business send me a message!,0
2222,Ive been unemployed for a month. Sent two important lengthy emails today. Im tired. Im excited.,1
3638,Looking for a new #job in #Kentucky? Subscribe to #JobAlerts! http://t.co/nlyggAo5xX,0
696,So for the first time in 30 years...I got fired today.  I am looking for work or marketing work but let me know... https://t.co/99ZRjqBdJQ,1
2332,I’ve only been unemployed for 10 days and I was blessed with a job when I wasn’t even looking and I start tomorrow. A bitch just want 2 sleep!!,0
1101,I am on the search for a second job.,1
2722,#Job #Manhattan Retail sales position (Midtown East): High end tennis shop in mid-town Manhattan needs an expe... http://t.co/nfsCk46kGR,0
1329,Here is an awesome app that shows you how long ago you quit smoking -&gt; https://t.co/69F7MYabG6 #vaping #eliquid,0
1023,Currently applying to jobs. Therefore my Twitter is now going private until Im hired.,1
1655,I am gonna start a new account i am tired of the shit is going on or im am just gonna quit i am still decideing about it,0
4352,Microsoft posted a job you might be interested in. Software Engineer II - Shanghai City China CN via LinkedIn.,0
2963,I now work another desk on campus and the new boss told me in order to work there I need an eclectic taste in music. Hes in for it.,0
3112,@DMRegister not well recently laid off. Struggle making essential payments. Looking for new opportunities all I can find is for lower pay.,1
3059,My shipping scale is broken I lost the keys for the place I housesat for and my place is a mess because my scale is broken. Today I quit.,0
3858,Literally lost a job and 5 min later got hired somewhere else #peopleskills #closeddoor #openwindow #happy #lucky,0
4316,Does anyone know whos hiring?!?! I need a different job,1
1030,Another interview and not hired thats now 4 jobs I been denied and no call backs on 10 others Ive called them and leave msg. What am I going to do.,1
1124,I am job searching for: Work at home jobs! http://t.co/4tgcXWg6JK — Walker Inklebarger (@Walker_marocliv.... http://t.co/prNqkTD5sJ,1
1115,I am searching jobs in New Jersey on http://t.co/rwQS6slTU4,1
4702,does anyone know anywhere hiring?? Im bout to quit my job,1
3375,Getting fired today. And probably going to get kicked out. Anybody hiring?,1
4323,I want a job so bad  whos hiring ???,1
1013,The reality is that as a job seeker if you can demonstrate that you have ideas for solutions to problems that a business has you get hired.,0
3953,I got hired in a salon..... I start monday bitches,0
4135,Jessica got fired from being a Lobbyist and Im trying to get her a new job.Jaik is a Paramedic.Both are Knowledge aspiration~,0
5269,About to quit  who hiring ?,1
2874,Being unemployed is a lot like being retired except Im not old and all my friends are busy at work all day what a bunch of nerds right?!,0
2288,Looking for a Spring semester Work-Study job?  Purdue School of Nursing has a Clerical Assistant position to scan files to archive make copies make student IDs file cover phones type and other clerical tasks. https://t.co/zEDTdoCG8I,0
4053,I am unemployed. I have a judgement against me. I am on my patents checking accounts as a signer for emergencies... http://t.co/r1y9nsqbaj,0
3406,So I applied for a new position earlier this week and not they’re telling us today that the kind of position I applied for is no longer going to be the same and that shit’s on hold AGAIN and I’ll have to re-apply eventually which is cool and nice and fun.,1
785,I am currently employed &amp; still searching for a payroll specialist position in the Kansas City MO or KS area. Anybody plz forward any leads,1
3122,I was laid off from my job April 7. Seeking editing job. Appreciate all leads. View my LinkedIn profile: http://t.co/ogRrXD1eNZ,1
3673,Looking for a teaching position? Dont miss Teacher Recruitment Day April 25 at 9am in Co-REC Black &amp; Gold Gym!,0
4439,Hired a Mommys Helper to run errands w me tomorrow bc I am a total sellout &amp; quitter.,0
3160,Debating whether to switch jobs rn to a better company with higher pay OR stay at my current job till I get laid off &amp; then go there? 🤔🙃,1
4321,Anyone know a place thats hiring?? #needajob #asap 😁,1
1111,I am Looking for work in fixing computers or security jobs.https://t.co/HsApvrA7Se#fintech #bitcoin #rimbit #crypto,1
764,@renewaldb I might be interested.  Is there a job posting where I can see position description?,1
245,got hired to be tutor in my summer statistics class even though I know as much about statistics as the guy Im tutoring,0
2343,Is anywhere hiring?? Someone please tell me of somewhere,1
3613,Recently I just been fuckin and making art exactly what I saw myself doing in the future 5 years ago,0
3508,Im not a bum for being unemployed right now my last job put me in danger. I have put in 23 applications and sent out my résumé.,1
1023,Currently applying to jobs. Therefore my Twitter is now going private until Im hired.,1
2365,Does anyone know any places hiring .....,1
1088,I am searching jobs in New Jersey on http://t.co/H0a5SDt6BT,1
1108,I am job searching for: Work at home jobs! http://t.co/4tgcXWg6JK — Walker Inklebarger (@Walker_marocliv... http://t.co/SQmarqg5CO,1
2701,#Job #Cambridge (USA-MA-Cambridge) Manager of Event Content: Manager of Event Content*The Position:*As a... http://t.co/D3XQe8JRXm,0
2198,The truth about how I found myself #unemployed and #unemployable - http://t.co/kq08eayplc #entrepreneur #fired #corporate,0
814,#quitness starting to show up even before the 4th quarter. #davidblatt take him OUT! #NBAFinals,0
1605,Looking for a new career? Rain Bird has the right environment for a thriving career. Sr. Tooling Engineer #Tucson AZ #job #hiring #career https://t.co/k9hK5oTSM4 #Engineer #Extrusion #Plastics #CareerArc,0
4539,My Hands Dont Like To Be Unemployed They Like To Work!,1
1459,I just lost my phone on my desk at work. What is my deal today?!,0
1628,I am thinking about quitting golf. What do you think? I need advice,0
918,I got offered a full time position doubt telecom today out of nowhere didnt even apply for it. School first tho,0
1044,Literally not applying to jobs I know I will get hired for. #aimhigh,1
3185,Some #USC players are finding out via Twitter that Sarkisian is fired. Position coaches also have texted their players.,0
209,Today I tried to spit out mouthwash in the grass but it all went in my hair &amp; if you think I washed it out before working 7 hrs youre wrong,0
1440,Unemployed? No job? Looking for employment?  Now hiring! http://t.co/uwCbHWfUuh http://t.co/cxOeKSTG1o,0
705,Also my co-workers fired me cause I didnt come into work yesterday,0
543,I Was Fired for Making Fun of Trump https://t.co/dPvM6tltSPI can only hope that I have enough character and backbone to be fired one day for making fun of our perpetually mediocre or worse political leaders. In this life stand for something or be blown over in the wind.,0
410,#Job #PaloAlto Hardware Development Engineer II - REQ260: Cupertino Multiple positions available company: a2z ... http://t.co/Y2o5xobBr0,0
4121,I was job searching &amp; wlc is looking for a new tech guy. Pretty sure Mr. Ballou got fired...,1
4989,Email is down at work and my dad was like are you sure you didnt get fired? STOP DAD I CAN GIVE MYSELF MY OWN PANIC ATTACKS.,0
2048,Looking for a new #career in #technical support? Get hired by doing this one thing http://t.co/hPzi63q5Fl,0
2618,Has attacking George W. Bush backfired big time for Donald Trump? https://t.co/AsuwDgfI07,0
5066,Stagnant?Im a highly skilled white collar worker &amp; I cant even find a damn job after being laid off! A nation of homeless ppl is coming. https://t.co/064d1cMiUq,1
2342,Anyone knows about a music studio thats hiring ?,1
1629,I am quitting smoking.,0
618,Looking to Hire or Be Hired? Turn to #SocialMedia | http://t.co/oKeJPIZ9iz,0
4119,I am applying for every fellowship I can find in 2018. I am so fired up to learn and share knowledge! My brain is ready to expand.,1
1705,Jared says: I am laid off for two weeks n I filed a claim for unemployment when I went to certify I answer... http://t.co/w253Vh9jMQ,0
3138,My boyfriend got laid off and hes looking for work but hes got two weeks to make rent. If you can help at all or just spread the word...,0
652,Heres what to say when a hiring manager asks Have you ever been fired? https://t.co/tapqkP9A2j,0
801,I am seeking a technology facilitator position at a school in the Chicago Suburb or DeKalb County Area. Please DM for resume.,1
3550,Recently started watching Castle. Its formulaic predictable a bit over-the-top and I love it.,0
3995,Wouldnt it be great to have an expert guide you through the #job #application process? Well here ya go: http://t.co/du1dzvutYF#unemployed,0
2736,I am Looking for work in fixing #computers or #security #jobs.https://t.co/Bm4FAwHaSz#Oakland #Bayarea,1
3154,@E_Megas I am looking for freelance gigs. I was laid off a steady 3 year gig. This is the longest Ive been out of work.,1
2386,Anyone taking applications for a personal chef? http://t.co/eOyw6Kodbs,1
122,My cat fired me. Then hired me back the next morning.,0
3573,I recently started listening to @the1975 and the song Somebody Else makes me :)))))))),0
790,My resume clearly states that I am currently employed. Why are you calling me about a Contract position?!  these recruiters man.,0
5006,Good news everyone! I had a bad attitude at work today for the entire 8 hours and I wasnt fired! If I can do it so can you!,0
4340,Ummmm anyone hiring ?? Need a good paying job asap,1
267,I got a job interview got asked out got someones number and free food. Today is a great day!,1
2236,Im an unemployed lump so Ill be staying up as late as I please for the next week or so until I get my resume in order to send out.,1
1110,I am job searching for: Work at home jobs! http://t.co/4tgcXWg6JK — Walker Inklebarger (@Walker_marocliv.... http://t.co/Wzgp5pE2qL,1
1087,I am searching a job for Graphic Designer,1
149,I bet I fucc around and get hired by somebody today aha I feel it,1
953,I applied for a position got sent a confirmation email then got a rejection one 3 minutes later lmao no bullshit here at least,1
2053,Looking for a #JOB!? Get hired here &gt;&gt; https://t.co/ktalbUlaA7 https://t.co/ukyz9UC2X6,0
1094,Today I am searching for a job pretty desperately again need to be busy and getting paid for it...,1
4137,We are seeking a social media expert/writer who is fired up about libraries archives and museums. Join us! http://t.co/rV097IQ3zr,0
3744,@DanScavino You are disgusting the worst kind of person. The world will greet your unemployment with a smile when your boss goes to jail,0
4979,This week I got 32.5 hours and my co worker got 7 sucks to be a shitty employee,0
255,Whos Job Is Hiring?!?! Hook Me Up Nigga!!!!,1
1207,So you were laid off or fired via Couponing 4 You - So you got laid off or fired today all these ... http://t.co/hr8vFz57nr,0
2129,Searching for #work in Newark NJ? Send your #resume to Horizon Blue Cross Blue Shield of New Jersey. http://t.co/UraFuURHaT #gethired,0
5296,I remember when I thought Eric Bledsoe was the answer. I remember when I thought firing Jason Kidd was the answer. But both have just caused more problems,0
4306,Anyone know about any restaurants that are hiring or non food jobs??,1
4704,Anyone hiring?! In need if a second job!! #gainesville #ga,1
644,Has anyone on here hired a Virtual Assistant? Advice???I seriously need a personal assistant at this point and have debated it for awhile for my publicity social media emails castings Production Contact log updates calendar management...#virtualassistant #PersonalBranding,0
3032,My job pissed me off so bad today for the first time  if this money that was rolling in wasnt so good . I would fuckin quit man,0
2720,#Job #LittleRock Applications Systems Analyst: AR-Little Rock Applications Systems Analyst - Senior Position... https://t.co/tq0p50rgrP,0
4580,I am  an unemployed father of 5. I am trying to start a small businessbut i need help with start up funds. any suggestions or help please,1
389,I Am Seeking A Virtual Strategic Sourcing and / or Recruiting position (for me).  I am successful working in...: http://t.co/BqNhZvNj6C,1
395,I am Looking for work in fixing computers or security jobs.https://t.co/74RmVx61ty#needajob #ITjobs #hirefriday… https://t.co/JhapDUfj94,1
3716,And.... Now Im unemployed.,0
4954,Curious how hiring someone for equity or raising capital effects your slice of the pie? https://t.co/dn0Y9H5cb3 https://t.co/XmIAK8Kf0g,0
2764,Today I got paid to stand and say hi to people at work then got paid to take pictures with this art intern...all in a days work,0
1467,I straight lost my mind today at work.,0
4668,Unemployed? Cant seem to get hired? Try this: https://t.co/3A7nJY5NsT #careers #careerstory https://t.co/HBBbAV9aRm,0
4705,Anyone know of places that are hiring?????? #needjob,1
196,Well I came into work late. They gonna fire me. I can feel it!!!! WHO HIRING,1
4318,anyones job hiring over night????????????????,1
864,I liked a @YouTube video from @thesiqshow https://t.co/0GZhmQtaHI Unemployed Rant Sexual Harassment Update Vlog,0
1127,I am seeking evening/weekend job opportunities. If you know of any available I would greatly appreciate it if you could send them my way.,1
3101,Im #laid off and #looking for new #job opportunities in the #Chicago area.  Microbiology Molecular Biology scientist.  #recruiter  DM me.,1
1826,I still search for that one employer who doesnt see me as a risk because I would really love a bit more financial security...,1
3527,unemployment is causing me to go freaking stir crazy....  Job searching in my field is really a pain in the dick.,1
2550,Looking to join a talented creative team and help businesses grow? Check out @WeidertGroups Copywriter position: https://t.co/779ygRf1eQ https://t.co/u3pjFL2Vmg,0
2985,My girlfriend recently started working nights. Ive been waking up to a lot of worrying te… https://t.co/QL0vbj3Pl9 https://t.co/uegSGlrC0D,0
4467,Officially gonna quit my job. Whos hiring?!?!,1
947,Got the best news today Im going from part time to a full time position. Get ready to work your butt off my manager tells me,0
4356,Microsoft posted a job you might be interested in. Software Engineer – Visual Studio Cambridge - Cambridge United Kingdom GB via LinkedI…,0
4607,Today went by really quick. Being unemployed sucks but glad I got the time to make some smart moves. Any downtown employers hit me up plz!,1
5103,Looking for a new job so I can quit one of my jobs...,1
4639,does anyone work at a place thats hiring??,1
3784,#581 #Shopping #FREE #USA Ultimate Guide To Job Interview Answers https://t.co/q26CZWTvGK https://t.co/7eqASii8gU,0
5213,Being #unemployed and looking for a new #job takes a surprising amount of time and effort. Sorry #youtubechannel I got some things to do.,1
4687,Anyone hiring in social media media or marketing? Drop me a line: http://t.co/WAVTSZTbjt #SocialMedia #Media #Jobs,1
1922,Hypocrisy Fiorina is talking about equal wages when you laid off 26K employees at HP while almost quadrupling your salary #CNBCGOPDebate,0
584,whos hiring? the moment i get hired somewhere i get my car... hook a nigga up guys! haha,1
365,I am trying to find a new avenue for work. I do not want a disability!,1
4473,I quit a job today &amp; got two other job offers 😏,1
566,Unemployed pot smoker? Weird. - I Regret Nothing: First Man to Buy Legal Weed in Washington Fired http://t.co/j5zLPcVm9D,0
