id,text,class
4050,Repayment holiday on my loan is about to end but am currently unemployed so cant go back to making my original payments. Help please! - …,0
4111,Searching for a second job that wont conflict with my first job and get me fired 😒,1
3756,This is where Im at with life right now. #unemployed http://t.co/PCMKpa10Pk,0
1264,One day you might find yourself working on a pursuit then all of a sudden lose all interest and have no qualms about it.,0
3327,I think Ima get fired soon anybody hiring?,1
2175,Bad News Rob Ryan Was Fired. Good News Rob Ryan Is Unemployed And Living In New Orleans https://t.co/cOD91SUhjv https://t.co/kSRSrZHXyA,0
4303,IS ANY PLACE HIRING??? THIS GIRL NEEDS A JOB YO.,1
1733,To all of my baseball fan family:I was laid off yesterday and am unemployed 1st time in 20 yrs. Send leads my way pls! @BaseballDo @TepidP,1
357,Im looking to hire a TRIM carpenter. Im looking for someone with some talent and wants to work hard. Im NOT looking for a helper or...,0
2378,Is anywhere hiring at all ??,1
2339,Anyone looking for a Paid Summer internship??? If so check out http://t.co/vp1Lqn72i9,0
1093,I am not looking for a job I am trying to find a career,1
3202,I got fired for organizing a union with my coworkers and it has been extremely difficult for us to find work. It’s not a good time to look for work https://t.co/FCCuyrYJV8,1
5320,So did @_anisamarie get fired? Because last time I saw her was a month ago.,0
4708,Does anyone know any place hiring? Please my store I work at is getting shut down and I will be jobless,1
2734,I am working on the Girlfriend Application. and i am looking for some good questions Any ideas any one?,0
4564,Now whos hiring?!?!,1
4695,Anyones jobs hiring???,1
1469,Today was a prime example as to why I cant go to work sober. Damn near almost lost my job,0
5175,I got laid off on Monday needing to find a job quickly also hoping my house~ https://t.co/EBlIQaTyhn #pray #prayer https://t.co/KK4e7zDX6b,1
3622,Looking for a job in #Arlington #VA? CAT II Bengali https://t.co/38oJl3yY6i #jobs #hiring,0
2285,Looking for new job or contemplating a career change? #DYK that new positions are posted to our Work In Optics job center every week? Check it out today: https://t.co/HAMh0SaSVo #NewJob #CareerChange https://t.co/sVuHTeFo4W,0
2357,Does anyone know any places hiring? #needajob,1
4554,OK #Nashville - I have a 19 year old with brains and muscles (my son) who needs a job. Anyone hiring or know of an opportunity?,1
3637,Looking for a new job..whos hiring?,1
5175,I got laid off on Monday needing to find a job quickly also hoping my house~ https://t.co/EBlIQaTyhn #pray #prayer https://t.co/KK4e7zDX6b,1
4086,Also I didnt get fired they are having a mass layoff so hopefully I can get a better job now.,1
4294,Anybody Hiring??? Looking for a 2nd job,1
1103,I am seeking a new marketing or investor relations job,1
3601,Im getting paid $12 + tips to ride in a golf cart and sell drinks/food to people all day at my new job. #score,0
2353,Who hiring???!!!,1
4423,@MileysFanbase Hed go learn himself a real skill b4 he gets fired bc hes going 2 have 2 focus on finding a home + wont have time 2 learn 1,0
1994,I recently had a conversation with my teacher at that time. It was her first year on the job. She wasnt sure what to say. #challenger,0
358,I am badly searching for a job. I was working for 1.5 yrs but lost it. Plea~ https://t.co/BoFNeiwnjA #pray #prayer https://t.co/Ot9tssGocS,1
4331,Anyone hiring C++ Developers or Linux Admins? Im in the job market :-),1
3482,I got the job!!!!! You can call me what you want but you cant call me unemployed!!!! Lol,0
3483,I am an unemployed facilities manager would love a job please help  legup,1
2213,Unemployed for 12 minutes; how I went from #fired to #CEO http://t.co/SYRtS6zFWK #entrepreneur #corporate #unemployed #unemployable,0
4593,Are You Unemployed? Want to Learn Social Media while you are looking? http://t.co/I7Pn3UwtpH  Earn while you learn,0
1214,RT @continimarco: InfoCert posted a job you might be interested in: Engineering Talent Network - Italy IT.,0
1068,Currently begging nick to come back so I can get a job. Am I cray? NO. 😩😅,0
3284,The Police Officer from Athens-Clarke County who was fired over the weekend for supposedly striking a fleeing felon with his patrol car was hired by another agency Monday. I will have his attorney on THE MIKE BROOKS SHOW 12-3PM TODAY on @TheTalk1067,0
149,I bet I fucc around and get hired by somebody today aha I feel it,1
922,Got hired  t best buy mobile last week &amp; today I have an interview with FedEx for a customer service rep position! #needthat#,1
5277,If you #smoke and are having a hard time getting a #job you might want to consider quitting. More about the connection on #WPSD at 6:20am.,0
4793,Shouldve moved up my interview to earlier in the week now i gotta depend on wednesday to determine if i have to stay at this wack ass job if i dont already get fired for not showing up lately...,1
1872,More than 250 workers were laid off Wednesday following the layoffs of another 108 workers three months ago.... http://t.co/Nzzrc7XFva,0
2391,Anyone hiring foodmonsters in NY? plz hire me full time I swear Ill try my hardest to leave you a pizza slice...,1
4949,Any places hiring around mesquite/pg?,1
1114,I am job searching for: Work at home jobs! http://t.co/4tgcXWg6JK — Walker Inklebarger (@Walker_marocliv.... http://t.co/2Krzj9OxCV,1
5412,Nyawinoh: Dell posted a job you might be interested in. Network Monitoring Analyst - Oklahoma City Oklahoma Area US #Link… …,0
4498,my bus driver quit today I wonder why???????,0
3924,Searching for #work in New York NY? Send your #resume to Lheim Industries LLC. http://t.co/mtsV8jaQ2T #gethired,0
2279,Looking for a job? Superintendent II - Wind Energy Group (IRC9674)Job Details at M. A. Mortenson ... http://t.co/QwGh7Ady3n #green #jobs,0
1078,(IN) I quit my advertising job because i lacked the passion for it. I am searching for a job that i am passionate about but im running out…,1
4169,I can’t get shit back on my tax returns... how you hoes be unemployed all year and get back more than 10 racks??,0
1880,@MJudahBrave @JJWatt very true. My mom just got laid off two weeks ago from BP after 35 years there!,0
2531,Looking for an exciting new #job? Opportunities include a Senior UI Developer position in #Arlington VA. #... https://t.co/dClbbeWAtU,0
1985,I was stressing over leaving my old job but my new job treat me like I own the place. You really gotta be willing to progress,0
3954,Got hired at @ChoiceMusicLA 5 months ago &amp; I realized I had no idea really what K-Pop was outside of BTS. So that night I went home &amp; started listening to @TheKpopcast to learn more &amp; today exactly 5 months later I finished listening to all their episodes dating back to 2016!,0
1120,I am job searching for: Work at home jobs! http://t.co/4tgcXWg6JK — Walker Inklebarger (@Walker_marocliv... http://t.co/BySThx8jDz,1
4272,Currently at work looking for new jobs so I can quit my gas station job.,1
13,@pixelatedboat Me: And in this scene Marnies boyfriend eats her assLaid off auto worker: I lost my job and my friends are all dying,0
1633,last resort is to give up searching quit my current pt job and go work ft thru the temp agency....,1
1072,Lost my job 7 years ago and have not been able to get another I am searching for a job but dont have a car to claim as my own. for a job,1
889,I searching for a position as a registered nurse. #focusclass,1
1632,If I don’t find an internship for next semester I am not finishing grad school. Like I’m quitting. I give up.,1
4565,Anyone kno of places near glassboro thats hiring? #mommyneedsajob,1
1918,Any day a #journo gets laid off is a horrible day for the industry.Thoughts go out to those at #FoxSports1 #FS1. https://t.co/KWzfLfJooq,0
4300,i need a job is anyone hiring??,1
1683,I quit my job today lol Going to start looking for a new job,1
2216,Still unemployed; not b/c the station didnt hire me but b/c of legal reasons. I was the only 1 interviewed and HR requires 2 more.,1
177,So today i got car sick had a boring day at work had to take a 2 hour bus ride home in the middle if the night &amp; said bus was an hour late,0
590,ima ask this all the time until I get hired... whose hiring???,1
4029,Currently unemployed seeking full-time employment in or near Bakersfield. Message me for resume.,1
2338,Anyone looking to hire a smart educated talented writer/producer/designer/photographer?  What Im saying is I am awesome.,1
806,Currently researching HR/Labor positions in the Ocean County NJ area however am willing to travel or relocate. Have 2.8 years experience…,1
196,Well I came into work late. They gonna fire me. I can feel it!!!! WHO HIRING,1
3194,I needa find a new job .-. I get bored af home. Why did I have to get fired -.-,1
2364,Does anyone know of any places in Mesa/Gilbert that are hiring right now??? PLZ help a girl out. I need that cash money flow,1
804,Currently seeking a position in Event Planning or Marketing. If your company has an opening feel free to message me :),1
910,I applied for a job position and surprisingly I got a call back today ya girl is making moves,1
392,I am looking for a few businesses to work with.,1
4692,Anyones job hiring????,1
2439,Who really looses Hiring Illegals...?? Small Business.A man that owned a small company hired 2 Spanish speaking... https://t.co/B35pR6cMoC,0
92,Got hired on the spot. God is so good to me,0
5293,My new Job site has 4 floorsa Elevator and a pool https://t.co/D0W7wLa1l6,0
2520,Looking for a development #internship? #UIRP companies offer positions for iOS Android web development &amp; more https://t.co/pLwjnAI0hX,0
5517,I got called 4 times today bc this woman wanted a bartending job at my bar... Yeah I dont own a bar.... Im 17.,0
4947,Is anyone hiring? Im dead ass about to quit my job,1
2195,i graduated on monday so now im just an unemployed 20-something,0
1585,Looking for a raise or a higher offer?  5 tips to negotiate #salary https://t.co/YCoXVJFjva #jobs,0
398,I am Looking for work in fixing #computers or #security #jobs.https://t.co/wCK1SPs6rv#fintech #bitcoin #rimbit #crypto,1
1549,2nd week on the job and I may have already gotten someone fired I mean freed up ones future. Being fired is an opportunity. Your welcome.,0
917,I got offered literally 4 positions today.,1
2353,Who hiring???!!!,1
4065,my old manager is trying to tell unemployment that I never called in on October 11th. Please explain this? Also I was fired on October 13th and my paycheck was ready 3 days later. If I stopped showing up why did I get a check so soon? I normally receive DP 🤷‍♀️ @ChipotleTweets https://t.co/JyjxOMGlCR,0
1946,Recently started my first FT job. Should I be paying more than the minimum on my student loans? - https://t.co/n7fgL3fDFR #taxreturn #taxe…,0
910,I applied for a job position and surprisingly I got a call back today ya girl is making moves,1
3535,Anyone in the greater Portland area know of any photography/videography type jobs? Amigo just got laid off.,1
1683,I quit my job today lol Going to start looking for a new job,1
3108,@cressler_nico nah sadly got laid off so I been searching. Woo! How have things been for you?,1
5528,3 wks ago on friends FB: I was just laid off. Whos hiring? This week same FB: Please stop with the annoying LinkedIn requests! SMH,0
4674,My manager has fired 4 people hired her best friend and a bunch of her other friends also,0
3209,I am positioning myself so that I can move in the full power of Christ. I am fired up.#boldness #christ,0
5279,Here is a creative way to quit your job!  So have you ever done anything creative to quit your job? http://t.co/WQvYXuU84p,0
1718,If I get laid off ima get that unemployment check,0
2313,Well has of yesterday I am unemployed (quit my job). Yes had enough my body and health can not take it anymore. Start looking tomorrow.,1
5164,Please pray that God leads me to a full time job. I was laid off and am not receiving responses to my http://t.co/R7QDi3NFx7 #pray #prayer,1
402,I am Looking for work in fixing #computers or #security #jobs.https://t.co/qDiujyCA9J#Oakland #Bayarea Please Repost,1
219,Lost my wallet today and yungboi at the gas station near my work held onto it for me. Good ass kid didnt even take a cent,0
1820,I am seeking employment with an agency whos ideology is about the well-being and care of the elderly.,1
5123,Just applied for an internship at the Ottawa County FOTC. Lets hope I get it and can quit searching for an internship.,1
1550,Got this girl a job next door to my office and she was late everyday they fired her this morning 🙄🙄,0
1949,Recently started job searching again...,1
325,i am thinking of changing my internship workplace if it is Gods will and i am searching for a place  http://t.co/GuAdDjDAku #pray #prayer,1
3431,My position at AMC was eliminated this morning so if anyone needs a lunch date or has a lead on an interesting gig PM me! #time4change,1
5424,Here Are The 32 States Where You Can Be Fired For Being LGBT http://t.co/bJnqS896TX,0
4536,My hands dont like to be unemployed they like to work,0
1563,This morning I got a call from Walmart thats my 4th job offer this week I had to tell them I was no longer... https://t.co/Y9qMRo1BM4,0
5228,WAIT WHAT ? WHO QUITS THEIR JOB BEFORE THEY GET AN INTERVIEW WITH THE NEXT COMPANY?....,0
4122,Well Im not fired but Im still searching for a break 😒,0
4389,@AndreaTantaros As long as the  @GOP stresses the HYPOCRISY &amp; #Killary was fired as a staffer 4  incompetance &amp; TRUSTWORTYNESS  #sarcasm,0
3287,Monster sent me a list of 5 ways to know if youre in danger of being fired. I need a list of 5 was to know youre about to be hired.,1
2744,My co workers found out I get weekends off and I got asked like 5 times to cover shifts yesterday and today,0
1058,Currently applying for jobs....,1
983,Interested in a #job in #PiscatawayTownship NJ? This could be a great fit: https://t.co/cjOSDPpnXa #NowHiring #GetHired #WebDesign,0
2257,Looking for a job in #Management? 100s of new positions were added to the BRR Job Board: https://t.co/ZNPyvVdGA2 https://t.co/17jKo4AFu6,0
3777,just find another job! (in some other country or something with the non-existent skills you obtained since... http://t.co/tgl3CQHBtm,0
3502,Sean Hannity is making 30 million a year for his job at Fox and Im unemployed ??  Seriously ??  SERIOUSLY ????,0
2038,Looking to get re-hired at a previous place of employment? Tip: be more prepared than you were the 1st time you got hired. #improve #biztip,0
4591,I have been working my ass off applying for jobs networking and volunteering and somehow 5 months after budget cuts Im still unemployed.,1
4298,Anyones job hiring? Bartender waitress cashier...anything just want to be busy!,1
5403,I helped a guy out that I worked with at my previous job by telling him about an open position at my new employer...he failed the drug test,0
1686,3 people quit at the DQ in Morris today and I applied.. if I dont get hired Im giving up all hope,1
3492,I should consider myself unemployed although not yet official. I am now open to consider other job offers!,1
370,I am looking for full-time work (and am willing to relocate!) if anyone knows of anyone hiring.,1
2841,I smoke everyday at all time bc I work my ass off and I can afford it. It would be bad if I was smoking errday but was a lazy unemployed guy,0
4636,Anyone hiring? Little brother got his hours cut and needs work,0
4214,https://t.co/EFA2GoapGv #JobSeek.us #Jobs #JobsIN This is an excellent opportunity for driven individuals with 1+ years experience in Private Equity Big Four Transaction Services or Investment Banking that are interested in working in a client... https://t.co/ZTGxst1KoC,0
4549,When you niggas talking about work you niggas unemployed,0
3259,I fired my Life Coach and hired an Inbox Coach. Look out email!,0
200,.......and i lost all the work i did today,0
361,I am looking for a PR person or company to work with for my upcoming Book and Gallery tour. Looking for any... http://t.co/lj2Tj6Z1tK,0
2092,Searching for #work in New York NY? Send your #resume to General Placement Service. http://t.co/Ka4yYpsS56 #gethired,0
1931,@HASSAssiNation: after following you for so many months I still cant tell what position you are Close D. Left side. #StrongSide,0
4311,I need a job  anyones work hiring ???,1
1082,I am searching jobs in New Jersey on http://t.co/p0ilvTJkLN,1
4733,I am late on my first day at my new job and Im prob gonna get fired already I suck,0
5229,Salary or equity? This website wants to help you understand startup job offers https://t.co/wjYZ6nQ7n9 https://t.co/TYJ4zfxC4n,0
3987,I  put in my notice today at one job and got hired 30 minutes later to another 😁😁😁,0
490,My mom isnt even mad that I got fired like tf I hope she realizes shes my source of money until I get a new job.,1
2500,Today has been rough. Headache  threw up from headache and told I wasnt qualified for a position.  Can I get a restart option?,1
2098,Looking for a CAREER with the same culture as your college team? This is it: https://t.co/j2wH4SWE0R #insurance #gethired #keepcompeting https://t.co/tNGk3R3XCV,0
3227,I dont want to find a new job but I honestly feel like I have no choice. Either I quit or get fired.,1
1640,I wish I didnt have to search so hard for a new job all I want to do is quit. Just thinking about work in the morning gives me anxiety...,1
5231,Anyone know any places that are hiring bc im really close to quitting and walking out,1
3154,@E_Megas I am looking for freelance gigs. I was laid off a steady 3 year gig. This is the longest Ive been out of work.,1
2008,Ight so I started this new job today right so Im in training class and the big manager dude ask who knows someone that works here this,0
3438,Last night I applied for a full-time good-pay position as a haha I wish but nOW I HAVE AN INTERVIEW ON WEDNESDAY???,1
3529,When unemployed ppl tell someone how to fill out job apps... lol ok,1
1543,I missed work yesterday bc i woke up @ 4pm so i didnt get my paycheck god what am i gonna do with my life i can even get fired from a job,0
5402,Of course when I tell my old job about my new job they offer me a full time position. Where was that about 3 weeks ago?,0
1737,Agood friend just got laid off after 30 years as an electrician. This economy is so bad! I miss u MITT!!!!,0
4444,Someone quit today and I talked my boss out of hiring someone else so I could get more hours. #success,0
43,Ill check this out within the coming days because Ive been terminated laid off and or locked out from my previous job. Thank you benefits,1
4644,so is anyone hiring? my coworkers are laughing in the face of another coworker a black nigerian immigrant that practices islam.,1
3654,Looking for real leadership in a virtual age? EWTN President and COO Doug Keck discusses the long standing... http://t.co/LfeZTd8ERX,0
741,you might be interested in: Director of Academic Success Position at Drake University Law https://t.co/NUPFhGH7MC,0
1441,Need to Make a Career Move?  Need a New Job?  Unemployed? @leezabyers Can Help: http://t.co/oOjI5gp7Na,0
3662,Looking to join Department of Veterans Affairs (@JobsatVA) Premier Anesthesia (@WorkatPremier) or Locum Leaders (@LocumLeaderJobs)? View 43 openings from these companies and more. https://t.co/Qe4cEifw7g,0
294,I cant stand my job today!  Whos hiring?  I can try to do about anything! Ugh!,1
1204,Ok got laid off.. Who needs a computer techie?  #unemployed,1
4621,Anyone working in retail know places hiring ???,1
2390,Does anyone know anywhere thats hiring??,1
1436,Unemployed Under-Employed Unhappily Employed? Find #jobs &amp; career solutions on #LinkedIn in the Job Seeker &amp;... http://t.co/vquOX8kf1O,0
4812,I was fired today from my part time job in california because i did not go to work. They update... https://t.co/y05XxIuHPX,0
915,Got hired at best buy mobile last week &amp;amp; today I have an interview with FedEx for a customer service rep position! #needthat,1
2368,HELLO SAN JOSE yall hiring????????,1
3322,So does Rutgers actually do employment background checks or do they just hire whoever?! And the persons hiring should be fired too!!!,0
1187,A year ago today I got laid off from Cheez. Yay?,0
1077,I seriously have pages and pages of Job Openings I want to apply for but I am addicted to Internet Job Searching &amp; avoiding the applications,1
1534,Well this morning I was threatened with a lawsuit and an 90 year old woman give me a kiss for doing a good job. Interesting day for sure,0
5251,Quitting? Firing someone? Here are the 4 toughest conversations youll have at work: https://t.co/SYToWxQwTb,0
3397,Can you recommend anyone for this #job? Fired Ware Utility - https://t.co/i6ZHvwO3EL #Spartanburg SC #Manufacturing #Hiring,0
1525,I recently began working at Nike. I rely on public transport so I worked nights in order to make it to work on time for 12 hour shifts.,0
4937,I have applied for so many jobs even a teacher aide position and not even an interview! I have 17 yrs teaching experience! #discrimination,1
4635,Anyone hiring where you actually have to do work??,1
3512,I came to Orlando worried about being unemployed and now I have 2 job offers to choose from #sweg,1
2463,Interested in a #job in #Halls TN? This could be a great fit: https://t.co/F1ITTEHUed #NowHiring #GetHired #Manufacturing #Hiring,0
4422,@MarcCarig Collins fucked up another game but he doesnt need to be fired what a joke this is,0
5305,To make this night worse I called the exact score 21-20 earlier this week cant catch a break,0
4934,haha i have a management position full-time and i still cant afford a basic fucking place to live funny joke,0
2801,Today I got free 20 Jamba Juice bc I have awesome coworkers who also work there.,0
276,Today I applied for 3 jobs and like I dont want any of them,1
4309,Anyone know if there job is hiring ??,1
4783,2nd day this week my car sat at a shop and nothing happened. If I was as useless as these people at my job I would be unemployed.,0
4512,umm your not a boss if you work for someone lol why do so many people call themselves boss and ceo? and they unemployed,0
326,I am working on being a rich wife while your out searching for a rich husband .,0
2330,Unemployed for three months constantly submitting applications and nothing... Now I get two job offers in the same day wtf,1
5152,I only worked 2 months &amp; already getting laid off,0
4592,I need prayer for full time employment. I have been unemployed for nearly a year. Donna-I need pray~ https://t.co/CRU9wptzrw #pray #prayer https://t.co/0roMPtg1sb,1
368,Im not looking for a handout. I am looking for a chance to work and prove I have what it takes to be a Pro Fisherman and make an impact.,1
297,I got asked if I was middle eastern at work today haha.. Thats new,0
2547,Looking for a new position? Visit @McCormickSems job board for open opportunities across the country &gt;&gt; https://t.co/6zddyM6joi,0
4304,Anyone looking for a job because mine is hiring !?,0
4657,Is anybodys work place hiring???,1
4319,Anyone know places in CLE/Akron that are hiring?!! I am having a hard time finding a job. Please let me know of any,1
4500,My soccer coach quit today...WORSE DAY OF MY LIFE,0
4692,Anyones job hiring????,1
2354,Whos hiring!? Anyone!? Bueller!?,1
2346,Does anyone know of any place hiring? http://t.co/4ggPlrcnNp #reddit,1
4642,Is anyones work hiring??,1
348,I am job searching for: Work at home jobs! http://t.co/4tgcXWg6JK — Walker Inklebarger (@Walker_marocliv.... http://t.co/eXIeEZM9cC,1
4625,Anyone work in the long-term care industry (e.g. nursing homes)? via /r/Entrepreneur http://t.co/nM0Dxrxrwh,0
3978,I applied yesterday and I got hired today lmao @ahricynthia5 @__AdamCCXX,0
3505,ok got another 8 job applications out now i am tuckered out and time to veg at tv for a bit,1
4353,Microsoft posted a job you might be interested in. Prinicipal Data Scientist - Greater Seattle Area US via LinkedIn.,0
2986,Recently started picking out outfits a week at a time because Im so tired in the mornings. Its been working out great.  #Adulting win!,0
2194,Of course Ed Orgeron resigned. Hes only going to be unemployed for about 15 minutes after the season ends.,0
3541,Got laid off today.  :(  Will rest this July 4th weekend and then start looking next Tuesday.  Anyone wants to hire me?,1
5509,I am seeking 2 local positions here in SLC. A customer service agent and a order entry coordinator. Play it forward if you know of anyone. …,0
2371,Anyone want to coach football?  The NFL is hiring! (Hey maybe someone will take Greg Roman),0
3283,Natasha got fired and I got hired,0
4332,In need of another job ASAP anyone job hiring?? #asktwitter,1
3333,Needless to say anybody know anyone hiring? #Imightgetfired,1
3369,So.  Brian George McPhee is fired and they hire his college teammate Brian MacLellan??,0
1096,I am job searching for: Work at home jobs! http://t.co/4tgcXWg6JK — Walker Inklebarger (@Walker_marocliv.... http://t.co/oeG4dn4iis,1
1073,I am searching for a job in helping clean businesses offices or home @lexijablon @lrotts http://t.co/Em2sdu6pK5,1
2881,I got called yesterday to attend an interview for a management position. I walk in today and the receptionist has a fold-out table 😅 #NahSon,1
3158,I was laid off from my first post grad school job 6 years ago today.,0
3511,Its 5 am time to start my daily job search and certify for my unemployment benefits. Good look in your job search and interviews! Peace.,1
355,I am looking for work full or part-time(fly-in) work as a data acquisition/assistant engineer.  Sports Cars or Open-wheel. Particularly int…,1
2107,Searching for #work in Lynn MA? Send your #resume to IBERIA Foods Co. of New England Inc.. http://t.co/CPOO3KWX7C #gethired,0
5236,Can you recommend anyone for this #job? Store Team Member - https://t.co/WXnjQCrkH8 #Retail #Mesquite TX #Hiring,0
