id,text,class
5219,Looking at job openings on my down time can be pretty sad. Especially as I sit next to the new intern aka an unemployed smarty with an MBA,1
4299,Does anyone know of any places hiring??  This girl needs a job,1
4635,Anyone hiring where you actually have to do work??,1
3265,Got fired for two hours then rehired. Wtff #NOBITCH I need to start looking for a new job,1
1113,So while searching for a job Im going to offer services as structural editor/copywriter/general wordsmith.,1
364,I am also looking for possible work in #branding #uidesign or studio openings.,1
2680,#Georgia #Jobs Field Supervisor- Temporary - Spectra Georgia: Norcross Position overview:to field inspect job ... http://t.co/ofuHQavtoL,0
4104,Work is killing me and I am sore this past week.  Started hydrating Gatorade and lots of water getting fired up... http://t.co/z2YCU0ftMy,0
4608,Im just got paid today drunk but Im unemployed. SMH fam,0
2909,No mama I lost my position as the teams water distribution engineer,0
4995,also I got sent home from work earlier because everyone was like fuck no get out of here but I still have to work all day tomorrow,0
2879,well just got told I wasnt hired for a summer position. my day is made.,1
889,I searching for a position as a registered nurse. #focusclass,1
2325,Ive been unemployed now for about 5 days...I am not about this life #ineedanotherjob,1
699,Just applied for a job that my friend works at and I worked at before I got fired for getting sick on black friday. ._.,1
62,I got laid off from an IT job and became an #UberDriver instead of going back to a 9-to-5 office job. One of the best things Ive ever done,0
3249,I got fired today bcuz I didnt feel like working and I dont even care.,0
3557,Every single summer since I started working at my job I get a new scar on my hand and arm from a cat scratching me. #jerks,0
804,Currently seeking a position in Event Planning or Marketing. If your company has an opening feel free to message me :),1
1410,Unemployed Under-Employed Unhappily Employed? Find jobs &amp; career solutions on LinkedIn in JCD The Job Seeker &amp;... http://t.co/JLU45SnxYg,0
4232,Currently sacrificing alot and its taking everything in me to stay the course and not to quit.,0
3025,Today my dog ate a slug and it stuck to her snout for a good 4 hours. I quit life as a dog mom,0
1748,I hope my husband at Cat is laid off instead of bumped down to $13/hr. Make more on unemployment...,0
382,I am looking for some extra help. I am adding an auto repair technician to my workforce. Email me twonutsmessage@gmail.com,0
2887,Interview today...n JUST got an interview for the position I really wanted TOMORROW. things are starting to fall into place,1
4350,Microsoft posted a job you might be interested in. Tech Solutions Prof DYN - United States US via LinkedIn.,0
4588,I have been unemployed for the past 5 months. Today there is a solid chance (I hope) that I might be offered a job. Should I negotiate sala…,1
740,Someone applying for a UI / UX Designer or Developer position might want to consider making their portfolio HTML5 compatible.,0
2411,Yahoo! posted a job you might be interested in. Incident Management Analyst - Buffalo/Niagara New York Area US... http://t.co/WIJ7UoIojs,0
1116,I am searching for a good job but i am not getting it .i am already 29 yrs and i dont know wen i will http://t.co/xeAPAYWQPu #pray #prayer,1
4321,Anyone know a place thats hiring?? #needajob #asap 😁,1
431,Cereal Entrepreneur Who Never Quits Makes Her Move To Organic Apparel https://t.co/kgfGvYG2Ex https://t.co/MCxmWffqcY,0
350,I am looking to start or work with a charity that helps foster kids.,1
1753,connecticut unemployment claim: #Collecting Unemployment if You Quit or Were Fired or Laid OffAudio/VideoI... https://t.co/jQrwqe98yk,0
689,I am ranting and if I get fired so be it. I am over this so called manager we have. Sent a text to him asking... https://t.co/vKLlEAIUgU,0
3699,With vine dead every vine famous person needs to go to the unemployment line now.,0
4411,@IheartsBrit thats Good I told U They Fired Us Right?,0
5478,My job fired me wow,0
1817,I am finding the new Big Boi album completely lackluster (with the exception of She Said OK). Am I missing something?,0
4704,Anyone hiring?! In need if a second job!! #gainesville #ga,1
395,I am Looking for work in fixing computers or security jobs.https://t.co/74RmVx61ty#needajob #ITjobs #hirefriday… https://t.co/JhapDUfj94,1
1524,I recently developed a new appreciation for Mondays. Hell yeah let’s go to WORK! #TGIM,0
4326,Anyone likes their job &amp; by any chance are hiring ?? Hook your girl up pls,1
1056,I am currently looming for a second job,1
717,Well just got fired from my job but its ok I can move forward while my former alcoholic boss is still dealing with highschool kids,0
3082,I lost my red indians hat too... I quit man,0
261,2 times today I get emailed about 2 jobs I applied for earlier this morning that were already filled. Unreal.,1
759,RT @dogfishbeer: Hey MD friends we just posted a Sales position you might be interested in!http://t.co/QZMPHJJuwi,0
256,Where at in beachwood? I just got hired out there too. @LoveMee_Lyn,0
5206,Still after a year officially still unemployed. I have survived on Unemployment a stock cash out selling my stuff on ebay. More to come.,0
924,Got a interview at Costco for a position there on Tuesday hope I get this one as well....just got hired at the school district,1
4115,I am willingly entering a field where you can be fired 9 months after receiving a lifetime achievement award. #goodlifechoices,0
5281,recently started to listen to v loud &amp; aggressive trap music in the shower and its rly improved my quality of life.,0
303,oh today i went to this gas station to apply and i asked the lady there if i could have an application and she just stared at me,1
5149,Wait why am I still working I should of been laid off 2 months ago...I guess manager likes me,0
1258,Here is your opportunity to make money from home free tour lets you in the back office http://t.co/V4Eh4ORSy5 #work #workathome,0
4727,My old job hired my best friend and then 3 days later fired me for using my cell phone. I found you a new employee then you fired me lol,0
1381,Unemployed Under-Employed Unhappily Employed? Find jobs &amp; career solutions on LinkedIn in JCD The Job Seeker &amp;... http://t.co/pwphSM48np,0
604,Someone hired Wanny as an analyst?? #Fox #Why #Stillhavingflashbacks #Bears,0
381,Looking to make an extra income? I am not looking for employees I am looking for motivated people that will work... http://t.co/wjoaiRxb,0
2398,Does anyone know anywhere in denton thats hiring? Help a sista move out!,1
1424,Unemployed Under-Employed Unhappily Employed? Find jobs &amp; career solutions on LinkedIn in JCD The Job Seeker &amp;... http://t.co/8NcC95KIrn,0
2735,i am trying to figure out where else i would apply to work and it is #tough gang.,1
1122,I am searching jobs in New Jersey on http://www.employmentladdercom,1
4315,Anyone know where is hiring?? #NeedAJob,1
2652,Hello my name is Senor Benjamin and I want to submit my resume for the position of manager. Skills: Preparing for massacre.,1
4639,does anyone work at a place thats hiring??,1
4166,Fear is Why Workers in Red States Vote Against Their Economic Self-Interest | The fear of being unemployed http://t.co/hFwXPnAnih,0
4772,I recently quit my job to bring in $5641 from my phone PRESS THE LINK INSIDE BIO to do it too https://t.co/BKYKp6wuxj,0
507,Just when I thought I was gonna get firedI got offered to work night shifts at my second job. So much good news today 👍😄,0
2630,Pastors Who Look at Porn: Should They Be Fired or Forced to Resign? Shocking Survey Results Sp... https://t.co/5yCrBPqMQO #tcot #p2 #news,0
1099,I am job searching for: Work at home jobs! http://t.co/4tgcXWg6JK — Walker Inklebarger (@Walker_marocliv.... http://t.co/QIM3fwjwaZ,1
1566,I didnt get fired &amp; I still hate my job. But I feel good cuz I had an awesome run this morning &amp; I have a date with a lovely lady tonight.,0
697,I am currently watching one of the worst bands Iv ever seen.  Theyre signed and headlining a tour. Someone is fired.,0
4832,Somebody might get laid off and you might get promoted,0
3451,Applied to a job a few days ago.then it was reposted as two separate positions.CAN YOU SEND ME A LETTER OF DECLINATION,1
3053,I almost quit my job yesterday but my manager called me and said dont quit just come in you have a child to think about,0
2882,I got to be in a leadership position today in ROTC.. And everything went well,0
253,Got hired today by just luck. Rewarding my week of sobriety by celebrating being employed again. http://t.co/Qlm6pfvEDV,0
2003,I recently started working a part-time job in addition to building my biz because I have big giving dreams and goals. #GetFit #Dream #Give,0
1037,I am resigning from cell tower work and would like to book some audio recording/hired gun drumming. Please let me... http://t.co/X1FH7ZVwKZ,1
5246,who job hiring? I had to quit chick-fil-a that aint my speed &amp; they was doing corny shit Im cool,1
4753,So tell me why...my coworker who was just fired last week came up to the job to talk to my supervisor while on her break,0
2263,Looking for a job? Energy Engineer/Resource Efficiency Manager(13005062) at Northrop Grumman (AK) http://t.co/0fdWzVCWvf #green #jobs,0
4289,anyone know of any jobs hiring in Lansing????,1
4047,Currently unemployed so if you know of anything Im taking suggestions,1
197,Today a customer came up to where I work &amp; called me stupid insulted my boss &amp; said racist slurs to my co-worker. Good times,0
5060,Got Laid off? Out of options? Think again We have your plan B... and it works like CRAZY.. http://t.co/eH9wccb4,0
1846,I am looking for GUEST BLOGGERS REALTORS and SMALL BUSINESS OWNERS.  Are you one of these?,0
4808,This week marked the 1 year anniversary of me being laid off. I still have not found a full time job. Some freelance work next week though.,1
1314,Statistically speaking if you employ me theres a 33% chance Im gonna quit and a 66% chance youre gonna fire me... hire me? :),1
5130,Heres the email Jack Dorsey sent all Twitter employees on Tuesday morning about 336 of them being laid off...,0
239,today my manager (who is 19) gave me (18) some tequila while we were working because I had never had any this job is bullshit Im so???,0
3107,Urgent - if you know of a marketing/communications job opening please let me know. Ive been laid off. Thank you.,1
5244,Any of yall niggas hiring ? Im quitting my job,1
2788,I got a certificate at work today my boss kno ion bullshit i work hard for mines,0
4058,I am an unemployed veteran simply looking for a chance.  I have an MBA and Med.  Anyone know of any opps. in Houston? #hr #jobs,1
4468,I quit my job whos hiring?,1
972,Interested in a #job in #Ohio 20226? This could be a great fit: https://t.co/eLTq7v9hOw #NowHiring #GetHired #Manufacturing #Hiring,0
3476,Unemployment is playing with my life 🙄 I just wanna job already 😩,1
5317,Video I wanted to release earlier this week is still battling against a content ID claim. So releasing another video this afternoon instead!,0
3559,New homie started working at Toyota younger than me.,0
3521,I kinda want to quit my job this week but then again watch me be unemployed for another 3 months like last time,0
1089,job searching is the worst. please give me money i am just trying to survive capitalism,1
4681,Now Im not gonna get hired.,1
3666,Looking for a grownup spot to unwind after a long week of work? Fuzion Fridays | $5 Buffet (6-9PM) | Ladies Free... http://t.co/2NdnvPmU,0
1854,Why Fiat Chrysler Automobiles Laid off 1300 Workers #FiatChryslerAutomobiles https://t.co/kHT8yPVV1X #FiatChryslerAutomobiles,0
1840,Searching for a new job. My expertise are HRM Admin Intelligence services and Tele Communications.,1
2298,Looking for a new job any places hiring ??,1
5463,Bad News Rob Ryan Was Fired. Good News Rob Ryan Is Unemployed And Living In New Orleans https://t.co/WkAUVVeQ0F https://t.co/J7lnwBi0sx,0
791,Currently unemployed and I am seeking a f/t permanent NYC or Long Island based marketing or event management position. Please respond to …,1
5072,RT @ninjyatlaw: just got laid off? youre not unemployed youre self-employed without compensation. WHAT IN THE ACTUAL FUCK.,0
1732,Day 8 of being unemployed: From laid off to unemployed http://t.co/ho30xFHS #jobsearch #blog #unemployed #jobs #nonprofit,1
5374,Laid off yesterday morning and got a temporary gig today? Still looking for a permanent position but its better than nothing.,1
335,I am searching for three special project interns to work on #OETC14 and more! | Public Assembly http://t.co/x1sdyWerHy #cbusinternships,0
1353,This #job might be a great fit for you: Part-Time Retail Sales Associate - https://t.co/Aw7fd3J8c4 #Retail #Mesquite TX #Hiring,0
2363,Whos hiring ????,1
5362,Its Been Some Firing People Being Arrested And Quitting At My Job Within The Last Week N Half,0
3972,Got hired yesterday (finally) and got another interview next Thursday :) #Options nigga OPTIONS !,1
5332,Moore Taylor in PHILADELPHIA PA hired a local Wedding DJ. Register FREE: http://t.co/bhpXFn1u #Wedding #BrideToBe #Brides #BridesMaid,0
2885,I got the secretary position and was reelected for the Public Relations committee for my sorority tonight ahhh Im doing the thing!!!,0
2435,Hey if were going to hire someone at least we hired a guy who played for the legend PAUL BEAR BRYANT!!! AMIRITE @Zooomingevy??,0
1172,30 people were laid off today at my place of employment. To say today wasnt tough is an understatement,0
3765,The most important job of the brain is to ensure our survival even under the most miserable conditions. Everything else is secondary BVDK M.D.,0
2376,Who hiring??,1
1140,I got laid off from work yesterday need a job asap near Indianapolis IN can start tomorrow need help #jobless #helpneeded,1
4810,I actually dont really care if I lose this job bc Im going to quit anyway but I dont want it on my record that I was fired,0
4576,Tired of being unemployed especially after searching for so long. All I need is an entry level job people! Come on!,1
1733,To all of my baseball fan family:I was laid off yesterday and am unemployed 1st time in 20 yrs. Send leads my way pls! @BaseballDo @TepidP,1
3704,Unemployment is zero fun when youre sick. Im officially a waste of life. Toss me in a dumpster,0
1242,A work-from-home opportunity that lets you go places. #WorkFromHome #smallbusiness #entrepreneurs #Canada http://t.co/Kvj3RG6NLz,0
3750,Morning is the time when everyone is jealous of unemployed.,0
1907,I was laid off and couldnt find a job then raised $1M to help people hunt jobs! A real story needs a great writer! You?,0
2503,Well I was scheduled for a test for that job position but the fire alarm went off.  Been sitting outside for 30mins and the FPD is here,1
3250,Salty i got fired today lol Ill have a job bye tomorrow tho aint tripping,1
2806,Looking for a new job in the new year? The best places to work in retail in 2016: https://t.co/3Sx5DggVPf,0
5373,This blog post is about me getting laid off yesterday: Unemployed http://t.co/r3TkMKxp #employment #arts #nonprofits #veg #vegan,0
2613,4th best in league with depleted roster &amp; still gets fired? https://t.co/vkVtZGSclq,0
350,I am looking to start or work with a charity that helps foster kids.,1
364,I am also looking for possible work in #branding #uidesign or studio openings.,1
1032,I keep not getting hired because I have no work experience. Well how in the hell do you expect me to get job experience if you dont hire me,1
5164,Please pray that God leads me to a full time job. I was laid off and am not receiving responses to my http://t.co/R7QDi3NFx7 #pray #prayer,1
4532,unemployed and its never felt better....why do I need to work ?,0
544,Well this week starts as me basically being fired as a driver which means big pay cut which means shit,0
2908,I dont count me losing my job as a lose... Just lets me know God got somethin for me on the way. I jz need to be positioned,0
1123,I am job searching for: Work at home jobs! http://t.co/4tgcXWg6JK — Walker Inklebarger (@Walker_marocliv.... http://t.co/7XD2J95J3X,1
4584,RT @womenbiznetwork: Ready Set Action! Searching for a New #Job http://t.co/AM52tdIj51 via @ItsJustTami #unemployed,1
4338,Anyone hiring? Im in desperate need of a job ... Just got kicked out with nothing.,1
3509,I am going to #tweet about my #unemployment until I find a #job I am from #LosAngeles #California living in #NorthCarolina,1
4337,Are there any jobs that are hiring???,1
5545,RT @clarissa: Im a UX designer/developer/strategist looking for a new position preferably to work remotely. Anyone hiring?,1
414,#Job #Richmond (USA-VA-Richmond) Catering Sales Manager: Job Description *The primary focus for this position ... http://t.co/7l1Kz5lFza,0
4703,Hey anyone know some place thats hiring? Im still in school but get out really early and am 18 sum1 hmu with a job offer,1
5512,Come out? Nah I got a bunch of work and thing around the apartment I gotta do. Have fun though! http://t.co/mGayAvAupW,0
1502,Today I work both job  kill me now!,0
800,I am looking for a sales job or sales trainer position in Dallas.  Multiple Presidents Club Winner #hireme #salesjobs #careercorner,1
4564,Now whos hiring?!?!,1
1245,the guys at amp.fm might be interested in working with the @GoMusicBubble crowd.  #pdxsw,0
3882,I had one job then they fired methen a drug dealer came an hired me,0
348,I am job searching for: Work at home jobs! http://t.co/4tgcXWg6JK — Walker Inklebarger (@Walker_marocliv.... http://t.co/eXIeEZM9cC,1
4830,Here are 4 critical lessons one person learned after getting laid off that you may be able to relate to: http://t.co/2Z9ndeoFB8 #careertips,0
4429,@OpieRadio &amp; @AnthonyCumia where mentioned on the Dan Patrick show today. In reference to the Atlanta radio hosts getting fired.,0
3745,Anyone have any need of an artist? Im broke broke broke still out of work and unemployment has yet to pay me a single dime. I need help.,1
3538,anyone know anywere hiring? I got laid off this week and gotta find another job asap before i lose my house,1
1074,I am looking for a position as a Talent Acquisition coordinator or Recruiter. Masters in HR new to field. In metro ATL area  #ReignyDayJobs,1
3516,Well currently unemployed job hunting.  It sucks . But on a good note Im alive.,1
4594,i have sent out 40 job applications and had 3 interviews…how am i still unemployed?,1
1760,Damn. They laid off 25 roughnecks this week... And theyre not done. Im probably getting unemployed too. 😕,0
4620,Unemployed people always say  I have a lot of Me Time. Busy people always apologize for the delay.,0
106,The Macys I got hired at is on a spree apply if you can,0
5246,who job hiring? I had to quit chick-fil-a that aint my speed &amp; they was doing corny shit Im cool,1
360,I am Looking for work in fixing #computers or #security #jobs.https://t.co/pI6e6gT3Y5 #resumes #careers https://t.co/ZqDXrZgyGO,1
3143,RT @jacobkleinman: Well i just got laid off at Mic. If you know of any positions in gaming tech media hit me up,1
1118,I am job searching for: Work at home jobs! http://t.co/4tgcXWg6JK — Walker Inklebarger (@Walker_marocliv.... http://t.co/Vdm4dkCNzU,1
3279,I was fired because Im trying to get hired somewhere else 😕,1
955,In my interview today the girl called my name then said what I applied for. I was like assembly wtf I applied for that position? lol,1
4555,Is any place hiring???,1
5396,So in 4 days I lost my job and my apartment. Ive got 19 days to find a place to stay and income. Im fucked.,1
2341,Anyone know of places newly hiring in Sierra Vista Tombstone Bisbee Fort Huachuca Benson or anywhere within 30 miles of here?,1
130,I just fired my ⛽️ man and hired a new one,0
3014,Im bout to start back working out Yall. My new job has a gym,0
4008,If youre unemployed you have a better chance of finding a full time job if you hahaha Im just kidding. #TeshTips,0
2325,Ive been unemployed now for about 5 days...I am not about this life #ineedanotherjob,1
608,Any MTZ parents have reaction? Judges ruling ends process of laying off teachers based solely on when hired http://t.co/rmz7vPMraS,0
118,Today I had to do math for work. MATH!!!! They hired the wrong person...,0
1171,I got laid off today.  Im ready to persue makeup.  Chicago beauties...any job leads?,1
3380,omghired/firedno,0
3477,Now I have 7 or 8 thousand n student loans with no job&amp; nobody will hire me bc I speak the truth&amp; so many people do dirt behind the scenes.,1
4070,Boss announced that were looking for another tech support worker. I immediately assume I am getting fired.,0
3063,So I quit my job today. Does anybody know if Office Depot is looking for animators?,1
4789,I just got my 3rd warning two more &amp; I get fired pretty pumped up about the amazing cool job that I love,0
3727,I am back on the Job Market! Is anyone looking for a Test or Technical Manager? https://t.co/gCBJh8nyQD #gamedev #gamejobs #unemployment,1
2374,Who is hiring???,1
3822,@MaxGraham @Audien Cant help but make connection to a story I posted last year large group of their developers were laid off.,0
115,Lost my job yesterday. Jus got hired again LOLLL,0
2365,Does anyone know any places hiring .....,1
140,Almost broke a fax machine AND copy machine today... How am I ever gonna get hired after I graduate,0
5244,Any of yall niggas hiring ? Im quitting my job,1
1037,I am resigning from cell tower work and would like to book some audio recording/hired gun drumming. Please let me... http://t.co/X1FH7ZVwKZ,1
1385,Unemployed? Underemployed? Looking for a new opportunity in Huron? http://t.co/EAH8A6gwDG,0
5100,I really wanna quit my job &amp; be unemployed. Thats how much I hate it &amp; am tired of waiting for a new one,1
4146,# unemployed 😔,0
4697,Anyone hiring? Im trying to quit my job doing bodywork....,1
1209,how uu think i got uu somebody got laid off,0
4765,I started at my new job without quitting my 1st job. Who wants to dig me out of this one?,0
2215,Today marks a week that I have been unemployed.  I will admit that it is very scary.  I have applied at... http://t.co/Odp4ei4bwd,1
4863,Might be wise to explore another income stream......because eyan le get laid off any fuckn time.,1
1762,Dude. Being laid off is so awesome...... Someone get me a good construction job,1
3445,this chick who took the position i applie to stopped showing up so my chances are high.,1
1100,I am job searching for: Work at home jobs! http://t.co/4tgcXWg6JK — Walker Inklebarger (@Walker_marocliv... http://t.co/WZfdKpUsEG,1
3006,I really would consider moving if I hadnt recently started working.,0
1400,Unemployed Under-Employed Unhappily Employed? Find #jobs &amp; career solutions on #LinkedIn in the Job Seeker &amp;... http://t.co/uUqhBrEH9n,0
4349,Microsoft posted a job you might be interested in. Sr Solution Spec SURFC ADR - SMSG - Beijing - Beijing City China CN via LinkedIn.,0
3534,The vicious cycle of unemployment is 100% caused by the fact that I have never had 3 professional references for a job application.,1
1203,Today I was laid off from my ultrasound job due to cutbacks. But its all good bc Ill be at the @jakeowen concert next Thursday!!,0
1496,I killed it today at work Im proud of myself everyone is telling me not to leave that Im a badass a worker makes me just wanna stay.,0
4718,I lost my job 3 times — here are 5 tips for moving on after getting fired — via @Inc https://t.co/ayjqcVCkbz https://t.co/GHZMgGlFOA,0
3402,An earlier recruiter had me filling out an I-9 form and theres been silence for 3 weeks now on that position. No new info when I ask.,1
5157,If only been laid off for 2 days are i have a potential job lined up. I must be lucky or something.,1
4568,Anyone know where theyre hiring ?? Lmk,1
1793,My dm is not working. @ me if you need me,0
1025,Man I am not a morning person at all and I where I just got hired I have like four shifts at 7 and 8AM! I asked for day shifts tf!,0
495,I worked at Cocos for 2 weeks after that schlepping pie also. But then got fired for taking off a day that I had requested off when hired,0
4711,Im actually rooting for the lions to lose today so dumbass Schwartz can lose his job. If he doesnt get fired Im boycotting them next year,0
61,Was just laid off due to the company closing.  Ive got 4.5 years of assisting experience. @taylorswift13 need an assistant? Insert panic.😩,1
1345,Interested in a #job near #Mesquite TX? This could be a great fit: https://t.co/PmMc4C3Jrz #Retail #Hiring #CareerArc,0
100,I may get hired back at Apple again spoke to my buddy who is a store leader over a store and hes considering hiring me back again,1
5177,I am no longer reporting on education @indystar - laid off Friday. 110% unexpected. Still bent on journalism/covering ed so plz RT,1
1128,Yes I am sending resumes and filing out job applications on Christmas.,1
4775,This dude earlier this week said I should quit my job and go back to making tacos.,0
2337,Anyone know of anyplace hiring?¿,1
2483,Interested in a #job in #Charlotte North Carolina? This could be a great fit: https://t.co/gmiUfbTT3y #NowHiring #GetHired #Engineering,0
2373,Anyone hiring...more than $14,1
2310,And I remember now why I shut down and didnt do job applications for a while. It makes me very aware of how long I have been unemployed,1
3773,You cant just be known as your job or for your job you have to have transferrable skills that you can use elsewhere. -@amandamogul,0
2312,Hubby turns 50 tomorrow.We had planned to go out to dinner but then he lost his job so instead I will make him some peanut butter cookies.still waiting for a decision from unemployment,0
1153,Got approved for a new car today then got told I was going to be laid off just got a call saying since someone quit I get to stay. 🤷🏽‍♀️,0
