id,text,class
1707,Saw a woman &amp; daughter asking for help outside w/a sign saying she was laid off. I gave her all my cash. Then I realized Im unemployed too!,0
1259,I might be interested in working at best buy.,1
993,Sous Chef opportunities are everywhere. EHS is here to help you be picky. Details here: https://t.co/zgqbL9N1W9 #GetHiredNow #EHSGetHired,0
517,Welp it happened i have 4 job interviews on the table after 2 weeks of getting fired.  Wow thats amazing.,1
2979,just started my new job and some bitch i work with decided to tell me that my bf fucked her in HS? Like ok? Do you want a cookie?,0
4921,The new coworker that was late for their interview and paperwork then didnt have 2 forms of ID is making more than I am. Same position.,0
2378,Is anywhere hiring at all ??,1
5159,I was just laid off and am looking for some babysitting dog sitting personal assistant or personal organizer work.,1
764,@renewaldb I might be interested.  Is there a job posting where I can see position description?,1
1583,Looking for a new career in 2013 or to enhance the job youve already got? Win free coaching w/ @MaggieMistal http://t.co/somMEU4j,0
4825,Somebody might get laid off  and you might get promoted .,0
356,I am job searching for: Work at home jobs! http://t.co/4tgcXWg6JK — Walker Inklebarger (@Walker_marocliv.... http://t.co/wResUHuArJ,1
4698,Does anyone know whos hiring ?? #Job Hunting,1
2606,O/H: you cant get fired for looking for a new job #HR #recruiting #jobsearch #jobseeker,1
5176,My project got killed this weekend and in the process I was laid off meaning that I am available for new opportunities lets talk...,1
5036,@Jeff_Erickson HAHAH surprisingly no. Im being laid off on the 15th so Im just looking at different career/job options,1
3171,Hi guys. I officially got laid off today. Send beer. Thanks. Also please hire me.,1
4582,Applying for jobs like crazy!! Need to find work soon cause being unemployed sucks. I am going stir crazy and its only been a week!,1
2346,Does anyone know of any place hiring? http://t.co/4ggPlrcnNp #reddit,1
484,I hate this new girl at my job this broad is gonna get herself fired,0
662,Your Job Search Might Get You Fired http://t.co/y1DKUHwbzx #fearofcareerchange #jobsearch #gettingfired #jobsearch,0
32,After 4 months of unemployment (being laid off sucks) I was going to celebrate 1 week of my new job by buying myself a ticket to see @OldDominion @TheBigEFair since I haven’t see them since last September at Foxwoods. Just went to the website and the show is sold out!  :( 😭,0
2584,Walmart worker fired for kicking out gay couple: A Walmart janitor is looking for a new job after he was fir... http://t.co/9lsDhexBQl,0
1581,Looking for a raise or a higher offer?  5 tips to negotiate #salary https://t.co/583qwXAfWW #jobs,0
1649,But people ask me I cant believe you quit your job to find a new one lol you know how hard it is to job search when you work office hours,1
4142,Unemployed! Looking for a job in Miami as a Substance Abuse Counselor...,1
1306,If you are thinking of #quitting here are 5 #nursing jobs at home you can try. https://t.co/DAFHLwiOSM #athomenurse https://t.co/PVhr7iwjSP,0
5220,Bad news - I am once again unemployed. My contract as a temp employee ended a little over an hour ago,0
2334,anyones job hiring?? seriously done w crappy Main Event,1
5131,Somebody might get laid off and you might get promoted 😅,0
1533,Im not fired btw but I have a job interview next week becauSe this guy is FUCKING crazy lmao,1
4098,Soo.. Been late to work by a few hours for the past 4 days.. I must be doing something right because I have yet to be written up/fired,0
5166,I was just laid off.If you need an accessibility analyst or perhaps a front-end developer let me know.,1
3892,Not gonna lie if I get hired at this new job Im gonna miss my coworkers at McDonalds well some of them.,1
2058,Looking to hire or be hired in 2016? Brush up on these 4 talent acquisition #trends @B2Community https://t.co/0bY2T31IZp,0
1700,Id love to get laid off (unemployment!),0
3297,One of the cooler coworkers got rehired. I am happy,0
2647,Coal-Fired Past or Clean Energy Future? Pueblo Looks for a New Economic Leg Up: Colorado Public Radio The Colorado city of Pueblo is having a very public debate about the merits of coal and #renewable_energy. Xcel Energy is proposing to close the… https://t.co/HumX60OynJ,0
58,With recently being laid off I now have the opportunity to go to London for 14 months!,0
355,I am looking for work full or part-time(fly-in) work as a data acquisition/assistant engineer.  Sports Cars or Open-wheel. Particularly int…,1
3265,Got fired for two hours then rehired. Wtff #NOBITCH I need to start looking for a new job,1
4797,Last week: I was looking for other jobs. This week: got a raise got 2 interviews as well.,1
1932,@atTivirii_14: Well wishes to my opposition.,0
1572,Looking for a job a new career or more job satisfaction? 51 Career and Job Affirmations. http://t.co/9G1ytHYqpw,0
1511,Recently started biking to work and I can confidently say that minivans are the moose of the road (re: I hit a minivan with my bike).,0
3727,I am back on the Job Market! Is anyone looking for a Test or Technical Manager? https://t.co/gCBJh8nyQD #gamedev #gamejobs #unemployment,1
3287,Monster sent me a list of 5 ways to know if youre in danger of being fired. I need a list of 5 was to know youre about to be hired.,1
3212,I am visiting my graduate school #syracuseuniversity after 16 years. This is the first job I had in #usa at #dunkindonuts and I was fired in two days in the year 2000. Lol @ Syracuse University,0
358,I am badly searching for a job. I was working for 1.5 yrs but lost it. Plea~ https://t.co/BoFNeiwnjA #pray #prayer https://t.co/Ot9tssGocS,1
4556,Anyone know of any places that are hiring right now??,1
1289,Am currently the people greeter at work..,0
1128,Yes I am sending resumes and filing out job applications on Christmas.,1
4548,The Michigan unemployment office has been the most difficult group of people to try and work with. I have received no help whatsoever.,1
359,I am job searching for: Work at home jobs! http://t.co/4tgcXWg6JK — Walker Inklebarger (@Walker_marocliv)... http://t.co/yN2e891rUT,1
2903,Same day call interview and Hire! Thank You Jesus! I will officially have a teaching position this upcoming school year!,0
4584,RT @womenbiznetwork: Ready Set Action! Searching for a New #Job http://t.co/AM52tdIj51 via @ItsJustTami #unemployed,1
1722,2018- The year that tested my fucking Faith more than any other year.... Unemployed for the first 6 months.... Laid off after 3 months of working again.... Still looking for a jobStill in love with my wifeStill supporting my family.... #Dontgetdiscouraged,1
1595,Looking for a job? Energy Engineer/Resource Efficiency Manager 4(13005096) at Northrop Grumman (SD) http://t.co/hQryVU5l8p #green #jobs,0
3564,My job search as recently just been non existent. I was dedicated for a good month,1
1822,Searching for a new job is not easy...,1
3370,got fired because my foot is broken. where is hiring?,1
3508,Im not a bum for being unemployed right now my last job put me in danger. I have put in 23 applications and sent out my résumé.,1
4922,Got offered assistant manager position at Dollar Tree for 9.50/hr. However I still work as a waitress and make good money. What to do?,1
4445,today i got yelled at over the phone by someone i presume isnt quite alright in the head. yay customer service jobs.,0
2252,RT @JPCVServices: Looking for a new job in 2016? If so are unemployed seeking internal promotion or looking to move company?,0
1120,I am job searching for: Work at home jobs! http://t.co/4tgcXWg6JK — Walker Inklebarger (@Walker_marocliv... http://t.co/BySThx8jDz,1
1730,@BarackObama 15 year teacher assistant laid off over a year unemployment funds almost gone. Cant find work. Now what? I fear being homeless,1
5545,RT @clarissa: Im a UX designer/developer/strategist looking for a new position preferably to work remotely. Anyone hiring?,1
2083,Looking for a new #career in architecture?  Get hired here by doing this one thing! http://t.co/O6ccG3AlV7,0
1703,Weird 5% unemployment but I see many homeless in NYC many ppl I know got laid off in last 2 wks &amp; the employed are working more for less,0
1776,Im currently lying in bed not wanting to get out and start my morning ha you feel me,0
1064,i HAVE BOTH INTERVIEW TOMORROW I AM NOT TRY TO BE FUNNY I AM NOT TELLING WHERE UNTIL I GET THE JOB,1
641,Just got hired to clean another store at water side shops named Panerai boutique .. Does anyone know what kind store is that ?,0
919,Got hired  t best buy mobile last week &amp; today I have an interview with FedEx for a customer service rep position! #needthat-,1
4588,I have been unemployed for the past 5 months. Today there is a solid chance (I hope) that I might be offered a job. Should I negotiate sala…,1
676,I am currently done with both tee tee and crystal...yall both fired.,0
28,Recently laid off? Download my complimentary workbook to move from panic to purpose! https://t.co/6YlKiAjjTv,0
2962,So I recently got this SNS  nail polish its great for the type of work I do and I found a new nail salon,0
1122,I am searching jobs in New Jersey on http://www.employmentladdercom,1
2575,Has attacking George W. Bush backfired big time for Donald Trump? https://t.co/QPllag2I5T,0
806,Currently researching HR/Labor positions in the Ocean County NJ area however am willing to travel or relocate. Have 2.8 years experience…,1
2792,So I got nominated for this thing at work and im like ???? and today the store manager was talking about how well I did and im like ????????,0
47,After being laid off in 2009 I walked into a Manpower office.  Today I have worked in that office staffing for over 5 years #myworkmystory,0
2143,Searching for #work in Warsaw IN? Send your #resume to Ivy Tech Community College. http://t.co/LWP93OYNuc #gethired,0
1853,@Adam_Ganz I have started the search for a new position. Are you in the Seattle area?,1
1947,Recently just had a conversation with guys at my job .. They are so crappy,0
38,Suuurrrrrree I couldnt get laid off 3 weeks ago BEFORE I bought my new car. #unemployed #hireme #job #FML,0
386,I am seeking a female (preferably a WOC) website/graphic designer to work with for my business need quotes to incorporate into fundraising.,0
4325,Who has a dope job and is hiring????,1
5182,First day of being unemployed and it feels sooo bad. I needa be on the go,0
3636,Looking for a #Nurse #Practitioner - Palliative Care - Northern and Southern CA Positions #jobs https://t.co/QKlQL1s6eb,0
2338,Anyone looking to hire a smart educated talented writer/producer/designer/photographer?  What Im saying is I am awesome.,1
3496,Being an NBA team president would have to classify as one of the greatest jobs in the world @cavsdan I am unemployed lets get it done,1
5112,I am looking for the following:2 to 3 Associates to join the Private Equity and M&amp;A group.  I am seeking individuals with a wide range of…,0
2873,So Ive been unemployed for like 3 hours and I need to work.,1
625,Too Young to Retire Too Old to Get Hired?  http://t.co/V7z8EdIAgX  http://t.co/lE5pbEarfx,0
5129,Im trying to quit mine bt I need to find another one first..,1
3604,I recently submitted my resume to Sony... But they canceled the interview.,1
5536,Here is a wonderful opportunity for a full-time Administrative position in Banking and Finance! #jobs #greenemployers http://t.co/16BeeVGQmt,0
1044,Literally not applying to jobs I know I will get hired for. #aimhigh,1
5233,Any restaurants hiring in buffalo? I need to quit my job like today,1
4583,If I dont find a job soon I will die from boredom... #unemployed,1
5075,So the guy I am covering/trading shifts with for today quit. Should I go in and not get tomorrow off or take the day off like I should have,0
4322,Anybody’s job hiring????,1
2313,Well has of yesterday I am unemployed (quit my job). Yes had enough my body and health can not take it anymore. Start looking tomorrow.,1
1716,Photo: Today I was laid off #layoff #unemployed :-( I am very sad but optimistic anyway…. One door slaps me... http://t.co/RMgG27F6vd,0
1108,I am job searching for: Work at home jobs! http://t.co/4tgcXWg6JK — Walker Inklebarger (@Walker_marocliv... http://t.co/SQmarqg5CO,1
4326,Anyone likes their job &amp; by any chance are hiring ?? Hook your girl up pls,1
3759,NOW I OWE 40 PUSH UPS.,0
2358,Anyone know of places hiring?!,1
322,I am searching to work for a company/department that develops clean technology. https://t.co/EFVYYkaxPu,1
2101,Searching for #work in Washington DC? Send your #resume to Ame Management Group. http://t.co/SmgXPWvwsp #gethired,0
885,The frustration of non-communication in the job hunt #unemployed http://t.co/yIQxX47t8w,1
2868,My hands dont like to be unemployed they like to work.,0
2740,I am looking at new ways to network so get at  me if you are a recording artist #hiphop #music #rap,0
4614,Unemployed life will be over by 27th January  i am sad and happy at the same time,0
1639,Relocated to Tucson AZ. Well not quite done yet. Relocating. Now Im searching in earnest for a Remote Front-End Developer position.,1
1095,I am job searching for: Work at home jobs! http://t.co/4tgcXWg6JK — Walker Inklebarger (@Walker_marocliv.... http://t.co/7lxxMP4mdn,1
818,$ERBB quit stacking the ask let this baby run.,0
4808,This week marked the 1 year anniversary of me being laid off. I still have not found a full time job. Some freelance work next week though.,1
4942,Yo anyone hiring college students? Somebody help me man I really want to quit the one I got now but I need money.,1
920,today I got offered an Assistant Manager position at Finish Line! :)))))))))),0
1616,Searching for #work in Bellevue WA? Send your #resume to Equity Residential. http://t.co/WnTuERVGv0 #gethired,0
659,Do you think getting fired is the worst thing that could happen to you? Heres an article of people who made it big and owe their success...,0
5273,Dont submit then quit. Apply for jobs like Java developer at Cognizant then look for people you might know at the company. You might be able to reach out to HR directly. Ready to apply? Check out the link in our bio.,0
3511,Its 5 am time to start my daily job search and certify for my unemployment benefits. Good look in your job search and interviews! Peace.,1
3569,I recently challenged myself to do something I had never done before. When was the last time you stepped out of your comfort zone?,0
1822,Searching for a new job is not easy...,1
1056,I am currently looming for a second job,1
3887,I applied to 7 Subways today. I better get fucking hired.,1
3565,Shift is almost over also I have the chance of possibly getting a new shift hmm wondering should I do it or not. Im think no my boss sucks,0
1040,I am a Polysomnographic Tech that cannot get hired ugh this shit sucks.,1
4488,I tried to quit my job today and ended up with 2 jobs this summer???,0
4575,RT @mmangen: Ready Set Action! Searching for a New #Job http://t.co/wljctC3w2O via @ItsJustTami #unemployed,1
1078,(IN) I quit my advertising job because i lacked the passion for it. I am searching for a job that i am passionate about but im running out…,1
4573,I still have not found a full time job. I havent been unemployed this long in my life ever. http://t.co/gq9jps2yiK,1
1904,@DirtMoverMan @Pleasehireme017 An uncle of mine was laid off by Chrysler a while back &amp; has had problems finding work since then.,0
4805,This week: I had to take Atlas to the Doggy ER for some nasty shit you dont want to hear about. But I also landed another kick ass job!,0
5270,RT @RunningCrazy1: Quit blaming each other and fix the fucking problem!-what I just said in this meeting.-oops-anyone hiring?,1
41,Bad news: laid off from my recreation position. Good news: I was offered another job at the same building. Less hours but its a job.,0
3604,I recently submitted my resume to Sony... But they canceled the interview.,1
4530,Im not unemployed Im living in post-work america,0
3240,Gave my supervisor a evaluation today also I got fired today,0
1097,I am Looking for work in fixing computers or security jobs.https://t.co/jvptE989VG#fintech #bitcoin #rimbit #crypto,1
3151,Some old friends at a CT agency were just laid off. Give me a shout if you need design talent.,0
2447,#VinceMacmahon defending the person that HIRED the person that beat him up?! Yall stupid! #wwe,0
3195,We need @SpeakerBoehner fired as speaker. He doesnt represent the Republican Party.  If he does then I need to find a new home. #SellOut,0
5122,I also had an internship and quit it since the time we talked. Im looking  for a new one as we speak.,1
1949,Recently started job searching again...,1
2536,Looking for a position that offers plenty of perks &amp; opportunities for career growth? USAA is hiring an Auto... https://t.co/cHkwQRc8Mk,0
2934,I went to a job interview and got offered a supervisor position. Look at God,1
791,Currently unemployed and I am seeking a f/t permanent NYC or Long Island based marketing or event management position. Please respond to …,1
2148,Looking for a #NewJob? #CareerCast has all your #Job and #Career needs at your fingertips. https://t.co/IgteR0FQRs #CareerAdvice #GetHired,0
5250,Salary or equity? This website wants to help you understand startup job offers https://t.co/ujPfXPnzG6,0
5034,#jobs #jobsearch #England #BEEN LAID OFF/MADE REDUNDANT? SEEKING A ROLE IN SALES/CUSTOMER SERVICE?:         ... https://t.co/t21L9ujzIb,0
1957,I been at my new job for less than 2 months  one of the girls I work with paid for everything I did this weekend . A blessing ok,0
5516,I am job searching for: Work at home jobs! http://t.co/4tgcXWg6JK — Walker Inklebarger (@Walker_marocliv... http://t.co/SSfAycUZJ8,1
4958,Well I just quit my job... So anyone know anywhere hiring?,1
404,#Job #NewJersey Client Services Director – Account Management CPG: NJ-Newark Full Time Permanent Position for... http://t.co/2Z2apfYPYF,0
1596,looking for a new job does anyone know a place thats hiring???,1
674,Currently sitting at the lunch room table considering what my next job should be. Not trying to get fired on a technicality no siree !!,1
405,#Job #NewJersey Community Director Bergen County Area: NJ-Pine Brook Position Purpose This position will impl... http://t.co/EbNuCzFaeP,0
1870,A good friend was laid off today because my agency decided to outsource his line of work. He gave me… http://t.co/mAKJfKBy0U,0
3476,Unemployment is playing with my life 🙄 I just wanna job already 😩,1
849,@EVSTGHXST feel it man. Im currently unemployed as of today as well. Shit is rough. Just gotta keep on keeping on.,0
1798,I am currently watching the wayan Bros.,0
4558,Needing a second job (preferably retail) anybody hiring?,1
3245,Ahh first time i get fired..after like 20 jobs of never getting fired i did today lol and somehow i think its funny lol ohh well,0
1024,The woman who hired me has not called in 5 days and is not answering when I call. I called like 7 times throughout the day yesterday.,0
5428,Here’s how to answer #interview questions when you’ve been fired. https://t.co/5Ar4DbIZID https://t.co/0xKvwSIbMi,0
1726,Crazy tho. I got laid off and now TWO jobs want me. Im spechul,1
5357,Amazon posted a job you might be interested in. Technical Account Manager - Beijing City China CN via LinkedIn http://t.co/34zWPHtZuB,0
1942,New guy started working at my job and is already tryna get my number but little does he know..,0
1520,I recently wondered aloud (which was the mistake) what I should do with my newly found free time. I was then of course buried in work.,0
5097,Does your company/school need a trainer? I am currently looking for a training position in the greater Philadelphia area. Im quite decent,1
5442,Looking for new workout playlists to get you in the zone? Check out Team Optimum on Spotify to get you fired up! #ONInsiderContest https://t.co/8kU8Ti6tpL,0
3470,Eww. The Job IS workplace Survivor and it looks like a horrible TV show. Unemployment is not entertainment.,1
1588,Looking for a FULL time job or looking to stay competitive in a tough job market? FREE Career workshop http://t.co/aGmP7fhpy1,0
1268,You might work for a conversation agency...if you dig through the trash to recycle something.,0
1073,I am searching for a job in helping clean businesses offices or home @lexijablon @lrotts http://t.co/Em2sdu6pK5,1
3883,So I had a job interview today and sadly I wont know if Im hired for 1-3 weeks. Then my second interview is pushed off till end of week.,1
438,Kassidy I think Im gonna quit track. I think Im pregnant.-Claire RaffinIts funny because its Claire,0
1639,Relocated to Tucson AZ. Well not quite done yet. Relocating. Now Im searching in earnest for a Remote Front-End Developer position.,1
4778,Earlier this week: Breaking Bad Star Aaron Paul -- I Need a Job BITCH! http://t.co/YUkQi9hbLV,0
4701,anyone know of places that are hiring? ya girl needs a job,1
1099,I am job searching for: Work at home jobs! http://t.co/4tgcXWg6JK — Walker Inklebarger (@Walker_marocliv.... http://t.co/QIM3fwjwaZ,1
4574,I too am unemployed looking for a #teaching job https://t.co/Rl6teoUf09,1
2051,Looking for a New Job? Interested in a Career Change? #CareerCast Has Everything You Need and More! - https://t.co/AooltyNlmL #GetHired,0
3457,I also applied for a job with apple last night.. Not the same position but HOLY CRAP PICK ME,1
2334,anyones job hiring?? seriously done w crappy Main Event,1
3522,Now actively seeking employment. I hate job hunting! But such are the times in todays job climate.,1
2667,#Bloomington #Job ASM Service &amp; Operations - Mall of America #135: MN-Bloomington Job Description : Position... https://t.co/J5hgGBr9Rs,0
651,Heres what to say when a hiring manager asks Have you ever been fired? https://t.co/Yk3Br6sekH https://t.co/mpNaQbfCVz,0
5378,Currently looking for a Director of Basketball Operations or Video Coordinator job within College Basketball. If anyone has any information on colleges/universities looking for one of these positions please let me know.,0
4317,I need another job. Anyone hiring???,1
2337,Anyone know of anyplace hiring?¿,1
304,Need a new job WHO HIRING ???,1
3178,need to find a job lmao lets see how long it takes before I am fired.,1
4622,Work is fuckin bs right now anyone know of any retail places that are hiring???,1
2415,Bookish? Outdoorsman former Flint cop hired as Muskegon Countys new top librarian http://t.co/N6tHl1p1G0,0
3232,need to find a way to get a certain someone fired from work this will be a challenge but i will find a way.,0
2716,#Job #KansasCity Bakery Clerk- Shawnee Price Chopper: Shawnee This position is responsible for preparing and p... http://t.co/AJ0IFOBalC,0
4026,Am now currently unemployed. Is there any place hiring for roughly four weeks?,1
4578,For months I have been unemployed and looking for a job. Today it is comforting to prepare for a new job (cont) http://t.co/GkR1zPJtMn,0
2653,Hey you will you come up here for a minute? Lol at one of the most uncomfortable positions I have ever been in😬 https://t.co/PpXTEoVIO7,0
2399,ANYONE WANT AN ID THAT DOESNT EXPIRE TILL 2017?? BOYS ONLY $$,0
1146,I got laid off today and I angrily played need for speed most wanted for 2 hours to cool off,0
1984,Man Im glad time breeze by at my new job.,0
533,Also man dude I dont know what to put for reason for leaving. I was fired for being tardy too many times.,1
5151,Just got laid off and am pursuing potential career openings in the IT industry. If you know of any please let me... http://t.co/24FLT5UsIA,1
3190,The manager made it clear she doesnt need/want me there after looking at a new job &amp; gave me the option quit or be fired. Why not be nc/ns?,1
169,I worked from home today........Ok ok I lied. I worked from the mall 󾌱󾌱󾌱 I worked so hard I got home and pass out. 󾠣󾠣󾠣,0
1132,I got laid off my job today. If anyone knows someone looking for a social/digital marketer with a can do attitude in the LA area hit me up.,1
3132,Being laid off has brought more blessings than I can count but this job search is close to breaking me. Rise and grind!,1
1634,This job search is wearing me out. Im about ready to give up but to do that apparently I need 3+ years of quitting experience.,1
5059,Is There Life After Being Laid Off? via @amazonkindle #newprice #careers http://t.co/wjLUzTWV,0
4556,Anyone know of any places that are hiring right now??,1
1465,TODAY I SAW RUPERT GRINT OUTSIDE WORK STOPPED HIM SAID HEY &amp; THEN NEVERMIND AND WALKED AWAY FUCK,0
4205,@HeartCapricorn: #Capricorn needs to work on not getting so quickly turned off &amp; irritated. True,0
3821,@CarlyFiorina You totally lie about live baby video. I mean blatantly lied.  That may be how u got ur job at HP and laid off 30000 Americans,0
3615,Looking for a job or an internship? Americans for Prosperity is hiring! Apply today! #job https://t.co/fxLuU3OFNU,0
4888,Since i am unemployed now i am becoming the family taxi and errand runner :(,0
303,oh today i went to this gas station to apply and i asked the lady there if i could have an application and she just stared at me,1
4152,@AdamtheBullFAN I knew I could count on you brother. Farmer rightly should be on the hot seat if not unemployed soon.,0
1690,So the break room at work hat a TV with Netflix. Means a co worker put on the office 5 min later a bitch comes up and puts on riverdale with out asking...needless to say I quit my job today,0
2381,Anyone know a good website for resumes or someone know how to edit one??,1
3626,Looking for a #career change? Dealertrack is #hiring a Director of Inside Sales. #Jobs https://t.co/kV9L4dHCFN #job,0
4308,Anyone know of places hiring??? I want a 2nd job! Im money hungry.,1
4554,OK #Nashville - I have a 19 year old with brains and muscles (my son) who needs a job. Anyone hiring or know of an opportunity?,1
