id,text,class
4845,Well Im the dopeman yeah boy wear corduroy⁰Money up to here but unemployed,0
8345,Last week this time I was down and out #jobless ... In the matter of days I was hired on the spot at one job,0
3804,I forgot to put on deodorant yesterday AND I witnessed my dog poop out a stuffed animals eyeball. #Unemployment,0
1085,Searching For a LinkedIn Marketing Superstar! - oDesk: I am seeking an experience LinkedIn ... http://t.co/tK73BjLJ6H #sales #mktg #jobs,1
7721,Finding A New Calling After Being Laid Off At 50 http://t.co/qFc0jP1byQ,0
80,I got hired as a camp counselor for short term teaching chorus and adventure time at Camp Waldemar!!!! Today is good. God is good.,0
5910,My new Job site has 4 floorsa Elevator and a pool https://t.co/D0W7wLa1l6,0
783,Job Opportunity: Gateway Center has an open position for a full-time Event Manager. If interested please send... https://t.co/1EDCcZXX8F,1
1324,Job Opportunity -  Java/Scala Equity Derivatives Developer in New York NY https://t.co/3wPhydpT3M #jobs #java #scala,1
2243,@ProfKFH all Im unemployed. I was fired 2 weeks ago. So be blessed you have one. :),0
9562,Anyone know of places hiring serving/hosting positions!?,0
157,When I told my boss I was quitting he was like wow I was the one that hired you yup and youre the one that put me in the back today 🙄,0
7687,Im confused as to why I received money from the company I got laid off from and I cannot check pay stubs until tomorrow. 🤔,0
2148,Searching for #work in Metuchen NJ? Send your #resume to Franco Manufacturing Co. Inc.. http://t.co/8XbC1bsFqC #gethired,1
1585,Looking for a job a new career or more job satisfaction? 51 #Career &amp; #Job Affirmations. https://t.co/8hR97kCZPj#hr,1
7563,this whole job search/being unemployed thing is not really for me any more. i would like it to over with now.,0
411,#Job #PaloAlto Hardware Development Engineer II - REQ260: Cupertino Multiple positions available company: a2z ... http://t.co/Y2o5xobBr0,1
6106,@lartist … you’re hired!,0
846,#jobs #unemployed Traveling PICU RN Registered Nurse: Palm Springs CA - Seeking PICU ... http://t.co/6dQlNgBqdn http://t.co/1Jnuthnk56,0
4040,Searching for #work in Iowa City IA? Send your #resume to Department of Veterans Affairs. http://t.co/za2MoXL6sa #gethired,1
8851,I have a permit and I literally got hired at a job last week you are not in my life anymore you know nothing https://t.co/XWNJJXJZAr,0
6225,IBM posted a job you might be interested in. Business Analyst - Shanghai City China CN... http://t.co/o6RaS5paFY http://t.co/Pk22NiRRUF,1
9524,Anyone hiring for a daily self-carer? Full-time position please. Let me know.,0
7092,First night at my new job was so much fun... Yaaaay Michelles not unemployed anymore!!!!😝,0
8862,boss calls me at 1pm to discuss work next week and im still in bed...he fired me #dontworryimrehired #theinternship,0
7157,I did it with $500 of my own money and was unemployed. This week I invoiced over $1000 for new projects related to downtown.,0
6202,Two years ago this week I started my career at WSET ABC-13 News. Earlier this week I resigned my position at WSET... http://t.co/o8kOxdzgAW,0
1220,Great Place to Work Institute posted a job you might be interested in. Temporary Financial Controller  - San Franc… http://t.co/YTb5NWVa4p,1
8607,Unemployed and need a job?  https://t.co/MVjCqw1zpz https://t.co/nyo2fQWeI5,1
9518,Anyone of any places that are hiring for full time positions??,0
1418,Need to Make a Career Move?  Need a New Job?  Unemployed? @leezabyers Can Help: http://t.co/qWP6WC1jfq,1
8561,My board broke today and I lost my job.. Life is going just great right now,0
2692,#CareerArc #internship #Job alert: Marketing/Sales Internship Position | Move. | #Savannah GA http://t.co/PWk8mAXtT8 #Jobs #Hiring,1
3720,Looking for a freelance position? - Check out #jobsboard with 50822+ jobs includings freelance work - http://t.co/bUfvdLRs9v,1
6964,I just got fired oops I meab I quit I mean I dropped outta school just to be the shit,0
6196,Starting work at my new #library today helping @ circ. Training for my new position starts Monday at reference #excited #nervous #changes,0
989,We can help you get that Direct-Hire opportunity..See How! http://t.co/zOkpkQfBMo #services #GetHired #HireMe,1
2584,Looking for a new career in the new year? Join our team! Santa Fe County is hiring for a variety of positions.... https://t.co/WUhekR88xM,1
1342,Any positions for an equity trader with 15+ years experience @jobs4ATX?  Other i-banking opportunities would also be of interest.  Thanks!,0
5753,Being unemployed helps you make discoveries! Today I discovered Boy Meets World is on tv in the middle of the day! #discovery,0
8774,Looking for a new career? The CHPs goal is to hire 600 cadets per year. #PatchCalifornia http://t.co/NRViDdtszO,1
1775,Got laid off Monday and now my boss askin can I work next week. Make up to damn mind!!! Smh,0
9074,I am currently hiring work at home customer service agents working for companies like Comcast Disney Road Side... http://t.co/bi7bx4bL7B,1
1598,Looking for an exciting new #job? Opportunities include a Principal Systems Analyst position in #Norfolk VA. #... https://t.co/C3fh4PyLbw,1
2037,Looking for a #NewJob? #CareerCast has all your #Job and #Career needs at your fingertips. https://t.co/zqpYVpjdjv #CareerAdvice #GetHired,1
5109,When I woke up this morning I did not think that I would be fired from asked to return to and quit the same job all within a span of 2 hrs,0
3171,@laidoffleftout I am also one who is laid off from the construction industry and got a better education who still cant find work. #renewui,0
2725,#Job #FortWorth (USA-TX-FORT WORTH) Shift Supervisor (US): Job Summary and MissionThis position contributes... https://t.co/TpYKaIaQJf,1
6541,Got hired and fired from the same place 3 times. They cant figure out if they love me or hate me.,0
2372,Whos hiring ????,0
6286,Tesla Motors posted a job you might be interested in. Tool and Die Supervisor - San Francisco Bay Area US via ... https://t.co/Y4wskvfUOJ*,1
4705,Life is a lot better when I have work to do. Unemployment = way more things to worry about and way more time to worry about them.,0
1596,Looking for a job? Energy Engineer/Resource Efficiency Manager 4(13005096) at Northrop Grumman (SD) http://t.co/hQryVU5l8p #green #jobs,1
5873,Looking for a job in #Mesquite #TX? Retail Sales Teammate https://t.co/NhlZVQJoT6 #jobs #hiring,1
2126,Searching for #work in Orange CA? Send your #resume to Focus Employment Inc.. http://t.co/mn74fbwQ0F #gethired,1
9374,Looking for a new #job? Check out @SimplyHired mobile app and do your #jobsearch on the go! https://t.co/7EoLhRyvmm,1
1314,Statistically speaking if you employ me theres a 33% chance Im gonna quit and a 66% chance youre gonna fire me... hire me? :),0
4691,My laundry consists of swimsuits pajamas work out clothes and towels #unemployed,0
9019,I just quit one of my part time jobs to make time for myself. Naturally 8 more positions are available and are interested,1
9541,Anyone looking for a receptionist position? My job is hiring (riverhead Toyota) no experience required. Must have a flexible schedule,1
2038,Looking for a #NewJob? #CareerCast has all your #Job and #Career needs at your fingertips. https://t.co/hDSOfJ6PNI #CareerAdvice #GetHired,1
2252,Looking for office #job #training? @UnitedSouthEnd offers a program that prepares under - and unemployed workers for administrative employment with career potential.  Learn more on their website! https://t.co/cjUz8kn8eG https://t.co/vAcev5fc9n,1
4172,I Am Officially Unemployed https://t.co/IKnjFc1HS7 https://t.co/1Xzd5mz31w,0
5124,Well I was fired from my job today (officially seeing how it is I have been suspended since last Wednesday).  Life goes on.,0
4445,Anyone looking for a full time or part time job?!??,1
1166,Got laid off today... bittersweet... not! Now I cam focus all my efforts on Real Estate! Lemme know how I can help you!,0
9319,Looking for a new #job? Check out these open positions! https://t.co/GPYjd9ce5Z,1
6511,I am working on a new FT Business Analyst position with a growing company in the Hunt Valley area. My client is hiring immediately! Want to…,1
5914,Earlier this week huge audition &amp; the auditors had major technical problems. Now another epic audition &amp; my car is falling apart! COME ON!,0
8087,We are seeking a new crew member!  This particular position is a part time server Thursday-Saturday. E-mail us at affinefoods@gmail.com,1
8462,I am job searching for: Work at home jobs! http://t.co/4tgcXWg6JK — Walker Inklebarger (@Walker_marocliv.... http://t.co/pr7lMbZVDN,0
6545,I thought it was gunna get worse before it got better.. I was right when I got fired today,0
6838,Network for Good posted a job you might be interested in. Product Manager - Washington D.C. Metro Area US via ... https://t.co/a6veGrMt1f*,1
2524,Looking for a permanent position? Lead Creative Developer position is still open: http://t.co/ROBDKgoQuz #dctech @dcww @dctechmeetup,1
354,I am looking for a presentation layer architect familiar with Java technology who wants to work in Alpharetta.,1
1694,TODAY I QUIT MY JOB...in three weeks,0
8292,Today Im rocking that Newly Employed Glow #Hired,0
9538,Know anyone for this job?  Big Data Architect permanent position in Milwaukee WI (BP) in Milwaukee WI https://t.co/RoNGfDy9SF #job,1
5398,Wouldnt quit. Well shit is anyone hiring?,0
2377,HELLO SAN JOSE yall hiring????????,0
3051,My first day of work at my new job is done! Wow crazy how time is flying by.,0
8621,Retired? Unemployed? Laid-Off or Insufficient Income? http://t.co/a6gvZcy9uQ,1
4637,I quit my job whos hiring?,0
8700,Looking for a summer job? BlaineParksMN needs Concessions/Field Worker &amp; Park Attendant https://t.co/OHcVsNFGvJ https://t.co/HmUVKmIZCf,1
7210,Looking for a job in #Mesquite #TX? Financial Ctr Mgr https://t.co/V5Dw7nnAbn #jobs #hiring,1
762,If you are looking for a full time or part time #job Opportunity Knocks has open positions see the link for details: http://t.co/UJnwkCdbqn,1
8086,Im searching for a company or graphic design firm needing to fill a Graphic Design position in the San Francisco Bay Area #jobs,0
4961,I applied to 5 jobs while watching ultra. I get shit done why arent I hired yet?,0
1606,Looking for a new career? Rain Bird has the right environment for a thriving career. Sr. Tooling Engineer #Tucson AZ #job #hiring #career https://t.co/k9hK5oTSM4 #Engineer #Extrusion #Plastics #CareerArc,1
4991,Anyone need a job ??? My job is hiring and told me to ask around,1
4051,Got hired today then got a call for an interview for another job Im tryna decide if I wanna go or not,0
9526,Any places hiring for a sales associate position??,0
6455,I am currently looking for a position in #hospitality  please let me know if anyone knows of any sales positions.,0
714,Guess I am fired not showing up last two days. Well I was gonna he tossed like garbage on a key error or whatever,0
7570,Looking for work?  Are you unemployed?  We are now hiring. http://t.co/uwCbHWfUuh http://t.co/hIAJMSf8Yp,1
8983,BETTER !YET  I NEED UNEMPLOYED PHOTOG AND WEB DEVELOPER ON MY TEAM I GOT BUSINESS PROPOSITION,1
9369,Looking for your dream job in data science? Get Hired at #ODSC #UK https://t.co/wYv04TNqpT https://t.co/nxcD9MWy0H,1
6092,@QLCareers Hiring at Get Hired! Job Expo on Aug 27 at MET Hotel 5500 Crooks Rd Troy MI. http://t.co/dxZeYJ1DXC http://t.co/2NNyemq2KH,1
6093,@RaLphy_ReLLo Sears hired me lol,0
804,Currently applying for a controller position in N. Alabama for giggles. I meet all the qualifications &amp; it meets my salary requirements!,0
9433,One of coworkers fist bumped me and blew it up today so now Im unemployed again.,0
6814,Amazon posted a job you might be interested in. Network Engineer - Beijing City China CN via LinkedIn http://t.co/OZTINDL6Zt,1
6447,#job - Home Instead Senior Care is looking for a Just Laid Off? in MinneapolisMN http://t.co/G0zsaqdwrk,1
1773,So who wants to buy a GoPro package at a reduced price!? Unfortunately I got laid off my job and need to sell a GoPro....,0
6264,RT @continimarco: Microsoft posted a job you might be interested in: DATACENTER OPERATIONS MANAGER - Washington D.C. Metro Area US.,1
4276,Any of my 🐥 followers need a job? I got two positions available for Fired Up Taco Truck. Hmu. Serious inquiries only please,1
3748,Looking for a new assignment or ft consulting job in the USA? http://t.co/iUt9icxf Very inexpensive to post your spots,1
3801,Wait jk again Im unemployed.,0
807,Currently researching HR/Labor positions in the Ocean County NJ area however am willing to travel or relocate. Have 2.8 years experience…,0
6339,Looking for a job in #Morristown #NJ? Equity Strategies Group https://t.co/rbo7ro8n0Z #jobs #hiring,1
5739,I was unemployed for 4 months and about to give up. Then I just got 2 jobs in the past 24 hours. Life is unpredictable.,0
1685,Quit my job yesterday got a new one today,0
1321,Interested in a #job in #Mesquite TX? This could be a great fit: https://t.co/QyhuaoF5Ql #parttime #Hospitality #Veterans #Hiring,1
5627,Looking for a programmer that is willing to do equity work...solid idea with a good following. Msg me please,1
4486,Anyone looking for a job wanting to drive a tow truck?!?! Get ahold of me kalebs looking to hire someone asap!,1
5634,Searching for #work in Tampa FL? Send your #resume to Equity Inc. http://t.co/4FDVgqE8FZ #gethired,1
1327,If youve ever been interested in quitting your part time job wanted to be your own boss  or run your own business send me a message!,1
6681,I went to try to get a job with a carnival today but they wanted me to cut my hair &amp; I said that I could not. They gave me $40 to leave. :),0
98,Got hired on the spot &amp; some random guy took the dent out my car for $20..today a good ass day lol,0
9368,Looking for new finance roles with a Fortune 500 company? Let me know working on multiple positions. #Finance #jobs #fortune500 #hired,1
8321,I got hired at a Bangladesh sweatshop. Meet my 9-year-old boss http://t.co/8TsBtR8glr via @torontostar,0
3109,I quit my job today I feel good about it,0
5314,I can sleep late and still get in dumb sleep.... that unemployed lifestyle,0
8832,I got hired 2 weeks ago and have not been scheduled to work 🙄,0
617,Does anybody know someone that is looking to get hired? Microsoft Dynamics CRM Consultant - http://t.co/F71ZI4ekDG #FMTway,1
2163,Searching for #work in Irving TX? Send your #resume to Check Point Software Technologies Ltd.. http://t.co/6sCiKMcZUT #gethired,1
2854,Looking for a Fun and Flexible Work at Home Job? https://t.co/GiUxM5FPIO #Moms #Jobs https://t.co/uNig7bhkS6,1
6342,Looking for a business opportunity to either quit your job or supplement your income? Look at @BuildTheStore http://t.co/lotEfDZ7VU #bizop,1
324,I am looking for a self employed IFA who may want to work for a new dynamic wealth management company based in Nottingham. Know any??,1
7630,A business opportunity you can work from home and get paid daily!! http://t.co/fTbBjKaaY7,1
6003,RT @ApploiJobs: Looking for retail jobs? Start with @Apploi http://t.co/6Rfn54WLOI #GetHired #JobConnect http://t.co/JbbRML2DvG,1
6802,Anyone looking for full-time seasonal and year round work? Buckmans inc. Is currently hiring.,1
3727,Looking to join GEICO (@GEICO_Jobs) Zurich (@ZurichNACareers) or Flagship Management (@FlagshipCareers)? View 11 openings from these companies and more. https://t.co/SgGgbFavCn,1
8063,I searching for someone to fill a leadership position on my team! If you are passionate about natural health alternatives please contact me!,1
9359,Got called from an extras service in California to work tomorrow and Friday on a movie set. I was picture chosen by producers..UNION VOUCHER,0
5680,The architecture firm laid off a group of employees and unfortunately I was one of them. I am currently in shock... http://t.co/IFToIYFbg8,0
8041,I am actively searching for a position as CEO/President of a small to medium size company.,0
1295,Dont submit then quit. Apply for jobs like Regular Classroom Teacher at San Francisco Unified School District then look for people you might know at the company. You might be able to reach out to HR directly. Ready to apply? Check out the link in our bio. Educator Teacher,1
6833,Accenture posted a job you might be interested in: Titanium Appcelerator &amp; IBM Worklight Professionals - Pune Area India IN.,1
5363,I have applied for so many jobs even a teacher aide position and not even an interview! I have 17 yrs teaching experience! #discrimination,0
7686,I have been laid off effective January 1 2013 by the new Harris County Tax Assessor-Collector.  I would be very grateful for any job leads…,0
384,I am seeking the next batch of leaders to work side by side with to go out there and change some lives. PM me.... http://t.co/bwqMjlUafu,1
4484,Anyone likes their job &amp; by any chance are hiring ?? Hook your girl up pls,0
3915,#Accounting #Job in #Morristown  NJ: Accounting Manager Real Estat... at Robert Half Finance &amp; Accounting http://t.co/Kjg1HRYse0,1
5769,This week marks 2 years that Ive been self-employed/unemployed. Still going strong trying to make my dream work out.,0
2246,I skipped work one day and was bored out my mind RT @FullMoonVoodoo: Ive been unemployed for 28 fucking days. This shit is not for me.,0
1116,I am searching for a good job but i am not getting it .i am already 29 yrs and i dont know wen i will http://t.co/xeAPAYWQPu #pray #prayer,0
7497,I am disabled veteran been unemployed since 2009 and I cant get disability benefits. I would like to do computer work (administrative or billing). My email:barryevanslive@gmail.com https://t.co/ZOMkrNOVzg,0
2023,My sudden job change is proof of this. Fired 1/14 hired 1/23 at a better job. God is good we just ha http://t.co/xLQj6tqut2,0
2911,Today I can smile. Today I have secured a new apartment and got hired for a full time position!😁👍,0
4846,Im watching the Doctor Who 50th Anniversary Special because Im a big Doctor Who fan and Im also very unemployed.,0
1056,I am currently looming for a second job,0
698,So for the first time in 30 years...I got fired today.  I am looking for work or marketing work but let me know... https://t.co/99ZRjqBdJQ,0
7131,Looks like Im unemployed again lets see if I can beat my record of starting a new job in 4 days.,0
8498,Today at work I was asked to advertise our hiring on the radio well I did. afterwards the man asked if Ill like a job at the radio station,1
1605,Looking for a career that offers job flexibility or a fat paycheck? Here are 10 that offer both: http://t.co/jzHClB9htM,1
8390,So I got laid off and then someone stole my main portrait lens so you could say this week has been fucking great,0
9208,Everyones laughing at my festival tweet but really I wasted 20 dollars. Guys Im unemployed I dont have much money you dont understand.,0
2754,Searching for an IT Project Manager skilled at working on complex projects ERP etc. Please reach out so I can share some details about a …,1
5136,I got fired earlier and as soon as the store closed I went back to ask for my job back and they immediately said yes lol,0
2100,Looking for a new way to hire or BE hired? check out http://t.co/UU5ax8MLHb to create an @myzumay . Fire your #resume ! #jobsearch #jobs,1
6832,Amazon posted a job you might be interested in. Software Development Engineer - Amazon WorkDocs - San Francisco Ba… http://t.co/yW0ntVsDGq,1
9534,Anyone looking for a server kitchen meat cutter or hostess position? the swinging door is hiring all positions right now! Come apply :-),1
756,you might be interested in: Assistant Director/Director of Academic Support Position at Thurgood Marshall https://t.co/XtRzKsjw9k,1
9405,when i first got hired 90+ work orders were on the table. i am down to 10~ now,1
4969,Anyone looking for a serving job??? Chilis is hiring and I want to recruit some friends!!,1
646,Has anyone on here hired a Virtual Assistant? Advice???I seriously need a personal assistant at this point and have debated it for awhile for my publicity social media emails castings Production Contact log updates calendar management...#virtualassistant #PersonalBranding,1
9196,Being unemployed means I got to sleep in after that Colts/Broncos game. But I woke up with a headache so its not all win.,0
412,#Job #Phoenix (USA-AZ-Phoenix) Account Clerk Supervisor: This position provides first line supervision of empl... http://t.co/cT8BikZCqQ,1
8896,RT @ATXLuci: #Zomato just laid off all their employees in the U.S. Anyone hiring? But seriously.,1
2308,Looking for a #(NEW #POSITION) Associate Director Regulatory Affairs Advertising and Labeling #jobs https://t.co/nVyls7e1Kj,1
1580,Looking for a job? Energy Engineer/Resource Efficiency Manager 3 at Northrop Grumman (NJ) http://t.co/2dXGw2tE7G #green #jobs,1
1695,Lost your Job? laid Off? Need extra cash? Be Healthier? Love Social media? work from Home? I have an amazing... http://t.co/x07xSODZf4,1
1224,If youre interested in working at @jump  you might be interested in this response to one of our challenges.,1
3899,#ABF is hiring a #City #Driver Full-Time Combined Dock/P in #Dallas apply now! #job http://t.co/t6RCrYueam http://t.co/uKeJoPeDbT,1
1599,Looking for an exciting new career opportunity in Detroit? https://t.co/1JbvAXo4wl    #jobopportunity #detroit https://t.co/PnYS6qcN34,1
8612,UNEMPLOYED ? sell someone elses products http://t.co/rGoFC2m1pP http://t.co/0hdE2gV1DT ways to beat economy info news links ideas,1
8035,Unemployed? Interested in a new career? Here’s some exciting good news! https://t.co/w07ChSRfbm,1
3398,Anyone fired/ laid off and they want 2 get back in control of their finances? go to http://t.co/kWPW8XgPrj &amp; then DM me W/ contact info!,1
787,I am currently looking for a part time position in a library or office.,0
379,I am looking for a couple of great Python coders to be co-founders in a huge-potential startup Im working on.,1
7505,I need a job.. I have turned in well over 15 job applications yet I am still unemployed.,0
6198,I got another job offer yesterday. Its another admin position and the coordinator was really excited when she was telling me about it,1
2311,Looking for a (new) job? Veteran? RecruitMilitary Veteran Job Fair is on October 6 at Soldier Field https://t.co/Xy06CO7poW,1
6535,I got fired today for getting caught having sex in the bathroom with a fine young woman...,0
890,I searching for a position as a registered nurse. #focusclass,0
1211,Heres an opportunity to work for a family owned company doing great things in the marketplace. https://t.co/98X1pfuwUG,1
9000,8 Months Unemployed. Please consider me for Project Management or Quality Assurance positions.  Amenable to reloca…http://Unemployed.Please,0
7129,Apparently Im still unemployed bc my former employers are not being nice or saying nice things about me. I wish I knew who it was.,0
8584,Unemployed or Looking For a Way to Make Extra Money? --&gt;&gt; http://t.co/tBDFOVcf23,1
2226,Two weeks officially #unemployed and Ive recon firmed that being a #SAHM is not my thing. Best enjoy it whilst I can!,0
3744,Looking for a new #job in #Pennsylvania? Subscribe to #JobAlerts! http://t.co/NZniIuH90n,1
3851,Currently eating a twix in bed surrounded by laundry. #unemployed,0
6996,Looking for a job as Nurse? ! $1000 bonus - Sign up to drive   #fired #layoff #work https://t.co/XEKH9eaDfG https://t.co/4ilKpZTL3y,1
5338,RT @Flashy_Words: 6 weeks of unemployment &amp; I accepted a position today. I’m gonna treat myself to drinks &amp; sushi &amp; a pedicure!,0
8043,I am searching for any available social media positions for someone based in Covington KY...any takers please respond :) thanks,0
7592,Here is an opportunity for you to create a #startups and become an online #entrepreneur. Get your start here. - http://t.co/LnOwNmremq,1
739,Would you be interested in a sign on bonus?  Call 582-8705 if interested in these two positions.RN ER FT Days &amp; NightsRN CCU Days &amp; Nights,1
7983,If you are currently unemployed here is a great opportunity for you.  Paladium Nightclub Broward is… https://t.co/u3uhulBwSB,1
2347,Anyone looking to hire a smart educated talented writer/producer/designer/photographer?  What Im saying is I am awesome.,0
766,Job Opportunity -  Are You Interested in an Administrative Position? in Las Vegas NV http://t.co/R3dnucUiIk #job,1
8989,God is awesome.  I never thought after seven months of unemployment I would have students asking for me after four weeks of a new position.,0
1328,Interested in a #job in #Mesquite TX? This could be a great fit: https://t.co/iKvp48XwUa #Retail #Hiring #CareerArc,1
5456,Monday was a work day yesterday was my birthday and today I got fired. :/,0
9482,Oh! The joys of waiting forever to know if youve gotten hired or not! #ridiculous Got bills to pay ya know! #societysucks #Unemployed4life,0
1723,2018- The year that tested my fucking Faith more than any other year.... Unemployed for the first 6 months.... Laid off after 3 months of working again.... Still looking for a jobStill in love with my wifeStill supporting my family.... #Dontgetdiscouraged,0
7475,Now baby girl the dump she no loger wants me Im no longer hired she said that i been fired,0
4231,Currently taking applications for someone new to caption my photos bc @TooSlick_Rick is fired... the job has no benefits except that you will get to see never before seen photos of me that may never actually be posted,1
8966,Looking for a part-time job? Guest Services at TWS is now hiring for permanent and holiday positions. Apply at http://t.co/5M5MMgisCQ,1
6822,Here is an employment opportunity to work with one of the coolest products on the planet earth.  Apply Today! http://t.co/ih0DONBS57,1
5359,Well I put my name in for manager position on weekends so I can have 4 days off for flight school but have to interview. I hate interviews,0
