id,text,class
3911,#Accounting #Job in #BuddLake  NJ: Accountant - Entry Level at Accountemps http://t.co/g834qqV2Xs #Jobs #TweetMyJobs,1
2032,Looking for a great career? Get Hired! https://t.co/1vxCFQSFja  #jobs #trending #jobsearch #career #job #gethired #hired #job #RT #CEO #CFO https://t.co/bumEefBYra,1
974,Interested in a #job in #NebraskaCity NE? This could be a great fit: https://t.co/DR8EvBkTZk #NowHiring #GetHired #Manufacturing #Hiring,1
3216,Im tired of getting laid off and Ive always wanted to work in law enforcement so I applied to Oakland Police Dept https://t.co/HUWnFga08d,0
5788,Welp now that Im officially unemployed my new full time job is looking for a full time job,0
5257,Im getting better and better at guitar the longer I am unemployed,0
1299,Interested in a #job near #Mesquite TX? This could be a great fit: https://t.co/GI5f8i0cdy #IHOP #restaurants https://t.co/reNS8SUSGO,1
3388,Im no longer hired he said that I been fired,0
7749,I am currently looking for someone that does printing.,1
4260,Officially looking for a new job.  Not fired just heard new mandates being handed down.  I do not want to be a part of this organization.,0
5430,I got fired wednesday now I have orientation wednesday look how God works.,0
5537,@BCDTravel Im looking to return to BCD after being laid off. Any supervisor positions in the works?,0
973,Interested in a #job in #Warren New Jersey? This could be a great fit: https://t.co/aXQKK0A79L #NowHiring #GetHired #IT #Hiring,1
8756,I was fired today. Im a badass,0
5545,Are You Looking for a Job?If you were laid off or are looking to enhance your career National Able Network can... http://t.co/CgYiDGZHlh,1
4020,I recently was hired as a freelance sewing pattern proof reader and well I just finished proof reading my first piece!! https://t.co/YXMb9ny2nd,0
4786,I am earning cash at InboxDollars &amp;you can too! http://t.co/J6naWhHj4i #whattodowhenyourunemployed #pennies #pennyforyourthought #unemployed,1
2297,Looking for a Spring semester Work-Study job?  Purdue School of Nursing has a Clerical Assistant position to scan files to archive make copies make student IDs file cover phones type and other clerical tasks. https://t.co/zEDTdoCG8I,1
8624,Any College Students or Unemployed Individuals Interested In Marketing or Blogging? Apply Today: https://t.co/lhAqQTPRBZ https://t.co/R5Q8lpLnJh,1
3815,*SCREECH* WHY ARE BEYONCÉ AND JAY Z GOING ON TOUR WHEN I:A- AM UNEMPLOYEDB- NEED TO BUY A NEXT GEN CONSOLE SOONC- FUCKING PAX TICKETS,0
1115,I am searching jobs in New Jersey on http://t.co/rwQS6slTU4,0
2009,I recently quit my job to pull in $5641 from my phone PRESS THE LINK INSIDE BIO to do it too https://t.co/Z9ohtJsp9P,1
336,I am searching for three special project interns to work on #OETC14 and more! | Public Assembly http://t.co/x1sdyWerHy #cbusinternships,1
3082,i quit my job today cause who cares i do not i realized i am smarter than everyone and now my head hurts,0
1009,Interested in a #job in #Burnaby British Columbia? This could be a great fit: https://t.co/4poW5AZgdC #NowHiring #GetHired #Construction,1
8126,Not working. &lt;&lt;&lt;&lt;&lt;&lt;&lt;&lt;&lt;&lt;&lt; I need a job yo,0
3125,I didnt lose it its not like whoops whered my job go? I quit! Someone pass the asparagus please.,0
4480,Anybody’s job hiring????,0
5487,Got Laid Off? Out of Options? Heres an option: http://t.co/JaZ8rHMtAi,1
8957,Looking to make a difference/leave a lasting legacy for causes u believe in? Apply today for the IIR position in #HHS http://t.co/5vuR7GtrBH,1
7135,I havent ate all day because Im too lazy to make anything. #unemployedlife,0
8,I WASNT FIRED I WAS LAID OFF BUT YOU WOULDNT KNOW THE DIFFERENCE,0
4156,I am currently unemployed homeless on food stamps fighting prostate cancer and use the Oxford comma. #IamtheMiddleClassunderObama,0
4750,Why dont people want to hire in the middle of the summer??? Broke life aint fun,0
2250,Ad: Unemployed? Looking for a new Job or Career? Work at Home Positions avail $80-$90 a hr http://t.co/QctV6WLzVk,1
1590,Looking for a new job or recruiting new staff? Facebook rolls out job postings plus other social media news stories:https://t.co/U1wHYlMIpH https://t.co/4gD8R9qPy5,1
7316,Got fired today… From a job I gave three years of my life to. I gave up church. I gave up going to college.... http://t.co/jtqOlLPTq4,0
8797,Looking for part time work or a work from home business or a job in Augusta?: http://t.co/b8HrSJfbfh via @YouTube,1
2084,Looking for Employment? Studies Show Voluteering Works | Get Hired Fast http://t.co/544Yr5OEqv via @GetHired #careers,1
4942,Every person i refer to work and who gets hired and completes their probation earns me $50 on my next check. SOMEONE APPLY AND GET HIRED,1
2098,Top Story: Looking for a great career? Get Hired! https://t.co/1vxCFQSFja  #jobs #trending #jobsearch #career #job #gethired #hired #job #RT https://t.co/y7PJ31eEjV,1
4478,Anyone know a place thats hiring?? #needajob #asap 😁,0
1737,Laid off Friday unemployment office Monday sigh,0
2828,Looking for a work study job? Want to work off-campus at $9.00 - $10.00/hour? View available jobs: https://t.co/PGCa0TQfHy https://t.co/ityk9vNCvg,1
2059,Looking for a New Job? Interested in a Career Change? #CareerCast Has Everything You Need and More! - https://t.co/AooltyNlmL #GetHired,1
6573,I got fired today yall.,0
6879,RT @Urbana_FireDept: Here is your opportunity to apply to be a Firefighter for the City of Urbana. #firefighter https://t.co/V47kVg4qtm,1
1411,Unemployed Under-Employed Unhappily Employed? Find jobs &amp; career solutions on LinkedIn in JCD The Job Seeker &amp;... http://t.co/JLU45SnxYg,1
6635,Today I quit my job took a roadtrip to see some pastors about my depression and I just crashed my car in the freeway. I hit my head and,0
9554,Anyone looking for a CFO position? http://t.co/AhzlCvBkCM,1
7854,I quit my job about one month ago and even poured coffee on my bosss wife head and he calls me and asks if I wanna work there again ..,0
5999,Probably shouldnt post things like that if I want to get hired.,0
7246,4:15pm. I officially have stopped caring if my job cares if I quit. #unemployed,0
7956,Boss hazed me about a parking spot.I QUIT3 weeks laterhe was fired 4 delivering marijuana.Guess he didnt need that parking spot! #abc2020,0
546,Well this week starts as me basically being fired as a driver which means big pay cut which means shit,0
2855,Looking for greater challenges new opportunities and a working environment that lets you challenge yourself and showcase your skills? Look no further! Join us: Associate Technical Account Manager https://t.co/RIe53pCooQ #Veterans #CareerArc,1
6665,Today I got a job serving donuts hit on someone drank a whole bottle of wine &amp; almost drunk bought a ticket to Boston for No Pants Day.,0
2077,Looking for a new tech job and want to try out a brand new experience in your job search?  Check out Hired Inc.! https://t.co/txC8pYtIhn,1
6646,SubhanAllah i lost my job but yesterday my bros wanted to go out so i said ok Allah will give back This morning I find money on my account,0
5289,this might be controversial but i love being unemployed,0
6227,Google posted a job you might be interested in: MBA Intern 2015 - Ireland IE.,1
2418,Target posted a job you might be interested in: Pharmacy Manager Full Time - Dothan AL - Dothan Alabama Area US.,1
2363,Whos hiring!? Anyone!? Bueller!?,0
3347,At a job interview this morning an employee peeked around the corner and mouthed YOU DO NOT WANT TO WORK HERE. I was hired. #badsign,0
2983,Weird state of my life. Yesterday I was being interviewed for a position today I was interviewing people for a position.,0
4089,Got hired to change brakes and  clean a car oooooh yes,0
8623,Anyone hiring right now? My brother in law is more unemployed than @lenadunham bra.,0
3660,I officially began my new job yesterday. The whole crew there is really nice and they sent me home today since Im sick lol.,0
8054,I am looking for 5 motivated people that want to change their position in life and only have time to work with five people.,1
6538,i got fired today... hooray me,0
9353,I went in a interview today idek why eye gotta good payin job already,0
4044,Searching for #work in Burlington IA? Send your #resume to Big Lots!. http://t.co/h9hPP3tYxJ #gethired,1
960,Get HIRED Today to Work for @LoveNightClubDc were HIRING for Multiple positions Txt 3013436531 for application http://t.co/bJXKRYU5iy,1
7694,Laid off today due to slow period. Looking for work in #StCloudMn https://t.co/w8u6tfHIED,0
3544,Alright got fired from a volunteer position new low in life whatever still setting milestones.,0
891,Looking for C2C companies with  Sr. Java Developers with EADs....4 positions open ! Message me for details,1
1870,@SSUSAJoe @AmyF222 @tomirvin44 @derikhunt915 @LoriMills4 @LuisGarzam89 I used to work for Barnum and Bailey but got laid off!!,0
3603,Its 5 am time to start my daily job search and certify for my unemployment benefits. Good look in your job search and interviews! Peace.,0
9322,Searching for a fabulous career? Merry Maids Tulsa Metro is searching for energetic people to become a part of... http://t.co/I4PdSaRTMN,1
3630,Hey I got laid off today. @FBI you hiring?,0
340,I am looking for Lanyard Locket Ambassadors.  I am looking for 5 people who wear name badges in your workplace to... http://t.co/RM7uLKWSbK,1
2731,#Job #Germantown Qdoba - Job Fair for all positions: At Qdoba we are proud to be considered a leader in the f... http://t.co/vG7p67Y9IX,1
8355,Still getting up at 6 to work out at 7am despite being laid off. Love working out with my pals.  #Motivation #toughmudder training.,0
9020,Now at my new corporate position. I go in at 10:30 and cant even wake up at 7:30 to go run. And Im sleeping earlier. Dont understand.,0
6161,got an assistant project management position open at my job. no experience req tech savvy person DM me,1
7164,And now Im unemployed,0
5730,Took my first Barre class this morning and then took a 3 hour nap after. My legs are still shaking! #unemployedlife #barresohard,0
2851,Looking for a career change? Working with Accounting Principals has perks http://t.co/Kq5ImxBGf0 @acctprincipals,1
963,Get HIRED Today to Work for @LoveNightClubDc were HIRING for Multiple positions Txt 3013436531 for application http://t.co/xK878Mxvip,1
6280,Microsoft posted a job you might be interested in. Sr PR Mgr - Thailand TH via LinkedIn.,1
3489,Wow I totally forgot I put in application for another part time position early this month and used another email I missed an interview wow😑,0
8111,I am looking for Fast Search consultant for long term contract position based in Austin TX interested send their...: http://t.co/bCAPqduGIK,1
5270,being unemployed during a daytime World Cup is fucking solid. I need to remember to unemployed again 4 years from now.,0
9189,Today I am unemployed.,0
928,Got hired to be a music reviewer again next semester but idk if I should take the position or not? Hmm.. decisions decisions.,0
2145,Searching for #work in Scranton PA? Send your #resume to Judicial Branch. http://t.co/amKhs7c8Oc #gethired,1
9392,GOT THE INTERVIEW IN THE AM I HOPE I GET HIRED ON THE SPOT CAUSE I GOT CAUGHT UP WITH MY UNEMPLOYMENT THEY FOUND OUT I WORKED FOR 6 HRS LOL,0
5269,I love a challenge and thrive on proving people wrong so yes compliments are the reason Im unemployed,0
9350,Got hired at best buy mobile last week &amp;amp; today I have an interview with FedEx for a customer service rep position! #needthat,0
8926,@TheGreenClovers know any places in the area that are hiring? Got laid off today.,1
397,I am looking for an acupuncturist to work in my studio . Do you know any?,1
1388,Unemployed Under-Employed Unhappily Employed? Find #jobs &amp; career solutions on #LinkedIn in the Job Seeker &amp;... http://t.co/DEBmswo4Ql,1
6536,Lol I got fired from my minimum wage job today and got hired for an above wage job the same day. #merica,0
1431,Unemployed Under-Employed Unhappily Employed? Find #jobs &amp; career solutions on #LinkedIn in the Job &amp; Career... http://t.co/5YimpWHkcE,1
17,I was recently laid off by a large bank. Today they sent me a credit line increase and some fake CC checks. Dont they know Im out of work?,0
5389,Anyone know of places hiring? Macs is pissing me off now and im quitting McDonalds no matter what lol,0
1578,Looking to join the autonomous vehicle industry or post a job? Over 100 current positions listed now at https://t.co/hWUvBTbx2o. @v2vjobs,1
5725,Just got laid off so making music is keeping me spirits up:) https://t.co/1R6347CLMU,0
5280,AKA #unemployed: I received an MBA &amp; used it in my business career. Now am using erudite methods to build up my background #dating,0
747,Hi Connie Below are some opportunities that we thought you might be interested in. Each position links to the... https://t.co/NEKDmxm22y,1
2124,Searching for #work in Durham NC? Send your #resume to Department of Veterans Affairs. http://t.co/l6ViPbYGEY #gethired,1
6956,oh I just remembered when the movie theater fired me 2 months ago I forgot to clock out,0
2493,Interested in a #job in #Richardson Texas? This could be a great fit: https://t.co/CS81xnDmc3 #NowHiring #GetHired #IT #Hiring,1
1092,I am seeking a Java Middle/Backend Developer for a C2C opportunity in alpharetta GA #job #J2EE #EJB http://t.co/qoHzje3gA0,1
9383,Looking for your next #sales #job? Let employers come to you w/ @Hired_HQ! http://t.co/Vvxf3vvnZ6,1
8469,After today have a couple days off at my job anybody know whos hiring I wanna try to get a second one,0
9106,I was fired from my job I was laid off but you wouldnt know the difference!!,0
9400,All my friends are getting hired at starbucks!! Why not me??? Oh yeah cuz they only hire pretty people. Sob sob.,0
1405,Unemployed Under-Employed Unhappily Employed? Find jobs &amp; career solutions on LinkedIn in JCD The Job Seeker &amp;... http://t.co/PU1at6It70,1
4518,Tesla Motors posted a job you might be interested in. Legal Assistant - Beijing City China CN via LinkedIn http://t.co/HYoGa29kJi,1
5823,Can you recommend anyone for this #job? Store Team Member - https://t.co/WXnjQCrkH8 #Retail #Mesquite TX #Hiring,1
2741,#Job #Lexington Assistant Professor: Richmond Position Summary The Department of Psychology invites applicatio... http://t.co/FflRyzRyFq,1
7270,Ive been working at my 1st job for little over a month &amp;I forgot I worked today &amp; now I feel like shit cause Im worried Im gonna be fired,0
407,#Job #NewJersey Entry Level/Management Customer Service Positions: NJ-Trenton What Are You Worth? Beginning a... http://t.co/YV7CA9H5ng,1
7414,@AgeroProvider  then they fired me told me I  terminated me then I file for unemployment and they told them I quit which I didnt do!,0
43,Just graduated college and got laid off before starting work. Not sure how to maximize my severance package - https://t.co/n7fgL3fDFR #tax…,0
1452,Unemployed? No job? Looking for employment?  Now hiring! http://t.co/uwCbHWfUuh http://t.co/8puUxiX0I8,1
917,Got hired at best buy mobile last week &amp;amp; today I have an interview with FedEx for a customer service rep position! #needthat,0
2414,Amazon posted a job you might be interested in: IT Support Engineer - Amazon Web Services Australia - Sydney Area Australia AU.,1
86,I got hired to cook fathers day dinner tomorrow...cuz Im nice in the kitchen.,0
6935,My english teachers freaking me out!!! After he saw my quiz score he said I was fired??? fired from what? i didnt know i had a job!,0
2570,Looking for an exciting new #job? Opportunities include an ETL/Tableau Developer position in #Arlington VA. #... https://t.co/jJMLJ4zEHV,1
2411,Whos hiring at the mall!!??,0
3908,#Accounting #- General needed in #SanAntonio at RIMSS Inc.. Apply now! #jobs https://t.co/rtKaArQfja,1
2109,Searching for #work in Auburn MA? Send your #resume to Sears Holdings Corp.. http://t.co/WDUy24xjXX #gethired,1
2734,#Job #Houston (USA-TX-Houston) SMB Sales Representative II: An mid-level sales position targeting small-to-med... http://t.co/M5KeHPGHTI,1
3786,cant believe i was just unemployed 50K divorce debt 40K hit by IRS no health insurance forced to buy it from the government or be fined..,0
5028,My old job hired my best friend and then 3 days later fired me for using my cell phone. I found you a new employee then you fired me lol,0
8948,Looking for a challenging administrative position in Boston (Waltham) MA?  http://t.co/3Wm4ObuUTm | #jobs #boston,1
1910,I was laid off and couldnt find a job then raised $1M to help people hunt jobs! A real story needs a great writer! You?,1
6553,Today I got hired promoted &amp; then fired from a Briarcrest commercial...thats all. #actress,0
5513,Laid off? Tired of working for someone else? Let us help you find the right opportunity. https://t.co/wR7G0sTlDg,1
4053,I got hired as an artist through an online service today.  First time that has happened. Let’s continue this shall we?,0
8959,Looking for a #INPUT/BAL. #CONTROL OPERATOR (4 POSITIONS AVAILABLE) #jobs https://t.co/eKVHHo29wU https://t.co/YLszrIJSZW,1
1259,I might be interested in working at best buy.,0
8617,Any College Students or Unemployed Individuals Interested In Marketing or Blogging? Apply Today: https://t.co/7gwDz8eSum https://t.co/0Bv9Sna6eg,1
2232,Have you seen my mid-week video? I decided to vlog whilst unemployed! http://t.co/MAppy5oxiT #lbloggers #crazybloggers #bdib,0
8863,Just got hired to write the next series of Fast and Furious sequels. Ill be posting the titles with Hashtag #fastsequels,0
129,Craziest thing happened to me today..i lost my job..then got hired by another one an hour later..pure awesomeness,0
4152,I am currently unemployed. Can I qualify for welfare?,0
7288,So my coworker got me fired today because of what happened last night thats a bitch ass move but fuck him &amp; that business i worked for,0
8502,Saw a snake in my job today I quit my job today,0
6133,Todays my last day on the job. Monday I start my new position suppppp,0
2702,#Insurance #Jobs Insurance Staff Position - State Farm Agent Team Member - Scott Krevat Insurance Agency Inc -... http://t.co/xABfRUObsH,1
7660,New job have being laid off for 9 months!!  Work is tiring!,0
3503,So my position was eliminated last week now I find out that the owners (nephew I think?) began working there a few days later. Hmmm.,0
1174,Got laid off today. If 2016 could stop trying to crush my fucking soul...I would be so grateful.,0
5784,Its the middle of the night and I started a Twitter. #unemployedprobs,0
4101,Got hired today for a really good new job but theyre asking me to cut my hair...,0
3105,yesterday I quit my job &amp; today I spent all day riding roller coasters,0
5134,I was fired in plot to give Sheldon Silver’s mistress a job. https://t.co/nITDhe6xMu https://t.co/KwEvqfOc2G,0
2522,Looking for a PGY1 or PGY2 pharmacy residency position? Registration is open for ASHP Resident Matching Program https://t.co/a1YZ7c1LsG,1
8698,Looking for a job? New operators of Nassau Coliseum searching for new workers https://t.co/CComLMeJ5L #newyork #nyc https://t.co/Apc08Jepco,1
8550,Today I was hired to teach skateboarding lessons at a birthday party. It was a group of 10 kids. Out of the 10 only 1 tried skateboarding for about 10 minutes of the 60 minute lesson. The rest of the kids rode scooters. But I did teach a them a scooter trick. Still did my job,0
9012,Unemployed? To see open Social Media positions use The Social Web App. http://t.co/p2cUeub9bH #needajob #jobs,1
9413,I GOT HIRED AT KOHLS. Better enjoy my unemployment while it lasts.,0
6475,I am currently seeking 3 interns to work with our team at LiJL Radio Network - these are not VA positions. Email... https://t.co/7YliK4xSKR,1
2490,Interested in a #job in #Reno Nevada? This could be a great fit: https://t.co/otkNxkGqlH #NowHiring #GetHired #Manufacturing #Hiring,1
2080,Looking for new challenges? On @Hired_HQ the best #rails #python #javascript companies compete for you. #railsconf http://t.co/bll0ZQo5hi,1
4769,Searching for #jobs as a #Christian who is #unemployed ... Read http://t.co/fzkRHJXiXB,0
9192,They are keeping me unemployed and forced me on medicare to make me appear to be crazy and uneducated,0
116,I quit and got hired in then same day because i sold another car ya boi is on fire lmao,0
1084,Im searching for another job so I can get my money up &amp; move.,0
8021,A bad economy and many unemployed but opportunity can be found - here is one http://t.co/MQ1JSoIDoU,1
487,After getting fired from my new job I’m ready for a new one.  Hello? World? Where’s that f*ing open door,0
2562,Looking for a #Visually #Impaired (VI) Teacher Position-Contract-Long Beach CA #jobs http://t.co/f1I3uVyhmx http://t.co/3OdkFrqRLL,1
8927,Laid Off? Start a - Work at Home Business in 24 Hours or Less-  http://t.co/hkh5A4wq3o,1
7831,I recently quit my job to generate $5641 from my phone PRESS THE LINK INSIDE BIO to do it too https://t.co/d2tIwmphEj,1
8792,Looking for a pay raise need a new job? Check it out @greensborocity ready to hire  https://t.co/AafU6AFYSM https://t.co/GdoOW4K4oy,1
4169,Currently unemployed should be saving money instead I just went shopping.. I have a problem,0
6816,SAIC posted a job you might be interested in. Network Engineer (Security) - Greater San Diego Area US via Linked… http://t.co/4zSSagx3EO,1
2111,Searching for #work in Albuquerque NM? Send your #resume to New Mexico State Personnel Office. http://t.co/iCPzGjdNAw #gethired,1
2723,#Job #Denver Discount Tire (4465 Forrest Hill Rd. CO Springs): Part time tire tech positions available. Start ... http://t.co/V24THH59vG,1
4759,I need a 2nd job anyone know anywhere that is hiring in Fort Wayne right now???,0
2554,Looking to make a difference? Make a difference with us! Home Health and Hospice positions available https://t.co/BtEq4LnLHw https://t.co/Yn5E57M2Eq,1
1059,I am currently looking for paid Sales Interns.  Send your resume to scott.m.herlin@sherwin.com #jobs #jobhunt #resume #intership,1
9240,Anyone looking for a job with decent pay? Full time or part time positions open and must be 18,1
2830,Looking for a #career worth having? #JCPenney is seeking sensational #talent for part time and... https://t.co/O8YKDi9rZp #IWork4JCP https://t.co/LhKcNp3UMn,1
2907,Being unemployed is a lot like being retired except Im not old and all my friends are busy at work all day what a bunch of nerds right?!,0
1849,I am looking for GUEST BLOGGERS REALTORS and SMALL BUSINESS OWNERS.  Are you one of these?,1
2549,Looking for a position that offers plenty of perks &amp; opportunities for career growth? USAA is hiring an Auto... https://t.co/cHkwQRc8Mk,1
2557,Looking for a summer job?  There are over 120 positions on the #WWU Student Employment Centers website. http://t.co/QAhs9xDyDf,1
1824,Searching for a new job is not easy...,0
8549,So accepted my job and started training and I friggen get offered another job today crazy,0
9122,So my dad got laid off today from his job...,0
105,on a brighter note I got hired today so Im stoked n I start tomorrow,0
4869,Anyone work at a show place thats hiring and pays more than $8.25??? #NeedThat,0
715,Apparently I am still working with Avalon honda when I was fired a month ago. I just received a message from... http://t.co/T8ybKo0J2c,0
4109,Fuck yes got hired at Eskimo Joes. I will not miss Oreganos one bit.,0
2560,Looking for an opportunity to position yourself for a career in the professional sports industry? https://t.co/O8eTCCnVLE,1
5311,i know there is a link between weight gain and unemployed-ness. as i am sitting here eating a whole box of cookie crisp #smdh,0
4477,Whose hiring!?? Im looking for a new job tired of the same bullshit everyday from people who arent even my supervisor but 2 hrs a day.,0
3716,Looking for a promotional opportunity?? Quick path to Production Manager position! https://t.co/6bnynNTPZz,1
4772,If anyone knows anywhere thats hiring please let me know. I dont want to be an unemployed person that sits around and collects a check,0
7494,i am unemployed.,0
7555,Looking for work?  Are you unemployed?  We are now hiring. http://t.co/uwCbHWfUuh http://t.co/ryNj95gBih,1
8973,Looking for a #Healthy #and Hunger-Free AmeriCorps Position. Application Deadline: 8/26/15! #jobs http://t.co/mKWTub0gOM,1
2099,Looking for new challenges? On @Hired_HQ the best #rails #python #javascript companies compete for you. #railsconf http://t.co/vlLcjfTocy,1
5829,Thursday is 8 months since... Its been quite a successful recovery so now time to find a job again. Any tips about anyone hiring?,0
3784,I am now officially unemployed lol,0
1692,I quit my job yesterday &amp; got a raise today :),0
1098,Looking for a #remote position? We are seeking a #Category Manager for an #IT division #jobs #categorymanagement http://t.co/d3ahhLkGfZ,1
3914,#Accounting #Job in #Milwaukee WI: Accounts Payable Coordinator at http://t.co/TqEt5Bf00c #Jobs #TweetMyJobs,1
8644,Anyone know who is hiring? Still unemployed stressing me out :/,0
6088,@Lawwren__ We saw that you need a job we would like to hire you To become a part of or team now go to this page @_YouAreHired_,1
3869,Jk government Im unemployed,0
5168,Recently laid off? Turn #lemonIntoLemonade and build your own #enterprise #giant with @softwaredevin https://t.co/Vg71rYVKBV,1
5816,Im looking to quit teaching after 18 years of being an educator Im looking for my niche? Anyone out there hiring? #myniche,0
1140,I got laid off from work yesterday need a job asap near Indianapolis IN can start tomorrow need help #jobless #helpneeded,0
5522,RT @jonfisher: Hey guys. My position was eliminated today and I got laid off. If you know anyone looking for a designer / project manager…,0
7138,Now that Im unemployed for the first time in two decades its time to start focusing on my true love. Becoming a Patent Troll.,0
