id,text,class
997,Interested in a #job in #Dallas TX? This could be a great fit: https://t.co/lbGcop8336 #NowHiring #GetHired #Clerical #Hiring https://t.co/zXqk4P1Lu6,1
5876,Citi posted a job you might be interested in: VP Investor Services - Private Equity (Ohio) - Columbus Ohio Area US.,1
2577,Looking for a Part-Time Weekend position? Come be a Vet Assistant! (Cinnaminson NJ) http://t.co/42xUBeq9tM,1
2003,I recently took a job cleaning houses a few days a week. Now on my days off I am slightly obsessed… https://t.co/rmcxrq5cWL,0
8938,Laid Off? Start a - Work at Home Business in 24 Hours or Less-  http://t.co/S9RC3xCgRY,1
73,I was laid off last fall. My heart goes out to those laid off from @IrrationalGames recently.,0
5099,I quit my job earlier this week... What should I do now,0
6851,Dam I got fired today! Smh who hiring?,0
4443,Anyone know any jobs hiring ???,0
3284,Looking for that perfect job? Download the BlazeJobs app now! #okcjobs #job #nowhiring #getfiredhttps://t.co/fSivfOKPmx,1
7711,@johnurschel Im searching at the Development Director level in MA. I was laid off in January.,0
7544,Job searching is never easy but anybody who knows me know I wont be unemployed for long,0
2500,Interested in a #job in #Redmond Washington? This could be a great fit: https://t.co/GVTiIwc1QJ #NowHiring #GetHired #Manufacturing,1
2733,#Job #Hershey Cashier: Swatara Position Purpose: Cashiers play a critical customer service role by providing c... http://t.co/rIxR1Sz3ft,1
2921,I got the secretary position and was reelected for the Public Relations committee for my sorority tonight ahhh Im doing the thing!!!,0
751,Full time/part time positions available at cricket wireless here in Birmingham. If anyone is interested/looking for a job message me.Thanks,1
2277,Looking for a Career change? Growth Opportunity? Salary plus Benefits (Los Angeles) http://t.co/UDcPchw9 #LASocialMediaJobs #SocialMedia ...,1
5081,Why do I have the worst luck with spas🤦🏻‍♀️ I been at my new job for 2 weeks and my boss just got fired so we have no manager and were locked out of our booking system so we can’t see or make any appointments it’s the hottest mess 😂😂,0
9372,Top Story: Looking for a great career? Get Hired! https://t.co/1vxCFQSFja  #jobs #trending #jobsearch #career #job #gethired #hired #job #RT https://t.co/8blxHGHYZ1,1
3906,#Accountant #2 needed in #NewHaven at Yale University. Apply now! #jobs http://t.co/Y6oc5vqa0d http://t.co/8InrvgJVpo,1
2153,Searching for #work in Columbia SC? Send your #resume to Palmetto Baptist Columbia SC. http://t.co/IhFw5nWjEH #gethired,1
7579,Here is an opportunity to help in Redding you may want to be a part of. Check it out. http://t.co/A4ypUpk5Hm,1
9553,Anyone looking for a job in insurance? We are looking to hire a customer service and agent position. If you are... https://t.co/HvWGoXC8nJ,1
9404,I had a dream that Google rehired me to a more awesome position that I had before. Then I woke up and realized that Im still unemployed.,0
55,Wow great economy I have just been laid off my second job this year. #Obama #economy,0
496,I was fired from an amusement park job before starting my first day. MT @SVbizjournal: My worst summer job was __________________________.,0
6831,Heres a work-from-home opportunity to explore your passion for #fitness &amp; #nutrition. #hiring #careers #BeTheForce https://t.co/sdzyNSXmEe,1
8671,Looking for a Fun and Flexible Work at Home Job? https://t.co/Y3x9ETFGbY #Moms #Jobs https://t.co/xC5q3jyFNf,1
8633,UNEMPLOYED ? sell someone elses products http://t.co/4tQ8OWO0O2 http://t.co/0hdE2gVztr ways to beat economy info news links ideas,1
6135,First day on my new position and mid day thru it all my boss hands me a beer. Life is good!,0
9006,I applied for a higher position @ work &amp; Im up against these talented seniors in college. I now have anxiety &amp; I want my rejection ASAP,1
5556,Stagnant?Im a highly skilled white collar worker &amp; I cant even find a damn job after being laid off! A nation of homeless ppl is coming. https://t.co/064d1cMiUq,0
7100,Soon to be unemployed. Hit me up if you need music. Heres a sample of some non-chiptune stuff Ive done for hire. http://t.co/HH3AN969D9,0
6402,I officially get laid off from Wells Fargo on the 10th. I thought theyd keep me around but I guess I was mistaken.,0
2523,Looking for a rewarding and unique experience? Apply today for our Live-In Overnight Residential Aide position. https://t.co/id95nvBBDE,1
6673,Lost my apartment car n job n pregnant all at the same time and mo one cares but no one cares at this time adoption.,0
334,I am looking for a digital marketer that has run a marathon and worked on the Obama campaign. Any thoughts?,1
1352,Interested in a #job near #Mesquite TX? This could be a great fit: https://t.co/C5lequ0zFW #Labor #Hiring #CareerArc,1
7194,Looking to make some supplemental income? or quit your job? Sandy Sembler is the woman to show you the way. http://t.co/4nKS3Bhgck,1
7619,Here is a good job opportunity for you we have the easiest surest and the most effective way to earn mo... http://t.co/bcBYuDP2kV cssp,1
3931,#Amazon is looking for a Senior #Financial #Analyst - IT Procurement apply now! (#Seattle) #job http://t.co/OUM6DfsNhY,1
3502,Got another 2 interviews this week but i really think i got this position i really want as a substance abuse counselor. Patiently waiting,0
4066,I got hired at a job yesterday but Im quitting today because a better job came along does that look bad?,0
6516,I applied for a server position. I am still waiting.[Click to Vote!]   - lol,0
4116,I  put in my notice today at one job and got hired 30 minutes later to another 😁😁😁,0
6213,Tesla Motors posted a job you might be interested in. Product Specialist - Beijing Suburb China CN via LinkedIn http://t.co/lUYRhCNYUR,1
7985,I got jobs for you unemployed hoes that may be interested.,1
6470,I am currently Recruiting for CDL A &amp; B drivers for positions in the Worcester Boston and Southern New Hampshire area. All drivers need to…,1
1235,Here is an opportunity for each of you to get some work in the off season.  Practices are… https://t.co/uCqSXYwBpb,1
2406,Does anyone know anywhere in denton thats hiring? Help a sista move out!,0
5742,I seriously spent $10 all weekend. Being unemployed has been the best thing to happen to me in months.,0
4091,Lol not sure why but today I got hired for a real job,0
8446,Searching for a new position? Be aware of current strategies and trends for a successful and effective #jobsearch. https://t.co/grNGZtuJo4,1
8318,So excited to start working. This is the first time Ive been hired. Yeah worked side jobs dish washer at a bar coffee grinder at a cafe,0
7614,Here is a great local job opening. If youre interested you must act fast though - the closing date is next... http://t.co/XvU6QFQ5fm,1
6823,Interested in joining a workplace in which you truly can make a difference?Travelers Insurance might be it!https://t.co/6eN07r8OK3,1
344,I am looking to find a fellow wine fan who would like to collaborate on some blog work.  DM me for details.,1
1185,2 weeks ago I got laid off 2 weeks later I got 2 jobs paying more than the one that laid me off! 😁😳,0
3725,Looking for a pro bono project? California Rural Legal Assistance needs volunteer lawyers http://t.co/NLuU8fJ5P2,1
2317,Oh boy... Now I can change my job occupation from student to unemployed ...Oh 21st Century you are THE BEST!,0
7459,Now baby girl have dumped me. She no longer wants me. Im no longer hired. She says that Ive been fired.,0
781,Our Consumer Insurance Department (CID) is looking to hire a Manager Inside Sales Position. To learn more about this opportunity visit...,1
1117,Searching for a new career? Visit our open positions today! http://t.co/JAV4yVgPA3 #MilwaukeeJobs #Jobs #Milwaukee,1
4926,Well I just applied for a few jobs to day and I hope I get hired so I can get more money coming so I can afford to have a boyfriend.,0
1080,Well I am actively searching for a new job.,0
9434,So I had an interview today. As an exercise they had us get in a circle and interact. This dude said he was from Dallas so naturally I started shittalking and then I found out he was one of the hiring people in disguise. In short I’m still unemployed,0
8112,Ashoka posted a job you might be interested in. General Manager Youth Venture - Washington D.C. Metro Area US v… http://t.co/rHJUftmNOL,1
7119,Hell yeah I got the job! :) It all started thanks to http://t.co/9RhBgP5osj #unemployed #resume,0
1746,RT @erinannie: How many times have I been laid off? The unemployment commission didnt issue a new PIN. They reactivated my old one. Pat…,0
8954,Looking for a part-time job with flexible hours? Avesta has a part-time job position for a Background Review... https://t.co/TqmVvliq5K,1
9530,Anyone in the market for a new job??Front Desk Receptionist positionOmaha Childrens Clinic is seeking a... https://t.co/cUOJTuo0Vi,1
7666,Yay. Got laid off today.. Now currently jobless.. Sweet..,0
1534,Im not fired btw but I have a job interview next week becauSe this guy is FUCKING crazy lmao,0
6884,Heres an application to be a sandwich artist RT @xmasape Coach Shanahan youre fired http://t.co/nK7yvFWTo3,1
937,Today I got a paid summer lab position bought a suit got to see my family from CT and got a new car!!! Its been a damn good day.,0
8964,Looking for a fun career &amp; love fashion? Clothes Mentor Dublin is NOW HIRING for ALL FULL &amp; PART TIME POSITIONS -... http://t.co/UOUVm8QSfL,1
4509,IBM posted a job you might be interested in. Intern-Recruitment - Gurgaon India IN via LinkedIn http://t.co/QdwHOGJMlN,1
7820,I recently quit my job to bring in $5641 from my phone PRESS THE LINK INSIDE BIO to do the same https://t.co/tQIRjgYOzB,1
3555,Eww. The Job IS workplace Survivor and it looks like a horrible TV show. Unemployment is not entertainment.,0
4481,I want a job so bad  whos hiring ???,0
6542,Sooo i whipped my managers ass with a wet towel today and got fired &lt;&lt;&lt;,0
1937,ENTRY LEVEL POSITION: Must have 4 year degree &amp; 57 years of professional experience. Great way to gain experience! https://t.co/2vWjhbA9MZ,1
1406,Unemployed Under-Employed Unhappily Employed? Find jobs &amp; career solutions on LinkedIn in JCD The Job Seeker &amp;... http://t.co/EC9IzitRoC,1
2537,Looking for a postdoc position to study metabolic and/or tumor immunology? Childrens National Medical Center: http://t.co/amnsldR5GS,1
7028,Lost my girlfriend and job in less than 24 hrs best day ever :),0
1600,Looking for a job? Verizon aims to add 300 full-time positions at Huntsville call center https://t.co/77sPk7PKXe https://t.co/vsqBVCLkKG,1
750,A friend is looking to hire an entry level marketing position. Let me know if you are interested. #mnjobs,1
3800,Im losing my mind. I miss waking up early and doing shit. #unemployed,0
3923,#Albany #Job Field Clerk: Selkirk Job SummaryInspect and repair refrigeration units. Primary Activities and Re... http://t.co/TX5kN84wzW,1
7706,I might be getting laid off again and this time Im not going back so if yall wanna let a girl live with you in ATX while I search for jobs,0
5743,Tomorrows my last day of being unemployed... what to do what to do?,0
8437,I am job searching for: Work at home jobs! http://t.co/4tgcXWg6JK — Walker Inklebarger (@Walker_marocliv)... http://t.co/4NQD1WxsLY,0
867,Job Hunting? 160+ Openings at Meetup N.Y. Philharmonic and More #Tech: Unemployed underemployed or somewher... http://t.co/OMxfzVWZ06,1
9324,Im searching for combat boots. @SettingSkyline hipster school has converted me,1
4291,#jobs #unemployed Internal Medicine - Physician: Integrity Locums - New York City NY - Part-Time to Full-Tim...  https://t.co/Pol0ZPn9st,1
2712,#Job #Baltimore Seeking __workers/ Assemblers/ production type Position ~$21.50-$21.50p/h: We are seeking 26 m... https://t.co/BX8eoUKEAJ,1
4726,And not even after a month of unemployment I am a working man again,0
8166,Ok.Im job seeking.Not currently working. Ive been told by hr pros recruiters to tell my network friends FB. Didnt tell LinkedIn. (1),0
8768,Looking for a Part-Time or Full-Time Job? Let Patch Help http://t.co/Zdnwr90KZL,1
3570,PRAISE JESUS AND THE LORD GOD after a MONTH of unemployment I. HAVE. A. JOB!!!!!!,0
2227,Unemployed for a month now. I feel like such a bum.,0
6231,Heres an opportunity that you wont want to pass up: Supervisor - https://t.co/yuUf7Klzwq #Retail #Tampa FL #Job #Jobs #Hiring #CareerArc,1
535,Also man dude I dont know what to put for reason for leaving. I was fired for being tardy too many times.,0
9548,Know anyone for this job? Cloud Architect permanent position in Milwaukee WI (BP) in Milwaukee WI https://t.co/szPr0U7jDu #job,1
2738,#Job #KansasCity Bakery Clerk- Shawnee Price Chopper: Shawnee This position is responsible for preparing and p... http://t.co/AJ0IFOBalC,1
3557,Now I have to figure out what #book Im going to #read next... I need some #inspiration for when I finally find a #job. #reading #unemployed,0
4280,Two new rts join the family after financial and mental health debate. Autumn and Drizzle are here to stay #unemployedbiograd!,0
2128,Searching for #work in Omaha NE? Send your #resume to Heartland Automotive Services. http://t.co/eQJyD9yNVV #gethired,1
8432,I am job searching for: Work at home jobs! http://t.co/4tgcXWg6JK — Walker Inklebarger (@Walker_marocliv.... http://t.co/ZOxEelZTNL,0
8878,Laid off? You may qualify for training programs funded by the U.S. Department of Labor: http://t.co/Nbr0iIZ63L,1
8843,i got hired at journeys almost 2 weeks ago and the manager still hasnt given me my schedule or told me when i start https://t.co/2YMXeWXEl3,0
3924,#Albany #Jobs Data Entry Clerk $22/HR) - (Albany): 50 Immediate Openings for Data Entry Clerks. We offer compe... http://t.co/L9ZXksjxwd,1
9357,Just got hired at Camp Bow Wow. #Sweet.,1
5267,Today is #EqualPayDay .Thanks #ObamaI will be more exited if I wasnt #Unemployed,0
6284,Tesla Motors posted a job you might be interested in: Delivery Experience Specialist Paris - Paris Area France FR.,1
7663,currently 4:15 sweating my balls off and still laid off,0
801,I am looking for a sales job or sales trainer position in Dallas.  Multiple Presidents Club Winner #hireme #salesjobs #careercorner,0
7525,Currently unemployed fuck the max but Ill be back  https://t.co/6pf6dxaxL4,0
8975,and its this endless feedback loop of feeling worthless bc of unemployment and being unemployed bc i dont feel im adequate for positions,0
1125,I am looking for a new job. give me ideas,0
2261,RT @JPCVServices: Looking for a new job in 2016? If so are unemployed seeking internal promotion or looking to move company?,1
7255,I got fired today.. Fml,0
3309,Got fired today..,0
1639,Are you seriously searching for a business opportunity so that you can quit your job and live life on your terms?... http://t.co/8as6A3QcNq,1
8918,Laid Off? Start a - Work at Home Business in 24 Hours or Less-  http://t.co/9YBzU0kH6C,1
2210,Im now unemployed. This feels odd.,0
7252,I got fired from my job today. But thats ok because the place was very ghetto,0
1073,I am searching for a job in helping clean businesses offices or home @lexijablon @lrotts http://t.co/Em2sdu6pK5,0
9343,Tomorrow Im going to a conference for my business internship that I still dont know how I got hired for??? What is going on this weekend,0
2748,Searching for a hard working individual with beer and wine knowledge. Part time position. Please… https://t.co/3K9V3hPv3T,1
8945,Laid Off? Start a - Work at Home Business in 24 Hours or Less-  http://t.co/cAJziZdcqD,1
740,We are hiring! If you are interested in a part-time position either serving or driving then send us a message or call 848-8777.,1
2127,Looking for a #NewJob? #CareerCast has all your #Job and #Career needs at your fingertips. https://t.co/iG4z5uHE7u #CareerAdvice #GetHired,1
1337,Interested in a #job in #Mesquite TX? This could be a great fit: https://t.co/yF8nC10Bbg #Retail #Hiring #CareerArc,1
975,Interested in a #job in #Richardson TX? This could be a great fit: https://t.co/G5ziGMNp0k #NowHiring #GetHired #IT #Hiring,1
2268,Looking for an opportunity to work for a company that positively impacts student lives? http://t.co/KVs0e8SEBN #SeattleJobs #tempjobs,1
4920,Anyone looking for this kind of work? RT @JobrepUS: HVAC Technician - Pinehurst NC #job #hiring http://t.co/fZX4urJl4F,1
2114,Looking for a new #career? Get Hired By the BEST event May 4. Award-winning employers. Register today! https://t.co/6TXkU51LRw #GetHired,1
1344,Interested in a #Retail #job near #Mesquite TX? This could be a great fit: https://t.co/uD484Gxn8y #Hiring #CareerArc,1
6265,EF Education First posted a job you might be interested in: Business Controller - EF Corporate Solutions - Shanghai City China CN.,1
8630,UNEMPLOYED ? sell someone elses products http://t.co/WJooNxvR72 http://t.co/NDnSCwsqvZ ways to beat economy info news links ideas,1
280,Got fired as from my nurse job today,0
5705,Just got laid off... am I too late for recruiting? http://t.co/2585gBm2qc,0
1072,Lost my job 7 years ago and have not been able to get another I am searching for a job but dont have a car to claim as my own. for a job,0
9335,I am looking for a Graphic Designer with experience in Project Management and Digital Design,1
4047,Searching for #work in Charleston SC? Send your #resume to 1st Choice Contracting. http://t.co/anhZEbnjQ2 #gethired,1
7363,I quit my job!Quit my job! I am done with legal seafoods and I could not be happier to be unemployed at the moment! http://t.co/9o1dG1D7kf,0
6279,Heres an opportunity that you wont want to pass up: Supervisor - https://t.co/ANP5ujxBWp #Retail #Mesquite TX #Job #Jobs #Hiring #CareerArc,1
5765,Recently Laid-Off or Unemployed? Start a Business! http://t.co/zK2SDBVYXv,1
9182,I lost all my friends and now my family too. I am so very much alone and unwanted right now. Bring an unemployed loser sucks.,0
899,Looking for a change?? Search for new positions in your area http://t.co/ThT7qNiQAV #OpportunityKnocks #WorkplaceDiversity,1
2112,Looking for a new job? These ones pay well and dont require higher education: https://t.co/HLXvWvgrf5 #success #gethired,1
8568,Terrible day today ex girlfriend got hit by a bus and I lost my job as a bus driver.,0
8038,Need a way to make some extra income in 2015?  This may or may not be what youre looking for. http://t.co/uzEf3KU2OP #unemployed,1
8646,Unemployed or underemployed 23 weeks or more? http://t.co/fEUDOqPUfT http://t.co/MHSCxDUT49,1
1265,Undergrad interested in library archive or museum work? Heres an opportunity for you: https://t.co/v8EDjM7hyS @UO_UROP @UOregonLibNews https://t.co/Ki2hgtY6cG,1
9402,This is my last full week of unemployment! Ill be so happy when I see my first grown up paycheck! #someonefinallyhiredme ☺,0
5371,In a favorable position where Im now encouraging loved ones and giving out jobs. Bless the lord,1
8416,Fired? Laid Off? Join me TODAY and make money FROM HOME! - Classified Ad http://t.co/zKoS2EG3Ud  via @sharethis,1
8712,Looking for a new career opportunity in 2019?  Join our Consumer Leadership team for a Career Fair on Tuesday December 18th from 5:00pm-7:00pm.   Learn why BOK Financial was chosen by @Glassdoor Best Place to Work in 2019!  #LookatBOKF #BPTW    13230 W. Little York 77041,1
2299,Looking for an Entry-Level Job Near Nanuet? Sales Positions Lead Nation in Availability https://t.co/mZFXUrFcmf,1
6817,Yahoo! posted a job you might be interested in. Network Quality Optimization Specialist - Greater Los Angeles Ar... http://t.co/DZr7QXCRyf,1
8967,Looking for a #Driver/Warehouse #Position - Plumbing Wholesaler #jobs https://t.co/iPh1812fI4 https://t.co/67RN2cL1VE,1
805,Currently seeking a position in Event Planning or Marketing. If your company has an opening feel free to message me :),0
1708,Saw a woman &amp; daughter asking for help outside w/a sign saying she was laid off. I gave her all my cash. Then I realized Im unemployed too!,0
3221,Got laid off and paid today. W.e. Im in the union I start working in the next 2 days.,0
8324,After helping people get hired in now Im jobless. SoIm looking for employment. Funny how things change in so little time. Still thankful,0
3552,my best-friend  left to NY. Temp position is now open. Auditions are monday. Plz bring your resume 3 letters of rec and favorite dessert,1
7960,Ive been late everyday this week lol I quit. Im screwed,0
3288,I am dead ass never getting called back into work just to think I quit and in the end I got fired,0
2058,Looking for a New Job? Interested in a Career Change? #CareerCast Has Everything You Need and More! - https://t.co/eHENJJMqu4 #GetHired,1
1091,I Am Searching For A Dependable Driver For My High School Student Jobs in Houston TX #Houston #TX #jobs #jobsearch https://t.co/FtTEu0zZUe,1
7012,Me losing my job today https://t.co/TH4NOV0QSp,0
8429,Edmond OK - Home Cleaning position - Job Description I am searching for independent contractors to clean newly... http://t.co/Z8p8fka0tm,1
5516,Laid Off From Work? Watch This FREE Video And Learn How To Make Money Online. #workathome   #motivation. https://t.co/3pcGB0MSit,1
8039,I am searching for a recruiter for a contract position with a length of time not to exceed five months.  The positio…http://t.co/7dH545Pvst,1
3616,I Quit My #Job To Be A Travel Writer And Now Im Broke And Unemployed https://t.co/dIsxDcNC4y https://t.co/qj7yCSqjWB,0
745,Are you interested in becoming a #valetattendent then youve come to the right place! Check out our website for open positions today! #jobs #jobsearch #lotattendent #parking #valetjobs #valetattendentjobsApply here: https://t.co/1WrwUHEOLU https://t.co/xj2I0tPa8p,1
1419,Unemployed Under-Employed Unhappily Employed? Find #jobs &amp; career solutions on #LinkedIn in the Job Seeker &amp;... http://t.co/y843fQJ3yx,1
9462,Also with the season now being over Im technically unemployed anyone got a summer job I can do? I applied at Mighty Taco today #fuckthat,0
5294,I feel pretty badass for not paying any income taxes right now. Im ganna keep this up until I get caught #unemployed,0
3301,Gave my supervisor a evaluation today also I got fired today,0
9536,Anyone living in Greensboro NC looking to work for a great company? Check out these positions: https://t.co/z5qHCI0lQQ,1
2709,#Job #Austin Tutor Positions-Sylvan Learning(South Austin) (South Austin): Sylvan Learning is looking for dyna... http://t.co/fQYfrKO0rm,1
8772,Looking for a paid internship in DC? AFFs looking for a detail-oriented Development intern #intern #jobseekers  -http://t.co/xTrQlNlc0L,1
8047,I am looking for someone with a CCNP or CCDP. This is a direct hire position.,1
6967,I was fired for supporting Trump. https://t.co/7I11nmKe7b,0
2704,#Internship #finance Get in on the Hottest New Position -Online &amp; Social Media Marketing-Inte... http://t.co/aRguZr05yL #California #USA,1
2528,Looking for a part-time position? An Onoclogy practice needs an Infusion Nurse 3 days (24 hours) a week. https://t.co/5KobuhqBMr https://t.co/jLISb3MjAA,1
2538,Looking for summer employment? Colorados Glenwood Caverns has open positions: https://t.co/cUXA69Uhb0 https://t.co/5LJQhAcXAq,1
1949,I recently started working at a new job and now I have weekends off and a normal schedule and I don’t have to dread the weekend anymore,0
3920,#Adjunct #Instructor - Communications needed in #Richmond at Bryant &amp; Stratton College. Apply now! #jobs https://t.co/AVNYYaqH6Z,1
4645,So I quit my job today guys..ITS LIT,0
9229,Anyone in Hampton Roads looking for a full-time front-end developer position? #jobs,1
8460,I am Looking for work in fixing computers or security jobs.https://t.co/LqdYBhR9yi#needajob #ITjobs #hirefriday #freelance,0
405,#Job #NewJersey Client Services Director – Account Management CPG: NJ-Newark Full Time Permanent Position for... http://t.co/2Z2apfYPYF,1
7243,Ha! Yep - the legs go all the way to the top. Apparently they have been there for quite a while now. Actually - am I retired not unemployed?,0
5617,Trying to find a job while having a job and trying to keep it a secret from people you work with is quite the task..But I am making progress,0
3983,Hey lucky me!! I got fired today with no notice for the sole reason that the owner hired a friend. Fucking Awesome!!,0
7495,Today is the first time since 2006 I am not under contract as teacher with SJSD. Weird feeling. Im technically unemployed right now! Holla!,0
8627,Unemployed or Looking For a Way to Make Extra Money? http://t.co/MzhJsqe8sN,1
8806,I am unable to be HIRED Bc of my conditions in my state. It’s A LEGAL LIABILITY to hire me. Ffs. What do I do now? https://t.co/NN3S2LsYf7,0
2022,Im getting fired because the people you hired 6 months after me want to work full time? Ive been asking for 9 months go fuck yourself.,0
3136,I quit my job and my car broke down all today so now Im a broke bitch with no whip. smh life.,0
4473,Does anyone know whos hiring?!?! I need a different job,0
3366,So it seems like I was fired and re-hired and didnt even know it or some shit.,0
8489,My job interview went well today kinda said fuck as I walk away and I think the dude heard it pray for me,0
5679,Worst. Day. Ever. Thanks to Obama care I am now unemployed. Got laid off from the clinic and my car got hit. Everything happens for a reason,0
2746,#Job #Milwaukee Sales Opportunity (Waukesha): Position Information Position: Automotive Program Sales Consult... http://t.co/fh6DujIP3Z,1
4956,I be applying to jobs I dont even qualify for and get hired.,0
1062,Currently looking for a job. Can anyone help me out? Im open to doing porn. Please send amazon gift cards if you guys can,0
7973,Anyone that an aspiring actor unemployed or just had tomorrow off.... Come to the beach,1
7565,Employed looking for a new job? Unemployed searching for a job?Need a #Resume?  Call 414-533-5818. https://t.co/yx3gflW6KH,1
