id,text,class
727,You might be just what we are looking for - consider applying with us - we are hiring for a lot of positions! https://t.co/Ol9UGuzhln,1
9294,AND UPCOMING POSITIONS YOU MIGHT BE A GOOD FIT FOR!http://t.co/h4ye15F7sO,1
2724,#Job #Flint (USA-MI-Flint) Security Officers A 15 Positions Needed Flint M: Security Officers (A) 15 Positio... http://t.co/kjhRsJ9oBg,1
8884,Laid off work and searching? Try this: https://t.co/WrjYIvDQSP #jobhunt #unemployed https://t.co/gD2UigHtyv,1
7098,My fav thing about being unemployed again is that my dogs prefer to hang out with me rather than my employed brother.,0
8334,Im already hired at my new job just waiting for my background check then Im good to start😌,0
6232,Amazon posted a job you might be interested in. Recruiter - Hyderabad Area India IN via LinkedIn http://t.co/BSVn8aocRs,1
1112,I am looking for #JavaScript devs for a position in Austin. Angular bootstrap. Grunt and bower. #javascriptjobs,1
1424,Unemployed Under-Employed Unhappily Employed? Find jobs &amp; career solutions on LinkedIn in JCD The Job Seeker &amp;... http://t.co/cUJxN5v5W8,1
3148,Today I quit my job and immediately had some retail therapy.. because logic 🤷🏻‍♀️,0
2076,Looking for #career growth opportunities? Join GE in #Budapest #Hungary:  Lead #Accountant  @GECareers http://t.co/iTeYZMs09E #gethired,1
1975,My boss really pisses me off I dont even know why I started working here again. Hopefully I get this new job,0
799,I AM CURRENTLY SEEKING A FULL TIME NIGHT SHIFT POSITION IN LA -- Have any suggestions?,0
6549,I get hired on the first fired on the second,0
2752,i am looking for someone who is experienced with designing and making flyers. Please hit me up i have some work to be done. will pay,1
1359,Interested in this job? Take a look: Private Equity Associate- Pre-MBA in Connecticut http://t.co/IAdZ6JRqEO #job,1
8657,I was late for work &amp; my boss just called me &amp; fired me for the day FUCK YEAH 😀😁😀😁😀😁😀😁,0
3537,Applied to a job a few days ago.then it was reposted as two separate positions.CAN YOU SEND ME A LETTER OF DECLINATION,0
3207,Are you retired laid off looking for extra income? Join our Jan 13 webinar - Starting an Encore Business! https://t.co/1mJlsr3NWu#PCCSBDC https://t.co/pAyVYhe2uo,1
6793,55 or older? Elder Services of Cape Cod has immediate openings through their Bridge Back to Work program. http://t.co/1DSlpkZvVu,1
2694,#Columbus GA #Retail #Job: Retail Store Positions at CVS Health https://t.co/tG9OZatDVl #Jobs #Hiring #CareerArc,1
8802,Seriously considering going back to universal for a job since I am in the system hired for attractions 2 years ago. Job at Harry Potter!?,0
4151,Yes I am currently unemployed. No I am not some bum trying to cheat the system. I was sick and couldnt work now Im trying please be nice,0
4115,I got hired again to babysit and made $30 I FEEL RICH!!!!,0
7594,JPMorgan Chase &amp; Co. posted a job you might be interested in: Executive Admin Asst - COMMERCIAL BANK - CCB - NY NY - Greater New York Ci...,1
6290,Google posted a job you might be interested in: gCareer Program 2015 (Japanese-English Bilingual) - Within 23 wards Tokyo Japan JP.,1
2136,Searching for #work in New York NY? Send your #resume to New York City Health and Hospitals Corporation. http://t.co/jCQzQhCYYx #gethired,1
8885,So getting laid off kind of sucks! Related anyone hiring?,0
5550,Laid off from Golder Associates or URS? Find your place with Group Delta! http://t.co/A8x08Zv59d,1
5334,Unemployed? To see open Social Media positions use The Social Web App. http://t.co/p2cUeub9bH #JobOpening #Jobs,1
6228,GE posted a job you might be interested in: Customer Service Engineer Job - Bengaluru Area India IN.,1
8655,God fired like 2 hours ago from the restaurant . But the warehouse called me back to work rn 🙏🏼 God out here watching after me,0
2846,Looking for an opportunity to work with children?  Open House today from 12-5pm at 2288 Second Street Pike Suite 1 Newtown PA 18940.,1
1197,@LetGoBeFreeDoU.I know I got laid off not fired but w/ all those office jokes I do here abt getting fired really shows the irony in life.,0
9165,We are hiring! Retweet for the unemployed friends! #MyAmericana,1
2247,@CoolerThan_Cool Boyyyy subway just fired my goofy ass today. So right now Im unemployed until I workout a schedule for DD.,0
1441,Unemployed? No job? Looking for employment?  Now hiring! http://t.co/uwCbHWfUuh http://t.co/cxOeKSTG1o,1
5079,I been out sick for like 4 shifts in a row... Im def getting fired 🙃 time to look for a new pt job,0
5078,I got fired from my job but I gets busy,0
1079,I am looking for a UI UX designer for a Perm FTE position in #Sacramento Do you know anyone? Reach out to me. 916-403-4076 #ITjobs #looking…,1
3572,I got the job!!!!! You can call me what you want but you cant call me unemployed!!!! Lol,0
3208,@E_Megas I am looking for freelance gigs. I was laid off a steady 3 year gig. This is the longest Ive been out of work.,0
2695,#CustomerSupport Agent III position open in #FortWorth TX. Apply Online Today! http://t.co/E6xB4dk8aI,1
7274,So the man over my manager at Papa Johns let me and two others go today -_- not as in fired tho but he fucking with my money,0
2947,I dont count me losing my job as a lose... Just lets me know God got somethin for me on the way. I jz need to be positioned,0
9273,An ideal job opportunity may be closer than you think. Review our active positions database. http://t.co/jVKEeR0qXQ #newyorkcity #jobsearch,1
1400,Unemployed Under-Employed Unhappily Employed? Find #jobs &amp; career solutions on #LinkedIn in the Job &amp; Career... http://t.co/Gs7XVm0VAU,1
5246,Been unemployed for awhile? Contracting can help you get back in the game: https://t.co/VKsHLP3Unh,1
3701,I recently submitted my resume to Sony... But they canceled the interview.,0
2135,Searching for #work in Fordyce AR? Send your #resume to Arkansas Department of Human Services. http://t.co/lson5LnyAj #gethired,1
6491,I just filled out an online application for the Oregon Football Coach position. I am personally taking apps for an assistant. #nobigdeal,1
9537,Anyone looking for an entry level Paralegal position? My firm is hiring! (and I cant WAIT for the spot to be filled!) hehehehe #ILoveMyJob,1
8611,UNEMPLOYED ? sell someone elses products http://t.co/yPvcE1jyTM http://t.co/JZnnJ2YzZx ways to beat economy info news links ideas,1
8155,So I am in the receptionist area waiting to be interviewed for a job I am not sure is legit. They are playing loud music in the interview rm,0
4989,Anyone hiring? Im trying to quit my job doing bodywork....,0
8895,Laid Off? 5 Simple Things To Do After Layoffs http://t.co/P785jpZOyT,1
2517,Looking to see who #PennState hoops has offered for 2015? FREE list of offers designated by position here: http://t.co/xBgLcZu1HT #PSUBB,1
6494,I am seeking a Salesforce Marketing Cloud (SFMC) Email Specialist for a remote work opportunity!  Currently this is a temp position but co…,1
5302,i have like $1 i hate being unemployed,0
4038,Searching for #work in Cincinnati OH? Send your #resume to GE Aviation. http://t.co/0yV5wVVZBK #gethired,1
8114,Wells Fargo posted a job you might be interested in: Mortgage Sales Assoc (safe) - Myrtle Beach South Carolina Area US.,1
3709,My new job has an office dog. THIS IS THE BEST PLACE ON EARTH. THANK YOU FOR BLESSING ME WITH THIS OPPORTUNITY,0
5117,This week I failed about 3 or 4 assignments my car broke down I started a new job Im sleep deprived and Im broke asf. But Im good,0
3909,#Accounting #Job alert: Controller | Robert Half Management Resources | #CLEVELAND  OH http://t.co/LrNHsZkkjr #Jobs,1
3913,#Accounting #Job in #HONOLULU HI: Controller at Robert Half Finance &amp; Accounting http://t.co/PxP1jX9E0t #Jobs #TweetMyJobs,1
1225,Here is a great part-time opportunity to work with a fantastic team! https://t.co/EB75E59hda,1
2860,Looking for job openings internships or work study positions? Check out Bearcat Central for updated information! https://t.co/agVV4QTDxI,1
5791,Currently Unemployed and looking to Expand your Skills?   #jobseekers http://t.co/MiJHlqV4mF,1
3609,Temp job was just offered. I wanted to take it but too far. Vehicle in shop.lost the battle but will win this war on unemployment,0
1707,Unemployment Benefits Explained: Like most folks who are laid off I have applied for unemployme... http://t.co/yLoBjocR1L #Unemployment,0
2690,#CareerArc #Retail #Job alert: Retail Store Positions | CVS Health | #Asheville NC https://t.co/FpCn79Z0tG #Jobs #Hiring,1
6602,my mom said I was gon get fired yesterday and I did today,0
8672,Looking for Temporary Employment? Temporary Solutions helps State agencies fill workforce needs http://t.co/Ezl4zh3uyK #ncgov #Work4NC,1
2185,The unconventional way I was thrown into #entrepreneurship - http://t.co/P4oVYjjm0O #entrepreneur #fired #corporate #unemployed...,0
2730,#Job #Georgia Trainer Plant Maintenance at http://t.co/MaYS1DgaSa (Cumming GA): SUMMARY: This position is resp... http://t.co/kCxvW9pnDH,1
4193,Currently unemployed https://t.co/vc4QKBPoVt,0
3274,Currently seeking a whole new staffeverybody fired,1
1214,RT @continimarco: InfoCert posted a job you might be interested in: Engineering Talent Network - Italy IT.,1
3742,Looking for a #Junior #Financial Analyst ? Acquisition &amp; Development Analysis #jobs http://t.co/Pdd5FFgec5 http://t.co/aE1QUXSzNs,1
2269,Looking for a job? Superintendent II - Wind Energy Group (IRC9674)Job Details at M. A. Mortenson ... http://t.co/WhG0hzJtru #green #jobs,1
2091,Looking for a new #career in architecture?  Get hired here by doing this one thing! http://t.co/O6ccG3AlV7,1
9166,Since Im unemployed again if anyone is hiring tell them 2 lick my but,0
346,On Friday we learned of a reduction in workforce and now I am searching  for a new opportunity. https://t.co/hfX15on1uo,0
6600,I Got Fired Today Fuck Little Caesars 👌,0
4974,I hate my job  anyone know of any places hiring ???,0
7170,Well. Now Im unemployed.,0
3356,Star Wars hired me as a celebrity endorser of their new products. I was immediately fired http://t.co/9MvRJ9n1Up,0
6221,Microsoft posted a job you might be interested in. Berater Systems Management (m/w) - Cologne Area Germany DE via LinkedIn.,1
2383,Who is hiring???,0
7241,I be dat hippy muhfucker unemployments what Im repping. Tell moms to quit the bitching Ill eat that meatloaf in a second.,0
8128,I am currently working I have a job interview Thursday and Im still handing in applications.  #Grind,0
2173,Searching for #work in Sunderland MA? Send your #resume to Property Star Services Inc.. http://t.co/DwR1sPjGna #gethired,1
2154,Searching for #work in New Bedford MA? Send your #resume to http://t.co/ag5jvXi98S Classified Ads. http://t.co/Yp9rjwCpi0 #gethired,1
5727,Ummm I just got laid off of work.....,0
8138,Currently looking for another job. If anyone can help me out please let me know.,0
7626,#JobAlert Interested in a job opportunity? Graduation Success Research Specialist @FIU http://t.co/Cfotgso5wY,1
7719,Finding A New Calling After Being Laid Off At 50 http://t.co/AYUDSi0a0P via @HuffPost50,0
2160,Searching for #work in Miami FL? Send your #resume to New Directions Staffing. http://t.co/CxCd7jW4HM #gethired,1
4676,I quit today my spirit was crippled by the man so i had to move around,0
789,I am currently exploring new career opportunities. Please contact me to discuss any possible positions.,0
1624,Looking for a skilled iOS developer who can play a leadership role in a startup. Pay &amp; equity. Please message me if you know someone.,1
4632,I quit H&amp;M on the 2nd day but I went in there yesterday for some jackets....yall think theyll hire me back just for the discount again ?,0
8072,Tatiyants Law is searching for a new Client Services Manager. To learn more about the position or to apply see our ad on Craigs List....,1
983,Interested in a #job in #PiscatawayTownship NJ? This could be a great fit: https://t.co/cjOSDPpnXa #NowHiring #GetHired #WebDesign,1
4999,Anyone know where they are hiring ??! Need a new job I hate mine already I have to patience for my GM !,0
9531,Any of you upstate SC people know of anyone hiring? Administrative Assistant property management or office positions?,0
995,Interested in a #job in #Florida 20266? This could be a great fit: https://t.co/6VohW9Jt7W #NowHiring #GetHired #Hiring,1
5719,I got laid off on Monday needing to find a job quickly also hoping my house~ https://t.co/EBlIQaTyhn #pray #prayer https://t.co/KK4e7zDX6b,0
3917,#Accounting #Job in #Raleigh NC: Dispatcher Mobile 7a 7p supplemental at WakeMed Health &amp; Hospitals http://t.co/UgLSpbe5uf #Jobs #Hiring,1
5995,Now #Hiring @Google is seeking a Software Engineer ARCore to join their team in #SanFrancisco Apply Here &gt;&gt; https://t.co/XdP58hOWem #engineering #JOBHIRED https://t.co/vSOQH6Li4f,1
888,Looking for a new #job? Check out these open positions! http://t.co/m1o5QoGS5L,1
2896,Being unemployed is awful. Im going crazy without a work to-do list!!!,0
3751,Looking for a job in #Newark #NJ? Supervisor https://t.co/gHawIDCDx6 #jobs #hiring,1
991,Interested in a #job in #Pennsylvania 526? This could be a great fit: https://t.co/Qifzt9Yt8F #NowHiring #GetHired #Hiring,1
3608,Well currently unemployed job hunting.  It sucks . But on a good note Im alive.,0
5121,Was fired from HS coaching job earlier this week https://t.co/BC2WA6vV6Z,0
4905,so is anyone hiring? my coworkers are laughing in the face of another coworker a black nigerian immigrant that practices islam.,0
6531,So got fired today wnt to go apply at one place and I already have an interview tomorrow #bossstatus,0
948,I have to go in tomorrow at 1030 for a try out but he didnt tell me what position or if ill be hired even after that or if ill get paid ok,0
9464,I cleaned up my house today because being unemployed I have no excuse for how filthy it was.,0
8682,Looking for a Job? Attend DeKalb Workforce Development Summit - September 22nd  - 26th 2014 http://t.co/Nb7mrGmu3c #constantcontact,1
3206,Looking for a new opportunity in Seattle as I was just laid off with half of Cheeseburger. Contact me or Shauna Swerland at GloCap with an …,0
6537,I got a job today 2s later I got fired,0
1444,Need to Make a Career Move?  Need a New Job?  Unemployed? @leezabyers Can Help: http://t.co/xCA4tEyvFa,1
6513,REJECTION: Received an email concerning the Production Worker position with Hillshire Brands. I was simply not been selected.,0
1900,Hall of Fame Trucking is #hiring Truck Driver – Class A CDL – Laid off from the oil fiel http://t.co/3270MSPJef #jobs #Amarillo,1
3170,@DeptVetAffairs I recently got laid off and I dont qualify for unemployment because I havent worked there long enough.,0
1874,Charlotte NC - Telecom Business Opportunity - RMH Telecom ConsultantsTired of Getting Laid OffTired of Working... https://t.co/pDjCdijBBy,1
7889,On anniversary of quitting all jobs that involve taking wads of cash home my friend asks me if I want occasional gig involving wads of cash,1
7898,my old boss was my friend before i worked for him &amp; now that i quit he’s my friend again except now we know each other super well. it’s cool,0
3118,Today I quit my job and found out I offically work at Agaci. Life is great,0
2115,Searching for #work in Centennial CO? Send your #resume to Overland Contracting Inc.. http://t.co/jQQeXj5ZP1 #gethired,1
8556,Today I lost my job my son is home sick without me &amp;&amp; Im sleep deprived. Keeping faith that something good will come from the hope I have,0
2340,Now I am actively looking for jobs in Manhattan and uggh I hate looking for jobs,0
5401,Just quit my job lmao anyone hiring ?,0
1941,I recently quit my job to start making $5641 from my phone PRESS THE LINK INSIDE BIO to do the same https://t.co/D99x6QDPaS,1
1579,Looking for a job a new career or more job satisfaction? 51 #Career &amp; #Job Affirmations. https://t.co/who9XKjYB6#hr,1
1057,My name is sam Working in a hospital I am not satisfied with current job I~ https://t.co/k3mlEM9XyW #pray #prayer https://t.co/qXljsQdCTh,0
8587,Unemployed or Looking For a Way to Make Extra Money? --&gt;&gt; http://t.co/OvRAR4rAEe,1
3753,Looking for a new career opportunity? As a #wireless manager you’ll lead an awesome team of #sales associates in #Derby VT. Apply today: https://t.co/PD10gr1sbX #Sales #Job #Jobs #Hiring #CareerArc,1
1847,I am looking for a position that will get me closer to where I was. Who has had success with resumes on video? #LOOKINGFORAJOB #Accountants,0
1830,I am seeking people who have professional service support businesses. Not people who believe they have a business by sales affiliate or ma…,1
3810,Everyday is my day off.  Unemployment is great!.....not really.,0
4463,Anyone know of places hiring??? I want a 2nd job! Im money hungry.,0
9289,you might be interested in: University of Miami School of Law Lecturer in Academic Achievement Position https://t.co/FjyEbJm5bw,1
4506,Microsoft posted a job you might be interested in. PFE (Premier Field Engineer)- Exchange - Israel IL via LinkedIn.,1
3280,Rescue coordinator fired: Teton County Search and Rescue is searching for a new coordinator after longtime... http://t.co/C2LfL41BMd,1
5358,Job Offer withdrawal: Hello. After being terminated from my previous employer I was offered a position at a ba... http://t.co/5w8hPeQgJJ,0
5146,This week: I had to take Atlas to the Doggy ER for some nasty shit you dont want to hear about. But I also landed another kick ass job!,0
7522,I am the operator of my pocket calculator.Also I am unemployed and have the worst quality health plan imaginable,0
4087,Got hired at a food truck today then worked 7 hours. Now I have something to occupy my time,0
8773,Looking for New Job or change in career? Visit Big Daddy Job Board at http://t.co/R0pt8AdIfc,1
6899,Heres a solution. Youre all fired. Apply at Kaleida.  https://t.co/QXytIYVV9K,1
5400,A little too tired of racism thinking of quitting. Is anyone hiring?,0
916,Got hired  at best by mobile last week &amp;amp; today I have an interview with FedEx for a customer service rep position! #needthat@,0
3152,Im #laid off and #looking for new #job opportunities in the #Chicago area.  Microbiology Molecular Biology scientist.  #recruiter  DM me.,0
907,Got offered a full time position at work which I took! Got a car yesterday &amp; if someone moves out before the 17th I will have my own place!,0
4884,With that being said anyone hiring? I can basically do anything and can work like 5 am-2pm every day because I go to work at 3. Hit me up,0
744,Looking to earn some extra money through the holidays and beyond?  The City of Miami has a position you might be... https://t.co/XhFjPitWZz,1
9142,Yesterday I got laid off and today when I went to put on tights they ripped. 😩😩😩 the struggle that is my life 😵🔫,0
4852,I think Ive been taking stupid pills. I swear I get thicker everyday I dont use my brain &amp; I didnt have much to start with! #Unemployed,0
4975,Anyone looking for a job??? Fitness 19 is hiring for a person to work in the kids room!,1
8642,Someone hit the light switch &amp; the power went out?..well that dude will be filing for unemployed as of tomorrow,1
7568,Unemployed? Are you searching for a Social Media Job? Use The Social Web App. http://t.co/p2cUetU69H #hiring #jobs,1
1574,Looking for a challenging new position and want to work with top tier colleagues?Look no further! Our Senior Facilities Infrastructure &amp; Energy Specialist position is for you!Learn more &gt; https://t.co/ne1qhHo2lc #sustainability #energy #projectmanagement #ACTJobs https://t.co/oeLv1McoSa,1
3124,I quit my job and 3 people have texted me since then saying they quit too.,0
3827,My mom tries talking shit to me but I dont let her cause shes just like me. UNEMPLOYED.,0
1834,I am looking for a #BookingAgent looking for great sales person For more info and to apply:  http://t.co/IjViG3EACn #jobs via @skillpages,1
707,Idk maybe its just me but I would hate ppl tweeting me constantly about a job I was fired from. Especially when Im not currently working.,0
9195,Today I made tiramisu in mason jars and I desperately hope its the nadir of my unemployed activities that could be on pinterest.,0
2413,Microsoft posted a job you might be interested in. Senior Software Engineer- Xbox Recommendation - Israel IL via LinkedIn.,1
1711,How can Ex-Non-profit workers receive Unemployment?: I was recently laid off from a non-profit and was informed ... http://t.co/tndpQOXu,0
5264,Girl you know Im unemployed trynna be fancy,0
2531,Looking for a Utility: We are looking for a utility player that can play more than 1 position on the field ...... http://t.co/gO2XVQ6vvS,1
8970,Looking for Work? Amazon Plans Job Fair for 50000 Positions - The Wall Street Journal #Amazon $AMZN https://t.co/ivmnk1bBm2,1
4782,Apply Today: Are you searching for a Social Media Job? Use The Social Web App. https://t.co/p2cUeub9bH #unemployed #jobs,1
5896,Now On my way to my first corporate job which I got on my own #blessed . NEVER GIVE UP !,0
2529,Looking for a part-time position for full time pay? (Tampa Bay) https://t.co/O1RXqVNc11,1
2121,Searching for #work in Carmel IN? Send your #resume to Cox Automotive. http://t.co/K3pIbfn7Zf #gethired,1
6801,Dude i fckin hate working at lil Caesars. Anyone know a place hiring?,0
8922,Just been laid off? What do you do now? Join us for the Real People Real Jobs Opportunity Expo! #sanjuancollege... https://t.co/H0aDo6Dwic,1
8495,Goin hard in the paint job hunting just filled out my 12th app today lol. Hmu if anyone knows of places hiring!!,0
8538,Job fair was hiring on the spot today so glad I went.,0
3222,Got laid off today... And then got another job 5 hours later,0
7117,So now that I finally have a job I am already realizing how much I loved being unemployed and laying on the couch from 1pm- 11pm.,0
382,Looking to make an extra income? I am not looking for employees I am looking for motivated people that will work... http://t.co/wjoaiRxb,1
1044,Literally not applying to jobs I know I will get hired for. #aimhigh,0
1436,Need to Make a Career Move?  Need a New Job?  Unemployed? @leezabyers Can Help: http://t.co/hwaFiCd9qZ,1
7514,Currently unemployed spending money I shouldnt.,0
3733,Looking to serve on a nonprofit board or grow in your skill-set as a current board member?  The Johnson Center... http://t.co/prSRdIGj0B,1
7714,Please pray for my favor in landing a job. I was laid off nearly two years ago yet have survive... https://t.co/uTPjqKdSs4 #pray #prayer,0
8444,I am job searching for: Work at home jobs! http://t.co/4tgcXWg6JK — Walker Inklebarger (@Walker_marocliv.... http://t.co/03CkKU7Sdx,1
9010,Unemployed? Use The Social Web App to see open Social Media positions. http://t.co/p2cUeusKjL #unemployed #jobs,1
9135,Got my heart smashed laid off and lost business to a crazy lady. And thats just within 24 hours. So Im eating my sorrows away,0
71,8 Years Ago… I woke up unemployed: 8 years ago I was laid off.  Friday the 13th was my last day at my job (get... http://t.co/p12SAfGOtP,0
7700,A1b: I was laid off &amp; finding new employment is difficult. Luckily I am in a position to go back to school. Others arent as lucky #hachat,0
1564,This morning I got a call from Walmart thats my 4th job offer this week I had to tell them I was no longer... https://t.co/Y9qMRo1BM4,0
9513,@CoryBooker @Teewrites4u Its a whole lot of suffering going on. People are unemployed ...Show me the money?!?!! I was laid off 19 months ago,0
4110,I got hired at both of the jobs I had interviews at today. I am going to vomit,0
1852,I AM LOOKING FOR A GRAPHIC DESIGNER FOR SOME QUICK PROMO FLYERS.,1
5290,my life now consists of greek yogurt lana del rey and spending 20 minutes trying to find the perfect twitter background.  #unemployed,0
8721,Looking for a Fun and Flexible Work at Home Job? https://t.co/o4kQHiBEXW #Moms #Jobs https://t.co/5hA2Z3Hexc,1
1109,Why am I searching for a job rn I dont understand why im doing this. I cant apply for financial aid if I get a job kms what is my life.,0
2583,Looking for a #(NEW #POSITION) Senior Tax Analyst #jobs http://t.co/1LcsImla3K http://t.co/pGYpwjvGNB,1
353,Im in search of people that want to work part-time. No sales. No start-up costs. I am offering a $25 sign on bonus and would like to get...,1
1597,looking for a new job does anyone know a place thats hiring???,0
8402,I was in a really good mood this morn after a tumultuously emotional week so of course this evening I got the news I am being laid off.,0
3926,#Albany #Jobs Gas station cashier needed for overnights. (clifton park): I am looking for a full time cashier ... http://t.co/SyXgIEpZKs,1
7966,If anyone is hiring.. I am unemployed,0
8596,#bipolar #unemployed no one wanting to #hire you except maybe fast food chains. Why did I get my #masters #degree again? #stigma #blogger,0
6609,I got fired and rehired all in the same day lol and hired at another place .. aint that some shit,0
6837,Google posted a job you might be interested in: Assist Program Manager Google for Work - San Francisco Bay Area US.,1
3991,MY JOB HIRED ME BACK!!! Im hype af!!!,0
5445,My work called two hours ago while I was sleeping this is why Im going to get fired not even after a week lol,0
9483,First time ever I am now unemployed...,0
1432,Unemployed Under-Employed Unhappily Employed? Find jobs &amp; career solutions on LinkedIn in JCD The Job Seeker &amp;... http://t.co/LyDXdplJs2,1
2244,Its been a really long week.  Took until today for me to really break down and sob.  I am unemployed and it sucks.,0
297,Got hired at my favorite Cannibus Club Dispensary they said I come in there so much to buy edibles and weed lol,0
5091,Im gone have 56 hours on my first check at my new job .,0
4724,Every time I get in an argument with someone they say you dont work I aint been unemployed a full two weeks yet lol,0
4450,Is anyones job hiring??,0
